guid,crc?,entry name,Japanese,English,French,Italian,German,Spanish,Russian,Polish,Dutch,Portuguese,PortugueseBr,Korean,TraditionalChinese,SimplifiedChinese,Finnish,Swedish,Danish,Norwegian,Czech,Hungarian,Slovak,Arabic,Turkish,Bulgarian,Greek,Romanian,Thai,Ukrainian,Vietnamese,Indonesian,Fiction,Hindi,LatinAmericanSpanish
b25065a0-4a63-4a79-be04-d3df3595a20f,4255814186,CharMakeMsg_Sy_032,サポートタイプを指定なしにします。,"Set your Buddy's support type to ""No Preference.""","""Pas de préférence"" pour la classe de votre Pilpoil.","Imposta il tipo di supporto su ""Qualsiasi"".","Lege ""keine Präferenz"" als Unterstützungstyp fest.","Cambia el tipo de apoyo del camarada a
""Sin preferencia"".","Поставить тип поддержки у спутника на
""Без предпочтений"".",Ustaw typ wsparcia kompana na „Brak preferencji”.,,,"Definir o tipo de suporte do seu Amigo
para ""Sem Preferência”.",서포트 타입을 지정 없음으로 변경합니다.,將支援類型設為不指定。,不指定支援类型。,,,,,,,,"تعيين نوع الدعم للرفيق إلى ""من دون تفضيل.""",,,,,,,,,,,
8b30da98-5fc7-456d-9b93-8b66c78cb51b,3825508511,CharMakeMsg_Sy_033,"回復ならお任せのサポートタイプです。
ヒーラーサポート行動が得意で、
ハンターの回復補助が可能です。","A support type that focuses on recovery moves.
Uses healing to keep hunters in tip-top fighting
shape.","Une classe spécialisée dans les soins.
Peut soigner les chasseurs pour
les garder en bonne santé.","Supporto incentrato sul recupero della vita.
Guarisce i cacciatori per tenerli in perfetta
forma per i combattimenti.","Ein auf Erholungsaktionen fokussierter Unter-
stützungstyp, der Heilung einsetzt, um Jäger im
Kampf in Topform zu halten.","Tipo de apoyo centrado en la curación, manteniendo
así a los cazadores en las mejores condiciones
posibles.","Помощник, специализирующийся на восстановлении.
Лечит охотников, чтобы поддерживать их в боевой
форме.","Typ wsparcia zorientowany na regenerację.
Wykorzystuje uzdrawianie, aby utrzymywać łowców
w doskonałej formie bojowej.",,,"Um tipo de suporte focado em movimentos de
recuperação. Usa a cura para manter os caçadores
aptos a lutar.","회복에 특화된 서포트 타입입니다.
힐러 서포트 행동이 특기로
헌터의 회복을 보조할 수 있습니다.","負責回復的支援類型。
擅長治療者支援行動，
可以輔助獵人進行回復。","包揽回复的支援类型。
擅长治疗型支援行动，
能协助猎人回复体力。",,,,,,,,"نوع الدعم الذي يركز على حركات التعافي.
يستخدم التعافي ليحافظ
على أعلى درجات القتال للصيادين.",,,,,,,,,,,
51d54b24-3454-4054-be09-5d6e10c4c958,3066037337,CharMakeMsg_Sy_034,"アシスト大好きなサポートタイプです。
アシストサポート行動が得意で、
罠を仕掛けたりすることが可能です。","A support type that's ready to assist. Places
traps to weaken monsters and set up advantageous
situations.","Classe faite pour vous assister. Peut
placer des pièges pour affaiblir les
monstres et vous avantager.","Supporto incentrato sul fornire assistenza.
Posiziona trappole per indebolire i mostri
e creare situazioni vantaggiose.","Ein listiger Unterstützungstyp, der
Fallen legt, um Monster zu schwächen und
vorteilhafte Situationen herbeizuführen.","Tipo de apoyo que proporciona ayuda.
Coloca trampas para debilitar a los
monstruos y te da ventaja en el terreno.","Помощник, чья роль — ассистировать вам в бою.
Ставит ловушки, чтобы ослаблять монстров
и создавать выгодные для вас ситуации.","Typ wsparcia zapewniający pomoc.
Umieszcza pułapki, które osłabiają
potwory i dają przewagę sytuacyjną.",,,"Um tipo de suporte pronto para ajudar.
Coloca armadilhas para enfraquecer
monstros e cria situações vantajosas.","어시스트를 좋아하는 서포트 타입입니다.
어시스트 서포트 행동이 특기로
함정을 설치할 수 있습니다.","最喜歡協助的支援類型。
擅長協助支援行動，
並且還能設置陷阱。","最喜欢协助的支援类型。
擅长协助型支援行动，
能够设置陷阱等。",,,,,,,,"نوع الدعم الجاهز للمساعدة. وضع
الفخاخ لإضعاف الوحوش وإعداد مواقف
مميزة.",,,,,,,,,,,
ae6c8561-86b9-4cb5-b415-4f2e56921a6b,3082640770,CharMakeMsg_Sy_035,"各種戦闘に優れたサポートタイプです。
サポート行動による自己強化が可能で、
攻撃面での補助が得意です。","A support type that focuses on combat. Can become
fur-ious, boosting its own attack and making it a
fantastic fighting furball.","Une classe spécialisée dans le combat. Peut sortir
les griffes et augmenter son attaque, ce qui en
fait la parfaite boule de poils pour se battre.","Supporto incentrato sul combattimento.
Diventa furrrioso, potenziando il proprio attacco
e trasformandosi in un'aggressiva palla di pelo.","Dieser Unterstützungstyp ist ein Kampfspezialist,
der entkätzlich wild werden und seinen Angriff
stärken kann – ein Fellknäul mit mächtig Dampf!","Tipo de apoyo centrado en el combate. Se pondrá
como una fiera y eso hará que su ataque mejore,
convirtiéndose en una bola de pelos con mala idea.","Помощник, специализирующийся на битве. Может
впадать в мярость, усиливая свои атаки, из-за
чего становится пушистым боевым шаром.","Typ wsparcia zorientowany na walkę. Może wpadać
w stan furr-ii, wzmacniając własny atak
i czyniąc z siebie nieustraszoną kulkę futra.",,,"Tipo de suporte que se concentra em combate. Pode
ficar furioso, aumentando o próprio ataque e
virando uma fantástica bola de pelos de combate.","각종 전투가 능숙한 서포트 타입입니다.
서포트 행동으로 자신을 강화할 수 있으며
공격 면에서 보조하는 것이 특기입니다.","戰鬥能力優秀的支援類型。
能透過支援行動自我強化，
也擅長攻擊方面的輔助。","擅长各种战斗的支援类型。
可使用支援行动强化自己，
擅长攻击方面的辅助。",,,,,,,,"نوع الدعم الذي يركز على القتال. يمكن أن يصبح
شرسًا ويعزز هجومه ويجعله
مقاتلًا رائعًا.",,,,,,,,,,,
e43b8efe-fb3f-400a-8917-5404ee599214,378173682,CharMakeMsg_Sy_036,"爆弾の扱いに長けたサポートタイプです。
爆弾全般の攻撃力が高く、
大型の爆弾を使用することも可能です。","A support type with a penchant for blowing things
up. Has high explosive power and can handle large
bombs.","Une classe qui aime tout faire exploser. A une
puissance explosive détonante et peut manier
de grosses bombes.","Supporto incentrato sulla detonazione di oggetti.
Ha un alto potere esplosivo e può maneggiare
grosse bombe.","Ein Unterstützungstyp, der gerne Dinge in die
Luft jagt. Hat hohe Sprengkraft und kann mit
großen Bomben umgehen.","Tipo de apoyo con tendencia a volar cosas.
Tiene un gran poder explosivo y puede usar bombas
grandes.","Помощник, чья задача — взрывать все и вся.
Обладает большой взрывной мощью, может
управляться с большими бомбами.","Typ wsparcia z upodobaniami pirotechnicznymi.
Posiada wybuchowe moce i potrafi się obchodzić
z dużymi bombami.",,,"Um tipo de suporte com uma propensão para explodir
coisas. Possui alto poder explosivo e pode lidar
com bombas grandes.","폭탄을 잘 다루는 서포트 타입입니다.
폭탄류 전반의 공격력이 높으며
대형 폭탄을 사용할 수 있습니다.","擅長使用爆彈的支援類型。
所有爆彈的攻擊力都很高，
且能夠使用大型爆彈。","擅长使用爆弹的支援类型。
所有爆弹的攻击力都更高，
还可以使用大型爆弹。",,,,,,,,"نوع الدعم المائل إلى نسف
الأشياء. يمتلك قوة انفجار هائلة ويمكنه
التعامل مع قنابل كبيرة.",,,,,,,,,,,
a2845d98-c19d-4e36-a19f-2c732b282aa9,2816919176,CharMakeMsg_Sy_037,"お宝が大好きなサポートタイプです。
そのため、ぶんどりや採取が、
他のサポートタイプに比べ得意です。","A support type that can sniff out valuables.
Highly suited to pilfering items and collecting
quality materials.","Une classe capable de repérer les objets de
valeur. Est capable de chaparder des objets et de
trouver des matériaux de grande valeur.","Supporto che ha fiuto per gli oggetti di valore.
È in grado di sgraffignare oggetti e raccogliere
materiali di qualità.","Ein Unterstützungstyp, der Wertsachen erschnüffeln
kann. Bestens geeignet, um Objekte zu stibitzen
und hochwertige Materialien zu sammeln.","Tipo de apoyo que puede rastrear objetos de valor.
Estupendo para hacerse con objetos y materiales
de calidad.","Помощник, способный находить ценные вещи. Отлично
умеет воровать предметы и собирать качественное
сырье.","Typ wsparcia, który potrafi wywęszyć cenne
przedmioty i jakościowe materiały. Doskonale
nadaje się do ich podkradania i zbierania.",,,"Tipo de suporte que pode farejar objetos de valor.
Altamente adequado para furtar itens e coletar
materiais de qualidade.","보물을 좋아하는 서포트 타입입니다.
그런 만큼 약탈과 채집 능력은
다른 서포트 타입보다 뛰어납니다.","最喜歡寶藏的支援類型。
因此與其他支援類型相比
更擅長掠奪和採集。","一心扑在宝藏上的支援类型。
因此在抢夺和采集方面
比其他支援类型更加得心应手。",,,,,,,,"نوع الدعم الذي يمكنه تتبع الأشياء الثمينة.
يصلح بشكل كبير لسرقة العناصر وجمع
مواد بجودة عالية.",,,,,,,,,,,
