guid,crc?,entry name,Japanese,English,French,Italian,German,Spanish,Russian,Polish,Dutch,Portuguese,PortugueseBr,Korean,TraditionalChinese,SimplifiedChinese,Finnish,Swedish,Danish,Norwegian,Czech,Hungarian,Slovak,Arabic,Turkish,Bulgarian,Greek,Romanian,Thai,Ukrainian,Vietnamese,Indonesian,Fiction,Hindi,LatinAmericanSpanish
429741af-ec03-47c3-85e4-1d51a135aa82,3529888544,W_DualBlades_073_Explain,"勇壮なるアオアシラ素材を用い
青熊双鉞を強化。二双の刃が
もたらす連係の妙が冴える。","The Cerulean Axes's upgraded
form perfects the harmony
between the two axes.","Les deux armes sont
en harmonie parfaite.
Base : Haches céruléennes","Forma potenziata delle asce
cerulee. Sublimano l'armonia
tra le due asce.","Verbesserte Himmelblaue
Äxte. Ein Axtpaar, vereint
in perfekter Harmonie.","Hachas cerúleas mejoradas.
Lleva al límite la armonía
entre ambas hachas.","Улучшение Лазурных топоров.
Гармония между ними
максимальна.","Ulepszone błękitne topory.
Udoskonalona harmonia
pomiędzy dwoma ostrzami.",,,"O Machado Cerúleo melhorado
aperfeiçoa a harmonia
entre as duas lâminas.","웅장한 아오아시라 소재로
청웅쌍월을 강화. 두 쌍의
도끼날 간의 연계가 날카롭다.","利用雄壯的青熊獸素材強化
後的青熊雙鉞。成雙的刀刃
展現出天衣無縫的配合。","利用雄壮的青熊兽素材，
进行青熊双钺的强化。
成双的刀刃表现出连携的奥妙。",,,,,,,,"يُحسّن الشكل الذي تمت
ترقية الفأس الزرقاء عليه
التناغم الموجود بين الفأسين.",,,,,,,,,,,
8957d5e0-feba-415d-9a6b-a94874e23ae0,2059224466,W_DualBlades_074_Explain,"白雪と雫。凍土で命を落とした
双子の姉妹の名を持つ双剣。
美しくも哀しき悲劇の剣。","Swords named after Snow and
Dew, sisters who perished in
the tundra. Heartbreaking.","Épées honorant Neige et
Rosée, mortes dans la
toundra. Brisent les cœurs.","Spade che portano il nome di
due sorelle morte nella
tundra. Una storia dolorosa.","Schwerter namens ""Schnee""
und ""Tau"", nach Schwestern,
die in der Tundra starben.","""Nieve"" y ""Rocío"", llamadas
así por dos hermanas caídas
en la tundra. Desgarrador.","Мечи по имени Снег и Роса.
Названы в честь сестер,
погибших в тундре.","Miecze nazwane na cześć
Śniegu i Rosy, sióstr, które
zginęły w tundrze. Smutne.",,,"Espadas batizadas em ode a
Neve e Orvalho, irmãs que
morreram na Tundra. Triste.","시라유키와 시즈쿠. 죽은
쌍둥이의 이름을 딴 쌍검.
아름답고도 슬픈 비극의 검.","以在凍原喪命的雙子姊妹──
白雪與露滴為名之雙劍。
優美且哀傷的悲劇之劍。","白雪与露滴。
以命丧冻土的双子姊妹命名。
美丽而哀伤的悲剧双剑。",,,,,,,,"سيوف سُميت تيمنًا بسنو وديو،
الأختان اللتان لقيتا حتفهما
في البيئات المتجمدة. مؤسف.",,,,,,,,,,,
e6430328-245a-4740-8fc5-5e509adef164,4142609502,W_DualBlades_075_Explain,"白雪と雫。凍土で命を落とした
双子の姉妹の名を持つ双剣。
美しくも哀しき悲劇の剣。","Swords named after Snow and
Dew, sisters who perished in
the tundra. Heartbreaking.","Épées honorant Neige et
Rosée, mortes dans la
toundra. Brisent les cœurs.","Spade che portano il nome di
due sorelle morte nella
tundra. Una storia dolorosa.","Schwerter namens ""Schnee""
und ""Tau"", nach Schwestern,
die in der Tundra starben.","""Nieve"" y ""Rocío"", llamadas
así por dos hermanas caídas
en la tundra. Desgarrador.","Мечи по имени Снег и Роса.
Названы в честь сестер,
погибших в тундре.","Miecze nazwane na cześć
Śniegu i Rosy, sióstr, które
zginęły w tundrze. Smutne.",,,"Espadas batizadas em ode a
Neve e Orvalho, irmãs que
morreram na Tundra. Triste.","시라유키와 시즈쿠. 죽은
쌍둥이의 이름을 딴 쌍검.
아름답고도 슬픈 비극의 검.","以在凍原喪命的雙子姊妹──
白雪與露滴為名之雙劍。
優美且哀傷的悲劇之劍。","白雪与露滴。
以命丧冻土的双子姊妹命名。
美丽而哀伤的悲剧双剑。",,,,,,,,"سيوف سُميت تيمنًا بسنو وديو،
الأختان اللتان لقيتا حتفهما
في البيئات المتجمدة. مؤسف.",,,,,,,,,,,
9811e1d8-d997-49dc-a47c-88a2da6243ee,4217805020,W_DualBlades_076_Explain,"白雪と雫。悲しき双子の遺志を
冷たき双刃に込めた悲劇の剣。
スノウツインズ強化版。","The upgrade of the Snow
Slicers. Contain the prayers
of those who mourn.","Investies des prières de
ceux ayant vécu le deuil.
Base : Neiges jumelles","Forma potenziata delle lame
della neve. Custodiscono le
preghiere di chi è in lutto.","Verbesserte Schneeschlitzer.
Erfüllt von den Gebeten der
Trauernden.","Mejora de las Cortadoras de
nieve, con las oraciones de
quienes lloran a alguien.","Улучшение Снежных лезвий.
В них — молитвы
скорбящих.","Ulepszone śnieżne majchry.
Przepełnione modlitwami
rozpaczających żałobników.",,,"Melhoria das Fatiadoras
de Neve. Carrega as orações
daqueles envoltos em luto.","시라유키와 시즈쿠. 슬픈
쌍둥이의 유지를 담은 비극의
검. 스노트윈스의 강화판.","白雪與露滴。將可憐的雙子遺志
封入冰冷雙刃中的悲劇之劍。
冰雪雙劍的強化版本。","白雪与露滴。将可怜双子遗志
封入冰冷双刃中的悲剧之剑。
冰雪双刃的强化版。",,,,,,,,"ترقية شاطرات
الجليد. تحتوي على صلوات
أولئك المنتحبين.",,,,,,,,,,,
098554fd-8934-4ed9-a8b9-d6d45d9fbe11,578797502,W_DualBlades_077_Explain,"銃身に毒液が仕込まれた双剣。
たとえ卑劣と言われても、
貪欲に勝利を目指す者の武器。","Dual blades laced with
poison. It may be dirty,
but if you want to win...","Lames doubles imprégnées de
poison. Tous les coups sont
permis quand on veut gagner.","Doppie lame ricoperte di
veleno. Si gioca sporco,
ma pur di vincere...","Giftbenetzte Doppelklingen.
Nicht fair, aber was tut man
nicht alles für den Sieg...","Espadas dobles emponzoñadas.
Puede ser juego sucio, pero
si quieres ganar...","Два клинка, пропитанные
ядом. Для победы все
средства хороши...","Zatrute bliźniacze ostrza.
Podłe rozwiązanie, ale czego
się nie robi dla zwycięstwa.",,,"Duplas-Lâminas embebidas
em veneno. É golpe sujo,
mas se você quiser vencer...","총신에 독을 바른 쌍검.
비겁하다는 말을 들어도
탐욕스레 승리를 노리는 무기.","槍身裝入毒液的雙劍。
即使被認為卑鄙也在所不惜，
是把屬於渴望勝利者的武器。","枪身填入了毒液的双剑。
即便被人斥责卑劣也不为所动，
贪婪地追求胜利之人的武器。",,,,,,,,"أنصال ثنائية ممزوجة
بالسُم. قد تكون قذرة،
لكن إذا رغبت في الفوز...",,,,,,,,,,,
8e0da8b6-afee-42fc-8eaa-21299f090e86,864525975,W_DualBlades_078_Explain,"銃身に毒液が仕込まれた双剣。
たとえ卑劣と言われても、
貪欲に勝利を目指す者の武器。","Dual blades laced with
poison. It may be dirty,
but if you want to win...","Lames doubles imprégnées de
poison. Tous les coups sont
permis quand on veut gagner.","Doppie lame ricoperte di
veleno. Si gioca sporco,
ma pur di vincere...","Giftbenetzte Doppelklingen.
Nicht fair, aber was tut man
nicht alles für den Sieg...","Espadas dobles emponzoñadas.
Puede ser juego sucio, pero
si quieres ganar...","Два клинка, пропитанные
ядом. Для победы все
средства хороши...","Zatrute bliźniacze ostrza.
Podłe rozwiązanie, ale czego
się nie robi dla zwycięstwa.",,,"Duplas-Lâminas embebidas
em veneno. É golpe sujo,
mas se você quiser vencer...","총신에 독을 바른 쌍검.
비겁하다는 말을 들어도
탐욕스레 승리를 노리는 무기.","槍身裝入毒液的雙劍。
即使被認為卑鄙也在所不惜，
是把屬於渴望勝利者的武器。","枪身填入了毒液的双剑。
即便被人斥责卑劣也不为所动，
贪婪地追求胜利之人的武器。",,,,,,,,"أنصال ثنائية ممزوجة
بالسُم. قد تكون قذرة،
لكن إذا رغبت في الفوز...",,,,,,,,,,,
2cf1ec40-5ae5-4fbb-b9ca-8387b37d4f82,3629808259,W_DualBlades_079_Explain,"改良により左右に二種類の毒を
仕込んだフロギィの双剣。より
効率的な毒液の放出が可能に。","New and improved with two
types of poison! No trick is
beneath you now.","Deux types de poison rendent
ces lames plus sournoises.
Base : Desperado","Potenziate con due tipi di
veleno! Ora nessuno
potrà batterti.","Neu und verbessert, mit zwei
Arten von Gift! Dir ist nun
jedes Mittel recht.","¡Nuevas y mejoradas con dos
tipos de veneno! Ya no
puedes caer más bajo.","Новые и улучшенные, с двумя
типами яда! Вы уже
готовы на все.","Ulepszone o dwa rodzaje
trucizn! Teraz wszystkie
chwyty dozwolone.",,,"Novas e melhoradas com dois
tipos de veneno! Não há mais
limites para sua maldade.","좌우에 두 종류의 독을
바른 프로기의 쌍검. 보다
효율적으로 독을 방출한다.","改良後可在左右兩側裝入兩種
毒液的毒狗龍雙劍。能夠更有
效率地將毒液釋放出來。","通过改良，左右各填装了
不同毒液的毒狗龙双剑。
能够用更高的效率释放毒液。",,,,,,,,"جديدة ومُحسنة بنوعين
من السُم! لن تنطلي عليك
أي حيلة الآن.",,,,,,,,,,,
e0bc5658-426e-4b39-bcf5-1496147f1e1c,2335762852,W_DualBlades_080_Explain,"掻鳥のクチバシから作られた
一対の双剣。粗削りだが丈夫で
取り扱いも易しい人気の武器。","Dual blades made out of a
Kulu-Ya-Ku beak. Rough, but
sturdy—a big hit.","Lames doubles faites avec le
bec d'un Kulu-Ya-Ku.
Robustes avant tout !","Doppie lame con becco di
Kulu-Ya-Ku: rozze, ma
resistenti. Vanno a ruba.","Doppelklingen aus einem
Kulu-Ya-Ku-Schnabel. Grob,
aber robust. Ein echter Hit.","Espadas dobles de pico de
Kulu-Ya-Ku. Burdas, pero
recias: un golpe de gracia.","Два клинка из клюва Кулу-
Йа-Ку. Грубые, но прочные.","Bliźniacze ostrza z dzioba
Kulu-Ya-Ku. Surowe,
ale solidne – ostry cios.",,,"Duplas-Lâminas feitas de
bico de Kulu-Ya-Ku.
Rudimentar, mas resistente.","소조의 부리로 만든 한쌍의
쌍검. 조잡하지만 튼튼하고
다루기 쉬운 인기 무기.","由搔鳥鳥喙製成的成對雙劍，
做工雖然粗糙，但十分堅固且
容易使用，是很受歡迎的武器。","使用搔鸟的喙制作的双剑。
虽然切削较粗放，但使用方便，
也非常结实，广受欢迎。",,,,,,,,"أنصال ثنائية مصنوعة من
منقار كولو-يا-كو. خشنة
ولكنها قوية ورائجة جدًا.",,,,,,,,,,,
edcb308c-5b38-4040-90f9-2419cdf28059,3606139528,W_DualBlades_081_Explain,"掻鳥のクチバシから作られた
一対の双剣。粗削りだが丈夫で
取り扱いも易しい人気の武器。","Dual blades made out of a
Kulu-Ya-Ku beak. Rough, but
sturdy—a big hit.","Lames doubles faites avec le
bec d'un Kulu-Ya-Ku.
Robustes avant tout !","Doppie lame con becco di
Kulu-Ya-Ku: rozze, ma
resistenti. Vanno a ruba.","Doppelklingen aus einem
Kulu-Ya-Ku-Schnabel. Grob,
aber robust. Ein echter Hit.","Espadas dobles de pico de
Kulu-Ya-Ku. Burdas, pero
recias: un golpe de gracia.","Два клинка из клюва Кулу-
Йа-Ку. Грубые, но прочные.","Bliźniacze ostrza z dzioba
Kulu-Ya-Ku. Surowe,
ale solidne – ostry cios.",,,"Duplas-Lâminas feitas de
bico de Kulu-Ya-Ku.
Rudimentar, mas resistente.","소조의 부리로 만든 한쌍의
쌍검. 조잡하지만 튼튼하고
다루기 쉬운 인기 무기.","由搔鳥鳥喙製成的成對雙劍，
做工雖然粗糙，但十分堅固且
容易使用，是很受歡迎的武器。","使用搔鸟的喙制作的双剑。
虽然切削较粗放，但使用方便，
也非常结实，广受欢迎。",,,,,,,,"أنصال ثنائية مصنوعة من
منقار كولو-يا-كو. خشنة
ولكنها قوية ورائجة جدًا.",,,,,,,,,,,
331bb08a-1bc1-41c0-a423-bf3ae7bd83fb,2820842140,W_DualBlades_082_Explain,"上位素材を加えた掻鳥の双剣。
軽さを求めた結果、堅さも手に
入った、まさに一石二鳥の品。","Dual blades that take out
two Kulus with one stone,
being both light and strong.","D'une pierre deux Kulu !
Base : Piques Kulu","Doppie lame, forti ma
leggere, che prendono due
Kulu con una fava.","Doppelklingen, die mit ihrem
Mix aus leichtem Gewicht und
Stärke den Kulu abschießen.","Espadas dobles ligeras y
fuertes. Matas dos Kulus de
un tiro.","Два клинка, что убьют разом
двух Кулу. Оба легкие
и прочные.","Bliźniacze ostrza, które
powalą dwa Kulu za jednym
zamachem. Lekkie i silne.",,,"Duplas-Lâminas que derrubam
dois Kulus com um só golpe;
leves, porém fortes.","상위 소재를 더한 소조의
쌍검. 가벼움을 추구하며
강도도 얻은 일석이조의 무기.","加入了進階素材的搔鳥雙劍。
獲得輕巧性的同時也變得更為
堅固，可謂是一石二鳥的武器。","添加了上位素材的搔鸟双剑。
追求轻便却也获得了坚固质地，
正可谓是一箭双雕。",,,,,,,,"أنصال ثنائية تقضي على وحشي
كولو في آن واحد،
إذ تجمع بين الخِفة والقوة.",,,,,,,,,,,
ef244bd8-e247-44d3-af3d-75196a7ea4fb,3609463478,W_DualBlades_083_Explain,"溢れ出る水流が美しき弧を空に
描き出す水獣の双剣。返り血は
瞬く間に洗い流される。","Swords made from a Royal
Ludroth. They spray water
to help wash away the blood.","Épées en Ludroth royal.
Lancent des jets d'eau qui
lavent le sang.","Spade fatte di Ludroth
reale. L'acqua che sprizzano
lava via il sangue.","Schwerter aus einem Königs-
Ludroth. Die Wasserfontänen
waschen Blutspuren weg.","Espadas de Ludroth Real.
Lanzan chorros de agua para
ayudar a limpiar la sangre.","Мечи из королевского
Лудрота. Брызгают водой,
помогают смыть кровь.","Miecze z Ludrotha
Królewskiego. Rozpylają
wodę, by łatwiej zmyć krew.",,,"Espadas feitas de Ludroth
Real. Borrifam água para
ajudar a lavar o sangue.","흐르는 물줄기가 하늘에 호를
그리는 수괴수의 쌍검. 칼날의
피도 순식간에 씻어낸다.","滿溢出的水流在空中劃出美麗
弧度的水獸之雙劍。回濺的鮮
血會在瞬間就被沖洗掉。","满溢出的水流，在空中划出
美丽弧度的水兽之双剑。
回溅的鲜血瞬间就被洗净。",,,,,,,,"سيوف مصنوعة من لودورث
الملكيّ. ترشّ الماء
لتساعد في إزالة الدماء.",,,,,,,,,,,
3a7ed61f-e08e-4478-9645-bf183ce60234,194961429,W_DualBlades_084_Explain,"溢れ出る水流が美しき弧を空に
描き出す水獣の双剣。返り血は
瞬く間に洗い流される。","Swords made from a Royal
Ludroth. They spray water
to help wash away the blood.","Épées en Ludroth royal.
Lancent des jets d'eau qui
lavent le sang.","Spade fatte di Ludroth
reale. L'acqua che sprizzano
lava via il sangue.","Schwerter aus einem Königs-
Ludroth. Die Wasserfontänen
waschen Blutspuren weg.","Espadas de Ludroth Real.
Lanzan chorros de agua para
ayudar a limpiar la sangre.","Мечи из королевского
Лудрота. Брызгают водой,
помогают смыть кровь.","Miecze z Ludrotha
Królewskiego. Rozpylają
wodę, by łatwiej zmyć krew.",,,"Espadas feitas de Ludroth
Real. Borrifam água para
ajudar a lavar o sangue.","흐르는 물줄기가 하늘에 호를
그리는 수괴수의 쌍검. 칼날의
피도 순식간에 씻어낸다.","滿溢出的水流在空中劃出美麗
弧度的水獸之雙劍。回濺的鮮
血會在瞬間就被沖洗掉。","满溢出的水流，在空中划出
美丽弧度的水兽之双剑。
回溅的鲜血瞬间就被洗净。",,,,,,,,"سيوف مصنوعة من لودورث
الملكيّ. ترشّ الماء
لتساعد في إزالة الدماء.",,,,,,,,,,,
dedf0785-0df3-445d-b337-00697136c442,731061031,W_DualBlades_085_Explain,"圧倒的な水流噴出力を得た、
ルドロスツインズ強化型。その
水量は原野に河を生み出す程。","The Ludroth Pair's upgraded
form. It holds enough water
to forge mighty rivers.","Renferme assez d'eau pour
créer de puissants fleuves.
Base : Paire Ludroth","Coppia Ludroth potenziata.
L'acqua che contiene può
formare interi fiumi.","Verbessertes Ludroth-Paar.
Enthält genug Wasser, um
mächtige Flüsse zu schaffen.","Pareja de Ludroth mejoradas.
Tienen agua suficiente para
crear ríos temibles.","Улучшенная форма Дуэта
Лудрота. В них столько воды,
что хватит на реку.","Ulepszona Para Ludrotha.
Zawiera tyle wody, że może
wykuwać porywiste rzeki.",,,"Par de Ludroth melhorado.
Armazena água suficiente
para forjar grandes lagos.","루드로스트윈스의 강화형.
그 압도적인 물줄기는
초원에 강을 만들어낼 정도.","得到了壓倒性的水流噴力，
水獸雙劍的強化型態。噴出
的水量多到能在原野匯流成河。","得到了压倒性的水流喷射力，
水兽双剑的强化型。
喷出的水量多到能在原野成河。",,,,,,,,"شكل ثنائي للودورث الذي
تمت ترقيته. يحمل ما يكفي
من الماء لتشكيل أنهار ضخمة.",,,,,,,,,,,
a17b71a0-8be0-4d80-8b2b-69f57ef035b9,1000358849,W_DualBlades_086_Explain,"殺傷力を追究したフルフルの
双剣。刃から放たれる雷光が、
獲物の魂を震え上がらせる。","Daggers made with real
bloodlust. The lightning
they emanate terrifies prey.","Dagues animées de haine et
de violence. Leurs éclairs
terrifient leurs proies.","Pugnale dalla insaziabile
sete di sangue. I lampi che
emana atterriscono la preda.","Ein Dolch aus echter Blut-
rünstigkeit. Seine Blitze
versetzen Beute in Furcht.","Dagas hechas con sed de
sangre real. El rayo que
emiten aterra a sus presas.","Кинжалы, наделенные жаждой
крови. Их сияние приводит
жертву в ужас.","Sztylety ukute z żądzy krwi.
Emanują błyskawicami,
które przerażają ofiary.",,,"Adagas feitas com verdadeira
sede de sangue. Emitem
relâmpagos aterrorizantes.","살상력을 추구한 푸루푸루의
쌍검. 검에서 나오는 번개가
사냥감의 영혼도 떨게 한다.","追求殺傷力的奇怪龍之雙劍。
從刀刃放出的雷光
能讓獵物的靈魂顫抖。","追求杀伤力的奇怪龙之双剑。
从刀刃放出的雷光，
可使猎物的灵魂战栗。",,,,,,,,"خناجر مصنوعة بشغف حقيقي
لإراقة الدماء. يُرعب البرق
الذي ينبعث منه الفريسة.",,,,,,,,,,,
ebf16d23-3c73-4860-b50b-f531643047bc,246372767,W_DualBlades_087_Explain,"殺傷力を追究したフルフルの
双剣。刃から放たれる雷光が、
獲物の魂を震え上がらせる。","Daggers made with real
bloodlust. The lightning
they emanate terrifies prey.","Dagues animées de haine et
de violence. Leurs éclairs
terrifient leurs proies.","Pugnale dalla insaziabile
sete di sangue. I lampi che
emana atterriscono la preda.","Ein Dolch aus echter Blut-
rünstigkeit. Seine Blitze
versetzen Beute in Furcht.","Dagas hechas con sed de
sangre real. El rayo que
emiten aterra a sus presas.","Кинжалы, наделенные жаждой
крови. Их сияние приводит
жертву в ужас.","Sztylety ukute z żądzy krwi.
Emanują błyskawicami,
które przerażają ofiary.",,,"Adagas feitas com verdadeira
sede de sangue. Emitem
relâmpagos aterrorizantes.","살상력을 추구한 푸루푸루의
쌍검. 검에서 나오는 번개가
사냥감의 영혼도 떨게 한다.","追求殺傷力的奇怪龍之雙劍。
從刀刃放出的雷光
能讓獵物的靈魂顫抖。","追求杀伤力的奇怪龙之双剑。
从刀刃放出的雷光，
可使猎物的灵魂战栗。",,,,,,,,"خناجر مصنوعة بشغف حقيقي
لإراقة الدماء. يُرعب البرق
الذي ينبعث منه الفريسة.",,,,,,,,,,,
5f8844db-9466-42fa-9962-faa3e259be65,172167822,W_DualBlades_088_Explain,"フルージェントダガー強化型。
癒えぬ傷口から流れる鮮血に
磨かれ、刃は更に輝きを増す。","The Khezu Daggers's upgraded
form. The more blood they
spill, the shinier they get.","Plus elle fait couler de
sang, plus elle brille.
Base : Dagues Khezu","Forma potenziata del pugnale
Khezu. Con il sangue versato
risplende ancora di più.","Verbesserte Khezu-Dolche.
Je mehr Blut vergossen wird,
desto heller das Strahlen.","Dagas Khezu mejoradas.
Cuanta más sangre derraman,
más brillantes se vuelven.","Улучшенная форма Кинжалов
Кезу. Чем больше они прольют
крови, тем ярче блеск.","Ulepszone sztylety z Khezu.
Im więcej krwi rozlewają,
tym jaśniej błyszczą.",,,"Adagas Khezu melhoradas.
Quanto mais sangue derramam,
mais brilhantes elas ficam.","푸루젠트대거의 강화형.
상처의 피로 연마되어
칼날은 더욱 빛을 발한다.","奇怪龍短劍的強化型態。用無法
癒合的傷口中流出的鮮血加以
研磨，使刀刃的光輝更加閃耀。","奇怪龙短剑的强化型。
以不愈伤口之血打磨，
刀刃的光辉变得更加闪耀。",,,,,,,,"شكل خناجر خيزو التي تمت
ترقيتها. يزداد لمعانها كلما
امتصت كمية كبيرة من الدماء.",,,,,,,,,,,
1926c243-b685-4cf5-b95b-235ea7bf1ab8,749578179,W_DualBlades_089_Explain,"泥魚竜の素材を二組、きっちり
組み上げ双剣に仕立てたもの。
粗削りだが、光るものがある。","Dual blades made of
Jyuratodus bits. Rough,
but they've got an edge.","Lames doubles en Jyuratodus.
Rudimentaires, mais
diablement efficaces !","Doppie lame con parti di
Jyuratodus. Rozze, ma dal
taglio efficace.","Aus Jyuratodus-Teilen
gefertigte Doppelklingen.
Grob, aber sie haben Biss.","Espadas dobles de restos de
Jyuratodus. Burdas pero
afiladas.","Два клинка из частей
Юратода. Не лишены
остроты.","Bliźniacze ostrza wykonane
z fragmentów Jyuratodusa.
Surowe, ale dają przewagę.",,,"Duplas-Lâminas feitas de
partes de Jyuratodus.
Rudimentar, mas eficaz.","이어룡의 소재 둘을 제대로
엮어 쌍검을 만들었다.
조잡하지만 빛나는 것이 있다.","將兩組泥魚龍素材組合起來
所製成的雙劍。雖然很粗糙，
但性能卻很出眾。","使用两组泥鱼龙的素材
仔细组合制造出的双剑。
虽然略显粗糙，但自有其价值。",,,,,,,,"أنصال ثنائية مصنوعة من فتات
جيوراتودوس. خشنة،
ولكنها مميزة.",,,,,,,,,,,
9e9624b1-2b46-475c-b15a-a48f553a0e2a,2342509583,W_DualBlades_090_Explain,"泥魚竜の素材を二組、きっちり
組み上げ双剣に仕立てたもの。
粗削りだが、光るものがある。","Dual blades made of
Jyuratodus bits. Rough,
but they've got an edge.","Lames doubles en Jyuratodus.
Rudimentaires, mais
diablement efficaces !","Doppie lame con parti di
Jyuratodus. Rozze, ma dal
taglio efficace.","Aus Jyuratodus-Teilen
gefertigte Doppelklingen.
Grob, aber sie haben Biss.","Espadas dobles de restos de
Jyuratodus. Burdas pero
afiladas.","Два клинка из частей
Юратода. Не лишены
остроты.","Bliźniacze ostrza wykonane
z fragmentów Jyuratodusa.
Surowe, ale dają przewagę.",,,"Duplas-Lâminas feitas de
partes de Jyuratodus.
Rudimentar, mas eficaz.","이어룡의 소재 둘을 제대로
엮어 쌍검을 만들었다.
조잡하지만 빛나는 것이 있다.","將兩組泥魚龍素材組合起來
所製成的雙劍。雖然很粗糙，
但性能卻很出眾。","使用两组泥鱼龙的素材
仔细组合制造出的双剑。
虽然略显粗糙，但自有其价值。",,,,,,,,"أنصال ثنائية مصنوعة من فتات
جيوراتودوس. خشنة،
ولكنها مميزة.",,,,,,,,,,,
7fece0be-fa0e-403a-888d-9baf3287ea28,3080981344,W_DualBlades_091_Explain,"より上質な泥魚竜素材を加えた
武器。一対の剣から放たれる
怒涛の攻撃は、荒波の如し。","Attacks from these blades
come crashing down with the
force of a cresting wave.","Ces lames ont la force
écrasante d'une vague !
Base : Duo Jyura","Queste lame attaccano il
nemico travolgendolo come
un'onda minacciosa.","Hiebe dieser Klingen stürzen
mit der Gewalt brechender
Wellenkämme hernieder.","Los ataques con estas hojas
destrozan todo a su paso
como una gigantesca ola.","Эти клинки обрушиваются
на врагов с мощью
крупной волны.","Atakujące ostrza spadają
na ofiarę z siłą
rozbijającej się fali.",,,"O ataque destas lâminas
tem a força comparável
à de uma tsunami.","품질 좋은 이어룡 소재를 더한
무기. 쌍검이 펼치는 노도의
공격은 거친 파도와도 같다.","加入了更優質的泥魚龍素材
製成的武器。此對雙劍所發出的
怒濤攻擊，宛如驚濤駭浪一般。","添加更高级泥鱼龙素材的武器。
以这对双剑释放的怒涛连击，
仿佛滔天的巨浪。",,,,,,,,"تحطم الهجمات التي تشنها
هذه الأنصال
كالموجة العاتية.",,,,,,,,,,,
