guid,crc?,entry name,Japanese,English,French,Italian,German,Spanish,Russian,Polish,Dutch,Portuguese,PortugueseBr,Korean,TraditionalChinese,SimplifiedChinese,Finnish,Swedish,Danish,Norwegian,Czech,Hungarian,Slovak,Arabic,Turkish,Bulgarian,Greek,Romanian,Thai,Ukrainian,Vietnamese,Indonesian,Fiction,Hindi,LatinAmericanSpanish
a807c823-8690-45fc-9ec1-f62de26a4371,2383497818,W_DualBlades_092_Explain,"氷牙竜の息吹を感じる、爪牙の
双剣。凍てつく刃は触れるだけ
で心の臓まで凍りつかせる。","Dual blades made from claws,
tusks, and Barioth breath.
Freeze anything they touch.","Lames doubles en griffes,
défenses et souffle de
Barioth. Gèlent tout.","Doppie lame con artigli,
zanne e soffio di Barioth
che congelano ogni cosa.","Doppelklauen, eisig scharf
wie der Barioth-Atem. Eine
Berührung gefriert das Herz.","Espadas dobles hechas con
garras, colmillos y aliento
de Barioth. Congeladoras.","Два клинка из когтей,
клыков и дыхания Бариота.
Замораживают все подряд.","Ostrza z pazurów, kłów
i oddechu Bariotha. Wszystko
zamarznie na kamień.",,,"Duplas-Lâminas feitas de
garras, presas e bafo de
Barioth. Congelantes.","빙아룡의 숨결이 느껴지는
쌍검. 차디찬 칼날은 닿기만
해도 마음까지 얼어붙는다.","能感受到冰牙龍的呼吸，
爪牙的雙劍。光是碰觸結凍
的刀刃，就會連心臟都凍住。","隐现冰牙龙呼吸的爪牙双剑。
光是碰触结冻的刀刃，
就会连心脏都冻住。",,,,,,,,"أنصال ثنائية مصنوعة من
مخالب وأنياب ونفثة باريوث.
تُجمد أي شيء تلمسه.",,,,,,,,,,,
d1c581b0-e4dd-4db8-bd8d-ed878f7eb13e,2051818714,W_DualBlades_093_Explain,"氷牙竜の息吹を感じる、爪牙の
双剣。凍てつく刃は触れるだけ
で心の臓まで凍りつかせる。","Dual blades made from claws,
tusks, and Barioth breath.
Freeze anything they touch.","Lames doubles en griffes,
défenses et souffle de
Barioth. Gèlent tout.","Doppie lame con artigli,
zanne e soffio di Barioth
che congelano ogni cosa.","Doppelklauen, eisig scharf
wie der Barioth-Atem. Eine
Berührung gefriert das Herz.","Espadas dobles hechas con
garras, colmillos y aliento
de Barioth. Congeladoras.","Два клинка из когтей,
клыков и дыхания Бариота.
Замораживают все подряд.","Ostrza z pazurów, kłów
i oddechu Bariotha. Wszystko
zamarznie na kamień.",,,"Duplas-Lâminas feitas de
garras, presas e bafo de
Barioth. Congelantes.","빙아룡의 숨결이 느껴지는
쌍검. 차디찬 칼날은 닿기만
해도 마음까지 얼어붙는다.","能感受到冰牙龍的呼吸，
爪牙的雙劍。光是碰觸結凍
的刀刃，就會連心臟都凍住。","隐现冰牙龙呼吸的爪牙双剑。
光是碰触结冻的刀刃，
就会连心脏都冻住。",,,,,,,,"أنصال ثنائية مصنوعة من
مخالب وأنياب ونفثة باريوث.
تُجمد أي شيء تلمسه.",,,,,,,,,,,
fb0b92f9-83c8-410d-ba1f-fca35e222910,3642695656,W_DualBlades_094_Explain,"迅速の騎士が生んだニヴルブリ
ザードの強化型。その連撃は逃
れられない終焉の雪嵐を呼ぶ。","The Blizzarioths's upgrade.
Their attacks rain down like
an inescapable blizzard.","Invoquent un blizzard
qu'on ne peut fuir.
Base : Blizzarioths","Tempeste Barioth potenziate.
Si scagliano sui nemici come
una bufera inesorabile.","Verbesserter Barioth-Schnee-
sturm. Die Angriffe erzeugen
einen tödlichen Schneesturm.","Neviscarioths mejoradas. Sus
golpes son como una ventisca
de la que no se puede huir.","Улучшение Клинков вьюги.
Их атаки — словно вьюга,
от которой не укрыться.","Ulepszenie Śnieszczotów.
Atakują z siłą
niechybnej zamieci.",,,"Melhoria da Nevascarioths.
Os ataques dela caem como
uma nevasca implacável.","신속의 기사가 만들어낸
니블블리자드의 강화형.
종언의 눈보라를 일으킨다.","從迅速的騎士手中誕生的
暗霧蘊劍強化型態。
那連擊能喚來終焉的暴風雪。","从神速骑士手中诞生的
冰牙双剑强化型。
那连击能唤来终焉的暴风雪。",,,,,,,,"ترقية بليزاريوث.
تنهال هجماته كعاصفة
لا مفر منها.",,,,,,,,,,,
cf316284-998a-429b-97cc-a52472d23e01,3593493430,W_DualBlades_095_Explain,"飛雷竜の鱗から造られた双剣。
舞うような剣技は迅雷を呼び、
獲物を容易く切り裂いていく。","Made of Tobi-Kadachi scales,
these blades can summon
thunderclaps while hunting.","Lames doubles en écailles de
Tobi-Kadachi. Elles peuvent
invoquer le tonnerre.","Con scaglie di Tobi-Kadachi,
queste lame invocano i tuoni
durante la caccia.","Klingen aus Tobi-Kadachi-
Schuppen, können beim Jagen
Donnerschläge entfesseln.","Estas espadas de escamas de
Tobi-Kadachi pueden convocar
truenos cuando cazas.","Эти клинки из чешуи Тоби-
Кадачи могут призывать
гром.","Ostrza przyzywające
grzmoty. Wykonane
z łusek Tobi-Kadachi.",,,"Feitas de escamas de
Tobi-Kadachi, essas lâminas
evocam trovoadas na caça.","비뢰룡의 비늘로 만든 쌍검.
춤 같은 검술로 번개를 만들어
사냥감을 쉽게 찢어발긴다.","以飛雷龍鱗片製成的雙劍。
飛舞般的劍技能召來迅雷，
毫不費力地撕裂獵物。","用飞雷龙鳞片制造的双剑。
舞蹈般的剑技卷带着迅雷，
轻易地将猎物撕开。",,,,,,,,"يمكن لهذه الأنصال المصنوعة
من قشور توبي-كاداتشي استدعاء
القصف الرعدي أثناء الصيد.",,,,,,,,,,,
205bb4c9-4dfd-4b8e-936a-0bea1c829d75,1771928393,W_DualBlades_096_Explain,"飛雷竜の鱗から造られた双剣。
舞うような剣技は迅雷を呼び、
獲物を容易く切り裂いていく。","Made of Tobi-Kadachi scales,
these blades can summon
thunderclaps while hunting.","Lames doubles en écailles de
Tobi-Kadachi. Elles peuvent
invoquer le tonnerre.","Con scaglie di Tobi-Kadachi,
queste lame invocano i tuoni
durante la caccia.","Klingen aus Tobi-Kadachi-
Schuppen, können beim Jagen
Donnerschläge entfesseln.","Estas espadas de escamas de
Tobi-Kadachi pueden convocar
truenos cuando cazas.","Эти клинки из чешуи Тоби-
Кадачи могут призывать
гром.","Ostrza przyzywające
grzmoty. Wykonane
z łusek Tobi-Kadachi.",,,"Feitas de escamas de
Tobi-Kadachi, essas lâminas
evocam trovoadas na caça.","비뢰룡의 비늘로 만든 쌍검.
춤 같은 검술로 번개를 만들어
사냥감을 쉽게 찢어발긴다.","以飛雷龍鱗片製成的雙劍。
飛舞般的劍技能召來迅雷，
毫不費力地撕裂獵物。","用飞雷龙鳞片制造的双剑。
舞蹈般的剑技卷带着迅雷，
轻易地将猎物撕开。",,,,,,,,"يمكن لهذه الأنصال المصنوعة
من قشور توبي-كاداتشي استدعاء
القصف الرعدي أثناء الصيد.",,,,,,,,,,,
1db0d6e0-e39f-4b34-9d30-a9d05fbbfffa,2808341287,W_DualBlades_097_Explain,"名のある刀工の手で鍛えられし
白眉の双剣。振るえば雷鳴が
轟き、獲物に衝撃を見舞う。","Magnum opus of a renowned
swordsmith. Pulses with
thunder at a mere twitch.","Les coups de ce chef-d'œuvre
provoquent le tonnerre.
Base : Dagues Kadachi","Opera eccelsa di un fabbro
rinomato. Scatena tuoni al
minimo movimento.","Meisterwerk eines bekannten
Schmiedes. Donner pulsiert
bei der kleinsten Bewegung.","Obra maestra de un herrero
renombrado. El trueno late
en cada sacudida de la hoja.","Лучшее творение знаменитого
кузнеца. Внутри
пульсирует гром.","Magnum opus renomowanego
szermierza. Przy ruchu
zaczynają drgać od grzmotów.",,,"Obra magnífica de um
ferreiro renomado. Evoca
trovões a um mero toque.","유명한 도공이 만든 쌍검 중
백미. 휘두르면 뇌명이 울려
사냥감을 충격에 빠뜨린다.","由知名刀匠親手鍛造的白眉
雙劍。揮動時會響起雷鳴，
給予獵物衝擊般的洗禮。","著名刀匠亲手锻造的白眉双剑。
稍稍一挥便雷声大作，
为猎物带去强大的冲击。",,,,,,,,"تحفة فنية صنعها
سيّاف مرموق. ينبض بالرعد
بمجرد تحريكه.",,,,,,,,,,,
f59103dd-6906-4326-a93d-ee888295b37f,3350671710,W_DualBlades_098_Explain,"蛮顎竜の暴威がみなぎる双剣。
振るうほどに燃え盛る両の刃は
さながら炎が舞うようである。","With each swing, Anjanath
rage flickers from these
blades like dancing flames.","Chacun de leurs coups est
marqué par les flammes
dansantes d'un Anjanath.","Lame che tremano come fiamme
danzanti della rabbia
furiosa di un Anjanath.","Bei jedem Schwung dieser
Klingen erglimmt Anjanath-
Zorn wie tanzende Flammen.","La furia de Anjanath
restalla en cada sacudida de
estas hojas como llamas.","С каждым взмахом из этих
клинков прорывается
гнев Аньяната.","Przy każdym zamachu gniew
Anjanatha migocze na ostrzu
jak tańczące płomienie.",,,"A cada golpe, a fúria de
Anjanath emana das lâminas,
como chamas saltitantes.","만악룡의 위협을 담은 쌍검.
휘두를수록 불타는 한쌍의
검은 마치 불꽃의 춤과 같다.","充滿蠻顎龍狂暴氣息的雙劍。
雙刃隨著揮動而燃燒得更劇烈，
宛如正在手中舞動的火焰。","洋溢着蛮颚龙暴威的双剑。
越是挥舞，火就愈加翻腾，
利刃有如两团跳动的烈焰。",,,,,,,,"يندفع غضب أنجاناث من
هذه الأنصال كاللهب المتراقص
عند كل ضربة متأرجحة.",,,,,,,,,,,
6d805326-90f6-4d80-a92f-d077b4f18b95,1589210521,W_DualBlades_099_Explain,"蛮顎竜の暴威がみなぎる双剣。
振るうほどに燃え盛る両の刃は
さながら炎が舞うようである。","With each swing, Anjanath
rage flickers from these
blades like dancing flames.","Chacun de leurs coups est
marqué par les flammes
dansantes d'un Anjanath.","Lame che tremano come fiamme
danzanti della rabbia
furiosa di un Anjanath.","Bei jedem Schwung dieser
Klingen erglimmt Anjanath-
Zorn wie tanzende Flammen.","La furia de Anjanath
restalla en cada sacudida de
estas hojas como llamas.","С каждым взмахом из этих
клинков прорывается
гнев Аньяната.","Przy każdym zamachu gniew
Anjanatha migocze na ostrzu
jak tańczące płomienie.",,,"A cada golpe, a fúria de
Anjanath emana das lâminas,
como chamas saltitantes.","만악룡의 위협을 담은 쌍검.
휘두를수록 불타는 한쌍의
검은 마치 불꽃의 춤과 같다.","充滿蠻顎龍狂暴氣息的雙劍。
雙刃隨著揮動而燃燒得更劇烈，
宛如正在手中舞動的火焰。","洋溢着蛮颚龙暴威的双剑。
越是挥舞，火就愈加翻腾，
利刃有如两团跳动的烈焰。",,,,,,,,"يندفع غضب أنجاناث من
هذه الأنصال كاللهب المتراقص
عند كل ضربة متأرجحة.",,,,,,,,,,,
6819011e-17e6-4d14-9091-2278e7492e22,2248256015,W_DualBlades_100_Explain,"燃え盛る蛮顎竜の双剣強化型。
数多の命を焼き尽くしてもなお
その炎が消えることはない。","Upgraded Anjanath blades.
They've burned countless
lives, yet still they rage.","Leur rage reste insatiable
malgré leurs victimes.
Base : Flammenschild","Flammenschild potenziate.
Hanno incenerito molte vite
e non accennano a fermarsi.","Verbessertes Flammenschild.
Brannte unzählige Leben aus,
doch die Wut verglüht nicht.","Flammenschild mejorado.
Han quemado una miríada de
vidas y ansían más.","Улучшенные клинки Аньяната.
Сожгли множество жертв,
но все еще полны гнева.","Ulepszone ostrza Anjanatha.
Ich wściekły ogień pochłonął
niezliczone żywoty.",,,"Lâminas de Anjanath
melhoradas. Queimaram tantas
vidas, mas ainda há fúria.","불타는 만악룡 쌍검의 강화형.
무수한 생명을 태우면서도
그 불꽃은 꺼질 줄 모른다.","熊熊燃燒的蠻顎龍雙劍
強化型態。即使已燒盡無數
生命，其火焰仍不會熄滅。","熊熊燃烧的蛮颚龙双剑强化型。
即便燃尽了无数生命，
它的烈焰仍然不知停息。",,,,,,,,"أنصال أنجاناث التي تمت
ترقيتها. حرقت أرواحًا
لا حصر لها، ولا تزال مشتعلة.",,,,,,,,,,,
91ebc094-8b9b-4e50-afcc-3a865c754047,1381533082,W_DualBlades_101_Explain,"夜陰に紛れる黒い双剣。
暗殺を生業とする集団の長が
代々伝える武器もこれだとか。","Ebon dual blades, jet black.
Rumored to have been passed
down by a line of assassins.","Lames doubles en ébène.
Auraient été transmises
par un groupe d'assassins.","Doppie lame d'ebano, nere
corvine. Pare si tramandino
in una setta di assassini.","Nachtschwarze Doppelklingen.
Sollen einst einer Attentäter-
bande gehört haben.","Espadas dobles de ébano.
Se dice que son el legado de
un linaje de asesinos.","Два черных клинка. Говорят,
они передаются из поколения
в поколение убийц.","Bliźniacze hebanowe ostrza,
kruczoczarne. Przekazywane
sobie przez zabójców.",,,"Duplas-Lâminas lustrosas de
ébano. Dizem que elas vêm
de uma família de matadores.","어둠 속에 숨어드는 검은
쌍검. 암살을 생업으로 한
집단의 수장이 썼다고 한다.","隱於夜色中的黑色雙劍。
聽說跟以暗殺為生的集團首領
代代相傳的武器是同一把。","藏身于深夜中的漆黑双剑。
听说它正是以暗杀为生的
集团首领代代相传的武器。",,,,,,,,"أنصال ثنائية سوداء قاتمة.
يُحكى أن سلالة من السفاحين
توارثتها فيما بينها.",,,,,,,,,,,
fdddea1f-1ace-4984-aee2-61f6bb96caad,2284439396,W_DualBlades_102_Explain,"夜陰に紛れる黒い双剣。
暗殺を生業とする集団の長が
代々伝える武器もこれだとか。","Ebon dual blades, jet black.
Rumored to have been passed
down by a line of assassins.","Lames doubles en ébène.
Auraient été transmises
par un groupe d'assassins.","Doppie lame d'ebano, nere
corvine. Pare si tramandino
in una setta di assassini.","Nachtschwarze Doppelklingen.
Sollen einst einer Atten-
täterbande gehört haben.","Espadas dobles de ébano.
Se dice que son el legado de
un linaje de asesinos.","Два черных клинка. Говорят,
они передаются из поколения
в поколение убийц.","Bliźniacze hebanowe ostrza,
kruczoczarne. Przekazywane
sobie przez zabójców.",,,"Duplas-Lâminas lustrosas de
ébano. Dizem que elas vêm
de uma família de matadores.","어둠 속에 숨어드는 검은
쌍검. 암살을 생업으로 한
집단의 수장이 썼다고 한다.","隱於夜色中的黑色雙劍。
聽說跟以暗殺為生的集團首領
代代相傳的武器是同一把。","藏身于深夜中的漆黑双剑。
听说它正是以暗杀为生的
集团首领代代相传的武器。",,,,,,,,"أنصال ثنائية سوداء قاتمة.
يُحكى أن سلالة من السفاحين
توارثتها فيما بينها.",,,,,,,,,,,
9d152f3e-0f13-462d-b068-275db17cb2b1,2542356060,W_DualBlades_103_Explain,"黒き双翼は夜天に死を運ぶ。
伝説の暗殺者が携えたという、
ヒドゥガー進化形態。","The Hidden Gemini's upgraded
form, a legendary assassin's
preferred weapon.","L'arme favorite d'un
assassin de légende.
Base : Dagues occultes","Forma potenziata dei gemelli
occulti. L'arma preferita di
un leggendario assassino.","Verbesserte Versteckte
Zwillinge, Lieblingswaffe
eines legendären Assassinen.","Géminis oculto mejorado.
Es el arma preferida de
un legendario asesino.","Улучшенная форма Скрытых
близнецов. Оружие
легендарного убийцы.","Ulepszone Ukryte Bliźnięta.
Broń wybierana przez
legendarnych zabójców.",,,"Gêmeos Ocultos melhorada,
a arma preferida de um
assassino lendário.","검은 날개는 밤하늘에 죽음을
불러 온다. 전설의 암살자가
사용했다는 히드가의 진화형.","漆黑雙翼自夜空中帶來死亡。
傳說中的暗殺者曾持有的武器。
隱密匕首的進化型態。","漆黑双翼自夜空中带来死亡。
据称传说暗杀者曾持有此武器，
禁忌匕首的进化形态。",,,,,,,,"شكل التوأمة المخفية التي تمت
ترقيتها، وهو السلاح المُفضل
للسفاح الأسطوري.",,,,,,,,,,,
72abbbe3-ac68-4d77-846c-942d267248cf,1602221982,W_DualBlades_104_Explain,"天下を統べた士が遺した雅なる
双刃。双つ身の刃は暁の空の下
に輝き、主君に栄華を与える。","Shining radiantly at dawn,
these blades bestow their
owner with prosperity.","Lames à l'éclat sublime au
petit matin. Confère
prospérité à son porteur.","Lame radiose e raggianti
all'alba. Donano prosperità
a chi le brandisce.","Bei Sonnenaufgang erstrahlen
die Klingen und bringen
ihrem Besitzer Wohlstand.","Estas espadas brillan al
amanecer y confieren
prosperidad a su dueño.","Эти клинки, сияющие на заре,
наделяют владельца
процветанием.","Lśnią promiennie o świcie.
Te ostrza gwarantują
właścicielowi dobrobyt.",,,"Com um brilho radiante na
alvorada, essas lâminas dão
prosperidade ao portador.","천하를 다스리던 이가 남긴
쌍검. 두 칼은 새벽을 비추며
주군에게 영광을 가져다준다.","統率天下的武士所遺留的
風雅雙刃。雙身之刃在晨曦
之空下閃耀，授與主君榮華。","统率天下之士遗留的风雅双刃。
双身之刃在晨曦下闪耀，
授与主君荣华。",,,,,,,,"تُنعم هذه الأنصال التي
تتوهج مشرقة عند
الفجر على مالكها بالرخاء.",,,,,,,,,,,
37ccac3a-30c3-41ba-9647-f2ba01fa95d4,1923357626,W_DualBlades_105_Explain,"天下を統べた士が遺した雅なる
双刃。双つ身の刃は暁の空の下
に輝き、主君に栄華を与える。","Shining radiantly at dawn,
these blades bestow their
owner with prosperity.","Lames à l'éclat sublime au
petit matin. Confère
prospérité à son porteur.","Lame radiose e raggianti
all'alba. Donano prosperità
a chi le brandisce.","Bei Sonnenaufgang erstrahlen
die Klingen und bringen
ihrem Besitzer Wohlstand.","Estas espadas brillan al
amanecer y confieren
prosperidad a su dueño.","Эти клинки, сияющие на заре,
наделяют владельца
процветанием.","Lśnią promiennie o świcie.
Te ostrza gwarantują
właścicielowi dobrobyt.",,,"Com um brilho radiante na
alvorada, essas lâminas dão
prosperidade ao portador.","천하를 다스리던 이가 남긴
쌍검. 두 칼은 새벽을 비추며
주군에게 영광을 가져다준다.","統率天下的武士所遺留的
風雅雙刃。雙身之刃在晨曦
之空下閃耀，授與主君榮華。","统率天下之士遗留的风雅双刃。
双身之刃在晨曦下闪耀，
授与主君荣华。",,,,,,,,"تُنعم هذه الأنصال التي
تتوهج مشرقة عند
الفجر على مالكها بالرخاء.",,,,,,,,,,,
5f066986-8b66-4f29-bbcb-7ed41556f993,863244267,W_DualBlades_106_Explain,"雅なる双刃が斬り拓く栄華の
道には、穢れの一片も落ちず。
狐双刃アカツキノソラ強化型。","The Morning Dawn's upgraded
form, its cuts are as clean
as a fresh, new beginning.","Inflige des blessures d'une
netteté sans pareille.
Base : Aube éclatante","Forma potenziata dell'alba
mattutina. I suoi tagli sono
netti come un nuovo inizio.","Schnitte der Abenddämmerung
markieren den Neuanfang wie
ein neuer Tag.","Amanecer mejorado.
Sus cortes son tan limpios
como un nuevo inicio.","Улучшенная форма Утренней
зари. Раны от них чисты,
словно новый рассвет.","Ulepszenie Świtu Poranka.
Cięcia czyste jak
nowe początki.",,,"Alvorecer, versão melhorada.
O fio dela é límpido como
um novo recomeço.","우아한 쌍검이 밝힌 영광의
길에 한 점의 오점도 없나니.
아카츠키노소라의 강화형.","風雅雙刃所劈斬拓開的榮華
之路上，從未落下一絲汙穢。
狐雙刃拂曉夢如空的強化型態。","风雅双刃劈斩拓开的荣华路上，
从未落下一丝污秽。
狐双刃【浮世梦如空】强化型。",,,,,,,,"شكل فجر الصباح الذي تمت
ترقيته، يترك الجروح نظيفة
كالبداية الجديدة كليًا.",,,,,,,,,,,
19abbb26-a465-435d-8688-1bf583524d46,4011652699,W_DualBlades_107_Explain,"火竜の一族が持つ強力な火の
属性により、単発の攻撃力を
高めた双剣。","Powerful swords with potent
elemental properties
inherited from fire wyverns.","Des lames puissantes dotées
des propriétés élémentaires
des wyvernes de feu.","Possenti spade pervase dalle
potenti proprietà elementali
dei wyvern di fuoco.","Mächtige Schwerter, deren
Elementeigenschaften von
Feuerwyvern stammen.","Espadas con gran poder
elemental heredado de un
wyvern de fuego.","Мощные клинки со свойствами
огненной стихии, полученными
от виверны.","Potężne miecze, które
odziedziczyły moc żywiołów
po ognistych wiwernach.",,,"Espadas poderosas com
propriedades elementais
herdadas de serpes de fogo.","화룡의 일족이 가진
강력한 불속성으로 한 방의
공격력을 높인 쌍검.","因擁有火龍一族的
強力火屬性，提高了
單發攻擊力的雙劍。","因拥有火龙一族的强力火属性，
而提高了单发攻击力的双剑。",,,,,,,,"سيوف قوية مع خصائص
عناصر شديدة القوة موروثة من
تنانين النار المجنحة.",,,,,,,,,,,
bfca16d5-db5f-451e-a12f-1d2d483e95b7,1729204363,W_DualBlades_108_Explain,"火竜の一族が持つ強力な火の
属性により、単発の攻撃力を
高めた双剣。","Powerful swords with potent
elemental properties
inherited from fire wyverns.","Des lames puissantes dotées
des propriétés élémentaires
des wyvernes de feu.","Possenti spade pervase dalle
potenti proprietà elementali
dei wyvern di fuoco.","Mächtige Schwerter, deren
Elementeigenschaften von
Feuerwyvern stammen.","Espadas con gran poder
elemental heredado de un
wyvern de fuego.","Мощные клинки со свойствами
огненной стихии, полученными
от виверны.","Potężne miecze, które
odziedziczyły moc żywiołów
po ognistych wiwernach.",,,"Espadas poderosas com
propriedades elementais
herdadas de serpes de fogo.","화룡의 일족이 가진
강력한 불속성으로 한 방의
공격력을 높인 쌍검.","因擁有火龍一族的
強力火屬性，提高了
單發攻擊力的雙劍。","因拥有火龙一族的强力火属性，
而提高了单发攻击力的双剑。",,,,,,,,"سيوف قوية مع خصائص
عناصر شديدة القوة موروثة من
تنانين النار المجنحة.",,,,,,,,,,,
3e88d9d8-ff25-46df-8ed4-790606b6d152,3582238482,W_DualBlades_109_Explain,"強化版ツインフレイムは、竜の
炎を統べる者の証。灼炎の番い
を従え、世界を焼き尽くせ。","The Twin Flames's upgraded
form. Capable of setting the
world aflame.","Elles peuvent embraser
le monde entier.
Base : Flammes fraternelles","Fiamme fraterne potenziate.
Sono in grado di ardere
il mondo intero.","Verbesserte Brüderflammen.
Sie sind in der Lage, die
Welt in Brand zu setzen.","Llamas fraternas mejoradas.
Pueden hacer arder el mundo
a los cuatro vientos.","Улучшенная форма Двух
пламен. Способна зажечь
весь мир.","Ulepszone dwa
płomienie. Zdolne
podpalić cały świat.",,,"Chamas Gêmeas melhoradas.
Capazes de incendiar
o mundo inteiro.","강화판 트윈플레임은 용의
불꽃을 다루는 증표. 작열하는
한쌍의 칼로 세계를 불태워라.","強化版本的雌雄焰刀，
是統治了龍之炎的證明。
率領灼炎的對劍，焚毀世界吧。","强化版的雌雄双焰刀，
是统治龙炎之人的证明。
御灼炎对剑，焚尽世界。",,,,,,,,"شكل النيران المزدوجة التي
تمت ترقيتها. قادرة على
إحراق العالم.",,,,,,,,,,,
