guid,crc?,entry name,Japanese,English,French,Italian,German,Spanish,Russian,Polish,Dutch,Portuguese,PortugueseBr,Korean,TraditionalChinese,SimplifiedChinese,Finnish,Swedish,Danish,Norwegian,Czech,Hungarian,Slovak,Arabic,Turkish,Bulgarian,Greek,Romanian,Thai,Ukrainian,Vietnamese,Indonesian,Fiction,Hindi,LatinAmericanSpanish
0263d8cb-5c17-4e48-b60e-b9691597991c,2932686273,evc1515_Text_01,戯れに近寄りし 繭玉は 糸に撚られし従者,"What seems an easy target,
is a servant on a leash.","Une cible qui semblait facile s'avère
être un serviteur en laisse.","Ciò che sembra preda facile,
è un servo guinzagliato","Was wie ein leichtes Ziel wirkt,
ist ein Diener an der Leine.","Presas fáciles parecen ser,
pero su soberana las ata en corto","Что кажется легкой добычей,
является верным слугой.","Choć wydaje się łatwym celem,
jest sługą na smyczy.",,,"O que parece um alvo fácil
é um servo na coleira.",함부로 다가간 고치는 실에 엉킨 종자,隨意靠近之繭球 乃以絲捻成之從者 ,近嬉戏 捻丝成茧之仆,,,,,,,,"ما يبدو هدفًا سهلاً، 
هو خادم مقيد.",,,,,,,,,,,
2b17cc47-1dcc-4488-8c35-d8ef9208b589,1082874227,evc1515_Text_02,手繰りし糸の元 主の命のままに,Reeled in at its mistress's command.,Sous le joug de leur maîtresse.,"Che accorre se dalla
sua padrona viene richiamato.",Kurz gehalten auf Geheiß seiner Herrin.,Una sola orden bastará,Повинуясь каждому зову хозяйки.,Wciągnięty w sidła żądań jego pani.,,,Puxado ao comando da mestre.,손으로 자아낸 실 끝 주인의 명령을 따라,順應己身絲線之源 或動或靜依主之意,从主命 跟随引线之源,,,,,,,,يأتمر بأمر سيده.,,,,,,,,,,,
cd506c38-b903-41fe-9413-e54126c110b8,3965119052,evc1515_Text_03,囲み 獲りつき 封じ 惑わせて,"They close in, cling on, subdue, restrain...","Ils s'approchent, s'accrochent,
soumettent, maîtrisent...","Si avvicinano, si aggrappano,
opprimendo e frenando","Er pirscht heran, klammert sich
an, unterwirft, bändigt...","Para que cierren el cerco;
y se aferren y paralicen y sometan...","Они приближаются, цепляются, хватают,
подавляют...","Zbliżają się, ujarzmiają, poskramiają...",,,"Se aproximam, apegam, dominam, contêm...",에워싸고 휘감고 봉하고 현혹하여,包圍 捕獲 束縛 迷惑,包围住 猎捕封锁诱惑,,,,,,,,يحاصرون، يتشبثون، يخضعون، يكبحون...,,,,,,,,,,,
a85c528b-45b3-4354-8195-0cf65445b6f4,3844401192,evc1515_Text_04,果ては我が身を焦がし 獲物を供す,Until they engulf their prey in flames.,"Jusqu'à envelopper leur proie
dans les flammes.","Finché il bersaglio dalle fiamme
non viene attanagliato","Bis er seine Beute in
Flammen einschließt.","Envolverán a sus presas en llamas
hasta que sea demasiado tarde",Пока жертва не будет охвачена пламенем.,Zanim otoczą ofiarę płomieniami.,,,Até engolfarem a presa em chamas.,끝내 자신의 몸을 태워 사냥감을 바친다,最終焚燒自身 獻上獵物,燃己身 仅为供奉猎物,,,,,,,,حتى يحيطوا فريستهم بالنيران.,,,,,,,,,,,
e9d7c549-9410-4f09-9c3c-a58377382767,4012812543,evc1515_Text_05,重ね撚られし糸は舌鼓のように,"Baked and strung, like a glazed ham.","Rôtie et pendue, comme un jambon
laqué.","Come un prosciutto glassato,
cotto e legato.","Gebraten und geschnürt wie
ein glasierter Schinken.","A fuego vivo las asarán
como pedazos de carne","Запеченная и подвешенная, словно сочный
окорок.","Przypiekając ją, jak glazurowaną szynkę.",,,"Amarrada e assada, como um pernil.",겹겹이 꼬인 실은 입맛을 다시는 듯하구나,絲線不斷旋捻 如貪求美食之舌,线重重 如同享用佳肴,,,,,,,,لتصبح مطهية ومخبوزة، مثل لحم الخنزير الشهي.,,,,,,,,,,,
9c23ca39-e4fa-4807-a6b7-9e6970cd059d,3062615029,evc1515_Text_06,万糸焚く御前,Parching Puppeteer,Marionnettiste ardent,Burattinaio cocente,Dörrender Puppensplr,Sofocante titiritera,Жгучий кукловод,Ogniolalkarz,,,Titereiro Sedento,실을 불사르고,焚燒萬絲的貴婦人,焚尽万丝之贵妇,,,,,,,,محرِّك الدمى الجافة,,,,,,,,,,,
d8fa1ed5-5c8f-48fa-85ab-830fd5dbbc9e,3343098830,evc1515_Text_07,熾妃蜘蛛 ヤツカダキ亜種,Pyre Rakna-Kadaki,Rakna-Kadaki de feu,Rakna-Kadaki igneo,Pyro-Kadaki,Rakna-Kadaki Pira,Плам. Ракна-Кадаки,Pyre Rakna-Kadaki,,,Rakna-Kadaki Pírico,치비지주 야츠카다키 아종,熾妃蜘蛛,炽妃蜘蛛,,,,,,,,راكنا-كاداكي الحارق,,,,,,,,,,,
