guid,crc?,entry name,Japanese,English,French,Italian,German,Spanish,Russian,Polish,Dutch,Portuguese,PortugueseBr,Korean,TraditionalChinese,SimplifiedChinese,Finnish,Swedish,Danish,Norwegian,Czech,Hungarian,Slovak,Arabic,Turkish,Bulgarian,Greek,Romanian,Thai,Ukrainian,Vietnamese,Indonesian,Fiction,Hindi,LatinAmericanSpanish
ec9bd667-09da-4d95-b2e4-f6c789640877,2295115910,evc1507_Text_01,そのものが 気づけるはずもなかった,No one could have seen it coming...,Personne n'aurait pu prévoir...,Nessuno poteva aspettarsi,Niemand hat ihn kommen sehen...,Nunca jamás lo han visto acercarse,Никто этого не ожидал...,Nikt nie mógł tego przewidzieć...,,,Ninguém poderia ter antecipado...,그것을 알아챌 방법은 없다,無人得以覺察此物,无人可察觉此物,,,,,,,,لم يتوقع أحدٌ حدوث ذلك...,,,,,,,,,,,
465ffb62-e78d-49f6-9d93-835655e512df,1632631862,evc1507_Text_02,迫る 異妖,This stalking shadow.,Cette ombre tapie là.,Quest'ombra insidiosa,Den schleichenden Schatten.,Pues invisible es su acechadora sombra,Этой крадущейся тени.,Ten prześladowczy cień.,,,Esta sombra espreitadora.,다가오는 요기,異妖悄悄接近,逐渐迫近之妖物,,,,,,,,هذه الظلال المطارِدة.,,,,,,,,,,,
413d0011-4e8b-4683-ac90-4d6e726e83cd,92581596,evc1507_Text_03,漂う霧は餌を蝕もうとする魔手となって,"The mist that envelops it,
an evil force that consumes its prey.","La force démoniaque qui
l'enveloppe consume sa proie.","Malevola forza che consuma la preda
è la nebbia che la avvolge.","Der Nebel, der ihn einhüllt, eine
böse Kraft, die ihre Beute verschlingt.","Y es que camuflada en la neblina,
su inquina devoradora oculta","Окутанная туманом злая сила,
пожирающая свою добычу.","Ta mgła, która go otacza, przeklęta
siła, z którą pochłania ofiarę.",,,"A névoa que a recobre,
força maligna que consome a presa.",떠도는 안개가 먹이를 탐하는 마수가 되어,飄盪黑霧化為侵蝕魔手,轻雾化魔蚀猎物,,,,,,,,"الضباب الذي يحيط به،
هو قوة شريرة تلتهم فريستها.",,,,,,,,,,,
f2a381fe-2cdd-469d-b3c6-43f5cd9a66b4,1051368251,evc1507_Text_04,時 すでに遅く,It is already too late.,Il est déjà trop tard.,Ma è troppo tardi ormai.,Es ist bereits zu spät.,Ya es demasiado tarde,Уже слишком поздно.,Już jest za późno.,,,Já é tarde demais.,때는 이미 늦었구나,逃難之時已遲,直到此时已太晚,,,,,,,,فات الأوان بالفعل.,,,,,,,,,,,
c6653634-d97f-401d-a3b2-40160970dcff,1881471704,evc1507_Text_05,死力を尽くし抗うほどに,"Even those who struggle
in a desperate effort to survive...","Même ceux tentant un ultime
effort pour survivre...","Anche coloro che per la sopravvivenza
lottano disperatamente","Selbst jene, die im verzweifelten
Überlebenskampf kämpfen...","Inútil es forcejear,
fútil cualquier intento de supervivencia","Даже те, кто отчаянно
пытаются выжить...","Nawet ci, którzy desperacko
próbują przetrwać...",,,"Até aqueles que lutam num esforço
desesperado para sobreviver...",사력을 다해 발버둥 친다 한들,即便用盡全力抵抗,即便欲尽力反抗,,,,,,,,"حتى هؤلاء الذين يكافحون
بجهد يائس من أجل البقاء...",,,,,,,,,,,
b3de4c8a-3b9b-4418-b9ce-d27ea0f988dd,3397530009,evc1507_Text_06,叩き ねじ伏す力はおさまることなく,"Are beaten and pinned down
by its overwhelming force.",Sont impuissants devant sa force écrasante.,"Vengono sconfitti e messi alle strette
da una forza irrompente","Werden von der überwältigenden Macht
besiegt und niedergedrückt.","Todos caerán aplastados
por su sobrecogedora potencia","Оказываются бессильны перед
этой сокрушительной мощью.","Zostają pokonani i przygnieceni
jego przytłaczającą mocą.",,,"São surrados e imobilizados
pela força implacável.",굴복시키려는 힘은 사그라들 기미가 없고,依然無法阻其攻勢,打击碾压不会停,,,,,,,,"تعرضوا للضرب والتثبيط
بقوته الساحقة.",,,,,,,,,,,
cd419e03-8890-4c80-a416-7ae46742b825,451206354,evc1507_Text_07,終には凶々しき姿が顕現する,"Not until the end, when all is over,
will it reveal its ghastly form.","Et à la fin, sa forme
terrifiante sera révélée.","E solo quando non c'è più scampo
rivela la sua forma sconvolgente.","Erst am Ende, wenn alles vorbei ist,
wird er seine grausige Form zeigen.","Y no será hasta que todo acabe,
cuando desvele su abominable imagen","И лишь когда все кончено,
откроется истинный облик монстра.","Ale dopiero na sam koniec, gdy wszystko
ucichnie, ujawni swój okropny wygląd.",,,"É só no fim, quando tudo acabar,
que ele revelará a forma medonha.",끝내는 섬뜩한 모습을 드러낸다,凶暴姿態終將顯現,最终凶姿必显现,,,,,,,,"لن يظهر شكله المروع إلا في النهاية،
عندما ينتهي كل شيء.",,,,,,,,,,,
4377796c-ee08-4c6d-85d7-0759e7acae37,2959733560,evc1507_Text_08,災厄の黒き蝕,Dark Eclipse,Éclipse noire,Eclissi oscura,DnklSnnnfnstrns,Eclipse oscuro,Темное затмение,Mroczne zaćmienie,,,Eclipse Sombrio,재앙의 검은 침식,災難之黑蝕,灾厄黑蚀,,,,,,,,الكسوف الأسود,,,,,,,,,,,
58b0cf5a-ce8f-47a4-94a4-c612381ad525,2800075013,evc1507_Text_09,黒蝕竜 ゴア・マガラ,Gore Magala,Gore Magala,Gore Magala,Gore Magala,Gore Magala,Кровавая Магала,Gore Magala,,,Gore Magala,흑식룡 고어-마가라,黑蝕龍,黑蚀龙,,,,,,,,جور ماجالا,,,,,,,,,,,
