guid,crc?,entry name,Japanese,English,French,Italian,German,Spanish,Russian,Polish,Dutch,Portuguese,PortugueseBr,Korean,TraditionalChinese,SimplifiedChinese,Finnish,Swedish,Danish,Norwegian,Czech,Hungarian,Slovak,Arabic,Turkish,Bulgarian,Greek,Romanian,Thai,Ukrainian,Vietnamese,Indonesian,Fiction,Hindi,LatinAmericanSpanish
d9d3583e-7462-4ad5-bce9-a1854f79cb1a,378729720,evc1508_Text_01,争うがままにたどり着いたその先は,At the tail end of a reckless battle...,Aux confins d'une bataille sans merci...,Al termine di uno scontro efferato,Am Ende einer stürmischen Schlacht...,"En el último suspiro
de una despiadada pelea",В самом конце отчаянной битвы...,Na samym końcu bezmyślnej walki...,,,No finalzinho da batalha imprudente...,싸움 끝에 다다른 곳은,歷盡無數鬥爭後抵達的終點,于纷争之尽头,,,,,,,,في نهاية معركة طائشة...,,,,,,,,,,,
e32daa08-2aed-4d29-a54d-50a854e0455e,1873181083,evc1508_Text_02,なにものも足を踏み入れることの許されぬ地,"Two beasts find themselves
in a place they don't belong.","Deux monstres se retrouvent
en territoire inconnu.","Due bestie si ritrovano in un posto
a loro sconosciuto.","Finden sich zwei Bestien an einem Ort,
an den sie nicht gehören.","Dos bestias se hallan
alejadas de su morada",Два зверя оказываются в чуждом им месте.,"Dwie bestie znajdują się w miejscu,
gdzie nie powinny być.",,,"Duas feras se encontram
num lugar que não é delas.",그 누구도 출입을 허락받지 못한 땅,乃世間萬物皆禁入之詭地,无人可入之地,,,,,,,,"يجد وحشان نفسيهما
في مكان لا ينتميان إليه.",,,,,,,,,,,
359a9b2f-e763-4ee0-93d0-6658f4ebe9ff,4129046173,evc1508_Text_03,現れた主の前には,And when the master of this land appears...,Et lorsque le maître des lieux s'annonce...,"E quando il padrone di questa terra
si vede comparire",Und als der Herr dieses Landes erscheint...,"El dueño de esas tierras
aparece de la nada","И когда появляется властитель этих
земель...",A kiedy pojawia się władca tego lądu...,,,E quando surge o mestre dessa terra...,나타난 땅의 주인에게는,主宰者現身之時,面对领主现身,,,,,,,,وعندما يظهر سيد هذه الأرض...,,,,,,,,,,,
c4ea019c-a729-4c44-a432-a957c1930356,2286017029,evc1508_Text_04,いかなる攻めで抗おうともその一切が通じぬ,"Not even the mightiest attacks
can do it any harm.","Aucune attaque, même puissante,
ne le blesse.","Nemmeno il più brutale degli
attacchi lo può scalfire.","Können ihm selbst die mächtigsten
Angriffe keinen Schaden zufügen.","Es inmune ante todo ataque,
por poderoso que sea","Даже самые мощные атаки не причинят
ему вреда.","Nawet najpotężniejsze ataki
nic mu nie zaszkodzą.",,,"Nem o mais poderoso ataque
pode feri-lo.","어떤 방법으로 저항해 봐도
일절 통하지 않는다네",不論揮刀引弓 一切抵抗皆為徒勞,毫无招架之力,,,,,,,,"لا يمكن لأقوى الهجمات
أن تسبب أي ضرر.",,,,,,,,,,,
97a130d4-ce5d-4250-93b2-7f1e26c52310,2371458648,evc1508_Text_05,圧倒する力が叩く ねじ伏せる,"With its overwhelming strength,
it pummels and pins down its prey.","Sa force immense lui permet
d'écraser sa proie.","Demolisce e inchioda la preda
con forza impressionante.","Mit überwältigender Stärke prügelt er
auf seine Beute ein, nagelt sie fest.","A sus presas sacude y golpea
con devastadora fuerza","Его сокрушительная мощь не оставляет
жертве ни малейшего шанса.","Z przytłaczającą siłą atakuje
i przygniata swoją ofiarę.",,,"Com a força implacável, ele
surra e imobiliza a presa.",압도적인 힘으로 공격해 굴복시키고,面對壓倒性的力量 萬物只得潰敗臣服,强大碾压臣服,,,,,,,,"حيث
يضرب فريسته ويدمرها بقوته الساحقة.",,,,,,,,,,,
7086a629-e7e6-4745-af92-cf5271f06562,3014467587,evc1508_Text_06,鎮まることなき怒りは 高らかな怒号となって漂い,"Its endless anger fills the air
in the form of a deafening roar.","Sa rage infinie retentit dans
un rugissement assourdissant.","La sua furia infinita permea l'aria
con un ruggito assordante","Sein endloser Zorn erfüllt die Luft in
Form eines ohrenbetäubenden Brüllens.","Un rugido ensordecedor colma el aire
con inagotable crudeza","Оглушительным ревом он наполняет
воздух безмерной злобой.","Jego niepohamowany gniew wypełnia
powietrze ogłuszającym rykiem.",,,"A ira infinda toma o ar
na forma de um rugido ensurdecedor.","식지 않는 분노는
높고도 성난 포효가 되어 떠도니",永不止息的憤怒 化為高昂的怒號飄盪,怒不可遏愤吼,,,,,,,,"يملأ غضبه اللامتناهي الهواء
على هيئة هدير يصم الآذان.",,,,,,,,,,,
f2afaaf4-a61d-4041-9ca9-3d28aea7d3d3,1102201445,evc1508_Text_07,姿を滅すまで蝕みつくすだろう,"As it prepares to feast
without leaving a single bone.","Avant de dévorer son festin
jusqu'au dernier os.","Mentre si accinge a banchettare
senza lasciare traccia alcuna.","Während er sich auf das Mahl vorbereitet,
das keinen Knochen hinterlässt.","Relamiéndose para una panzada
de la que no dejará tajada","После этого кровавого пира
не останется ни единой косточки.","Gdy szykuje się do uczty,
z której nie zostanie nawet kość.",,,"Quando ele se prepara para comer
sem deixar sequer um osso.",그 모습을 멸할 때까지 물어뜯으리,不斷侵蝕來敵 直至形神俱滅,噬敌片骨不剩,,,,,,,,"كما يستعد لالتهام ضحاياه دون
ترك عظمة واحدة.",,,,,,,,,,,
c720f726-6fba-4105-aa14-86de191e4c87,984660266,evc1508_Text_08,天廻する白き蝕,Bright Eclipse,Claire éclipse,Eclissi radiosa,HllSonnnfnstrns,Eclipse claro,Яркое затмение,Jasne zaćmienie,,,Eclipse Brilhante,천회의 하얀 침식,天迴之白蝕,天廻白蚀,,,,,,,,الكسوف المشرق,,,,,,,,,,,
e0241d35-b083-428b-9222-812c7e52e632,4216769096,evc1508_Text_09,天廻龍 シャガルマガラ,Shagaru Magala,Shagaru Magala,Shagaru Magala,Shagaru Magala,Shagaru Magala,Шагару Магала,Shagaru Magala,,,Shagaru Magala,천회룡 샤가르마가라,天迴龍,天廻龙,,,,,,,,شاجارو ماجالا,,,,,,,,,,,
