guid,crc?,entry name,Japanese,English,French,Italian,German,Spanish,Russian,Polish,Dutch,Portuguese,PortugueseBr,Korean,TraditionalChinese,SimplifiedChinese,Finnish,Swedish,Danish,Norwegian,Czech,Hungarian,Slovak,Arabic,Turkish,Bulgarian,Greek,Romanian,Thai,Ukrainian,Vietnamese,Indonesian,Fiction,Hindi,LatinAmericanSpanish
44c939df-230a-4a67-b028-5697635f7896,1214482732,evc1523_Text_01,両雄の争いが熾烈になるほどに 苛烈になるほどに,"As the battle escalates,
growing fiercer by the second","Alors que la bataille s'intensifie,
de plus en plus violente","Mentre lo scontro imperversa,
un crescendo di ardore","Während der Kampf eskaliert,
mit jeder Sekunde heftiger","Al recrudecerse la batalla,
haciéndose más ardua cada segundo,","Когда битва обостряется,
становясь все более ожесточенной.","Bitwa się wzmaga,
coraz bardziej zawzięta.",,,"Conforme a batalha encrudesce,
cada vez mais feroz",두 영웅의 싸움이 격렬해지고 가열될수록,兩雄之爭 愈發激烈熾熱,两雄之争 愈是炽烈,,,,,,,,"مع تصاعد حدة المعركة،
تزداد الشراسة بمرور الوقت",,,,,,,,,,,
8f38125f-3e7b-44b0-bfda-ed4f145e93f3,3463951616,evc1523_Text_02,拮抗が崩れ 勝敗が決しようとするとき,"The struggles comes to an end,
and the conqueror to be proclaimed.","Les combats prennent fin,
le vainqueur va être proclamé.","La strenua lotta si conclude,
bisogna proclamare un vincitore.","Die Kämpfe gehen zu Ende und der
Eroberer soll verkündet werden.","la lucha llega a su fin,
y el conquistador queda proclamado.","Битва подходит к концу,
и победитель скоро будет провозглашен.","Zmagania są u kresu,
zaraz wyłoni się zdobywca.",,,"A luta se encerra,
o conquistador será declarado.",균형이 무너져 승패가 결정될 때,抗拮已毀 勝敗將分之時,一方溃败 胜负将定,,,,,,,,"تنتهي النزاعات
ويتم الإعلان عن المنتصر.",,,,,,,,,,,
74f2d954-ee2c-4d28-bbf2-848ec39eba46,2934548979,evc1523_Text_03,その勝ち様 負け様は壮絶を極めよう,But both sides hold on to their courage.,Mais les deux camps restent courageux.,"Eppure nessuno molla,
si resiste con valore.","Aber beide Seiten klammern
sich an ihren Mut.","Pero ambos contendientes conservan su
valor.",Но обе стороны не теряют отваги.,Odwaga się trzyma obu stron.,,,Só que os dois lados são corajosos.,그 모습은 장렬함의 극치일 것이니,勝者敗寇 皆須壯烈一搏,胜姿败态 勇猛至极,,,,,,,,لكن كلا الجانبين يحافظان على شجاعتهما.,,,,,,,,,,,
f785d482-7316-4bdb-807d-2104abbeb651,1884142993,evc1523_Text_04,果たして この争いの勝者はいずれか,Who is the victor here?,Qui a gagné ?,Ma chi sarà destinato a trionfare,Wer ist der Sieger hier?,¿Quién es aquí el vencedor?,Но кто здесь победитель?,Kto jest zwycięzcą?,,,Quem é o vencedor?,과연 어느 쪽이 승리할 것인가,最終勝利 究竟歸於何方,争斗之末 孰能取胜,,,,,,,,من المنتصر هنا؟,,,,,,,,,,,
cdc98eaf-a766-477a-b9ec-5e21c7d9570c,165825073,evc1523_Text_05,内に秘して高めた力を晒し,"For one of them has been storing
a trick up its sleeve.","Car l'un d'eux garde un tour
dans son sac.","Se il nemico nasconde
un asso nella manica cruciale","Denn einer von ihnen hat noch
ein Ass im Ärmel.","Resulta que uno se guardaba una sorpresa
en la manga.",Ибо один из них припрятал хитрость.,"Jeden z nich ma
asa w rękawie.",,,"Pois um deles tinha um ás
guardado na manga.",은밀히 키워 왔던 힘을 드러내고,體內之力 早已蓄勢待發,秘藏之力 尽数显露,,,,,,,,"فقد كان أحدهم يخفي
خدعة في جعبته.",,,,,,,,,,,
a8790eb9-2f5b-419d-8574-32d0ab5925a9,1869137834,evc1523_Text_06,渾身の一撃を放つのはいずれになるのか,"And it may strike a decisive blow
when least expected.","Et pourrait frapper un coup décisif
quand on s'y attend le moins.","Che, quando meno te lo aspetti,
è pronto a usare?","Und dies kann einen entscheidenden Tref-
fer landen, wenn am wenigsten erwartet.","Y quizá dé un golpe decisivo
en el momento más inesperado.","И может нанести решающий удар,
когда этого меньше всего ожидают.","I może zadać decydujący cios,
gdy nikt się nie spodziewa.",,,"E pode dar um golpe decisivo
quando menos se espera.",혼신의 일격을 날리는 것은 어느 쪽인가,渾身一擊 何時重現天日,全力一击 何时释放,,,,,,,,"وقد يوجه ضربة حاسمة
على غير المتوقع.",,,,,,,,,,,
04c6253f-8f52-4b45-b1ac-4a98c786de35,1283357342,evc1523_Text_07,激情する邪毒,Passionate Poisoner,Empoisonneur passionné,Avvelenatore esaltato,Giftmischer,Pasión venenosa,Страстный отравитель,Żarliwy truciciel,,,Envenenador Passional,격정적인 사독,激昂之邪毒,激昂邪毒,,,,,,,,مُسمم شغوف,,,,,,,,,,,
34e2a68b-62dc-4929-997c-9af49ec3cd69,3212878872,evc1523_Text_08,棘茶竜 エスピナス亜種,Flaming Espinas,Espinas de feu,Espinas ardente,Flammen-Espinas,Espinas Llameante,Пылающий Эспиназ,Płomienny Espinas,,,Espinas Flamejante,극다룡 에스피나스 아종,棘茶龍,棘茶龙,,,,,,,,إسبيناس المشتعل,,,,,,,,,,,
