guid,crc?,entry name,Japanese,English,French,Italian,German,Spanish,Russian,Polish,Dutch,Portuguese,PortugueseBr,Korean,TraditionalChinese,SimplifiedChinese,Finnish,Swedish,Danish,Norwegian,Czech,Hungarian,Slovak,Arabic,Turkish,Bulgarian,Greek,Romanian,Thai,Ukrainian,Vietnamese,Indonesian,Fiction,Hindi,LatinAmericanSpanish
2241cf03-4ca2-4589-8b6f-d9fa48b33f06,3801195847,W_Hammer_373_Explain,"最も質の高い骨材で造られた
至高の骨槌。超重量が生み出す
規格外の破壊力で気分爽快！","Hammer crafted from the blue
ribbon of bones. Ultra-dense,
and absurdly destructive!","Fabriqué en os de qualité.
Ultra dense et totalement
destructeur !","Martello creato col midollo
blu delle ossa. Densissimo
e follemente distruttivo!","Hammer aus dem blauen
Knochenband. Ultradicht
und absurd destruktiv!","Martillo hecho con huesos de
primerísima calidad, tan denso
como alocadamente destructivo.","Молот из синей ленты костей.
Сверхплотный и невероятно
разрушительный.","Młot wykuty z wiązanki
niebieskich kości. Bardzo ciężki
i absurdalnie niszczycielski!",,,"Martelo feito do melhor
dos ossos. Ultradenso e
absurdamente destruidor!","최고급 뼈 소재로 만든
최고의 뼈 해머. 무시무시한
파괴력에 기분도 상쾌!","以最高品質的骨材製成之頂級
骨錘。可藉巨大重量產生超群的
破壞力，帶來愉快的使用感受！","用最优质骨材打造的极品骨锤。
骨锤重量惊人，所以破坏力非
同一般，让人酣畅淋漓！",,,,,,,,"صنعت المطرقة من شريط
العظام الأزرق. سميكة للغاية،
ومدمرة بصورة لا تصدَّق!",,,,,,,,,,,
7b546c18-8996-4697-9f5f-fd3b0466cea2,3475791079,W_Hammer_374_Explain,"千刃竜の鱗を組み合わせた鎚。
極めて高い強度と鋭利な棘で
攻撃対象を粉塵と化す。","A hammer forged from the
scales of a Seregios. Capable
of reducing foes to dust.","Forgé en écailles de Seregios.
Réduit les ennemis
en poussière.","Martello forgiato con scaglie
di Seregios. Capace di
ridurre i nemici in polvere.","Ein Hammer aus Seregios-
Schuppen, der Gegner zu
Staub zermahlen kann.","Un martillo forjado con escamas
de Seregios. Puede hacer
polvo a sus víctimas.","Молот из чешуи Серегиоса.
Обращает врагов в прах.","Młot wykuty z łusek
Seregiosa. Ściera
wrogów na proch.",,,"Martelo forjado de escamas
de Seregios. Reduz inimigos
a pó.","천인룡의 비늘을 조합한 해머.
높은 강도와 예리한 가시로
공격 대상을 가루로 만든다.","組合千刃龍鱗片製成的大錘。
有著極高的強度及銳利的棘刺，
受到攻擊者將灰飛煙滅。","使用千刃龙的鳞组合而成的锤。
强度极高且锋利的棘会将敌人
化为粉尘。",,,,,,,,"مطرقة مصنوعة من
حراشف سيريجوس. قادرة
على تحويل الأعداء إلى غبار.",,,,,,,,,,,
9bde60c3-6f8e-4e8c-8d06-8ebdf8e6f9c6,1870179006,W_Hammer_375_Explain,"千刃竜の鱗を組み合わせた鎚。
極めて高い強度と鋭利な棘で
攻撃対象を粉塵と化す。","A hammer forged from the
scales of a Seregios. Capable
of reducing foes to dust.","Forgé en écailles de Seregios.
Réduit les ennemis
en poussière.","Martello forgiato con scaglie
di Seregios. Capace di
ridurre i nemici in polvere.","Ein Hammer aus Seregios-
Schuppen, der Gegner zu
Staub zermahlen kann.","Un martillo forjado con escamas
de Seregios. Puede hacer
polvo a sus víctimas.","Молот из чешуи Серегиоса.
Обращает врагов в прах.","Młot wykuty z łusek
Seregiosa. Ściera
wrogów na proch.",,,"Martelo forjado de escamas
de Seregios. Reduz inimigos
a pó.","천인룡의 비늘을 조합한 해머.
높은 강도와 예리한 가시로
공격 대상을 가루로 만든다.","組合千刃龍鱗片製成的大錘。
有著極高的強度及銳利的棘刺，
受到攻擊者將灰飛煙滅。","使用千刃龙的鳞组合而成的锤。
强度极高且锋利的棘会将敌人
化为粉尘。",,,,,,,,"مطرقة مصنوعة من
حراشف سيريجوس. قادرة
على تحويل الأعداء إلى غبار.",,,,,,,,,,,
bbfc4941-99cc-4ab3-b653-09c461e13b1d,327631617,W_Hammer_376_Explain,"無窮の強さをもって乱世を変革
する鉄鎚。マトラカアルグルの
強化型は革命者の証なり。","An upgrade of Matraca's Hammer.
The sign of a revolutionary, as its
strength seeks change.","Assoiffé de changement, il semble
avoir l'âme d'un révolutionnaire.
Base : Marteau Matraca","Martello Matraca potenziato.
Tende al cambiamento e si fa
simbolo di rivoluzione.","Verbesserter Matraca-Hammer.
Er sehnt sich nach Wandel als
Revolutionszeichen.","Martillo Matraca mejorado.
Símbolo revolucionario debido a
que su fuerza persigue el cambio.","Улучшение молота Матраки.
Символ революции и перемен.","Ulepszony Młot Matraca.
Symbol rebelii, siła
poszukująca zmiany.",,,"Martelo Matraca melhorado.
Sinal de revolução, força
que busca mudança.","무궁한 힘으로 난세를 바꾸는
해머. 마트라카아르굴의
강화형은 혁명가의 증표다.","以無窮的力量改變亂世的鐵錘。
大錘大陵五的強化型態
乃革命者的證明。","以无尽的力量变革乱世的铁锤。
大锤大陵五的强化型乃身为革
命者的证明。",,,,,,,,"ترقية مطرقة ماتراكا.
علامة الثورية، إذ
تسعى قوتها إلى التغيير.",,,,,,,,,,,
18b5402d-ca2f-4e16-8581-9cd233900ee2,1407400183,W_Hammer_377_Explain,"優れた素材で強化された毒妖鳥
の鎚。重い打撃と強烈な毒が、
獲物の脳を激しく揺らす。","An enhanced Pukei hammer.
Crushing, poisonous blows
strike fear into its foes.","Terrifie les proies avec ses
coups puissants et venimeux.
Base : Marteau Pukei","Martello Pukei potenziato.
Terrorizza i nemici con
devastanti colpi avvelenati.","Verbesserter Pukei-Hammer.
Mächtige, giftige Schläge
lassen Feinde erzittern.","Martillo Pukei-Pukei mejorado.
Sus fuertes golpes venenosos
espantan a los enemigos.","Улучшенный молот Поки.
Мощнейшие ядовитые удары
вселяют страх в его врагов.","Ulepszony młot Pukei.
Druzgocące, jadowite ciosy
budzą strach wśród wrogów.",,,"Martelo Pukei-Pukei melho-
rado. Golpes esmagadores e
venenosos que incitam medo.","뛰어난 소재로 강화한 독요조의
해머. 육중한 타격과 독이
사냥감의 뇌를 뒤흔든다.","以優秀素材強化過的毒妖鳥錘。
沉重的打擊與強烈的劇毒，
能給予獵物腦袋猛烈一擊。","用优秀素材强化的毒妖鸟锤。
剧烈打击与猛烈毒性，
会让猎物的大脑痛不欲生。",,,,,,,,"مطرقة بوكي المُحسنة.
تزرع ضرباتها السامة الساحقة
الخوف في أعدائها.",,,,,,,,,,,
c9ef227b-6e19-4652-b896-840cc77d7b67,1812515392,W_Hammer_378_Explain,"毒妖鳥の喉袋から強化した鎚。
猛毒を含み、放つ鎚の激震は、
獲物を内外から破壊する。","A hammer of hardened Pukei-
Pukei gular skin. Its toxic blows
attack from the inside out.","Marteau en glandes de Pukei-Pukei.
Les effets toxiques attaquent
la proie de l'intérieur.","Martello di pelle indurita
del collo di Pukei-Pukei. Il
suo attacco tossico è letale.","Ein Hammer aus gehärteter
Pukei-Kehlsackhaut, dessen
giftige Angriffe jeden ermüden.","Con piel curtida de pescuezo
de Pukei-Pukei. Sus golpes
tóxicos te atacan desde dentro.","Молот из затвердевшей кожи
с шеи Поки-Поки. Его яд
выворачивает наизнанку.","Młot z twardego worka
Pukei-Pukei. Jego trucizna
atakuje od wewnątrz.",,,"Martelo de pele rija da
garganta de Pukei-Pukei.
Seus golpes são tóxicos.","독요조의 후대로 강화한 해머.
맹독을 머금은 격진으로
사냥감을 안팎으로 파괴한다.","由毒妖鳥的喉袋強化的大錘。
含有猛毒，可擊出激烈的震波，
將獵物從裡到外完全破壞。","用毒妖鸟的喉袋强化的锤。
锤击含有剧毒，释放的剧烈
震荡能从内部和外部破坏猎物。",,,,,,,,"مطرقة من جلد بوكي-بوكي
المتصلب. تهاجم ضرباتها
السامة من الداخل إلى الخارج.",,,,,,,,,,,
917326a0-dd5b-42ef-b407-6ad11f690fce,3190669478,W_Hammer_379_Explain,"毒妖鳥の喉袋から強化した鎚。
猛毒を含み、放つ鎚の激震は、
獲物を内外から破壊する。","A hammer of hardened Pukei-
Pukei gular skin. Its toxic blows
attack from the inside out.","Marteau en glandes de Pukei-Pukei.
Les effets toxiques attaquent
la proie de l'intérieur.","Martello di pelle indurita
del collo di Pukei-Pukei. Il
suo attacco tossico è letale.","Ein Hammer aus gehärteter
Pukei-Kehlsackhaut, dessen
giftige Angriffe jeden ermüden.","Con piel curtida de pescuezo
de Pukei-Pukei. Sus golpes
tóxicos te atacan desde dentro.","Молот из затвердевшей кожи
с шеи Поки-Поки. Его яд
выворачивает наизнанку.","Młot z twardego worka
Pukei-Pukei. Jego trucizna
atakuje od wewnątrz.",,,"Martelo de pele rija da
garganta de Pukei-Pukei.
Seus golpes são tóxicos.","독요조의 후대로 강화한 해머.
맹독을 머금은 격진으로
사냥감을 안팎으로 파괴한다.","由毒妖鳥的喉袋強化的大錘。
含有猛毒，可擊出激烈的震波，
將獵物從裡到外完全破壞。","用毒妖鸟的喉袋强化的锤。
锤击含有剧毒，释放的剧烈
震荡能从内部和外部破坏猎物。",,,,,,,,"مطرقة من جلد بوكي-بوكي
المتصلب. تهاجم ضرباتها
السامة من الداخل إلى الخارج.",,,,,,,,,,,
edc67015-6cd6-4e08-bfb5-0182954d8fa3,1143529936,W_Hammer_380_Explain,"強化を重ねた先に生まれた烈火
のレッドビート。その雄なる魂
は何者にも縛ること適わず。","The Red Bludgeon's enhanced
form features many upgrades.
It cannot be tamed.","Doté de nombreux ajouts.
Difficile à maîtriser.
Base : Matraque rouge","Clava rossa potenziata con
numerose migliorie. Non
può essere domata.","Ein stärkerer Roter Knüppel.
Mit vielen Verbesserungen,
absolut unbezähmbar.","Cachiporra roja mejorada.
Es indomable y presenta
un sinfín de mejoras.","Улучшенная форма Красной
палицы содержит много
изменений. Ее не укротить.","Nowa wersja czerwonej
pałki otrzymała ulepszenia.
Nie można jej poskromić.",,,"Espancador Vermelho com
várias melhorias.
Não pode ser domado.","강화를 거듭해 만든 맹렬한
레드비트. 늠름한 혼은
누구에게도 구속되지 않는다.","不斷強化的成果
便是這把烈火的紅色衝擊。
其雄健魂魄不受任何拘束。","不断强化的成果便是这把
烈火的赤色冲击。
其雄健魂魄不受任何拘束。",,,,,,,,"يتميز الشكل المُحسن للهراوة
الحمراء بالعديد من الترقيات.
لا يمكن ترويضها.",,,,,,,,,,,
2c32f706-a85f-4023-9a55-10f89500f011,507811975,W_Hammer_381_Explain,"火竜の鼓動、深山に木霊して
侵入者を遠ざける。一度踏み
入れば逆鱗に触れ塵芥と化す。","Dwelling deep in the mountains,
keeping intruders at bay. There's
no turning back for all who enter...","Éloigne les intrus de ses
montagnes. Aller sans retour
pour ceux qui y pénètrent.","Sprofondato nella montagna,
tiene a bada gli intrusi.
Se si entra, non si torna.","Ein Haus tief im Gebirge,
das Eindringlinge fernhält.
Für sie gibt es kein Zurück...","Habita en las montañas, y las
protege de los intrusos. Quienes
entren allí no regresarán jamás...","Обитатели горных глубин
зорко стерегут свои земли.
Возврата оттуда нет...","Czyha głęboko w górach
na intruzów. Nie mogą
potem już uciec...",,,"Mora fundo nas montanhas,
afasta todos os intrusos.
quem entra não sai mais.","산속에 울려 침입자를 쫓는
화룡의 고동. 한 발 내디디면
역린에 닿아 티끌이 된다.","火龍的鼓動迴響於深山，
驅逐入侵者。但凡踏入此地者
將觸碰其逆鱗，最終化為塵土。","火龙的心跳，回响于深山，
驱散入侵者。若擅自肆虐，
将触其逆鳞，化为草芥。",,,,,,,,"يسكن في أعماق الجبال،
ويبعد المتسللين. ليس هناك
عودة لكل من يدخل ... ",,,,,,,,,,,
69a9d54f-9b37-405f-bceb-1d3eed4fd9fa,2426025764,W_Hammer_382_Explain,"エスピナスの頭部を豪快に
使用したハンマー。棘竜の
怒りが、何もかもを粉砕する。","A hammer making striking use
of an Espinas head. Thorny
rage smashes everything.","Utilise la tête d'un Espinas.
Sa rage piquante écrase
tout sur son passage.","Martello che sfrutta una
testa di Espinas. La sua
ira spinosa distrugge tutto.","Bemerkenswerte Verwendung
eines Espinas-Kopfs. Dornige
Wut zerschmettert alles.","Un martillo que golpea con la
cabeza de un Espinas. Su ira
punzante lo arrasa todo.","Молот в виде головы
Эспиназа. Шипастая ярость
сокрушает все.","Młot, który robi dobry użytek
z głowy Espinasa. Kłujący
gniew rozbija wszystko.",,,"Martelo que faz um uso
incrível de uma cabeça
de Espinas. Esmaga tudo.","에스피나스의 머리를 사용한
파격적인 해머. 극룡의
분노가 모든 것을 분쇄한다.","豪邁地使用了棘龍頭部
製成的大錘。
棘龍的憤怒將會粉碎萬物。","豪爽地使用棘龙头部制成的
大锤。棘龙之怒，足以粉碎
世间万物。",,,,,,,,"مطرقة تستخدم رأس إسبيناس
بصورة لافتة للنظر.
الغضب الشائك يحطم كل شيء.",,,,,,,,,,,
ada2ddbb-0325-4e70-a01d-755279920708,3029359498,W_Hammer_383_Explain,"エスピナスの頭部を豪快に
使用したハンマー。棘竜の
怒りが、何もかもを粉砕する。","A hammer making striking use
of an Espinas head. Thorny
rage smashes everything.","Utilise la tête d'un Espinas.
Sa rage piquante écrase
tout sur son passage.","Martello che sfrutta una
testa di Espinas. La sua
ira spinosa distrugge tutto.","Bemerkenswerte Verwendung
eines Espinas-Kopfs. Dornige
Wut zerschmettert alles.","Un martillo que golpea con la
cabeza de un Espinas. Su ira
punzante lo arrasa todo.","Молот в виде головы
Эспиназа. Шипастая ярость
сокрушает все.","Młot, który robi dobry użytek
z głowy Espinasa. Kłujący
gniew rozbija wszystko.",,,"Martelo que faz um uso
incrível de uma cabeça
de Espinas. Esmaga tudo.","에스피나스의 머리를 사용한
파격적인 해머. 극룡의
분노가 모든 것을 분쇄한다.","豪邁地使用了棘龍頭部
製成的大錘。
棘龍的憤怒將會粉碎萬物。","豪爽地使用棘龙头部制成的
大锤。棘龙之怒，足以粉碎
世间万物。",,,,,,,,"مطرقة تستخدم رأس إسبيناس
بصورة لافتة للنظر.
الغضب الشائك يحطم كل شيء.",,,,,,,,,,,
3eadbb2c-6823-4e65-b1bc-2e9d2736a0c2,2907806206,W_Hammer_384_Explain,"棘竜の頭部を使用。頭部に
籠められた激しい怒りが、
遮るもの全てを撃砕する。","The horned Espinas skull used to
forge this weapon still retains
memories shrouded in fury.","L'Espinas cornu utilisé pour
forger cette arme garde
des souvenirs teintés de furie.","Arma forgiata con il teschio
con corna di Espinas. Conserva
ancora ricordi furiosi.","Waffe aus dem Schädel eines
gehörnten Espinas, der ein
wütendes Gedächtnis besitzt.","Arma forjada con un cráneo astado
de Espinas, que aún conserva
sus iracundos recuerdos.","Это оружие выковано из рога-
того черепа Эспиназа, храня-
щего яростные воспоминания.","Broń wykuwana z rogatej
czaszki Espinasa. Nadal są w
niej pełne furii wspomnienia.",,,"Crânio chifrudo de Espinas da
arma ainda contém lembranças
cobertas de fúria.","극룡의 머리를 사용. 머리에
담긴 격렬한 분노가 가로막는
모든 것을 격파한다.","使用棘龍的頭部製成。
頭部蘊含激烈怒火，
將擊碎阻礙去路的一切事物。","使用了棘龙的头部。
蕴含于头部的熊熊怒火将
焚尽一切阻碍。",,,,,,,,"لا تزال قرون إسبيناس
المستخدمة لصنع هذا السلاح،
تحتفظ بذكريات يكتنفها الغضب.",,,,,,,,,,,
692803c9-c3f7-41e4-a4e0-519abad351ef,2163439600,W_Hammer_385_Explain,"雪鬼獣の豪快な槌が、加工に
より重量化。ひたすらに重い
一撃で何もかもベチャッッ！！","An enhanced Yeti Hammer.
Be like Goss Harag—
don't think, just smash!","Soyez un Goss Harag ! Moins
de blabla, plus de bobo !
Base : Marteau du yéti","Martello Yeti potenziato.
Fa' come un Goss Harag:
non pensare, attacca!","Verbesserter Yeti-Hammer.
Mach es wie Goss Harag –
erst schlagen, dann fragen!","Martillo de yeti mejorado.
Sé como Goss Harag:
no pienses, ¡destroza!","Улучшенный Молот йети.
Наподобие Госс-Харага,
не думай, просто бей!","Ulepszony młot yeti.
Bądź jak Goss Harag –
nie myśl, po prostu niszcz!",,,"Martelo de Yeti melhorado.
Seja um Goss Harag...
não pense, só esmague!","설귀수의 호쾌한 망치가
가공을 통해 중량화. 더욱
묵직한 일격으로 뭐든지 콱!","雪鬼獸的豪邁大錘，經過加工後
更具分量。反覆揮出沉重一擊，
將所有事物都徹底擊毀！！","雪鬼兽的豪爽大锤，经过加工
变得更加沉重。用顶顶沉重的
一击将所有都——啪叽！",,,,,,,,"مطرقة ييتي مُحسنة.
كُن مثل جوس هراج—
لا تفكر، اسحق فحسب!",,,,,,,,,,,
c711e891-7bfa-4dc8-9ae5-deb04e3e48ef,2327365930,W_Hammer_386_Explain,"雪鬼獣の豪快な槌が、加工に
より重量化。ひたすらに重い
一撃で何もかもベチャッッ！！","An enhanced Yeti Hammer.
Be like Goss Harag—
don't think, just smash!","Soyez un Goss Harag ! Moins
de blabla, plus de bobo !
Base : Marteau du yéti","Martello Yeti potenziato.
Fa' come un Goss Harag:
non pensare, attacca!","Verbesserter Yeti-Hammer.
Mach es wie Goss Harag –
erst schlagen, dann fragen!","Martillo de yeti mejorado.
Sé como Goss Harag:
no pienses, ¡destroza!","Улучшенный Молот йети.
Наподобие Госс-Харага,
не думай, просто бей!","Ulepszony młot yeti.
Bądź jak Goss Harag –
nie myśl, po prostu niszcz!",,,"Martelo de Yeti melhorado.
Seja um Goss Harag...
não pense, só esmague!","설귀수의 호쾌한 망치가
가공을 통해 중량화. 더욱
묵직한 일격으로 뭐든지 콱!","雪鬼獸的豪邁大錘，經過加工後
更具分量。反覆揮出沉重一擊，
將所有事物都徹底擊毀！！","雪鬼兽的豪爽大锤，经过加工
变得更加沉重。用顶顶沉重的
一击将所有都——啪叽！",,,,,,,,"مطرقة ييتي مُحسنة.
كُن مثل جوس هراج—
لا تفكر، اسحق فحسب!",,,,,,,,,,,
0a00dece-0ce4-4fdf-a015-568f406364bc,333367539,W_Hammer_387_Explain,"寒威を増した雪鬼獣の槌。
強大な獲物でも冷気で弱らせて
最期は一思いにゴベチャッ！！","Riding Goss Harag can make
you want to punch like one;
this is the next best thing.","Côtoyer un Goss Harag donne
envie de cogner comme lui.
Succès garanti.","Cavalcare un Goss Harag
invoglia a colpire duro.
Ecco cosa ti serve.","Auf Goss Harag zu reiten,
kann dazu führen, dass du
alles kaputtschlagen willst.","Si te montas en un Goss Harag,
querrás golpear igual que él.
Puedes practicar con esto.","Езда на Госс-Хараге может
придать вам его силы. А тут
и оружие под стать!","Jazda na Goss Haragu sprawia,
że chcesz uderzać jak on.
To coś równie świetnego.",,,"Cavalgar um Goss Harag pode
fazer você querer socar como
um; é a segunda melhor coisa.","한기를 더한 설귀수의 해머.
강한 사냥감도 냉기로 약하게
만들어 단숨에 꽝!","嚴寒之力更增的雪鬼獸之錘。
其寒氣足以削弱強大的魔物，
最後再一鼓作氣發動打擊！！","增强了寒气的雪鬼兽大锤。
寒气甚至能让强大的猎物衰弱，
给与最后一击——啪叽噗！！",,,,,,,,"يمكن أن يجعلك ركوب جوس هراج
ترغب في أن تلكم كواحد
منهم؛ وهو ثاني أفضل شيء.",,,,,,,,,,,
02e8dc72-801f-4414-aa57-80116b279825,1692116921,W_Hammer_388_Explain,"万雷を従えし真の王者がここに
誕生する。王鎚カミナリ強化版
は天地の民が平伏す雷帝の鎚。","The enhanced Usurper's
Thunder. Forces enemies to
bow before the thunder god.","Tous se prosternent face
au dieu de la foudre !
Base : Tonnerre du roi","Potenziamento del tuono
del tiranno. Tutti devono
inchinarsi al dio del tuono.","Verbesserter Thronräuber-
Donner. Zwingt alle zur
Huldigung des Donnergottes.","Rayo del usurpador mejorado.
Obliga al mundo a postrarse
ante el dios del trueno.","Улучшенная Гроза захватчика.
Заставляет врагов склоняться
перед богом грома.","Ulepszony grzmot uzurpatora.
Zmusza wrogów do pokłonu
przed bogiem piorunów.",,,"Trovão do Usurpador melho-
rado. Inimigos, ajoelhem
perante o deus do trovão!","번개를 부리는 진정한 왕이
탄생했다. 천지를 굴복시키는
왕퇴 카미나리의 강화판.","統率萬雷的真正王者誕生於此。
王錘神雷的強化版，
是令天地眾民跪拜的雷帝之錘。","统率万雷的真正王者诞生于此。
王锤神雷的强化版。
是令天地众民跪拜的雷帝之锤。",,,,,,,,"رعد المحتل
المُحسن. يجبر الأعداء على
الانحناء أمام سيد الرعد.",,,,,,,,,,,
cd647432-0497-4fcb-95e4-28f66706bab6,2351078353,W_Hammer_389_Explain,"神を凌駕する力を授ける雷鎚。
天砕く剛撃は、雷雲で空を覆い
この世の終末を予感させる。","A hammer mightier than the gods.
It shatters the heavens and
engulfs the sky in clouds.","D'une puissance divine, il
brise les cieux et gonfle
les nuages dans le ciel.","Martello più potente degli
dei. Frantuma i cieli e
li riempie di nuvole.","Ein Hammer, der mächtiger
als die Götter ist. Er hüllt
den Himmel in Wolken.","Un martillo más poderoso que
los dioses. Sacude los cielos
y los engulle con nubarrones.","Мощь этого молота сильнее
богов и сокрушает небеса,
затягивая их облаками.","Młot silniejszy od bogów.
Rozbija niebiosa i napełnia
je chmurami.",,,"Martelo mais forte que os
deuses. Destrói o paraíso
e cobre o céu de nuvens.","신을 능가할 힘을 받은 해머.
일격은 뇌운으로 하늘을 덮고
세상의 종말을 예감케 한다.","賜予用者凌駕神明之力的雷錘。
擊碎天空的剛擊使雷雲
滿布蒼穹，使人感到末日將至。","雷锤能够带来超越神明之力。
可碎穹苍的重击令天空雷云
密布，预示着世界的终结。",,,,,,,,"مطرقة أقوى من الأسياد.
تحطم السماء وتملؤها
بالغيوم.",,,,,,,,,,,
aba01300-60d3-43e8-b201-dbab5845494c,283683655,W_Hammer_390_Explain,"その鎚を振えば定めて大難を
呼び込むと伝わる厄災の使者。
カラミティーサインの強化版。","An enhanced Calamitous
Portent. It brings disaster
with every swing.","Plus que d'annoncer
le chaos, il le sème.
Base : Augure calamiteux","Potenziamento del prodigio
calamitoso. Ogni fendente è
foriero di catastrofe.","Ein verbessertes Mentekel.
Jeder Hieb führt näher an
den Untergang heran.","Presagio calamitoso
mejorado. Trae el desastre
con cada golpe.","Улучшенный Предвестник
бедствий. Приносит беду
каждым взмахом.","Ulepszony Złowieszczy Omen.
Z każdym zamachem
przynosi katastrofę.",,,"Presságio Calamitoso
melhorado. Traz desastre
em cada golpe.","이 해머를 사용하면 불행이
닥쳐온다고 하는 재앙의 사자.
캘러미티사인의 강화판.","災厄的使者，
傳說揮下此錘必會招致大難。
災厄之徵兆的強化版。","灾厄的使者，
传说挥下此锤必会招致大难。
灾厄之兆的强化版。",,,,,,,,"نذير مشؤوم
مُحسن. تجلب كارثة مع
كل ضربة متأرجحة.",,,,,,,,,,,
