guid,crc?,entry name,Japanese,English,French,Italian,German,Spanish,Russian,Polish,Dutch,Portuguese,PortugueseBr,Korean,TraditionalChinese,SimplifiedChinese,Finnish,Swedish,Danish,Norwegian,Czech,Hungarian,Slovak,Arabic,Turkish,Bulgarian,Greek,Romanian,Thai,Ukrainian,Vietnamese,Indonesian,Fiction,Hindi,LatinAmericanSpanish
4f673e6d-7e30-4ba9-bcd7-2deaa101c9ee,1041111061,W_Hammer_409_Explain,"いくら強化しても割れなかった
エッグハンマー強化版。割れる
時はいつか来るのだろうか。","The unbreakable Egg Hammer's
enhanced form. Surely it has
to break eventually...?","Il finira bien par se
briser... Non ?
Base : Marteau-œuf","Indistruttibile martello
uovo potenziato. Prima
o poi dovrà pur rompersi...","Verbesserter unzerstörbarer
Eierhammer. Wird er
wirklich nie zerbrechen?","Martillo de huevo mejorado.
Tiene que acabar rompiéndose...","Улучшенная форма неразруши-
мого Молота-яйца. Или он все
же когда-нибудь сломается?..","Ulepszona wersja
niezniszczalnego młota jaja.
Pewnie w końcu pęknie...?",,,"Inquebrável: forma melhorada
do Martelovo. Claro que
uma hora vai quebrar...","아무리 강화해도 깨지지 않는
에그해머의 강화판.
과연 언제쯤 깨질 것인가.","卵錘的強化版本，
無論強化多少次都不會碎裂。
到底什麼時候才會碎掉呢？","卵锤的强化版，
无论强化多少次都不会碎裂。
到底什么时候才会碎掉呢。",,,,,,,,"شكل مُحسن لمطرقة البيض غير
القابلة للكسر. ستنكسر في
النهاية بالتأكيد، أليس كذلك؟",,,,,,,,,,,
737f89d5-4ef4-4811-9be5-38bb1c0b9676,3623629307,W_Hammer_410_Explain,"割れる時は来るのか。否、これ
はもはや卵にあらず。天地を
揺るがす丸鳥の鉄槌なり。","Will the egg hatch? No, this
is no longer an egg. This is a
ferocious hammer of the Gargwa.","L'œuf éclora-t-il ? Non,
ce n'est plus un œuf. C'est
un marteau féroce du Gargwa.","L'uovo si schiuderà? No, non
è più un uovo, ma un martello
feroce di Gargwa.","Schlüpft das Ei noch? Nein,
denn das ist kein Ei mehr,
sondern ein Gargwa-Hammer.","Un huevo que nunca eclosionará,
puesto que ya no es un huevo, sino
un poderoso martillo de Gargwa.","Вылупится ли это яйцо?
Нет, это уже не яйцо.
Это яростный молот Гаргвы.","Co się wykluje z jaja?
Nie, to już nie jajo.
To wściekły młot Gargwy.",,,"O ovo vai chocar? Não é mais
um ovo. Um feroz martelo
de Gargwa.","깨질 때는 오는가. 아니,
이것은 더 이상 알이 아니다.
천지를 흔드는 환조의 철퇴이다.","它會裂開嗎？
不，它已不再是一顆蛋，
而是撼動天地的丸鳥鐵錘。","会有破壳而出之日吗？
不，这已不再是蛋，而是
撼动天地的丸鸟铁锤。",,,,,,,,"هل ستفقس البيضة؟ لا،
هذه لم تعد بيضة. هذه مطرقة
جارجوا الكاسرة.",,,,,,,,,,,
0d7933e2-2a47-4453-a13c-42db317bb2de,2469764047,W_Hammer_411_Explain,"闘争を求めて猛りし者よ、我を
求めよ。怒髪鎚は強化によって
鬼神を生み出す鎚と化した。","An enhanced Mane Malice.
This hammer is perfect for
warriors in search of war.","Redoutable entre les mains
de guerriers sanguinaires.
Base : Vile crinière","Criniera nera potenziata.
È l'ideale per i guerrieri
assetati di sangue.","Verbesserte Mähnentücke.
Perfekter Hammer für Krieger
auf der Suche nach Krieg.","Malicia melenuda mejorada.
Perfecta para guerreros
con sed bélica.","Улучшенный Гривастый молот.
Идеально подходит для
воинов, рвущихся в бой.","Lepsza Złośliwość Grzywy.
Idealny młot dla
ruszających na wojnę.",,,"Malícia de Juba aprimorada.
Este martelo é perfeito
para quem busca guerras.","투쟁을 바라는 용맹한 이여.
나를 탐하라. 노발추를 강화해
귀신을 낳는 해머가 되었다.","尋求鬥爭的威猛之人，
來追尋吾吧。怒髮錘經過
強化後，化為創造鬼神的大錘。","追求斗争的猛者啊，寻求吾吧。
怒发锤再经强化，
化作孕育鬼神的大锤。",,,,,,,,"مطرقة مكر العُرف المُحسنة. هذه
المطرقة مثالية للمحاربين
الباحثين عن الحرب.",,,,,,,,,,,
c7dd2018-ed06-49b3-9a69-b0faf223ae12,2939693406,W_Hammer_412_Explain,"怒髪鎚、ここに極まれり。
憤怒に抗わず、猛りに身を任せ
いざ存分に荒れ狂うがいい。","The Mane Malice's final form,
which lets untempered fury
course through the body.","Emplit le corps d'une fureur
incontrôlable.
Base : Vile crinière.","Forma finale della criniera
nera, che fa scorrere un'ira
violenta in tutto il corpo.","Finale Form der Mähnentücke,
die ungezügelte Wut durch
den Körper strömen lässt.","La forma final de la malicia
melenuda cuya furia desatada
se adentra por el cuerpo.","Конечная форма Гривастого
молота. Наполняет тело
необузданной яростью.","Najlepsza wersja Złośliwości
Grzywy. Nieokiełznana furia
kipi w ciele.",,,"Forma final da Malícia de
Juba, fúria descontrolada
corre pelo corpo.","극한의 노발추. 분노를
거스르지 말고 흥분에
몸을 맡겨 마음껏 날뛰어라.","怒髮錘業已登峰造極。
毋須反抗憤怒，
儘管任暴戾擺布，盡情肆虐吧。","怒发锤，登峰造极。
怒火中烧，心生狂暴，尽情地
大闹一场吧。",,,,,,,,"الشكل النهائي لمطرقة مكر
عُرف، والتي تدع الغضب
المبالغ فيه أن يسري في الجسد.",,,,,,,,,,,
589bf3ab-5a7d-448a-a3af-2b5af0d6b5a0,3368047383,W_Hammer_413_Explain,"勇気は大地を烈しく震わし、
恐怖は天を虚しく震わす。
その鎚、終に神をも潰さん。","Courage rocks the earth.
Fear rocks the heavens.
Gods crumble by such blows.","Le courage ébranle la terre.
La peur ébranle les cieux.
Les dieux tombent sous ces coups.","Il coraggio smuove la terra.
La paura smuove i cieli. Gli
dei cadono sotto i suoi colpi.","Mut lässt die Erde erzittern.
Angst den Himmel.
Die Schläge töten Götter.","El coraje sacude la tierra.
El miedo sacude los cielos.
Los dioses sucumben ante él.","Отвага сотрясает землю.
Страх сотрясает небеса. Боги
не выдержат этих ударов.","Odwaga porusza ziemią.
Strach porusza niebem.
Bogowie upadają.",,,"Coragem treme a terra.
Medo treme o céu.
Deuses tombam com os golpes.","용기는 대지를 격하게 흔들고
공포는 하늘을 덧없이 흔든다.
그 해머는 신조차 부수리라.","勇氣使大地劇烈震盪，
恐懼令天空徒然顫動。
此錘終將擊潰諸神。","勇气猛烈地震动大地，
恐怖虚无地撼彻天穹。
此锤终将击溃神祇。",,,,,,,,"تهز الشجاعة الأرض.
يهز الخوف السماء. وتنهار الآلهة
بمثل هذه الضربات.",,,,,,,,,,,
b574fa25-3918-48bb-9c4a-4087d52a4085,2993721620,W_Hammer_414_Explain,"怒りは大地を烈しく震わし、
悲しみは天を虚しく震わす。
その鎚、終に神をも潰さん。","Rage rocks the earth.
Sorrow rocks the heavens.
Gods crumble by such blows.","La colère ébranle la terre.
Le chagrin ébranle les cieux.
Les dieux tombent sous ces coups.","La rabbia smuove la terra.
La tristezza smuove i cieli. Gli
dei cadono sotto i suoi colpi.","Wut lässt die Erde erzittern.
Kummer den Himmel.
Die Schläge töten Götter.","La furia sacude la tierra.
El pesar sacude los cielos.
Los dioses sucumben ante él.","Ярость сотрясает землю.
Грусть сотрясает небеса.
Боги не вынесут этих ударов.","Gniew porusza ziemią.
Smutek porusza niebem.
Bogowie upadają.",,,"Ira treme a terra.
Mágoa treme o céu.
Deuses tombam com os golpes.","분노는 대지를 격하게 흔들고
슬픔은 하늘을 덧없이 흔든다.
그 해머는 신조차 부수리라.","憤怒使大地劇烈震盪，
悲傷令天空徒然顫動。
此錘終將擊潰諸神。","愤怒猛烈地震动大地，
悲哀虚无地撼彻天穹。
此锤终将击溃神祇。",,,,,,,,"يهز الغضب الأرض.
يهز الأسف السماء. وتنهار الآلهة
بمثل هذه الضربات.",,,,,,,,,,,
b060718a-8386-4478-a312-476e06e3d92b,3087484663,W_Hammer_415_Explain,"鋼龍の威光を宿した鋼氷棍の
強化版。かつて古代文明を死滅
させた伝説の寒波を放つ氷鎚。","The Icesteel Hammer's final
form. Unleashed a wave that
wiped out a civilization.","Son blizzard annihila jadis
une civilisation entière.
Base : Marteau inexorable","Forma finale del martello
ghiacciaio. Una sua onda
distrusse un'intera civiltà.","Finale Version des Stahleis-
Hammers. Seine kalte Welle
stürzte eine Zivilisation.","Martillo Acero Helado
finalizado. Lanzó una ola de
frío que arrasó una civilización.","Конечная форма Молота из
ледяной стали, что волной
уничтожил цивилизацию.","Ostateczna wersja młota
lodowej stali. Uwolnił falę,
która zmiotła cywilizację.",,,"Forma final do Martelo
Friaço. Liberou uma onda que
devastou uma civilização.","강룡의 위엄이 깃든 강화판
강빙곤. 고대 문명을 멸망시킨
전설의 한파를 내뿜는 무기.","蘊藏鋼龍威光的鋼冰棍強化版。
此冰錘能放出曾毀滅古代文明的
傳說級寒氣。","势如钢龙的钢冰棍强化版。
传说这把冰锤释放的
寒波曾毁灭过古代文明。",,,,,,,,"الشكل النهائي لمطرقة الفولاذ
الثلجي. أطلق العنان للموجة
التي محت إحدى الحضارات.",,,,,,,,,,,
b7130e8d-aad2-4aa4-ade3-98c7a498fedd,4179178353,W_Hammer_416_Explain,"鋼龍の重厚な威厳を放つ氷鎚。
絶大なる風の力を纏い氷山を
跡形もなく砕く純粋な脅威。","This smooth, alluring beauty
condemns foes to being
sealed in eternal ice.","Ce petit bijou condamne
ses ennemis à un sarcophage
de glace.","Delicata e ammaliante bellezza
che condanna i nemici alla
prigionia nel ghiaccio eterno.","Diese geschmeidige Schönheit
verdammt Feinde ins ewige Eis.","Esta arma de etérea belleza
condena a sus enemigos a una
prisión de hielo eterna.","Эта светлая красота обрекает
врагов на вечный плен
во льдах.","Gładkie, urzekające cudo
skazuje wrogów na wieczność
w lodowym więzieniu.",,,"Esta beleza suave e sedutora
condena os inimigos ao
gelo eterno.","강룡의 위엄을 내뿜는 해머.
절대적인 바람의 힘을 두르고
빙산을 흔적도 없이 파괴한다.","附有鋼龍強勁氣場的冰錘。
強大的風之力包覆此錘，危險得
可將冰山粉碎，不留痕跡。","钢龙散发威严庄重气息的冰锤。
带着强劲的风力，威力可令冰
山粉碎殆尽，是十足的威胁。",,,,,,,,"هذا الجمال السلس والمغري
يحكم على الأعداء بأن يكونوا 
محجوزين في الجليد الأبدي.",,,,,,,,,,,
b8187854-0628-4e93-9bff-d638cba97087,2872876903,W_Hammer_417_Explain,"壊鎚の極地と謳われる強化形態
テオ＝クラテル。無敵の要塞を
一振りで壊滅させたという。","An enhanced Teostra
Cratermaker. Has decimated
entire kingdoms.","Il a décimé des
royaumes entiers.
Base : Cratère Teostra","Teocraterizzatore
potenziato. Ha decimato
i popoli di interi reami.","Ein verbesserter Teostra-
Kratermacher. Königreiche
zerfielen vor ihm zu Staub.","Creacráteres Teostra mejorado.
Ha diezmado reinos enteros.","Улучшенный Творец кратеров
Теостры. Уничтожает
целые королевства.","Ulepszony Kratermłot
Teostry. Zdziesiątkował
całe królestwa.",,,"Faz-crateras de Teostra
melhorado. Dizimou
reinos inteiros.","해머의 끝이라 불리는 강화형
테오크라테르. 무적의 요새를
단번에 괴멸시켰다고 한다.","強化型態的炎王火口，被譽為
毀滅之錘的巔峰之作。據說
揮舞一下即可摧毀無敵的要塞。","强化形态的炎王火山口，
被誉为毁灭之锤的巅峰之作。
据说一挥即可摧毁无敌的要塞。",,,,,,,,"صانع حفر تيوسترا
المُحسن. لقد أهلك ممالك
بأسرها.",,,,,,,,,,,
24b74377-e850-4f4d-8c24-91d47a9a1558,1603862146,W_Hammer_418_Explain,"壊鎚の極地は、更なる進化を
遂げた。塔に喩えられた巨鎚の
一撃が世界を破滅に導く。","As tall as a tower, this
lofty Cratermaker evolution
pummels the earth to dust.","Aussi haut qu'une tour,
ce grand creuse-cratère
réduit la terre en poussière.","Alto come una torre, questo
teocraterizzatore evoluto
riduce la terra in cenere.","Die Weiterentwicklung dieses
stolzen Kratermachers zer-
malmt die Erde zu Staub.","Creacráteres mejorado,
tan alto como una torre.
Pulveriza la tierra.","Высокий, как башня, Творец
кратеров. Сравняет с землей
всех и вся.","Wysoki jak wieża, ten
wzniosły Kratermłot
miażdży ziemię na proch.",,,"Alto como uma torre, esta
evolução Faz-crateras
transforma terra em pó.","해머의 끝이 한층 진화했다.
탑에 버금가는 해머의 일격이
세계를 파멸로 이끈다.","毀滅之錘的極限獲得了更進一步
的進化。被形容為高塔的巨錘，
轟出的一擊將使世界走向毀滅。","进一步改进的毁灭之锤。
被喻为巨城的巨锤，只需一击
就能毁天灭地。",,,,,,,,"ارتفاعه كالبرج، يحول التطور
النبيل لصانع الحفر النبيل
الأرض إلى غبار منثور.",,,,,,,,,,,
2bea3a33-9b64-410b-91aa-ca8541014d34,4252397698,W_Hammer_419_Explain,"魔神鎚エクスパンド強化版。
極めて高い致死性を持つ毒液を
一撃と共に散布する悪魔の鎚。","An enhanced Genie's
Expanse. Combines powerful
poison with crippling blows.","Ses coups dévastateurs sont
aussi empoisonnés.
Base : Heurtoir de génie","Distesa del genio potenziata
che fonde un potente veleno
con attacchi paralizzanti.","Bessere Version von Dschinns
Ausdehnung. Bietet starkes
Gift und lähmende Schläge.","Extensión del genio mejorado
que combina un fuerte veneno
y unos golpes atroces.","Улучшенное Пространство
джинна. Сочетает сильный яд
и сокрушительные удары.","Ulepszony Bezmiar Dżina.
Potężną truciznę uzupełniają
paraliżujące ciosy.",,,"Extensão de Gênio melhorada.
Combina um veneno poderoso
com golpes devastadores.","마신추 익스펀드의 강화판.
치사율이 높은 독을 공격과
동시에 살포하는 악마의 해머.","魔神錘擴散的強化版。
這把惡魔之錘擊出之時，
將噴發出極為致命的毒液。","扩张之魔神锤的强化版。
这把恶魔之锤击出之时，
将喷发出极为致命的毒液。",,,,,,,,"امتداد جيني
مُحسن. يجمع بين السم القوي
والضربات المدمرة.",,,,,,,,,,,
7d992226-01d9-4ef3-98fd-d4a31aca8c79,3132201761,W_Hammer_420_Explain,"大いなる一撃は毒の霞と共に
泰然と命を奪う。夢幻の如き
霊妙な所業、これぞ神の鉄鎚。","With eerie calm, life is
extinguished by this toxic
hammer of the gods.","Dans un calme inquiétant,
la vie est éteinte par ce
marteau toxique des dieux.","Con calma inquietante,
questo martello tossico
degli dei spegne ogni vita.","Mit unheimlicher Ruhe löscht
dieser giftige Götterhammer
jedes Leben aus.","Este tóxico martillo de los
dioses apaga vidas con
espeluznante calma.","Ядовитый молот богов.
Оставляет после себя
лишь безжизненную пустыню.","W dziwnej ciszy
ten trujący młot
bogów dławi życie.",,,"Com uma calma sinistra, a
vida é extinta por este
martelo tóxico dos deuses.","큰 일격은 독안개와 함께 태연
하게 목숨을 빼앗는다. 이것이
몽환처럼 영묘한 신의 해머.","偉大的一擊與劇毒之霧，將從容
奪去獵物的性命。那宛如幻夢般
奇妙的攻擊，正是神之鐵錘。","随毒烟而来的强力一击从容地夺
走生命。巧妙的动作如梦似幻，
这正是神之铁锤。",,,,,,,,"تنطفئ الحياة بهدوء
غريب بمطرقة
الآلهة السامة.",,,,,,,,,,,
36a4f7de-2815-4877-bf04-995d13de7027,2216976777,W_Hammer_421_Explain,"その衝撃は隕石の如く、天より
墜ちて大地を穿つ。生命を根絶
させる危険性を宿す脅威の鎚。","This hammer's shock force
hits like a meteorite,
causing catastrophic damage.","Chacun de ses impacts a la
force d'une météorite.
Base : Foreuse rayonnante","Questo martello colpisce
con la forza catastrofica
di un meteorite.","Die Schockwucht des Hammers
schlägt zu wie ein Meteorit,
mit katastrophalen Folgen.","La fuerza de choque de este
martillo golpea como un
meteorito devastador.","Молот такой силы, что
бьет как метеорит, вызывая
критические повреждения.","Szokująca moc młota spada
jak meteoryt, powodując
katastrofalne obrażenia.",,,"O impacto deste martelo é
como um meteorito.
Causa danos catastróficos.","그 충격은 운석처럼 하늘에서
떨어져 대지를 뚫는다. 생명을
절멸시킬 위험성을 지닌 해머.","其衝擊有如隕石般從天而降，
貫穿大地。極具威脅性的錘，
能使萬物面臨滅亡的危機。","它的冲击如同陨石，从天而降，
将大地击穿。这危险的锤
拥有灭绝生命的恐怖能量。",,,,,,,,"تضرب القوة الصادمة لهذه
المطرقة مثل الحجر النيزكي؛
مما يسبب أضرارًا كارثية.",,,,,,,,,,,
33c9c975-8e16-4451-8fbb-a3a471f39a81,1451438258,W_Hammer_422_Explain,"異形の者の髑髏を象った禍々
しい槌。隠された魔眼は永劫の
時を経ても開くことはない。","An ominous Hammer adorned
with a menacing skull. The
hidden eye shall never open.","Un marteau inquiétant orné d'un
crâne menaçant. L'œil caché ne doit
jamais s'ouvrir.","Un inquietante martello adornato
da un teschio minaccioso. L'occhio
celato non dovrà mai aprirsi.","Ein unheilvoller Hammer
mit bedrohlichem Schädel.
Das versteckte Auge schläft.","Un intimidante martillo adornado
con una amenazadora calavera.
El ojo oculto nunca se abrirá.","Зловещий молот, украшенный
зловещим черепом. Скрытый
глаз не откроется.","Złowieszczy młot ozdobiony
groźną czaszką. Ukryte oko
nigdy się nie otworzy.",,,"Um martelo nefasto enfeitado
c/ uma caveira ameaçadora. O
olho oculto não deve se abrir.","이형의 해골을 본뜬 불길한
해머. 숨겨진 마안은 영겁의
시간이 지나도 열리지 않는다.","仿照異形頭骨打造而成的
不祥大錘。隱藏起來的魔眼
無論經過多長歲月都不會睜開。","仿造异形者的骷髅制成的
不祥大锤。隐藏的魔眼将
永远紧闭。",,,,,,,,"مطرقة مشؤومة مزينة
بجمجمة مهددة. لن
تُفتح العين الخفية أبدًا.",,,,,,,,,,,
9df0a561-16ed-43cc-a85b-6c9aafe9076d,191850413,W_Hammer_423_Explain,"異形の者の髑髏を象った禍々
しい槌。隠された魔眼は永劫の
時を経ても開くことはない。","An ominous Hammer adorned
with a menacing skull. The
hidden eye shall never open.","Un marteau inquiétant orné d'un
crâne menaçant. L'œil caché ne doit
jamais s'ouvrir.","Un inquietante martello adornato
da un teschio minaccioso. L'occhio
celato non dovrà mai aprirsi.","Ein unheilvoller Hammer
mit bedrohlichem Schädel.
Das versteckte Auge schläft.","Un intimidante martillo adornado
con una amenazadora calavera.
El ojo oculto nunca se abrirá.","Зловещий молот, украшенный
зловещим черепом. Скрытый
глаз не откроется.","Złowieszczy młot ozdobiony
groźną czaszką. Ukryte oko
nigdy się nie otworzy.",,,"Um martelo nefasto enfeitado
c/ uma caveira ameaçadora. O
olho oculto não deve se abrir.","이형의 해골을 본뜬 불길한
해머. 숨겨진 마안은 영겁의
시간이 지나도 열리지 않는다.","仿照異形頭骨打造而成的
不祥大錘。隱藏起來的魔眼
無論經過多長歲月都不會睜開。","仿造异形者的骷髅制成的
不祥大锤。隐藏的魔眼将
永远紧闭。",,,,,,,,"مطرقة مشؤومة مزينة
بجمجمة مهددة. لن
تُفتح العين الخفية أبدًا.",,,,,,,,,,,
5eeb3399-42f7-4309-9357-fc0bad7a6b8e,3919955546,W_Hammer_424_Explain,"常世の輪廻を司る漆黒の槌。
禁断の魔眼が開かれる時、
世界は虚無への回帰を始める。","A hammer said to control time.
It casts a shadow that'll plunge
the world into nothingness.","Marteau contrôlant le temps.
Son ombre plongera
le monde dans le néant.","Martello che controlla il tempo.
Genera un'ombra che sprofonderà
il mondo nel vuoto assoluto.","Ein Hammer, der die Zeit
beherrscht. Wirft Schatten,
der die Welt ins Nichts stürzt.","Dicen que controla el tiempo.
Proyecta una sombra que sume
al mundo en la nada.","Говорят, этот молот
управляет временем, а тень
его погрузит мир в небытие.","Młot, który ponoć kontroluje
czas. Rzuca cień, który
zatopi świat w nicości.",,,"Martelo que controla o tempo.
Lança sombra que tornará
o mundo em nada.","영원한 윤회를 관장하는 검은
해머. 금단의 마안이 열리면
세계는 허무로 회귀한다.","支配黃泉輪迴的漆黑之錘。
當禁忌魔眼睜開之時，
世界將會回歸虛無。","执掌尘世轮回的漆黑之锤。
禁忌的魔眼睁开，世界开始
回归虚无。",,,,,,,,"يُقال إن المطرقة تتحكم في الوقت.
تغمر العالم بظلالها
الذي تغرقه في العدم.",,,,,,,,,,,
3215162c-b035-4205-ab02-8de3c3c69438,4224447935,W_Hammer_425_Explain,"天廻龍の素材から精製した巨石
を利用した槌。石を掴む鋭爪は
永劫の時を経ても開かない。","A Hammer whose head is pure
Shagaru Magala material. The
claw holding it never opens.","Marteau muni d'une tête en
Shagaru Magala. Les griffes
ne s'ouvrent jamais.","La testa è in puro Shagaru Magala.
L'artiglio la stringerà in eterno.","Der Kopf ist aus reinem
Shagaru-Magala-Material.
Die Klaue öffnet sich nie.","Martillo cuya cabeza está hecha
de puro Shagaru Magala.
Su garra no se abre.","Молот, чье навершие из
Шагару Магалы. Коготь, что
держит его, не разожмется.","Młot z obuchem z Shagaru
Magali. Trzymające go szpony
nigdy nie zwalniają uścisku.",,,"A cabeça desse martelo é puro
material de Shagaru Magala.
Sua garra nunca se abre.","천회룡의 소재에서 정제한
돌로 만든 해머. 발톱은 돌을
쥔 채 영원히 놓지 않는다.","以天迴龍素材精製出的巨石
製成的大錘。緊握巨石的利爪
無論經過多長歲月都不會睜開。","这把大锤使用了天廻龙素材
精制出的巨石。利爪将永远
紧抓巨石。",,,,,,,,"مطرقة رأسها مصنوع من
مادة شاجارو ماجالا الخالصة.
المخلب الذي يمسكها لا يتركها أبدًا.",,,,,,,,,,,
2cd3dd51-294b-4df6-96a1-70a86bb2e403,2992132027,W_Hammer_426_Explain,"天廻龍から賜りし美しき巨石を
用いた金色の槌。鋭爪は終焉、
玉石は誕生をもたらす。","The golden claws represent
the end of all things, and
the massive stone, rebirth.","Griffes dorées symbolisant
la fin de tout, et la renaissance
de ce gros caillou.","Gli artigli d'oro rappresentano
la fine di tutto. L'enorme
pietra, invece, la rinascita.","Die goldenen Klauen stellen
das Ende aller Dinge dar.
Der Stein steht für Neugeburt.","Su garra dorada representa
el fin de la existencia, y su
enorme piedra, el renacer.","Золотые когти символизируют
конец всего и перерождение.","Złote szpony to symbol
końca wszystkiego, a wielki
kamień – odrodzenia.",,,"As garras douradas repre-
sentam o fim de tudo, e a
pedra imensa, renascimento.","천회룡이 준 아름다운 돌을
사용한 금빛 해머. 발톱은
종언, 돌은 탄생을 가져온다.","以天迴龍賜予的美麗巨石
製成的金色大錘，利爪將帶來
終焉，玉石則帶來新生。","这把金色大锤配有天廻龙赐予的
美丽巨石。利爪带来终结，玉石
则带来新生。",,,,,,,,"تمثل المخالب الذهبية
نهاية كل شيء، وولادة جديدة للحجر
الهائل.",,,,,,,,,,,
