guid,crc?,entry name,Japanese,English,French,Italian,German,Spanish,Russian,Polish,Dutch,Portuguese,PortugueseBr,Korean,TraditionalChinese,SimplifiedChinese,Finnish,Swedish,Danish,Norwegian,Czech,Hungarian,Slovak,Arabic,Turkish,Bulgarian,Greek,Romanian,Thai,Ukrainian,Vietnamese,Indonesian,Fiction,Hindi,LatinAmericanSpanish
0c8983ab-464f-4168-9964-e7ad5f27b951,1199172198,W_Hammer_300_Explain,"この鎚に潰された獲物は骨一つ
残さず闇に溶ける。カムラの
里の職人が生んだまさに傑作。","A true Kamura masterpiece.
It's lights out for anything
that gets struck by this.","Un chef-d'œuvre de Kamura.
C'est la mort assurée pour
ses victimes.","Capolavoro dell'artigianato
di Kamura. Non lascia scampo
a niente e nessuno.","Ein echtes Meisterstück aus
Kamura. Wo er aufschlägt,
wächst kein Gras mehr.","Una verdadera obra maestra.
Es el fin de cuanto reciba
uno de sus golpes.","Настоящий шедевр из деревни
Камура. Смертоносен для
всех, кого поражает.","Arcydzieło z Kamury.
Rozbłyska przy każdym
uderzeniu w cel.",,,"Uma obra-prima de Kamura.
Ele apaga qualquer coisa
que cruze seu caminho.","해머에 깔린 사냥감은 뼛조각
하나 남기지 않는다. 카무라
마을의 장인이 만들어낸 걸작.","遭此錘擊中的獵物將屍骨無存，
淹沒在黑暗當中。
神火村工匠打造而成的傑作。","此锤砸扁的猎物会归于黑暗，
不留半点尸骸。村中工匠的
巧手杰作。",,,,,,,,"تحفة فنية حقيقية من كامورا.
تقتل أي شيء تصطدم
به.",,,,,,,,,,,
d318e9e7-53d4-45a3-ad33-a06b09538206,1923368958,W_Hammer_301_Explain,"この鎚に潰された獲物は骨一つ
残さず闇に溶ける。カムラの
里の職人が生んだまさに傑作。","A true Kamura masterpiece.
It's lights out for anything
that gets struck by this.","Un chef-d'œuvre de Kamura.
C'est la mort assurée pour
ses victimes.","Capolavoro dell'artigianato
di Kamura. Non lascia scampo
a niente e nessuno.","Ein echtes Meisterstück aus
Kamura. Wo er aufschlägt,
wächst kein Gras mehr.","Una verdadera obra maestra.
Es el fin de cuanto reciba
uno de sus golpes.","Настоящий шедевр из деревни
Камура. Смертоносен для
всех, кого поражает.","Arcydzieło z Kamury.
Rozbłyska przy każdym
uderzeniu w cel.",,,"Uma obra-prima de Kamura.
Ele apaga qualquer coisa
que cruze seu caminho.","해머에 깔린 사냥감은 뼛조각
하나 남기지 않는다. 카무라
마을의 장인이 만들어낸 걸작.","遭此錘擊中的獵物將屍骨無存，
淹沒在黑暗當中。
神火村工匠打造而成的傑作。","此锤砸扁的猎物会归于黑暗，
不留半点尸骸。
村中工匠的巧手杰作。",,,,,,,,"تحفة فنية حقيقية من كامورا.
تقتل أي شيء تصطدم
به.",,,,,,,,,,,
91bb6b61-a386-4679-a67f-d0e2c658658c,4204584558,W_Hammer_302_Explain,"猛き炎と呼ばれる英雄のために
里の思いが詰め込まれた鎚。
全ての災禍を残さず叩き潰す。","Made for the ""Saving Flame
of Kamura,"" a hammer to
stomp out all calamity.","Conçu pour la Flamme salvatrice
de Kamura, ce marteau vise à
écraser toutes les calamités.","Martello creato per la
""fiamma salvifica di Kamura"".
Pone fine a ogni calamità.","Ein Hammer für die Rettende
Flamme Kamuras, der alles
Unglück zermalmt.","Hecho para la ""Llama salvadora
de Kamura"", y destinado
a erradicar la maldad.","Создан для ""Спасительного
пламени Камуры"". Этот молот
сокрушит любое бедствие.","Wykonany dla „Zbawczego
Płomienia Kamury”. Ten młot
odstraszy każdy kataklizm.",,,"Feito para ""Chama Salvadora
de Kamura"", martelo que
esmaga toda calamidade.","맹렬한 불꽃 같은 영웅을 위해
마을의 마음을 담은 해머.
재앙을 남김없이 물리친다.","為了擁有烈火之名的英雄而製，
注入了村莊思念的大錘。
它將徹底擊碎所有災禍。","为了号称烈焰的英雄而制成
的锤，倾注了全村的心意。
将一切灾祸都锤得四分五裂。",,,,,,,,"مطرقة صنعت من أجل ""إنقاذ
شعلة كامورا""، وهدفها القضاء
على كل الكوارث.",,,,,,,,,,,
ebfd84a5-60d6-4c44-90e5-f93cbd30f37e,3659120455,W_Hammer_303_Explain,"爵銀龍の鎚。殺傷力を高める
ために先端が尖っており、
獲物を骨の髄まで砕き散らす。","A Malzeno hammer, made more
lethal through a tapered tip that
crushes to the marrow.","Marteau Malzeno, sa pointe
plus léthale broie l'os
jusqu'à la moelle.","Martello di Malzeno, reso più
letale dalla punta affusolata
che distrugge fino al midollo.","Ein Malzeno-Hammer mit
tödlicher Spitze, die bis
ins Mark dringt.","Martillo de Malzeno con una
punta más afilada y más letal,
que se clava hasta la médula.","Молот Малзено. Его
заостренный край с легкостью
пробивает кости.","Młot z Malzeno ze stożkowym
końcem jest jeszcze
bardziej niebezpieczny.",,,"Martelo Malzeno, mais letal
com a ponta fina que esmaga
até o tutano.","은작룡의 해머. 살상력을
높이기 위해 끝이 뾰족하며
사냥감의 뼈를 으스러뜨린다.","爵銀龍之錘。為了提高殺傷力，
末端做成了尖銳的形狀，能將
獵物從血肉至骨髓完全粉碎。","爵银龙之锤。为提高杀伤力，
前端做得十分尖锐，甚至可以
将猎物的骨髓都打得稀烂。",,,,,,,,"مطرقة مالزينو، صنعت لتكون
أكثر فتكًا بطرفها المدبب
الذي يسحق الضحية حتى النخاع.",,,,,,,,,,,
80ac636c-ce2e-4e97-8c38-1fb2734f2115,1470984572,W_Hammer_304_Explain,"脅威の殺傷力を持つ鎚。
獲物がいくら泣き喚こうが、
振り下ろす手は止まらない。","A hammer of menacing lethality.
Keep bringing the pain, no
matter how much they scream.","Marteau très menaçant.
Assène des coups malgré
les cris de douleur.","Martello dalla temibile
letalità. Per quanto si urli,
continua a dispensare dolore.","Ein unglaublich tödlicher
Hammer. Füge weiter Schmerzen
zu, egal, wie die Opfer schreien.","Martillo que deja patente su
letalidad. Tú sigue golpeando,
por mucho que bramen.","Этот невероятно смертоносный
молот не знает пощады.","Wyjątkowo niebezpieczny
młot. Zadaje ogromne ilości
bólu wrogom.",,,"Martelo ameaçadoramente
letal. Não para de ferir,
mesmo com todos os gritos.","위협적인 살상력의 해머.
사냥감이 아무리 울부짖어도
내리치는 손은 멈추지 않는다.","具備極高殺傷力的大錘。
無論獵物如何哀號，
揮動大錘的手臂也不會停止。","此锤的杀伤力极为危险。
无论猎物如何哭号，挥下
巨锤的手都不会停住。",,,,,,,,"مطرقة ذات خطورة مميتة.
تظل تسبب الألم، غير
مبالية بصراخ الأعداء.",,,,,,,,,,,
a2d930de-2510-4243-9dba-3618fa450676,3184768142,W_Hammer_305_Explain,"宵月の導きにより雅なる鎚は
妄執を払う現世の光となる。
狐鎚ツキヲイザナイ強化型。","The Purity Hammer's enhanced
form is a guiding light for
a world lost in darkness.","Incarne la lueur qui guide
et perce les ténèbres.
Base : Marteau de pureté","Potenziamento del martello
di purezza. Luce guida per i
mondi persi nel buio.","Stärkerer Reinheitshammer.
Ein Licht, das der Welt den
Weg aus dem Dunkel zeigt.","Martillo de pureza mejorado.
Sirve de faro para un mundo
sumido en la oscuridad.","Улучшенная форма Молота
чистоты — путеводный свет в
мире, потерянном во мраке.","Ulepszony Młot Czystości
jest światłem przewodnim
dla świata w ciemności.",,,"Martelo da Pureza melhorado.
Traz luz a um mundo
perdido na escuridão.","초저녁 달을 따라 그 해머는
망집을 정화해 현세에 빛나리.
츠키오이자나이의 강화형.","遵循新月的指引，風雅大錘
化為驅散妄執的現世之光。
狐錘月落棄塵世的強化型。","遵循新月的指引，风雅大锤
化为驱散妄执的现世之光。
狐锤【玉落弃尘世】强化型。",,,,,,,,"يُعد الشكل المُحسن لمطرقة
النقاء هو الضوء الذي يهدي
إلى لعالم الضائع في الظلام.",,,,,,,,,,,
cca5e274-0321-45a5-85e6-1823ae005f76,3928338257,W_Hammer_306_Explain,"愛し君が世に迷わぬよう、我、
光明の鎚高く掲げ、照らさん。
願わくは生々世々に灯れ。","Burn forevermore, my friend!
May loved ones ne'er be
lost with such a beacon!","Brûle à jamais, mon ami !
Que les êtres chers illuminent
le chemin d'un tel flambeau !","Brucia in eterno, mio fedele
amico. Che il faro guidi per
sempre i nostri cari.","Brenne ewig, mein Freund!
Mögen Geliebte niemals in
solch einem Feuer vergehen!","¡Arde eternamente, amigo mío!
¡Guía a tus seres queridos
actuando como un faro sin igual!","Гори вечно, мой друг!
Будь путеводной звездой
для родных и близких!","Płoń na wieki, przyjacielu!
Oby ukochani nigdy nie
zginęli z tą światłością!",,,"Queime para sempre, amigo!
Que os seres amados nunca
se percam com tal farol!","사랑하는 그대가 헤매지 않게
광명의 해머로 비추리라.
부디 영원히 비추소서.","為使深愛之人永不迷惘，
我將高舉光明之錘指引明路。
願光芒照耀你生生世世。","为心爱之人不在世间迷路，我将
高举光明之锤，照亮前路。
愿生生世世永明。",,,,,,,,"تحترق إلى الأبد يا صديقي!
أدعو ألا يضيع الأحباء
بمثل هذه المنارة!",,,,,,,,,,,
a1b7dcae-982b-4d5f-be3e-7a2310cd2dc8,3694335893,W_Hammer_307_Explain,"愛し君が世に迷わぬよう、我、
光明の鎚高く掲げ、照らさん。
願わくは生々世々に灯れ。","Burn forevermore, my friend!
May loved ones ne'er be
lost with such a beacon!","Brûle à jamais, mon ami !
Que les êtres chers illuminent
le chemin d'un tel flambeau !","Brucia in eterno, mio fedele
amico. Che il faro guidi per
sempre i nostri cari.","Brenne ewig, mein Freund!
Mögen Geliebte niemals in
solch einem Feuer vergehen!","¡Arde eternamente, amigo mío!
¡Guía a tus seres queridos
actuando como un faro sin igual!","Гори вечно, мой друг!
Будь путеводной звездой
для родных и близких!","Płoń na wieki, przyjacielu!
Oby ukochani nigdy nie
zginęli z tą światłością!",,,"Queime para sempre, amigo!
Que os seres amados nunca
se percam com tal farol!","사랑하는 그대가 헤매지 않게
광명의 해머로 비추리라.
부디 영원히 비추소서.","為使深愛之人永不迷惘，
我將高舉光明之錘指引明路。
願光芒照耀你生生世世。","为心爱之人不在世间迷路，我将
高举光明之锤，照亮前路。
愿生生世世永明。",,,,,,,,"تحترق إلى الأبد يا صديقي!
أدعو ألا يضيع الأحباء
بمثل هذه المنارة!",,,,,,,,,,,
4858e284-8851-4b5c-af52-2d05c028c4bc,592555730,W_Hammer_308_Explain,"古の退魔師は己が鎚に御霊を
籠めた。打ち候え、焔を纏う
白魂が大地の穢れを払い除く。","The pure chunk of spiritual
energy beats enemies until
they are purified or paste.","Cette masse d'énergie
spirituelle frappe les ennemis
jusqu'à purification ou trépas.","Un frammento di pura energia
che colpisce il nemico fino
a purificarlo o spezzarlo.","Dieser Brocken pure spiritu-
elle Energie läutert Feinde
oder schlägt sie zu Brei.","Un auténtico pedazo de energía
espiritual que, o purifica a sus
enemigos, o los hace trizas.","Чистый сгусток духовной
энергии либо очищает,
либо уничтожает.","Czysta doza duchowej energii
atakuje wrogów aż do
oczyszczenia lub zmiażdżenia.",,,"O puro naco de energia
espiritual surra o inimigo
até purificá-lo ou detoná-lo.","옛 퇴마사는 자신의 해머에
영혼을 담았다. 불꽃을 두른
백귀가 대지를 정화한다.","遠古驅魔師將自身靈魂封入
此錘。敲擊此錘吧，散發火焰
的白魂將會驅除大地的邪穢。","古时的除魔师将灵魂放入自己的
锤中。击打吧，带着火焰的白魂
将祛除大地的污秽。",,,,,,,,"قطعة نقية من الطاقة
الروحية تهزم الأعداء
حتى تتم تنقيتهم أو إبادتهم.",,,,,,,,,,,
8cbfae7c-3054-4cf1-b3fd-94608c4c37f8,2820384931,W_Hammer_309_Explain,"バインドバウンド強化型。
麻痺液の濃度を飛躍的に高めた
凶悪極まりない大鎚。","Binding Bludgeon's enhanced
form. Its paralytic agent is
even more concentrated.","Son agent actif est encore
plus concentré.
Base : Matraque paralysante","Clava paralizzante
potenziata con un agente
tossico più concentrato.","Ein verbesserter Bindungs-
knüppel mit noch konzen-
trierterem Lähmungsgift.","Cachiporra cegadora mejorada
cuyo líquido paralizante está
aún más concentrado.","Улучшенная форма Связующей
палицы. Ее парализующий
агент более насыщенный.","Ulepszona wiążąca pałka.
Jej środek paraliżujący
ma większe stężenie.",,,"Espancador Paralisante
aprimorado. Sua paralisia
está ainda mais concentrada.","강화형 바인드바운드.
마비액의 농도를 비약적으로
높인 극악무도한 해머.","束縛之力的強化型。
麻痺液濃度獲得了飛躍性提升，
性能極為凶惡的大錘。","束缚之力的强化型。
此款大锤极为凶恶，
麻痹液浓度飞跃性提升。",,,,,,,,"الشكل المُحسَّن من النبوت
المقيد. تُعد المادة المسببة
للشلل فيه أكثر تركيزًا.",,,,,,,,,,,
a80808b1-f150-481b-a0f1-a25ac5071257,4155602612,W_Hammer_310_Explain,"破壊力と麻痺毒を格段に強化。
この大鎚に狙われた獲物は
瞬時に地に伏せる事になる。","All prey crumbles in a flash
with this hammer's redoubled
destruction and paralysis.","Les proies tombent en un
clin d'œil sous ses coups redoublés
de destruction et de paralysie.","Martello in grado di
distruggere e paralizzare
le prede in un lampo.","Alle Beute zerbröckelt blitz-
schnell an verdoppelter
Zerstörung und Lähmung.","Con su redoblado poder destructor
y paralizante, sus víctimas se
desmoronan en un destello","Этот молот в два раза мощнее
и парализует в два раза
сильнее. У врага нет шансов.","Wszyscy wrogowie giną w
mgnieniu oka pod tym młotem
zniszczenia i paraliżu.",,,"Toda presa é esmigalhada com
a destruição e paralisia
redobrada deste martelo.","파괴력과 마비독이 대폭 강화.
이 해머의 표적이 된 사냥감은
순식간에 쓰러진다.","破壞力與麻痺毒素獲大幅強化。
被此大錘盯上的獵物
將在須臾之間倒下。","破坏力和麻痹毒被大幅强化。
此大锤瞄准的猎物将会瞬间
倒地不起。",,,,,,,,"تنهار كل الفرائس في لحظة
بتأثير هذه المطرقة المضاعف،
وقدرتها على إحداث الشلل.",,,,,,,,,,,
c229d232-da21-4a98-ba48-0abf9ad5830e,1627553034,W_Hammer_311_Explain,"破壊力と麻痺毒を格段に強化。
この大鎚に狙われた獲物は
瞬時に地に伏せる事になる。","All prey crumbles in a flash
with this hammer's redoubled
destruction and paralysis.","Les proies tombent en un
clin d'œil sous ses coups redoublés
de destruction et de paralysie.","Martello in grado di
distruggere e paralizzare
le prede in un lampo.","Alle Beute zerbröckelt blitz-
schnell an verdoppelter
Zerstörung und Lähmung.","Con su redoblado poder destructor
y paralizante, sus víctimas se
desmoronan en un destello","Этот молот в два раза мощнее
и парализует в два раза
сильнее. У врага нет шансов.","Wszyscy wrogowie giną w
mgnieniu oka pod tym młotem
zniszczenia i paraliżu.",,,"Toda presa é esmigalhada com
a destruição e paralisia
deste martelo redobrado.","파괴력과 마비독이 대폭 강화.
이 해머의 표적이 된 사냥감은
순식간에 쓰러진다.","破壞力與麻痺毒素獲大幅強化。
被此大錘盯上的獵物
將在須臾之間倒下。","破坏力和麻痹毒被大幅强化。
此大锤瞄准的猎物将会瞬间
倒地不起。",,,,,,,,"تنهار كل الفرائس في لحظة
بتأثير هذه المطرقة المضاعف،
وقدرتها على إحداث الشلل.",,,,,,,,,,,
7518062f-aa0c-47df-a499-d87007dbb4aa,1476075146,W_Hammer_312_Explain,"硬質な素材を用いて、破壊力に
磨きをかけた泥翁竜の剛鎚。
静寂を打ち砕く、圧倒的威力。","An enhanced Almudron hammer.
Can break any silence with
its overwhelming power.","Peut briser même le néant
avec sa force titanesque.
Base : Marteau Almudron","Potenziamento del martello
Almudron. Un potere tale da
spezzare anche il silenzio.","Ein stärkerer Almudron-
Hammer. Kann krachend
jede Stille zerschlagen.","Martillo Almudron mejorado.
Rompe el silencio con su poder
abrumador.","Улучшенный молот Алмудрона.
Нарушает любое безмолвие
своей подавляющей мощью.","Ulepszony młot Almudrona.
Potrafi zmącić ciszę swoją
przytłaczającą mocą.",,,"Martelo Almudron melhorado.
Quebra qualquer silêncio
com seu poder abissal.","단단한 소재로 파괴력을 높인
이옹룡의 해머. 정적을
깨는 압도적인 위력.","使用堅硬素材，使破壞力
更加提升的泥翁龍硬錘。
壓倒性的威力能打破寂靜。","使用坚硬的素材，
增强了破坏力的泥翁龙钢锤。
压倒性的威力足以粉碎静寂。",,,,,,,,"مطرقة ألمودرون مُحسنة.
يمكنها اختراق أي صمت بقوتها
العارمة.",,,,,,,,,,,
92c804ef-bfaa-476a-b054-09436185ded9,3457689777,W_Hammer_313_Explain,"硬質な素材を用いて、破壊力に
磨きをかけた泥翁竜の剛鎚。
静寂を打ち砕く、圧倒的威力。","An enhanced Almudron hammer.
Can break any silence with
its overwhelming power.","Peut briser même le néant
avec sa force titanesque.
Base : Marteau Almudron","Potenziamento del martello
Almudron. Un potere tale da
spezzare anche il silenzio.","Ein stärkerer Almudron-
Hammer. Kann krachend
jede Stille zerschlagen.","Martillo Almudron mejorado.
Rompe el silencio con su poder
abrumador.","Улучшенный молот Алмудрона.
Нарушает любое безмолвие
своей подавляющей мощью.","Ulepszony młot Almudrona.
Potrafi zmącić ciszę swoją
przytłaczającą mocą.",,,"Martelo Almudron melhorado.
Quebra qualquer silêncio
com seu poder abissal.","단단한 소재로 파괴력을 높인
이옹룡의 해머. 정적을
깨는 압도적인 위력.","使用堅硬素材，使破壞力
更加提升的泥翁龍硬錘。
壓倒性的威力能打破寂靜。","使用坚硬的素材，
增强了破坏力的泥翁龙钢锤。
压倒性的威力足以粉碎静寂。",,,,,,,,"مطرقة ألمودرون مُحسنة.
يمكنها اختراق أي صمت بقوتها
العارمة.",,,,,,,,,,,
11842aad-7c95-4494-9d83-bc7053f4e534,2898945375,W_Hammer_314_Explain,"進化により更なる破壊力を得た
剛鎚。狙い定めた獲物を塊一つ
残さず徹底的に叩き潰す。","A hammer so hard it can
pulverize any foe into a
haze of red mist.","Si dur qu'il peut pulvériser
tout ennemi en une brume
rougeâtre.","Un martello così potente
da polverizzare i nemici
in una rossa foschia.","So hart, dass er Feinde
zu einem Nebel von
rotem Staub pulverisiert.","Tan duro que pulveriza a sus
enemigos hasta convertirlos
en una neblina roja.","Этот молот настолько прочен,
что способен расплющить
в кашу любого врага.","Młot tak ciężki, że obraca w
pył wrogów i pozostaje z nich
jedynie czerwona mgiełka.",,,"Martelo tão duro que pode
pulverizar o inimigo numa
névoa vermelha.","진화로 더 큰 파괴력을 얻은
해머. 사냥감을 흔적 없이
완벽하게 파괴한다.","在進化後破壞力獲得提升的
剛錘。遭其盯上的獵物將被
徹底擊潰，灰飛煙滅。","通过进化获得更强破坏力的
刚锤。一击可令目标的猎物
彻底灰飞烟灭。",,,,,,,,"مطرقة عنيفة جدًّا
تسحق أي عدو وتحوله إلى
سحابة من الضباب الأحمر.",,,,,,,,,,,
be1abbdf-401e-4e8b-9e00-34ab60c3af74,1153870244,W_Hammer_315_Explain,"溶翁竜の素材を用いた鎚。
巨大な輪から放たれる打撃は、
硬い石をも砕くほどの威力。","A hammer made from real hot
stuff. Its strikes have the
power to shatter solid rock.","Fabriqué en matériaux
ardents. Ses coups
pulvérisent le granit.","Martello incandescente
i cui colpi frantumano
anche la roccia più dura.","Ein Hammer aus extrem heißem
Material. Zerschmettert sogar
harte Felsbrocken.","Un martillo de abrasadores
materiales. Sus golpes pueden
pulverizar una sólida roca.","Молот из невероятно горячего
материала. Способен
расколоть скалу.","Młot z bardzo gorących
materiałów. Jego uderzenia
rozbijają skały na kawałki.",,,"Martelo de material
fumegante. Seus golpes
despedaçam rochas.","용옹룡의 소재로 만든 해머.
둥글고 거대한 해머는 단단한
돌도 부수는 위력이 있다.","使用熔翁龍素材打造的錘。
巨輪所造成的打擊
足以擊碎極為堅硬的岩石。","使用熔翁龙素材制成的锤。
巨大圆轮的打击威力非凡，
足以碎石破岩。",,,,,,,,"مطرقة مصنوعة من مواد
ساخنة حقيقية. تستطيع ضرباتها
تحطيم الصخور الصلبة.",,,,,,,,,,,
2856d29b-2c8f-4aaa-843b-b8a1b1f381f8,2255704715,W_Hammer_316_Explain,"神秘性に磨きがかった輪鎚。
その荘重なる一撃は、全ての
不浄を祓い粉砕する。","A highly polished wheel-like
hammer. Its burning fire
both pulps and purifies.","Marteau en forme de
roue. Son feu ardent
extrait la pureté.","Martello rifinito simile a
una ruota. Il suo fuoco
ardente spolpa e purifica.","Auf Hochglanz polierter
radförmiger Hammer. Sein
Feuer zermalmt und reinigt.","Lo han pulido tanto que parece
una rueda. Su fuego hace puré
a sus víctimas y las purifica.","Тщательно отполированный
молот. Его пламя и обжигает,
и очищает.","Wypolerowany młot kołowy.
Jego płonący ogień miażdży
i oczyszcza.",,,"Martelo redondo muito
polido. Seu fogo ardente
tritura e purifica.","신비롭게 연마된 둥근 해머.
그 묵직한 일격은 모든
부정을 쫓고 분쇄한다.","神秘性更加提升的輪錘。
其莊重的一擊能將所有
不淨之物徹底粉碎。","轮锤的神秘感更胜一筹。
那庄重的一击，将祓除
一切污秽。",,,,,,,,"مطرقة تشبه العجلة مصقولة
بشدة. تحرق نارها المشتعلة
وتنقي على حد سواء.",,,,,,,,,,,
8dbc2a03-f938-48bc-bff7-6807835e9424,1326908489,W_Hammer_317_Explain,"鬼神の力を宿す、天狗の武器。
如何なる障害をも打ち砕く力を
持つと言われる、高名な鎚。","An enhanced Pronged Hammer.
Famously able to smash any
obstacle in its way.","Capable de briser le moindre
obstacle sur son chemin.
Base : Marteau à pics","Martello cinquepunte
potenziato. Distrugge ogni
ostacolo sul suo percorso.","Verbesserter Zinkenhammer.
Bekannt dafür, jedes Hinder-
nis zu zertrümmern.","Martillo de cinco puntas
mejorado. Capaz de aplastar
cualquier obstáculo.","Улучшенный Зубчатый молот.
Способен преодолевать
любые препятствия на пути.","Ulepszony zębaty młot.
Niebywale rozbija wszelkie
przeszkody na swojej drodze.",,,"Martelo dentado melhorado.
Famoso por esmagar quaisquer
obstáculos em seu caminho.","귀신의 힘이 담긴 천구의
무기. 수많은 고난을 넘어설
힘을 지녔다는 해머.","寄宿著鬼神之力的天狗武器。
極負盛名之錘，據說它的力量
能夠將一切阻礙通通都擊碎。","寄宿着鬼神之力的天狗武器。
据说可以打碎任何障碍，
是一把威名远扬的锤。",,,,,,,,"مطرقة شوكية مُحسنة.
تشتهر بقدرتها على تدمير
أي عقبات في طريقها.",,,,,,,,,,,
