guid,crc?,entry name,Japanese,English,French,Italian,German,Spanish,Russian,Polish,Dutch,Portuguese,PortugueseBr,Korean,TraditionalChinese,SimplifiedChinese,Finnish,Swedish,Danish,Norwegian,Czech,Hungarian,Slovak,Arabic,Turkish,Bulgarian,Greek,Romanian,Thai,Ukrainian,Vietnamese,Indonesian,Fiction,Hindi,LatinAmericanSpanish
cbcfc291-4d91-45fd-b972-eac0117e5392,2901066354,W_HeavyBowgun_300_Explain,"山を越え迫り来る獣たちを、
山ごとぶち抜く高火力。里を
守る忍重弩は災厄を蹴散らす。","The hordes of beasts come
cresting over the hills, but
this bowgun is waiting.","Ce fusarbalète reste stoïque
face aux hordes ennemies.
Base : Fusarbalète Kamura","Orde di bestie raggiungono
le colline, ma la balestra
è già pronta a colpire.","Horden von Bestien kommen
angestürmt, doch dieses
Bogengewehr wartet schon.","Esta ballesta aguarda a las
hordas de bestias que se
abalanzan desde las colinas.","Орды зверей наступают
из-за холмов, но это
лукорудие не дремлет.","Hordy bestii ruszyły
ze wzgórz na żer. Ale to
łukodziałko już czeka.",,,"As hordas de feras vêm lotar
o topo das colinas, mas este
fuzilarco está esperando.","산을 넘어오는 야수들을 산과
함께 날려 버릴 만큼 고화력.
마을을 지키는 헤비보우건.","具有將拔山倒樹而來的野獸，
連同山頭一起轟飛的強大火力。
保護村莊的忍重弩能驅除災厄。","如果有野兽翻过山来捣乱，
就把它们连同山头一起粉碎。
守护村子的忍重弩将铲除灾厄。",,,,,,,,"تحتشد جموع الوحوش فوق
التلال؛ لتجد بندقية القوس
هذه في انتظارهم.",,,,,,,,,,,
69543b00-de36-4b0a-b5fa-708cfdd80107,4056620121,W_HeavyBowgun_301_Explain,"山を越え迫り来る獣たちを、
山ごとぶち抜く高火力。里を
守る忍重弩は災厄を蹴散らす。","The hordes of beasts come
cresting over the hills, but
this bowgun is waiting.","Ce fusarbalète reste stoïque
face aux hordes ennemies.
Base : Fusarbalète Kamura","Orde di bestie raggiungono
le colline, ma la balestra
è già pronta a colpire.","Horden von Bestien kommen
angestürmt, doch dieses
Bogengewehr wartet schon.","Esta ballesta aguarda a las
hordas de bestias que se
abalanzan desde las colinas.","Орды зверей наступают
из-за холмов, но это
лукорудие не дремлет.","Hordy bestii ruszyły
ze wzgórz na żer. Ale to
łukodziałko już czeka.",,,"As hordas de feras vêm lotar
o topo das colinas, mas este
fuzilarco está esperando.","산을 넘어오는 야수들을 산과
함께 날려 버릴 만큼 고화력.
마을을 지키는 헤비보우건.","具有將拔山倒樹而來的野獸，
連同山頭一起轟飛的強大火力。
保護村莊的忍重弩能驅除災厄。","如果有野兽翻过山来捣乱，
就把它们连同山头一起粉碎。
守护村子的忍重弩将铲除灾厄。",,,,,,,,"تحتشد جموع الوحوش فوق
التلال؛ لتجد بندقية القوس
هذه في انتظارهم.",,,,,,,,,,,
06a0be68-9fe9-447d-9e38-fad137d63c08,3057351985,W_HeavyBowgun_302_Explain,"里の製鉄技術の粋を集めた
重弩。英雄への感謝の思いは、
轟弾となって大海をも裂く。","Their hero's gratitude in every
payload, this pith of village
forging wit will part oceans.","Cette production du village
est pleine de bons sentiments
et redoutablement efficace.","Capolavoro del villaggio che,
con colpi pieni della gratitudine
di un eroe, dividerà le acque.","Mit der Dankbarkeit des Helden
kann dieses Herz der Dorf-
schmiedekunst Meere teilen.","Devoción al héroe con cada
disparo; un ejemplo para la
aldea capaz de partir mares.","Мощь, способная разделить
океаны, чувствуется в каждом
выстреле этого оружия.","Wdzięczność bohatera jest jej
nabojem. Kunszt kuźnictwa
wioski, rozstępuje oceany.",,,"A gratidão do herói em cada
carga, esse núcleo da forja
da aldeia fende oceanos.","제철 기술의 정수를 모은 헤비
보우건. 영웅을 위하는 마음은
탄환이 되어 대해를 가른다.","集村莊鍛鐵技術之大成打造的
重弩。對英雄的感謝之情將化
為轟彈，威力足以令大海裂開。","集村庄的制铁技术之大成的
重弩。对英雄的感激之情化
作响弹，甚至可分开海洋。",,,,,,,,"يغمر بطلهم الامتنان مع كل حمولة،
فقوة هذه القرية الذكية
سوف تشق المحيطات.",,,,,,,,,,,
0630c767-6eab-430d-bbdc-ce374bf612a8,2583526620,W_HeavyBowgun_303_Explain,"絢爛な造形が目を引く爵銀龍の
重弩。重い深紅の弾丸は、
獲物に確実な死をもたらす。","A bowgun with an eye-catching
design. Its heavy crimson shots
guarantee death to its prey.","Fusarbalète élégant. Ses tirs
écarlates puissants garantissent
la mort de ses proies.","Balestra dalla struttura
vistosa. I pesanti colpi rossi
condannano a morte la preda.","Ein auffälliges Bogengewehr.
Seine karmesinroten Schüsse
bringen Opfern den Tod.","Con un diseño atrayente.
Sus potentísimos disparos
carmesíes son letales.","Лукорудие необычного вида.
Его алые выстрелы несут
верную смерть добыче.","Łukodziałko o atrakcyjnym
wyglądzie. Jego krwawe
pociski gwarantują śmierć.",,,"Fuzilarco com belo design.
Tiros rubros pesados
garantem a morte da presa.","현란한 조형이 튀는 은작룡의
헤비보우건. 진홍빛 탄환은
사냥감을 확실히 죽인다.","爵銀龍重弩，擁有引人注目
的絢爛造型。沉重的深紅子彈
將確實為獵物帶來死亡。","爵银龙重弩的造型华丽，引人
注目。沉重的深红弹丸无疑将
赐予猎物死亡。",,,,,,,,"بندقية قوس بتصميم ملفت
للنظر. تضمن طلقاتها القرمزية الثقيلة
موت فريستها.",,,,,,,,,,,
d223725e-4fdd-42a5-a2fb-5c5731c667c9,807817648,W_HeavyBowgun_304_Explain,"数え切れぬ死をもたらした
果てに、その銃口が自分に
向けられていることに気づく。","After causing countless deaths,
it now finds the muzzle of this
gun aimed at itself.","Après avoir causé des morts
innombrables, son canon est
désormais tourné vers lui.","Dopo aver causato innumerevoli
morti, ora la canna è rivolta
verso se stessa.","Nach unzähligen Opfern
richtet sich die Mündung des
Gewehrs auf sich selbst.","Ha provocado innumerables
muertes y ahora está en el
punto de mira.","Безжалостный убийца обнару-
жил, что дуло этого лукору-
дия направлено на него.","Po zabiciu nieskończonej
liczby ofiar nagle widzi lufę
broni skierowaną w siebie.",,,"Depois de causar mortes sem
conta, agora o cano da arma
aponta para si mesma.","셀 수 없을 정도로 많은 죽음을
초래한 끝에서야 그 총구가
자신을 향한 것임을 깨닫는다.","在經歷無數次殺戮之後，
看著手上所持之弩，
才發覺槍口竟對準了自己。","造成不计其数的死亡后，
才意识到那重弩的枪口
已经对准了自己。",,,,,,,,"بعد أن تسببت في عدد لا يحصى من الوفيات،
ستجد فوهة هذه البندقية
موجهة نحو نفسها الآن.",,,,,,,,,,,
6ecb4408-6df6-4c21-aae7-ad6cd2379dfc,2192493026,W_HeavyBowgun_305_Explain,"轟竜の強靭な素材を使用した、
レックスハウル強化型。
撃つ度に竜の咆哮が響き渡る。","A Tigrex Howl upgrade. Built
from Tigrex parts, it emits
a loud roar with each blast.","Forgé avec des ossements de
Tigrex. Rugit à chaque tir.
Base : Hurlement Tigrex","Potenziamento dell'urlo di
Tigrex. Ogni colpo esploso è
accompagnato da un ruggito.","Verbessertes Tigrex-Geheul.
Begleitet jeden Schuss
mit lautem Brüllen.","Aullido de Tigrex mejorado.
De restos duros de Tigrex,
ruge con cada ráfaga.","Улучшение Воя Тигрекса.
Создано из останков Тигрекса
и громко ревет при взрыве.","Ulepszony Skowyt Tigrexa.
Każdy strzał rozbrzmiewa
potężnym rykiem bestii.",,,"Uivo de Tigrex aprimorado.
Feito com partes de Tigrex,
sua explosão é um rugido.","굉룡의 강인한 소재로 만든
렉스하울의 강화형. 쏠 때마다
용의 포효가 울려 퍼진다.","轟龍咆哮的強化型，使用了
轟龍的強韌素材。每次開砲，
轟龍的咆哮聲都會響徹天地。","轰龙咆哮的强化型，使用了
轰龙的强韧素材。每次开炮，
都可听到轰龙的咆哮响彻天地。",,,,,,,,"ترقية صياح تجريكس. تُصدر تلك
المصنوعة من أجزاء تجريكس
دويًّا مرتفعًا مع كل انفجار.",,,,,,,,,,,
e7b11fb8-e534-428e-8f46-721591d4e0e5,246205514,W_HeavyBowgun_306_Explain,"轟竜の息吹を感じる意匠。その
砲身が放つ爆発的な咆哮は、
射線上の全てを破砕する。","The barrel of this Tigrex-
inspired gun roars as all
in its path is razed to dust.","Le canon aux allures de
Tigrex rugit et réduit tout
en poussière sur son passage.","La canna di questa balestra
ispirata al Tigrex ruggisce
mentre rade tutto al suolo.","Der Lauf dieses Tigrex-
Gewehrs vernichtet dröhnend
alles in seinem Weg.","La munición de esta arma
inspirada en el Tigrex ruge
al pulverizarlo todo a su paso.","Ствол этого ружья напоминает
череп Тигрекса. Разнесет
все в пух и прах.","Lufa tego podobnego do
Tigrexa łukodziałka grzmi,
zmieniając wszystko w pył.",,,"O cano desta arma inspirada
num Tigrex ruge e transforma
tudo em pó.","굉룡의 숨결이 느껴지는 포신
이 내뿜는 폭발적인 포효는
사선상의 모든 것을 파괴한다.","能使人感受到轟龍氣息的設計。
砲身會發出爆發性的咆嘯，
能夠粉碎射線上的一切。","匠心独具，仿佛能感受到轰龙的
气息。炮身射出的炸裂的咆哮，
将沿途粉碎一切阻碍。",,,,,,,,"تزأر فوهة المسدس
المستوحى من تجريكس، وتحول
كل شيء في طريقها إلى غبار.",,,,,,,,,,,
709a8105-91fd-43b6-937a-d41c48fb4821,2274619780,W_HeavyBowgun_307_Explain,"轟竜の息吹を感じる意匠。その
砲身が放つ爆発的な咆哮は、
射線上の全てを破砕する。","The barrel of this Tigrex-
inspired gun roars as all
in its path is razed to dust.","Le canon aux allures de
Tigrex rugit et réduit tout
en poussière sur son passage.","La canna di questa balestra
ispirata al Tigrex ruggisce
mentre rade tutto al suolo.","Der Lauf dieses Tigrex-
Gewehrs vernichtet dröhnend
alles in seinem Weg.","La munición de esta arma
inspirada en el Tigrex ruge
al pulverizarlo todo a su paso.","Ствол этого ружья напоминает
череп Тигрекса. Разнесет
все в пух и прах.","Lufa tego podobnego do
Tigrexa łukodziałka grzmi,
zmieniając wszystko w pył.",,,"O cano desta arma inspirada
num Tigrex ruge e transforma
tudo em pó.","굉룡의 숨결이 느껴지는 포신
이 내뿜는 폭발적인 포효는
사선상의 모든 것을 파괴한다.","能使人感受到轟龍氣息的設計。
砲身會發出爆發性的咆嘯，
能夠粉碎射線上的一切。","匠心独具，仿佛能感受到轰龙的
气息。炮身射出的炸裂的咆哮，
将沿途粉碎一切阻碍。",,,,,,,,"تزأر فوهة المسدس
المستوحى من تجريكس، وتحول
كل شيء في طريقها إلى غبار.",,,,,,,,,,,
ce86068f-84a2-4b67-a943-24fedf498d09,2878332501,W_HeavyBowgun_308_Explain,"雅なる重砲から放つ水沫の軌跡
は遥か遠き明月まで伸びゆく。
狐重砲ハライニケリナ強化型。","A Cirrus Blaster upgrade.
Its shots leave behind a
watery trail.","Laisse derrière lui une
traînée d'eau à chaque tir.
Base : Exploseur cirrus","Cannone cirro potenziato.
I suoi colpi producono una
scia d'acqua.","Verbesserter Zirrussprenger.
Hinterlässt eine Wasserspur,
die bis zum Mond reicht.","Ráfaga de cirrus mejorada.
Sus disparos dejan un rastro
de agua.","Улучшение Облачной пушки.
Ее выстрелы оставляют за
собой водяную дорожку.","Ulepszony Blaster Cirrus.
Strzały pozostawiają za
sobą wodny ślad.",,,"Detonador Cirrus melhorado.
Seus tiros deixam para
trás um rastro de água.","멋진 중포가 쏘는 물보라의
궤적은 머나먼 달까지 닿는다.
하라이니케리나의 강화형.","風雅重砲射出水沫，
其軌跡延伸至遙遠的明月。
狐重砲風清雲霧散的強化型態。","风雅重炮射出水沫，
其轨迹将蔓延至遥远的明月。
狐重炮【风过云雾散】强化型。",,,,,,,,"ترقية ناسفة السُحب
الخفيفة. تترك طلقاتها
أثرًا مائيًّا.",,,,,,,,,,,
aef8aca9-1cb8-4a5f-a9a6-17ef9cf7e6c5,2823724384,W_HeavyBowgun_309_Explain,"山の如く泰然とした心で重弩を
用い、愛し君を厄より護らん。
願わくは往古来今、頼り給へ。","With rock-like surety and
longevity, loved ones are
kept safe by this ballista.","La sécurité et la longévité
de pierre de cette baliste
protègent les êtres chers.","La balista tiene al sicuro
le persone amate con
fermezza e longevità.","Mit eherner Sicherheit und
Langlebigkeit schützt diese
Balliste geliebte Menschen.","Balista de seguridad y
durabilidad férreas que
protege a los seres queridos.","Эта баллиста не подведет в
бою и прослужит очень долго.
Близкие в безопасности.","Mocna i trwała jak skała,
balista ta chroni
twych bliskich.",,,"Esta balista mantém seus
queridos seguros com sua
certeza firme e longevidade.","의연한 마음으로 헤비보우건을
들어 사랑하는 그대를 지킨다.
부디 왕고내금 의지하소서.","以不動如山的泰然心境使此
重弩，保護深愛之人遠離厄運。
願你古往今來，皆有所依。","内心稳如泰山，以重弩守护心爱
之人远离灾祸。愿古往今来，有
依有靠。",,,,,,,,"يحمي هذا المنجنيق 
الأحبَّة بضمان كالصخر
وطول العمر.",,,,,,,,,,,
ce606a3f-6708-4152-9086-7a145fb87828,281740972,W_HeavyBowgun_310_Explain,"山の如く泰然とした心で重弩を
用い、愛し君を厄より護らん。
願わくは往古来今、頼り給へ。","With rock-like surety and
longevity, loved ones are
kept safe by this ballista.","La sécurité et la longévité
de pierre de cette baliste
protègent les êtres chers.","La balista tiene al sicuro
le persone amate con
fermezza e longevità.","Mit eherner Sicherheit und
Langlebigkeit schützt diese
Balliste geliebte Menschen.","Balista de seguridad y
durabilidad férreas que
protege a los seres queridos.","Эта баллиста не подведет в
бою и прослужит очень долго.
Близкие в безопасности.","Mocna i trwała jak skała,
balista ta chroni
twych bliskich.",,,"Esta balista mantém seus
queridos seguros com sua
certeza firme e longevidade.","의연한 마음으로 헤비보우건을
들어 사랑하는 그대를 지킨다.
부디 왕고내금 의지하소서.","以不動如山的泰然心境使此
重弩，保護深愛之人遠離厄運。
願你古往今來，皆有所依。","内心稳如泰山，以重弩守护心爱
之人远离灾祸。愿古往今来，有
依有靠。",,,,,,,,"يحمي هذا المنجنيق 
الأحبَّة بضمان كالصخر
وطول العمر.",,,,,,,,,,,
a949ff3d-7edd-4046-9a8a-95f5a38c403c,1915685731,W_HeavyBowgun_311_Explain,"止事無き退魔師は聖輿でこそ
霊力を発揮した。撃ち御坐せ、
聖域からの畏き芳志の弾丸。","A purified cannon intended
to ward off evil while firing
from a sanctuary.","Canon purifié conçu pour
éloigner le mal tout en tirant
depuis un sanctuaire.","Cannone purificato volto a
scacciare il male sparando
da una zona santificata.","Eine gereinigte Kanone zur
Abwehr des Bösen mit
Schüssen aus einem Heiligtum.","Un cañón purificado concebido
para alejar el mal con sus
disparos desde un santuario.","Очищенная пушка, может
отгонять зло при стрельбе
из святилища.","Oczyszczone działo mające
odstraszać zło i chronić
sanktuarium.",,,"Canhão purificado que
espanta o mal enquanto
atira de um santuário.","고귀한 퇴마사는 성여이기에
영력을 발휘했다. 쏘소서,
성역에서 받은 자비의 탄환을.","高貴的驅魔師唯有透過聖輿才能
發揮其靈力。開火吧，來自聖域
的盛情之彈將從槍口射出。","高贵的除魔师只有在神轿上才能
施展其灵力。射下吧，来自圣域
的盛情弹丸，敬畏凛然。",,,,,,,,"مدفع خالص يهدف إلى
درء الشر خلال إطلاق النار
من منطقة مقدسة.",,,,,,,,,,,
56f866ad-82ce-46fa-8b85-f50858bdc23f,3342539623,W_HeavyBowgun_312_Explain,"烈しい砲撃は、練達した闘士の
覇気が如く。撃ッチャリの強化
版は相手の戦意を削ぎ落とす。","Fires shells with the vigor
of a seasoned warrior. Saps
your foes' will to fight.","Les vétérans font pleuvoir
un déluge de munitions.
Base : Tir inversé","Impossibile ribellarsi alla
sua devastante pioggia
di conchiglie.","Feuert Geschosse hart wie
ein Kriegsveteran. Raubt
Feinden ihren Kampfwillen.","Dispara como un guerrero
veterano y quítale las ganas
de combatir al enemigo.","Бьет снарядами с напором
опытного воина. Ломает
волю врага к победе.","Wali pociskami z werwą
starego wojownika. Odbiera
wrogom chęć do walki.",,,"Seus tiros vigorosos acabam
com o espírito de luta
dos inimigos.","맹렬한 포격은 숙달된 투사의
패기처럼. 강화판 뒤집기는
상대의 전의를 꺾는다.","猛烈的砲擊有如老練鬥士的
霸氣。後仰側摔的強化版，
能夠用來削弱對手的戰意。","炽烈的炮击如同老练斗士
散发的霸气。反击的强化版
足以瓦解对手的斗志。",,,,,,,,"تخرج الطلقة مغلفة بحيوية
محارب مُحنك. استنزف رغبة
خصومك في القتال.",,,,,,,,,,,
0ec8e878-2e5f-4d78-a238-d0023d53e135,2016481541,W_HeavyBowgun_313_Explain,"洗練されきった河童蛙の重弩。
その重厚な銃身と豪快な砲撃は
闘士が如く、他を圧倒する。","This refined Tetranadon heavy
bowgun boasts a massive barrel
and is capable of powerful gunfire.","Fusarbalète lourd dont le canon
massif est capable d'une
grande puissance de feu.","Pesante balestra Tetranadon
dalla massiccia canna, capace
di sparare colpi potenti.","Schweres Tetranadon-Bogen-
gewehr mit massivem Lauf und
machtvollen Schüssen.","Refinada ballesta pesada de
Tetranadon que puede ejecutar
disparos descomunales.","Улучшенное тяжелое лукорудие
Тетранадона обладает высокой
огневой мощью.","To ciężkie łukodziałko
z Tetranadona ma wielką lufę
i pluje potężnym ogniem.",,,"Fuzilarco pesado de
Tetranadon com imenso cano,
capaz de tiros poderosos.","세련된 하동와의 헤비보우건.
중후한 총신과 호쾌한 포격은
투사처럼 타인을 압도한다.","洗鍊至極的河童蛙重弩。
厚重的槍身與豪快的砲擊
能像鬥士一般壓制對手。","经过改良的河童蛙重弩。
厚重的枪身和豪迈的炮击
如斗士般压倒一切。",,,,,,,,"تتميز بندقية قوس تيترانادون
الثقيلة المصقولة بماسورة ضخمة
يمكنها إطلاق نيران قوية.",,,,,,,,,,,
8395191f-4bd5-4613-a089-d36a7b444354,80735923,W_HeavyBowgun_314_Explain,"洗練されきった河童蛙の重弩。
その重厚な銃身と豪快な砲撃は
闘士が如く、他を圧倒する。","This refined Tetranadon heavy
bowgun boasts a massive barrel
and is capable of powerful gunfire.","Fusarbalète lourd dont le canon
massif est capable d'une
grande puissance de feu.","Pesante balestra Tetranadon
dalla massiccia canna, capace
di sparare colpi potenti.","Schweres Tetranadon-Bogen-
gewehr mit massivem Lauf und
machtvollen Schüssen.","Refinada ballesta pesada de
Tetranadon que puede ejecutar
disparos descomunales.","Улучшенное тяжелое лукорудие
Тетранадона обладает высокой
огневой мощью.","To ciężkie łukodziałko
z Tetranadona ma wielką lufę
i pluje potężnym ogniem.",,,"Fuzilarco pesado de
Tetranadon com imenso cano,
capaz de tiros poderosos.","세련된 하동와의 헤비보우건.
중후한 총신과 호쾌한 포격은
투사처럼 타인을 압도한다.","洗鍊至極的河童蛙重弩。
厚重的槍身與豪快的砲擊
能像鬥士一般壓制對手。","经过改良的河童蛙重弩。
厚重的枪身和豪迈的炮击
如斗士般压倒一切。",,,,,,,,"تتميز بندقية قوس تيترانادون
الثقيلة المصقولة بماسورة ضخمة
يمكنها إطلاق نيران قوية.",,,,,,,,,,,
f9e27788-9676-49d8-b3d7-bce8677dc00d,3846861682,W_HeavyBowgun_315_Explain,"細身の銃身に技術の粋を投入
した、妃竜砲【遠撃】強化版。
熟練者のみが所持を許される。","A Queen's Longfire upgrade.
Its elongated barrel offers
both form and function.","Son canon allongé est
élégant et efficace.
Base : Reine de feu Horizon","Falò di regina potenziata.
La canna lunga è elegante
e funzionale.","Verbesserter Königinnen-
weitschuss. Der längere Lauf
verbindet Form und Funktion.","Fuego de la reina mejorada.
Su cañón alargado tiene
función estética y práctica.","Улучшение Огнемета королевы.
Удлиненный ствол обеспечит
форму и действенность.","Ulepszony sztucer królowej.
Przedłużona lufa gwarantuje
skuteczność i urodę.",,,"O cano alongado do Fogueira
da Rainha aprimorado
oferece forma e função.","얇은 총신에 기술의 정수를
담은 강화판 비룡포【원격】.
숙련자만 사용할 수 있다.","妃龍砲【遠擊】的強化版，
細巧的槍身彙集了技術的精華。
唯有高手可擁有此砲。","妃龙炮【远击】的强化版，
细巧的枪身上汇集了技术精华。
唯有老手可拥有此炮。",,,,,,,,"ترقية نيران الملكة الممتدة.
تجمع ماسورتها المستطيلة
بين الشكل والوظيفة.",,,,,,,,,,,
fe067923-085b-43d9-bd7d-4f258f8ae453,2307015906,W_HeavyBowgun_316_Explain,"狙い定めた一撃が、狩場の争乱
を鎮める。悠然と振る舞い、
支配する様子は、まさに女王。","Feel the majesty as a shot
fired with deadly accuracy
mutes the battlefield.","Sentez la majesté de la
précision mortelle qui réduit
le champ de bataille au silence.","Sprigiona maestosità mentre
spara un colpo dalla precisione
mortale che riduce al silenzio.","Erhaben fliegen die Schüsse
mit tödlicher Präzision und
das Schlachtfeld verstummt.","Siente la majestad de un certero
tiro letal que enmudece al campo
de batalla.","Стреляет настолько точно,
что враги теряют дар речи.
Это и есть величие.","Poczuj majestat, gdy
dokładny strzał wprawia
w zdumienie wszystkich.",,,"Sinta a grandiosidade de um
disparo preciso que silencia
o campo de batalha.","정확한 일격, 사냥터의 소란을
잠재운다. 여유롭게 지배하는
모습은 그야말로 여왕.","精確瞄準後的一擊，將平息
獵場的爭亂。那支配戰場的
悠然自得之姿，無愧於女王之名。","瞄准后射出的一击，能平息猎场
上的纷争。那支配猎场的从容姿
态，正如女王。",,,,,,,,"ستشعر بالعظمة عندما
تُطلق طلقة بدقة مميتة
تجعل الصمت يغزو أرض المعركة.",,,,,,,,,,,
a793b3cb-f75a-46b8-b1bc-8b115ba46777,765868258,W_HeavyBowgun_317_Explain,"狙い定めた一撃が、狩場の争乱
を鎮める。悠然と振る舞い、
支配する様子は、まさに女王。","Feel the majesty as a shot
fired with deadly accuracy
mutes the battlefield.","Sentez la majesté de la
précision mortelle qui réduit
le champ de bataille au silence.","Sprigiona maestosità mentre
spara un colpo dalla precisione
mortale che riduce al silenzio.","Erhaben fliegen die Schüsse
mit tödlicher Präzision und
das Schlachtfeld verstummt.","Siente la majestad de un certero
tiro letal que enmudece al campo
de batalla.","Стреляет настолько точно,
что враги теряют дар речи.
Это и есть величие.","Poczuj majestat, gdy
dokładny strzał wprawia
w zdumienie wszystkich.",,,"Sinta a grandiosidade de um
disparo preciso que silencia
o campo de batalha.","정확한 일격, 사냥터의 소란을
잠재운다. 여유롭게 지배하는
모습은 그야말로 여왕.","精確瞄準後的一擊，將平息
獵場的爭亂。那支配戰場的
悠然自得之姿，無愧於女王之名。","瞄准后射出的一击，能平息猎场
上的纷争。那支配猎场的从容姿
态，正如女王。",,,,,,,,"ستشعر بالعظمة عندما
تُطلق طلقة بدقة مميتة
تجعل الصمت يغزو أرض المعركة.",,,,,,,,,,,
