guid,crc?,entry name,Japanese,English,French,Italian,German,Spanish,Russian,Polish,Dutch,Portuguese,PortugueseBr,Korean,TraditionalChinese,SimplifiedChinese,Finnish,Swedish,Danish,Norwegian,Czech,Hungarian,Slovak,Arabic,Turkish,Bulgarian,Greek,Romanian,Thai,Ukrainian,Vietnamese,Indonesian,Fiction,Hindi,LatinAmericanSpanish
e1322971-2d5e-4e26-99ae-3557f30bf47b,2742726166,W_HeavyBowgun_370_Explain,"ガウプシカの強化形態。
しなやかな角が放つ銃弾は、
力強く野山を駆け抜ける。","The Anteka Burst's upgrade.
The horns it fires carve the
air with deadly precision.","Ses projectiles flexibles
fendent précisément l'air.
Base : Explosion Anteka","Potenziamento dello scoppio
Anteka. I suoi dardi ossei
colpiscono con precisione.","Stärkere Anteka-Explosion
mit tödlich genauer Munition
aus flexiblen Hörnern.","Ráfaga de Anteka mejorada.
Dispara cuernos flexibles
con una precisión mortal.","Улучшение Шквала Антеки.
Снаряды рассекают воздух
со смертельной точностью.","Ulepszenie Wybuchu Anteki.
Wystrzelone rogi mają
śmiercionośną precyzję.",,,"Estouro Anteka melhorado.
Os chifres que ele atira
esculpem o ar com precisão.","가우푸시카의 강화 형태.
부드러운 뿔이 쏘는 총탄은
산과 들을 힘차게 달려나간다.","雪鹿弩的強化型態。
柔韌鹿角中射出的子彈，
將強而有力地飛馳於山野之間。","雪鹿弩的强化形态。
柔韧鹿角中射出的子弹
将强有力地飞驰于山野之间。",,,,,,,,"ترقية مدفع أنتيكا. تشق
القرون التي تطلقها
الهواء بدقة مميتة.",,,,,,,,,,,
37f495f1-99f1-4969-befe-f28e7d392db6,909022329,W_HeavyBowgun_371_Explain,"鹿の王を彷彿とさせる雄大な
姿をした重弩。弾丸を放てば
風のように強く駆け、進む。","A bowgun reminiscent of the
King of Deer. Its rounds travel
through the air like wind.","Fusarbalète rappelant le Roi
des cerfs. Ces munitions
fusent comme le vent.","Una balestra che ricorda
il re dei cervi. I suoi colpi
viaggiano come vento.","Ein Bogengewehr, das an den
Hirschkönig erinnert. Seine
Kugeln sind blitzschnell.","Ballesta que recuerda al rey
del venado. Sus descargas
surcan los vientos.","Лукорудие, похожее на Короля
Сохатых. Его снаряды летят
со скоростью ветра.","To łukodziałko przypomina
króla jeleni. Jego pociski
lecą jak wiatr.",,,"Fuzilarco que parece o Rei
dos Cervos. O tiro corre no
ar como o vento.","사슴의 왕이 떠오르는 웅대한
헤비보우건. 탄환을 쏘면
바람처럼 강하게 나아간다.","外觀像極了鹿王雄偉英姿的
重弩。射出的子彈會如同
颶風般猛烈向前飛行。","重弩外形大气，令人联想起
鹿王。射出的弹药能如疾风
般飞速前进。",,,,,,,,"بندقية قوس تذكرنا
بملك الغزلان. تنطلق طلقاتها
في الهواء مثل الرياح.",,,,,,,,,,,
e6765b28-75c5-45f6-8012-c92a46b4b0aa,1770389910,W_HeavyBowgun_372_Explain,"デュエルスタッブの強化形態。
目前の獲物を容赦なく撃ち倒す
無頼無敵の恐るべき剛砲。","This Dual Threat upgrade is
made to destroy enemies with
incomparable firepower.","Fait pour tuer ses ennemis
avec une puissance inégalée.
Base : Double menace","Potenziamento del doppio
pericolo. Molto efficace,
distrugge i nemici a vista.","Verstärkte Doppelbedrohung.
Tötet Feinde in Sichtweite
mit einmaliger Feuerkraft.","Mejora de la Amenaza Doble
hecha para destruir enemigos
con incomparable potencia.","Это улучшение Двойной угрозы
для уничтожения врагов
огнем огромной мощи.","Wzmocnione Podwójne
Zagrożenie. Niszczy wrogów
z nieporównywalną mocą.",,,"Esta Dupla-ameaça melhorada
é feita para destruir alvos
com alto poder de fogo.","듀얼스태프의 강화 형태.
눈앞의 적을 무자비하게 쓰러
뜨리는 무적을 자랑하는 무기.","決鬥者的強化型態。
無法無天的可怕剛砲，
將無情地擊倒眼前的獵物。","决斗双角弩的强化形态。
无法无天的可怕刚炮，
可无情击倒眼前的猎物。",,,,,,,,"صُممت ترقية التهديد المزدوجة
هذه لتدمير الأعداء
بقوَّة نارية منقطعة النظير.",,,,,,,,,,,
5229f5a4-7b54-4af3-8683-2c582d95b554,3104207272,W_HeavyBowgun_373_Explain,"威風堂々たる巨大な二本の角を
備える決闘用のボウガン。
狩猟の荒野に勝利をもたらす。","A dueling weapon fashioned
with two large horns that
brings victory in the wild.","Arme de duel faite avec
deux grandes cornes
symbole de victoire.","Arma da duello ricavata da
due grandi corna che portano
alla vittoria in campo.","Duellwaffe mit zwei großen
Hörnern, die in der Wildnis
zum Sieg verhelfen.","Arma de duelo creada con dos
grandes cuernos, para una
victoria en estado salvaje.","Дуэльное оружие с двумя
большими рогами. Очень
пригодится на охоте!","Broń do pojedynków.
Zdobiona dwoma rogami,
które przynoszą zwycięstwo.",,,"Uma arma de duelo feita com
dois grandes chifres.
Traz a vitória nos ermos.","위풍당당한 거대한 두 뿔을
갖춘 결투용 보우건. 사냥의
황야에 승리를 가져온다.","配有兩根威風凜凜的巨角，
用於決鬥的弩槍。
能為於荒野狩獵者帶來勝利。","此弩炮装备了两根威风凛凛的
巨角，用于决斗。能为荒野中
的狩猎带来胜利。",,,,,,,,"سلاح مبارزة صُمم
بقرنين كبيرين
يحقق النصر في البرية.",,,,,,,,,,,
653789df-68ac-46a2-b03c-49ba1e0c8d5e,650245122,W_HeavyBowgun_374_Explain,"名のある妖怪を討ち取ったと
伝わる重砲。銃声は雷鳴の如く
轟音と苛烈な衝撃を見舞う。","This Kadachi cannon barks
with thunder and bites with
lightning.","Personne ne peut échapper à
la morsure de la foudre !
Base : Canon Kadachi","Cannone Kadachi dal fragore
di un tuono e la potenza
di un fulmine.","Diese Kadachi-Kanone bellt
mit Donner und beißt mit
Blitzen.","Este cañón Kadachi ruge
truenos y muerde como el
relámpago.","Эта пушка Кадачи лает
громом и кусается молнией.","To działo z Kadachi
szczeka gromami
i gryzie piorunami.",,,"Este canhão Kadachi
late com trovões
e morde com raios.","유명한 요괴를 퇴치했다고
전해지는 중포. 번개 같은
굉음을 동반한 충격을 준다.","相傳此重砲曾討伐過知名妖怪。
其發出的槍聲將帶給獵物
雷鳴般的震耳聲與猛烈的衝擊。","传说击杀了有名妖怪的重炮。
发射声响可比肩雷鸣，
带来轰隆声与恐怖的冲击。",,,,,,,,"يدوّي مدفع كاداتشي
هذا بالرعد، ويلسع
بالبرق.",,,,,,,,,,,
3074cf40-2cb6-4441-9a22-f10dd8b12556,4055210471,W_HeavyBowgun_375_Explain,"妖を討ち取る重砲は、真に力を
使いこなす者が持てば、弾丸も
天を別つ稲妻の如く閃く。","In the right hands, this
mighty cannon fires shots
like thunder from the gods.","Entre de bonnes mains, ce
puissant canon tire des coups
comme le tonnerre des dieux.","Nelle mani giuste, questo
potente cannone spara colpi
come tuoni degli dei.","In den richtigen Händen feuert
dieses mächtige Bogengewehr
wie Götterdonner.","Si cae en buenas manos,
este poderoso cañón dispara
proyectiles como rayos divinos.","В умелых руках эта мощная
баллиста превращается
в оружие богов.","W odpowiednich rękach
to działo strzela
niczym pioruny bogów.",,,"Nas mãos certas, este canhão
poderoso dispara como
trovões dos deuses.","요괴를 퇴치하는 중포를 참된
힘을 다루는 자가 들면 탄이
뇌신의 번개처럼 번쩍인다.","用以討伐妖魔的重砲。
若是由具備真正力量之人使用，
子彈也會變得劃破天空的閃電。","击杀妖怪的重炮，若由能运用此
炮真正力量的人来使用，弹药便
会如划破天际的闪电般耀眼。",,,,,,,,"عند استخدامه بشكل صحيح،
يطلق هذا المدفع العظيم طلقات
أشبه برعد الآلهة.",,,,,,,,,,,
ab599392-1d64-4154-9bd4-a216ea536a50,1750247787,W_HeavyBowgun_376_Explain,"妖を討ち取る重砲は、真に力を
使いこなす者が持てば、弾丸も
天を別つ稲妻の如く閃く。","In the right hands, this
mighty cannon fires shots
like thunder from the gods.","Entre de bonnes mains, ce
puissant canon tire des coups
comme le tonnerre des dieux.","Nelle mani giuste, questo
potente cannone spara colpi
come tuoni degli dei.","In den richtigen Händen feuert
dieses mächtige Bogengewehr
wie Götterdonner.","Si cae en buenas manos,
este poderoso cañón dispara
proyectiles como rayos divinos.","В умелых руках эта мощная
баллиста превращается
в оружие богов.","W odpowiednich rękach
to działo strzela
niczym pioruny bogów.",,,"Nas mãos certas, este canhão
poderoso dispara como
trovões dos deuses.","요괴를 퇴치하는 중포를 
참된 힘을 다루는 자가 들면 
탄환도 번개처럼 번쩍인다.","用以討伐妖魔的重砲。
若是由具備真正力量之人使用，
子彈也會變得劃破天空的閃電。","击杀妖怪的重炮，若由能运用此
炮真正力量的人来使用，弹药便
会如划破天际的闪电般耀眼。",,,,,,,,"عند استخدامه بشكل صحيح،
يطلق هذا المدفع العظيم طلقات
أشبه برعد الآلهة.",,,,,,,,,,,
9b192822-ba28-4b2d-a62d-197ca920bbe9,2502682873,W_HeavyBowgun_377_Explain,"ハイサイクルキャスト強化型。
高速リロードと高威力を両立。
猛烈な弾丸の嵐を獲物に放つ。","The Cyclecaster's upgrade.
It unleashes a torrent of
powerful rapid fire ammo.","Déverse un torrent de dégâts
sur ses cibles.
Base : Lanceur-cyclique","Potenziamento del lanciatore
ciclico. Infligge danni elevati
con raffiche veloci.","Verbesserter Kreisstreuer.
Richtet mit Schnellfeuer-
munition großen Schaden an.","Ciclolanzador mejorado.
Lanza una oleada de munición
de fuego muy potente.","Улучшение Циклострела.
Он выпускает поток мощных
скорострельных боеприпасов.","Ulepszony kołomiot.
Wali rzeką potężnych
pocisków.",,,"Conjuraciclo aprimorado.
Desencadeia uma torrente de
projéteis de fogo rápidos.","하이사이클캐스트의 강화형.
고속 리로드와 위력을 살렸다.
맹렬한 탄환의 폭풍을 쏜다.","高頻率狙擊弩的強化型。
兼具高速裝填性能和強大威力。
向獵物釋放出猛烈的子彈風暴。","高频率狙击弓的强化型。
兼具高速装填性能和强大威力。
可向猎物释放猛烈的子弹风暴。",,,,,,,,"ترقية الرامي الدوار. تطلق
العنان لوابل من الذخيرة
النارية بسرعة وفعالية.",,,,,,,,,,,
b101667b-86ec-4015-add7-cc02563cd896,3542519593,W_HeavyBowgun_378_Explain,<COLOR FF0000>#Rejected#</COLOR> W_HeavyBowgun_378_Explain,<COLOR FF0000>#Rejected#</COLOR> W_HeavyBowgun_378_Explain,<COLOR FF0000>#Rejected#</COLOR> W_HeavyBowgun_378_Explain,<COLOR FF0000>#Rejected#</COLOR> W_HeavyBowgun_378_Explain,<COLOR FF0000>#Rejected#</COLOR> W_HeavyBowgun_378_Explain,<COLOR FF0000>#Rejected#</COLOR> W_HeavyBowgun_378_Explain,<COLOR FF0000>#Rejected#</COLOR> W_HeavyBowgun_378_Explain,<COLOR FF0000>#Rejected#</COLOR> W_HeavyBowgun_378_Explain,<COLOR FF0000>#Rejected#</COLOR> W_HeavyBowgun_378_Explain,<COLOR FF0000>#Rejected#</COLOR> W_HeavyBowgun_378_Explain,<COLOR FF0000>#Rejected#</COLOR> W_HeavyBowgun_378_Explain,<COLOR FF0000>#Rejected#</COLOR> W_HeavyBowgun_378_Explain,<COLOR FF0000>#Rejected#</COLOR> W_HeavyBowgun_378_Explain,<COLOR FF0000>#Rejected#</COLOR> W_HeavyBowgun_378_Explain,<COLOR FF0000>#Rejected#</COLOR> W_HeavyBowgun_378_Explain,<COLOR FF0000>#Rejected#</COLOR> W_HeavyBowgun_378_Explain,<COLOR FF0000>#Rejected#</COLOR> W_HeavyBowgun_378_Explain,<COLOR FF0000>#Rejected#</COLOR> W_HeavyBowgun_378_Explain,<COLOR FF0000>#Rejected#</COLOR> W_HeavyBowgun_378_Explain,<COLOR FF0000>#Rejected#</COLOR> W_HeavyBowgun_378_Explain,<COLOR FF0000>#Rejected#</COLOR> W_HeavyBowgun_378_Explain,<COLOR FF0000>#Rejected#</COLOR> W_HeavyBowgun_378_Explain,<COLOR FF0000>#Rejected#</COLOR> W_HeavyBowgun_378_Explain,<COLOR FF0000>#Rejected#</COLOR> W_HeavyBowgun_378_Explain,<COLOR FF0000>#Rejected#</COLOR> W_HeavyBowgun_378_Explain,<COLOR FF0000>#Rejected#</COLOR> W_HeavyBowgun_378_Explain,<COLOR FF0000>#Rejected#</COLOR> W_HeavyBowgun_378_Explain,<COLOR FF0000>#Rejected#</COLOR> W_HeavyBowgun_378_Explain,<COLOR FF0000>#Rejected#</COLOR> W_HeavyBowgun_378_Explain,<COLOR FF0000>#Rejected#</COLOR> W_HeavyBowgun_378_Explain,<COLOR FF0000>#Rejected#</COLOR> W_HeavyBowgun_378_Explain,<COLOR FF0000>#Rejected#</COLOR> W_HeavyBowgun_378_Explain,<COLOR FF0000>#Rejected#</COLOR> W_HeavyBowgun_378_Explain
241b2400-557d-47d9-a1b8-5e03f4a6bbe0,2532445029,W_HeavyBowgun_379_Explain,"ケルビの動きを参考にする事で
更なる性能アップを実現。
狩られる側から狩る側へ…。","This weapon's greater power
stems from a study of Kelbi.
From hunted to hunter...","La puissance de cette arme
vient de l'étude de Kelbi.
De la proie au chasseur...","Il grande potere dell'arma
è frutto di uno studio su un
Kelbi. Da preda a predatore.","Die größere Schlagkraft
dieser Waffe basiert auf
dem Studium der Kelbi.","Su gran poder es fruto de los
estudios del Kelbi. Un saber
transmitido entre cazadores.","Мощь этого оружия проистека-
ет из изучения Келби. Добыча
становится охотником...","Największa moc tej broni
wynika z badań nad Kelbi.
Tak między łowcami...",,,"O poder maior desta arma
deriva do estudo de Kelbi.
De caçador para caçador.","켈비의 움직임을 참고하여
성능을 더욱 향상했다.
사냥감에서 사냥꾼으로….","藉由參考精靈鹿的動作，
使其性能得到大幅提升。
從獵物轉為狩獵者之時已到……","参考精灵鹿的动作进一步提升了
性能。从猎物变为猎人……",,,,,,,,"تنبع القوة الأكبر لهذا السلاح
من دراسة كيلبي. من
المُطارد إلى الصياد...",,,,,,,,,,,
c810da7b-0e19-4fb7-b59c-3e4a072913f5,3351589212,W_HeavyBowgun_380_Explain,"ダイミョウザザミの素材を
実験的に使用した重弩。改良の
余地はあるが性能は十分高い。","A Heavy Bowgun crafted from
Daimyo Hermitaur materials.
Strong and upgradeable.","Fusarbalète lourd à base de
matériaux d'Hermitaur
Daimyo. Améliorable.","Balestra pesante fatta di materiali
Daimyo Hermitaur. Forte e
potenziabile.","Ein Schweres Bogengewehr
aus Daimyo Hermitaur.
Stark und aufrüstbar.","Ballesta pesada de materiales
de Daimyo Hermitaur. Fuerte
y con posibilidades de mejora.","Тяжелое лукорудие из
материалов Гермитавра Даймё.
Можно улучшать.","Ciężkie łukodziałko z Daimyo
Hermitaura. Jest wytrzymałe
i można je ulepszać.",,,"Fuzilarco Pesado de
materiais de Hermitaur
Daimyo. Forte e melhorável.","다이묘자자미의 소재를 실험적
으로 쓴 헤비보우건. 개량의
여지는 있지만 성능은 좋다.","以大名蟹素材製成的實驗性
重弩。尚有改良的空間，
但其性能已是出類拔萃。","实验性地使用了大名盾蟹素材
的重弩。此弩尚有改良的空间，
但性能已足够优异。",,,,,,,,"بندقية قوس ثقيلة صُنعت
من مواد دايمياو هيرميتور.
قوية وقابلة للترقية.",,,,,,,,,,,
57c5445f-1439-4d3c-bf2a-307cf73f7b66,2491728875,W_HeavyBowgun_381_Explain,"ダイミョウザザミの素材を
実験的に使用した重弩。改良の
余地はあるが性能は十分高い。","A Heavy Bowgun crafted from
Daimyo Hermitaur materials.
Strong and upgradeable.","Fusarbalète lourd à base de
matériaux d'Hermitaur
Daimyo. Améliorable.","Balestra pesante fatta di materiali
Daimyo Hermitaur. Forte e
potenziabile.","Ein Schweres Bogengewehr
aus Daimyo Hermitaur.
Stark und aufrüstbar.","Ballesta pesada de materiales
de Daimyo Hermitaur. Fuerte
y con posibilidades de mejora.","Тяжелое лукорудие из
материалов Гермитавра Даймё.
Можно улучшать.","Ciężkie łukodziałko z Daimyo
Hermitaura. Jest wytrzymałe
i można je ulepszać.",,,"Fuzilarco Pesado de
materiais de Hermitaur
Daimyo. Forte e melhorável.","다이묘자자미의 소재를 실험적
으로 쓴 헤비보우건. 개량의
여지는 있지만 성능은 좋다.","以大名蟹素材製成的實驗性
重弩。尚有改良的空間，
但其性能已是出類拔萃。","实验性地使用了大名盾蟹素材
的重弩。此弩尚有改良的空间，
但性能已足够优异。",,,,,,,,"بندقية قوس ثقيلة صُنعت
من مواد دايمياو هيرميتور.
قوية وقابلة للترقية.",,,,,,,,,,,
ed2df1fa-6b89-4ec2-bac6-7aa97366e7d3,3973533252,W_HeavyBowgun_382_Explain,"硬い盾蟹の甲殻でフレームの
剛性を上げたバスタークラブ
強化型。熟練者も納得の性能。","An enhanced form of the Crab
Buster. Veteran hunters appreciate
its tough Hermitaur shell frame.","Appréciée pour sa structure
en Hermitaur robuste.
Base : Explosion de crabe","Distruttore granchio potenziato.
I veterani apprezzano il suo
telaio in Hermitaur.","Verstärkter Krabbensprenger.
Jagdveteranen schätzen den
Hermitaur-Panzer-Rahmen.","Vengadora cangrejo mejorada.
Los veteranos valoran la
dura coraza de Hermitaur.","Улучшенная форма Крабовой
пушки. Бывалые охотники
ценят ее за прочный каркас.","Ulepszona wersja krabowego
pogromcy. Starsi łowcy cenią
twardy korpus z Hermitaura.",,,"Melhoria do Caranguejo Dem.
Caçadores veteranos gostam
do casco duro de Hermitaur.","방패게의 갑각으로 단단함을
높인 버스터크랩 강화형.
숙련자도 인정하는 성능.","破壞者蟹弩的強化型態，使用
大名蟹的堅硬甲殼提升了剛性。
其性能連高手都會點頭讚許。","破坏者蟹弩的强化型，使用大名
盾蟹的坚硬甲壳提升了其刚性。
其性能连老手都会点头赞许。",,,,,,,,"شكل محسَّن لمحطم السلطعون.
يُقدر الصيادون إطاره المصنوع
من صَدفة هيرميتور الصلبة.",,,,,,,,,,,
56becfb2-5d54-4da4-9e67-71ad688dc69d,2195749606,W_HeavyBowgun_383_Explain,"威嚇的な外観を持つボウガン。
その印象通り、斬裂弾中心の
長距離支援攻撃を得意とする。","A Bowgun with a menacing-looking
exterior, it can fire long distance
support rounds that shred enemies.","Fusarbalète à longue portée et
à l'aspect intimidant, qui tire de
redoutables munitions explosives.","Balestra dall'aspetto intimidatorio
che può abbattere i nemici dalla
lunga distanza.","Bedrohlich wirkendes Bogen-
gewehr, das Feinde mit Lang-
streckengeschossen dezimiert.","Ballesta de aspecto amenazador.
Puede disparar a larga distancia
y destruir a sus enemigos.","Лукорудие грозного вида.
Стреляет далеко снарядами,
рвущими врагов.","Łukodziałko o groźnym
wyglądzie. Strzela na dużą
odległość, eliminując wrogów.",,,"Fuzilarco com exterior amea-
çador, dispara de longa dis-
tância e acaba com os alvos.","위협적인 외관을 가진 보우건.
그 인상처럼 참렬탄 중심의
장거리 지원 공격에 특화됐다.","外觀懾人的弩槍。
如同其給人的印象，擅長以
斬裂彈進行遠距離支援攻擊。","外观慑人的弩炮。
一望即知其擅长以斩裂弹
为主的远距离支援攻击。",,,,,,,,"بندقية قوس ذات مظهر خارجي
مهدد، يمكنها إطلاق طلقات دعم
لمسافات طويلة تمزق الأعداء.",,,,,,,,,,,
e6fc06f0-2735-4c8e-b15b-a9ffc6337513,3552860500,W_HeavyBowgun_384_Explain,"威嚇的な外観を持つボウガン。
その印象通り、斬裂弾中心の
長距離支援攻撃を得意とする。","A Bowgun with a menacing-looking
exterior, it can fire long distance
support rounds that shred enemies.","Fusarbalète à longue portée et
à l'aspect intimidant, qui tire de
redoutables munitions explosives.","Balestra dall'aspetto intimidatorio
che può abbattere i nemici dalla
lunga distanza.","Bedrohlich wirkendes Bogen-
gewehr, das Feinde mit Lang-
streckengeschossen dezimiert.","Ballesta de aspecto amenazador.
Puede disparar a larga distancia
y destruir a sus enemigos.","Лукорудие грозного вида.
Стреляет далеко снарядами,
рвущими врагов.","Łukodziałko o groźnym
wyglądzie. Strzela na dużą
odległość, eliminując wrogów.",,,"Fuzilarco com exterior amea-
çador, dispara de longa dis-
tância e acaba com os alvos.","위협적인 외관을 가진 보우건.
그 인상처럼 참렬탄 중심의
장거리 지원 공격에 특화됐다.","外觀懾人的弩槍。
如同其給人的印象，擅長以
斬裂彈進行遠距離支援攻擊。","外观慑人的弩炮。
一望即知其擅长以斩裂弹
为主的远距离支援攻击。",,,,,,,,"بندقية قوس ذات مظهر خارجي
مهدد، يمكنها إطلاق طلقات دعم
لمسافات طويلة تمزق الأعداء.",,,,,,,,,,,
0dc3ffed-3590-4a05-92e6-00001a36cece,2819082753,W_HeavyBowgun_385_Explain,"その名に偽りはなし。定めた
獲物を逃さず撃ち抜く。
ピアースクラブ強化形態。","Like its name implies, the shots
from this enhanced Piercing Crab
will go through just about anything.","Comme son nom l'indique, les
tirs de cette arme transpercent
tout. Base : Crabe perforant","Come suggerisce il nome, i
colpi del granchio perforante
potenziato trafiggono tutto.","Die Schüsse dieser ver-
besserten Durchbohrenden
Krabbe durchdringen alles.","Como su nombre indica, no
hay nada que este Cangrejo
perforador no pueda horadar.","Выстрелы этого улучшенного
Крабового пронзателя 
пробьют что угодно.","Ulepszony przebijający krab.
Jak sama nazwa wskazuje,
przeszyje wszystko.",,,"Como o nome indica, os tiros
deste Caranguejo Perfurador
perfuram qualquer coisa.","그 이름에 거짓은 없다.
포착한 사냥감을 놓치지 않고
꿰뚫는 피어스크랩의 강화형.","穿甲蟹弩的強化型態。
不負其名，可將瞄準的
獵物全部擊穿。","穿刺棒的强化形态。
名下无虚，可将瞄准的
猎物全部“击穿”。",,,,,,,,"كما يوحي اسمه، ستخترق
الطلقات من هذا السلطعون
الثاقب أي شيء تقريبًا.",,,,,,,,,,,
8482971c-dbb5-4a32-a9dd-b0d7005ad539,3806183975,W_HeavyBowgun_386_Explain,"幾多の魂を吸って、不吉なる厄
を纏い昇華した夜砲。放たれた
弾は、電光石火で獲物を貫く。","A bowgun as dark as night,
The souls it has consumed
are sublimated with evil.","Fusarbalète sombre comme la nuit.
Les âmes consumées sont
sublimées par le mal.","Balestra nera come la notte.
Le anime divorate sono
perfidamente sublimate.","Pechschwarzes Bogengewehr.
Sublimiert die verschlung-
enen Seelen mit Grausamkeit.","Tan oscura como la noche.
Las ánimas que ha consumido
destilan maldad.","Темное, как ночь, лукорудие.
Поглощенные им души напол-
няются злобой.","Łukodziałko ciemne jak
noc. Pochłonięte nim dusze
są nasączone złem.",,,"Fuzilarco sombrio como a noite.
As almas que consumiu são
sublimadas com maldade.","무수히 많은 혼을 흡수해 
재액으로 승화한 야포. 탄환은
재빠르게 사냥감을 꿰뚫는다.","吸收無數魂魄，身纏不祥厄運
而昇華的黑夜之砲。射出的子
彈將以電光石火之勢貫穿獵物。","吸收大量灵魂，萦绕着不祥厄
运的升华版夜炮。出膛的弹药
会在电光石火间贯穿猎物。",,,,,,,,"بندقية قوس مظلمة كالليل.
تبخرت الأرواح التي حصدتها
من الشر.",,,,,,,,,,,
c5ff8835-fac5-466b-ae56-840c54bf6f1b,640746872,W_HeavyBowgun_387_Explain,"幾多の魂を吸って、不吉なる厄
を纏い昇華した夜砲。放たれた
弾は、電光石火で獲物を貫く。","A bowgun as dark as night,
The souls it has consumed
are sublimated with evil.","Fusarbalète sombre comme la nuit.
Les âmes consumées sont
sublimées par le mal.","Balestra nera come la notte.
Le anime divorate sono
perfidamente sublimate.","Pechschwarzes Bogengewehr.
Sublimiert die verschlung-
enen Seelen mit Grausamkeit.","Tan oscura como la noche.
Las ánimas que ha consumido
destilan maldad.","Темное, как ночь, лукорудие.
Поглощенные им души напол-
няются злобой.","Łukodziałko ciemne jak
noc. Pochłonięte nim dusze
są nasączone złem.",,,"Fuzilarco sombrio como a noite.
As almas que consumiu são
sublimadas com maldade.","무수히 많은 혼을 흡수해 
재액으로 승화한 야포. 탄환은
재빠르게 사냥감을 꿰뚫는다.","吸收無數魂魄，身纏不祥厄運
而昇華的黑夜之砲。射出的子
彈將以電光石火之勢貫穿獵物。","吸收大量灵魂，萦绕着不祥厄
运的升华版夜炮。出膛的弹药
会在电光石火间贯穿猎物。",,,,,,,,"بندقية قوس مظلمة كالليل.
تبخرت الأرواح التي حصدتها
من الشر.",,,,,,,,,,,
