guid,crc?,entry name,Japanese,English,French,Italian,German,Spanish,Russian,Polish,Dutch,Portuguese,PortugueseBr,Korean,TraditionalChinese,SimplifiedChinese,Finnish,Swedish,Danish,Norwegian,Czech,Hungarian,Slovak,Arabic,Turkish,Bulgarian,Greek,Romanian,Thai,Ukrainian,Vietnamese,Indonesian,Fiction,Hindi,LatinAmericanSpanish
4f3e27d4-1030-4fad-820c-980085bf5179,4172040025,W_HeavyBowgun_405_Explain,<COLOR FF0000>#Rejected#</COLOR> W_HeavyBowgun_405_Explain,<COLOR FF0000>#Rejected#</COLOR> W_HeavyBowgun_405_Explain,<COLOR FF0000>#Rejected#</COLOR> W_HeavyBowgun_405_Explain,<COLOR FF0000>#Rejected#</COLOR> W_HeavyBowgun_405_Explain,<COLOR FF0000>#Rejected#</COLOR> W_HeavyBowgun_405_Explain,<COLOR FF0000>#Rejected#</COLOR> W_HeavyBowgun_405_Explain,<COLOR FF0000>#Rejected#</COLOR> W_HeavyBowgun_405_Explain,<COLOR FF0000>#Rejected#</COLOR> W_HeavyBowgun_405_Explain,<COLOR FF0000>#Rejected#</COLOR> W_HeavyBowgun_405_Explain,<COLOR FF0000>#Rejected#</COLOR> W_HeavyBowgun_405_Explain,<COLOR FF0000>#Rejected#</COLOR> W_HeavyBowgun_405_Explain,<COLOR FF0000>#Rejected#</COLOR> W_HeavyBowgun_405_Explain,<COLOR FF0000>#Rejected#</COLOR> W_HeavyBowgun_405_Explain,<COLOR FF0000>#Rejected#</COLOR> W_HeavyBowgun_405_Explain,<COLOR FF0000>#Rejected#</COLOR> W_HeavyBowgun_405_Explain,<COLOR FF0000>#Rejected#</COLOR> W_HeavyBowgun_405_Explain,<COLOR FF0000>#Rejected#</COLOR> W_HeavyBowgun_405_Explain,<COLOR FF0000>#Rejected#</COLOR> W_HeavyBowgun_405_Explain,<COLOR FF0000>#Rejected#</COLOR> W_HeavyBowgun_405_Explain,<COLOR FF0000>#Rejected#</COLOR> W_HeavyBowgun_405_Explain,<COLOR FF0000>#Rejected#</COLOR> W_HeavyBowgun_405_Explain,<COLOR FF0000>#Rejected#</COLOR> W_HeavyBowgun_405_Explain,<COLOR FF0000>#Rejected#</COLOR> W_HeavyBowgun_405_Explain,<COLOR FF0000>#Rejected#</COLOR> W_HeavyBowgun_405_Explain,<COLOR FF0000>#Rejected#</COLOR> W_HeavyBowgun_405_Explain,<COLOR FF0000>#Rejected#</COLOR> W_HeavyBowgun_405_Explain,<COLOR FF0000>#Rejected#</COLOR> W_HeavyBowgun_405_Explain,<COLOR FF0000>#Rejected#</COLOR> W_HeavyBowgun_405_Explain,<COLOR FF0000>#Rejected#</COLOR> W_HeavyBowgun_405_Explain,<COLOR FF0000>#Rejected#</COLOR> W_HeavyBowgun_405_Explain,<COLOR FF0000>#Rejected#</COLOR> W_HeavyBowgun_405_Explain,<COLOR FF0000>#Rejected#</COLOR> W_HeavyBowgun_405_Explain,<COLOR FF0000>#Rejected#</COLOR> W_HeavyBowgun_405_Explain
8daad85f-aa29-4734-b751-8ec753bc8154,1104430366,W_HeavyBowgun_406_Explain,"デルフ＝ダオラ強化型。
鋼龍素材の強度と重量が高威力
かつ高汎用性を支える逸品。","A Daora's Delphinidae
upgrade. The parts used add
to its already vast power.","Les éléments rajoutés
accentuent sa puissance.
Base : Delphinidae Daora","Delfinide Daora potenziata,
resa ancora più efficace
dai nuovi innesti.","Verbesserte Daoras Delphini-
dae, weiter verstärkt durch
die verwendeten Teile.","Mejora de la Delfindad
Daora. Las piezas utilizadas
incrementan su gran poder.","Улучшение Дельфина Даоры.
Используемые детали повышают
и без того огромную силу.","Ulepszenie Delfina Daory.
Dodane materiały zwiększają
jego niszczącą moc.",,,"Um Delphinidae de Daora
melhorado. As partes usadas
aumentam o já vasto poder.","델프다오라의 강화형.
강룡 소재의 강도와 중량이
위력과 범용성을 살려낸 명품.","鋼龍堅弩的強化型。
鋼龍素材的強度與重量造就
其強大威力與通用性的珍品。","钢龙坚弩的强化型。
一款珍品，其威力与通用性之强
来源于钢龙素材的强度与重量。",,,,,,,,"ترقية دلافين
محيط داورا. تُعزز الأجزاء
المستخدمة من قوتها الهائلة.",,,,,,,,,,,
17062f3a-993a-42ed-a06a-fb48a4ca77aa,2768325495,W_HeavyBowgun_407_Explain,"頑強な鋼から撃ち出される
必滅の氷弾は瞬く間に獲物の
心臓を捉え命の熱を奪い去る。","The frozen bullets from this
barrel of ice steal the heat
from a target's heart.","Les balles givrées sortant de
ce canon glacé absorbent la
chaleur du cœur de la cible.","I proiettili gelati di questa
canna d'acciaio rubano il
calore dal cuore della preda.","Die eisige Kugeln
rauben dem Opfer das
letzte bisschen Wärme.","Sus gélidos proyectiles
despojan el corazón de sus
presas de todo ápice de calor.","Морозные снаряды из ледяного
ствола крадут жар из сердца
жертвы.","Zamarznięte naboje lodowej
broni wysysają ciepło
z serca ofiary.",,,"As balas congeladas deste
cano de gelo roubam o calor
do coração de um alvo.","튼튼한 강철로 쏜 필멸의
빙탄은 순식간에 사냥감의
심장을 뚫고 생명을 빼앗는다.","自頑強之鋼擊出的必殺冰彈，
能在一瞬間瞄準獵物的心臟，
並奪去其生命的熱度。","从坚硬的钢铁中射出的必杀的
冰弹，将瞬间击中猎物的心脏，
夺取其生命的热量。",,,,,,,,"يسرق الرصاص المتجمد
من هذه الفوهة الثلجية 
الحرارة من قلب الهدف.",,,,,,,,,,,
65d12f80-9bf5-4e7f-8a7c-afa47e1491d0,1530852604,W_HeavyBowgun_408_Explain,"テオ＝アーティレリ強化版は
灼熱を纏う巨砲。装填すれば
炎が舞い、世界を赤く染める。","An upgrade of Teostra's
Artillery. Emits dancing
flames on reload.","Émet des flammes
lorsqu'il est rechargé.
Base : Artillerie Teostra","Artiglieria Teostra
potenziata. Emette lingue di
fuoco durante la ricarica.","Verbesserte Form von
Teostras Artillerie. Stößt
beim Nachladen Flammen aus.","Mejora de la Artillería Teostra.
Emite llamas que danzan
al recargarla.","Улучшение артиллерии
Теостры. Выпускает танцующее
пламя при перезарядке.","Ulepszona Artyleria Teostry.
Podczas przeładowania
widać tańczące płomyki.",,,"Esta Artilharia de Teostra
melhorada emite chamas
dançantes ao recarregar.","테오아틸러리의 강화판.
불꽃을 휘감은 거포. 장전하면
불꽃이 세상을 붉게 물들인다.","炎王大砲的強化版是通體炙熱的
巨砲。裝填砲彈後，將看見火焰
飛舞，將世界染成赤紅之色。","炎王大炮的强化版是通体炙热的
巨炮。装填炮弹后，火焰飞舞，
整个世界都被染成红色。",,,,,,,,"ترقية مدفعية تيوسترا.
تندفع منها ألسنة لهب
متراقصة عند إعادة تلقيمها.",,,,,,,,,,,
49070678-bd74-47a1-9c45-b640a21d0c0f,3199554763,W_HeavyBowgun_409_Explain,"帝王の覇権を示す深紅の巨砲。
放てば紅蓮の嵐が巻き起こり、
天を貫く巨大な火柱が立つ。","A huge gun with an emperor's
cardinal colors that throws
a pillar of fire aloft.","Arme énorme aux couleurs
d'un empereur qui projette
une colonne de feu.","Enorme fucile rosso
cardinale che proietta una
colonna di fuoco in aria.","Dieses große Gewehr in den
Farben des Kaisers entfacht
Feuersäulen.","Descomunal arma con los colores
de un emperador que proyecta
un pilar de fuego a lo alto.","Огромная пушка ярко-красного
цвета. Обрушивает на врагов
шквал огня.","Ogromne łukodziałko w
cesarskich barwach. Wyrzuca
wysoko kolumnę ognia.",,,"Arma imensa de cores rubras
de um imperador que
dispara uma coluna de fogo.","제왕의 패권을 상징하는 붉은
거포. 폭풍을 일으키고 하늘을
꿰뚫는 불기둥을 만든다.","昭示帝王霸權的深紅巨砲。
開火時將颳起紅蓮風暴，
轟出聳立衝天的巨大火柱。","彰显帝王霸权的深红巨炮。
一旦开炮，就会卷起烈火风暴，
形成贯穿天际的巨大火柱。",,,,,,,,"سلاح ضخم بألوان الإمبراطور
الأساسية يقذف عمودًا
من النار عاليًا.",,,,,,,,,,,
0c3c1a94-699d-48a2-8f42-abe7ce955869,2510036407,W_HeavyBowgun_410_Explain,"現る蜃気楼。惑う獲物の背後で
夢幻の重弩は舌なめずりする。
カーマエレオーン強化版。","The Kamaeleon's upgrade.
This bowgun punishes any
unsuspecting prey it finds.","Fusarbalète impitoyable
envers des proies crédules.
Base : Kamaeleon","Kamaeleon potenziata.
Castiga senza preavviso
qualunque preda.","Verbessertes Kamaeleon.
Dieses Bogengewehr bestraft
jeden unachtsamen Gegner.","Mejora final del Kamaleón.
Castiga a cualquier presa
que encuentre desprevenida.","Улучшение Хамелеона.
Расправляется с любой
беспечной добычей.","Doskonalszy Kameleon.
Jego ofiary do końca
niczego się nie spodziewają.",,,"Camaleão aprimorado. Esta
arma pune qualquer presa
inocente que encontrar.","신기루를 이용해 사냥감의
배후를 노리는 헤비보우건.
카마엘레온의 강화판.","海市蜃樓出現，夢幻的重弩
在困惑的獵物背後垂涎欲滴。
霞龍濃霧重弩的強化版。","海市蜃楼出现。梦幻重弩
在困惑的猎物背后垂涎欲滴。
霞龙浓雾重弩的强化版。",,,,,,,,"ترقية كاميليون. تضرب بندقية
هذا القوس أي
فريسة مطمئنة تعثر عليها.",,,,,,,,,,,
a092a92b-7a3f-44ec-b669-1f75116ad273,2557174709,W_HeavyBowgun_411_Explain,"煙霞に現出するは幻惑の重弩。
幻に錯乱した命は絡めとられ
深閑とした地だけが残る。","Amid smoke this bewitching
gun emerges. Fatal illusion
lures life to a silent end.","Arme ensorcelante crachant de la
fumée. Illusion fatale qui leurre
la vie vers une fin silencieuse.","L'arma ammaliante emerge dal
fumo. Un'illusione mortale che
porta a una fine silenziosa.","Im Qualm dieses betörenden
Gewehrs beenden tödliche
Illusionen das Leben.","Señuelo letal que emerge de
una nube de humo y conduce
a una muerte silenciosa.","Пушка в дыму. Волшебное
зрелище. Но это иллюзия,
и она может убить.","Ta broń wyłania się
z dymu. Straszna iluzja wabi
życie do cichego końca.",,,"Da fumaça, emerge esta arma
fascinante. Ilusão fatal
atrai a um fim silencioso.","연하 속에 출현한 환혹의 헤비
보우건. 환상에 빠진 목숨이
사로잡히면 정적만이 남는다.","釋放煙霧的蠱惑之重弩。
因幻影而錯亂的生命將落入
陷阱，最終只留下一片寂靜。","蛊惑人心的重弩浮现于蜃楼中。
陷入幻觉的生命错乱失常而落
入幻网，只留下寂静的大地。",,,,,,,,"يظهر هذا السلاح الساحر
وسط الدخان. يجلب الوهم القاتل
الحياة إلى نهاية ساكنة.",,,,,,,,,,,
a8d981cb-0ed1-4afe-b295-9a21565baf24,4279054932,W_HeavyBowgun_412_Explain,"天から降った赫き星は、地を
割り、海を巻き上げ、生命を
燃やし尽くす。苛烈なる一撃。","The crimson eclipse dawns.
Rend earth, scatter seas,
and extinguish life.","Une éclipse écarlate capable
d'anéantir le monde.
Base : Canon rayonnant","Un'eclissi cremisi dilania
la terra, dissolve i mari
e pone fine alla vita.","Die rote Finsternis naht.
Zerbrich Land und Meer,
lösche alles Leben aus.","El eclipse carmesí comienza.
Desgarra la tierra, derrama
los mares y sofoca toda vida.","Багровое затмение на заре.
Разрой землю, расплескай
моря и забери жизнь.","Świt szkarłatnego zaćmienia.
Ziemia pęka, morza parują,
wszelkie życie wymiera.",,,"O eclipse rubro surge.
Rasgue a terra, dissipe os
mares e elimine a vida.","하늘에서 내려온 붉은 별은
땅을 가르고 바다를 휘감아
생명을 불태운다.","從天而降的赫耀之星，其猛烈的
一擊能夠震毀大地、捲起大浪，
並將一切生命全都燃燒殆盡。","灾星从天而降，它裂碎大地，
翻卷海洋，将生命悉数燃尽。
何等剧烈的一击。",,,,,,,,"بزوغ الكسوف القرمزي.
مزّق الأرض، وبعثر البحار،
وامحُ الحياة.",,,,,,,,,,,
cca2b5e8-940b-4dcd-96ce-190a8ef4a5b2,845147577,W_HeavyBowgun_413_Explain,"黒蝕竜の瘴気が凝りし重弩。
その禍口が吐出す黒き呪詛は、
獲物を内から蝕み喰い荒らす。","Gore Magala Heavy Bowgun that
pronounces black curses upon
prey, devouring them from within.","Fusarbalète lourd en Gore Magala
qui lance des malédictions sur ses
proies et les dévore de l'intérieur.","Balestra pesante di Gore
Magala che maledice la preda,
divorandola dall'interno.","Schweres Gore-Magala-Bogengewehr,
das dunkle Flüche auf Beute legt
und sie von innen verschlingt.","Ballesta pesada de Gore Magala
que maldice a su presa y la
devora por dentro.","Тяжелое лукорудие Кровавой
Магалы. Насылает темные
проклятья, пожирает изнутри.","Ciężkie łukodziałko z Gore
Magali rzuca mroczne klątwy,
pożerając ofiary od środka.",,,"Fuzilarco Pes. de Gore Magala
que profere maldições,
devorando as presas.","흑식룡의 독기가 서린
헤비보우건. 토해낸 검은
저주가 사냥감을 집어삼킨다.","凝聚了黑蝕龍瘴氣的重弩。
從不祥的槍口射出的黑色詛咒
會從內部侵蝕並吞食獵物。","黑蚀龙的瘴气凝结而成的重弩。
不祥的枪口中射出黑色的诅咒，
从内部侵蚀并吞食猎物。",,,,,,,,"بندقية قوس جور ماجالا ثقيلة
تطلق اللعنات السوداء على 
الفريسة، وتلتهمها من الداخل.",,,,,,,,,,,
0ccc5572-4b9e-47f4-bdc3-a5af797ab08e,1856906431,W_HeavyBowgun_414_Explain,"黒蝕竜の瘴気が凝りし重弩。
その禍口が吐出す黒き呪詛は、
獲物を内から蝕み喰い荒らす。","Gore Magala Heavy Bowgun that
pronounces black curses upon
prey, devouring them from within.","Fusarbalète lourd en Gore Magala
qui lance des malédictions sur ses
proies et les dévore de l'intérieur.","Balestra pesante di Gore
Magala che maledice la preda,
divorandola dall'interno.","Schweres Gore-Magala-Bogengewehr,
das dunkle Flüche auf Beute legt
und sie von innen verschlingt.","Ballesta pesada de Gore Magala
que maldice a su presa y la
devora por dentro.","Тяжелое лукорудие Кровавой
Магалы. Насылает темные
проклятья, пожирает изнутри.","Ciężkie łukodziałko z Gore
Magali rzuca mroczne klątwy,
pożerając ofiary od środka.",,,"Fuzilarco Pes. de Gore Magala
que profere maldições,
devorando as presas.","흑식룡의 독기가 서린
헤비보우건. 토해낸 검은
저주가 사냥감을 집어삼킨다.","凝聚了黑蝕龍瘴氣的重弩。
從不祥的槍口射出的黑色詛咒
會從內部侵蝕並吞食獵物。","黑蚀龙的瘴气凝结而成的重弩。
不祥的枪口中射出黑色的诅咒，
从内部侵蚀并吞食猎物。",,,,,,,,"بندقية قوس جور ماجالا ثقيلة
تطلق اللعنات السوداء على 
الفريسة، وتلتهمها من الداخل.",,,,,,,,,,,
dbd5610e-3c99-4c00-a541-4477eeabed75,1487174545,W_HeavyBowgun_415_Explain,"常闇に漂う漆黒の重弩。
放たれる黒き呪詛は世界を巡り
数多の生命を奈落へ誘う。","A jet-black heavy bowgun.
Its black curses have doomed
countless opponents.","Sa magie noire a causé la chute
d'innombrables adversaires.","Balestra pesante nerissima.
La sua sventura si è abbattuta
su numerose prede.","Ein Schweres Bogengewehr. Seine
dunklen Flüche wurden ganzen
Scharen zum Verhängnis.","Ballesta pesada tan negra como
el azabache. Sus maldiciones
oscuras han condenado a muchos.","Угольно-черное тяжелое
лукорудие, обрекшее на
гибель орды врагов.","Ciężkie, czarne łukodziałko.
Jego mroczne klątwy zgładziły
wielu przeciwników.",,,"Fuzilarco pesado como ébano.
Suas maldições condenaram
inúmeros oponentes.","암흑에 떠도는 헤비보우건.
검은 저주는 세계를 돌며
생명을 나락으로 유인한다.","漂浮於永恆黑暗中的漆黑重弩。
散發出的黑色詛咒將巡遍世界，
引誘眾多生命墜入地獄。","漂浮于黑暗中的漆黑重弩。
黑色诅咒游遍世界，引诱
众多生命坠入地狱。",,,,,,,,"بندقية قوس ثقيلة شديدة السواد.
قضت لعناتها السوداء على عدد لا
يحصى من المعارضين.",,,,,,,,,,,
28967aae-8653-4c4f-86a1-c73cc594cf08,480522080,W_HeavyBowgun_416_Explain,"七色の光射す天廻龍の重弩。
天空より放たれる福音の調べは
翼を得て地の果てを照らす。","An iridescent Shagaru Magala
Bowgun that brings light to the
earth with each heavenly peal.","Fusarbalète irisé en Shagaru
Magala qui projette à chaque tir
céleste la lumière sur la terre.","Balestra iridescente di Shagaru
Magala che illumina il mondo a ogni
rintocco celestiale.","Ein schillerndes Shagaru-Magala-
Bogengewehr. Jedes himmlische
Läuten bringt Licht auf die Erde.","Ballesta de colores de Shagaru
Magala que trae luz a la tierra
con cada tañido.","Переливчатое лукорудие
Шагару Магалы, приносящее
на землю свет небес.","Opalizujące łukodziałko z
Shagaru Magali sprowadza
światło na ziemię.",,,"Fuzilarco de Shagaru Magala
iridescente que traz a luz à
terra com cada soar divino.","일곱 빛깔로 빛나는 천회룡의
헤비보우건. 하늘에서 울리는
복음이 세상을 비춘다.","閃耀七彩光芒的天迴龍重弩。
來自天空的福音旋律獲得了
翅膀，響徹至大地盡頭。","闪耀七彩光芒的天廻龙重弩。
来自天空的福音旋律插上翅膀，
响彻大地尽头。",,,,,,,,"بندقية قوس شاجارو ماجالا 
قزحية اللون تجلب الضوء إلى 
الأرض مع كل جلجلة سماوية.",,,,,,,,,,,
e2555eac-26ee-43d6-8b88-b445f4b29ac2,3420347468,W_HeavyBowgun_417_Explain,"加護をもたらす金色の重弩。
最果てに見える彩光は、この世
から闇を葬る天廻龍の後光。","A protective golden bowgun.
Its light can bring an end
to the world's darkness.","Fusarbalète doré protecteur.
Sa lueur peut mettre fin aux
ténèbres englobant le monde.","Balestra d'oro protettiva.
La sua luce può porre fine
all'oscurità del mondo.","Ein wehrhaftes goldenes
Bogengewehr. Das Licht beendet
die Dunkelheit der Welt.","Una protectora ballesta dorada.
Su luz puede erradicar la
oscuridad de este mundo.","Защитное золотое лукорудие.
Его свет разгоняет тьму.","Złote łukodziałko obronne.
Jego światło może położyć
kres ciemnościom świata.",,,"Fuzilarco dourado protetor.
Sua luz pode dar um fim
à treva do mundo.","가호를 주는 금빛 헤비보우건.
최후에 보는 빛은 세상의 모든
어둠을 지우는 천회룡의 후광.","能帶來加護的金色重弩。
於終焉顯現的彩光，是葬送
人世黑暗的天迴龍之光。","给与护佑的金色重弩。
最后看到的彩光是驱逐现世
黑暗的天廻龙的光环。",,,,,,,,"بندقية ذهبية حامية.
يمكن لضوئها أن
ينهي ظلام العالم.",,,,,,,,,,,
7cd234b8-f0d4-4b9d-884a-ff6e8b344eb0,190131795,W_HeavyBowgun_418_Explain,"暗き地の底から出づる十四の
破壊。第十三の破壊は宙を覆う
星々のつぶての形をしていた。","Fourteen terrors from the
black abyss. The thirteenth
was like spreading stardust.","Quatorze terreurs des abysses.
La treizième était comme une
poussière céleste.","Quattordici orrori degli
abissi oscuri. Il tredicesimo
sparse polvere di stelle.","14 Schrecken vom Schwarzen
Abgrund. Der dreizehnte verbrei-
tete sich wie Sternenstaub.","Catorce horrores del oscuro
abismo. El decimotercero
crecía como polvo estelar.","14 ужасов из черной бездны.
Тринадцатый — звездная
пыль, затмившая все.","Czternaście okropności czarnej
otchłani. Ttrzynasta jest
jak rozsypany gwiezdny pył.",,,"Quatorze terrores do abismo
negro. O décimo terceiro era
como poeira cósmica.","땅속에서 일어난 14번의 파괴.
13번째는 하늘을 뒤덮은
무수한 별의 형상이었다.","來自黑暗地底的十四破壞之一。
第十三破壞之形貌
有如滿布蒼穹的群星的碎片。","来自幽暗地底的十四破坏。
第十三破坏形如漫天繁星。",,,,,,,,"الأهوال الأربعة عشر
من الهاوية السوداء. الثالث عشر
منها كان مثل نشر غبار النجوم.",,,,,,,,,,,
33ccc7cf-08dc-4139-a0cb-4e58c0419483,1084688257,W_HeavyBowgun_419_Explain,"金の重弩より放たれる弾丸は
荒ぶる雷。その怒りに触れた
者は、骨も残らず姿を消す。","All hit by the fury of this
golden ballista's missiles
are vaporized at once.","Ceux touchés par la furie des
missiles de cette baliste dorée
sont vaporisés immédiatement.","I missili furiosi di questa
balista dorata vaporizzano
tutto ciò che incontrano.","Die Wucht der Geschosse die-
ser goldenen Balliste führt
unausweichlich zum Tod.","Balista dorada que vaporiza
al instante a quienes alcanza
con la furia de sus misiles.","Всех, в кого попадают
снаряды этой баллисты,
разрывает на мелкие части.","Ofiary gniewu tej złotej
balisty są natychmiast
obracane w proch.",,,"Quem for atingido pela fúria
dos projéteis desta balista
será dizimado de cara.","헤비보우건에서 발사된 총탄은
마치 날뛰는 번개. 분노를 산
자는 흔적도 없이 사라진다.","黃金重弩射出的子彈乃
暴虐之雷。觸其逆麟者
將灰飛煙滅，屍骨無存。","金色的重弩炮释放出的子弹
是为荒雷。触及此愤怒者，
将尸骨无存。",,,,,,,,"كل ما يمسُّه غضب قذائف
المنجنيق الذهبي هذا
يتبخر في الحال.",,,,,,,,,,,
ac4a775e-78fd-4818-98b1-8bfffdf085ff,3291297121,W_HeavyBowgun_420_Explain,"昔々、一人の少女に与えられた
不思議な重弩。携えた少女は後
に見事、夢を叶えたのだとか。","Once upon a time, a fair
maiden wielded this, and
achieved her dreams with it.","Presque aussi confortable
qu'un soulier de verre.
Base : Bazooka Carrozza","Un tempo, una dama
imbracciò quest'arma
e realizzò i suoi sogni.","Wurde einst von einer holden
Maid geschwungen, die damit
ihre Träume erfüllte.","Érase una vez una dama que
cumplió sus sueños mientras
blandía esto.","Когда-то оружием владела
прекрасная дева, которой оно
помогло осуществить мечту.","Dawno, dawno temu
pomógł spełnić marzenia
pewnej dziewczyny.",,,"Muito tempo atrás, uma nobre
dama realizava seus sonhos
com esta arma na mão.","옛날 한 소녀에게 주어진
신기한 헤비보우건. 그 소녀는
멋지게 꿈을 이루었다고도.","從前從前，有一位少女得到了
一把很神奇的重弩。據說少女
擁有這把弩後便實現了夢想。","曾有一个小女孩获得过
这不可思议的重弩。
据说她最后实现了自己的梦想。",,,,,,,,"في يوم من الأيام، حملت
شابة جميلة هذا السلاح،
وحققت أحلامها به.",,,,,,,,,,,
9ae85250-efaa-41ce-9d27-efb81c81f664,1724559745,W_HeavyBowgun_421_Explain,"ついに悪しき竜を打ち倒した
少女は、村に平和をもたらし
末永く幸せに暮らしたという。","Legend says that after felling
the dragon, the girl returned
home and lived happily ever after.","On raconte qu'une fois le dragon
terrassé, la fille retourna
chez elle et vécu heureuse.","Dopo aver ucciso il drago,
la ragazza tornò a casa e
visse felice e contenta.","Laut Legende soll das Mädchen
vergnügt weitergelebt haben,
nachdem es den Drachen erschlug.","Cuenta la leyenda que, tras
acallar al dragón, la joven
volvió a casa y fue feliz.","По легенде, победив дракона,
девушка вернулась домой
и жила долго и счастливо.","Według legendy panna zabiła
smoka, a potem żyła
długo i szczęśliwie.",,,"Diz a lenda que, com o dragão
morto, a garota foi embora
e viveu feliz para sempre.","끝내 악룡을 쓰러뜨린 소녀는
마을에 평화를 가져오고
오랫동안 행복하게 살았다.","據說少女在成功擊敗惡龍後，
為村落帶來了和平，
並永遠過著幸福的生活。","传说少女终于打败了恶龙，
为村子带来了和平，永远地
幸福生活下去。",,,,,,,,"تقول الأسطورة إنه بعد القضاء
على التنين، عادت الفتاة إلى
المنزل وعاشت في سعادة دائمة.",,,,,,,,,,,
b4ff089c-9a5b-427f-9c14-70e049fec6d7,1964289858,W_HeavyBowgun_422_Explain,"彷徨う魂を導いて、黄泉への
旅路をご案内。可憐に煌めく
リーサリィ・ジェリィ強化版。","Guides wandering souls
through the abyss with
a lovely shimmer.","Guide les âmes errantes à
travers les abysses.
Base : Canon méduse.","Il suo luccichio ipnotico
guida le anime erranti
attraverso l'abisso.","Leitet wandelnde Seelen
mit einem lieblichen Glanz
durch den Abgrund.","Guía almas errantes por el
abismo con un titilar
encantador.","Ведет заблудшие души сквозь
бездну своим изумительным
сиянием.","Migocze prześlicznie,
wyprowadzając zagubione
dusze z otchłani.",,,"Guia almas errantes através
do abismo com um
brilho encantador.","방황하는 혼을 인도하여
황천으로 안내한다. 가련하게
반짝이는 리설-젤리의 강화판.","指引徬徨無助的魂魄，
帶領其踏上黃泉旅途。發出
可愛光芒的致命水母強化版。","引导着迷途的灵魂，指出通向
黄泉的旅途。可爱闪亮的致命
旅行包强化版。",,,,,,,,"تُرشد الأرواح التائهة
عبر الهاوية
ببريق عذب.",,,,,,,,,,,
