guid,crc?,entry name,Japanese,English,French,Italian,German,Spanish,Russian,Polish,Dutch,Portuguese,PortugueseBr,Korean,TraditionalChinese,SimplifiedChinese,Finnish,Swedish,Danish,Norwegian,Czech,Hungarian,Slovak,Arabic,Turkish,Bulgarian,Greek,Romanian,Thai,Ukrainian,Vietnamese,Indonesian,Fiction,Hindi,LatinAmericanSpanish
10547dd8-e254-4e20-a9f2-1c336d4af3ea,924411580,HN_MonsterListMsg_EnemyIndex014_page2,"左右の翼についたスパイク状の鱗が破壊されると、
氷の上で踏ん張ることができなくなる。そのため、
思うように動けなくなり動きが鈍くなるらしい。
ベリオロスの迅速な動きを崩すなら、
スパイク状の鱗を狙うといいだろう。","Destroy the spikes on its winged forelegs and it
won't be as zippy on the ice anymore! If you really
want to slow a Barioth down, aim at those spikes.","Une fois que vous aurez brisé les écailles de
ses pattes ailées, le Barioth ne pourra plus se
tenir fermement sur la glace. Si vous voulez
affaiblir et ralentir un Barioth, visez
ces écailles !","Distruggendo le squame acuminate sulle ali, non
riuscirà a camminare sul ghiaccio. Di conseguenza, i
suoi movimenti si faranno incerti. Concentra gli
attacchi sugli aculei per rallentare il Barioth.","Wenn die Stachelschuppen an beiden Flügeln zerstört
werden, verliert er seinen sicheren Stand auf dem
Eis und muss sich vorsichtiger bewegen. Wenn dir die
Geschwindigkeit des Barioth Angst macht, nimm also
die Stacheln aufs Korn!","Acaba con los pinchos que tiene en las patas aladas
para que no pueda agarrarse al hielo tan fácilmente.
¡Es el mejor método para evitar que se te escape!","Уничтожьте шипы на его передних лапах — тогда он
уже не будет так ловок на льду! Если хотите
замедлить Бариота, цельтесь по этим шипам.","Zniszcz kolce na jego uskrzydlonych przednich
łapach, a nie będzie już taki zwrotny na lodzie!
Chcesz zwolnić Bariotha – celuj w kolce.",,,"Destrua os espigões nas patas dianteiras aladas,
e ele não será mais tão ágil sobre o gelo! Se você
quiser mesmo diminuir a velocidade de um Barioth,
mire nesses espigões.","좌우 날개에 달린 가시 모양 비늘이 파괴되면
얼음 위에서 버틸 수 없게 된다. 그렇기 때문에
생각한 대로 움직일 수 없어져 움직임이 둔해진다.
벨리오로스의 신속한 움직임을 막으려면
가시 모양 비늘을 노려야 한다.","只要破壞其左右翅膀上的釘狀鱗片，
就能讓牠難以在冰上站穩。
如此便能使其無法自在地行動，
動作也會變得遲緩。
如果想阻止冰牙龍迅速的動作，
不妨先攻擊牠的釘狀鱗片。","若左右羽翼上的钉状鳞片遭到破坏，
其便不能再在冰上如履平地，
行动也将变得迟钝且不能随心所欲。
如果要封住冰牙龙快速的动作，
那就攻击钉状鳞片吧。",,,,,,,,"دمِّر الأشواك الموجودة على أرجله الخلفية المجنّحة،
ولن يكون سريعًا على الثلج مثلما كان! إذا أردت
أن تبطئ باريوث، فاستهدف هذه الأشواك.",,,,,,,,,,,
5a1d734d-1745-49f7-b256-4f42f90c8506,3052853391,HN_MonsterListMsg_EnemyIndex015_page1,"別名「土砂竜」。暑さから身を守るためか、
普段は泥の中に潜んでいる事もある。
泥をまとう行動も避暑のためだという説が有力。
まとった泥は攻撃にも使われるため要注意。
また、泥沼を荒されることを嫌い、
荒らす者には猪突猛進の勢いで襲い掛かってくる。","Barroth usually remain beneath the mud, perhaps
to shield themselves from heat; they are even
known to attack by flinging mud. They will charge
in a frenzy at anything that disturbs their bogs.","Les Barroth restent en général sous la boue
pour se protéger de la chaleur.
Ils attaquent en lançant de la boue.
Ils se jettent sur tout ce qui dérange
leur marais.","I Barroth solitamente rimangono nascosti nel fango,
forse per proteggersi dal caldo, ma caricano
furiosamente chiunque li disturbi nel loro pantano,
ricorrendo anche ai lanci di fango.","Barroth bleiben gewöhnlich unter dem Schlamm,
vermutlich, um sich vor Hitze zu schützen. Sie
werfen sogar zum Angreifen mit Schlamm.
Sie attackieren vehement alles, was ihrem Sumpf
zu nahe kommt.","Los Barroth normalmente se quedan bajo el barro,
quizá para protegerse del calor; incluso arrojan
barro para atacar. Cargan frenéticamente contra
todo aquello que perturbe sus barrizales.","Барроты обычно прячутся под слоем грязи — вероятно,
чтобы защитить себя от жары. Они даже
могут швыряться комьями грязи во врагов. Барроты
яростно атакуют всякого, кто вторгнется
в их трясину.","Barrothy zwykle pozostają pod powierzchnią błota,
zapewne chroniąc się przed ciepłem. Czasami atakują,
obrzucając przeciwnika błotem. Szarżują w szale
na każdego, kto zakłóca spokój ich bagien.",,,"O Barroth costuma permanecer embaixo da lama, talvez
para se proteger do calor; eles são conhecidos por
atacar jogando lama. Atacam freneticamente qualquer
coisa que perturbe seus pântanos.","별명 「토사룡」. 더위로부터 몸을 지키기 위해서인지
평소에는 진흙 속에 파묻혀 있는 경우도 있다.
진흙을 끼얹는 행위도 피서를 위해서라는 설이 유력.
몸에 두른 진흙은 공격에도 쓰이니 주의가 필요하다.
그리고 진흙탕을 더럽히는 걸 싫어해서
더럽힌 자에게 맹렬한 기세로 돌진해 온다.","人稱「土砂龍」。
或許是為了讓身體不受高溫影響，
平常也會潛在泥中。
一種可能性較高的假設指出，
牠將泥巴包覆在身上是為了避暑，
也會將其用於攻擊，須小心留意。
另外，牠討厭擾亂泥沼的訪客，
會橫衝直撞地攻擊不速之客。","人称“土砂龙”。或许是为了避暑，
平时会有潜入泥土中的情况。
较为有力的见解表示，
将泥土包裹在身上也是为了避暑。
要注意，其还会使用包裹在身上的泥土进行攻击。
另外，其讨厌沼泽被破坏，
若有破坏者出现，其会不顾一切地发动攻击。",,,,,,,,"عادةً ما يبقى باروث تحت الطين، ربما
ليحمي نفسه من الحرارة؛ حتى أنه معروف عنه أنه
يهاجم بقذف الطين. سيهاجم بضراوة أي
شيء يزعجه في مستنقعاته.",,,,,,,,,,,
63a243fa-e853-40bd-8ffb-883b95f094d9,2707177809,HN_MonsterListMsg_EnemyIndex015_page2,"ボルボロスは泥を飛ばし、周囲を泥まみれにしてしまう。
優位な狩猟にしたければ、ボルボロスが
泥をまとっている部位を攻撃して泥を剥がすと良い。
再び泥をまとわない限り、立ち回りやすくなるはずだ。","If you get hit by the mud a Barroth flings around,
you'll get muddy, which means that any pro hunter
should prioritize attacking the muddy parts of the
monster to clean it off! Once you've got rid of all
that mud, fighting it will be some good, clean fun!","Si la boue lancée par le Barroth vous touche,
celle-ci vous recouvrira. C'est pourquoi tout bon
chasseur se doit d'attaquer les parties boueuses du
monstre en priorité ! Une fois que vous en aurez
fini avec toute cette boue, il ne vous restera plus
qu'à faire le ménage !","Se il fango lanciato dal Barroth ti colpisce, può
impedirti alcune azioni. Per una caccia più
efficace, attacca prima di tutto le parti ricoperte
di fango per ferirlo. In questo modo sarà più facile
affrontarlo.","Ein Barroth schleudert Schlamm und kann dich so auch
damit bedecken. Um das zu verhindern, solltest du
die Teile von ihm angreifen, die mit Schlamm bedeckt
sind, um diesen so zu entfernen. Solange er sich
keinen neuen besorgt, hast du es erst mal leichter!","Si el Barroth te acierta con el barro que arroja,
te afectará el estado embarrado, así que primero
deberías centrarte en atacar las partes del monstruo
que están cubiertas de barro. Cuando ya esté limpio,
te resultará más fácil combatirlo.","Если по вам попадет грязь, которую швыряет Баррот,
вы запачкаетесь, а это значит, что любой опытный
охотник должен в первую очередь бить по грязным
частям монстра, чтобы очистить его! Когда счистите
с монстра всю грязь, бой станет по-настоящему
чистым.","Błoto rozrzucane przez Barrotha może cię oblepić.
Porządny łowca powinien zawsze najpierw atakować
błotne części potwora. Gdy już załatwisz sprawę
brudu, walka stanie się czystą zabawą!",,,"Se você for atingido pela lama que o Barroth lança,
ficará enlameado, o que significa que qualquer
caçador profissional deve atacar prioritariamente as
partes lamacentas do monstro para limpá-lo! Depois
de se livrar de toda a lama, lutar contra ele será
divertido e limpo!","볼보로스는 진흙을 날리며 주변을 진흙투성이로 만든다.
사냥을 유리하게 이끌려면 볼보로스가
진흙을 두른 부위를 공격해 진흙을 벗겨내는 게 좋다.
다시 진흙을 두르기 전까지는 상대하기 쉬워질 것이다.","土砂龍會甩出泥巴，將所經之處弄得滿是泥濘。
如果想要在狩獵時獲得優勢，不妨攻擊
土砂龍身上包覆著泥巴的部位使其剝落。
在牠身上沒有泥巴時，對付起來應該會相對輕鬆。","土砂龙会甩飞泥巴，把泥弄得到处都是。
如果想在狩猎中处于优势的话，攻击土砂龙
身上包裹着泥土的部位，将泥土剥落为好。
只要其不再次包裹泥土，走位也会变得轻松。",,,,,,,,"إذا تمت إصابتك بالطين الذي يطلقه باروث،
فستصبح موحلًا، وهذا يعني أنه ينبغي على أي صياد
محترف إعطاء الأولوية لمهاجمة الأجزاء الموحلة
من الوحش لقطعها! بمجرد أن تتخلص من كل هذا الطين،
سيكون القتال جيدًا إلى حد ما، فالنظافة رائعة!",,,,,,,,,,,
0fb093d4-5e3f-4bff-a20c-cf9adc6aaba0,3685368647,HN_MonsterListMsg_EnemyIndex016_page1,"大型化したルドロスの雄個体で、別名は「水獣」。
首にあるスポンジ状の鱗に大量の水分を含ませることで
表皮の乾燥を防ぎ、陸上での活動を助けている。
スポンジが萎縮し始めるとその能力を失うため、
水を蓄え回復を図ろうとする。また、
特殊な粘液を吐きだし、獲物の足元をすくって捕らえる。","Larger than regular Ludroth, Royal Ludroth use
their sponge-like mane to absorb water and keep
from drying out on land. Once the sponge loses
moisture, they will seek out water to recover.
They also spew mucus to trip up their prey.","Plus gros que le Ludroth ordinaire, le Ludroth royal
absorbe l'eau avec sa crinière spongieuse
pour ne pas s'assécher. Quand son éponge
sèche, il cherche de l'eau. Il crache du mucus
pour faire tomber sa proie.","Più grossi dei Ludroth comuni, i Ludroth reali hanno
una criniera sul collo simile a spugne che assorbe
l'acqua e consente loro di stare sulla terraferma
senza disidratarsi. Quando si secca, cercheranno di
raggiungere l'acqua per tornare in forma. Possono
anche sputare muco per far inciampare la preda.","Der Königs-Ludroth ist größer als der gewöhnliche
Ludroth und nutzt seine schwammähnliche Mähne,
um Wasser aufzusaugen und an Land nicht auszu-
trocknen. Verliert der Schwamm Feuchtigkeit, sucht
er Wasser auf, um sich zu erholen. Er speit Schleim,
der Beute zu Fall bringt.","El Ludroth Real usa su característica melena
esponjosa para absorber agua y así evitar secarse
en tierra. Cuando esta haya perdido todo el agua,
intentará dar con más para recuperarse.
Además, suelen escupir mucosidades para confundir
a sus presas.","Королевские Лудроты крупнее обычных, своей
губчатой гривой на шее они поглощают воду, что
не дает им засохнуть на суше. Как только влага
в губке заканчивается, они пытаются снова
зайти в воду, чтобы восстановить запас. Также плюют
в жертву слизью, чтобы опрокинуть ее.","Ludrothy Królewskie są większe od zwykłych
Ludrothów. Dzięki gąbczastej grzywie na karku
pochłaniają wodę i nie wysychają na lądzie.
Gdy gąbka traci wilgoć, szukają wody, aby ponownie
nasączyć grzywę. Plują śluzem, który utrudnia
ruchy ofierze.",,,"Maior que o Ludroth comum, o Ludroth Real usa
sua juba esponjosa para absorver a água
e evitar secar em terra. Depois que a
esponja perde a umidade,
eles buscarão água para se recuperar.
Também expelem um muco para derrubar
suas presas.","대형화한 루드로스의 수컷 개체, 별명은 「수괴수」.
목에 있는 스펀지 모양 비늘에 대량의 수분을 비축해
피부 건조를 방지하고 육상 활동을 할 수 있다.
스펀지가 쭈그러들면 그 능력을 잃어버리기 때문에
물을 비축해 회복하려고 한다.
또한, 특수한 점액을 토해 사냥감의 발을 묶는다.","大型的雄性水生獸個體，人稱「水獸」。
可利用脖子處的海綿狀鱗片儲存大量水分
以防止表皮乾燥，使其得以在陸地上活動。
若海綿萎縮，便會失去該功能，
因此牠會試圖補充水分。
另外，還會朝獵物的腳下吐出特殊的黏液，藉此捕捉獵物。","巨大的水生兽雄性个体，人称“水兽”。
颈部的海绵状鳞片内含大量水分，
可防止表皮干燥，有助于其陆地行动。
但若海绵开始萎缩便会丧失此能力，
因此其会尝试储蓄水分以求回复。
此外，会吐出特殊粘液来绊倒并捕获猎物。",,,,,,,,"كونه أكبر من لودروث العادي، يستخدم لودروث الملكي عرفه
الذي يشبه الإسفنجة لامتصاص المياه حتى لا يتعرض
للجفاف على الأرض. بمجرد أن تفقد الإسفنجة
الرطوبة، سيسعى للوصول إلى الماء لترطيبها.
كما أنه يقذف المخاط ليجعل فريسته تتعثر.",,,,,,,,,,,
0f622eaf-c2ca-4216-a961-8feb4c9ff011,1616994559,HN_MonsterListMsg_EnemyIndex016_page2,"ロアルドロスの攻撃は水辺であるほど効果が増す。
また、「水属性やられ」になることがあるため、
前もって<COL RED>ウチケシの実</COL>を用意しておけば、
回復できるだろう。水のない場所へ誘導すれば、
少しは立ち回りやすくなるはずだ。","The Royal Ludroth's attacks are empowered when
in proximity of water, and can inflict foes with water-
blight. Combat this by stocking up on <COL RED>Nulberries</COL>
and drawing the creature away from aquatic areas.","Les attaques du Ludroth royal sont renforcées quand
il est proche de l'eau et peuvent infliger le
fléau-eau. Évitez cela en ayant un bon stock de
<COL RED>Baies-soin</COL> et en l'attirant loin des zones
aquatiques.","Gli attacchi del Ludroth reale sono più potenti in
prossimità dell'acqua e possono infliggere
malus da acqua. Affrontalo facendo scorta di
<COL RED>nulbacche</COL> e attiralo lontano dalle aree acquatiche.","Die Angriffe des Königs-Ludroth werden durch die
Nähe zu Wasser verstärkt und können Gegner mit
Wasserpest belegen. Besorge dir reichlich <COL RED>Nullbeeren</COL>
und locke die Kreatur weg vom Wasser, um deine
Chancen zu erhöhen.","Los ataques del Ludroth Real ganan potencia cuando
está cerca del agua y pueden infligir plaga de agua
a sus enemigos. Enfréntate a esto con un buen montón
de <COL RED>curibayas</COL> y alejando a la bestia de zonas
acuáticas.","Атаки Королевского Лудрота усиливаются рядом с водой
и могут накладывать на соперников водную порчу.
Чтобы противостоять этому, запаситесь <COL RED>Пустоягодами</COL>
и выманивайте монстра подальше от воды.","Ataki Ludrotha Królewskiego są wzmacniane bliskością
wody. Wróg rażony jest wtedy wodną plagą.
Żeby temu zaradzić, zaopatrz się w <COL RED>oczystki</COL>
i próbuj odciągnąć potwora od zbiorników wodnych.",,,"Os ataques do Ludroth Real são fortalecidos quando
ele está próximo à água e podem afetar inimigos com
flagelo de água. Combata-o estocando <COL RED>Nulafrutas</COL>
e afastando a criatura de áreas aquáticas.","로아루드로스의 공격은 물가에 있을수록 강해진다.
또한 「물속성 피해」에 걸리는 경우가 있어
미리 <COL RED>지움열매</COL>를 준비해 두면 회복할 수 있다.
물이 없는 곳까지 유인하면
조금은 상대하기 쉬워질 것이다.","越靠近水邊，水獸的攻擊就會變得越強。
若遭到攻擊，可能會陷入「水屬性異常」，
只要事前準備<COL RED>打消果實</COL>就能從異常中回復。
如果將其引導至沒有水的地方，狩獵將會輕鬆一些。","水兽越靠近水边，攻击就越强大。
受到其攻击，还可能会陷入“水属性异常状态”，
可事前备好<COL RED>打消果实</COL>用于解除异常。
将其引诱到没有水的地方，
就能使战斗更为有利。",,,,,,,,"تزداد قوة هجمات اللودروث الملكي بالقرب
من الماء، ويمكنه إصابة خصومه،
بقذائف الماء. يمكنك نزاله عن طريق تخزين<COL RED>نولبيري</COL>
واستدراج الوحش بعيدًا عن المناطق المائية.",,,,,,,,,,,
7ef68e38-acbf-4dcf-8587-dbb9f518d7f7,1223255925,HN_MonsterListMsg_EnemyIndex017_page1,"鳥竜種に分類される肉食モンスター。
寒冷地になじむ青白い皮膚の色と、
大きく隆起した頭部の突起が特徴。
その狡猾な頭脳でバギィの群れを統率する。
狩りをする際には集団で獲物を追い込み、
特殊な体液で昏睡させて仕留めるため、
「眠狗竜」とも呼ばれている。","A carnivorous bird wyvern. Noted for their
projecting cranial crests and bluish-white
skin that's adapted to snowy climates.
Great Baggi craftily command other Baggi
to surround their prey and stun them with
a tranquilizing fluid.","Une wyverne rapace carnivore. Le Grand Baggi est
renommé pour sa crête crânienne imposante et son
pelage bleu et blanc parfaitement adapté aux
climats enneigés. Il est capable d'ordonner aux
autres Baggi d'encercler leurs proies et de les
paralyser avec un fluide tranquillisant.","Wyvern rapace carnivoro noto per la sua cresta
prominente e dalla pelle bianco-bluastra, adatta
alle regioni nevose. I Gran Baggi ordinano
astutamente agli altri Baggi di circondare le prede
e stordirle con un fluido tranquillante.","Ein fleischfressender Vogelwyvern, bekannt für
die hervorstehenden Kämme an seinem Schädel
und die bläulich weiße Haut, die an das Leben in
Schneegebieten angepasst ist. Großbaggi sind listig;
sie befehlen anderen Baggi, ihre Beute zu umzingeln
und diese mit einer beruhigenden Flüssigkeit zu
betäuben.","Un ave wyvern carnívora. Característica por su
cresta craneal y su piel blanquiazul adaptada
a climas nevados. El Gran Baggi ordena con astucia
a otros Baggi que rodeen a su presa y la paralicen
con un fluido tranquilizante.","Плотоядная пернатая виверна. Примечательна
черепными гребнями и синевато-белой кожей,
приспособленной к снежному климату. Большой Багги
умело командует другими Багги, приказывая им
окружить жертву, после чего оглушает ее
жидкостью-транквилизатором.","Mięsożerna wiwerna ptasia. Na uwagę zasługuje
czaszkowy grzebień oraz niebiesko-biała
skóra przystosowana do śnieżnego klimatu.
Wielkie Baggi nakazują pozostałym Baggi
otaczać ofiary i oszałamiać je
płynem o działaniu otępiającym.",,,"Um serpássaro carnívoro. Notável por suas cristas
cranianas projetadas e pele branca azulada, adaptada
ao clima nevado. O Grande Baggi comanda habilmente
outros Baggis para cercar suas presas e atordoá-las
com um fluido tranquilizante.","조룡종으로 분류되는 육식 몬스터.
한랭지에 잘 녹아드는 청백색 피부와
크게 튀어나온 머리의 돌기가 특징.
교활한 두뇌로 바기 무리를 통솔한다.
사냥할 때 집단으로 사냥감을 몰아넣고
특수한 체액으로 혼수상태로 만들기에
「면구룡」이라고도 불린다.","被分類為鳥龍種的肉食性魔物。
特徵為能夠融入寒冷地區景色的淺藍色皮膚，
以及頭上高高隆起的巨角。
靠著其狡猾的腦袋統領著眠狗龍群。
因為其在狩獵時會成群結隊追趕獵物，
並以特殊體液使獵物昏睡後加以獵殺，
所以也被稱作「眠狗龍」。","被分类为鸟龙种的肉食性怪物。
特征是适应寒冷地域的苍白肤色
及头部的巨大突起。
大型个体以其狡诈的头脑统率族群。
狩猎时集体行动围捕猎物，
因其以特殊体液令猎物陷入昏睡，
故此人称“眠狗龙”。",,,,,,,,"تنين مجنح شبيه بالطيور آكل للحوم. معروف بعرض
عرفه الملكي وجلده الأبيض المزرق
الذي تأقلم مع البيئات المناخية الثلجية.
باجي العظيم يأمر وحوش باجي الأخرى
ببراعة بمحاصرة فرائسها وإصابتها بسائل
مخدّر.",,,,,,,,,,,
