guid,crc?,entry name,Japanese,English,French,Italian,German,Spanish,Russian,Polish,Dutch,Portuguese,PortugueseBr,Korean,TraditionalChinese,SimplifiedChinese,Finnish,Swedish,Danish,Norwegian,Czech,Hungarian,Slovak,Arabic,Turkish,Bulgarian,Greek,Romanian,Thai,Ukrainian,Vietnamese,Indonesian,Fiction,Hindi,LatinAmericanSpanish
b567e495-75a9-4101-8105-37ed4cd9b43b,2185198469,HN_MonsterListMsg_EnemyIndex042_page2,"クルルヤックは抱えた岩で身を守ったり、
叩きつけて攻撃に利用したりするようだ。
怯ませたり、閃光で目を眩ませて岩を落とさせる、
あるいは、ヒビ割れた岩は攻撃して壊すなど、
岩を持たせない立ち回りが重要となるだろう。","A Kulu-Ya-Ku uses small boulders to shield itself or
smash against its enemies. Force it to drop whatever
it's holding by staggering or blinding it, or if it's
holding a cracked boulder, attack it to break it.","Le Kulu-Ya-Ku utilise des rochers pour se protéger
ou attaquer. Forcez-le à lâcher
ce qu'il tient en le faisant vaciller ou
en l'aveuglant, ou s'il tient un rocher fissuré,
attaquez ce dernier pour le briser.","Il Kulu-Ya-Ku usa i massi come scudo e come arma
allo stesso tempo. Puoi farlo vacillare o accecarlo
per fargli cadere gli oggetti dalle zampe oppure,
se sta usando un masso già crepato, puoi attaccarlo
per frantumarlo.","Der Kulu-Ya-Ku nutzt kleine Felsen als Schilde oder
schleudert sie auf Feinde. Bringe ihn ins Wanken
oder blende ihn, damit er fallenlässt, was immer er
trägt. Wenn es ein Felsbrocken mit Riss ist, greife
diesen an, um ihn zu zerbrechen.","El Kulu-Ya-Ku usa rocas a modo de escudo y para
estrellarlas contra sus enemigos. Atúrdelo o ciégalo
para obligarle a soltar lo que tuviera aferrado o,
si se trata de una roca agrietada, ataca para
romperla.","Кулу-Йа-Ку использует небольшие камни, чтобы
защищать себя или отбиваться от врагов. Заставьте
его выбросить свою ношу, сбив монстра с ног или
ослепив. Если же Кулу-Йа-Ку держит треснувший
камень, атакуйте монстра, чтобы сломать его.","Kulu-Ya-Ku używa małych głazów do osłony lub
ciskania we wrogów. Zmuś bestię do upuszczenia
tego, co trzyma, wytrącając ją z równowagi
lub oślepiając. Jeśli niesie
pęknięty kamień, zniszcz go atakiem.",,,"O Kulu-Ya-Ku usa pequenas rochas para se proteger ou
esmagar inimigos. Derrube o que ele estiver
segurando atordoando-o ou cegando-o; ou, se ele
estiver segurando uma rocha trincada, ataque-a
para quebrá-la.","쿠루루야크는 껴안은 바위로 몸을 보호하거나
내려치는 데 이용하는 듯하다. 움찔하게 하거나
섬광으로 눈부시게 만들어 바위를 떨어뜨리게 하거나
금이 간 바위를 공격해서 부수는 등,
바위를 못 들고 있게 만드는 것이 중요하다.","搔鳥抱起岩石時，除了用來保護自己，
似乎也會使用岩石敲擊敵人。
狩獵的重點在於避免讓牠使用岩石戰鬥。
可以使其膽怯、以閃光奪其視野令岩石掉落，
或是直接破壞裂開的岩石等等。","搔鸟除了抱着岩石保护自己，
似乎也会以岩石敲打作为攻击手段。
可令其畏缩或用闪光造成目眩，迫使其放开岩石，
也可攻击开裂的岩石，将岩石破坏。
狩猎的重点就在于不能让它利用岩石。",,,,,,,,"يستخدم كولو-يا-كو الصخور الصغيرة لحماية نفسه
أو قذفها على أعدائه. أجبره على رمي
ما يحمله عن طريق صدمه أو التسبب في عماه
وإذا كان يحمل صخرة متشققة، فهاجمها لتكسيرها.",,,,,,,,,,,
a24083a2-e5e5-4cc0-9d10-e05d2c9601fb,2259975584,HN_MonsterListMsg_EnemyIndex043_page1,"泥湿地に生息する魚竜。泥を利用して獲物を捕らえたり
身を守るため、別名「泥魚竜」とも呼ばれている。
鱗が乾燥すると強度が落ちて脆くなる上に、
皮膚呼吸の効率も落ちてしまうため、
常に泥で身体を潤していると推察されている。
ジュラトドスの吐く泥は粘性が強く、地面に残った
泥に触れてしまうと動きが制限されるため注意が必要。","A piscine wyvern that inhabits swamps,
utilizing the mud there to hunt and survive.
It wallows in the mire to maximize cutaneous
respiration and preserve the toughness of its
scales. The sludge it spits is highly viscous, so
watch where you step, lest you get stuck in it.","Une wyverne aquatique qui réside dans les marais et
se sert de la boue que l'on y trouve pour chasser
et survivre. Elle se prélasse dans le bourbier pour
bien hydrater sa peau et préserver la robustesse de
ses écailles. La vase qu'elle crache est hautement
visqueuse, alors attention où vous mettez les pieds
ou vous risquez de ne plus pouvoir bouger.","Wyvern acquatico che vive nelle paludi e utilizza
il fango per cacciare e sopravvivere. Sguazza nel
pantano per sfruttare al meglio la respirazione
cutanea e preservare la robustezza delle sue
scaglie. Sputa una melma molto viscosa in cui è
facile rimanere intrappolati se la si calpesta.","Ein Fischwyvern, der in Sümpfen lebt und den
dort vorhandenen Schlamm zur Jagd und zum
Überleben nutzt. Er wälzt sich im Schlamm, um
maximal viel Sauerstoff über die Haut aufzunehmen
und die Härte seiner Schuppen zu bewahren. Die
Brühe, die er speit, ist sehr zähflüssig, also pass
auf, wohin du trittst, sonst bleibst du stecken.","Un wyvern acuático que vive en pantanos y que usa
el barro para cazar y sobrevivir. Se revuelca en el
fango para maximizar su capacidad respiratoria y
preservar la dureza de sus escamas. El lodo que
escupe es muy viscoso, así que cuidado donde pisas
o te quedarás atrapado.","Ихтиовиверна, населяющая болота, чей ил помогает
ей охотиться и выживать. Она валяется в иле, чтобы
по максимуму задействовать кожное дыхание
и сохранить крепость чешуи. Плюется очень вязкой
слюной, в которой легко можно увязнуть.","Wiwerna rybia zamieszkująca bagna.
Aby przetrwać i polować, wykorzystuje błoto.
Tarza się w nim, aby zwiększyć natężenie
oddychania skórnego i zachować twardość
łusek. Wypluwana przez nią
wydzielina jest wyjątkowo lepka,
dlatego należy uważać na każdy krok.",,,"Uma hidroserpe que habita pântanos, utilizando
a lama para caçar e sobreviver. Mergulha na lama
para maximizar a respiração cutânea e preservar
a resistência de suas escamas.
O lodo que ela cospe é altamente viscoso; portanto,
cuidado onde pisa, para não ficar preso nele.","습지에 사는 어룡. 진흙을 이용해
사냥하고 몸을 지키는 습성이 있어
「이어룡」이라는 별명으로도 불린다.
비늘이 건조해지면 강도가 떨어져 물러지고
피부 호흡의 효율도 떨어지기 때문에
항상 진흙으로 몸을 적시는 것으로 추측된다.
쥬라토도스가 뱉는 진흙은 점성이 높아 지면에 있는
진흙에 닿으면 움직임을 둔해지니 주의해야 한다.","棲息在泥沼地的魚龍。由於在捕捉獵物
及保護自身時都會使用泥巴，故被稱為「泥魚龍」。
牠的鱗片一旦乾燥就會變得脆弱，
皮膚的呼吸效率也會降低，
因此人們推測牠會頻繁使用泥巴來保持身體濕潤。
泥魚龍吐出的泥巴具有強烈黏性，如果碰到
地上的泥巴，行動將會受限，需特別注意。","栖息于泥泞湿地的鱼龙。
利用湿泥捕捉猎物、防护己身，人称“泥鱼龙”。
鳞片一旦干燥，就会失去强度变脆，
皮肤呼吸的效率也会降低。
因此推断其用泥来保持身体湿润。
泥鱼龙吐出的泥黏性较强，
接触到其残留在地面的泥，行动就会受限，要注意。",,,,,,,,"تنين مجنح سباح يسكن المستنقعات،
يستخدم الطين للصيد والنجاة.
وهو يغرق في المستنقع ليزيد من تنفس جلده
والحفاظ على صلابة
قشوره. الوحل الذي يلفظه لزج للغاية، لذا راقب
خطواتك، وإلا ستعلق به.",,,,,,,,,,,
e814b770-79b0-4bf6-b7de-4212997d2579,3882845975,HN_MonsterListMsg_EnemyIndex043_page2,"泥をまとった箇所は硬くなるため、
水属性を持つ武器などで、
泥を剥がしながら立ち回るといいだろう。
泥の上では動きが制限されるため、
常に泥の位置を意識したい。","A Jyuratodus's mud-caked carapace is tough, so use
water-elemental weapons to dissolve the mud and get
to its squishy core. Stepping in its mud slows you
down, so pay attention to your footing.","La carapace de boue du Jyuratodus est robuste, alors
utilisez des armes à l'élément Eau pour vous
débarrasser de la boue et atteindre son cœur mou.
Marcher dans sa boue vous ralentit, alors attention
où vous mettez les pieds.","Il carapace del Jyuratodus è molto resistente e
ricoperto da uno strato di fango. Usa armi con
elemento acqua per sciogliere la fanghiglia ed
esporre il corpo molle del mostro. Attenzione
a dove metti i piedi: il fango ti rallenterà.","Der schlammbedeckte Rückenpanzer des Jyuratodus ist
nur schwer zu knacken. Beseitige den Schlamm mit
Wasserelementwaffen, um zu dem weichen Kern durch-
zudringen. Sein Schlamm macht dich langsamer, also
pass auf, wo du hintrittst.","El caparazón embarrado del Jyuratodus es muy duro,
así que usa armas de agua para disolver el barro y
alcanzar su blando núcleo. Irás más lento si pisas
el barro, así que mira dónde pones los pies.","Образованный запекшейся грязью панцирь Юратода очень
крепок, пользуйтесь оружием водной стихии, чтобы
растворить грязь и добраться до скрытой за ней
мягкой сердцевины. Ходьба по этой грязи замедляет
вас, так что смотрите под ноги.","Pokryty błotem karapaks Jyuratodusa jest
twardy, więc użyj broni z żywiołem wody, żeby go
rozpuścić i dobrać się do miękkiego wnętrza.
Błoto spowolni twoje ruchy, więc uważaj,
gdzie stawiasz kroki.",,,"A carapaça coberta de lama de um Jyuratodus é dura,
portanto, use armas elementais de água para
dissolver a lama e atingir seu núcleo mole.
Ao pisar na lama, você fica mais lento, portanto,
preste atenção no chão.","진흙을 두른 부위는 단단해지기 때문에
물속성을 가진 무기 등을 이용해
진흙을 벗겨내며 상대하는 것이 좋다.
진흙 위에서는 움직임이 제한되기 때문에
항상 진흙의 위치를 의식하며 상대하면 좋다.","覆蓋著泥巴的部位會變硬，
可以使用水屬性的武器，
在戰鬥的同時剝除牠身上的泥巴。
在泥濘上移動時會受到限制，
最好時時注意泥濘的位置。","包裹泥巴的部位十分坚硬，
狩猎时可使用水属性武器等
将泥巴剥落。
站在泥巴上行动会受到限制，
所以要时刻注意泥巴的位置。",,,,,,,,"درقة جيوراتودوس المغطاة بالطين صلبة للغاية،
لذا استخدم أسلحة ذات عنصر ماء لإذابة الطين والوصول
إلى مركزها اللين. سيؤدي الوطء في طينه إلى إبطائك،
لذا راقب خطواتك.",,,,,,,,,,,
545d730d-f4f1-41a4-bf6f-a4791c57fc90,3709791150,HN_MonsterListMsg_EnemyIndex044_page1,"樹上に生息し木々を飛び回って活動する牙竜種。
木や地面に身体を擦りつけながら移動することで
体毛に静電気を溜め込む性質を持つ。
ある程度静電気が溜まると「帯電状態」になり、
体毛が発光し逆立つため、この状態のトビカガチを
目撃した場合は特に頭と尻尾の攻撃に注意したい。
その生態から、別名「飛雷竜」と呼ばれている。","A fanged wyvern that flies among the treetops.
Its penchant to brush against the ground and
the trees as it moves around builds up static
electricity within its fur. This action allows it to
reach a charged state—identified by its glowing
fur—in which its head and tail attacks are said
to be particularly lethal.","Une wyverne à crocs qui aime voler entre les cimes
des arbres. Elle se charge en électricité statique
en se frottant aux arbres ou au sol lorsqu'elle
se déplace. Ceci lui permet d'atteindre un état de
surcharge, que l'on peut repérer à sa fourrure
brillante, lors duquel ses attaques de queue et
frontales seraient particulièrement dangereuses.","Un wyvern zannuto che volteggia tra le cime degli
alberi. È in grado di generare elettricità statica
quando il suo pelo viene a contatto con il terreno e
la vegetazione. Questo gli permette di raggiungere
uno stato di carica, riconoscibile dalla luminosità
del pelo, durante il quale gli attacchi sferrati con
testa e coda sono particolarmente letali.","Dieser Reißzahn-Wyvern fliegt zwischen den
Baumwipfeln und ist bekannt dafür, den Boden
und Bäume zu streifen, um statische Elektrizität
im Fell aufzubauen. Auf diese Weise erreicht er
einen geladenen Zustand – erkennbar am leuchtenden
Fell –, in dem seine Angriffe mit Kopf und Schwanz
angeblich besonders tödlich sind.","Wyvern de colmillos que vuela entre los árboles.
Su afición por frotarse con la tierra y los árboles
al moverse genera electricidad estática en su
pelaje. Esto le permite alcanzar un estado cargado
(característico por el pelaje luminoso) durante el
que sus cabezazos y coletazos son aún más letales.","Клыкастая виверна, прячущаяся среди деревьев.
Передвигаясь, любит прижиматься к земле
и деревьям, из-за чего в шерсти накапливается
статический заряд. В наэлектризованном состоянии,
когда мех светится, ее атаки головой и хвостом
особенно опасны.","Uzbrojona w kły wiwerna fruwająca między drzewami.
Lubi tarzać się po ziemi i ocierać o drzewa,
co wytwarza na jej skórze ładunek elektrostatyczny.
Dzięki temu zwierzę wchodzi w stan naładowania,
który można rozpoznać po świecącym
futrze. W tym czasie szczególnie groźne
są jej ataki głową i ogonem.",,,"Uma serpe com presas que voa entre as copas das
árvores. Sua propensão a roçar no chão e nas
árvores, enquanto se move acumula eletricidade
estática em seu pelo. Essa ação permite alcançar
um estado de carga — identificado por seu pelo
brilhante — no qual seus ataques de cabeça e cauda
são considerados particularmente letais.","나무 위에 서식하며 나무를 뛰어다니는 아룡종.
나무나 지면에 신체를 문지르며 이동해서
체모에 정전기를 축적하는 성질을 가졌다.
어느 정도 정전기가 모이면 「대전 상태」가 되어
체모가 빛나고 곤두서는데, 이 상태의 토비카가치를
목격했다면 머리와 꼬리 공격에 특히 주의해야 한다.
이런 생태 때문에 「비뢰룡」이라는 별명으로 불린다.","棲息在樹上，會在林間跳躍活動的牙龍種。
具有在移動時以身體摩擦樹木與地面，
藉此將靜電積蓄於體毛當中的特性。
只要累積一定量的靜電，就會進入「帶電狀態」，
此時體毛將會發光且倒豎。如果在這個狀態
遭遇牠，必須格外小心其頭部與尾巴的攻擊。
牠也因為這樣的生態，而被稱為「飛雷龍」。","栖息于树上，在林木间飞舞活动的牙龙种。
移动时会摩擦树木或地面，使体毛蓄积静电。
静电积蓄到一定程度便成为“带电状态”，
体毛会发光倒竖，目击到该状态下的此怪物时，
要尤其注意头部和尾巴发出的攻击。
因其生态，人称“飞雷龙”。",,,,,,,,"تنين مجنح ذو أنياب يطير بين قمم الأشجار.
يميل للاحتكاك بالأرض
والأشجار بينما يتحرك ليجمّع الكهرباء
الساكنة في فرائه. يتيح له هذا الإجراء
الوصول إلى حالة مشحونة؛ يتم التعرف عليه
بفروه المتوهج، ويقال إن هجمات ذيله
مميتة للغاية.",,,,,,,,,,,
9d7afd30-34bd-4fb7-8c60-742c41d0aaf3,4035756581,HN_MonsterListMsg_EnemyIndex044_page2,"縦横無尽に動き回るため死角からの攻撃に注意。
常に視界に捉えつつ、移動の足止めをしながら
「帯電状態」への移行を封じることが重要となる。
「水やられ」になると帯電状態になりにくいため、
環境生物なども積極的に利用していきたい。","Always keep the Tobi-Kadachi in your sights to avoid
being ambushed from behind. The key to defeating
this monster is to immobilize it and prevent it from
reaching a charged state. If you can make use of
endemic life to afflict it with waterblight, it'll
no longer be able to charge itself up.","Gardez toujours en vue le Tobi-Kadachi pour éviter
de vous faire surprendre par derrière lorsqu'il va
d'arbre en arbre. Pour le vaincre, empêchez-le
de se mouvoir et de générer de l'électricité. Si
vous pouvez utiliser la Faune locale pour lui infliger
le fléau-eau, il ne pourra plus générer d'énergie.","Tieni sempre d'occhio il Tobi-Kadachi per evitare di
farti cogliere di sorpresa da dietro. Il segreto
per sconfiggere questo mostro è immobilizzarlo e
impedirgli di caricarsi. Se riesci a sfruttare la
fauna endemica per infliggergli malus da acqua,
non potrà più caricarsi.","Behalte den Tobi-Kadachi stets im Auge, um nicht von
ihm überrumpelt zu werden. Willst du dieses Monster
besiegen, musst du verhindern, dass es in seinen
aufgeladenen Zustand gelangt. Wenn du es mithilfe
Einheimischer Wesen mit der Wasserpest belegen
kannst, kann es sich nicht mehr aufladen.","Ten siempre controlado al Tobi-Kadachi para evitar
que te ataque por la espalda. La clave para vencerle
es inmovilizarlo y evitar que alcance un estado de
carga. Si puedes usar la fauna local para infligirle
plaga de agua, no podrá cargar.","Всегда внимательно следите за Тоби-Кадачи, чтобы
не дать ему внезапно напасть сзади. Ключ к победе
над этим монстром — обездвижить его и не дать ему
накопить силы для атаки. Если у вас получится
наложить на Тоби-Кадачи водную порчу с помощью
местной живности, он больше не сможет набирать силы.","Nie spuszczaj wzroku z Tobi-Kadachi, aby uniknąć
zaskoczenia od tyłu. By pokonać tego potwora, musisz
go unieruchomić i uniemożliwić mu naładowanie się.
W tym celu możesz użyć lokalnej fauny, aby
zarazić go plagą wody – nie będzie
wtedy mógł się ładować.",,,"Sempre mantenha o Tobi-Kadachi sob sua mira para
evitar ser emboscado por trás. A chave para derrotar
esse monstro é imobilizá-lo e impedi-lo de alcançar
um estado carregado. Se você puder usar a vida
nativa para afetá-lo com o Flagelo de Água,
ele não poderá mais se carregar.","종횡무진 움직이기에 사각지대에서의 공격에
주의해야 한다. 항상 시야 안에 두고 이동을 저지시켜
「대전 상태」가 되는 것을 막는 것이 중요하다.
「물 피해」 상태가 되면 대전 상태가 되기
어렵기 때문에 환경생물을 적극적으로 이용하면 좋다.","由於飛雷龍能夠自在地移動，因此須注意來自死角的攻擊。
狩獵的重點在於避免讓牠離開自己的視野，
阻止牠移動，並同時阻止牠進入「帶電狀態」。
當牠處於「水屬性異常」狀態時，將難以進入帶電狀態。
因此積極利用環境生物等手段狩獵吧。","会自由自在地到处移动，因此要注意它来自死角的攻击。
狩猎时的重点就是要片刻不让它脱离视野，
阻止它移动以及变成“带电状态”。
陷入“水异常状态”后，它就不易变为带电状态，
还望积极利用环境生物等。",,,,,,,,"ضع توبي-كاداتشي في مرمى بصرك دائمًا لتجنب
مباغتتك من الخلف. أساس هزيمة هذا الوحش
هو شل حركته ومنعه من
الوصول إلى حالة الشحن. إذا أمكنك استخدام
الحياة المستوطنة لإصابته بلفحة مياه
فلن يتمكن من شحن نفسه.",,,,,,,,,,,
82d9cf6b-ffe3-48b0-863b-d240461976f4,2102415765,HN_MonsterListMsg_EnemyIndex045_page1,"獲物を求め、各地に出没している大型の飛竜。
身体から垂れ下がる、無数の爆発性の鱗を
一面に撒き散らし、周囲に存在するすべてのものを
巻き込みながら狩りをおこなう。
この爆発を引き起こす性質の鱗は爆鱗と呼ばれ、
バゼルギウスが「爆鱗竜」と呼ばれる所以である。","A nefarious flying wyvern that travels the
world in search of prey. It scatters its own
explosive scales over a wide area to prey
on whatever gets caught in the blast.
In some places, this has earned it
the nickname ""Bomber Wyvern.""","Une infâme wyverne volante qui parcourt le monde
en quête de proies. Elle répand ses propres
écailles explosives pour piéger ses victimes dans
les flammes. Cela lui a valu le surnom de
""Wyverne explosive"" dans certaines régions.","Un malvagio wyvern volante che solca i cieli di
tutto il mondo in cerca di prede. Lancia scaglie
esplosive che intrappolano la preda, lasciandola
soccombere avvolta tra le fiamme. In alcune regioni,
è soprannominato ""wyvern bombardiere"".","Ein ruchloser Flugwyvern, der die Welt auf der
Suche nach Beute durchstreift. Er kann seine
explosiven Schuppen verteilen, die Opfer in
Flammen hüllen. Diese Jagdstrategie hat ihm
mancherorts den Spitznamen ""Bomber-Wyvern""
eingebracht.","Un malvado wyvern volador que recorre el mundo
en busca de presas. Esparce escamas explosivas
por amplias superficies para cazar y alimentarse
de criaturas atrapadas en la explosión. Se le conoce
como el ""bombardero wyvern"" en algunos lugares.","Летающая виверна с дурной славой, что рыщет
по свету в поисках добычи. Широко разбрасывает свою
взрывную чешую, чтобы поражать взрывом добычу.
В некоторых местах получила за это
прозвище ""Виверна-бомбардировщик"".","Złośliwa latająca wiwerna przemierzająca świat
w poszukiwaniu ofiar. Rozrzuca wybuchowe
łuski na dużym obszarze, by później
żerować na swoich zdobyczach.
W niektórych miejscach zyskała
przydomek „wiwerny bombardującej”.",,,"Uma serpe voadora nefasta que viaja pelo mundo
em busca de presas. Dispersa escamas explosivas
sobre uma área ampla para atacar os alvos pegos
pela explosão. Em alguns lugares, ela ganhou
o apelido de ""Serpe bombardeira"".","사냥감을 찾아 각지에 출몰하는 대형 비룡.
몸에 달린 무수한 폭발성 비늘을 뿌려서
주위에 존재하는 모든 것이 폭발에
휘말리게 하는 방식으로 사냥을 한다.
폭발을 일으키는 성질을 가진 비늘을
폭린이라 하며 바젤기우스가
「폭린룡」이라 불리는 이유이기도 하다.","出沒於各地尋找獵物的大型飛龍。
會將身體垂下，朝特定方向灑出無數
具爆炸性質的鱗片，將周圍的東西
全部席捲進去的方式進行狩獵。
此具有爆炸性質的鱗片被稱為爆鱗，
也是牠被稱作「爆鱗龍」的原因。","为寻求猎物而出没于各地的大型飞龙。
狩猎时会将身周四垂的无数爆炸鳞大肆泼撒，
席卷周围的一切。
此可引发爆炸之鳞被称为爆鳞，
其“爆鳞龙”之名，便是由此而来。",,,,,,,,"تنين مجنح شرير يجوب العالم للبحث
عن فريسة. فهو ينشر
قشوره المتفجرة في منطقة واسعة لافتراس
أي شيء يقع داخل الانفجار.
ولهذا اكتسب لقب
""التنين المجنح قاذف القنابل"" في بعض الأماكن.",,,,,,,,,,,
