guid,crc?,entry name,Japanese,English,French,Italian,German,Spanish,Russian,Polish,Dutch,Portuguese,PortugueseBr,Korean,TraditionalChinese,SimplifiedChinese,Finnish,Swedish,Danish,Norwegian,Czech,Hungarian,Slovak,Arabic,Turkish,Bulgarian,Greek,Romanian,Thai,Ukrainian,Vietnamese,Indonesian,Fiction,Hindi,LatinAmericanSpanish
56d57b77-80a5-4c3d-8ac9-a3a0f2fb1f2a,288517281,HN_MonsterListMsg_EnemyIndex029_page1,"発達した尻尾が特徴的なモンスター。
雑食性だが特に果実が好物で、腹部の袋に、
様々な効果を持つ柿を蓄えている。
好奇心旺盛でいたずら好きな一面もあり、
狩りをおこなう際に、尻尾などを使って、
柿を獲物に投げつけている姿が目撃されている。
別名「天狗獣」と呼ばれている。","A monster with a distinctive tail. While it is
omnivorous, it has a preference for fruit,
and keeps various fruits with all kinds of
effects in its belly pouch. An incredibly
curious beast, it enjoys playing tricks on
people, and has been seen to bat fruit at
its prey using its tail.","Un monstre avec une queue distincte. Bien qu'il
soit omnivore, il préfère les fruits et conserve
toutes sortes de fruits aux divers effets dans sa
poche. Il est curieux et adore s'amuser à jouer
des tours ; il a été aperçu à jeter des fruits
sur ses proies avec sa queue.","Mostro dalla caratteristica coda. È onnivoro, ma ama
la frutta e ne conserva diversi tipi dagli svariati
effetti nella sacca che ha sul ventre. È una bestia
incredibilmente curiosa, adora fare scherzi e,
spesso, usa la coda per scagliare frutti contro
le sue prede.","Ein Monster mit unverkennbarem Schwanz. Der
Bishaten ist ein Allesfresser, jedoch mit einer
Vorliebe für Früchte, von denen er stets vielerlei
Sorten mit allen möglichen Effekten in seinem
Beutel trägt. Er ist unglaublich neugierig und
spielt Leuten gerne Streiche – zum Beispiel, indem
er mit seinem Schwanz Früchte auf seine Opfer
schleudert.","Un monstruo de distintiva cola. Aunque omnívoro,
prefiere comer fruta, las cuales guarda de varios
efectos en su bolsa ventral. Siente curiosidad por
todo y disfruta gastando bromas a la gente.
Incluso hay quien dice haberle visto arrojar fruta
a sus víctimas usando su cola.","Монстр с характерным хвостом. Всеяден, но
предпочитает фрукты и хранит в сумке на животе
разные плоды с разными эффектами. Чрезвычайно
любопытный зверь, любит сбивать охотников с толку.
Были случаи, когда он обстреливал жертву фруктами,
отправляя их в полет хвостом, как битой.","Potwór z charakterystycznym ogonem. Jest
wszystkożerny, ale najbardziej lubi owoce, które
przechowuje w worku brzusznym. Ciekawska
bestia, lubi płatać ludziom figle.
Widziano, jak miota w swoje ofiary
owoce, używając ogona niczym kija.",,,"Um monstro com uma cauda distinta. Embora onívoro,
tem preferência por frutas e mantém várias delas
com todo tipo de efeito em uma bolsa na barriga.
Uma fera incrivelmente curiosa, gosta de pregar
peças nas pessoas e foi vista usando a cauda para
rebater frutas em suas presas.","발달한 꼬리가 특징인 몬스터. 잡식성이지만
과일을 특히 좋아하며 복부에 있는 주머니에
다양한 효과를 가진 감을 비축해 두었다.
호기심이 왕성하고 장난치는 것을 좋아하는
면도 있으며 사냥할 때는 꼬리를 사용해
감을 사냥감에게 던지는 모습이 목격된다.
「천구수」라는 별명이 붙었다.","此魔物的特徵為那發達的尾巴。
雖是雜食性但偏愛果實，在牠腹部的袋子裡，
儲存著許多具有各式各樣效果的柿子。
好奇心相當旺盛，也有喜愛惡作劇的一面。
目擊報告指出牠在狩獵時，
會用尾巴將柿子丟出去玩弄獵物，
也因此被稱為「天狗獸」。","发达的尾巴极具特色的怪物。
虽为杂食性，却特别爱吃果实，
腹袋中储存着拥有各种效果的柿子。
充满好奇心，喜欢恶作剧。
有目击报告称，其进行狩猎时，
会使用尾巴等将柿子掷向猎物。
人称“天狗兽”。",,,,,,,,"وحش له ذيل بارز. على الرغم من أنه يقتات على اللحوم،
فهو يفضل الفاكهة،
ويحتفظ بالعديد من أنواع الفاكهة التي لها جميع
التأثيرات في كيس معدته. وحش فضولي
للغاية، فهو يحب خداع الناس،
وشوهد يضرب فرائسه بالفاكهة
باستخدام ذيله.",,,,,,,,,,,
96f4310e-a428-4d25-ae58-97ef89da1e84,675538682,HN_MonsterListMsg_EnemyIndex029_page2,"尻尾を軸に繰り出してくる攻撃は力強く、また、
コマのような動きで翻弄してくるため厄介だ。しかし、
そのときにダメージを受けて倒れると、持っている柿を
地面にばらまく。その柿は拾うことが可能で、狩りに利用
することができる。動きを見極めて積極的に攻撃しよう。","Its varied tail attacks are incredibly powerful, and
sometimes it spins around like a top, so avoiding
damage can be tough. But, if you use that chance to
attack, the beast will drop its fruit, and you can
pick it up and throw it back, aiding your hunt.
Watch its moves carefully to find your opening.","Ses coups de queue variés sont incroyablement
puissants, et il peut tourner sur lui-même, rendant
ses attaques difficiles à esquiver. Mais si vous
saisissez cette occasion pour attaquer, il laissera
tomber ses fruits, que vous pouvez ramasser pour
lancer sur lui. Attaquez au bon moment !","I suoi numerosi attacchi di coda sono molto potenti
e, talvolta, gira su se stesso rendendo difficile
evitarli. Ma, se approfitti di quei momenti per
colpirlo, lascerà cadere i suoi frutti: potrai
raccoglierli e gettarglieli addosso per aiutarti
a sconfiggerlo. Osserva e trova il momento giusto.","Seine vielseitigen Schwanzangriffe sind unglaublich
mächtig. Gelegentlich dreht er sich wie ein Kreisel
und auszuweichen kann schwierig sein. Aber wenn du
das als Gelegenheit zum Angriff nutzt, lässt er sein
Obst fallen und du kannst es aufheben und die Bestie
damit bewerfen. Also halte Ausschau nach der Lücke!","Sus muchos ataques caudales son muy potentes y,
a veces, gira como una peonza, así que evitar daño
puede ser difícil, pero, si atacas en ese momento,
dejará caer su fruta, que podrás recoger para luego
arrojársela y así facilitar la cacería. Vigila sus
movimientos para encontrar una abertura.","Очень мощно атакует хвостом, иногда вращается,
как волчок, от чего избежать урона бывает непросто.
Если же воспользоваться этим, чтобы атаковать,
монстр выронит свой фрукт и вы сможете поднять
его и бросить обратно в монстра. Внимательно следите
за движениями монстра, чтобы знать, когда нападать.","Zróżnicowane ataki ogona Bishatena mają dużą moc.
Gdy kręci się z niezwykłą szybkością, trudno
uniknąć obrażeń. Jeśli jednak uda ci się wtedy
zaatakować, bestia upuści owoce. Możesz
je podnieść i użyć ich do ataku. Skoncentruj się
i czekaj na swoją szansę.",,,"Seus variados ataques de cauda são poderosíssimos,
às vezes, ele gira como um pião, tornando difícil
evitar danos. Se você usar essa chance para atacar,
a fera soltará suas frutas e você poderá pegá-las e
jogá-las de volta, ajudando na sua caçada. Observe
bem seus movimentos para encontrar uma abertura.","꼬리를 축으로 하는 공격은 강력하고
팽이처럼 움직이며 적을 농락하여 꽤나 성가시다.
비슈텐고가 대미지를 받아 쓰러졌을 때
갖고 있던 감을 지면에 뿌리니 그것을 주워 사냥에
이용할 수 있다. 움직임을 파악해 적극적으로 공격하자.","天狗獸會以尾巴為主，使出一連串強力的攻擊，
也會以陀螺般的動作玩弄獵物，相當棘手。
但若能趁此機會加以攻擊使其跌倒，
牠身上的柿子就會散落一地。
此時可以撿起柿子並利用於狩獵上，
仔細看清牠的動作，積極發動攻擊吧。","以尾巴为轴使出的攻击极为强大，
陀螺般的动作非常难缠。
不过，若此时受到伤害，它就会倒地，
带着的柿子也会散落在地上。
可拾取柿子用于狩猎。
看清其动作，积极发起攻击吧。",,,,,,,,"هجمات ذيله المتنوعة قوية للغاية، وفي بعض الأحيان
يدور مثل دوامة، لذا قد يكون تجنّب الضرر الذي يلحقه
صعبًا. ولكن إذا استخدمت هذه الفرصة
للهجوم، فسيسقط الوحش فواكهه، ويمكنك
التقاط هذه الفاكهة وقذفه بها، مما يساعدك على الصيد.
راقب حركته بحذر لتجد مجالًا للهجوم.",,,,,,,,,,,
13e71b47-0782-480a-a230-71816f85e850,1956600725,HN_MonsterListMsg_EnemyIndex030_page1,"１本脚で立つ独特の姿が傘のように見えることから、
別名「傘鳥」と呼ばれている。縄張り意識が強く、
踏み入るものがあれば、翼を大きく広げたり、
目玉のように見える独特なトサカを広げて威嚇する。
また、体内に溜めている発火性の体液は、
一度火がつくと消えにくく、しばらく地面に残り続ける。
水辺に誘導するなど立ち回りに注意したい。","Tending to stand on one leg, this monster somewhat
resembles an umbrella. The Aknosom is highly
territorial; it will spread out its wings and show
off its characteristic comb to scare off threats. It
also bears flammable venom that burns fiercely and
lingers on the ground when lit. Draw the beast to
water for an easier fight.","Ayant tendance à tenir sur une jambe, ce monstre
ressemble à une sorte de parapluie. L'Aknosom défend
férocement son territoire. Il déploie ses ailes et
sa crête pour effrayer ses assaillants et peut
cracher du venin hautement inflammable qui brûle
tout ce qu'il touche. Attirez ce monstre dans l'eau
pour rendre le combat plus facile.","Con la sua tendenza a rimanere su un piede solo,
ricorda un ombrello. L'Aknosom è altamente
territoriale. Per spaventare i nemici, apre le ali e
mostra la caratteristica cresta. Produce anche un
veleno infiammabile che può generare violenti
incendi sul terreno. Attiralo verso l'acqua per
facilitare la caccia.","Dieses Monster steht gerne auf einem Bein und sieht
dann fast aus wie ein Schirm. Der Aknosom ist sehr
territorial; er breitet seine Flügel aus und zeigt
seinen typischen Kamm, um Bedrohungen zu verjagen.
Er verfügt außerdem über ein brennbares Gift, das
lichterloh brennt und den Boden lang in Brand setzt.
Locke die Bestie ans Wasser, um dir den Kampf zu
erleichtern.","El Aknosom tiende a permanecer sobre una pata,
asemejándose a un paraguas. Es muy territorial:
desplegará las alas y exhibirá su característica
cresta para amedrentar a intrusos. Además, tiene
un veneno inflamable que quema terriblemente y
permanece en el suelo cuando se prende. Atráelo
hacia el agua para hacer más fácil el combate.","Этот монстр любит стоять на одной ноге и в такие
моменты немного напоминает зонт. Акносом очень
территориален, он отпугивает врагов, расправляя
крылья и демонстрируя свой характерный гребень.
Также он носит в себе огнеопасный яд, который очень
жарко горит и при возгорании остается на земле.
Приманивайте монстра к воде, чтобы облегчить
себе бой.","Często stoi na jednej nodze, co nadaje mu wygląd
parasolki. Aknosom jest bardzo terytorialny.
Przepędza intruzów, rozpościerając skrzydła
i prezentując charakterystyczny grzebień.
Wydziela również niezwykle łatwopalną truciznę,
która po zajęciu się ogniem pozostaje na ziemi. Zwab
bestię w pobliże wody, żeby ułatwić sobie zadanie.",,,"Tendendo a ficar em uma perna, esse monstro parece
um guarda-chuva. O Aknosom é altamente territorial;
ele abre as asas e exibe sua crista característica
para espantar ameaças. Ele também tem um veneno
inflamável que queima ferozmente e permanece no chão
quando aceso. Atraia o monstro para a água para
uma luta mais fácil.","다리 하나로 서는 독특한 자세가 우산처럼 보여
「산조」라는 별명이 붙었다. 영역 의식이 강해서
침범한 대상을 향해 날개와 눈동자처럼 생긴
독특한 볏을 펼치고 위협한다.
또한 체내에 모아 둔 발화성 체액은
한 번 불이 붙으면 잘 꺼지지 않고 지면에 남아 있다.
물가로 유인하는 등의 특별한 주의가 필요하다.","由於牠用單腳站立的獨特姿態如同傘一般，
所以被稱為「傘鳥」。地盤意識極強，
只要有生物踏進牠的地盤，牠就會大大張開翅膀，
展開外觀有如眼球的獨特頭冠進行威嚇。
此外，儲存在牠體內的體液具有可燃性，
一旦點燃便難以熄滅，且會在地面持續燃燒一陣子。
建議將其誘導至水邊進行狩獵。","单脚站立的独特姿态宛如一把伞，
因此得名“伞鸟”。领地意识极强，
一旦发现入侵者，就会大幅张开翅膀，
并展开眼球一般的独特头冠进行威吓。
此外，它体内积蓄的易燃性体液点燃后
不易熄灭，会在地面上燃烧一段时间。
战斗时应尽量将其引诱至水边。",,,,,,,,"بميله للوقوف على قدم واحدة، هذا الوحش
يشبه الشمسية. أكنوسوم إقليمي للغاية؛
سيفرد أجنحته ويعرض
مشطًا مميزًا لإخافة من يهدده. كما أنه
يحمل سمًا قابلًا للاشتعال يحترق بشراسة
ويبقى على الأرض عند إشعاله. استدرج الوحش إلى
الماء لقتاله بسهولة.",,,,,,,,,,,
91ff42bc-f000-4e3c-8d30-d182cf09c43f,2682135064,HN_MonsterListMsg_EnemyIndex030_page2,"頭部にある傘のような構造のトサカは、
丸める、広げる、１本に束ねるなど、
自由自在に変形が可能。
その形状を注視していれば、ある程度
攻撃を予測することができる。","It can manipulate the umbrella-shaped crest on its
head to curl up, fan out, or shut tight. Observe
its shape closely, and you might be able to predict
which attack it will use next.","Il peut contrôler la crête en forme de parapluie sur
sa tête pour la retrousser, la déployer ou la
serrer étroitement. Observez bien sa forme pour
prédire sa prochaine attaque.","È in grado di manipolare la propria cresta a forma
di ombrello per arricciarla, estenderla o chiuderla
completamente. Osserva attentamente la forma che
assume e riuscirai a prevedere quale attacco sta
preparando.","Der schirmförmige Kamm auf seinem Kopf kann sich
zusammenrollen, ausbreiten oder schließen. Achte
genau auf seine Form. Daran kannst du vielleicht
erkennen, welcher Angriff als Nächstes kommt.","Puede combar, desplegar o cerrar firmemente la
cresta con forma de paraguas en su cabeza. Observa
su forma con atención y podrás predecir el ataque
que se avecina a continuación.","Может сворачивать и разворачивать зонтообразный
гребень на голове. Внимательно следите за
гребнем — так вы, возможно, сумеете предсказать
следующую атаку Акносома.","Grzebień na głowie ma szeroki zakres
ruchów – może się zwijać, rozpościerać lub ciasno
zamykać. Obserwuj go uważnie i próbuj
przewidzieć kolejny atak.",,,"Ele pode manipular a crista em forma de guarda-chuva
na cabeça para se enrolar, ventilar ou se fechar.
Observe atentamente sua forma e você poderá prever
qual ataque será usado em seguida.","머리에 있는 우산처럼 생긴 볏은
둥글게 말고 펼치거나 한 묶음으로 묶는 등
자유자재로 변환할 수 있다.
변화되는 모습을 주시하고 있으면
공격을 어느 정도는 예측할 수 있다.","牠的頭冠有著宛如傘似的構造，
能夠捲起、打開或是收成1束等，
自由自在地變形。
與牠對峙時，只要仔細觀察頭冠的形狀，
就能在一定程度上預測牠的攻擊。","头冠拥有伞一般的构造，
可自由自在地变形，
能变圆、能展开、还能收成一束。
只要留意头冠的形状，
就能在一定程度上预测其攻击。",,,,,,,,"يمكنه التلاعب بعرفه على شكل شمسية الموجود على رأسه
ليتكور أو ينفتح أو ينغلق بإحكام. لاحظ
شكله عن قرب، وقد تتمكن من التنبؤ
بالهجوم الذي سيستخدمه لاحقًا.",,,,,,,,,,,
bc7fb68e-d3bb-4bd9-b0d0-a3a9b478173b,665179623,HN_MonsterListMsg_EnemyIndex031_page1,"別名「河童蛙」と呼ばれる両生種のモンスター。
食べることに貪欲で、動くものを見つけると砂利ごと
平らげてしまう。これは、胃の中で砂利を使って獲物を
すりつぶし、効率よく消化するためと考えられている。
また、一度捕食しても、食べられないものは吐き出す
習性がある。弱点を守る頭の皿は、長く生きた個体ほど
硬さが増し、青みも鮮やかになるという。","An amphibious monster resembling a frog. Its appetite
is infinite, and if it sees anything moving, it will gobble
it up, dirt an all. It's theorized that the dirt it consumes
builds up in its stomach and aids in digestion. If it eats
something that it cannot digest, it will throw it back up.
The cranial disc protecting its tender head is said to
harden and become a more brilliant blue over time.","Un monstre amphibien ressemblant à un crapaud.
Il est insatiable, et s'il aperçoit quoi que ce soit
bouger, il le gobera avec la terre autour en prime.
Il est dit que la terre qu'il consomme l'aide à
digérer. S'il mange quelque chose qu'il ne peut pas
digérer, il le recrachera. Le disque crânien
protégeant sa tête souple deviendrait plus dur
et bleu au fil du temps.","Mostro anfibio che assomiglia a una rana. Ha un
appetito smisurato e ingurgita qualunque cosa si
muova, compresa la terra. Si ipotizza che questa si
accumuli nel suo stomaco e che gli faciliti
la digestione. Se ingerisce qualcosa di indigesto,
lo rivomita. Dicono che il disco craniale che
protegge la sua testa, morbida e delicata, col tempo
diventi più duro e bluastro.","Ein amphibisches Monster, das an einen Frosch
erinnert. Sein Appetit ist unersättlich und es
verschlingt seine Opfer mitsamt dem Schmutz rund-
herum. Es wird angenommen, dass ihm der Dreck bei
der Verdauung hilft. Wenn es etwas Unverdauliches
frisst, wird es wieder ausgespuckt. Die Scheibe, die
seinen empfindlichen Kopf schützt, wird mit der Zeit
angeblich härter und leuchtet in satterem Blau.","Monstruo anfibio semejante a una rana. De apetito
voraz, engullirá cuanto se mueva junto con el cieno
alrededor. Se cree que el cieno que consume se
acumula en el estómago y le ayuda a digerir.
Si devora algo que no puede digerir, lo regurgitará.
Dicen que el disco craneal que protege su blanda
cabeza se endurece y se vuelve de un azul más
brillante con el tiempo.","Земноводный монстр, внешне напоминающий лягушку.
Обладает неуемным аппетитом, заметив что-то
движущееся, сжирает это вместе с землей. Есть
предположения, что земля копится в желудке монстра
и помогает пищеварению. Проглотив что-нибудь, что
не получается переварить, монстр выплевывает добычу.
Говорят, что черепной диск, защищающий его нежную
голову, со временем твердеет и набирает блеск.","Wodny potwór o wyglądzie żaby. Jest wiecznie głodny
i pożera wszystko, co się rusza, łącznie z ziemią.
Podobno zjadana ziemia gromadzi się w jego żołądku,
pomagając w trawieniu. Jeśli połknie coś, czego
nie może strawić, wypluwa to. Chroniący
jego delikatną głowę krąg podobno z czasem
staje się coraz twardszy i bardziej połyskujący.",,,"Um monstro anfíbio parecido com um sapo. Seu apetite
é infinito e, se vir algo em movimento, ele o devora
com terra e tudo. Teoriza-se que aterra que ele
consome se acumula no estômago e ajuda na digestão.
Se comer algo que não pode digerir, ele vomita.
Dizem que o disco craniano que protege sua cabeça
sensível endurece e seu tom azul fica mais intenso
ao longo do tempo.","「하동와」라고도 불리는 양서종 몬스터.
식탐이 매우 강해 움직이는 것만 보면
바닥의 돌까지 전부 먹어 치운다. 위 속에 들어간 
자갈로 먹잇감을 잘게 부숴 효율적으로 
소화시키기 위함으로 보인다. 일단 전부 집어
삼킨 후, 먹지 못하면 바로 뱉어내는 습성이
있다. 머리의 접시는 약점을 지키기 위한 것으로
오래 살수록 단단해지고 선명한 파란빛을 띤다.","被稱為「河童蛙」的兩生種魔物。有著強大的食慾，
只要發現會動的東西，就連砂石也會一起吞下。
一般認為牠會以砂石研磨胃中的獵物，
藉此提高消化效率。萬一捕食的東西有無法消化的部分，
就會將其吐出。頭部的盤子能夠保護弱點，
且越是年長的個體，其盤子的硬度越高，
顏色也會變為更加鮮豔的藍色。","人称“河童蛙”的两栖种怪物。极其贪吃，
一旦发现活物，就会连同砂石一口吞下。
这是为了在胃中以砂石碾碎猎物，
使消化更具效率。此外，其有捕食后
会将无法食用之物吐出的习性。
据说活得越久的个体，其头上保护弱点的
碟子就越是坚硬，颜色也会变得更为鲜艳。",,,,,,,,"وحش برمائي يشبه الضفدعة. شهيته غير محدودة،
وإذا رأى أي شيء يتحرك، فإنه يفترسه، مع القاذورات
وكل شيء. يُفسّر الأمر على أن القاذورات التي يستهلكها
تتراكم في معدته وتساعده على الهضم. إذا أكل
شيئًا لا يمكنه هضمه، فسيتقيأه.
يُقال إن أسطوانة جمجمته التي تحمي رأسه الحساس
تصبح أكثر قوة وبلون أزرق لامع مع مرور الوقت.",,,,,,,,,,,
