guid,crc?,entry name,Japanese,English,French,Italian,German,Spanish,Russian,Polish,Dutch,Portuguese,PortugueseBr,Korean,TraditionalChinese,SimplifiedChinese,Finnish,Swedish,Danish,Norwegian,Czech,Hungarian,Slovak,Arabic,Turkish,Bulgarian,Greek,Romanian,Thai,Ukrainian,Vietnamese,Indonesian,Fiction,Hindi,LatinAmericanSpanish
3d80acc3-d7ce-4353-a6d0-59f7915611cf,915304686,HN_MonsterListMsg_0,<COLOR FF0000>#Rejected#</COLOR> HN_MonsterListMsg_0,<COLOR FF0000>#Rejected#</COLOR> HN_MonsterListMsg_0,<COLOR FF0000>#Rejected#</COLOR> HN_MonsterListMsg_0,<COLOR FF0000>#Rejected#</COLOR> HN_MonsterListMsg_0,<COLOR FF0000>#Rejected#</COLOR> HN_MonsterListMsg_0,<COLOR FF0000>#Rejected#</COLOR> HN_MonsterListMsg_0,<COLOR FF0000>#Rejected#</COLOR> HN_MonsterListMsg_0,<COLOR FF0000>#Rejected#</COLOR> HN_MonsterListMsg_0,<COLOR FF0000>#Rejected#</COLOR> HN_MonsterListMsg_0,<COLOR FF0000>#Rejected#</COLOR> HN_MonsterListMsg_0,<COLOR FF0000>#Rejected#</COLOR> HN_MonsterListMsg_0,<COLOR FF0000>#Rejected#</COLOR> HN_MonsterListMsg_0,<COLOR FF0000>#Rejected#</COLOR> HN_MonsterListMsg_0,<COLOR FF0000>#Rejected#</COLOR> HN_MonsterListMsg_0,<COLOR FF0000>#Rejected#</COLOR> HN_MonsterListMsg_0,<COLOR FF0000>#Rejected#</COLOR> HN_MonsterListMsg_0,<COLOR FF0000>#Rejected#</COLOR> HN_MonsterListMsg_0,<COLOR FF0000>#Rejected#</COLOR> HN_MonsterListMsg_0,<COLOR FF0000>#Rejected#</COLOR> HN_MonsterListMsg_0,<COLOR FF0000>#Rejected#</COLOR> HN_MonsterListMsg_0,<COLOR FF0000>#Rejected#</COLOR> HN_MonsterListMsg_0,<COLOR FF0000>#Rejected#</COLOR> HN_MonsterListMsg_0,<COLOR FF0000>#Rejected#</COLOR> HN_MonsterListMsg_0,<COLOR FF0000>#Rejected#</COLOR> HN_MonsterListMsg_0,<COLOR FF0000>#Rejected#</COLOR> HN_MonsterListMsg_0,<COLOR FF0000>#Rejected#</COLOR> HN_MonsterListMsg_0,<COLOR FF0000>#Rejected#</COLOR> HN_MonsterListMsg_0,<COLOR FF0000>#Rejected#</COLOR> HN_MonsterListMsg_0,<COLOR FF0000>#Rejected#</COLOR> HN_MonsterListMsg_0,<COLOR FF0000>#Rejected#</COLOR> HN_MonsterListMsg_0,<COLOR FF0000>#Rejected#</COLOR> HN_MonsterListMsg_0,<COLOR FF0000>#Rejected#</COLOR> HN_MonsterListMsg_0,<COLOR FF0000>#Rejected#</COLOR> HN_MonsterListMsg_0
c9fb7256-d399-49c6-8ad7-c49e8155f74f,2790346318,HN_MonsterListMsg_EnemyIndex000_page1,"陸の女王の異名を持つ「雌火竜」。
地上を中心とした狩りをおこなうための、
大地を駆ける優れた脚力と、
獲物を仕留める猛毒を含んだ尾を持つ。
雄の火竜とつがいで狩りをする様子も
目撃されている。","Fire-breathing female wyverns, also known as
the ""Queens of the Land."" With powerful legs
and poison-secreting tails, they hunt mainly
on the ground. Sometimes seen preying as a
couple, Rathian and Rathalos cooperate well.","Wyverne femelle crachant du feu,
aussi appelée ""reine de la terre"".
Avec ses pattes puissantes et
sa queue sécrétant du poison,
elle chasse principalement au sol.
On la voit parfois coopérer avec
le Rathalos.","Wyvern femmina sputafuoco, nota anche come la
""regina dei wyvern"". Con gambe potenti e una coda
che sparge veleno, caccia principalmente a terra.
Qualche volta viene osservata predare in coppia:
Rathian e Rathalos cooperano efficacemente.","Eine feuerspeiende weibliche Wyvern, auch bekannt
als die ""Königinnen der Lande"". Mit kraftvollen
Beinen und giftabsondernden Schwänzen jagen sie
hauptsächlich am Boden. Rathian und Rathalos
ergänzen sich gut und jagen manchmal auch als Paar.","Wyverns hembra escupefuego conocidas como
""reinas de la tierra"". Estas depredadoras terrestres
tienen poderosas patas y colas venenosas.
Cuando cazan juntos, las Rathian y los Rathalos
cooperan de maravilla.","Огнедышащие виверны, известные также, как
""Королевы этих мест"". Обладают мощными ногами
и хвостами, выделяющими яд, охотятся в основном
на земле. Ратианы и Раталосы хорошо
сотрудничают, иногда их видят охотящимися
парами.","Ziejące ogniem samice wiwerny,
znane również jako „królowe ziemi”. Mają potężne
nogi i wytwarzające truciznę ogony,
a polują głównie na ziemi. Czasami Rathiany
i Rathalosy współpracują w parach.",,,"Serpes fêmeas cuspidoras de fogo, também
conhecidas como ""Rainhas da Terra"". Com pernas
poderosas e caudas secretoras de veneno, elas caçam
principalmente no chão. Às vezes vistos atacando
em casal, Rathians e Rathalos cooperam bem.","육지의 여왕이라는 이명을 가진 「자화룡」.
지상을 중심으로 사냥을 하기 때문에
대지를 누비는 우수한 다리 힘과
사냥감을 끝장내는 맹독 꼬리를 가졌다.
수컷 화룡과 함께 사냥하는 모습도
목격되었다.","擁有陸之女王別名的「雌火龍」。
由於主要是於地面上進行狩獵，
因此擁有能夠奔馳於大地的優異腳力，
以及能夠殺死獵物的猛毒尾巴。
另外，雌火龍亦被目擊過與雄性的火龍成雙狩獵。","“雌火龙”，别名陆之女王。
以陆地为中心的狩猎方式，
使其拥有穿梭大地的强劲脚力
及足以结果猎物的猛毒之尾。
曾有人目击到其与雄性“火龙”
成对狩猎的场景。",,,,,,,,"تنانين مجنحة تنفث النار، معروفة أيضًا باسم
""ملكات الأرض"". لها أرجل قوية
وذيول تنفث السم، وتصطاد أساسًا،
على الأرض. في بعض الأحيان تفترس
كثنائي، يتعاون راثيان وراذالوس بشكل جيد.",,,,,,,,,,,
e49e7e26-23f4-423b-81cc-1ce4cae68798,4020446820,HN_MonsterListMsg_EnemyIndex000_page2,"尻尾の棘に強力な毒を持ち、その攻撃範囲の広さから
注意深く立ち回る必要がありそうだ。
尻尾の切断に成功すれば、
狩猟を有利に展開できるだろう。","The strong venom in her tail, along with the wide
reach of her sweeping attacks, makes maneuvering
around the Rathian a dangerous feat. Cutting off her
tail can give you quite a bit more breathing room.","Se déplacer autour de la Rathian est un exercice
périlleux à cause du puissant venin contenu dans
sa queue et la portée de ses balayages. Coupez-lui
la queue pour obtenir un peu de champ libre.","Il potente veleno presente nella sua coda, insieme
all'ampia portata dei suoi attacchi travolgenti,
rende le manovre intorno alla Rathian molto
rischiose. Tagliare la sua coda può dare un po' di
respiro.","Das starke Gift in ihrem Schwanz kombiniert mit
ihren fegenden Angriffen macht es schwierig, um die
Rathian herum zu manövrieren. Ihr den Schwanz
abzutrennen, verschafft den notwendigen Spielraum.","El potente veneno que contiene su cola y el tremendo
alcance de sus ataques horizontales no hacen fácil
maniobrar alrededor de la Rathian. Cortar su cola te
dará algo más de margen.","В хвосте у Ратианы мощный яд, дальность ее сметающих
атак велика, и потому биться с ней в ближнем бою
опасно. Если отсечь ей хвост, у вас будет больше
места для маневра.","Silna trucizna w ogonie i duży zasięg ataku
sprawiają, że poruszanie się wokół Rathiany to
niebezpieczne zadanie. Odcięcie ogona
da ci trochę koniecznej przestrzeni.",,,"O forte veneno em sua cauda, juntamente com o amplo
alcance de seus ataques, torna as manobras em torno
do Rathian um grande risco. Cortar o rabo dele pode
lhe dar alguma folga para lutar.","꼬리의 가시에는 강력한 독이 있어 넓은 범위에
걸친 공격을 주의 깊게 살펴야 한다.
꼬리 절단에 성공하면 사냥을 유리하게
이끌어 나갈 수 있을 것이다.","其尾巴的棘含有劇毒，且攻擊範圍較廣，
因此在行動時需謹慎留意。
如果成功切斷尾巴，其攻擊範圍將會變小，
能讓狩獵變得更加有利。","其尾上之棘有剧毒，且尾部攻击范围广，
走位时需要多加小心。
只要成功切断其尾，
就能使胜利的天平朝猎人倾斜。",,,,,,,,"السم القوي الموجود في ذيلها بالإضافة إلى
المدى الواسع لهجمات الاجتياح الخاصة بها، تجعل
المناورة حول راثيان عملًا في غاية الخطورة.
قد يعطيك قطع ذيلها مساحة أكبر قليلًا للحركة.",,,,,,,,,,,
2269ca51-ab2e-4ff3-8c47-2b3293072f91,881607399,HN_MonsterListMsg_EnemyIndex001_page1,"「ヌシ」の名を冠した雌火竜。
まるで嵐に巻き込まれたかのような傷跡が全身に見られ、
その影響か、常に怒りと恐怖に支配されている様子。
尾が通常の個体よりも著しく発達しており、
その棘には猛烈な毒が含まれている。
また、ヌシはその咆哮によって自身の怒りと恐怖を
周囲に波及させ、活発化させる。","A Rathian so mighty, it was crowned an Apex. Its
body is covered in scars and wounds as if it had
been caught in a storm, and it's seemingly always
dominated by wrath and terror. Its tail oozes a
venom far deadlier than any of a normal monster.
The call of an Apex unleashes its tortured anger
on nearby beasts, driving them into a frenzy.","Une Rathian si puissante qu'elle a été élue
monstre supérieur. Elle est couverte de cicatrices,
comme si elle avait enduré une tempête, et elle
semble perpétuellement rongée par la rage et
la terreur. Sa queue sécrète un venin mortel.
Le rugissement d'un monstre supérieur déchaîne
sa colère sur les monstres à proximité,
les enrageant.","Rathian tanto potente da essere incoronata Apex.
Ha il corpo ricoperto di ferite, come se fosse stata
travolta dalla tempesta, e appare sempre dominata da
furia e terrore. La sua coda trasuda un veleno molto
più letale di quello dei mostri comuni. Il richiamo
di un Apex infonde la sua stessa ira in ogni bestia
nelle vicinanze, rendendole incontrollabili.","Eine so mächtige Rathian, dass sie zur Apex gekrönt
wurde. Ihr Körper ist mit unzähligen Wunden übersät,
als sei sie in einen Sturm geraten, und sie ist
besessen von Zorn und Schrecken. Das Gift, das aus
ihrem Schwanz tritt, ist viel tödlicher als das
normaler Monster. Der Ruf einer Apex entlädt ihren
ganzen qualvollen Zorn auf die Monster in ihrer Nähe
und treibt sie zur Raserei.","Una Rathian tan poderosa que fue coronada Apex.
Su cuerpo muestra laceraciones como si hubiera
quedado a merced de una tormenta, y parece
continuamente dominada por la ira y el terror.
Su cola exuda un veneno más mortífero que el
de cualquier monstruo normal. La llamada de un Apex
instila su furia atormentada en las bestias cercanas
y las pone frenéticas.","Настолько сильная Ратиана, что ее нарекли высшим
монстром. Тело покрыто шрамами и ранами, словно она
попала в эпицентр бури. Всегда одержима гневом. Ее
хвост испускает яд, что сильнее яда любого обычного
монстра. Своим зовом высший монстр передает свой
гнев и муку ближайшим монстрам, ввергая
их в безумие.","Rathiana tak potężna, że została Apeksem. Jej
ciało to jedno wielkie kłębowisko blizn i ran.
Wygląda na wiecznie wściekłą i żądną krwi. Ogon
bestii wydziela truciznę o wiele bardziej śmiertelną
niż u jakiegokolwiek innego potwora. Przesycona
bólem wściekłość Apeksa wprawia w szał pobliskie
potwory.",,,"Uma Rathian tão poderosa que foi coroada como Alfa.
Seu corpo é coberto de cicatrizes e feridas, como
se uma tempestade a tivesse carregado, e sempre
parece dominada pela ira e pelo terror. Sua cauda
exala um veneno muito mais letal do que qualquer
monstro normal. O chamado de um Alfa incita feras
próximas com sua fúria torturada, levando-as a um
frenesi.","「주인」의 이름을 얻은 자화룡.
온몸에 폭풍이 휩쓸고 지나간 것 같은 상처가 있으며
그 영향인지 항상 분노와 공포에 지배되어 있다.
꼬리가 보통 개체보다 두드러지게 발달했으며
그 가시에는 맹렬한 독이 담겨 있다.
그리고 주인은 포효를 통해 자신의 분노와
공포를 주변에 전파하며 활성화한다.","冠有「首領」之名的雌火龍。
全身上下都有著像是被捲入暴風後所留下的傷痕，
這也許是牠一直受到憤怒與恐懼支配的原因。
尾巴比起一般的個體更加發達，
棘上還有著猛烈的劇毒。
另外，首領會藉由咆嘯，將自己的憤怒與恐懼
散播至周遭，使其他魔物變得活躍起來。","冠有“霸主”之名的雌火龙。
全身布满仿佛曾被风暴席卷的可怕伤痕，
或是受其影响，时刻都充满愤怒与恐惧。
尾巴远比普通个体更为发达，
棘上带有猛烈的毒性。
此外，霸主的咆哮会将自身的愤怒与恐惧
向周围散播，使怪物们更加活跃。",,,,,,,,"راثيان جبار للغاية، لدرجة تتويجه كوحش علوي.
فجسده مغطى بالندوب والجروح كما لو أنه علق بعاصفة،
ويبدو أن الرعب والغضب يسيطران عليه دائمًا.
يفرز ذيله سمًا أكثر فتكًا من أي وحش عادي آخر.
يؤدي استدعاء وحش علوي إلى إطلاق غضبه
المعذب على الوحوش القريبة،
مما يدفعها إلى الجنون.",,,,,,,,,,,
25929d7f-3e88-4205-9dee-fe45beb3f27a,83723350,HN_MonsterListMsg_EnemyIndex001_page2,"ヌシは怒ると、最大級の大技を放つ。
ヌシ・リオレイアの大技は猛毒の棘を周囲にまき散らし、
その棘を中心とした毒の領域をつくりだす。
ヌシが怒っているときは、攻撃の手を緩めずに、
怯ませて速やかに怒りを鎮めるようにしよう。","An angry Apex Rathian will trigger a devastating
move, spraying poisonous thorns in all directions,
creating toxic fields wherever they land. Push on
against an enraged Apex to quickly rid it of its
rage and steady its temper.","Une Rathian supérieure enragée lance une attaque
dévastatrice, faisant voler des épines empoisonnées
dans toutes les directions. Des zones toxiques
apparaîtront aux endroits touchés. Ne laissez pas de
répit à un monstre supérieur enragé pour faire
rapidement retomber sa rage et le calmer.","Una Rathian Apex infuriata eseguirà una mossa
devastante, lanciando in ogni direzione aculei
avvelenati che rendono tossico il terreno dove
atterrano. Avventati contro un Apex furioso per
fargli sbollire in fretta la rabbia ed equilibrare
il suo temperamento.","Im wütenden Zustand setzt die Apex-Rathian einen
verheerenden Angriff ein, bei dem sie giftige Dornen
in alle Richtungen sprüht, die dort, wo sie landen,
Giftfelder erzeugen. Dränge weiter auf eine rasende
Apex ein, um sie schnell zu besänftigen und von der
nächsten Rage abzuhalten.","Una Rathian Apex enfadada lanzará un devastador
ataque consistente en esparcir espinas envenenadas
en todas las direcciones, creando zonas tóxicas
allá donde aterricen. Ataca para calmar su ira lo
antes posible.","Злая высшая Ратиана исполняет опасный прием, швыряя
во все стороны ядовитые шипы, которые при падении
выпускают яд. Скорее атакуйте разъяренного высшего
монстра, чтобы обуздать его гнев.","Wściekła Apeks Rathiana wykona niszczący ruch,
posyłając na wszystkie strony trujące kolce,
które tworzą toksyczne pola tam, gdzie wylądują.
Napieraj na wściekłą Apeks, aby szybko
osłabić jej gniew i ją uspokoić.",,,"Uma Rathian Alfa enfurecida realiza um movimento
devastador, que espalha espinhos venenosos em todas
as direções, criando campos tóxicos onde quer que
eles pousem. Mantenha a pressão contra um Alfa
enfurecido para acabar rapidamente com sua fúria
e controlar seus ânimos.","주인은 분노하면 최강의 비기를 사용한다.
주인 리오레이아의 비기는 맹독 가시를 주변에 흩뿌려
그 가시를 중심으로 독 지대를 만든다.
주인이 분노했을 때는 쉴 새 없이 공격해서
움찔하게 하면 빠르게 분노를 진정시킬 수 있다.","首領發怒後，會施展最強勁的必殺技。
首領雌火龍的必殺技為將具有猛毒的棘射向四周，
並以飛散的棘為中心創造出毒素領域。
當首領處於憤怒狀態時，記得要持續攻擊，
盡早使其膽怯，平息首領的怒火吧。","霸主一旦发怒，就会释放最大级别的大招。
霸主・雌火龙的大招为向周围散布猛毒之棘，
创造出以棘为中心的毒之领域。
当霸主发怒时，切勿放缓攻势，
应当设法使其畏缩，迅速平息其怒气。",,,,,,,,"راثيان علوي غاضب سيطلق حركة
مدمرة، وينشر الأشواك السامة في كل الاتجاهات،
ليخلف وراءه حقولًا سامة أينما حل. لا تستسلم أمام
الوحش العلوي الغاضب حتى تتخلص من غضبه وتهدّئ
مزاجه.",,,,,,,,,,,
6c059743-ac54-4ab2-9419-abdc3e665376,2642375133,HN_MonsterListMsg_EnemyIndex002_page1,"天空の王者と呼称され、畏れられる飛竜。
雌火竜と共に巣を中心とした
広いテリトリーを形成し、空から監視する。
テリトリーに侵入した者には
優れた飛行能力で上空から急降下し、
毒を含む強力な爪で襲い掛かってくる。
火を吐くことから「火竜」と呼ばれる。","Terrible wyverns called ""Kings of the Skies.""
Along with Rathian, they stake wide territories
centered around their nests. Rathalos descend
on invaders from the sky, attacking with poison
claws and a breath of fire.","Terrible wyverne surnommée
""Roi des cieux"". Comme la Rathian,
il surveille de vastes territoires
autour de son nid et fond du ciel
sur les intrus, attaquant avec ses
griffes empoisonnées et son souffle
de feu.","Terribile wyvern noto a molti come ""sovrano dei
cieli"". Insieme alla Rathian, controllano ampi
territori intorno ai loro nidi. I Rathalos si
buttano in picchiata sugli intrusi, per poi
attaccarli con artigli avvelenati e getti di fuoco.","Ein schrecklicher Wyvern, der auch ""König der Lüfte""
genannt wird. Zusammen mit der Rathian steckt er
sein Territorium weit um seine Nester ab. Der
Rathalos stürzt sich vom Himmel auf Eindringlinge
herab und attackiert sie mit Giftklauen und feurigem
Atem.","Wyverns terribles llamados ""reyes de los cielos"".
Con ayuda de las Rathian, cercan territorios amplios
centrados en sus nidos. El Rathalos desciende sobre
los invasores con garras envenenadas y aliento de
fuego.","Жуткие виверны, прозванные ""Королями небес"".
Как и Ратианы, охотятся на обширных территориях
вокруг своих гнезд. Раталосы атакуют добычу
с неба, поражая ее ядовитыми
когтями и огненным дыханием.","Straszliwe wiwerny zwane „królami przestworzy”.
Razem z Rathianami zajmują rozległe terytoria
skupione wokół ich gniazd. Rathalosy atakują
wrogów z powietrza, posługując się
trującymi pazurami i zionąc ogniem.",,,"Terríveis serpes chamadas ""Reis dos Céus"".
Juntamente com Rathians, elas dividem vastos
territórios centrados em torno de seus ninhos.
Rathalos desce do céu sobre os invasores,
atacando com garras venenosas e um sopro de fogo.","하늘의 왕자라 불리며 경외시 되는 비룡.
자화룡과 함께 둥지를 중심으로
넓은 영역을 형성해 하늘에서 감시한다.
영역을 침범한 자에게는
우수한 비행 능력으로 하늘에서 급강하한 뒤,
독이 있는 강력한 발톱으로 공격한다.
불을 뿜어 「화룡」이라고도 불린다.","擁有天空王者之名，受人畏懼的飛龍。
會與雌火龍以巢穴為中心擴展勢力範圍，
並從空中進行監視。
若其勢力範圍遭到入侵，便會以優異的飛行能力
從高空迅速降下，使用帶毒的強力爪擊攻擊敵人。
由於會噴出火焰，因此被稱為「火龍」。","令人畏惧的飞龙，又称“天空王者”。
与“雌火龙”一起以巢穴为中心占有广阔领地，
并从空中进行监视。
一旦发现入侵者，
便会发挥自身飞行特长，从上空急速俯冲而下，
以含毒的利爪抓向对方。
由于其会喷火，故人称“火龙”。",,,,,,,,"تنانين مجنحة فظيعة تُسمى ""ملوك السماوات"".
بالإضافة إلى راثيان، فهي تحجز مكانًا واسعًا
متمركزًا حول أعشاشها. يهبط راذالوس
على الدخلاء من السماء، مهاجمًا بمخالبه
السامة نافثًا النار.",,,,,,,,,,,
e9fb7c71-26ec-4085-a073-b8ec881983b7,2866951308,HN_MonsterListMsg_EnemyIndex002_page2,"天空の王者の名が示すように、
空中から様々な攻撃を仕掛けてくる。
強烈な閃光などで目を眩ませれば、
地上へと叩き落とせるだろう。","The King of the Skies lives up to its name by
staying airborne for most of its attacks. A well-
aimed <COL RED>Flash Bomb<COL RED> can help to bring a Rathalos
down to earth, however.","Fidèle à son surnom, le Roi des Cieux effectue la
plupart de ses attaques en l'air. Une <COL RED>bombe flash</COL>
bien lancée peut aider à forcer un Rathalos au sol.","Il re dei cieli vive all'altezza del suo nome,
rimanendo in volo per molti dei suoi attacchi.
Una bomba-lampo ben assestata, però, può riuscire
a portarlo a terra.","Der König der Lüfte macht seinem Namen alle Ehre und
bleibt meist in der Luft, eine gut gezielte Blitz-
bombe bringt ihn jedoch zu Boden.","Al rey de los cielos le gusta hacer honor a su
nombre quedándose en el aire para ejecutar casi
todos sus ataques. Es complicado derribar a un
Rathalos, pero una buena bomba de luz puede ser la
solución.","Король небес оправдывает свое прозвище,
предпочитая атаковать на лету. Впрочем, метко
брошенной слепящей бомбой Раталоса можно сбить
с небес на землю.","Zgodnie ze swoim mianem Król Przestworzy większość
ataków przeprowadza z powietrza. Jednak
dobrze wycelowana bomba błyskowa może
ułatwić sprowadzenie go na ziemię.",,,"O Rei dos Céus faz jus ao seu nome,
permanecendo no ar durante a maior parte de seus
ataques. Mas uma Bomba de Luz bem direcionada pode
ajudar a trazer um Rathalos ao chão.","하늘의 왕자라는 이름처럼
공중에서 다양한 공격을 해 온다.
강렬한 섬광 등으로 눈부시게 하면
지상으로 떨어뜨릴 수 있다.","正如其天空王者之名，
牠會從空中發動各式各樣的攻擊。
使用強烈的閃光剝奪牠的視野，
應該就能將牠擊落。","正如天空王者之名，
会从空中发起各种攻击。
使用强烈的闪光等使其目眩，
便可一举将其击落。",,,,,,,,"ملك السماوات يستحق اسمه لأنه يبقى في الهواء في أغلب
وقت هجومه. ومع ذلك، تنجح
<COL RED>قنبلة ضوئية<COL RED> موجهة جيدًا
في جلب راذالوس إلى الأرض.",,,,,,,,,,,
