guid,crc?,entry name,Japanese,English,French,Italian,German,Spanish,Russian,Polish,Dutch,Portuguese,PortugueseBr,Korean,TraditionalChinese,SimplifiedChinese,Finnish,Swedish,Danish,Norwegian,Czech,Hungarian,Slovak,Arabic,Turkish,Bulgarian,Greek,Romanian,Thai,Ukrainian,Vietnamese,Indonesian,Fiction,Hindi,LatinAmericanSpanish
19d62f7d-8422-4554-bdb8-2fbbc5f3e245,2269973953,HN_NormalControlsMsg_small2_19,"翔蟲ゲージは、翔蟲アクションをおこなうと
消費し、<COL RED>時間経過で回復</COL>します。回復した
翔蟲ゲージは、再度使用できます。
アクションによって消費する翔蟲ゲージの
<COL RED>数</COL>や回復にかかる<COL RED>時間</COL>は異なります。","Performing Wirebug actions consumes
the <COL RED>Wirebug Gauge</COL>, which recovers over
time. Once recovered, the gauge can be
used again. The <COL RED>degree of consumption</COL>
and <COL RED>recovery time</COL> vary for each action.","Les actions Filoptères dépensent
<COL RED>la jauge de Filoptère</COL>, qui se régénère
petit à petit. Une fois restaurée, la
jauge peut être réutilisée. Le <COL RED>coût</COL> et
le <COL RED>temps de récupération</COL> varient.","Eseguire mosse con insetti filo consuma
<COL RED>la barra insetto filo</COL>, che si ripristina
nel tempo per poi essere riutilizzata.
Il <COL RED>livello di consumo</COL> e
il <COL RED>tempo di recupero</COL> sono variabili.","Ausgeübte Seilkäfer-Aktionen leeren den
<COL RED>Seilkäfer-Balken</COL>, der sich mit der Zeit
neu auffüllt und wieder genutzt werden
kann. <COL RED>Verbrauch</COL> und <COL RED>Erholungsdauer</COL> sind
je nach Aktion unterschiedlich.","La acciones con cordóptero consumen el
<COL RED>indicador cordóptero</COL>, pero se volverá
a llenar pasado un tiempo.
El <COL RED>nivel de consumo</COL> y el <COL RED>tiempo de
recuperación</COL> dependen de cada acción.","Выполнение действий с Прутожуками расх.
<COL RED>шкалу Прутожука</COL>, которая постепенно
восст-ся. После восст. шкалу можно
использовать снова. <COL RED>Скорость расхода</COL>
и <COL RED>время восст.</COL> зависят от действия.","Wykonywanie czynności kablobakiem
<COL RED>zużywa pasek kablobaka</COL>. Jego regeneracja
wymaga czasu. <COL RED>Poziom zużycia</COL>
i <COL RED>czas regeneracji</COL> paska
zależą od czynności.",,,"Executar ações de Cabinseto consome a
<COL RED>Barra de Cabinseto</COL>, que recupera com o
tempo. Quando recuperada, pode ser
usada novamente. O <COL RED>nível de consumo</COL> e o
<COL RED>tempo de recuperação</COL> variam para cada ação.","밧줄벌레 게이지는 밧줄벌레 액션으로
소비하며 <COL RED>시간이 지나면 회복</COL>합니다.
회복한 게이지는 재사용이 가능합니다.
액션에 따라 소비하는 밧줄벌레 게이지의
<COL RED>수치</COL>와 회복에 필요한 <COL RED>시간</COL>이 달라집니다.","翔蟲在動作時會消耗翔蟲計量表，
並會<COL RED>隨著時間經過自然回復</COL>，
回復後就可再次使用。
隨著動作不同，消耗的翔蟲計量表<COL RED>數量</COL>，
以及回復所需的<COL RED>時間</COL>也會不同。","发动翔虫动作会消耗翔虫槽，
翔虫槽会<COL RED>随时间经过而回复</COL>，
回复后即可再次使用。
不同的动作，消耗的翔虫槽的
<COL RED>数量</COL>和回复所需的<COL RED>时间</COL>都各有不同。",,,,,,,,"تستنزف حركات حشرة الحرير <COL RED>مقياس حشرة الحرير،
</COL>ولكنه يمتلأ بمرور الوقت.
 بمجرد التعافي، يمكن استخدام
المقياس مجددًا. تختلف <COL RED>درجة الاستهلاك</COL>
و<COL RED>وقت التعافي</COL> حسب كل حركة.",,,,,,,,,,,
1141e21a-c9ae-40b1-9c07-b1bda3b27384,4084083875,HN_NormalControlsMsg_small2_20,"翔蟲を使って空中を素早く移動し、
標的や目的地に到達する手段です。
連続で移動でき、<ICON PAD_X>でジャンプ攻撃に
繋げることができます。また、壁に向かって
おこなうと<COL RED>壁走り</COL>ができます。","Perform airborne acrobatics with Wirebugs
to move toward a destination or target.
Chain these moves together, or lead into
a jump attack with <ICON PAD_X>. This will execute
a <COL RED>wall run</COL> if used while facing a wall.","Faites des acrobaties aériennes avec des
Filoptères pour approcher un endroit ou
une cible. Enchaînez ces déplacements ou
amorcez une attaque sautée avec <ICON PAD_X>. Face
à un mur, cela vous fera <COL RED>courir</COL> dessus.","Esegui acrobazie in volo con un insetto
filo per muoverti verso una destinazione
o un obiettivo. Concatena queste mosse o
esegui un attacco in salto con <ICON PAD_X>. Se
sei davanti a un muro, puoi <COL RED>correrci su</COL>.","Bewege dich mit Seilkäfern akrobatisch
in der Luft auf Ziele zu. Verkette diese
Aktionen oder führe mit <ICON PAD_X> einen Sprung-
angriff aus. Wenn du dabei eine Wand
anvisierst, löst das einen <COL RED>Wandlauf</COL> aus.","Muévete hacia lugares u objetivos
mediante acrobacias aéreas con
cordópteros. Encadénalas o pasa a un
ataque en salto con <ICON PAD_X>. Si lo haces de
cara a una pared, <COL RED>correrás por ella</COL>.","Выполняйте приемы воздушной акробатики
с Прутожуками, чтобы достичь нужной
цели. Соединяйте приемы в цепочки или
переходите к атаке прыжком, нажимая <ICON PAD_X>.
Прием лицом к стене — <COL RED>бег по стене</COL> .","Wykonuj powietrzne ewolucje kablobakiem
w kierunku miejsca lub celu.
Połącz kilka ruchów lub wyprowadź nagły
atak, wciskając <ICON PAD_X>. Jeśli zrobisz to
przed <COL RED>ścianą, przebiegniesz po niej</COL>.",,,"Executa acrobacias aéreas com Cabinsetos
para se mover para um destino ou alvo.
Conecte estes movimentos ou um ataque
saltado com <ICON PAD_X>. Isto te fará
<COL RED>correr pela parede</COL> se usado em uma.","밧줄벌레로 공중을 빠르게 이동해 표적과
목적지에 도달하는 데 이용할 수 있습니다.
연속 이동이 가능하며 <ICON PAD_X>를 눌러 점프
공격으로 연계할 수 있습니다. 또한, 벽을
향해 사용하면 <COL RED>벽 달리기</COL>가 가능합니다.","使用翔蟲在空中迅速移動，
就能快速抵達目標或目的地。
能夠連續使用疾翔移動，
也能以<ICON PAD_X>接續施展跳躍攻擊。
另外，對著牆壁使用還能在<COL RED>壁面上奔跑</COL>。","使用翔虫在空中迅速移动，
以抵达目标或目的地的一种方法。
可连续移动，疾翔时按下<ICON PAD_X>
即可使出跳跃攻击。
此外，对着墙壁使用就能<COL RED>飞檐走壁</COL>。",,,,,,,,"نفّذ حركات بهلوانية في الجو بحشرة الحرير
للتحرك نحو وجهة أو هدف معين. اجمع هذه
الحركات معًا، أو تنقّل إلى هجوم بالقفز مع
<ICON PAD_X>. سينفذ ذلك <COL RED>ركض على الجدار</COL>
عند الاستخدام بمواجهة جدار.",,,,,,,,,,,
5d772805-ea2f-404f-b192-fdb186dc78b2,3810799196,HN_NormalControlsMsg_small2_21,"疾翔けが壁に届く射程内、射程外で
変化します。","The crosshairs will change depending
on whether you are in or out of reach
of a wall when performing a Wiredash.","Les réticules changeront selon si
vous êtes à portée d'un mur
ou non lors d'une propulsion.","I mirini variano a seconda che
ti trovi entro o fuori dalla portata
di una parete durante un filoscatto.","Das Fadenkreuz ändert sich abhängig
davon, ob du beim Seilsprint in Reich-
weite einer Wand bist oder nicht.","El punto de mira cambiará dependiendo
de si tienes una pared al alcance o no
cuando haces un cordoesprint.","Вид прицела будет зависеть от близости
к вам стены при выполнении рывка
на Прутожуке.","Celowniki zmieniają się w zależności
od tego, czy jesteś w zasięgu ściany,
wykonując kablozryw.",,,"As miras mudarão dependendo se você está
dentro ou fora do alcance de uma parede
ao executar uma Cabinvestida.","질주의 사거리가 벽에
닿는지에 따라 변화합니다.","會根據牆壁在疾翔射程內或射程外
而有所變化。","疾翔的准星会根据
墙壁在射程内、射程外而有所变化。",,,,,,,,"سيتغير النمط المتقاطع حسب درجة قُربك
للجدار
عند تنفيذ اندفاع الحرير.",,,,,,,,,,,
78474d35-d7cf-4dda-8831-8c0a0876e7b3,2725920131,HN_NormalControlsMsg_small2_22,射程外,Out of Reach,Hors de portée,Fuori portata,Außer Reichweite,Fuera de alcance,Вне досягаемости,Poza zasięgiem,,,Fora de Alcance,사거리 밖,射程外,射程外,,,,,,,,خارج النطاق,,,,,,,,,,,
e27d88f8-aa54-48c3-91e5-161df35f878b,3525710946,HN_NormalControlsMsg_small2_23,射程内,Within Reach,À portée,Entro la portata,In Reichweite,Al alcance,В пред. досяг.,W zasięgu,,,Dentro d'Alcance,사거리 안,射程內,射程内,,,,,,,,ضمن النطاق,,,,,,,,,,,
3fd58999-010e-41d4-9f45-1c5db4b1ffc1,3652714824,HN_NormalControlsMsg_small2_24,"空中で一定時間とどまることができます。
空中停止中は翔蟲ゲージは回復しません。
<ICON PAD_B>で落下、<ICON ANALOG_LS>＋<ICON PAD_B>で空中回避に繋がります。","Momentarily stop in midair. Your gauge
will not recover during this time. Drop
down with <ICON PAD_B> or evade with <ICON ANALOG_LS>+<ICON PAD_B>.","Permet de s'arrêter en l'air.
Votre jauge ne se restaure pas.
Descendez avec <ICON PAD_B>, esquivez avec <ICON ANALOG_LS>+<ICON PAD_B>.","Blocco momentaneo a mezz'aria. La barra
non si ripristinerà in questo periodo.
Lascia con <ICON PAD_B> o schiva con <ICON ANALOG_LS> e <ICON PAD_B>.","Halte kurz in der Luft an; dein Balken
füllt sich dabei nicht. Lass dich mit <ICON PAD_B>
fallen oder weiche mit <ICON ANALOG_LS>+<ICON PAD_B> aus.","Te detendrás un momento en el aire,
durante el cual tu barra no se restaura.
Cae con <ICON PAD_B> o esquiva con <ICON ANALOG_LS> + <ICON PAD_B>.","Временная остановка в воздухе. Шкала
в это время восст. не будет. Выполняйте
падение — <ICON PAD_B>, или уклоняйтесь — <ICON ANALOG_LS>+<ICON PAD_B>.","Zatrzymaj się na chwilę w locie. Pasek
nie będzie się w tym czasie regenerował.
Opad: <ICON PAD_B>. Unik: <ICON ANALOG_LS> + <ICON PAD_B>.",,,"Para momentaneamente no ar. Sua barra
não se recuperará durante este tempo.
Desça com <ICON PAD_B> ou esquive com <ICON ANALOG_LS>+<ICON PAD_B>.","공중에서 일정 시간 머무를 수 있습니다.
정지 중에는 게이지가 회복되지 않습니다.
<ICON PAD_B>로 낙하, <ICON ANALOG_LS>+<ICON PAD_B>로 공중에서 회피합니다.","能夠在空中停留一定時間，
停留在空中時，翔蟲計量表不會回復。
按下<ICON PAD_B>降落，<ICON ANALOG_LS>+<ICON PAD_B>則可進行空中迴避。","可在空中滞留一段时间。
滞空时无法回复翔虫槽。
按<ICON PAD_B>落下，以<ICON ANALOG_LS>+<ICON PAD_B>可进行空中回避。",,,,,,,,"التوقف لحظات في الهواء. لن يمتلئ مقياسك
خلال هذا الوقت. اهبط لأسفل من خلال الضغط
على <ICON PAD_B> أو تفادَ الضرب بالضغط على <ICON ANALOG_LS>+<ICON PAD_B>.",,,,,,,,,,,
631d850e-1fb4-411b-8bb8-046872a0d671,3404458926,HN_NormalControlsMsg_small2_25,"疾翔けで空中に移動した時や、
空中停止から<ICON ANALOG_LS>＋<ICON PAD_B>で使えます。
攻撃の回避に使える他、移動手段としても
使用することができます。","To execute, press <ICON ANALOG_LS>+<ICON PAD_B>
after a midair Wiredash or midair stop.
This move is handy for getting around
and dodging attacks.","Pour effectuer cette action,
appuyez sur <ICON ANALOG_LS>+<ICON PAD_B> après une propulsion
ou un arrêt en l'air. Cette technique
est parfaite pour se déplacer et
esquiver rapidement.","Per eseguire, premi <ICON ANALOG_LS> + <ICON PAD_B> dopo un
filoscatto o un blocco a mezz'aria.
Utile per aggirare e schivare attacchi.","Drücke <ICON ANALOG_LS>+<ICON PAD_B> nach einem Seilsprint
oder Stopp in der Luft, um die Aktion
auszuführen. Das ist ein praktisches
Manöver, um herumzukommen und
Angriffen zu entgehen.","Para ejecutarlo, pulsa <ICON ANALOG_LS> + <ICON PAD_B> después
de un cordoesprint o de una parada aérea.
Esto te ayudará a maniobrar y evitar
ataques.","Чтобы выполнить прием, нажмите <ICON ANALOG_LS>+<ICON PAD_B>
после рывка на Прутож. в воздухе или
ост. в воздухе. Этот прием удобен
для перемещения и уклонения от атак.","Aby wykonać unik, użyj
kombinacji <ICON ANALOG_LS> + <ICON PAD_B> po kablozrywie
w locie lub zatrzymaniu w locie. Jest
to przydatny sposób poruszania się
i unikania ataków.",,,"Para executar, pressione <ICON ANALOG_LS>+<ICON PAD_B> depois de
uma Cabinvestida aérea ou parada no ar.
Este movimento é útil para se mover e se
esquivar de ataques.","질주로 공중에서 이동하거나
공중 정지 중에 <ICON ANALOG_LS>+<ICON PAD_B>로 사용 가능합니다.
회피나 이동 수단으로
사용할 수 있습니다.","以疾翔在空中移動時，
或是在空中停留時按下<ICON ANALOG_LS>+<ICON PAD_B>就能使用。
除了用來迴避攻擊以外，
也能作為一種移動方式。","以疾翔在空中移动或滞空时，
以<ICON ANALOG_LS>+<ICON PAD_B>可使出空中回避。
可用于回避攻击或进行移动。",,,,,,,,"للتنفيذ، اضغط على <ICON ANALOG_LS>+<ICON PAD_B>بعد اندفاع الحرير
في الهواء أو التوقف في الهواء.
تعد هذه الحركة مناسبة
للالتفاف وتفادي الهجمات.",,,,,,,,,,,
0a22ea51-78d8-4978-a9e1-98d13d778910,2710743480,HN_NormalControlsMsg_small2_26,"ダメージを受けたときは、翔蟲ゲージを使い
<OPT ZL>+<ICON PAD_B>で体勢を立て直すことで、
モンスターの追撃を避けることができます。
ただし、モンスターの攻撃によっては
翔蟲受け身ができない強い攻撃もあります。","Press <OPT ZL>+<ICON PAD_B> when a monster
sends you flying to execute a Wirefall
(this consumes some of your Wirebug
Gauge), allowing you to quickly recover
and evade any oncoming attacks.","Si un monstre vous fait voler, appuyez
sur <OPT ZL>+<ICON PAD_B> pour effectuer une Filochute.
(Consomme votre jauge de Filoptère.)
Cela vous permet de vite reprendre
l'équilibre et esquiver.","Premi <OPT ZL> e <ICON PAD_B> quando un mostro ti colpisce
per eseguire una filocaduta a costo però
di una porzione di barra insetto filo.
In questo modo potrai riprenderti in
fretta e schivare gli attacchi successivi.","Setze mit <OPT ZL>+<ICON PAD_B> einen Seilfall ein, wenn
dich ein Monster wegschleudert (verbraucht
einen Teil deines Seilkäfer-Balkens), um
dich schnell zu erholen und drohenden
Angriffen auszuweichen.","Pulsa <OPT ZL> + <ICON PAD_B> cuando un monstruo te
lance por los aires para ejecutar una
cordocaída (que consumirá parte del
indicador cordóptero), recuperándote
más rápido para evitar otros ataques.","Когда монстр пинком отправляет вас
в воздух, нажмите <OPT ZL>+<ICON PAD_B>, чтобы выполнить
нырок (расходует шкалу Прутожука). Это
позволяет быстро восстановиться
и уклониться от атак.","Gdy potwór pośle cię atakiem
w powietrze, wciśnij <OPT ZL> + <ICON PAD_B>, by wykonać
kablopad (zużywa to część paska
kablobaka). Dzięki temu szybko odzyskasz
równowagę i unikniesz ataków.",,,"Pressione <OPT ZL>+<ICON PAD_B> quando um monstro mandar
você pelos ares para executar uma
Cabinqueda (consome Barra de Cabinseto)
para se recuperar rapidamente e evadir
ataques subsequentes.","대미지를 입었을 때, 밧줄벌레 게이지를
사용해 <OPT ZL>+<ICON PAD_B>로 자세를 바로잡아
몬스터의 추가 공격을 피할 수 있습니다.
단, 몬스터의 공격 중에는 밧줄벌레 낙법을
할 수 없는 강력한 공격도 있습니다.","受到傷害時，可以消耗翔蟲計量表，
按下<OPT ZL>+<ICON PAD_B>施展此受身，藉此調整姿勢，
並避開魔物的追擊。
但依據魔物攻擊種類不同，
受到部分強力攻擊時將無法使出翔蟲受身。","受到伤害时，可使用翔虫槽，
按<OPT ZL>+<ICON PAD_B>来重整态势，
并避开怪物的追击。
不过，若被怪物的某些强大攻击打中，
猎人将无法发动翔虫受身。",,,,,,,,"اضغط على <OPT ZL>+<ICON PAD_B> عندما يرسلك أحد الوحوش
في الهواء لتنفيذ سقوط الحرير
(يستنفذ هذا بعضًا من مقياس
حشرة الحرير لديك)، مما يتيح لك التعافي
سريعًا وتفادي أي هجمات قادمة.",,,,,,,,,,,
b959ea84-765f-49e6-ab55-6f2dae115a74,1722564895,HN_NormalControlsMsg_small2_27,"抜刀中、翔蟲ゲージを消費して使えます。
<ICON PAD_X>と<ICON PAD_A>にはそれぞれ個別の鉄蟲糸技があり
武器種によって異なります。剣士では<OPT ZL>を、
ガンナーでは<OPT Gunner_RT>を押しながら使用できます。
詳細は武器操作指南書で確認できます。","Hold <OPT ZL> (Blademasters) or <OPT Gunner_RT> (Gunners)
with your weapon drawn, then press either
<ICON PAD_X> or <ICON PAD_A> to perform a unique Silkbind
attack. Refer to Weapon Controls in your
Hunter's Notes for more details.","Maintenez <OPT ZL> (Épéistes) ou <OPT Gunner_RT> (Artilleurs)
avec l'arme dégainée puis appuyez sur
<ICON PAD_X> ou sur <ICON PAD_A> pour faire une
attaque Lien de soie. Consultez
le Guide de combat du Compendium.","Tieni premuto <OPT ZL>
(spadaccini) o <OPT Gunner_RT>
(artiglieri), poi premi <ICON PAD_X> o <ICON PAD_A> con l'arma
sguainata per un attacco con fildiseta. Per
più dettagli, consulta i Comandi delle armi.","So nutzt du Seidenbinder-Angriffe: Halte
<OPT ZL> (Klingenmeister)
oder <OPT Gunner_RT> (Schützen)
und drücke <ICON PAD_X> oder <ICON PAD_A>. Mehr Details unter
""Waffensteuerung"" in den Jägernotizen.","Con el arma desenfundada, mantén <OPT ZL>
(espadachines) o <OPT Gunner_RT> (artilleros) y luego
pulsa <ICON PAD_X> o <ICON PAD_A> para ejecutar un ataque de
cordoamarre único. Más detalles en la
guía de armas de las notas de cazador.","Уд. <OPT ZL> (Мастера клинка)
или <OPT Gunner_RT> (Стрелки) с оружием
наготове, затем нажмите <ICON PAD_X> или <ICON PAD_A>,
чтобы вып. атаку паутиной. Подробности:
""Записи охотника"" — ""Управл. оружием"".","Przytrzymaj <OPT ZL> (mistrzowie ostrza) lub
<OPT Gunner_RT> (strzelcy) z dobytą bronią i wciśnij
<ICON PAD_X> lub <ICON PAD_A>, żeby wykonać wyjątkowy atak
jedwabionicią. Szczegóły: „Sterowanie
i kombinacje” w „Notatkach łowcy”.",,,"Segure <OPT ZL>
(M. Lâminas) ou <OPT Gunner_RT>
(Atiradores) com a arma em punho, depois
aperte <ICON PAD_X> ou <ICON PAD_A> para executar um ataque
de Sedaférrea único.","발도 중 밧줄벌레 게이지를 소비해서
사용합니다. <ICON PAD_X>와 <ICON PAD_A>에 각각 벌레철사
기술이 있으며 무기에 따라 달라집니다. 검사는 <OPT ZL>,
건너는 <OPT Gunner_RT>를 누른 채로 사용할 수 있습니다.
자세한 내용은 무기 조작 방법에서 확인하세요.","在拔刀狀態下，消耗翔蟲計量表即可使用。
<ICON PAD_X>與<ICON PAD_A>都有各自的鐵蟲絲招式，
並會隨著武器種類不同而有所變化。
劍士按著<OPT ZL>、槍手按著<OPT Gunner_RT>即可使用。
詳細資訊可至武器操作說明書確認。","拔刀中，可消耗翔虫槽来使用。
<ICON PAD_X>与<ICON PAD_A>能使出不同的铁虫丝技，
每种武器的铁虫丝技也各有不同。
剑士按住<OPT ZL>、枪手按住<OPT Gunner_RT>即可使用。
详情可在武器操作指南书中确认。",,,,,,,,"اضغط باستمرار على <OPT ZL> (أسياد النصال) أو
<OPT Gunner_RT> (حاملي البنادق) مع إشهار سلاحك، ثم
اضغط سواء على <ICON PAD_X> أو <ICON PAD_A> لتنفيذ هجوم فريد
بربطة حريرية. عُد إلى إعدادات الأسلحة في
ملاحظات الصياد لمزيد من التفاصيل.",,,,,,,,,,,
1edb268f-5141-41ad-92d4-0659d091b969,2521972096,HN_NormalControlsMsg_small2_28,"ツタなどの壁に向かって移動すると、
自動的に壁に張りつくことができます。","Move towards an ivy wall and you
will automatically grab on to it.","Avancez vers un mur de lierre et vous
vous y accrocherez automatiquement.","Cammina verso una parete di edera
e ti ci aggrapperai automaticamente.","Wenn du dich auf eine Efeuwand zubewegst,
greifst du automatisch danach.","Dirígete a una pared con hiedra para
agarrarte automáticamente a ella.","Если подойти к стене с плющом, вы
автоматически схватитесь за нее.","Wykonując ruch w stronę ściany
z bluszczem, automatycznie się
jej chwycisz.",,,"Mova-se para uma parede de heras
e você a agarrará automaticamente.","넝쿨 같은 벽을 향해 이동하면
자동으로 벽에 달라붙습니다.","往藤蔓一類的牆面移動，
就會自動攀附在牆上。","朝藤蔓等墙面移动时，
会自动贴在墙面上。",,,,,,,,"تحرّك نحو جدار اللّبلاب وسوف
تمسك به تلقائيًا.",,,,,,,,,,,
