guid,crc?,<PageAttr>,<TalkAttr>,<VillageProgress>,<HallProgress>,<HunterRank>,<TalkTag>,<TalkTagParam>,<TalkTagComment>,<TalkTag>,<TalkTagParam>,<TalkTagComment>,<TalkTag>,<TalkTagParam>,<TalkTagComment>,<TalkTag>,<TalkTagParam>,<TalkTagComment>,<TalkTag>,<TalkTagParam>,<TalkTagComment>,<TalkTag>,<TalkTagParam>,<TalkTagComment>,<TalkTag>,<TalkTagParam>,<TalkTagComment>,<TalkTag>,<TalkTagParam>,<TalkTagComment>,<TalkTag>,<TalkTagParam>,<TalkTagComment>,<TalkAction1>,<TalkAction1Param>,<TalkAction1Comment>,<TalkAction2>,<TalkAction2Param>,<TalkAction2Param2>,<TalkAction2Comment>,<KohakuProgress>,entry name,Japanese,English,French,Italian,German,Spanish,Russian,Polish,Dutch,Portuguese,PortugueseBr,Korean,TraditionalChinese,SimplifiedChinese,Finnish,Swedish,Danish,Norwegian,Czech,Hungarian,Slovak,Arabic,Turkish,Bulgarian,Greek,Romanian,Thai,Ukrainian,Vietnamese,Indonesian,Fiction,Hindi,LatinAmericanSpanish
ddb9b348-5808-4a90-80c4-57564b6e70e2,1200904919,,,,,,,,,,,,,,,,,,,,,,,,,,,,,,,,,,,,,,,,,nid033_ch5_006,"その秘めたる実力は、
剣の師であるカゲロウ殿と
並ぶ勢い…だそうニャ。","Appawrently, his hidden talents match
the skill of sword master Kagero.","Apparemment, ses talents cachés rivaliseraient
avec ceux de l'épéiste Kagero.","Sembra che i suoi talenti nascosti
siano al pari di quelli del miaestro
di spada Kagero.","Offenschnurrig kommen seine verborgenen
Talente den Fähigkeiten von Schwertmeister
Kagero gleich.","Parece ser que sus talentos ocultos están
a la par de los del espadachín Kagero...","Его скрытые таланты сравнимы с
навыками мастера меча Кагэро.
Так мяуворят.","Jego ukryte talenty są na poziomie
umiejętności mistrza miecza
Kagero... Podobno.",,,"Os talentos secretos dele estão à altura
do Mestre de Espadas Kagero.
Aparentemente.","그 숨겨진 실력은
검술 스승인 카게로 공과
비견될 정도…라고 한다냥.","他身上所潛藏的實力……
據說足以和教他劍術的師父陽炎大人匹敵喵。","听说……他真正的实力堪与他的剑术师父
阳炎大人相媲美喵。",,,,,,,,"مواهبه الخفية تتطابق مع مهارة
كاجيرو سيد السيوف. على ما يبدو.",,,,,,,,,,,
4c69ff41-0a91-43ca-9ef2-8aa5cd96e5c5,375201604,,,,,,,,,,,,,,,,,,,,,,,,,,,,,,,,,,,,,,,,,nid033_ch5_007,"そしてその実力を買われて
チッチェ姫の護衛という密命を
王国から受けているのニャ。","As a result, he's secretly charged with
the purr-otection of Princess Chichae.","Du coup, il a été choisi pour protéger
la princesse Chichae en secret.","Pertanto, ha l'incarico segreto di
proteggere la principessa Chichae.","Daher ist er insgeheim mit dem Schutz
von Prinzessin Chichae beauftragt.","Por eso, tiene encomendada la protección
de la princesa Chichae, pero todo esto
es secreto.","И теперь его тайная миссия —
защита Принцессы Чиче.","Z tego powodu powierzono mu sekretne
zadanie ochrony księżniczki Chichae.",,,"Por isso, ele está secretamente encar-
regado da prroteção da Princesa Chichae.","그리고 그 실력을 높이 산
왕국에서 치체 공주님을
호위하라는 밀명을 내렸다냥.","而王國也看中了他的實力，
秘密指派他擔任琪婕公主的護衛喵。","王国欣赏他的实力，就给他下了密令，
让他保护琪切公主喵。",,,,,,,,"نتيجة لذلك، وُجهت إليه سرًا تهمة
حماية الأميرة شيشاي.",,,,,,,,,,,
52a56c2e-e897-443e-82d0-047b00aeb267,2350759168,,,,,,,,,,,,,,,,,,,,,,,,,,,,,,,,,,,,,,,,,nid033_ch5_008,"でも命を奪う行為はしたくないので
オボロ殿は木刀を隠し持っているニャ。
提督いわく、木刀でじゅうぶんだそうニャ。","But as he won't take anyone's life, he
conceals about his purrson only a wooden
sword. Which is sufficient, I hear.","Mais comme il refuse d'ôter la vie de
quiconque, il n'a qu'une épée en bois
sur lui, ce qui suffirait apparemment...","Ma dato che non vuole uccidere nessuno,
porta con sé solo una spada di legno.
Che pare sia sufficiente.","Aber da er niemanden töten wird, verbirgt
er nur ein Holzschwert am Körper. Was
ausreicht, wie ich höre, *schnurr*.","Como no quiere matar, solo lleva oculta
en sus ropajes una espada de madera,
¡y al parecer con eso le basta!","Но, поскольку он не хочет убивать, при
нем есть лишь деревянный меч. Но этого
вполне достаточно, как я слышал.","Ponieważ nie chce nikogo zabić, ma
ze sobą tylko drewniany miecz.
Co podobno wystarcza.",,,"Mas, como ele nunca tira uma vida,
esconde nas roupas só uma espada de
madeira, que já é suficiente.","하지만 오보로 공은 목숨을 빼앗는 행위가
싫어 목도를 숨기고 있다냥.
제독님 말로는 목도면 충분하다고 한다냥.","不過因為朧大人不想奪去任何性命，
所以身上只藏著木刀而已喵。但據提督所說，
他用木刀就足以勝任護衛一職了喵。","但胧大人不想杀生，所以偷偷带着木刀喵。
据提督说，用木刀足矣喵。",,,,,,,,"ولكن نظرًا لأنه لن يقتل أي شخص،
فإنه يخفي فقط سيفًا خشبيًا.
وهذا كافٍ وفقًا لما سمعته.",,,,,,,,,,,
d416b6c2-46a5-47ea-a7ae-d61f8ed18872,2275192680,,,,,,,,,,,,,,,,,,,,,,,,,,,,,,,,,,,,,,,,,nid033_ch5_009,"そして、姫が危険な目にあわないよう
見ている必要があるため
あの場所に雑貨屋があるのニャ。","That's why he has his market where
he does. To keep a close eye on the
purr-incess.","C'est pour ça qu'il a son stand à cet
endroit précis... pour veiller sur
la princesse.","Per questo ha il suo mercato proprio lì:
per tenere d'occhio la prrrincipessa.","Darum hat er seinen Markt dort, wo er ist.
Um die Prinzessin im Auge zu behalten.","Ese es el motivo de que su puesto esté
situado donde está: así puede vigilar de
cerca a la princesa.","Поэтому он торгует в том месте —
прис-мяу-тривает за принцессой.","Dlatego ma swój stragan w tym miejscu.
Aby mieć pod okiem księżniczkę.",,,"Por isso que ele fica bem ali.
Para ficar de olho na prrrincesa.","공주님이 위험에 빠지지 않도록
지켜봐야 하니
저곳에 잡화점이 있는 거다냥.","然後由於他必須看著公主，
避免讓她遭遇危險，
因此才會在那個地方開設雜貨店。","还有，他需要留意公主，不让她遇到危险，
所以在那里开了家杂货店喵。",,,,,,,,"لهذا السبب يعمل في
السوق. ليراقب الأميرة
عن كثب.",,,,,,,,,,,
31dd606e-c287-4a31-9fed-568cc655eb4a,557484652,会話終了,,,,,,,,,,,,,,,,,,,,,,,,,,,,,,,,,,,,,,,,nid033_ch5_010,"……ニャんとも驚愕の情報だったニャ。
次の情報更新は、オヌシの実力がさらに
認められて、MRが上がったあとだニャ。","By my whiskers, wasn't that juicy?
I'll update you again once your MR
has increased.","J'en ai les moustaches qui frétillent !
Bref, je t'en dirai plus quand ton RM
aura augmenté.","Per mille baffi, non era interessante?
Quando aumenterai di grado maestro,
ti dirò un altro segreto!","Jetzt bist du baff, was? Mehr Infos gibt
es, sobald sich dein Meisterrang erhöht
hat.","¿A que es una información de primera?
Tendré algo más para ti cuando haya
aumentado tu RM.","Клянусь хвостом, разве это не пикантно?
Как только у вас вырастет РМ, я сообщу
вам новую информацию.","Na moje wąsy, pikantna sprawka, co?
Przekażę ci kolejną miau-formację, gdy
podniesiesz swoją RM.",,,"Pelos meus bigodes, não foi um baque?
Vou te atualizar de novo assim que você
elevar seu RM.","……정말 놀라운 정보다냥.
그럼 다음 정보 갱신은 실력을 더욱 
인정받아 MR이 오른 뒤다냥.","……真是令人震驚的情報喵。
那麼，下一條情報會在
你的實力更受認可，MR上升之後更新喵。","……多喵惊人的情报喵。那么下一次的情报
更新，要等你实力进一步得到认可，大师
等级提升后喵。",,,,,,,,"بالله <LSNR {عليك} {عليكِ}>، أليس هذا مثيرًا؟
سأقوم <LSNR {بإخطارك} {بإخطاركِ}> مرة أخرى
بمجرد زيادة رتبة القائد.",,,,,,,,,,,
b9ddb7a8-1bf0-470d-bafb-8e27b2930a26,812825904,,(default)世間話,,,,この会話フラグがONなら→,EV_PRO_MR_006_01_01,,,,,,,,,,,,,,,,,,,,,,,,,,,,,,,,,,nid033_ch6_000,"ニャンとフカシギ。
謎の情報屋、ただいま参上…だニャ。","It is I, Fukashigi the Informant,
at your service...","C'est moi, Fukashigi l'informateur !
À ton service...","Fukashigi l'informatore,
al tuo servizio...","Ich bin es, Fukashigi der Informant,
zu deinen Diensten...","Soy yo, Fukashigi el informador,
a tu servicio...","Я, Информатор Фукасиги,
к вашим услугам...","To ja, Informator Fukashigi,
do usług...",,,"Sou eu, Fukashigi, o Informante,
ao seu dispor!","의문의 정보상,
후카시기의 등장이다…냥.","奇妙奇喵妙妙妙。
神秘情報商在此登場……喵。","多喵玄又玄。
神秘情报商来也……喵。",,,,,,,,"إنه أنا المخبر فوكاشيجي،
في <LSNR {خدمتك} {خدمتكِ}>...",,,,,,,,,,,
f2009a67-5021-4ec7-9c88-a82ecd086d18,4057407528,,,,,,,,,,,,,,,,,,,,,,,,,,,,,,,,,,,,,,,,,nid033_ch6_001,"フム、ではエルガドの
裏情報…「すぺしゃる」のうちの１つを
オヌシに伝えようではニャいか…。","Very well. I'll impawrt to you the first half
of the most special secret of Elgado...","Très bien, il est temps maintenant de
te révéler la première partie
du plus sombre secret d'Elgado...","Miaolto bene. Ti svelerò la prima
metà del segreto speciale di Elgado...","Also gut. Ich verrate dir die erste Hälfte
des größten Geheimnisses von Elgado...","Muy bien, compartiré contigo el primero
de los dos secretos más ocultos de Elgado...","Хорошо. Расскажу первую часть самого
необычного секрета Элгадо...","Kociastycznie. Za chwilę poznasz pierwszą
połowę największej tajemnicy Elgado...",,,"Bem. Vou contar a primeira miautade
do segredo mais especial de Elgado...","흠, 그럼 엘가도의
스페셜한 비밀 중 하나를
자네에게 알려 주겠다냥…","嗯，那就讓吾告訴你
艾爾卡多的「SPECIAL」秘密情報
其中之1吧喵……","嗯，那老夫就告诉你埃尔迦德的内幕消息……
“特别”情报之一喵……",,,,,,,,"جيد جدًا. <LSNR {سأخبرك} {سأخبركِ}> بالنصف الأول من
السر الأكثر تميزًا لإلجادو...",,,,,,,,,,,
bbdac188-bed3-41b0-8b38-efa7a9dd9e68,1897008904,,,,,,,,,,,,,,,,,,,,,,,,,,,,,,,,,,,,,,,,,nid033_ch6_002,薬師タドリ殿は…。,Doctor Tadori...,Docteur Tadori...,Il dottor Tadori...,Tadori...,El doctor Tadori...,Доктор Тадори...,Doktor Tadori...,,,O Doutor Tadori...,약사 타도리 공은…,溯藥師大人他……,游方医沿大夫他……,,,,,,,,الطبيب تادوري...,,,,,,,,,,,
fa582597-d969-4766-8373-b79b16e00c5f,249519203,,,,,,,,,,,,,,,,,,,,,,,,,,,,,,,,,,,,,,,,,nid033_ch6_003,じつは…。,Is in fact...,Mange en fait...,... in realtà...,... hat in Wirklichkeit...,Nada menos que...,На самом деле...,Tak naprawdę...,,,Na verdade...,사실…,其實……,其实……,,,,,,,,هو في الحقيقة...,,,,,,,,,,,
fc4e54d0-0719-4f13-8a37-4436f90d9063,231069463,,,,,,,,,,,,,,,,,,,,,,,,,,,,,,,,,,,,,,,,,nid033_ch6_004,"バハリ殿に
お弁当を作ってもらっている！","Having packed lunches made for him
by Bahari!","Des petits plats qui seraient préparés
rien que pour lui par Bahari !",... si fa preparare il pranzo da Bahari!,"Mittagessenpakete, die Bahari
für ihn gemacht hat!","¡Solo come porque Bahari le prepara
las comidas!","Ест готовые обеды, которые собирает
для него Бахари!","Dostaje drugie śniadanie przyrządzane
przez Bahariego!",,,Leva marmitas feitas pelo Bahari!,"바하리 공이
만들어 준 도시락을 먹고 있다!",有巴赫里大人替他做便當！,让巴哈里大人帮他做便当！,,,,,,,,"يتناول وجبات غداء مجهزة خصيصًا له
يصنعها بهاري!",,,,,,,,,,,
dde13b9f-4f85-4635-8c97-17c6364e986b,1173238722,,,,,,,,,,,,,,,,,,,,,,,,,,,,,,,,,,,,,,,,,nid033_ch6_005,"１人で現地調査を行っているタドリ殿は
外に出ていることが多いのもあって
あまり食に興味がないようなのニャ。","The doctor is fur-equently out doing
field work and appears to have little
interest in eating.","Le docteur va souvent sur le terrain
pour ses recherches et ne semble
guère penser à se nourrir.","Il medico è spesso in giro a fare ricerche
e non pensa a mangiare.","Der Doktor ist ständig unterwegs und
arbeitet. Er hat anscheinend wenig
Interesse am Essen.","El doctor suele estar trabajando sobre
el terreno, y se ve que nunca piensa en
mover el bigote.","Доктор частенько занимается полевой
работой и, кажется, не уделяет
особого внимания питанию.","Doktor często wyrusza na badania i nie
jest zbytnio zainteresowany jedzeniem.",,,"O doutor vive saindo em trabalho de
campo e não liga muito para comida.","혼자 현지 조사를 나가 있는 타도리 공은
밖에 나가 있을 때가 많아서인지,
먹는 것에 별로 흥미가 없는 것 같다냥.","溯大人會獨自前往野外進行調查。
也因為常常待在外頭的關係，
他對吃的似乎沒什麼興趣喵。","沿大夫要一个人去实地调查，常常外出，
所以对吃东西好像没什么兴趣喵。",,,,,,,,"يقوم الطبيب بالعمل الميداني
بشكل مستمر ويبدو أنه لا يهتم
كثيرًا بالطعام.",,,,,,,,,,,
31ea864c-3ae2-4880-978c-58cb5441d3b5,2940987214,,,,,,,,,,,,,,,,,,,,,,,,,,,,,,,,,,,,,,,,,nid033_ch6_006,"草やキノコをそのまま食べている姿を
みかねて、バハリ殿が料理を
作ってくれているニャ。","Unable to bear seeing Tadori munching
on raw herbs and mushrooms, Bahari
has taken to purr-eparing him a lunch.","Bahari ne supportait plus de voir
Tadori se nourrir juste de champignons
et d'herbes, donc il lui fait ses repas.","Stufo di vedere Tadori mangiucchiare
erbe crude e funghi, Bahari ha iniziato
a prrreparargli il pranzo.","Da Bahari es nicht ertragen kann zu sehen,
wie Tadori rohe Kräuter und Pilze kaut,
bereitet er ihm ein Mittagessen zu.","Como Bahari no soporta verle vivir solo
de hierbajos y setas, tomó la decisión
de prepararle el almuerzo.","Не в силах смотреть, как Тадори жует
сырые травы и грибы, Бахари начал
готовить для него обеды.","Bahari nie mógł patrzeć, jak Tadori je
tylko korzonki i grzyby, i zaczął mu
przygotowywać drugie śniadanie.",,,"Farto de ver Tadori mastigando ervas
e cogumelos crus, Bahari começou a
fazer refeições para ele.","항상 약초나 버섯을
생식하는 모습을 보다 못한
바하리 공이 음식을 만들어 주고 있다냥.","巴赫里大人看過他直接吃草和香菇，
覺得看不下去才會做菜給他吃喵。","他总是就那么生吃草和蘑菇，巴哈里阁下
看不下去，就帮他做饭了喵。",,,,,,,,"ونظرًا لأن بهاري لم يتحمل رؤية تادوري يأكل الأعشاب
والفطر النيئ، صار يجهز
له الغداء.",,,,,,,,,,,
3fc159be-ff49-4691-9447-0de8e2a0edda,2328666638,,,,,,,,,,,,,,,,,,,,,,,,,,,,,,,,,,,,,,,,,nid033_ch6_007,"バハリ殿は
食事と睡眠を大事にしているだけあって
料理の腕はかなりのものなのニャ。","Bahari values good nutrition and sleep
very highly, and he's actually a rather
accomplished cook.","La bonne nourriture et le repos comptent
beaucoup pour Bahari, et il s'en sort
plutôt bien au fourneau.","Per Bahari una buona alimentazione
e il riposo sono fondamentali. Inoltre,
è anche un cuoco eccezionale.","Bahari hält viel von guter Ernährung und
Schlaf – und er kann tatsächlich richtig
gut kochen.","Bahari da mucha importancia a la buena
alimentación y a dormir bien, y de hecho
es muy buen cocinero.","Бахари очень высоко ценит хорошее
питание и сон, и он довольно неплохо
готовит.","Bahari przykłada wielką wagę do snu
i odżywiania i jest wyśmienitym kucharzem.",,,"Bahari valoriza muito a alimentação e o
sono saudáveis, e cozinha muito bem.","바하리 공은
식사와 수면을 중요시하는 만큼
요리 실력도 꽤 좋다냥.","不愧是非常重視用餐和睡眠的巴赫里大人，
廚藝也相當了得呢喵。","巴哈里大人到底是个看重饮食和睡眠的人，
厨艺相当了得喵。",,,,,,,,"يقدر بهاري التغذية الجيدة
والنوم الكافي، وهو في الواقع
طباخ ماهر.",,,,,,,,,,,
f70c8a57-f18f-441e-bbfe-09e60986977b,92910850,,,,,,,,,,,,,,,,,,,,,,,,,,,,,,,,,,,,,,,,,nid033_ch6_008,"タドリ殿がたまにエルガドに来たときに
日持ちする食べ物やお弁当を持たせて
食のお世話をしているニャ。","Whenever Doc comes to Elgado, Bahari
makes sure to send him off again with a
packed lunch of good, long-lasting food.","Chaque fois que le doc vient à Elgado,
Bahari ne le laisse repartir qu'avec un
bon plat qui se garde.","Ogni volta che il dottore viene a Elgado,
Bahari si assicura che riparta con
dell'ottimo cibo a lunga conservazione.","Immer, wenn der Doktor nach Elgado kommt,
schickt Bahari ihn mit einem Paket voller
gutem, satt machendem Essen fort.","Cuando el doctor llega a Elgado, Bahari
se asegura de darle una tartera llena de
buenas viandas para el próximo viaje.","Когда доктор бывает в Элгадо, Бахари
обязательно готовит для него
питательный обед в дорогу.","Gdy Doktor jest w Elgado, Bahari daje mu
paczkę ze smacznym pożywieniem, które
długo wytrzyma w podróży.",,,"Sempre que o doutor vem a Elgado, Bahari
cuida para que ele parta com uma marmita
cheia de comida boa e durável.","타도리 공이 가끔 엘가도에 올 때마다
오래 보관할 수 있는 음식이나 도시락을
주는 등 신경을 써 주고 있다냥.","溯大人偶爾來到艾爾卡多的時候，
巴赫里大人就會給他能久放的食物或便當，
讓他好好填飽肚子喵。","沿大夫偶尔来埃尔迦德的时候，巴哈里大人
会让他带些能长时间保存的食物和便当喵。",,,,,,,,"عندما يأتي الطبيب إلى إلجادو، يحرص
بهاري على إرسال غداء معبأ معه
من الطعام الجيد طويل الأمد.",,,,,,,,,,,
f4abd912-96d2-495d-b6ca-236f2083073f,822469612,,,,,,,,,,,,,,,,,,,,,,,,,,,,,,,,,,,,,,,,,nid033_ch6_009,"あんなに冷静で大人なタドリ殿が
変わり者のバハリ殿のお世話になってる
なんて、意外すぎる関係なのニャ。","It's amewsing to see the calm and
collected doctor being pampurred
by the eccentric Bahari.","C'est tellement drôle de voir le docteur
si calme se faire bichonner par
un type aussi excentrique que Bahari.","È divertente vedere il dottore,
così calmo e distinto, che viene
viziato dall'eccentrico Bahari.","Es ist pfotastisch zu sehen, wie der
ruhige und gefasste Doktor vom
exzentrischen Bahari verwöhnt wird.","¡Qué locura que el doctor, tan tranquilo
y comedido, se deje cuidar por el loco
de Bahari!","Забавно с-мяу-треть, как эксцентричный
Бахари заботится о спокойном и
собранном докторе.","Zabawny to widok. Ekscentryczny Bahari
rozpieszcza opanowanego
i spokojnego lekarza.",,,"É divertido ver o doutor, tão calmo e
sereno, sendo mimado pelo
excêntrico Bahari.","냉정하면서 어른스러운 타도리 공이
괴짜인 바하리 공에게 신세를 지고 있다니
엄청나게 놀라운 관계다냥.","溯大人明明那麼冷靜又成熟，
居然會讓巴赫里大人這位怪人照顧，
他們的關係實在是太出人意料了喵。","冷静又成熟的沿大夫竟然会受巴哈里大人
这个怪人的关照，他们的交情可真太让人
意外了喵。",,,,,,,,"إنه لأمر ممتع أن ترى بهاري
غريب الأطوار يدلل
الطبيب الهادئ.",,,,,,,,,,,
bbb8b131-01a8-4083-a669-dcb10f18d009,701700633,会話終了,,,,,,,,,,,,,,,,,,,,,,,,,,,,,,,,,,,,,,,,nid033_ch6_010,"……ニャんとも驚愕の情報だったニャ。
では、２つの「すぺしゃる」な情報のうちの
１つは、これにて終了だニャ。","By my whiskers, wasn't that juicy?
Thus concludes the first half of
my most special, secret intel.","J'en ai les moustaches qui frétillent !
Et ainsi s'achève la première partie de
mes infos spéciales secrètes.","Per mille baffi, questo sì che era
interessante. Qui si conclude la prima
metà del segreto speciale...","Ich weiß, jetzt bist du baff.
Das war die erste Hälfte meines größten,
speziellsten Geheimnisses.","¡Por mis bigotes, menudo dato! ¿No?
Con esto concluye el primero de los dos
secretos más ocultos de Elgado.","Клянусь хвостом, это просто чудесно.
Вот я и поведал вам первую часть
самого необычного секрета.","Na moje wąsy, to było pikantne, co?
Zatem znasz pierwszą połowę mojej
najbardziej bombowej tajemnicy.",,,"Pelos meus bigodes, essa foi das boas.
E aqui termina a primeira parte da minha
informação secreta mais especial.","……정말 놀라운 정보다냥.
「스페셜」한 비밀 중 하나는
이걸로 끝이다냥.","……真是令人震驚的情報喵。
那麼，2條「SPECIAL」情報的其中之一，
就到此結束喵。","……多喵惊人的情报喵。
那么，两个“特别”情报之一就此讲完了喵。",,,,,,,,"ربّاه، ألم يكن ذلك مثيرًا؟
وهكذا نستنتج النصف الأول من
سري الخاص الأكثر تميزًا.",,,,,,,,,,,
40207077-222d-467d-9e7d-bd5c2c7b8b12,2779366496,,(default)世間話,,,,この会話フラグがONなら→,EV_PRO_MR_006_01_01,,,,,,,,,,,,,,,,,,,,,,,,,,,,,,,,,,nid033_ch6_011,"ニャンとフカシギ。
謎の情報屋、ただいま参上…だニャ。","It is I, Fukashigi the Informant,
at your service...","C'est moi, Fukashigi l'informateur !
À ton service...","Fukashigi l'informatore,
al tuo servizio...","Ich bin es, Fukashigi der Informant,
zu deinen Diensten...","Soy yo, Fukashigi el informador,
a tu servicio...","Я, Информатор Фукасиги,
к вашим услугам...","To ja, Informator Fukashigi,
do usług...",,,"Sou eu, Fukashigi, o Informante,
ao seu dispor!","의문의 정보상,
후카시기의 등장이다…냥.","奇妙奇喵妙妙妙。
神秘情報商在此登場……喵。","多喵玄又玄。
神秘情报商来也……喵。",,,,,,,,"إنه أنا المخبر فوكاشيجي،
في <LSNR {خدمتك} {خدمتكِ}>...",,,,,,,,,,,
1419d135-ec16-4fcf-a2b9-9011d2397ed1,3324077668,,,,,,,,,,,,,,,,,,,,,,,,,,,,,,,,,,,,,,,,,nid033_ch6_012,"フム、ではエルガドの
裏情報…「すぺしゃる」のうちの１つを
オヌシに伝えようではニャいか…。","Very well. I'll impawrt to you the second half
of the most special secret of Elgado...","Très bien, il est temps maintenant de
te révéler la seconde partie
du plus sombre secret d'Elgado...","Miaolto bene. Ti svelerò la seconda
metà del segreto speciale di Elgado...","Also gut. Ich verrate dir die zweite Hälfte
des größten Geheimnisses von Elgado...","Muy bien, compartiré contigo el segundo
de los dos secretos más ocultos de Elgado...","Хорошо. Расскажу вторую часть самого
необычного секрета Элгадо...","Kociastycznie. Za chwilę poznasz drugą
połowę największej tajemnicy Elgado...",,,"Bem. Vou contar a segunda miautade
do segredo mais especial de Elgado...","흠, 그럼 엘가도의
스페셜한 비밀 중 하나를
자네에게 알려 주겠다냥…","嗯，那就讓吾告訴你
艾爾卡多的「SPECIAL」秘密情報
其中之1吧喵……","嗯，那老夫就告诉你埃尔迦德的内幕消息……
“特别”情报之一喵……",,,,,,,,"جيد جدًا. <LSNR {سأخبرك} {سأخبركِ}> بالنصف الثاني من
السر الأكثر تميزًا لإلجادو...",,,,,,,,,,,
b4183ded-60fe-4c25-98fb-492c40118c24,1739879917,,,,,,,,,,,,,,,,,,,,,,,,,,,,,,,,,,,,,,,,,nid033_ch6_013,受付嬢チッチェ姫は…。,"Princess Chichae, the Quest Damsel...","Princesse Chichae, la demoiselle
des quêtes...","La principessa Chichae,
la missionatrice...","Prinzessin Chichae, die Quest-Maid...","La princesa Chichae, la gestora de misiones...",У раздатчицы заданий Принцессы Чиче...,"Księżniczka Chichae, panna z zadaniami...",,,"A Princesa Chichae, a Recrutadora...",접수원 치체 공주님은…,接待員琪婕公主她……,接待员琪切公主她……,,,,,,,,الأميرة شيشاي، فتاة المهام...,,,,,,,,,,,
680cac9a-06fe-4681-8a28-2fd0b6dac997,2171730852,,,,,,,,,,,,,,,,,,,,,,,,,,,,,,,,,,,,,,,,,nid033_ch6_014,じつは…。,In fact...,A en fait...,... in realtà...,Tatsächlich...,Nada menos que...,Оказывается...,Tak naprawdę...,,,Na verdade...,사실…,其實……,其实……,,,,,,,,في الحقيقة...,,,,,,,,,,,
