guid,crc?,<PageAttr>,<TalkAttr>,<VillageProgress>,<HallProgress>,<HunterRank>,<TalkTag>,<TalkTagParam>,<TalkTagComment>,<TalkTag>,<TalkTagParam>,<TalkTagComment>,<TalkTag>,<TalkTagParam>,<TalkTagComment>,<TalkTag>,<TalkTagParam>,<TalkTagComment>,<TalkTag>,<TalkTagParam>,<TalkTagComment>,<TalkTag>,<TalkTagParam>,<TalkTagComment>,<TalkTag>,<TalkTagParam>,<TalkTagComment>,<TalkTag>,<TalkTagParam>,<TalkTagComment>,<TalkTag>,<TalkTagParam>,<TalkTagComment>,<TalkAction1>,<TalkAction1Param>,<TalkAction1Comment>,<TalkAction2>,<TalkAction2Param>,<TalkAction2Param2>,<TalkAction2Comment>,entry name,Japanese,English,French,Italian,German,Spanish,Russian,Polish,Dutch,Portuguese,PortugueseBr,Korean,TraditionalChinese,SimplifiedChinese,Finnish,Swedish,Danish,Norwegian,Czech,Hungarian,Slovak,Arabic,Turkish,Bulgarian,Greek,Romanian,Thai,Ukrainian,Vietnamese,Indonesian,Fiction,Hindi,LatinAmericanSpanish
a8ed7cc4-9ccb-4bea-bdfd-b6acf3b27fc3,765737175,会話終了,,,,,,,,,,,,,,,,,,,,,,,,,,,,,,,,,,,,,,,nid025_h3_007,"サボリじゃないニャ。
これは、待機というんだニャ。
ふぁ～あ。","What? No, I'm not being lazy.
It's called ""being on standby,""
OK!? *yawn*","Quoi ? Non, je suis pas fainéant, ça
s'appelle ""être de garde"", OK ?
*bâille*","Cosa? No, non sono pigro. Si chiama
""modalità standby"", OK? Yawn!","Was? Ich bin nicht faul.
Man nennt das ""Bereitschaftsdienst"", okay?!
*gähn*","¿Cómo? No, esto no es pereza. Se llama
""permanecer en modo de bajo consumo"",
¿entiendes? Uaaah...","Что? Нет, я не ленюсь. Это называется
""быть на дежурстве"". Понимаешь?
*зевает*","Co? Nie lenię się.
To się nazywa „być na pauzie”.
Jasne? Zieeew...",,,"O quê? Não, não tô de preguiça.
Nunca ouviu falar em ""ficar de
prontidão""? Uaaah...","놀고 있는 게 아니다냥.
지금은 대기 중인 거다냥.
흐아암~","老夫才不是在偷懶喵，
這叫做待命啊喵。
呼啊～","老夫不是偷懒喵。
这叫做待命喵。
呼～啊。",,,,,,,,"ماذا؟ لا، أنا لست كسولًا.
هذا يُسمَّى ""كونك في وضع الاستعداد""،
اتفقنا!؟ *تثاؤب*",,,,,,,,,,,
d0555e73-ca68-4b90-9c6d-ef01bbf1d451,1556520243,,(default)世間話,,集会所進行☆4,,,,,,,,,,,,,,,,,,,,,,,,,,,,,,,,,,,,nid025_h4_000,"ヒノエの、龍との共鳴は…
ワシにはどうすることもできんかったニャ。",I wasn't able to treat Hinoa...,J'ai pas pu soigner Hinoa...,Non sono riuscito a curare Hinoa...,Ich konnte Hinoa nicht heilen...,No he sido capaz de tratar a Hinoa...,Я не смог вылечить Хиноа...,Nie udało mi się wyleczyć Hinoi.,,,Não consegui tratar a Hinoa...,"히노에가 용과 공명한 건…
나도 낫게 할 수 없었다냥.","火芽與龍發生的共鳴……
老夫什麼忙都幫不上喵。","火芽和龙的共鸣……
老夫无能为力喵。",,,,,,,,لم أتمكن من علاج هينوا...,,,,,,,,,,,
78b5ab04-13d9-4992-8689-baf7210e36d1,713591778,,,,,,,,,,,,,,,,,,,,,,,,,,,,,,,,,,,,,,,,nid025_h4_001,"できたのは、せいぜい気休め程度の薬を
飲ませるくらいだニャ。","All I could do was give her something
to ever so slightly ease the pain.","J'ai juste pu lui donner quelque chose
pour calmer un peu la douleur.","Ho potuto darle soltanto qualcosa per
alleviare il dolore.","Das Einzige, was ich tun konnte, war,
ihr etwas zu geben, das ihre Schmerzen
ein wenig lindert.","Todo lo que he podido hacer ha sido darle
algo para aliviar un poco el dolor.","Я смог лишь немного ослабить
ее боль.",Mogłem tylko złagodzić jej ból.,,,"Eu só pude dar alguns remédios a ela
pra tentar aliviar a dor.","임시 방편으로 원기회복을 돕는 약을
먹이는 게 전부였다냥.","老夫唯一能做的，
也只是開一些幫助不大的藥給她喵。","老夫能做的，
最多是给她开些安慰剂喵。",,,,,,,,"كل ما استطعت فعله هو إعطاؤها
شيئًا لتخفيف الألم قليلًا.",,,,,,,,,,,
e6e21c6a-79b8-405b-bd09-c30dde1fa82f,753311180,,,,,,,,,,,,,,,,,,,,,,,,,,,,,,,,,,,,,,,,nid025_h4_002,"本人は、たいしたことないと
言ってはおるが、そんなことはないニャ。
しんどいはずだニャ。","She says it isn't a big deal, but...
I know better. I can see how
it's eating away at her.","Ce n'est rien de grave d'après elle,
mais... Je la connais. Je vois bien à
quel point ça la ronge.","Ha detto che non sta poi così male, ma... non
sono mica nato ieri. So che sta soffrendo.","Sie sagt, es sei nicht so schlimm, aber...
Ich weiß es besser. Ich sehe, wie sehr
es ihr zusetzt.","Dice que no pasa nada, que está bien, 
pero sé que no es así. Se nota que la
está consumiendo.","Она говорит, ничего страшного, но я-то
вижу. Я вижу, как ее гложет изнутри.","Twierdzi, że to nic takiego, ale...
Ja wiem lepiej. Widzę, jak
ją to zżera.",,,"Ela diz que não é grande coisa, mas...
Ela não me engana. Dá pra ver como
ela tá sofrendo.","본인은 별거 아니라고 하지만
그럴 리가 없다냥.
아주 힘들 거다냥.","雖然她本人說不要緊，
但老夫並不這麼認為喵。
她現在肯定很難受喵。","她自己说没什么大不了的，
但其实问题很大喵。
她应该很难熬喵。",,,,,,,,"تقول إنها ليست مشكلة كبيرة
لكن...أنا أعلم جيدًا. يمكنني أن أرى
كيف يؤثر ذلك عليها.",,,,,,,,,,,
b8ebcb2c-2a77-4511-83a9-c797903dcdc7,3866610013,会話終了,,,,,,,,,,,,,,,,,,,,,,,,,,,,,,,,,,,,,,,nid025_h4_003,"名医名医と言われてはおるが、
どうしようもないことはあるニャ。
まったく、医者なんて非力なもんだニャ…。","Folks call me a good doctor,
and yet in times like these,
I am utterly useless...","Les gens disent que je suis un bon
docteur, mais dans des moments comme
ça, je me sens inutile...","Tutti dicono che sono un bravo medico,
eppure, in casi come questi, mi sento
inutile...","Man nennt mich einen guten Arzt, aber in
Zeiten wie diesen bin ich völlig nutzlos...","La gente me considera un buen médico, pero,
en momentos como este, me siento totalmente
inútil...","Меня называют хорошим доктором, но
в такие времена я ощущаю
себя бесполезным...","Ludzie mówią, że jestem dobrym
lekarzem, ale w takiej sytuacji
jestem do niczego...",,,"O pessoal diz que sou um bom miáudico,
mas, nessas horas, eu me sinto inútil...","명의도
할 수 없는 일이 있는 거다냥.
의사는 정말 무력한 존재다냥…","儘管大家都稱呼老夫為名醫，
但老夫還是有辦不到的事喵。
真是的，醫生其實很無力啊喵……","老夫虽然人称名医，
却也有爱莫能助的时候喵。
唉，医生是多么无能喵……",,,,,,,,"يقول الناس إنني طبيب جيد،
وفي مثل هذه الأوقات، أنا
عديم الفائدة تمامًا...",,,,,,,,,,,
95e55014-8435-45ad-b91b-199540d73371,4133918438,,(default)世間話,,集会所進行☆5,,,,,,,,,,,,,,,,,,,,,,,,,,,,,,,,,,,,nid025_h5_000,"なんじゃ<PL>。
ワシは、考え事をしておるニャ。
邪魔するでないニャ。","What do you want, <PL>?
Quit disturbing me while I'm trying
to think.","Qu'est-ce que tu veux, <PL> ?
Tu pourrais pas arrêter de me déranger ?
J'essaie de réfléchir.","Che c'è, <PL>?
Smettila di disturbarmi mentre sto pensando.","Was willst du, <PL>?
Stör mich nicht beim Nachdenken.","¿Qué quieres, <PL>?
No me molestes cuando intento pensar.","Что тебе надо, <PL>?
Перестань отвлекать меня,
пока я пытаюсь думать.","Czego chcesz, <PL>?
Nie przeszkadzaj mi
w rozmyślaniach.",,,"O que você quer, <PL>?
Pare de me perturbar enquanto
tô tentando pensar.","뭐냥, <PL>.
지금 생각할 게 있다냥.
방해하지 마라냥.","怎麼啦，<PL>？
老夫正在想事情喵，
別來打擾老夫喵。","怎么了，<PL>？
老夫在思考喵。
不要妨碍老夫喵。",,,,,,,,"ماذا <LSNR {تريد} {تريدين}> يا <PL>؟ <LSNR {توقف} {توقفي}>
عن إزعاجي وأنا أحاول
التفكير.",,,,,,,,,,,
f5326110-aff6-4943-9588-d3e7140c5759,1971584386,,,,,,,,,,,,,,,,,,,,,,,,,,,,,,,,,,,,,,,,nid025_h5_001,"なにって、ヒノエの龍との共鳴のことニャ。
今は落ち着いておるようじゃけど、
またいつどうなるかわからんからニャ。","""Think about what?"" About Hinoa and the
serpent, what else? She may be fine now,
but they could very well resonate again.","Qu'est-ce qui me tracasse ? Hinoa et le
serpent, bien sûr. Elle va bien, là,
mais ils pourraient résonner à nouveau.","A cosa sto pensando? A Hinoa e al drago, no?
Ora sta bene, ma potrebbero entrare
di nuovo in risonanza.","Worüber ich nachdenke? Na, über Hinoa und
die Schlange, was sonst? Jetzt geht es ihr
zwar gut, aber das kann sich auch ändern.","¿Sobre qué? Pues sobre Hinoa y el dragón,
¿qué si no? Puede que ahora esté bien,
pero podría volver a resonar.","О чем думать? О Хиноа и змее, о чем же
еще? Пусть сейчас она здорова, но
резонанс может возникнуть снова.","„O czym myślę?” O Hinoi i wężu,
a niby o czym? Polepszyło się jej, ale
one znowu mogą z nią zarezonować.",,,"""Pensar sobre o quê?"" Sobre a Hinoa e a
serpente, ué. Ela tá melhor agora,
mas pode ser que elas voltem a ressoar.","뭐냐니, 히노에의 공명말이다냥.
지금은 멀쩡해 보이지만
나중에 어떻게 될지 모른다냥.","你問什麼事？就是火芽與龍發生共鳴的事喵。
雖然目前騷動已經暫時平息了，
但不曉得以後還會發生什麼事情喵。","思考什么？当然是火芽和龙的共鸣喵。
她现在好像稳定下来了，
但是不知道以后还会怎么样喵。",,,,,,,,"""فيمَ تفكر؟"" بشأن هينوا والأفعى،
ماذا غير ذلك؟ قد تكون بخير الآن، لكن من
المحتمل جدًا أن تُصدر أصوات الصدى مرة أخرى.",,,,,,,,,,,
75b1e504-f17d-4797-8a6d-107f078ba883,2770637177,,,,,,,,,,,,,,,,,,,,,,,,,,,,,,,,,,,,,,,,nid025_h5_002,"今のうちに、少しは対処法を
見出しておきたいニャ。
医者として、当然の心構えニャ。","I have to find some way of countering
it ahead of time. It's the least I can do
as a doctor.","Je dois trouver un moyen d'empêcher ça
avant que ça se reproduise. C'est
le moins que je puisse faire.","Non devo farmi cogliere impreparato la
prossima volta. È il minimo che possa
fare in qualità di dottore.","Wenn die Schlange sich wieder mit ihr
verbinden will, muss ich das rechtzeitig
verhindern. Das ist meine Pflicht als Arzt.","Tengo que encontrar una forma de
contrarrestarlo con antelación. Es lo menos
que puedo hacer como médico.","Мне надо заранее придумать, как с ним
бороться. Я же доктор, это мой долг.","Znalazłem sposób na zapobiegnięcie
temu. Przynajmniej tyle
mogę zrobić jako lekarz.",,,"Preciso descobrir uma maneira de
ao menos evitar isso. É o mínimo que posso
fazer como médico.","지금 미리 대처법을
찾아놔야 한다냥.
의사로서 당연한 거다냥.","老夫想趁這時候
至少先找出解決方法喵。
這是老夫身為醫生該做的事喵。","老夫想趁现在，
稍微找出些方法来喵。
这是身为医生应有的态度喵。",,,,,,,,"يجب أن أجد طريقة ما لمواجهتها
بسرعة. هذا أقل ما يمكنني
فعله كطبيب.",,,,,,,,,,,
1e4eed29-19b0-4edb-98f3-677d6b84089d,480824965,会話終了,,,,,,,,,,,,,,,,,,,,,,,,,,,,,,,,,,,,,,,nid025_h5_003,"うむむ…まずはあの草を煎じて…
あの薬のあの成分を抽出して…
あーしてこーして………………ふぁ～あ。","Let's see, if I grind some of this herb.
Then take an extract from that blend.
Do this, and add a little of that... *yawn*","Voyons voir, cette herbe... Et un
extrait de ça... Et si je rajoute un
peu de ce truc, et peut-être... *bâille*","Vediamo, se trito un po' di quest'erba e
ricavo un estratto... Un po' di questo e
poi aggiungo un po' di quello... Yawn!","Ich muss dieses Kraut zerkleinern... Und
einen Sud herstellen... Und dann noch das,
und ein wenig... *gähn*","A ver, si muelo esta hierba y uso el extracto
de esa mezcla... Hago esto y añado un poco
de esto otro... Ya me está dando sueño...","Посмотрим: если растолочь вот эту
траву... потом сделать вытяжку...
Вот так, и еще чуток этого... *зевает*","Jeśli zmielę trochę tych ziół...
Zrobię wyciąg z tej mieszanki...
Potem to, a potem... Zieeew...",,,"Vejamos... se eu moer um pouco dessa
planta, tirar o extrato daquela mistura,
adicionar uma pitada daquilo... Uaaah...","으음… 우선 그 풀을 달여서…
그 약의 그 성분을 추출한 다음에…
이렇게 하고 저렇게 해서………… 흐아암~","唔……首先要先熬煮那個藥草……
再萃取那個藥裡面的成分……
如此這般如此這般………………呼啊。","嗯……先煎那种草……
提取那道药的那种成分……
这样又那样……呼～啊。",,,,,,,,"لنر، إذا طحنت بعض هذه العشبة.
ثم أخذت مستخلصًا من هذا الخليط.
وبعد ذلك، أضفت القليل من ذلك... *تثاؤب*",,,,,,,,,,,
e1b0fa56-79bb-4266-8a4a-47fd89c2f66c,1044302056,,(default)世間話,,集会所進行☆6,,この会話フラグがOFFなら→,EV_PRO_HALL_006_02_01,,この会話フラグがONなら→,EV_PRO_HALL_006_01_01,,,,,,,,,,,,,,,,,,,,,,,,,,,,,,nid025_h6_000,"なんじゃ<PL>。
ワシは、考え事をしておるニャ。
邪魔するでないニャ。","What do you want, <PL>?
Quit disturbing me while I'm trying
to think.","Qu'est-ce que tu veux, <PL> ?
Tu pourrais pas arrêter de me déranger ?
J'essaie de réfléchir.","Che c'è, <PL>?
Smettila di disturbarmi mentre sto pensando.","Was willst du, <PL>?
Stör mich nicht beim Nachdenken.","¿Qué quieres, <PL>?
No me molestes cuando intento pensar.","Что тебе надо, <PL>?
Перестань отвлекать меня,
пока я пытаюсь думать.","Czego chcesz, <PL>?
Nie przeszkadzaj mi
w rozmyślaniach.",,,"O que você quer, <PL>?
Pare de me perturbar enquanto
tô tentando pensar.","뭐냥, <PL>.
지금 생각할 게 있다냥.
방해하지 마라냥.","怎麼啦，<PL>？
老夫正在想事情喵，
別來打擾老夫喵。","怎么了，<PL>？
老夫在思考喵。
不要妨碍老夫喵。",,,,,,,,"ماذا <LSNR {تريد} {تريدين}> يا <PL>؟ <LSNR {توقف} {توقفي}>
عن إزعاجي وأنا أحاول
التفكير.",,,,,,,,,,,
c2cc18d0-fb9c-4237-b1c4-b87a58062eda,2584646794,,,,,,,,,,,,,,,,,,,,,,,,,,,,,,,,,,,,,,,,nid025_h6_001,"なにって、ヒノエの龍との共鳴のことニャ。
今は落ち着いておるようじゃけど、
またいつどうなるかわからんからニャ。","""Think about what?"" About Hinoa and the
serpent, what else? She may be fine now,
but they could very well resonate again.","Qu'est-ce qui me tracasse ? Hinoa et le
serpent, bien sûr. Elle va bien, là,
mais ils pourraient résonner à nouveau.","A cosa sto pensando? A Hinoa e al drago, no?
Ora sta bene, ma potrebbero entrare
di nuovo in risonanza.","Worüber ich nachdenke? Na, über Hinoa und
die Schlange, was sonst? Jetzt geht es ihr
zwar gut, aber das kann sich auch ändern.","¿Sobre qué? Pues sobre Hinoa y el dragón,
¿qué si no? Puede que ahora esté bien,
pero podría volver a resonar.","О чем думать? О Хиноа и змее, о чем же
еще? Пусть сейчас она здорова, но
резонанс может возникнуть снова.","„O czym myślę?” O Hinoi i wężu,
a niby o czym? Polepszyło się jej, ale
one znowu mogą z nią zarezonować.",,,"""Pensar sobre o quê?"" Sobre a Hinoa e a
serpente, ué. Ela tá melhor agora,
mas pode ser que elas voltem a ressoar.","뭐냐니, 히노에의 공명말이다냥.
지금은 멀쩡해 보이지만
나중에 어떻게 될지 모른다냥.","你問什麼事？就是火芽與龍發生共鳴的事喵。
雖然目前騷動已經暫時平息了，
但不曉得以後還會發生什麼事情喵。","思考什么？当然是火芽和龙的共鸣喵。
她现在好像稳定下来了，
但是不知道以后还会怎么样喵。",,,,,,,,"""فيمَاذا أفكر؟"" بشأن هينوا والأفعى،
ماذا غير ذلك؟ قد تكون بخير الآن، لكن من
المحتمل جدًا أن تُصدر أصوات الصدى مرة أخرى.",,,,,,,,,,,
4b6ba2ae-3248-4e30-8e31-81375f30f542,3566122328,,,,,,,,,,,,,,,,,,,,,,,,,,,,,,,,,,,,,,,,nid025_h6_002,"今のうちに、少しは対処法を
見出しておきたいニャ。
医者として、当然の心構えニャ。","I have to find some way of countering
it ahead of time. It's the least I can do
as a doctor.","Je dois trouver un moyen d'empêcher ça
avant que ça se reproduise. C'est
le moins que je puisse faire.","Non devo farmi cogliere impreparato la
prossima volta. È il minimo che possa
fare in qualità di dottore.","Wenn die Schlange sich wieder mit ihr
verbinden will, muss ich das rechtzeitig
verhindern. Das ist meine Pflicht als Arzt.","Tengo que encontrar una forma de
contrarrestarlo con antelación. Es lo menos
que puedo hacer como médico.","Мне надо заранее придумать, как с ним
бороться. Я же доктор, это мой долг.","Muszę znaleźć sposób, aby zapobiec
temu zawczasu. Przynajmniej tyle
mogę zrobić jako lekarz.",,,"Preciso descobrir uma maneira de
ao menos evitar isso. É o mínimo que posso
fazer como médico.","지금 미리 대처법을
찾아놔야 한다냥.
의사로서 당연한 거다냥.","老夫想趁這時候
至少先找出解決方法喵。
這是老夫身為醫生該做的事喵。","老夫想趁现在，
稍微找出些方法来喵。
这是身为医生应有的态度喵。",,,,,,,,"يجب أن أجد طريقة ما لمواجهتها
بسرعة. هذا أقل ما يمكنني
فعله كطبيب.",,,,,,,,,,,
9d64d076-dbf3-4cd9-b2ce-f47bc4244ab7,4015040105,会話終了,,,,,,,,,,,,,,,,,,,,,,,,,,,,,,,,,,,,,,,nid025_h6_003,"うむむ…まずはあの草を煎じて…
あの薬のあの成分を抽出して…
あーしてこーして………………ふぁ～あ。","Let's see, if I grind some of this herb.
Then take an extract from that blend.
Do this, and add a little of that... *yawn*","Voyons voir, cette herbe... Et un
extrait de ça... Et si je rajoute un
peu de ce truc, et peut-être... *bâille*","Vediamo, se trito un po' di quest'erba e
ricavo un estratto... Un po' di questo e
poi aggiungo un po' di quello... Yawn!","Ich muss dieses Kraut zerkleinern... Und
einen Sud herstellen... Und dann noch das,
und ein wenig... *gähn*","A ver, si muelo esta hierba y uso el extracto
de esa mezcla... Hago esto y añado un poco
de esto otro... Ya me está dando sueño...","Посмотрим: если растолочь вот эту
траву... потом сделать вытяжку...
Вот так, и еще чуток этого... *зевает*","Jeśli zmielę trochę tych ziół...
Zrobię wyciąg z tej mieszanki...
Potem to, a potem... Zieeew...",,,"Vejamos... se eu moer um pouco dessa
planta, tirar o extrato daquela mistura,
adicionar uma pitada daquilo... Uaaah...","으음… 우선 그 풀을 달여서…
그 약의 그 성분을 추출한 다음에…
이렇게 하고 저렇게 해서………… 흐아암~","唔……首先要先熬煮那個藥草……
再萃取那個藥裡面的成分……
如此這般如此這般………………呼啊。","嗯……先煎那种草……
提取那道药的那种成分……
这样又那样……呼～啊。",,,,,,,,"لنر، إذا طحنت هذه العشبة.
واستخرجت مستخلصًا منها.
وبعد ذلك، أضفت القليل من ذلك... *تثاؤب*",,,,,,,,,,,
2a41d8d3-27cb-4c51-a137-c50ac9dff683,2830743298,,(default)世間話,,集会所進行☆6,,このクエストが未クリアなら→,QN010603,,この会話フラグがONなら→,EV_PRO_HALL_006_02_01,,,,,,,,,,,,,,,,,,,,,,,,,,,,,,nid025_h6_004,"<PL>、イブシマキヒコを
倒しに行くんだニャ！？","Wait, <PL>!
Are you really taking on Ibushi!?","Attends, <PL> ! Tu
comptes vraiment t'attaquer à l'Ibushi ?","Ehi, <PL>! Hai davvero
intenzione di affrontare l'Ibushi?","Moment, <PL>!
Kämpfst du wirklich gegen Ibushi?","¡Espera, <PL>!
¿En serio pretendes ir a por Ibushi?","<PL>, подожди!
Ты правда идешь драться с Ибуси?","Zaczekaj, <PL>!
Naprawdę mówisz o Ibushim?!",,,"Espere, <PL>!
Você vai mesmo enfrentar a Ibushi?!","<PL>, 이부시마키히코를
쓰러뜨리러 가는 거냥?!","<PL>，
你要去討伐風神龍啊喵！？","<PL>，
你要去打倒风神龙喵！？",,,,,,,,"<LSNR {انتظر} {انتظري}> يا <PL>! هل <LSNR {أنت حقًا تتحدى} {أنتِ حقًا تتحدين}>
إيبوشي!؟",,,,,,,,,,,
bb552420-461c-49de-aa78-7a11efea8a8c,127479142,,,,,,,,,,,,,,,,,,,,,,,,,,,,,,,,,,,,,,,,nid025_h6_005,"ヒノエの共鳴に関してじゃが…
ワシではせいぜい対症療法が関の山だニャ。","Listen, about Hinoa. Despite my efforts,
the most I can do is ease her pain.","Écoute, concernant Hinoa... Malgré mes
efforts, tout ce que je peux faire,
c'est soulager sa douleur.","Per quanto riguarda Hinoa... Nonostante
i miei sforzi, non posso fare altro che
alleviare il suo dolore.","Was Hinoa betrifft... Alles, was ich tun
kann, ist, ihre Schmerzen zu lindern.","Escucha, con respecto a Hinoa... He hecho lo
que he podido, pero lo único de lo que soy
capaz es de calmar un poco su dolor.","Слушай, насчет Хиноа... Как я ни
стараюсь, а могу лишь облегчить ей боль.","Słuchaj, co do Hinoi...
Pomimo wysiłków...
Mogę tylko złagodzić jej ból.",,,"Olhe, sobre a Hinoa... Apesar dos meus
esforços, tudo que posso fazer é
tentar aliviar a dor dela.","히노에의 공명 말인데…
나는 응급처치가 고작이다냥.","關於火芽發生的共鳴……
老夫唯一能做的就是盡量對症下藥了喵。","在火芽的共鸣问题上……
老夫至多只能做到对症治疗喵。",,,,,,,,"<LSNR {اسمع} {اسمعي}>، بشأن هينوا. برغم جهودي،
أقصى ما يمكنني فعله هو تخفيف ألمها.",,,,,,,,,,,
0156a9ee-7867-499d-84bc-ada84c3b2e8e,2240777922,,,,,,,,,,,,,,,,,,,,,,,,,,,,,,,,,,,,,,,,nid025_h6_006,"お前さんがイブシマキヒコを倒してくれれば
それは、まさに原因療法だニャ！","But if you defeat Ibushi, that would
remedy the affliction!","Mais si tu réussis à vaincre l'Ibushi,
ça devrait la soigner complètement !","Ma se tu sconfiggerai l'Ibushi, il problema
sarà risolto!","Aber wenn du Ibushi besiegen könntest,
wäre das die Heilung!","Pero se puede acabar con su afección de raíz,
lo que hay que hacer es acabar con Ibushi.","Но если ты победишь Ибуси, это
излечит ее полностью!","Jeśli pokonasz Ibushiego,
dolegliwość sama ustąpi!",,,"Mas, se você derrotar a Ibushi, isso
remediaria a angústia dela!","네가 이부시마키히코를 쓰러뜨려준다면
완벽하게 치료될 거다냥!","唯有你前去打倒風神龍，
才是真正能夠治本的方法喵！","如果你能打倒风神龙的话，
就是地地道道的对因治疗了喵！",,,,,,,,"لكن إذا <LSNR {هزمت} {هزمتِ}> إيبوشي،
فمن شأن ذلك معالجة البلاء!",,,,,,,,,,,
29f264d3-fc61-4f3d-b130-693be298c0cf,44886758,会話終了,,,,,,,,,,,,,,,,,,,,,,,,,,,,,,,,,,,,,,,nid025_h6_007,"頼んだニャ。
お前さんにかかっとるニャ！","So it's all up to you now.
We're all counting on you!","Son sort est entre tes pattes.
On compte sur toi !","Quindi siamo nelle tue zampe!
Contiamo tutti su di te!","Du hast es jetzt also in der Hand.
Wir zählen alle auf dich!","Así que está todo en tus manos.
¡Contamos contigo!",Так что теперь вся надежда — на тебя.,"Tak więc wszystko w twoich rękach.
Liczymy na ciebie!",,,"Então tá tudo em suas patas agora.
Estamos contando com você!","부탁한다냥.
네 손에 달렸다냥!","拜託你了喵，
她的命就掌握在你手中了喵！","拜托了喵。
看你的了喵！",,,,,,,,"إذن الأمر كله بين <LSNR {يديك} {يديكِ}>.
كلنا نعتمد <LSNR {عليك} {عليكِ}>!",,,,,,,,,,,
