guid,crc?,<PageAttr>,<TalkAttr>,<VillageProgress>,<HallProgress>,<HunterRank>,<TalkTag>,<TalkTagParam>,<TalkTagComment>,<TalkTag>,<TalkTagParam>,<TalkTagComment>,<TalkTag>,<TalkTagParam>,<TalkTagComment>,<TalkTag>,<TalkTagParam>,<TalkTagComment>,<TalkTag>,<TalkTagParam>,<TalkTagComment>,<TalkTag>,<TalkTagParam>,<TalkTagComment>,<TalkTag>,<TalkTagParam>,<TalkTagComment>,<TalkTag>,<TalkTagParam>,<TalkTagComment>,<TalkTag>,<TalkTagParam>,<TalkTagComment>,<TalkAction1>,<TalkAction1Param>,<TalkAction1Comment>,<TalkAction2>,<TalkAction2Param>,<TalkAction2Param2>,<TalkAction2Comment>,entry name,Japanese,English,French,Italian,German,Spanish,Russian,Polish,Dutch,Portuguese,PortugueseBr,Korean,TraditionalChinese,SimplifiedChinese,Finnish,Swedish,Danish,Norwegian,Czech,Hungarian,Slovak,Arabic,Turkish,Bulgarian,Greek,Romanian,Thai,Ukrainian,Vietnamese,Indonesian,Fiction,Hindi,LatinAmericanSpanish
af0f0725-3f59-40ae-8498-2b7c58587cfd,11966833,会話終了,,,,,,,,,,,,,,,,,,,,,,,,,,,,,,,,,,,,,,,nid025_v5_003,"いや～、お前さんは
実に素晴らしいハンターだニャ…。
ふぁ～あ。","You're one darn good hunter,
you know that?
*yawn*","Tu fais honneur aux chasseurs, crois-moi.
*bâille*","Sei davvero <LSNR {un} {una}> <LSNR {bravo} {brava}> <LSNR {cacciatore} {cacciatrice}>, lo sai?
Yawn!","Du bist <LSNR {ein verdammt guter Jäger} {eine verdammt gute Jägerin}>,
weißt du das? *gähn*","Ya te lo habrán dicho, pero que sepas que
eres <LSNR {un cazador} {una cazadora}> de primera categoría.","Ты чертовски <LSNR {хороший охотник} {хорошая охотница}>,
ты это знаешь?
*зевает*","<LSNR {Dobry} {Dobra}> z ciebie <LSNR {łowca} {łowczyni}>,
wiesz o tym?
Zieeew...",,,"Você é <LSNR {um caçador} {uma caçadora}> e tanto, sabia?
Uaaah...","너는 정말로
대단한 헌터다냥…
흐아암~","哎呀～你真是一位
優秀的獵人啊喵……
呼啊～","哎～
你真是一名出色的猎人喵……
呼～啊。",,,,,,,,"<LSNR {أنت صيّاد جيد} {أنتِ صيّادة جيدة}>،
<LSNR {أتعلم} {أتعلمين}> ذلك؟
*تثاؤب*",,,,,,,,,,,
a6f58579-daeb-4af1-8995-6d30134e54d4,1710826370,,(default)世間話,村進行☆6,,,,,,,,,,,,,,,,,,,,,,,,,,,,,,,,,,,,,nid025_v6_000,"ふぁ～あ…。
<PL>、お前さんはいっつも
よう頑張っとるニャァ…。","*yawn* You're always
hard at work, aren't ya,
<PL>?","*bâille* Tu t'arrêtes jamais, toi,
hein, <PL> ?","Yawn! Hai sempre un gran daffare...
Vero, <PL>?","*gähn* Du bist immer schwer am Arbeiten,
was, <PL>?","Uaaah... Qué sueño... Oye, ¿tú no sabes hacer
otra cosa que no sea trabajar o qué?","*зевает* Все упорно трудишься,
да, <PL>?","Zieeew...
Zawsze tak ciężko pracujesz,
<PL>?",,,"Uaaah... Você sempre capricha no
que faz, não é,
<PL>?","흐아암~…
<PL>, 너도
늘 열심이구냥…","呼啊……
<PL>，
你平時總是非常努力喵……","呼～啊……
<PL>，
你总是拼尽全力喵……",,,,,,,,"*تثاؤب* <LSNR {أنت جاد} {أنتِ جادة}> في العمل
دائمًا، أليس كذلك يا
<PL>؟",,,,,,,,,,,
1039dc63-77c8-44bd-9d3a-ed5c20eaa335,4037182257,,,,,,,,,,,,,,,,,,,,,,,,,,,,,,,,,,,,,,,,nid025_v6_001,"たまには昼寝してもええんじゃぞ。
ほれほれ、今日もいい昼寝日和だニャ…。","Why not take a break sometimes?
It's prime napping weather today.","Tu sais, ça te fera pas de mal de te
détendre de temps en temps. Aujourd'hui,
on a le temps parfait pour une sieste.","Perché non ti prendi una pausa ogni tanto?
Oggi c'è proprio un tempo da sonnellino!","Gönn dir doch mal ein Päuschen. Heute ist
bestes Nickerchenwetter.","¿Por qué no bajas el ritmo de vez en cuando?
Hoy hace un día idóneo para una siesta.","Чего б тебе не отдохнуть?
Сегодня погодка — как раз подремать.","Może zrobisz sobie czasem przerwę?
Dziś jest najlepsza pogoda,
by uciąć sobie drzemkę.",,,"Por que não faz umas pausas de vez
em quando? O clima tá ótimo pra
uma soneca.","가끔은 낮잠이라도 자는 게 어떻겠냥.
자, 오늘도 낮잠 자기 좋은 날이다냥…","偶爾睡個午覺也很不錯喔。
你瞧，今天也是個
適合睡午覺的好日子喵……","偶尔睡个午觉也不错啊。
你看，今天的天气也很适合睡午觉喵……",,,,,,,,"لمَ لا <LSNR {تأخذ} {تأخذين}> استراحة في بعض
الأوقات؟ إنه وقت القيلولة الأساسي اليوم.",,,,,,,,,,,
b4aab6ee-a51f-4b0d-8651-8d6036fda92f,3323248746,会話終了,,,,,,,,,,,,,,,,,,,,,,,,,,,,,,,,,,,,,,,nid025_v6_002,ふぁ～あ。,*yawn*,*bâille*,Yawn!,*gähn*,Uaaah...,*зевает*,Zieeew...,,,Uaaah...,흐아암~,呼啊～,呼～啊。,,,,,,,,*تثاؤب*,,,,,,,,,,,
62c514e0-eb20-4b2b-b203-b348c9f2859e,2891417449,,(default)世間話,,集会所進行☆1,,,,,,,,,,,,,,,,,,,,,,,,,,,,,,,,,,,,nid025_h1_000,"酒はよいニャ。
百薬の長というじゃろ？
適量ならどんな薬よりもいい薬なのニャ。","Alcohol can be the best medicine.
In moderation, of course,
as with many other things.","Un petit verre de temps en temps, ça
guérit plein de trucs. Mais bon, faut pas
en abuser, hein.","L'alcol può essere un'ottima medicina. Va
assunto con moderazione, ovviamente,
come molte altre cose.","Alkohol kann die beste Medizin sein.
In Maßen natürlich, wie bei so vielem.","El alcohol puede ser la mejor medicina.
Con moderación, por supuesto, como pasa
con todo.","Алкоголь может быть лучшим лекарством.
В умеренных дозах, конечно,
как и многое другое.","Alkohol bywa najlepszym lekarstwem.
Tylko z umiarem, jak zresztą wszystko.",,,"O álcool pode ser um grande remédio.
Com moderação, é claro,
assim como tudo na vida.","술은 좋다냥.
만병통치약이다냥.
적당히만 마시면 어떤 약보다도 좋다냥.","酒可是很棒的東西喵。
俗話不是說，酒為百藥之長嗎？
只要適量，它可是比任何藥都還有效呢喵。","酒是好东西喵。
所谓百药之长，对吧？
适量的酒比任何药都有用喵。",,,,,,,,"يمكن أن يكون الكحول أفضل دواء.
باعتدال بالتأكيد، كما هو
الحال مع أشياء أخرى كثيرة.",,,,,,,,,,,
c4c2e680-e70f-4a02-ba16-eb6ff5ca5dcd,3289605642,会話終了,,,,,,,,,,,,,,,,,,,,,,,,,,,,,,,,,,,,,,,nid025_h1_001,"楽しく飲んで、医者いらずニャ。
ヒック。","Enjoy the occasional drink and
you'll never need a docto—*hic*","Avec un petit coup dans l'aile, t'auras
jamais besoin d'un doct... *hic*","Bevi un drink ogni tanto e non avrai mai
bisogno di un medi... Hic!","Gönn dir ab und zu mal ein Gläschen, dann
brauchst du auch keinen Arz-- *hicks*","Disfruta una copichuela de vez en cuando
y jamás necesitarás un médi... ¡Hic!","Не чурайся иногда выпивки, и
тебе не понадобятся докто... *ик*","Napij się czasem, a lekarz nigdy
nie będzie ci potrzeb... Hik!",,,"Beba um pouquinho todo dia e você
nunca vai precisar de um miáudi— hic!","즐겁게 마시면 의사도 필요없다냥.
딸꾹.","一天一杯酒，醫生遠離我喵，
嗝。","饮酒开怀，医生不来喵。
嗝。",,,,,,,,"<LSNR {استمتع} {استمتعي}> بالمشروب الموسمي
ولن <LSNR {تحتاج} {تحتاجي}> إلى طبيب أبدًا—*حازوقة*",,,,,,,,,,,
97a7e925-0a7f-45a7-8c9c-ec9fe94ee9d3,444773809,,(default)世間話,,集会所進行☆2,,,,,,,,,,,,,,,,,,,,,,,,,,,,,,,,,,,,nid025_h2_000,"おお、<PL>。どうだニャ。
ちゃんと食っとるかニャ。
ちゃんと寝とるかニャ。","Ah, <PL>. How goes it?
Eating properly? Sleeping well?","Ah, <PL>. Tout va bien ?
Tu manges correctement ?
Tu penses à bien dormir ?","Ah, <PL>. Come va?
Mangi e dormi bene?","Ah, <PL>. Wie geht's?
Isst du anständig? Schläfst du genug?","Ah, <PL>. ¿Qué tal te encuentras?
¿Estás comiendo adecuadamente?
¿Durmiendo bien?","А, <PL>. Как дела?
Хорошо ли ешь? Хорошо ли спишь?","Ach, <PL>. Jak tam?
Dobrze się odżywiasz? Dużo śpisz?",,,"Ah, <PL>. Como anda?
Comendo direitinho? Dormindo bem?","오오, <PL>. 어떻게 지내냥.
밥은 잘 먹고 다니냥?
잠은 잘 자냥?","喔喔，<PL>。最近好嗎喵？
有按時吃飯嗎喵？
有好好睡覺嗎喵？","哦哦，<PL>。如何喵？
有好好吃饭喵？
有好好睡觉喵？",,,,,,,,"حسنًا، <PL>. كيف تسير الأمور؟
هل <LSNR {تأكل} {تأكلين}> جيدًا؟ هل <LSNR {تنام} {تنامين}> جيدًا؟",,,,,,,,,,,
1dae99b6-545e-4f7b-90fd-886083072b62,430185173,,,,,,,,,,,,,,,,,,,,,,,,,,,,,,,,,,,,,,,,nid025_h2_001,"ちゃんと歯も磨くニャよ。
歯の間も、ちゃーんとキレイにするニャ。","Don't forget to brush your teeth,
now. And make sure you get
those molars too.","Oublie pas de te laver les dents. Et
assure-toi de bien brosser tes molaires.","Non dimenticare di lavarti i denti.
Mi raccomando, in particolare quei molari.","Denk auch dran, dir die Zähne zu putzen.
Und die Backenzähne nicht vergessen.","Recuerda lavarte los dientes todos los días.
Y frota bien por todas partes, sin dejarte ni
las muelas del juicio.","Не забывай чистить зубы.
И клыки тоже захватывай!","Pamiętaj, by myć zęby.
Dokładnie, razem z trzonowcami!",,,"Não se esqueça de escovar os dentes.
Mas tem que escovar direito!","양치질도 잘하고 다녀라냥.
치간도 깔끔하게 관리해야 한다냥.","記得也要乖乖刷牙喔喵，
連牙縫也要徹底地清潔喵。","牙齿也要好好刷喵。
齿缝也要认真刷干净喵。",,,,,,,,"لا <LSNR {تنس} {تسني}> غسل
<LSNR {أسنانك} {أسنانكِ}>، الآن. و<LSNR {تأكد} {تأكدي}>
من الوصول إلى الضروس أيضًا.",,,,,,,,,,,
891308f2-192b-4974-8938-ab97a583563b,3574934162,,,,,,,,,,,,,,,,,,,,,,,,,,,,,,,,,,,,,,,,nid025_h2_002,"痛い痛いと喚いてワシを呼ぶんじゃなくて、
痛くならないためにはどうすればええか、
という相談をしろニャ。","Instead of counting on me to fix you,
ask me what you can do to prevent an
ailment BEFORE it occurs. Understand?","Au lieu de compter sur moi pour te
rafistoler, tu ferais mieux de te demander
comment éviter les problèmes, d'accord ?","Invece di aspettarti che sia io a curarti,
chiedimi PRIMA cosa fare per prevenire
un malanno. Capito?","Verlass dich nicht drauf, dass ich dich schon
richte, wenn was passiert. Frag mich lieber,
wie du ein Leiden VERHINDERN kannst. Klar?","En lugar de contar con que te cure los males,
lo que tienes es que saber cómo prevenirlos.
¿Te ha quedado claro? Espero que sí.","Вместо того, чтобы рассчитывать на
лечение, подумай, как можно
ПРЕДОТВРАТИТЬ болезнь. Понимаешь?","Zamiast liczyć na to, że cię wyleczę,
lepiej zapobiegaj chorobie.
Jasne?",,,"Em vez de me pedir pra te consertar,
me pergunte o que você pode fazer pra
EVITAR essa situação. Entendido?","아프다며 나를 찾지 말고
아프기 전에 어떻게 관리해야 하는지
나한테 물어봐라냥.","別等到哭著喊牙痛才來找老夫，
你該在那之前就先問問老夫
要如何預防牙齒疼痛喵。","不要边喊疼边叫老夫，
还是问问老夫，
怎么才能不疼喵。",,,,,,,,"بدلًا من الاعتماد عليّ <LSNR {لعلاجك} {لعلاجكِ}>،
<LSNR {اسألني} {اسأليني}> عمّا
<LSNR {يمكنك} {يمكنكِ}> فعله لتجنب المرض قبل حدوثه. مفهوم؟",,,,,,,,,,,
126eef64-ff4e-438d-b424-eef29da9cdee,2594585249,,,,,,,,,,,,,,,,,,,,,,,,,,,,,,,,,,,,,,,,nid025_h2_003,"本当の名医っちゅーのは、
病人を瞬く間に治す医者のことではなく、
病人を出さない医者のことを言うニャよ。","The best physicians aren't those who'll
miraculously cure patients, but those
who'll keep people from falling sick.","Les meilleurs docteurs sont pas ceux qui
guérissent leurs patients, mais ceux
qui les empêchent de tomber malades.","I migliori medici non sono quelli che
curano miracolosamente i loro pazienti,
ma quelli che li aiutano a non ammalarsi.","Die besten Ärzte sind nicht die, die ihre
Patienten heilen, sondern die, die Leute
gar nicht erst krank werden lassen!","Los mejores médicos no son aquellos que
curan milagrosamente a sus pacientes,
sino los que evitan que caigan enfermos.","Лучшие врачи — не те, что волшебным
образом исцеляют пациентов, а те,
которые не дают заболеть.","Najlepsi lekarze to nie ci, którzy
leczą pacjentów, tylko ci,
którzy zapobiegają chorobom.",,,"Os melhores médicos não são aqueles que
curam milagrosamente, mas aqueles que
previnem as pessoas contra as doenças.","진정한 명의란 병을 순식간에
고치는 의사가 아니라 더는 아픈 사람이
없도록 하는 의사를 말하는 거다냥.","真正的名醫指的並不是
能馬上治好病人的醫生，
而是能避免病人出現的醫生啊喵。","真正的名医，
不是抬抬手就能治好病人的医生，
而是指让人不生病的医生喵。",,,,,,,,"ليس أفضل الأطباء هم أولئك الذين
يعالجون المرضى بإعجاز. بل أولئك الذين
يمنعون الناس من الإصابة بالمرض.",,,,,,,,,,,
122f2a54-24c7-4a85-a983-acaf28edc81e,3350987696,会話終了,,,,,,,,,,,,,,,,,,,,,,,,,,,,,,,,,,,,,,,nid025_h2_004,"以上、名医ゼンチのありがたいお話ニャ。
は～、今日もよう働いたニャ。
ふぁ～あ。","And that concludes Doctor Zenchi's
medical advice of the day. Looks like
my work is done until tomorrow. *yawn*","Et ce sera tout pour les conseils du
jour de docteur Zenchi. Bon, j'ai fini
ma journée. À demain. *bâille*","E questo conclude la rubrica quotidiana
dei consigli del Dottor Zenchi. Fino a
domani sono a posto. Yawn!","Das war Doktor Zenchis medizinischer
Top-Tipp des Tages. Sieht aus, als wäre
meine Arbeit für heute damit getan. *gähn*","Y hasta aquí la lección de medicina
preventiva del doctor Zenchi. Parece que
mi trabajo ha concluido por hoy. Uaaah...","И на этом советы Доктора Дзэнти на
сегодня закончены. Похоже, что
до завтра я свободен. *зевает*","To była zdrowotna porada doktora
Zenchiego na dziś. Zatem do jutra,
mam wolne. Zieeew...",,,"E esse foi o conselho médico do dia
do Doutor Zenchi. Agora já chega de
trabalho por hoje. Uaaah...","이상, 명의 젠치의 명언이었다냥.
아~ 오늘도 열심히 일했다냥.
흐아암~","這些就是本名醫善地的寶貴建議喵，
呼～今天又辛苦地工作了一天喵。
呼啊～","名医善岐黄的金玉良言讲完了喵。
哎～老夫今天也勤劳工作了喵。
呼～啊。",,,,,,,,"وهذا يُلخّص نصيحة الدكتور زينشي
الطبية لليوم. يبدو أن عملي انتهى
حتى الغد. *تثاؤب*",,,,,,,,,,,
e5f87420-a93e-4220-bc0c-725f7939755c,3258605370,,(default)世間話,,集会所進行☆3,,この会話フラグがOFFなら→,EV_PRO_HALL_003_99_01,,,,,,,,,,,,,,,,,,,,,,,,,,,,,,,,,nid025_h3_000,"おお、<PL>。どうだニャ。
ちゃんと食っとるかニャ。
ちゃんと寝とるかニャ。","Ah, <PL>. How goes it?
Eating properly? Sleeping well?","Ah, <PL>. Tout va bien ?
Tu manges correctement ?
Tu penses à bien dormir ?","Ah, <PL>. Come va?
Mangi e dormi bene?","Ah, <PL>. Wie geht's?
Isst du anständig? Schläfst du genug?","Ah, <PL>. ¿Qué tal te encuentras?
¿Estás comiendo adecuadamente?
¿Durmiendo bien?","А, <PL>. Как дела?
Хорошо ли ешь? Хорошо ли спишь?","Ach, <PL>. Jak tam?
Dobrze się odżywiasz? Dużo śpisz?",,,"Ah, <PL>. Como anda?
Comendo direitinho? Dormindo bem?","오오, <PL>. 어떻게 지내냥.
밥은 잘 먹고 다니냥?
잠은 잘 자냥?","喔喔，<PL>。最近好嗎喵？
有按時吃飯嗎喵？
有好好睡覺嗎喵？","哦哦，<PL>。如何喵？
有好好吃饭喵？
有好好睡觉喵？",,,,,,,,"حسنًا، <PL>. كيف تسير الأمور؟
هل <LSNR {تأكل} {تأكلين}> جيدًا؟ هل <LSNR {تنام} {تنامين}> جيدًا؟",,,,,,,,,,,
ac8d1931-6d21-43e0-8677-df32947a6908,2978029727,,,,,,,,,,,,,,,,,,,,,,,,,,,,,,,,,,,,,,,,nid025_h3_001,"ちゃんと歯も磨くニャよ。
歯の間も、ちゃーんとキレイにするニャ。","Don't forget to brush your teeth,
now. And make sure you get
those molars too.","Oublie pas de te laver les dents. Et
assure-toi de bien brosser tes molaires.","Non dimenticare di lavarti i denti.
Mi raccomando, in particolare quei molari.","Denk auch dran, dir die Zähne zu putzen.
Und die Backenzähne nicht vergessen.","Recuerda lavarte los dientes todos los días.
Y frota bien por todas partes, sin dejarte ni
las muelas del juicio.","Не забывай чистить зубы.
И клыки тоже захватывай!","Pamiętaj, by myć zęby.
Dokładnie, razem z trzonowcami!",,,"Não se esqueça de escovar os dentes.
Mas tem que escovar direito!","양치질도 잘하고 다녀라냥.
치간도 깔끔하게 관리해야 한다냥.","記得也要乖乖刷牙喔喵，
連牙縫也要徹底地清潔喵。","牙齿也要好好刷喵。
齿缝也要认真刷干净喵。",,,,,,,,"لا <LSNR {تنس} {تسني}> غسل
<LSNR {أسنانك} {أسنانكِ}>، الآن. و<LSNR {تأكد} {تأكدي}>
من الوصول إلى الضروس أيضًا.",,,,,,,,,,,
083772e3-c351-4afc-86d4-783bcc319699,1278778382,,,,,,,,,,,,,,,,,,,,,,,,,,,,,,,,,,,,,,,,nid025_h3_002,"痛い痛いと喚いてワシを呼ぶんじゃなくて、
痛くならないためにはどうすればええか、
という相談をしろニャ。","Instead of counting on me to fix you,
ask me what you can do to prevent an
ailment BEFORE it occurs. Understand?","Au lieu de compter sur moi pour te
rafistoler, tu ferais mieux de te demander
comment éviter les problèmes, d'accord ?","Invece di aspettarti che sia io a curarti,
chiedimi PRIMA cosa fare per prevenire
un malanno. Capito?","Verlass dich nicht drauf, dass ich dich schon
richte, wenn was passiert. Frag mich lieber,
wie du ein Leiden VERHINDERN kannst. Klar?","En lugar de contar con que te cure los males,
lo que tienes es que saber cómo prevenirlos.
¿Te ha quedado claro? Espero que sí.","Вместо того, чтобы рассчитывать на
лечение, подумай, как можно
ПРЕДОТВРАТИТЬ болезнь. Понимаешь?","Zamiast liczyć na to, że cię wyleczę,
lepiej zapobiegaj chorobie.
Jasne?",,,"Em vez de me pedir pra te consertar,
me pergunte o que você pode fazer pra
EVITAR essa situação. Entendido?","아프다며 나를 찾지 말고
아프기 전에 어떻게 관리해야 하는지
나한테 물어봐라냥.","別等到哭著喊牙痛才來找老夫，
你該在那之前就先問問老夫
要如何預防牙齒疼痛喵。","不要边喊疼边叫老夫，
还是问问老夫，
怎么才能不疼喵。",,,,,,,,"بدلًا من الاعتماد عليّ <LSNR {لعلاجك} {لعلاجكِ}>،
<LSNR {اسألني} {اسأليني}> عمّا
<LSNR {يمكنك} {يمكنكِ}> فعله لتجنب المرض قبل حدوثه. مفهوم؟",,,,,,,,,,,
b787553f-b1da-41fa-9d1c-edca24e07ba6,3607639665,,,,,,,,,,,,,,,,,,,,,,,,,,,,,,,,,,,,,,,,nid025_h3_003,"本当の名医っちゅーのは、
病人を瞬く間に治す医者のことではなく、
病人を出さない医者のことを言うニャよ。","The best physicians aren't those who'll
miraculously cure patients, but those
who'll keep people from falling sick.","Les meilleurs docteurs sont pas ceux qui
guérissent leurs patients, mais ceux
qui les empêchent de tomber malades.","I migliori medici non sono quelli che
curano miracolosamente i loro pazienti,
ma quelli che li aiutano a non ammalarsi.","Die besten Ärzte sind nicht die, die ihre
Patienten heilen, sondern die, die Leute
gar nicht erst krank werden lassen!","Los mejores médicos no son aquellos que
curan milagrosamente a sus pacientes,
sino los que evitan que caigan enfermos.","Лучшие врачи — не те, что волшебным
образом исцеляют пациентов, а те,
которые не дают заболеть.","Najlepsi lekarze to nie ci, którzy
leczą pacjentów, tylko ci,
którzy zapobiegają chorobom.",,,"Os melhores médicos não são aqueles que
curam milagrosamente, mas aqueles que
previnem as pessoas contra as doenças.","진정한 명의란 병을 순식간에
고치는 의사가 아니라 더는 아픈 사람이
없도록 하는 의사를 말하는 거다냥.","真正的名醫指的並不是
能馬上治好病人的醫生，
而是能避免病人出現的醫生啊喵。","真正的名医，
不是抬抬手就能治好病人的医生，
而是指让人不生病的医生喵。",,,,,,,,"ليس أفضل الأطباء هم أولئك الذين
يعالجون المرضى بإعجاز. بل أولئك الذين
يمنعون الناس من الإصابة بالمرض.",,,,,,,,,,,
256412e0-9b15-4dd9-8026-31dc91983453,2458461873,会話終了,,,,,,,,,,,,,,,,,,,,,,,,,,,,,,,,,,,,,,,nid025_h3_004,"以上、名医ゼンチのありがたいお話ニャ。
は～、今日もよう働いたニャ。
ふぁ～あ。","And that concludes Doctor Zenchi's
medical advice of the day. Looks like
my work is done until tomorrow. *yawn*","Et ce sera tout pour les conseils du
jour de docteur Zenchi. Bon, j'ai fini
ma journée. À demain. *bâille*","E questo conclude la rubrica quotidiana
dei consigli del Dottor Zenchi. Fino a
domani sono a posto. Yawn!","Das war Doktor Zenchis medizinischer
Top-Tipp des Tages. Sieht aus, als wäre
meine Arbeit für heute damit getan. *gähn*","Y hasta aquí la lección de medicina
preventiva del doctor Zenchi. Parece que
mi trabajo ha concluido por hoy. Uaaah...","И на этом советы Доктора Дзэнти на
сегодня закончены. Похоже, что
до завтра я свободен. *зевает*","To była zdrowotna porada doktora
Zenchiego na dziś. Zatem do jutra,
mam wolne. Zieeew...",,,"E esse foi o conselho médico do dia
do Doutor Zenchi. Agora já chega de
trabalho por hoje. Uaaah...","이상 명의 젠치의 명언이었다냥.
아~ 오늘도 열심히 일했다냥.
흐아암~","這些就是本名醫善地的寶貴建議喵，
呼～今天又辛苦地工作了一天喵。
呼啊～","名医善岐黄的金玉良言讲完了喵。
哎～老夫今天也勤劳工作了喵。
呼～啊。",,,,,,,,"وهذا يُلخّص نصيحة الدكتور زينشي
الطبية لليوم. يبدو أن عملي انتهى
حتى الغد. *تثاؤب*",,,,,,,,,,,
bacaae7a-781e-4910-9ce2-8ec3b7a5b00f,2993133084,,(default)世間話,,集会所進行☆3,,このクエストが未クリアなら→,QN010403,,この会話フラグがONなら→,EV_PRO_HALL_003_99_01,,,,,,,,,,,,,,,,,,,,,,,,,,,,,,nid025_h3_005,"なんじゃ<PL>。
でっかい百竜夜行が来るニャ？","What is it, <PL>? A large
Rampage horde approaches, you say?","Que se passe-t-il, <PL> ?
Il y a une énorme horde de la Calamité
en approche ?","Che c'è, <PL>?
La furia si sta avvicinando?","Was gibt's, <PL>?
Eine große Randale-Horde ist im Anmarsch,
sagst du?","¿Cómo dices, <PL>?
¿Que se acerca una gran horda del Frenesí?","Что такое, <PL>?
Говоришь, на подходе орда Буйства?","Co się dzieje, <PL>?
Mówisz, że zbliża się horda Furii...?",,,"O que foi, <PL>?
Uma horda enorme do Frenesi tá vindo?","뭐냥, <PL>.
큰 백룡야행이 온다고냥?","怎麼啦，<PL>？
有大規模的百龍夜行要來了喵？","怎么了，<PL>？
要来一场大规模百龙夜行喵？",,,,,,,,"ما هذا يا <PL>؟ يقترب حشد كبير من
الغضب العارم، كما <LSNR {تقول} {تقولين}>؟",,,,,,,,,,,
bf2a1aaf-d4da-4824-8039-9bdf11e9e8d9,3008394427,,,,,,,,,,,,,,,,,,,,,,,,,,,,,,,,,,,,,,,,nid025_h3_006,"心配せんでも、なんかあったら
いつでも呼ぶといいニャ。
ケガでも病気でも、すぐに治してやるニャ。","Well, not to worry; I can treat
any and all injuries. Just call
for me if I'm need—","T'as pas à t'inquiéter, je peux soigner
n'importe quelle blessure. T'as juste
à me demander en cas de besoin...","Non preoccuparti, io so curare qualsiasi
tipo di ferita. Chiamami se hai bisogno.","Ach, keine Bange. Es gibt keine Wunde, die
ich nicht heilen kann. Ruf mich einfach,
wenn ich gebraucht werd--","Bueno, no es momento de asustarse.
Yo me quedaré aquí, y si me necesitáis para
que os cure alguna herida, me avisas, ¿vale?","Не беспокойся. Я могу лечить
любые раны. Если буду нужен —
зови.","Cóż, bez obaw. Wyleczę wszystkie rany.
Zawołaj mnie w razie potrz...",,,"Bom, não se preocupe. Eu cuido de todo e
qualquer ferimento. É só me
chamar se preci...","무슨 일이 생기면 언제든 불러도 된다냥.
걱정할 거 없다냥.
병이든 상처든 금방 고쳐주겠다냥.","不必擔心，要是發生什麼事，
隨時可以來找老夫喵。不管是受傷
還是生病，老夫都能馬上治好喵。","不用担心，有什么事可以随时叫老夫喵。
不管是受伤还是生病，
老夫都当场为你治好喵。",,,,,,,,"حسنًا، لا داعي للقلق؛ يمكنني
علاج جميع الإصابات. <LSNR {اتصل} {اتصلي}>
بي فحسب إذا <LSNR {احتجت} {احتجتِ}> إلى—",,,,,,,,,,,
