guid,crc?,<PageAttr>,<TalkAttr>,<VillageProgress>,<HallProgress>,<HunterRank>,<TalkTag>,<TalkTagParam>,<TalkTagComment>,<TalkTag>,<TalkTagParam>,<TalkTagComment>,<TalkTag>,<TalkTagParam>,<TalkTagComment>,<TalkTag>,<TalkTagParam>,<TalkTagComment>,<TalkTag>,<TalkTagParam>,<TalkTagComment>,<TalkTag>,<TalkTagParam>,<TalkTagComment>,<TalkTag>,<TalkTagParam>,<TalkTagComment>,<TalkTag>,<TalkTagParam>,<TalkTagComment>,<TalkTag>,<TalkTagParam>,<TalkTagComment>,<TalkAction1>,<TalkAction1Param>,<TalkAction1Comment>,<TalkAction2>,<TalkAction2Param>,<TalkAction2Param2>,<TalkAction2Comment>,<KohakuProgress>,entry name,Japanese,English,French,Italian,German,Spanish,Russian,Polish,Dutch,Portuguese,PortugueseBr,Korean,TraditionalChinese,SimplifiedChinese,Finnish,Swedish,Danish,Norwegian,Czech,Hungarian,Slovak,Arabic,Turkish,Bulgarian,Greek,Romanian,Thai,Ukrainian,Vietnamese,Indonesian,Fiction,Hindi,LatinAmericanSpanish
14caa38a-9fbf-40f1-996c-65b5507635c5,3392640810,,,,,,,,,,,,,,,,,,,,,,,,,,,,,,,,,,,,,,,,,nid008_base2_001,"どうして知ってるかってニャ？
ニャッニャッニャッ、郵便屋さんの
情報網をなめちゃいかんぞニャ。","How do I know this? Meow, meow, meow!
Don't underestimate the Courier's infurmation
network.","Comment je sais ça ?
J'ai un bon réseau d'information,
en tant que messager, chat c'est sûr.","Come lo so? Per tutti i Felyne, non
sottovalutare la rete di informatori
di noi corrieri.","Wie ich das weiß? Miau, miau, miau!
Unterschätze nicht das Informations-
netzwerk der Kuriere.","¿Que cómo lo sé? ¡Miau, miau, miau!
Nunca subestimes a un mensajero
Felyne y a su red de contactos.","Откуда я это знаю? Мяу, мяу, мяу!
Не стоит недооценивать
сеть информаторов Курьера.","Skąd to wiem? Miau, miau, miau!
Nie lekceważ sieci infor-miau-cyjnej
kuriera.",,,"Como eu sei disso? Miau, miau, miau!
Não subestime a rede de informações
do Mensageiro.","어떻게 아냐고냥?
냥냥냥, 우체부의 정보망을
얕보지 마라냥.","你問我為什麼知道這種事喵？
喵哈哈，可別小看郵差的情報網喵。","你问俺怎么知道喵？
喵喵喵，别小瞧了信使搜集信息的手段喵。",,,,,,,,"كيف لى أن أعرف ذلك؟ مياو، مياو، مياو!
لا <LSNR {تقلل} {تقللي}> من شأن شبكة معلومات
الساعي.",,,,,,,,,,,
c9bdebd1-f296-40cc-8df1-45a9d979d5db,829012940,,,,,,,,,,,,,,,,,,,,,,,,,,,,,,,,,,,,,,,,,nid008_base2_002,"全部伝わっとるぞニャ。
なんなら、オヌシが狩りの前に食べた
うさ団子の本数まで知っとるぞニャ。","I know everything. I know how many
Bunny Dango you ate before your hunt.
How much dung you keep in your item—","Je sais tout. Je sais combien de dango
lapins tu as mangés avant la chasse.
La quantité de bouse que tu as dans...","Io so tutto. So quanti dango hai mangiato
prima della caccia, quanto letame nascondi
nella cassa og...","Ich weiß alles. Ich weiß, wie viele
Dango du vor der Jagd gegessen hast.
Wie viel Dung du in deinem...","No se me escapa nada. Sé los dango
que te has zampado antes de ir a cazar,
la de baratijas que llevas enci...","Я все знаю. Знаю, сколько данго попали
к тебе в желудок перед охотой.
Сколько навоза ты носишь в своей—","Wiem wszystko. Wiem ile dango zjadasz
przed polowaniem. Wiem ile gnoju
trzymasz w swoim inwentarzu...",,,"Eu sei de tudo. Eu sei quantos dangos
de coelho você comeu antes da caçada,
quanto esterco tem no seu inventário—","다 건너건너 듣는다냥.
자네가 사냥 전에 토끼 경단을
몇 개 먹었는지까지 알고 있다냥.","一切的消息全都傳到我耳裡了喵。
就連你在戰鬥前吃了多少兔兔糰子
我也一清二楚喵。","全都传到俺这里了喵。俺连你狩猎前
吃了几串兔团子都知道喵。",,,,,,,,"أنا أعرف كل شيء. أعرف كل ما أكلته
من دانجو الأرانب قبل الانطلاق للصيد.
مقدار السماد الذي <LSNR {تحتفظ} {تحتفظين}> به في العنصر الخاص <LSNR {بك} {بكِ}>...",,,,,,,,,,,
47f43c39-d559-42ab-aadd-2109708a2066,2604128685,会話終了,,,,,,,,,,,,,,,,,,,,,,,,,,,,,,,,,,,,,,,,nid008_base2_003,"郵便屋さんはなんでもお見通しニャ。
悪いことはできないぞニャ。","*ahem* Anyway, it's a Courier's duty
to always stay in-the-know! All part
of our fur-st class service!","Bref, le messager se doit d'être
au courant de tout !
Ça fait partie de notre travail !","Ehm, volevo dire, è compito di ogni bravo
corriere essere sempre ben informato.
Fa parte dei nostri servizi di prim'ordine.","*ähm* Nun ja, es ist die Pflicht eines
Kuriers, stets alles zu wissen!
Gehört alles zu unserem 1A-Service!","Ejem, a lo que iba... ¡Es la obligación
de todo mensajero Felyne mantenerse
al día! ¡Es primordial en mi trabajo!","*гм* Короче, Курьер всегда должен быть
в курсе всех событий! Это залог
нашего первоклассного обслуживания!","Ahem... Obo-miau-zkiem kuriera jest się
we wszystkim orientować. To jeden z
aspektów naszej pierwszej klasy usługi!",,,"Caham! Enfim, é dever do Mensageiro
estar sempre informado! Faz parte do
nosso serviço de primeira classe!","우체부는 뭐든 다 안다냥.
나쁜 짓은 못할 거다냥.","郵差可是把所有事情都看在眼裡喵。
你可不能做壞事喵。",什么都瞒不过信使喵。不能做坏事喵。,,,,,,,,"*احم* على أي حال، من واجب الساعي
البقاء دائمًا على اطلاع! خدمتنا
بالكامل من الدرجة الأولى!",,,,,,,,,,,
492bb9db-75b3-40ef-8055-dd66475f2227,3433922309,,(default)世間話,-,,,この会話フラグがONなら→,EV_PRO_MR_003_01_01,,この会話フラグがOFFなら→,EV_PRO_MR_004_01_01,,,,,,,,,,,,,,,,,,,,,,,,,,,,,,,nid008_base3_000,"百竜夜行のせいでしばらくヒマだったけど
最近少しずつ、郵便屋の仕事も
増えてきたニャ。","Meowllo there, <PL>. Not much
going on since the Rampage, but recently
things have been picking up little by little.","Chalut, <PL>. Depuis
la Calamité, c'était assez calme,
mais les choses commencent à bouger.","Miao, <PL>. Dopo la furia
non c'è molto da fare, ma ultimamente
le cose hanno iniziato a rimettersi in moto.","Miaulöle, <PL>. Seit der Randale
ist nicht viel los, aber in letzter Zeit
kommt langsam Fahrt auf.","Miau buenas, <PL>.
No teníamos mucho ajetreo desde lo del
Frenesí, pero vuelve a animarse la cosa.","Мяувет, <PL>. После Буйства все по-старому,
но жизнь потихоньку
возвращается в старое русло.","Moje mrrr-ukłony, <PL>! Niewiele
się tu dzieje od czasu Furii, ale ostatnio
znów wszystko zaczęło powoli się rozkręcać.",,,"Miaulá, <PL>. Sem muitas
novidades desde o Frenesi, mas as coisas
vêm melhorando pouco a pouco.","백룡야행 때문에 조금 한가했는데
요즘은 조금씩 우체부 일도
늘어나기 시작했다냥.","雖然先前因為百龍夜行的關係
讓我暫時比較有空，
不過這陣子郵差的工作越來越多了喵。","俺因为百龙夜行而闲了一阵子，
但最近信使的活儿也慢慢多起来了喵。",,,,,,,,"مرحبًا يا <PL>. لم يحدث الكثير
منذ مهمة الغضب العارم، ولكن بدأت الأمور بالانتعاش
شيئًا فشيئًا في الآونة الأخيرة.",,,,,,,,,,,
1626d228-fdf3-4212-beb5-85baab4b8aac,4126856946,,,,,,,,,,,,,,,,,,,,,,,,,,,,,,,,,,,,,,,,,nid008_base3_001,"これも<PL>のおかげぞニャ。
ありがたいニャ。","Couriers aren't really good at sitting
around twiddling their paws, so it feels
good to be busy again!","Attendre et se tourner les pattes, c'est
pas vraiment le fort des messagers,
alors je suis content d'avoir à faire !","Ai corrieri non piace stare con le
zampe in zampa, perciò è bello
tornare ad essere indaffarati.","Kuriere sitzen nicht gern untätig rum
und drehen Pfötchen, daher ist es toll,
wieder viel zu tun zu haben!","A los mensajeros Felyne no se nos da
nada bien quedarnos de patas cruzadas.
¡Me alegro de tener algo que hacer!","Курьеры не привыкли сидеть
сложа лапы, так что
много работы — это хорошо!","Kurierzy nie są zbyt dobrzy w nicnierobieniu
i graniu w łapki, więc miło jest znowu
mieć zajęcie!",,,"Os mensageiros não são muito bons em
ficar de patas cruzadas, à toa, por isso
é bom estar ocupado de novo!","이것도 <PL> 덕분이다냥.
고맙다냥.","這一切都是託<PL>的福喵。
我很感激喵。","<PL>，这也多亏了你喵。
感激不尽喵。",,,,,,,,"السعاة ليسوا جيدين حقًّا في الجلوس
باسترخاء والعبث بكفوفهم، لذلك من الجيد أن
<LSNR {تكون مشغولاً} {تكوني مشغولة}> مرة أخرى!",,,,,,,,,,,
9fc0246b-a586-4744-88a1-8b4273259fff,559890737,会話終了,,,,,,,,,,,,,,,,,,,,,,,,,,,,,,,,,,,,,,,,nid008_base3_002,"「オンライン」「オフライン」の仕事も
大事だけど、やっぱりオイラは郵便屋の
仕事が好きだニャ。郵便屋だからニャ。","This ""Offline, Online"" job Elder Fugen
gave me is great and all, but honestly
I pre-fur my Courier work...","J'aime bien le boulot En ligne/Hors ligne
que Fugen l'Ancien m'a donné, mais
je préfère mon travail de messager.","Fugen l'anziano mi ha incaricato di gestire
le miaodalità offline e online. Non mi
lamento, ma preferisco fare il corriere.","Dieser ""offline, online""-Job von Ältester
Fogen ist ja schön und gut, aber ich
bevorzuge meine Kurier-Arbeit...","La misión esta de Fugen el anciano
de comprobar conexiones no está mal,
pero me gustaba más ser mensajero...","Мне нравится задание ""офлайн-онлайн"",
которое дал мне Старейшина Фугэн, но
мне больше по душе работать Курьером...","To miau-danie „Offline, Online”, które
zlecił mi Starszy Fugen, jest super,
ale serio wolę moją pracę kuriera.",,,"Este trabalho ""offline, online"" que o
ancião Fugen me deu é ótimo e tal, mas
ainda prefiro o trabalho de Mensageiro...","「온라인」, 「오프라인」 변경 일도
중요하지만, 역시 난 우체부
일이 좋다냥. 우체부니까 당연하다냥.","雖然切換「線上」、「離線」的工作
也很重要，但我還是喜歡郵差的工作喵。
畢竟我是個郵差嘛喵。","“在线”和“离线”的工作虽然重要，但俺
还是喜欢信使的工作喵。因为俺是信使喵。",,,,,,,,"وظيفة ""الاتصال وعدم الاتصال"" التي منحها لي الزعيم فيوجين
رائعة وكل شيء، لكنني بصراحة
أفضل عمل الساعي...",,,,,,,,,,,
d59bccd5-23eb-4b55-ab23-a6edf252eb72,199400583,会話終了,,,,,,,,,,,,,,,,,,,,,,,,,,,,,,,,,,,,,,,,nid008_base3_003,<COLOR FF0000>#Rejected#</COLOR> nid008_base3_003,<COLOR FF0000>#Rejected#</COLOR> nid008_base3_003,<COLOR FF0000>#Rejected#</COLOR> nid008_base3_003,<COLOR FF0000>#Rejected#</COLOR> nid008_base3_003,<COLOR FF0000>#Rejected#</COLOR> nid008_base3_003,<COLOR FF0000>#Rejected#</COLOR> nid008_base3_003,<COLOR FF0000>#Rejected#</COLOR> nid008_base3_003,<COLOR FF0000>#Rejected#</COLOR> nid008_base3_003,<COLOR FF0000>#Rejected#</COLOR> nid008_base3_003,<COLOR FF0000>#Rejected#</COLOR> nid008_base3_003,<COLOR FF0000>#Rejected#</COLOR> nid008_base3_003,<COLOR FF0000>#Rejected#</COLOR> nid008_base3_003,<COLOR FF0000>#Rejected#</COLOR> nid008_base3_003,<COLOR FF0000>#Rejected#</COLOR> nid008_base3_003,<COLOR FF0000>#Rejected#</COLOR> nid008_base3_003,<COLOR FF0000>#Rejected#</COLOR> nid008_base3_003,<COLOR FF0000>#Rejected#</COLOR> nid008_base3_003,<COLOR FF0000>#Rejected#</COLOR> nid008_base3_003,<COLOR FF0000>#Rejected#</COLOR> nid008_base3_003,<COLOR FF0000>#Rejected#</COLOR> nid008_base3_003,<COLOR FF0000>#Rejected#</COLOR> nid008_base3_003,<COLOR FF0000>#Rejected#</COLOR> nid008_base3_003,<COLOR FF0000>#Rejected#</COLOR> nid008_base3_003,<COLOR FF0000>#Rejected#</COLOR> nid008_base3_003,<COLOR FF0000>#Rejected#</COLOR> nid008_base3_003,<COLOR FF0000>#Rejected#</COLOR> nid008_base3_003,<COLOR FF0000>#Rejected#</COLOR> nid008_base3_003,<COLOR FF0000>#Rejected#</COLOR> nid008_base3_003,<COLOR FF0000>#Rejected#</COLOR> nid008_base3_003,<COLOR FF0000>#Rejected#</COLOR> nid008_base3_003,<COLOR FF0000>#Rejected#</COLOR> nid008_base3_003,<COLOR FF0000>#Rejected#</COLOR> nid008_base3_003,<COLOR FF0000>#Rejected#</COLOR> nid008_base3_003
1fe6816a-5b78-4c9d-a97f-5da620c181c3,2989913988,,(default)世間話,-,,,この会話フラグがONなら→,EV_PRO_MR_004_01_01,,この会話フラグがOFFなら→,EV_PRO_MR_005_01_01,,,,,,,,,,,,,,,,,,,,,,,,,,,,,,,nid008_base4_000,"おう、<PL>！
向こうでの狩りもなかなか正念場だと
聞いておるぞニャ。","Meowllo there, <PL>!
I heard you've been hunting some seriously
fur-ocious meownsters!","Chalut, <PL> !
Alors comme ça, tu te frottes
à des monstres féroces ?","Miao, <PL>. Ho saputo che
stai dando la caccia ad alcuni
mostri davvero feroci.","Miaulöle, <PL>!
Wie ich hörte, hast du ein paar
echt wilde Miaunster gejagt!","Miau buenas, <PL>.
¡He oído que has estado cazando monstruos
de armas tomar!","Мяувет, <PL>! Говорят,
ты охотишься на
мур-жасно страшных монстров, мяу!","Moje mrrr-ukłony, <PL>!
Słyszałem, że <LSNR {polowałeś} {polowałaś}>
na serio straszliwe miaustra!",,,"Miaulá, <PL>! Ouvi dizer
que você anda caçando uns miaunstros
muito ferozes!","오, <PL>!
저쪽에서 하는 사냥도 꽤 치열해졌다고
들었다냥.","嘿，<PL>！
聽說你在王國的狩獵
也到了最關鍵的時刻了。","哟，<PL>！
俺听说在那边狩猎也很考验人喵。",,,,,,,,"مرحبًا يا <PL>!
سمعت <LSNR {أنك كنت تطارد} {أنكِ كنتِ تطاردين}> بعض
الوحوش الشرسة حقًّا!",,,,,,,,,,,
0d1230a7-c520-476e-a7be-bf18dd46884d,2741008123,会話終了,,,,,,,,,,,,,,,,,,,,,,,,,,,,,,,,,,,,,,,,nid008_base4_001,"気合いは十分かニャ？
気合いが足りないときはいつでも言うニャ。
オイラの肉球ビンタで、気合い注入ニャ！","If you need meowtivation you can try
reciting this daily affur-mation in front
of a mirror. I purr-omise it helps!","Si tu as besoin de motivation, je te
conseille de réciter cette affirmation
devant un miroir. Ça t'aidera, crois-moi !","Se sei in cerca di motivazione, prova a
ripetere quotidianamente questo miaontra
davanti allo specchio. Ti tornerà utile.","Solltest du Miautivation brauchen,
dann mach dir vor dem Spiegel Mut.
Das wird helfen! *maunz*","Si en algún momento necesitas un empujón,
no tienes más que repetírtelo delante
de un espejo. ¡Ya verás qué bien!","Если тебе не хватает мяу-тивации,
повторяй эту мантру перед зеркалом
каждый день. Помогает!","Jeśli potrzebujesz miau-tywacji,
codziennie przed lustrem powtarzaj tę
mantrę. Przyrzekam, że ci pomoże!",,,"Se precisar de miautivação, você pode
recitar essa afirmação diária na frente
do espelho. Isso vai te ajudar!","기합은 충분히 넣었냥?
기합이 부족할 땐 언제든 말해라냥.
내 냥펀치로 기합을 넣어 주겠다냥!","你的鬥志足夠嗎？
如果不夠的話隨時和我說喵。
我會用我的肉球巴掌替你注入鬥志喵！","干劲还够喵？不够的话，随时跟俺讲喵。
俺会用肉垫耳光给你鼓劲的喵！",,,,,,,,"إذا <LSNR {كنت} {كنتِ}> بحاجة إلى تشجيع، <LSNR {يمكنك} {يمكنكِ}> قول
هذه الإنجازات اليومية أمام
المرآة. <LSNR {أعدك} {أعدكِ}> أن ذلك <LSNR {سيساعدك} {سيساعدكِ}>!",,,,,,,,,,,
c6e10d57-04dc-489c-90da-cbb54ae8bff1,3931708631,,(default)世間話,,,,この会話フラグがONなら→,EV_PRO_MR_005_01_01,,この会話フラグがOFFなら→,EV_PRO_MR_006_01_01,,,,,,,,,,,,,,,,,,,,,,,,,,,,,,,nid008_base5_000,"おう、<PL>。
よく帰ったぞニャ。
エルガドでもがんばってるようだニャ。","Meowllo there, <PL>!
I heard you've been doing well in Elgado!","Chalut, <PL> !
J'ai entendu dire qu'Elgado te réussissait.","Miao, <PL>. Ho saputo che
te la cavi egregiamente a Elgado.","Miaulöle, <PL>!
Wie ich hörte, geht es dir gut in Elgado!","Miau buenas, <PL>.
¡He oído que te va de lujo en Elgado!","Мяувет, <PL>! Говорят,
у тебя неплохо идут дела в Элгадо!","Moje mrrr-ukłony, <PL>!
Słyszałem, że dobrze sobie radzisz w Elgado!",,,"Miaulá, <PL>! Ouvi dizer
que você tá se saindo muito bem
em Elgado!","오, <PL>.
잘 왔다냥.
엘가도에서도 열심인 모양이구냥.","嘿，<PL>。
你回來啦喵。
你在艾爾卡多似乎也很賣力喵。","哟，<PL>。
欢迎回来喵。你在埃尔迦德好像也很努力喵。",,,,,,,,"مرحبًا يا <PL>!
سمعت <LSNR {أنك أبليت} {أنكِ أبليتِ}> بلاءً حسنًا في إلجادو!",,,,,,,,,,,
dcf262b0-9a11-4120-9b17-9ffb2ad0dca4,1622737638,,,,,,,,,,,,,,,,,,,,,,,,,,,,,,,,,,,,,,,,,nid008_base5_001,"そりゃ知っとるニャ。
郵便屋さんはどこにでもおるぞニャ。
壁に郵便屋あり障子に郵便屋ありぞニャ。","How do I know that? Come on!
Us Couriers are everywhere! Here,
there! We're even in the walls!","Comment je sais ça ? Nous autres
messagers, on sait tout, voyons.
On est partout ! Partout !","Come faccio a saperlo? Suvvia, noi
corrieri siamo ovunque: di qua, di là
e persino dentro i muri.","Wie ich das weiß? Komm schon!
Wir Kuriere sind überall! Hier und da!
Wir sind sogar in den Wänden!","¿Que cómo lo sé? ¿No sabes que hay
mensajeros Felyne por todas partes?
¡Si estamos hasta en la sopa!","Откуда я знаю? Ну ты даешь!
Мы, Курьеры, повсюду!
И там, и тут. Даже в стенах!","Skąd to wiem? To jasne!
My kurierzy jesteśmy wszędzie.
Tu, tam. Nasze ściany mają uszy!",,,"Como eu sei disso? Ora! Nós Mensageiros
estamos em toda parte! Aqui, ali, acolá!
Estamos até nas paredes!","다 알고 있다냥.
우체부는 어디에든 있다냥. 낮말도
우체부가, 밤말도 우체부가 듣는다냥.","這我當然知道囉喵。
郵差可是無所不在的喵。
俗話說得好，隔牆有郵差喵。","俺当然知道喵，信使无处不在喵。
隔墙须有信使耳，窗外岂无信使猫喵。",,,,,,,,"كيف أعرف ذلك؟ هيا!
نحن السعاة موجودون في كل مكان!
هنا وهناك! نحن حتى في الجدران!",,,,,,,,,,,
118f5d55-6d2d-4f80-8646-b739c29c5d6c,3237074541,会話終了,,,,,,,,,,,,,,,,,,,,,,,,,,,,,,,,,,,,,,,,nid008_base5_002,"冗談ぞニャ。さすがに室内は
郵便屋さんの配達範囲外だニャ。
…室内は、ニャ。","Haha! Look at your face! I'm just kidding!
The Courier in Elgado told me, silly!","Ah ah ah, je plaisante ! C'est le
messager d'Elgado qui me l'a dit !","Ahah, guarda la tua faccia!
Dai, sto scherzando! Me l'ha
riferito il corriere di Elgado.","Haha! Dein Gesicht! Ich mach nur Spaß!
Der Kurier in Elgado hat es mir gesagt,
Dummerchen!","¡Ja, ja! ¡Pero qué cara has puesto!
Que es broma, <LSNR {tonto} {tonta}>, ¡me lo ha dicho
el mensajero de Elgado!","Ха-ха! Посмотри на себя! Да шучу я!
Мне это сказал Курьер из Элгадо,
<LSNR {глупыш} {глупышка}>!","Ha, ha! Ale mina! Tylko żartuję.
Wiem to od kuriera z Elgado, głuptasie!",,,"Haha! Olha só a sua cara! É brincadeira!
O Mensageiro de Elgado me contou!","농담이다냥. 아무리 그래도 실내는
우체부의 배달 범위가 아니다냥.
…실내는, 그렇다냥.","開玩笑的喵。再怎麼說，
室內也不是郵差的配送範圍嘛喵。
……僅限室內喔，喵。","开玩笑的喵。信使送信肯定不会进室内喵。
……不过也就仅限室内喵。",,,,,,,,"هاها! <LSNR {انظر إلى وجهك} {انظري إلى وجهكِ}>! أنا أمزح فقط!
لقد أخبرني الساعي في إلجادو <LSNR {أيها السخيف} {أيتها السخيفة}>!",,,,,,,,,,,
3df94278-3b80-4d2e-8f15-f75696d78548,1927406302,,(default)世間話,,,,この会話フラグがONなら→,EV_PRO_MR_006_01_01,,,,,,,,,,,,,,,,,,,,,,,,,,,,,,,,,,nid008_base6_000,"オイラ、足腰にはわりと自信があるぞニャ。
長年の郵便配達で
しっかり鍛えられておるからニャ。","All these years of delivering mail has done
wonders for my meowscles. Feel these
bad boys!","Toutes ces années à distribuer du
courrier, ça m'a musclé, tu sais.
Tâte-moi ça !","Tutti questi anni ad occuparmi della posta
hanno fatto miracoli per i miei miaoscoli.
Senti qui: sodi come rocce!","All die Jahre, in denen ich Post
ausgeliefert habe, haben sich auf
meine Miauskeln ausgewirkt! Fühl mal!","Todos estos años entregando paquetes
me han dado unos músculos de infarto.
¡Toca, toca!","Я столько лет доставлял почту,
что неслабо накачал мышцы.
Врагам не поздоровится!","Długie lata dostarczania poczty uczyniły
cuda dla moich miau-śni.
Dotknij tylko, jakie są mocne!",,,"Todos esses anos nesse ramo fizeram
miauravilhas pros meus miáusculos.
Sente só meu muque!","난 하반신에는 꽤 자신이 있다냥.
오랫동안 우체부 일을 하면서
착실히 단련되었으니까냥.","我對我的下盤還挺有自信的喵。
長年送信下來，
使我的肌肉鍛鍊得很結實喵。","俺对腰腿还挺有自信的喵。送了这么
多年信，俺锻炼得很到位喵。",,,,,,,,"كل تلك السنوات التي أمضيتها في توصيل البريد قد صنعت لي
المعجزات. <LSNR {انظر} {انظري}> إلى هذه
العضلات القوية!",,,,,,,,,,,
a57a8184-8606-4f33-afc5-8624ffdfc467,3729185180,,,,,,,,,,,,,,,,,,,,,,,,,,,,,,,,,,,,,,,,,nid008_base6_001,"と言っても、毎日モンスターを相手にしてる
ハンターたちに比べたら、
全然たいしたことはないぞニャ。","Purr-obably nothing compared to your
meowscles! I bet your gluteus meowximus
is as hard as a Basarios's backside!","C'est rien par rapport à tes muscles
à toi, c'est sûr ! Tu dois avoir
des fessiers en acier !","Probabilmente non sono niente rispetto
ai tuoi. Scommetto che hai dei glutei
duri come il dorso di un Basarios.","Im Vergleich zu deinen sind sie wohl
nichts! Dein Gluteus Miauximus ist
hart wie ein Basarios-Rücken!","Pero seguro que no son nada comparados
con los tuyos. ¡Apuesto que tienes unas
posaderas tan duras como un Basarios!","С твоими мяу-шцами они не сравнятся!
Держу пари, твоя ягодичная мяу-шца
такая же твердая, как зад Базариоса!","Pewnie to nic w porównaniu z twoimi
miau-śniami! Założę się, że twoje pośladki
są tak twarde jak tyłek Basariosa!",,,"Claro, nem se comparam aos seus!
Aposto que seu glúteo miauximus é tão
duro quanto o traseiro de um Basarios!","그래도 매일 몬스터를
상대하는 헌터들에 비하면
별거 아니다냥.","不過說是這麼說，
和每天面對魔物的獵人相比，
這點能耐完全不值一提喵。","但和每天对付怪物的猎人相比，
根本不值一提喵。",,,,,,,,"ربما هي لا شيء مقارنة
<LSNR {بعضلاتك} {بعضلاتكِ}>! أراهن أنها
بمثل صلابة ظهر باساريوس!",,,,,,,,,,,
e42c94d8-d829-4fa6-8d27-b09a7845056a,2555808674,会話終了,,,,,,,,,,,,,,,,,,,,,,,,,,,,,,,,,,,,,,,,nid008_base6_002,"そりゃ、郵便屋だからニャ。
郵便配達に使う力があれば十分ぞニャ。","Anymew, as long as I have what it takes to
be a Courier, then that's enough for me.","Bref, tant que je peux faire mon travail
correctement, ça me va.","Comiaunque, a me basta avere la
stoffa giusta per fare il corriere.","Maunz es wie es sei. Solange ich
das Zeug habe, ein Kurier zu sein,
reicht mir das.","Aunque a mí me basta con tener lo que
hace falta para ser mensajero.","Короче, если у меня есть задатки Курьера,
значит — и так сойдет.","W każdym razie dopóki sprawdzam się w roli
kuriera, niczego więcej nie potrzebuję.",,,"Bom, contanto que eles atendam às minhas
necessidades de Mensageiro, já tá ótimo.","그야, 우체부니까냥.
우편 배달에 쓸 힘만 있으면 충분하다냥.","不過我只是個郵差喵。
擁有送信的力氣就足夠了喵。",毕竟俺是信使喵，有送信的力量就够了喵。,,,,,,,,"على أي حال، طالما لديّ ما يلزم
لأكون ساعيًا، فهذا يكفي بالنسبة لي.",,,,,,,,,,,
