guid,crc?,<PageAttr>,<TalkAttr>,<VillageProgress>,<HallProgress>,<HunterRank>,<TalkTag>,<TalkTagParam>,<TalkTagComment>,<TalkTag>,<TalkTagParam>,<TalkTagComment>,<TalkTag>,<TalkTagParam>,<TalkTagComment>,<TalkTag>,<TalkTagParam>,<TalkTagComment>,<TalkTag>,<TalkTagParam>,<TalkTagComment>,<TalkTag>,<TalkTagParam>,<TalkTagComment>,<TalkTag>,<TalkTagParam>,<TalkTagComment>,<TalkTag>,<TalkTagParam>,<TalkTagComment>,<TalkTag>,<TalkTagParam>,<TalkTagComment>,<TalkAction1>,<TalkAction1Param>,<TalkAction1Comment>,<TalkAction2>,<TalkAction2Param>,<TalkAction2Param2>,<TalkAction2Comment>,entry name,Japanese,English,French,Italian,German,Spanish,Russian,Polish,Dutch,Portuguese,PortugueseBr,Korean,TraditionalChinese,SimplifiedChinese,Finnish,Swedish,Danish,Norwegian,Czech,Hungarian,Slovak,Arabic,Turkish,Bulgarian,Greek,Romanian,Thai,Ukrainian,Vietnamese,Indonesian,Fiction,Hindi,LatinAmericanSpanish
1a88aa4c-6447-4830-8592-887d21a76cf4,1846507918,ページ属性,会話属性,村進行度,集会所進行度,必要ハンターランク,会話タグ1,会話タグ1パラメータ,会話タグ1コメント,会話タグ2,会話タグ2パラメータ,会話タグ2コメント,会話タグ3,会話タグ3パラメータ,会話タグ3コメント,会話タグ4,会話タグ4パラメータ,会話タグ4コメント,会話タグ5,会話タグ5パラメータ,会話タグ5コメント,会話タグ6,会話タグ6パラメータ,会話タグ6コメント,会話タグ7,会話タグ7パラメータ,会話タグ7コメント,会話タグ8,会話タグ8パラメータ,会話タグ8コメント,会話タグ9,会話タグ9パラメータ,会話タグ9コメント,会話アクション1,会話アクション1パラメータ,会話アクション1コメント,会話アクション2,会話アクション2パラメータ,会話アクション2パラメータ2,会話アクション2コメント,nid017,日本語メッセージ,英語メッセージ,,,,,,,,,,,,,,,,,,,,,,,,,,,,,,,
b8c08611-0006-46e7-8562-da79cd4af713,1027397251,,(default)世間話,村進行チュートリアル,,,この会話フラグがOFFなら→,EV_PRO_VILL_001_01_06,,この会話フラグがONなら→,EV_PRO_VILL_001_01_01,,,,,,,,,,,,,,,,,,,,,,,,,,,,,,nid017_v0_000,"あ、<PL>さん！
どうもッス！","Oh, <PL>!
*munch munch*
How are *munch* you?","Oh, <PL> !
*miam miam*
Comment ça va *miam* ?","Oh, <PL>!
Gnam... gnam!
Come... gnam... stai?","Oh, <PL>!
*mampf* *mampf*
Wie geht es *mampf* dir?","Oh, <PL>. Ñam, ñam...
¿Qué tal andas? ¡Ñam!","О, <PL>!
*ням-ням*
Как *ням* твои дела?","O, <PL>!
*mlask, mlask*
Jak się – *mlask* – miewasz?",,,"Ah, <PL>!
Nhac, nhac...
Tudo — nhac — bem?","아, <PL> 씨!
안녕하세요!","啊，<PL>！
你好啊！","啊，<PL>！
你好啊！",,,,,,,,"أوه، يا <PL>!
*صوت مضغ*
كيف <LSNR {حالك} {حالكِ}> *صوت مضغ*؟",,,,,,,,,,,
a5ea8163-80c0-4296-8a5c-30c1101f99b5,670426859,会話終了,,,,,,,,,,,,,,,,,,,,,,,,,,,,,,,,,,,,,,,nid017_v0_001,"すんませんけど自分、
いまメシ食ってるんで！
ヒノエさんとの買い物を優先してくれッス！","I'm actually gettin' some *munch*
grub right now. You should go on
shopping with Hinoa!","Je suis en train de manger,
va faire ton shopping avec Hinoa !
*miam*","Sono impegnato a... gnam... mangiare ora.
Vai pure a fare acquisti con Hinoa!","Ich hole mir erst mal was zu *mampf* futtern.
Kauf du ruhig weiter mit Hinoa ein!","Me pillas comiendo. ¡Ñam!
Deberías seguir de compras con Hinoa.","Мне сейчас надо поесть. *ням* А ты
сходи за покупками с Хиноа!","W tej chwili akurat – *mlask* – jem.
Lepiej zajmij się zakupami z Hinoą!",,,"Tô mandando um — nhac — rango agora.
Vai logo fazer compras com a Hinoa!","죄송하지만 제가 지금
식사 중이라서요!
히노에 씨하고 먼저 장 보고 오세요!","真是不好意思，
我現在正在吃飯！
你先跟火芽小姐去採買吧！","不好意思，
我正吃着饭呢！
你优先去和火芽买东西吧！",,,,,,,,"في الحقيقة أنا أعد بعض
الطعام *صوت مضغ* الآن. يجب أن
<LSNR {تذهب} {تذهبي}> للتسوق مع هينوا!",,,,,,,,,,,
1685f2a4-d836-4956-b13e-ed0ce75ad610,3839148677,,初対面会話,,,,この会話フラグがOFFなら→,NID_017_FIRST,,この会話フラグがONなら→,EV_PRO_VILL_001_01_06,,,,,,,,,,,,,,,,,,,,,,,,,,,,,,nid017_v0_002,"あ、<PL>さん！
正式にカムラの里のハンターに
なったんスよね！","I heard you became an official
Hunter of Kamura!","Tu as rejoint les rangs des
chasseurs de Kamura, paraît-il ?","Ho sentito dire che sei <LSNR {diventato} {diventata}>
ufficialmente <LSNR {un cacciatore} {una cacciatrice}> di Kamura!","Ich habe gehört, dass du jetzt <LSNR {ein offizieller} {eine offizielle}>
<LSNR {Jäger} {Jägerin}> von Kamura bist.","¡He oído que te has convertido en <LSNR {cazador} {cazadora}> de
Kamura de forma oficial!","Я слышал, ты теперь <LSNR {официальный охотник} {официальная охотница}>
Камуры!","Słyszałem, że <LSNR {zostałeś oficjalnym} {zostałaś oficjalną}>
<LSNR {łowcą} {łowczynią}> Kamury!",,,"Soube que você se tornou
<LSNR {um caçador} {uma caçadora}> de Kamura!","아, <PL> 씨!
정식으로 카무라 마을의
헌터가 되셨군요!","啊，<PL>！
你已經正式成為
神火村的獵人了吧！","啊，<PL>！
你正式当上
炎火村的猎人了吧！",,,,,,,,"سمعت <LSNR {أنك أصبحت الصياد الرسمي} {أنكِ أصبحتِ الصيادة الرسمية}>
لكامورا!",,,,,,,,,,,
f78b2b24-d2ee-476a-bd3a-1404a04295a7,2330462133,,,,,,,,,,,,,,,,,,,,,,,,,,,,,,,,,,,,,,,,nid017_v0_003,"自分も最近、ウツシ教官に弟子入りして、
ハンターを目指してるんッスよ！
いま、がんばって訓練に励んでるッス！","I started studying under Master Utsushi
so I can become a hunter myself!
I'm like, trainin' real hard!","J'ai commencé à m'entraîner avec Maître
Utsushi pour pouvoir devenir chasseur.
Je bosse dur !","Ho iniziato ad addestrarmi col maestro Utsushi
per diventare anch'io un cacciatore! Mi
sto allenando duramente!","Ich möchte unter Meister Utsushi auch
zum Jäger werden. Ich gebe alles dafür
und trainiere hart!","Yo he comenzado a estudiar bajo la tutela
del maestro Utsushi para convertirme en
cazador. ¡Me dejo el culo entrenando!","Я начал учиться у Мастера Уцуси, чтобы
тоже стать охотником! Я очень
упорно тренируюсь!","Zacząłem uczyć się pod okiem
Mistrza Utsushiego, żeby zostać łowcą!
Pracuję naprawdę ciężko!",,,"Comecei a estudar com o Mestre
Utsushi pra me tornar um caçador!
Tô, tipo, treinando muitão!","저도 요즘 우츠시 교관님의 제자로
들어가서 헌터를 목표로 공부하고 있어요!
훈련도 열심히 받고 있고요!","我最近也拜倪泰教官為師，
並以當上獵人為目標了喔！
目前正在努力訓練中！","我最近也拜了倪泰教官为师，
争取当上猎人呢！
我现在就在努力训练！",,,,,,,,"بدأت أتعلم على يد السيد أوتسوشي
حتى أكون صيادة بارعة! أتدرب بكل قوة
وتركيز!",,,,,,,,,,,
39ba4861-7928-4c3a-9925-a5811b7bd993,3100125151,会話終了,,,,,,,,,,,,,,,,,,,,,,,,,,,,,,,,,,,,,,,nid017_v0_004,"だから、今後は<PL>さんを
センパイと呼ばせてもらうッス！
よろしくッス！　センパイ！","Hey, since you've been training under Master
Utsushi longer than me, is it OK if I call you
Chief? That sounds cool, right!?","Hé, puisque tu t'entraînes avec Maître
Utsushi depuis plus longtemps que moi,
je peux t'appeler <LSNR {Chef} {Cheffe}> ?","Ehi, dato che ti alleni col maestro Utsushi
da più tempo di me, posso chiamarti sensei?
Suona bene, no?","Darf ich dich Boss nennen, weil du ja länger
unter Meister Utsushi gelernt hast als ich?
Klingt doch cool, oder?","Oye, ya que has estado entrenando con el
maestro Utsushi más tiempo que yo, ¿te parece
bien si te llamo <LSNR {jefe} {jefa}>? Suena guay, ¿verdad?","Раз ты тренируешься у Мастера Уцуси
дольше, чем я, можно я буду
звать тебя ""шеф""? Круто же!","Słuchaj, skoro trenujesz u Mistrza
Utsushiego dłużej ode mnie, czy mogę ci
mówić „<LSNR {szefie} {szefowo}>”? Fajnie brzmi, co?",,,"Ei, já que você tá treinando com Mestre
Utsushi há mais tempo que eu, tudo bem
te chamar de Chefe? É legal, né?","그러니까 앞으로 <PL> 씨를
선배라고 부를게요!
잘 부탁드립니다, 선배!","所以從今以後請讓我稱呼
<PL>為前輩吧！
前輩！請多指教！","所以，以后我要
叫<PL>前辈了！
多关照了！前辈！",,,,,,,,"<LSNR {أنت} {أنتِ}>، بما <LSNR {أنك} {أنكِ}> أقدم مني في التدريب
مع السيد أوتسوشي هل يُمكنني
<LSNR {مناداتك بالقائد} {مناداتكِ بالقائدة}> ؟ يبدو هذا رائعًا، أليس كذلك!؟",,,,,,,,,,,
c9f63acd-6781-42be-86d7-b012ff980fa3,110374909,,(default)世間話,村進行チュートリアル,,,このクエストが未クリアなら→,QN030101,,この会話フラグがONなら→,EV_PRO_VILL_001_01_06,,,,,,,,,,,,,,,,,,,,,,,,,,,,,,nid017_v0_005,"狩りの基本は、食事！
特に、狩りの前に食べるうさ団子は、
めっちゃ大事とウツシ教官から習ったッス！","Master Utsushi says meals are
the foundation of a good hunter—
especially Bunny Dango.","Maître Utsushi dit que pour bien
chasser, il faut bien manger.
Surtout des dango-lapins.","Il maestro Utsushi dice che un buon pasto
è fondamentale per i cacciatori di talento,
specialmente i dango.","Meister Utsushi sagt, Mahlzeiten sind die
beste Grundlage für eine gute Jagd – vor
allem niedliche Dango.","El maestro Utsushi dice que cada comida
es el cimiento de una buena caza.
Especialmente cuando hablamos de dango.","Мастер Уцуси говорит, что хорошо
поесть — залог удачной охоты. Особенно
если поесть данго.","Mistrz Utsushi mówi, że posiłek 
czyni dobrego łowcę.
Szczególnie króliczkowe dango.",,,"O Mestre Utsushi diz que as refeições
são o alicerce de um bom caçador.
Especialmente se for dango de coelho.","사냥의 기본은 식사! 특히 사냥 전에
먹는 토끼 경단은 엄청 중요하다고
우츠시 교관님이 말씀하셨어요!","進食是狩獵的基本！
倪泰教官特別強調，在狩獵之前
先吃個兔兔糰子是非常重要的！","倪泰教官教了我，
狩猎的基础是吃饭！
尤其是狩猎前吃的兔团子，非常重要！",,,,,,,,"يقول السيد أوتسوشي
إن الوجبات هي أساس الصياد
الماهر وخصوصًا— وجبة دانجو الأرانب.",,,,,,,,,,,
b1f45967-677f-4bf0-86e9-6991519af848,1586132720,,,,,,,,,,,,,,,,,,,,,,,,,,,,,,,,,,,,,,,,nid017_v0_006,"そんなわけで、最近は茶屋に行って、
ヨモギさんからうさ団子について
いろいろ勉強してるッスよ！","So, I've been going to the Tea Shop
to learn a couple things about
Bunny Dango from Yomogi.","Du coup, je passe de temps en temps
au salon de thé, et Yomogi m'explique
des trucs sur les dango-lapins.","Quindi sto andando alla casa da tè per imparare
i segreti dei dango a coniglietto da Yomogi.","Darum gehe ich immer in den Teeladen, um
von Yomogi alles über Dango zu lernen.","Así que he estado pasándome por la casa
del té para aprender de Yomogi un par
de cosas sobre ellos.","Так что я хожу в чайный домик, чтобы
побольше узнать у Йомоги о данго.","Dlatego chodzę do herbaciarni,
żeby dowiedzieć się o nich
czegoś od Yomogi.",,,"Tenho ido à Casa de Chá pra
aprender algumas coisas sobre
dangos de coelho com a Yomogi.","그래서 요즘은 찻집에 찾아가
요모기 씨에게 토끼 경단을
열심히 공부하고 있어요!","所以我最近常常跑去茶館，
跟艾草姐姐學了很多
關於兔兔糰子的知識喔！","所以我最近去了茶点店，
向艾草学习了
很多兔团子的知识！",,,,,,,,"لذا، كنت أذهب إلى متجر الشاي
لأتعلم بعض الأشياء عن
دانجو الأرانب من يوموجي.",,,,,,,,,,,
94f68b43-8de9-4d41-9c0f-c511153375ee,1969608987,会話終了,,,,,,,,,,,,,,,,,,,,,,,,,,,,,,,,,,,,,,,nid017_v0_007,"団子の組み合わせで、狩りのときに
出てくる効果が変わるんッスね！
いやぁ、奥が深いッス！　うさ団子！","She says the combination of dango
changes what they do for a hunt.
Man, dango are just so...deep!","Il paraît que tous les dango
n'ont pas les mêmes effets.
C'est dingue, non ? Sacrés dango !","Dice che ogni combinazione di dango
ha effetti diversi sulla caccia.
Cavolo, i dango sono così... speciali!","Sie sagt, die Kombination der Dango
beeinflusst ihre Auswirkungen auf die Jagd.
Mann, Dango sind so... tiefgründig!","Dice que la forma de combinar los dango
cambia lo que pueden hacer por ti en la caza.
¡Los dango son tela de profundos!","Она говорит, что все полезные эффекты
зависят от сочетания данго.
Как сложно все!","Twierdzi, że układ dango zmienia
ich właściwości podczas polowania.
Te dango to... poważna sprawa!",,,"Ela diz que a combinação de dangos
muda o que eles fazem pra caçada.
Cara, dangos são tão... profundos!","경단의 조합에 따라 사냥할 때
얻을 수 있는 효과가 바뀌는군요!
토끼 경단은 정말 심오하네요!","不同糰子的組合，
在狩獵時產生的效果也會有所不同！
哎呀，兔兔糰子的學問還真深奧啊！","团子的不同搭配
会在狩猎时发挥出不同效果啊！
哎，真是深奥！兔团子！",,,,,,,,"إنها تقول إن تركيبة الدانجو
تؤثر على ما يفعلونه عند الصيد.
ربّاه، هذا الدانجو يخبئ لنا الكثير!",,,,,,,,,,,
01203a99-fa76-4452-aa5e-4d632277db5d,378272778,,(default)世間話,村進行☆1,,,,,,,,,,,,,,,,,,,,,,,,,,,,,,,,,,,,,nid017_v1_000,"自分、ウツシ教官の指導のもと、
ハンターを目指して猛勉強中ッス！","I'm studyin' hard to become a hunter
under Master Utsushi!","Je m'entraîne avec Maître Utsushi
pour devenir chasseur !","Mi sto addestrando col maestro Utsushi per
diventare un cacciatore.","Ich arbeite hart, damit ich unter Meister
Utsushi auch zum Jäger werden kann!","¡Estoy estudiando un montón con el maestro
Utsushi para hacerme cazador!","Я тренируюсь у Мастера Уцуси, чтобы
стать охотником!","Ciężko trenuję u Mistrza Utsushiego,
żeby zostać łowcą!",,,"Tô estudando pra me tornar um caçador
com o Mestre Utsushi!","전 우츠시 교관님의 지도하에서
헌터를 목표로 공부하고 있어요!","我目前正在倪泰教官的指導下，
以成為獵人為目標努力學習！","我正在倪泰教官的指导下，
为当上猎人而疯狂学习！",,,,,,,,"أذاكر باجتهاد ما يقوله السيد أوتسوشي
لأصبح صيادًا ماهرًا!",,,,,,,,,,,
5f756018-db9e-455e-a004-5ee63b3930e1,3447361915,,,,,,,,,,,,,,,,,,,,,,,,,,,,,,,,,,,,,,,,nid017_v1_001,"ウツシ教官からの教えでは、今の自分には
「よく食べて」「よく寝る」ことが
何よりも大事だそうッス！","Master Utsushi says I should
concentrate on eatin' a lot
and sleepin' a lot.","Maître Utsushi me conseille
de manger beaucoup
et dormir beaucoup.","Il maestro Utsushi dice che devo dedicarmi
a mangiare e dormire tanto.","Meister Utsushi hat gesagt, ich soll viel
essen und schlafen, das sei das Wichtigste.","El maestro Utsushi dice que tengo que
centrarme en comer y dormir un montón.","Мастер Уцуси говорит, сейчас главное —
много есть и много спать.","Mistrz Utsushi mówi, że powinienem
dbać o to, aby dużo jeść i spać.",,,"Mestre Utsushi diz que preciso me
concentrar em comer e dormir bastante.","우츠시 교관님은 지금 제게
「잘 먹는 것」과 「잘 자는 것」이
무엇보다 중요하다고 하셨어요!","倪泰教官教導我，
說我現在最需要的，
就是要「吃好」和「睡好」！","倪泰教官教我，
现在我最重要的
是“吃好”“睡好”！",,,,,,,,"يقول السيد أوتسوشي إنه يجب
أن أضع تركيزي في الاهتمام
بالغذاء الكثير والنوم الكثير.",,,,,,,,,,,
b6fb0706-4c41-416f-8e7e-d027d34e9f42,1606572574,会話終了,,,,,,,,,,,,,,,,,,,,,,,,,,,,,,,,,,,,,,,nid017_v1_002,"そういうわけで自分、
今は食べて、食べて、食べまくって、
寝て、寝て、寝まくってるッスよ！","So I'm gonna eat and eat n' keep
eatin', and then I'm gonna sleep
'til my eyes don't shut anymore!","Alors je vais manger, manger, manger,
et puis après je vais dormir jusqu'à ce
que mes paupières ne se ferment plus.","Perciò continuerò a mangiare fino a scoppiare
e a dormire come un sasso!","Also werde ich essen, essen und noch
mehr essen. Dann schlafe ich, bis meine
Augen nicht mehr zugehen.","¡Así que voy a comer hasta atiborrarme y a
dormir como un lirón!","Так что я буду есть и есть, а потом
буду спать и спать, пока силы
уже не закончатся!","Dlatego zamierzam jeść i jeść,
a potem będę spać tak długo,
aż się obudzę!",,,"Então vou comer, e comer, e continuar
comendo, e aí vou dormir até meus
olhos não fecharem mais!","그러니 저는
지금 먹고 또 먹은 뒤에
자고 계속 잘 거예요!","所以我現在每天都
拼命地吃吃吃和睡睡睡喔！","所以我现在
吃吃吃，吃个不停，
睡睡睡，睡个不停！",,,,,,,,"لذلك، سآكل كثيرًا جدًا وأستمر في الأكل
، ثم أخلد إلى نوم عميق
حتى لا أحتاج إلى النوم مُجددًا!",,,,,,,,,,,
2ef85c05-7998-4681-84e7-c73e3f3c6d70,2955681633,,(default)世間話,村進行☆2,,,,,,,,,,,,,,,,,,,,,,,,,,,,,,,,,,,,,nid017_v2_000,"センパイ、狩猟生活、順調ッスか？
自分も将来、センパイみたいな
ハンターになるため、絶賛勉強中ッス！","Hey, Chief! How's the hunting life?
Me, I've been training really hard so
I can be a hunter just like you!","Salut ! Ça te plaît la chasse ?
Moi je bosse super dur pour devenir
chasseur un jour, comme toi !","Sensei! Com'è la vita da <LSNR {cacciatore} {cacciatrice}>?
Io mi sto allenando duramente per diventare
come te un giorno!","Hey, Boss! Wie läuft die Jagd? Was mich
angeht, ich trainiere fleißig, damit ich
ein Jäger wie du sein kann!","¡Eh, <LSNR {jefe} {jefa}>! ¿Qué tal la vida de <LSNR {cazador} {cazadora}>?
¡Yo he estado entrenando mucho para
convertirme en uno!","Шеф! Как жизнь охотничья?
Я вот тренирусь, чтобы тоже стать
таким охотником, как ты!","Hej, <LSNR {szefie} {szefowo}>! Jak tam łowieckie życie?
Trenuję bardzo pilnie,
żeby być taki jak ty!",,,"Ei, Chefe! Como tá a vida de <LSNR {caçador} {caçadora}>?
Eu tô treinando bastante pra ser
um caçador como você!","선배! 사냥은 순조로우신가요?
저도 나중에 선배 같은 헌터가
되려고 열심히 공부하고 있어요!","前輩的狩獵生活過得還順利嗎？
為了將來能成為像前輩一樣的獵人，
我也正在拼命地學習喔！","前辈，狩猎生活还顺利吗？
为了以后成为前辈那样的猎人，
我也在发奋学习！",,,,,,,,"مرحبًا يا <LSNR {قائد} {قائدة}>! كيف هي حياة الصيد؟
بالنسبة لي، أتدرب تدريبًا
قاسيًا حتى أصبح صيادًا <LSNR {مثلك} {مثلكِ}>!",,,,,,,,,,,
d8ca10f9-f6a7-491a-bbb0-bfdffc62c987,1509971708,会話終了,,,,,,,,,,,,,,,,,,,,,,,,,,,,,,,,,,,,,,,nid017_v2_001,"今は、オトモ広場から行ける修練場に
出向いて、走り込みとかもやってるッスよ。
あそこは、鍛えるのに最適の場所ッスね。","I also jog to the Training Area
via the Buddy Plaza: a perfect
regimen for gettin' in shape.","Je cours jusqu'à l'Aire d'entraînement
en passant par la Place Pilpoil,
c'est parfait pour garder la forme.","Corro persino fino all'area di addestramento
attraverso Piazza compagni per mantenermi
in forma.","Ich jogge auch über die Buddy-Plaza
zum Trainingsbereich. So komme ich
perfekt in Form!","También corro desde la zona de entrenamiento
hasta la plaza Camarada. Es lo mejor para
mantenerse en forma.","А еще я бегаю к Тренировочной зоне
через Площадь спутников — отличное
упражнение, чтобы быть в форме.","Do tego biegam do obszaru treningowego
przez Plac Kompanów. To doskonały
sposób, żeby być w formie.",,,"Eu também corro na Área de Treinamento
através da Praça dos Amigos: um regime
perfeito pra ficar em forma.","요즘은 동반자 광장을 통해
수련장에 가서 달리곤 해요.
거긴 단련하기 아주 좋은 곳이에요!","我現在常常穿過隨從廣場，
到修練場去練習跑步喔。
那裡很適合用來鍛鍊呢。","走随从广场就能到修炼场，
我现在会去那里练习跑步之类的。
那地方最适合锻炼了。",,,,,,,,"أنا أهرول أيضًا إلى منطقة التدريب
عبر ساحة الأصدقاء: يا لها من
حمية ممتازة لصقل الجسم.",,,,,,,,,,,
4df3c2f0-d528-4778-ba46-7f516b6876c5,3941460266,,(default)世間話,村進行☆2,,,,,,,,,,,,,,,,,,,,,,,,,,,,,,,,,,,,,nid017_v2_002,"大社跡に、ユーレイが出るって話、
本当ッスか！？","Hey, uh, is it true that there're
ghosts in the Shrine Ruins!?","Dis, euh.... C'est vrai qu'il y a
des fantômes au Temple oublié ?!","Ehi... ehm, è vero che alle Rovine sacre ci
sono i fantasmi?","Hey, äh, stimmt es, dass es Geister
in den Heiligen Ruinen gibt?","Oye, estooo... ¿Es verdad que hay fantasmas
en el Templo olvidado?","Слушай, а... Правда, что в Руинах
святилища есть призраки?!","Słuchaj, czy to prawda,
że w Ruinach Świątynnych są duchy?!",,,"Ei, uh, é verdade que tem
fantasmas nas Ruínas do Templo?!","사원 폐허에 유령이 나온다는 게
사실인가요?!","聽說大社遺跡有幽靈出現，
這是真的嗎！？","听说废神社闹鬼了，
是真的吗！？",,,,,,,,"<LSNR {أنت} {أنتِ}>، آه، هل هناك حقًا
أشباح عند أطلال الضريح!؟",,,,,,,,,,,
c42da9fd-4e7e-4ba6-b68d-bc7a5fde9a4f,4074174493,,,,,,,,,,,,,,,,,,,,,,,,,,,,,,,,,,,,,,,,nid017_v2_003,"い、いや、自分はちっとも
怖くなんかないッスよ！","What? Am I scared?
N-No, of course not!","Si j'ai peur ? Moi ?!
B-Bien sûr que non !!!","Cosa? Ti sembro spaventato?
N-no, certo che no!",Was? Ob ich Angst habe? N-Natürlich nicht!,"¿Cómo? ¿Que si tengo miedo?
N-no, ¡pues claro que no!","Что? Не страшно ли мне?
Н-Нет, конечно, нет!","Co? Czy się boję?
N-nie, oczywiście, że nie!",,,"Quê? Se tô com medo?
N-Não, claro que não!","아, 아니에요! 저는 하나도
안 무서워요!","沒、沒有啦，
我一點也不覺得害怕啦！","不、没有，
我一点也不怕！",,,,,,,,"ماذا؟ أنا خائف؟
لا، بالطبع لا!",,,,,,,,,,,
24032085-e88c-4d01-8c8b-7b2cbf138c0f,1838775850,会話終了,,,,,,,,,,,,,,,,,,,,,,,,,,,,,,,,,,,,,,,nid017_v2_004,"将来ハンターを目指す男が、
ユーレイごときにビビッてちゃあ
笑われちゃうッス！　ハハ…ハハハハハ！","I'm tryin' to become a hunter here!
I've got no time to be spooked
by fairytales! Haha...ha...","Attends, je vais devenir chasseur !
Je vais quand même pas croire à
toutes ces histoires ! Ha ha... Ahem.","Un giorno sarò un cacciatore! Non mi faccio
spaventare da sciocchezze simili!
Ahah... ah!","Ich möchte ein Jäger werden! Für
Schauermärchen habe ich wirklich
keine Zeit! Haha... Ha.","¡Que soy un futuro cazador! Un cuento de
miedo para niños no me va a asustar.
Ja, ja... Ja...","Я ведь учусь, чтобы стать охотником!
Меня страшилками не напугаешь! Ха!
Ха... ха.","Próbuję zostać łowcą!
Nie mam czasu bać się bajek
o duchach! Ha-ha... Ha.",,,"Tô tentando me tornar um caçador!
Não tenho tempo pra ter medo
de contos de fadas! Haha...ha.","장차 헌터가 될 남자가
고작 유령에 겁을 먹어선
웃음거리가 된다고요! 하하…하하하하!","我可是將來要成為獵人的男人！
要是害怕幽靈這種東西，
可是會被取笑的！哈哈……哈哈哈哈哈！","以将来当上猎人为目标的男人
遇到点鬼怪就一惊一乍的，
会被嘲笑的！哈哈……哈哈哈哈哈！",,,,,,,,"أحاول أن أكون صيادًا هنا!
لا أملك الوقت لأخاف من
القصص الخيالية! هاها...ها...",,,,,,,,,,,
