guid,crc?,<PageAttr>,<TalkAttr>,<VillageProgress>,<HallProgress>,<HunterRank>,<TalkTag>,<TalkTagParam>,<TalkTagComment>,<TalkTag>,<TalkTagParam>,<TalkTagComment>,<TalkTag>,<TalkTagParam>,<TalkTagComment>,<TalkTag>,<TalkTagParam>,<TalkTagComment>,<TalkTag>,<TalkTagParam>,<TalkTagComment>,<TalkTag>,<TalkTagParam>,<TalkTagComment>,<TalkTag>,<TalkTagParam>,<TalkTagComment>,<TalkTag>,<TalkTagParam>,<TalkTagComment>,<TalkTag>,<TalkTagParam>,<TalkTagComment>,<TalkAction1>,<TalkAction1Param>,<TalkAction1Comment>,<TalkAction2>,<TalkAction2Param>,<TalkAction2Param2>,<TalkAction2Comment>,<KohakuProgress>,entry name,Japanese,English,French,Italian,German,Spanish,Russian,Polish,Dutch,Portuguese,PortugueseBr,Korean,TraditionalChinese,SimplifiedChinese,Finnish,Swedish,Danish,Norwegian,Czech,Hungarian,Slovak,Arabic,Turkish,Bulgarian,Greek,Romanian,Thai,Ukrainian,Vietnamese,Indonesian,Fiction,Hindi,LatinAmericanSpanish
4ea98b11-4501-4759-b169-d349459bafd3,2828252095,,,,,,,,,,,,,,,,,,,,,,,,,,,,,,,,,,,,,,,,,nid033_ch3_002,王国騎士ジェイ殿は…。,Sir Jae...,Sieur Jae...,Sir Jae...,Sir Jae...,Sir Jae...,У Сира Джея...,Sir Jae...,,,O Sir Jae...,왕국 기사 제이 공은…,王國騎士傑伊大人他……,王国骑士杰伊大人他……,,,,,,,,السيد جاي...,,,,,,,,,,,
21497aa9-bda7-4de3-84eb-ed38fdc21093,3988163778,,,,,,,,,,,,,,,,,,,,,,,,,,,,,,,,,,,,,,,,,nid033_ch3_003,じつは…。,In fact...,A en fait...,... in realtà...,Tatsächlich...,Nada menos que...,Оказывается...,Tak naprawdę...,,,Na verdade...,사실…,其實……,其实……,,,,,,,,في الحقيقة...,,,,,,,,,,,
4ff7884d-f093-4c20-96e1-90e2d1e85b31,3724018244,,,,,,,,,,,,,,,,,,,,,,,,,,,,,,,,,,,,,,,,,nid033_ch3_004,絶対に逆らえない姉がいる！,...has an older sister he can't stand up to!,"Une grande sœur à laquelle
il a du mal à tenir tête !","... ha una sorella maggiore a cui
non riesce a tenere testa.","... hat er eine ältere Schwester,
gegen die er nicht ankommt!",¡Se deja mangonear por su hermana mayor!,"...есть старшая сестра, которую он
боится!",...ma starszą i dominującą siostrę!,,,Tem uma irmã mais velha que manda nele!,절대 거역하지 못하는 누나가 있다!,有個完全無法違抗的姊姊！,根本不敢忤逆他姐姐！,,,,,,,,لديه أخت أكبر منه لا يستطيع مواجهتها!,,,,,,,,,,,
8b754d75-9911-491b-9ed0-eeeee10a95d9,1985119130,,,,,,,,,,,,,,,,,,,,,,,,,,,,,,,,,,,,,,,,,nid033_ch3_005,"とっても気の強いお姉さんで、
対抗するために筋肉を鍛えている
というウワサも聞くほどニャ。","My sources tell me he works out just
so he has the courage to con-furr-ont
his strong-willed sibling.","Selon mes sources, il s'entraînerait
pour avoir le courage de faire face à
sa sœur tellement elle a du caractère.","Le mie fonti mi dicono che si allena solo
per trovare il coraggio di affrontare la
sua determinatissima sorella.","Meine Quellen sagen mir, dass er nur
trainiert, um den Mut zu haben, es mit sei-
ner willensstarken Schwester aufzunehmen.","Según mis fuentes, solo hace ejercicio
para ponerse minino y así enfrentarse a
la voluntad de hierro de su hermana.","Мои источники уверяют, что он трениру-
ется лишь для того, чтобы набраться
смяулости и дать ей отпор!","Moje źródła miauczą mi, że trenuje
tylko po to, aby przeciwstawić się
swej silnej siostrze.",,,"Minhas fontes me contam que ele malha só
para ter coragem de confrrrontar a irmã
cabeça dura.","엄청나게 기가 센 누나가 있고
누나에 대항하기 위해 근육을
단련한다는 소문이 들릴 정도다냥.","據傳他的姊姊個性非常強勢，
而且她為了與傑伊大人較量，
甚至有在鍛鍊肌肉喵。","老夫还听过一个传闻，说他姐姐性格强势，
所以他为了对抗姐姐，一直在锻炼肌肉喵。",,,,,,,,"تخبرني مصادري أنه يتدرب بشكل جيد
حتى تكون لديه الشجاعة لمواجهة
شقيقته قوية الإرادة.",,,,,,,,,,,
44cfb3b8-4aed-4322-a475-1e7c39109123,2213133770,,,,,,,,,,,,,,,,,,,,,,,,,,,,,,,,,,,,,,,,,nid033_ch3_006,"そして、ルーチカ殿の見た目が
お姉さんと似ているのニャ。","And I've learned that Dame Luchika
is the spitting image of his sister, too.","Et j'ai appris que Dame Luchika était
le portrait craché de sa sœur aussi.","E ho scoperto anche che Dama Luchika
è la copia sputata di sua sorella!","Und ich habe erfahren, dass Luchika auch
ein genaues Abbild seiner Schwester ist.","Y según tengo entendido,
la señorita Luchika es clavadita a ella.","И я узнал, что рыцарь Лучика как две
капли воды похожа на его сестру.","I dowiedziałem się też, że Pani Luchika
jest bardzo podobna do jego siostry.",,,"E descobri que a Dama Luchika é a cara
da tal irmã dele, ainda por cima.","그런데 루치카 공이 누나와
닮은 모양이다냥.","然後露琪卡大人又長得
和傑伊大人的姊姊很像喵。",而露琪卡小姐长得很像他姐姐喵。,,,,,,,,"وعلمت أن السيدة لوتشيكا هي
صورة طبق الأصل من شقيقته أيضًا.",,,,,,,,,,,
44be777f-f820-404e-aff5-be8ce4e23e0b,2487932316,,,,,,,,,,,,,,,,,,,,,,,,,,,,,,,,,,,,,,,,,nid033_ch3_007,"だからジェイ殿は
ルーチカ殿と話すとき、
心なしかビクビクしているニャ。","The upshot is, whenever he speaks with
Dame Luchika, he trembles with fear!","Du coup, chaque fois qu'il parle à Dame
Luchika, il tremble comme une feuille !","Infatti, quando parla con Dama Luchika,
trema di paura!","Der Vorteil ist, dass er immer, wenn
er mit Luchika spricht, vor Furcht
schlottert!","Lo más gracioso es que, siempre que él
habla con Luchika, ¡tiembla de miedo!","Поэтому всякий раз, когда он говорит
с Лучикой, его трясет от страха!","Kiedykolwiek rozmawia z panią Luchiką,
trzęsie się ze strachu!",,,"O mais legal é que, quando ele fala com
a Dama Luchika, treme todo de medo!","그래서 제이 공은
루치카 공과 이야기할 때
무의식적으로 움찔댄다냥.","所以傑伊大人在跟露琪卡大人講話時，
總會不自覺地戰戰兢兢喵。","因此不知道是不是错觉，杰伊大人在和
露琪卡小姐说话时，总是战战兢兢的喵。",,,,,,,,"النتيجة هي أنه كلما تحدث مع
السيدة لوتشيكا، يرتجف من الخوف!",,,,,,,,,,,
a3af2bbb-3f40-45de-8e1f-64ae54492b2c,692165336,会話終了,,,,,,,,,,,,,,,,,,,,,,,,,,,,,,,,,,,,,,,,nid033_ch3_008,"……ニャんとも驚愕の情報だったニャ。
次の情報更新は、オヌシの実力がさらに
認められて、MRが上がったあとだニャ。","By my whiskers, wasn't that juicy?
I'll update you again once your MR
has increased.","J'en ai les moustaches qui frétillent !
Bref, je t'en dirai plus quand ton RM
aura augmenté.","Per mille baffi, non era interessante?
Quando aumenterai di grado maestro,
ti dirò un altro segreto!","Jetzt bist du baff, was? Mehr Infos gibt
es, sobald sich dein Meisterrang erhöht
hat.","¿A que es una información de primera?
Tendré algo más para ti cuando haya
aumentado tu RM.","Клянусь хвостом, разве это не пикантно?
Как только у вас вырастет РМ, я сообщу
вам новую информацию.","Na moje wąsy, pikantna sprawka, co?
Przekażę ci kolejną miau-formację, gdy
podniesiesz swoją RM.",,,"Pelos meus bigodes, não foi um baque?
Vou te atualizar de novo assim que você
elevar seu RM.","……정말 놀라운 정보다냥.
그럼 다음 정보 갱신은 실력을 더욱 
인정받아 MR이 오른 뒤다냥.","……真是令人震驚的情報喵。
那麼，下一條情報會在
你的實力更受認可，MR上升之後更新喵。","……多喵惊人的情报喵。那么下一次的情报
更新，要等你实力进一步得到认可，大师
等级提升后喵。",,,,,,,,"بالله <LSNR {عليك} {عليكِ}>، أليس هذا مثيرًا؟
<LSNR {سأخبرك} {سأخبركِ}> بآخر التطورات
بمجرد زيادة رتبة القائد الخاصة <LSNR {بك} {بكِ}>.",,,,,,,,,,,
da29f144-92d7-4851-9d2d-a0aa04a6bf28,765780078,,(default)世間話,,,,この会話フラグがONなら→,EV_PRO_MR_004_01_01,,この会話フラグがOFFなら→,EV_PRO_MR_005_01_01,,,,,,,,,,,,,,,,,,,,,,,,,,,,,,,nid033_ch4_000,"ニャンとフカシギ。
謎の情報屋、ただいま参上…だニャ。","It is I, Fukashigi the Informant,
at your service...","C'est moi, Fukashigi l'informateur !
À ton service...","Fukashigi l'informatore,
al tuo servizio...","Ich bin es, Fukashigi der Informant,
zu deinen Diensten...","Soy yo, Fukashigi el informador,
a tu servicio...","Я, Информатор Фукасиги,
к вашим услугам...","To ja, Informator Fukashigi,
do usług...",,,"Sou eu, Fukashigi, o Informante,
ao seu dispor!","의문의 정보상,
후카시기의 등장이다…냥.","奇妙奇喵妙妙妙。
神秘情報商在此登場……喵。","多喵玄又玄。
神秘情报商来也……喵。",,,,,,,,"إنه أنا المخبر فوكاشيجي،
في <LSNR {خدمتك} {خدمتكِ}>...",,,,,,,,,,,
563a1498-4250-43df-bd00-0ecef1ff08e2,3081280386,,,,,,,,,,,,,,,,,,,,,,,,,,,,,,,,,,,,,,,,,nid033_ch4_001,"フム、ではエルガドの
裏情報その４を
オヌシに伝えようではニャいか…。","Very well. I'll impawrt to you the
fourth dirty secret of Elgado...","Très bien, il est temps maintenant de
te révéler le quatrième sombre secret
d'Elgado...","Miaolto bene. Ti svelerò il quarto
segreto di Elgado...","Also gut. Ich verrate dir Elgados
viertes schmutziges Geheimnis...","Muy bien, compartiré contigo el cuarto
turbio secreto de Elgado...","Превосходно. Я сообщу вам четвертый
грязный секрет Элгадо.","Kociastycznie. Za chwilę poznasz czwartą
wstydliwą tajemnicę Elgado...",,,"Muito bem. Vou te contar o quarto
segredinho sujo de Elgado...","흠, 그럼 엘가도의
네 번째 비밀을
자네에게 알려 주겠다냥…","嗯，那就讓吾告訴你
艾爾卡多的第4條秘密情報吧喵……","嗯，那老夫就告诉你
埃尔迦德的内幕消息其四喵……",,,,,,,,"جيد جدًا. <LSNR {سأخبرك} {سأخبركِ}>
بالسر الدفين الرابع لإلجادو...",,,,,,,,,,,
5384ddd4-a5ca-4d42-9a1d-ce41587faef1,3719106152,,,,,,,,,,,,,,,,,,,,,,,,,,,,,,,,,,,,,,,,,nid033_ch4_002,アルロー教官殿は…。,Master Arlow...,Maître Arlow...,Il maestro Arlow...,Arlow...,El maestro Arlow...,Мастер Арлоу...,Mistrz Arlow...,,,Mestre Arlow...,알로 교관님은…,亞爾羅教官大人他……,阿尔洛教官他……,,,,,,,,السيد أرلو...,,,,,,,,,,,
ab8bb998-1b4a-4d4d-9a57-5c48ded50315,2241102387,,,,,,,,,,,,,,,,,,,,,,,,,,,,,,,,,,,,,,,,,nid033_ch4_003,じつは…。,Is in fact...,Vient en fait...,... in realtà...,Stammt tatsächlich...,Nada menos que...,На самом деле...,Tak naprawdę...,,,Na verdade...,사실…,其實……,其实……,,,,,,,,هو في الحقيقة...,,,,,,,,,,,
72c2ad9f-2e67-4276-989e-f6cec1de2f23,677820362,,,,,,,,,,,,,,,,,,,,,,,,,,,,,,,,,,,,,,,,,nid033_ch4_004,ガレアス提督と同郷だった！,"From the same hometown as
Admiral Galleus!",De la même ville que l'amiral Galleus !,"... è nato nello stesso posto
dell'ammiraglio Galleus!",Aus der gleichen Heimatstadt wie Galleus!,¡Es paisano del almirante Galleus!,"Родом из того же города, что и
Адмирал Галлеус!","Pochodzi z tego samego miasta
co Admirał Galleus!",,,"Veio da mesma cidade que o
Almirante Galleus!",갈레아스 제독님과 고향 친구다!,我和加雷亞斯提督是同鄉！,跟加雷亚斯提督是老乡！,,,,,,,,"من نفس مسقط رأس
الأدميرال جاليوس!",,,,,,,,,,,
d7cb837c-4abb-43c1-8acc-febb8ab708a4,3934828917,,,,,,,,,,,,,,,,,,,,,,,,,,,,,,,,,,,,,,,,,nid033_ch4_005,"優等生だったガレアス提督と
やさぐれ者のアルロー教官は
幼い頃からお互いを認め合う親友なのニャ。","Purrize pupil Admiral Galleus and the
vagabond Master Arlow were the best
of fur-iends in their youth, it seems.","L'élève remarquable qu'était l'amiral
Galleus, et Maître Arlow le vagabond
étaient inséparables à l'époque.","Lo stimato ammiraglio Galleus e
l'errante maestro Arlow erano
migliori a-mici da giovani.","Schnurr-Schüler Galleus und der Vagabund
Arlow waren in ihrer Jugend wohl beste
Freunde.","Por lo que parece, el alumno estrella
Galleus y el trotamundos Arlow eran
zarpa y carne en su juventud.","Похоже, лучший ученик Адмирал Галлеус
и бродяга Мастер Арлоу в юности были
лучшими друзьями.","Wydaje się, że Admirał Galleus i
wędrowny Mistrz Arlow byli wielkimi
przyjaciółmi w młodości.",,,"O aluno-estrela Almirante Galleus e o
errante Mestre Arlow eram melhores
amigos na juventude, ao que parece.","우등생이었던 갈레아스 제독님과
불량했던 알로 교관님은
어릴 적부터 서로를 인정한 절친이었다냥.","品學兼優的加雷亞斯提督
和不良分子亞爾羅教官
從小就是互相認同的摯友喵。","品学兼优的加雷亚斯提督，和作风不良的
阿尔洛教官，从小相互欣赏，是好朋友喵。",,,,,,,,"يبدو أن تلميذ الأدميرال جاليوس
والسيد المتشرد أرلو كانا أفضل
صديقين في صباهما.",,,,,,,,,,,
bf375f71-c961-4bf0-b689-ddd49dfcf776,2750440166,,,,,,,,,,,,,,,,,,,,,,,,,,,,,,,,,,,,,,,,,nid033_ch4_006,"でも２人の故郷は、何らかの理由で
すでに滅びてしまっているニャ…。","But fur some reason, their hometown
no longer exists.","Mais pour une raison ou une autre,
leur village natal n'existe plus.","Ma, per qualche miaotivo, la loro città
natale non esiste più.","Aber aus irgendeinem Grund gibt es
ihre Heimatstadt nicht mehr, miau.","Aunque parece que su pueblo ya no
existe, no sé qué pasaría...","Но по какой-то причине, их родного
города больше нет.","Z jakiegoś powodu ich
miasto już nie istnieje.",,,"Mas, por algum motivo, a cidade natal
deles não existe mais.","하지만 둘의 고향은 어떠한 이유로
이미 없어져 버렸다냥.","不過因為一些原因，
他們的故鄉已經滅亡了喵……","不过他们两人的故乡，因为某种原因，已经
不在了喵。",,,,,,,,"لكن لسبب ما، لم يعد مسقط رأسهما
موجودًا.",,,,,,,,,,,
43a82579-1fe9-487a-bcbd-aa8c4d308c28,288380604,,,,,,,,,,,,,,,,,,,,,,,,,,,,,,,,,,,,,,,,,nid033_ch4_007,"その後、２人は王国騎士になり、
狩猟では息ピッタリの
コンビネーションを見せていたニャ。","Then they became hunters, and purroved
to be a purrfect pair, each knowing
exactly what the other was thinking.","Puis ils sont devenus chasseurs.
Ils formaient un couple parfait, chacun sachant
exactement ce que l'autre pensait.","Poi sono diventati cacciatori ed erano
una coppia perrrfetta. Sapevano entrambi
cosa stesse pensando l'altro.","Dann wurden sie Jäger und erwiesen
sich als pfotiges Paar, jeder wusste,
was der andere dachte.","Luego, siendo ya cazadores, hacían la
pareja perfecta, porque cada uno sabía
exactamente lo que pensaba el otro.","Став мяу-хотниками они были идеальными
напарниками, каждый из них точно знал,
о чем думает другой.","Gdy zostali łowcami, miau-kazali się
doskonałą parą. Rozumieli się bez
słów.",,,"Então se tornaram caçadores e formaram o
par perfeito, um sabia exatamente o que
o outro estava pensando.","그 후, 두 사람은 왕국 기사가 되었고
사냥에서는 호흡이 척척 맞는
콤비네이션을 보여 줬다냥.","之後兩人成為了獵人，
狩獵時也展現出默契十足、
合作無間的戰鬥方式喵。","后来，他们两人成了王国猎人，在狩猎中
的配合天衣无缝喵。",,,,,,,,"ثم أصبحا صيادين، وأثبتا
أنهما ثنائي مثالي، وكل منهما يعلم
بالضبط ما يفكر فيه الآخر.",,,,,,,,,,,
31d27407-e8b6-41d3-99e6-f6a530039485,2370312730,,,,,,,,,,,,,,,,,,,,,,,,,,,,,,,,,,,,,,,,,nid033_ch4_008,"悲劇を繰り返さないために
今はそれぞれ提督と教官という立場で
一緒に王国を守っているのニャ。","And today, they work to purr-otect the
Kingdom as admiral and arena master,
so a similar tragedy never occurs again.","Maintenant, ils protègent le Royaume en
tant qu'amiral et maître d'arène, pour
éviter une autre tragédie similaire.","E oggi lavorano come ammiraglio e istruttore
dell'Arena per proteggere il regno ed evitare
che una tragedia simile accada di nuovo.","Heute arbeiten sie als Admiral und Arena-
meister, um das Königreich zu schützen,
um eine neue Tragödie zu verhindern.","Pero ahora protegen el reino, uno como
almirante y otro como maestro de la arena,
para que eso no vuelva a pasar.","И сегодня они стремятся защитить Коро-
левство как адмирал и мастер арены,
чтобы эта трагедия не повторилась.","Dziś służą Królestwu jako admirał
i zarządca areny, aby nic podobnego
się nie powtórzyło.",,,"E, hoje, trabalham para prroteger o
Reino como almirante e mestre de arena,
para que essa tragédia nunca se repita.","비극이 반복되지 않게 하기 위해
두 사람은 제독과 교관이라는 위치에서
지금도 함께 왕국을 지키는 거다냥.","為了避免悲劇再次上演，
他們現在分別以提督和教官的立場
一起守護著王國喵。","为了不让悲剧重演，他们一个当提督，
一个当教官，现在也在一起保卫王国喵。",,,,,,,,"واليوم، يعملان على حماية المملكة
بصفتهما أدميرالًا وزعيمًا للساحة،
حتى لا تحدث مأساة مثل هذه مرة أخرى أبدًا.",,,,,,,,,,,
bfb211be-7c3e-4f6e-817a-9dcea3240bbc,2386586488,会話終了,,,,,,,,,,,,,,,,,,,,,,,,,,,,,,,,,,,,,,,,nid033_ch4_009,"……ニャんとも驚愕の情報だったニャ。
次の情報更新は、オヌシの実力がさらに
認められて、MRが上がったあとだニャ。","By my whiskers, wasn't that juicy?
I'll update you again once your MR
has increased.","J'en ai les moustaches qui frétillent !
Bref, je t'en dirai plus quand ton RM
aura augmenté.","Per mille baffi, non era interessante?
Quando aumenterai di grado maestro,
ti dirò un altro segreto!","Jetzt bist du baff, was? Mehr Infos gibt
es, sobald sich dein Meisterrang erhöht
hat.","¿A que es una información de primera?
Tendré algo más para ti cuando haya
aumentado tu RM.","Клянусь хвостом, разве это не пикантно?
Как только у вас вырастет РМ, я сообщу
вам новую информацию.","Na moje wąsy, pikantna sprawka, co?
Przekażę ci kolejną miau-formację, gdy
podniesiesz swoją RM.",,,"Pelos meus bigodes, não foi um baque?
Vou te atualizar de novo assim que você
elevar seu RM.","……정말 놀라운 정보다냥.
그럼 다음 정보 갱신은 실력을 더욱 
인정받아 MR이 오른 뒤다냥.","……真是令人震驚的情報喵。
那麼，下一條情報會在
你的實力更受認可，MR上升之後更新喵。","……多喵惊人的情报喵。那么下一次的情报
更新，要等你实力进一步得到认可，大师
等级提升后喵。",,,,,,,,"بالله <LSNR {عليك} {عليكِ}>، أليس هذا مثيرًا؟
<LSNR {سأخبرك} {سأخبركِ}> بآخر التطورات
بمجرد زيادة رتبة القائد الخاصة <LSNR {بك} {بكِ}>.",,,,,,,,,,,
eff81a90-7b34-4744-9771-4cb674e31003,180829641,,(default)世間話,,,,この会話フラグがONなら→,EV_PRO_MR_005_01_01,,この会話フラグがOFFなら→,EV_PRO_MR_006_01_01,,,,,,,,,,,,,,,,,,,,,,,,,,,,,,,nid033_ch5_000,"ニャンとフカシギ。
謎の情報屋、ただいま参上…だニャ。","It is I, Fukashigi the Informant,
at your service...","C'est moi, Fukashigi l'informateur !
À ton service...","Fukashigi l'informatore,
al tuo servizio...","Ich bin es, Fukashigi der Informant,
zu deinen Diensten...","Soy yo, Fukashigi el informador,
a tu servicio...","Я, Информатор Фукасиги,
к вашим услугам...","To ja, Informator Fukashigi,
do usług...",,,"Sou eu, Fukashigi, o Informante,
ao seu dispor!","의문의 정보상,
후카시기의 등장이다…냥.","奇妙奇喵妙妙妙。
神秘情報商在此登場……喵。","多喵玄又玄。
神秘情报商来也……喵。",,,,,,,,"إنه أنا المخبر فوكاشيجي،
في <LSNR {خدمتك} {خدمتكِ}>...",,,,,,,,,,,
a12c3a48-fb59-4b89-93d3-e508fb8259d6,1690682024,,,,,,,,,,,,,,,,,,,,,,,,,,,,,,,,,,,,,,,,,nid033_ch5_001,"フム、ではエルガドの
裏情報その５を
オヌシに伝えようではニャいか…。","Very well. I'll impawrt to you the
fifth dirty secret of Elgado...","Très bien, il est temps maintenant de
te révéler le cinquième sombre secret
d'Elgado...","Miaolto bene. Ti svelerò il quinto segreto
di Elgado...","Also gut. Ich verrate dir Elgados
fünftes schmutziges Geheimnis...","Muy bien, compartiré contigo el quinto
turbio secreto de Elgado...","Превосходно. Я сообщу вам пятый
грязный секрет Элгадо.","Kociastycznie. Za chwilę poznasz piątą
wstydliwą tajemnicę Elgado...",,,"Muito bem. Vou te contar o quinto
segredinho sujo de Elgado...","흠, 그럼 엘가도의
다섯 번째 비밀을
자네에게 알려 주겠다냥…","嗯，那就讓吾告訴你
艾爾卡多的第5條秘密情報吧喵……","嗯，那老夫就告诉你
埃尔迦德的内幕消息其五喵……",,,,,,,,"جيد جدًا. <LSNR {سأخبرك} {سأخبركِ}>
بالسر الدفين الخامس لإلجادو...",,,,,,,,,,,
3a73933d-1c55-49df-a1d4-5017dfb7047e,3485101040,,,,,,,,,,,,,,,,,,,,,,,,,,,,,,,,,,,,,,,,,nid033_ch5_002,雑貨屋のオボロ殿は…。,Oboro the Merchant...,Oboro le marchand...,Oboro il mercante...,Oboro der Händler...,Oboro el mercader...,Торговец Оборо...,Kupiec Oboro...,,,"Oboro, o mercador...",잡화점의 오보로 공은…,雜貨店的朧大人他……,杂货商胧大人他……,,,,,,,,أوبورو التاجر...,,,,,,,,,,,
cb41b483-82ed-4e86-b415-db3a6f5a30c6,1871327690,,,,,,,,,,,,,,,,,,,,,,,,,,,,,,,,,,,,,,,,,nid033_ch5_003,じつは…。,Is really...,Est en fait...,... in realtà è...,... ist in Wirklichkeit...,Esto te va a pillar por sorpresa...,На самом деле...,Naprawdę...,,,"É, na verdade...",사실…,其實……,其实……,,,,,,,,إنه حقًا...,,,,,,,,,,,
999c245f-0b7f-4a14-9aea-88d083633853,433144100,,,,,,,,,,,,,,,,,,,,,,,,,,,,,,,,,,,,,,,,,nid033_ch5_004,狩猟の腕は超・一流！,A furst-class hunter!,Un chasseur de renom !,... un cacciatore miaolto bravo!,"Ein erstklassiger Jäger, miau!",¡Es un cazador de primera!,Первоклассный мяу-хотник!,Jest pierwszej klasy łowcą!,,,Um caçador de prrrmeira classe!,초일류의 사냥 실력을 가졌다냥!,有著非常高超的狩獵本領！,狩猎技术超一流！,,,,,,,,<LSNR {صياد} {صيادة}> من الطراز الأول!,,,,,,,,,,,
5bef5630-62af-45a6-a36c-17ecf995bbaa,3970416467,,,,,,,,,,,,,,,,,,,,,,,,,,,,,,,,,,,,,,,,,nid033_ch5_005,"ケガをするのもさせるのも怖いから
狩猟はできないと言っているオボロ殿、
本当は超・一流の才能を持っているニャ。","Oboro claims not to hunt as he objects
to taking the life of any creature.
But in truth, he's an expurrt hunter!","Oboro proclame ne pas chasser car il
refuse d'ôter la vie d'un être vivant.
Mais en vrai, c'est un super chasseur !","Oboro non vuole cacciare perché non
vuole uccidere nessuna creatura.
Ma in realtà, è un cacciatore esperto.","Oboro behauptet, nicht zu jagen, weil er
gegen das Töten von Kreaturen ist. Aber
in Wahrheit ist er ein pfotiger Jäger!","Dice que no caza porque está en contra
de matar, ¡pero en realidad está hecho
un cazador de lo más minino!","Оборо говорит, что не охотится, потому
что не хочет убивать живых существ.
Но на самом деле он опытный мяу-хотник!","Oboro mówi, że nie poluje, bo nie chce
zabijać żadnego stworzenia. Ale tak
naprawdę jest wybitnym łowcą!",,,"Oboro diz que não caça por ser contra
tirar a vida de qualquer criatura. Mas,
na verdade, é um ótimo caçador!","상처를 입는 것도 입히는 것도 싫어
사냥은 하지 못하겠다는 오보로 공은
사실 초일류의 재능을 지녔다냥.","雖然朧大人說不喜歡受傷，
也不喜歡使別人受傷，才不會去狩獵，
但他其實有著超一流的狩獵才能喵。","胧大人害怕伤人，也害怕受伤，所以才说自己
不能狩猎，其实他技艺过人喵。",,,,,,,,"يدعي أوبورو أنه لا يذهب للصيد فهو 
يعترض على قتل أي مخلوق.
لكن في الحقيقة، هو صياد خبير!",,,,,,,,,,,
