guid,crc?,<PageAttr>,<TalkAttr>,<VillageProgress>,<HallProgress>,<HunterRank>,<TalkTag>,<TalkTagParam>,<TalkTagComment>,<TalkTag>,<TalkTagParam>,<TalkTagComment>,<TalkTag>,<TalkTagParam>,<TalkTagComment>,<TalkTag>,<TalkTagParam>,<TalkTagComment>,<TalkTag>,<TalkTagParam>,<TalkTagComment>,<TalkTag>,<TalkTagParam>,<TalkTagComment>,<TalkTag>,<TalkTagParam>,<TalkTagComment>,<TalkTag>,<TalkTagParam>,<TalkTagComment>,<TalkTag>,<TalkTagParam>,<TalkTagComment>,<TalkAction1>,<TalkAction1Param>,<TalkAction1Comment>,<TalkAction2>,<TalkAction2Param>,<TalkAction2Param2>,<TalkAction2Comment>,entry name,Japanese,English,French,Italian,German,Spanish,Russian,Polish,Dutch,Portuguese,PortugueseBr,Korean,TraditionalChinese,SimplifiedChinese,Finnish,Swedish,Danish,Norwegian,Czech,Hungarian,Slovak,Arabic,Turkish,Bulgarian,Greek,Romanian,Thai,Ukrainian,Vietnamese,Indonesian,Fiction,Hindi,LatinAmericanSpanish
126ec74b-91fb-4617-9143-49ea7588abaf,1296685692,,(default)世間話,,集会所進行☆6,,この会話フラグがOFFなら→,EV_PRO_HALL_007_01_01,,このクエストがクリア済みなら→,QN010603,,,,,,,,,,,,,,,,,,,,,,,,,,,,,,nid025_h6_008,"おっ、<PL>。
イブシマキヒコを撃退したかニャ。
よくやったニャ。","Ah, <PL>.
You defeated Ibushi, didn't you?
Excellent.","Ah, <PL>. Tu as vaincu
l'Ibushi, n'est-ce pas ? Bravo !","Ah, <PL>.
Hai sconfitto l'Ibushi, vero? Ottimo!","Ah, <PL>!
Du hast Ibushi also besiegt?
Exzellent.","Ah, <PL>.
Derrotaste a Ibushi, ¿verdad?
Miaugnífico.","А, <PL>.
Ты <LSNR {победил} {победила}> Ибуси, ведь так?
Отлично.","Ach, <PL>.
<LSNR {Pokonałeś} {Pokonałaś}> Ibushiego, prawda?
Doskonale.",,,"Ah, <PL>.
Você derrotou a Ibushi, não foi?
Miaugnífico.","오, <PL>.
이부시마키히코를 격퇴한 거냥?
잘했다냥.","啊，<PL>。
你成功擊退風神龍啦喵，
幹得漂亮喵。","哦，<PL>。
你击退风神龙了喵。
干得漂亮喵。",,,,,,,,"آه يا <PL>.
لقد <LSNR {هزمت} {هزمتِ}> إيبوشي،
أليس كذلك؟ ممتاز.",,,,,,,,,,,
d1ca1c8e-ae52-4121-a33d-ca290f62bec2,2656329208,,,,,,,,,,,,,,,,,,,,,,,,,,,,,,,,,,,,,,,,nid025_h6_009,"ヤツに深手を負わせたんだニャ？　まさか
イブシマキヒコのそばに、ワシのような
名医はおらんじゃろうから、大丈夫ニャ。","Gave it one heck of a bruising too,
I hear. And I highly doubt Ibushi has
a doctor as good as I it can count on.","Il paraît que tu lui as mis une sacrée
raclée. Et je doute que l'Ibushi ait un
docteur aussi doué que moi.","Gli hai pure lasciato qualche livido.
Dubito che l'Ibushi abbia un dottore
bravo come me su cui poter contare.","Und ihm dabei noch mächtig zugesetzt.
Ich glaube nicht, dass Ibushi einen so
guten Arzt wie mich hat.","He oído que le diste una buena tunda.
Y dudo mucho que Ibushi cuente con un médico
tan bueno como yo.","И трепку ему <LSNR {задал} {задала}> хорошую,
говорят. А у Ибуси, поди, нет такого
хорошего врача, как я.","Ponoć nieźle go <LSNR {poturbowałeś} {poturbowałaś}>.
Wątpię, czy Ibushi ma tak dobrego
lekarza jak ja.",,,"Também ouvi dizer que a briga foi feia
pro lado dela. E eu duvido muito que a
Ibushi tenha um médico bom como eu.","녀석에게 큰 상처를 입혔다고 들었다냥.
이부시마키히코에게는 나 같은
명의가 없을 테니 괜찮을 거다냥.","你讓牠受到重傷了喵？
我想風神龍身邊應該沒有
跟老夫一樣厲害的名醫，你就放心吧喵。","你重创了它喵？
风神龙的身边总不会有老夫这种名医，
不要担心喵。",,,,,,,,"<LSNR {سددت} {سددتِ}> إليه لكمة شديدة أيضًا،
كما سمعت. وأنا أشك بشدة في أن لدى
إيبوشي طبيبًا مثلي يمكنه الاعتماد عليه.",,,,,,,,,,,
60a0a80a-e30a-479f-8751-db1655df44ae,729518295,,,,,,,,,,,,,,,,,,,,,,,,,,,,,,,,,,,,,,,,nid025_h6_010,"そんなことよりも、
ヒノエの共鳴が治まったのが一番だニャ。","But more importantly, Hinoa seems
to have made a full recovery.","Et le plus important dans tout ça, c'est
que Hinoa est de nouveau sur pied.","Ma soprattutto, Hinoa sembra essersi
ripresa completamente.","Aber noch wichtiger ist, dass Hinoa sich
wieder vollständig erholt hat.","Pero lo que es más importante es que parece
que Hinoa se ha recuperado por completo.","Что еще важнее, Хиноа, кажется,
поправилась.","Najważniejsze, że Hinoa
całkowicie wyzdrowiała.",,,"Mas, acima de tudo, parece que a Hinoa
se recuperou completamente.","그런 것보다 히노에의
공명이 진정돼서 다행이다냥.","而且更重要的是，
火芽的共鳴已經不再發生了，
真是太好了喵。","先不说这个了，
火芽的共鸣治好了才是最大的喜事喵。",,,,,,,,"لكن الأهم من ذلك، يبدو
أن هينوا قد تعافت تمامًا.",,,,,,,,,,,
3b74eecb-8705-4b2a-958c-72d5cb593b1e,3433004641,会話終了,,,,,,,,,,,,,,,,,,,,,,,,,,,,,,,,,,,,,,,nid025_h6_011,"お前さんは、ワシより名医かもしれんニャ。
にょほほ。","Why, you might be an even
better doctor than I am!","Chapristi ! T'as songé à devenir
docteur ? T'as du potentiel... Peut-être
même plus que moi.","Diamine, potresti essere un dottore
migliore di me!","Mensch, vielleicht bist du ein noch
besserer Arzt als ich!","Por mis bigotes, igual se te da la medicina
mejor que a mí.","Ого, да ты, небось,
врач получше меня.","Może nawet będziesz
<LSNR {lepszym lekarzem} {lepszą lekarką}> ode mnie!",,,"Se brincar, você é melhor que eu
nesse negócio de miaudicina.","너는 나보다도 명의일지도 모르겠다냥.
뇨호호.","也許你是比老夫更厲害的名醫呢喵，
喵呵呵。","你可能是比老夫还高明的医生喵。
喵呵呵。",,,,,,,,"لذلك، قد <LSNR {تكون طبيبًا} {تكونين طبيبة}>
أفضل مني حتى!",,,,,,,,,,,
2ce1420c-3e13-47db-b71c-f117691f8b07,945225072,,(default)世間話,,集会所進行☆7,,この会話フラグがOFFなら→,EV_PRO_VDEMO_0006,,この会話フラグがONなら→,EV_PRO_HALL_007_01_01,,,,,,,,,,,,,,,,,,,,,,,,,,,,,,nid025_h7_000,"ヒノエの共鳴が治まったかと思ったら
今度はミノトの共鳴だニャ。
名医は大忙しだニャ。","Just when Hinoa looks to be in the
clear, Minoto goes and resonates too.
*sigh* A doctor's work is never done.","Et juste quand Hinoa a repris du poil de
la bête, Minoto se met à résonner. Aaah,
j'arriverai pas à me reposer...","Hinoa si è ripresa, ma ora anche Minoto
è entrata in risonanza. Uff... Noi dottori
abbiamo sempre un gran daffare.","Kaum ist es Hinoa wieder auf den Beinen,
fängt Minoto auch mit dem Verbinden an.
Uff, für einen Arzt gibt es immer was zu tun.","Justo cuando Hinoa parecía a salvo,
Minoto comienza a resonar también. Ay...
Las penas del médico jamás tienen fin.","Стоило Хиноа поправиться, как у Миното
тоже начался резонанс.
*вздох* Врачу и отдохнуть некогда.","Ledwie Hinoa wydobrzała,
to Minoto zaczęła rezonować.
Ach... lekarz nigdy nie odpoczywa...",,,"Foi só a Hinoa sair da zona de perigo
que a Minoto resolveu ressoar também.
Ai, ai... Médicos não têm descanso...","히노에의 공명이 나은 줄 알았더니
이번에는 미노토가 공명을 시작했다냥.
명의는 바쁘다냥.","才以為火芽的共鳴問題已經解決了，
結果這次輪到水藝發生共鳴了喵。
名醫總是沒有忙完的一天啊喵。","火芽的共鸣刚好，
这次又到水芸共鸣了喵。
名医忙得不可开交喵。",,,,,,,,"بمجرد أن تبدو هينوا سالمة،
تبدأ مينوتو في ترديد الصدى أيضًا.
*تنهيدة* لا ينتهي عمل الطبيب أبدًا.",,,,,,,,,,,
a96fc83e-df2b-4795-bbe2-cd2d6323cd82,2304701521,,,,,,,,,,,,,,,,,,,,,,,,,,,,,,,,,,,,,,,,nid025_h7_001,"いや、ワシは非っ常～に真面目に
症状を見たり薬の調合をしたりと
色々してやっとるんだがニャ…。","I've been doing what I can to
identify her symptoms and
treat them accordingly, but...","J'ai fait ce que j'ai pu pour identifier
ses symptômes et la soigner en
conséquence, mais...","Ho fatto tutto il possibile per identificare i
sintomi e curarli, ma...","Ich versuche alles, um ihre Symptome
zu identifizieren und entsprechend zu
behandeln, aber...","He estado haciendo lo posible por identificar
sus síntomas y tratarlos en consecuencia,
pero no ha habido suerte...","Я делаю все, что могу, чтобы опознать
симптомы и назначить лечение,
но...","Robię, co mogę, by ją zdiagnozować
i przepisać odpowiednią kurację, ale...",,,"Tô fazendo tudo ao meu alcance pra
identificar os sintomas dela e tratá-los
da melhor forma, mas...","아니, 나는 굉장히 진지하게
증상을 보거나, 약을 조합해 보기도 하고
여러 방면으로 노력은 하고 있는데냥…","不過啊，老夫雖然非～常努力
在觀察她的症狀、調配藥物，
做了不少努力喵……","哎，老夫是兢兢业业地
又诊断症状，又配药，
做了不少事喵……",,,,,,,,"كنت أفعل ما بوسعي
لتحديد أعراضها وعلاجها وفقًا
لذلك، لكن...",,,,,,,,,,,
1ffbee3e-960c-43cd-8de1-efa42380bd1f,3627046025,,,,,,,,,,,,,,,,,,,,,,,,,,,,,,,,,,,,,,,,nid025_h7_002,"ミノトのヤツ、妙に元気なんだニャ。
姉と同じ力を得たのが
よほど嬉しいらしいニャ。","Minoto's been oddly cheerful—
happy to have the same powers
as her sister, apparently.","Minoto est étonnamment de bonne humeur.
C'est peut-être le fait d'avoir les
mêmes pouvoirs que sa sœur...","Minoto è stranamente allegra. Sembra contenta
di avere la stessa abilità di sua sorella.","Minoto ist merkwürdig fröhlich... Sie freut
sich scheinbar darüber, dieselben Kräfte
wie ihre Schwester zu haben.","Minoto está extrañamente alegre, como si
estuviera encantada de tener los mismos
poderes que su hermana.","Миното на удивление радостна.
Наверное, ей приятно иметь ту же
способность, что у сестры.","Minoto jest dziwnie wesoła. Jakby
uszczęśliwiona, że ma takie same
moce jak jej siostra.",,,"Por incrível que pareça, a Minoto tá
animada por ter poderes assim
como a irmã dela.","미노토 녀석, 이상하게 기운이 넘친다냥.
언니와 같은 힘을 얻은 게
굉장히 기쁜 것 같다냥.","但水藝那孩子卻反而很有活力喵。
能夠得到跟姊姊相同的力量，
似乎讓她感到很開心喵。","水芸那丫头却精神得出奇喵。
有了和姐姐一样的力量，
她好像心花怒放了喵。",,,,,,,,"كانت مينوتو مبتهجة بطريقة غريبة—
يبدو أنها سعيدة لتمتعها بقوى
أختها نفسها.",,,,,,,,,,,
78beced4-61f8-4666-9f75-5a15cd3cdfed,64651639,会話終了,,,,,,,,,,,,,,,,,,,,,,,,,,,,,,,,,,,,,,,nid025_h7_003,"アヤツの考えることはようわからんニャ…。
ま、あとでまた薬を持っていってやるニャ。","Can't say I get it, but...oh well.
I'll give her some more medicine later.","J'ai un peu de mal à comprendre, mais
bon... Je lui donnerai plus de
médicaments tout à l'heure.","Non capisco, ma... Vabbè, le darò un'altra
medicina più tardi.","Kann nicht behaupten, dass ich das verstehe,
aber... was soll's. Nachher bekommt sie noch
etwas Medizin.","La verdad es que no lo entiendo, pero en fin.
Luego le daré algo más de medicina.","Не очень я это понимаю, ну да ладно.
Дам ей попозже лекарства.","Nie bardzo to rozumiem, ale cóż...
Później zaaplikuję jej lekarstwo.",,,"Não posso dizer que entendo, mas...
fazer o quê. Mais tarde eu dou
outra dose de remédio a ela.","미노토는 대체 무슨 생각을 하는 건지…
나중에 약이라도 또 들고 가겠다냥.","真搞不懂那孩子在想什麼喵……
算了，老夫等等會再送藥過去喵。","老夫不太懂那丫头的心思喵……
算了，之后再送药给她喵。",,,,,,,,"لا أجزم أنني فهمت ذلك، لكن...أوه حسنًا.
سأعطيها المزيد من الأدوية لاحقًا.",,,,,,,,,,,
b0f3981d-f0ac-4938-a0bf-9353dcfff4a6,2974877093,,(default)世間話,,集会所進行☆7,,このクエストが未クリアなら→,QN010702,,この会話フラグがONなら→,EV_PRO_VDEMO_0006,,,,,,,,,,,,,,,,,,,,,,,,,,,,,,nid025_h7_004,"<PL>、よく聞くにゃ。
とにかく無事で帰ってくるニャ。","Listen, <PL>. Just...
Come back in one piece, ya hear?","Écoute, <PL>... Essaie...
Essaie juste de revenir en un seul
morceau, d'accord ?","Ehi, <PL>.
Torna <LSNR {tutto} {tutta}> <LSNR {intero} {intera}>, OK?","Hör mal, <PL>. Komm...
Komm einfach in einem Stück wieder, okay?","Escúchame, <PL>.
Tienes que volver de una pieza, ¿queda claro?","Слушай, <PL>. Ты...
береги себя, ладно?","Słuchaj, <PL>. Nooo...
Wróć w jednym kawałku, słyszysz?",,,"Olha, <PL>. Só tenta...
voltar <LSNR {inteiro} {inteira}>, combinado?","<PL>, 잘 들어라냥.
무조건 무사히 돌아오는 거다냥.","<PL>，仔細聽我說喵，
不管怎麼樣，你都要平安地回來喔喵。","<PL>，听好了喵。
总之你要平安地回来喵。",,,,,,,,"<LSNR {اسمع} {اسمعي}> يا <PL>.
<LSNR {عُد سالمًا} {عودي سالمة}>، اتفقنا؟",,,,,,,,,,,
adcf39ce-f590-4ce1-ad34-96588413eedf,721334616,,,,,,,,,,,,,,,,,,,,,,,,,,,,,,,,,,,,,,,,nid025_h7_005,"ちょっとくらいならケガしてもいいニャ。
このワシが、ちょちょいのちょーいと
治してやるニャ！","Only small injuries are permissible, as
I merely have to work my medical magic
on them and you'll be as right as rain.","Pas plus que des petites égratignures,
d'accord ? Comme ça j'ai pas besoin de
trop en faire pour te rafistoler.","Posso accettare solo le piccole ferite. Su
quelle posso usare il mio tocco magico,
e tornerai subito in forma.","Kleine Blessuren sind akzeptabel, die bekomm
ich mit meinen üblichen medizinischen Zauber-
tricks ratzkatz wieder hin.","Solo te consiento que vengas con alguna que
otra herida pequeña, ¿eh? Así podré curarlas
usando magia sanadora y listo.","Разрешаю тебе получать только небольшие
травмы, чтобы моя помощь была
почти что и не нужна.","Dopuszczam tylko niewielkie skaleczenia.
Wystarczy, że użyję kilku lekarskich
sztuczek i będziesz <LSNR {zdrów} {zdrowa}> jak ryba.",,,"Só arranhõezinhos são permitidos, que aí
eu faço minha mágica neles e
você fica <LSNR {novinho em folha} {novinha em folha}>.","조금 다쳐도 괜찮다냥.
내가 순식간에
다 고쳐주겠다냥!","就算受點小傷也無所謂喵。
區區小傷，老夫只需
三兩下工夫就能治好了喵！","受点小伤也无妨喵。
老夫在此，
轻轻松松就可以帮你治好喵！",,,,,,,,"لا أسمح سوى بالجروح الطفيفة،
حيث لا أحتاج سوى لاستخدام سحري
الطبي عليها و<LSNR {ستتعافى} {ستتعافين}> كليًا.",,,,,,,,,,,
1d741b5c-c882-4197-8c0e-e5402b0e12f1,1246844721,会話終了,,,,,,,,,,,,,,,,,,,,,,,,,,,,,,,,,,,,,,,nid025_h7_006,"わかったなら、よしニャ！
気をつけて行ってくるニャよ！","Got it? Good. Off you go, then!",Compris ? Très bien... File !,Tutto chiaro? Bene. Ora vai!,"Alles andere ist tabu. Verstanden?
Dann mach dich auf den Weg!","¿Entendido? Bien. Ea, ¡y ve por la sombra!","Все понятно? Отлично.
Ну, иди!",Jasne? Dobrze. Ruszaj zatem!,,,Entendido? Ótimo. Agora vá-se embora!,"이거면 알면 된다냥!
조심히 다녀와라냥!","總之你明白就行了喵！
路上小心喵！","明白就好喵！
路上小心喵！",,,,,,,,مفهوم؟ جيد. <LSNR {انطلق} {انطلقي}> إذن!,,,,,,,,,,,
9134bc0d-1831-458d-b66e-3a90a2e04f3c,3375518663,,(default)世間話,,集会所進行☆7以上,,この会話フラグがOFFなら→,EV_PRO_HALL_008_02_01,,このクエストがクリア済みなら→,QN010702,,,,,,,,,,,,,,,,,,,,,,,,,,,,,,nid025_h7_007,"まさか、ヒノエとミノトが同時に
共鳴するとはニャ…。まったく、
名医に休息の時は来ないのかニャ。","I never expected both Hinoa and Minoto
to start resonating at the same time.
No rest for the weary ol' doc, eh?","J'aurais jamais imaginé que Minoto et
Hinoa se mettent à résonner en même
temps. Pas de repos pour le toubib...","Non mi aspettavo che Hinoa e Minoto
entrassero in risonanza allo stesso
tempo. Non ho un attimo di tregua, eh?","Ich hätte nie gedacht, dass Hinoa und
Minoto sich gleichzeitig verbinden.
Einem Arzt wird keine Pause gegönnt.","Jamás habría esperado que Hinoa y Minoto
comenzaran a resonar simultáneamente.
Nada, que no tengo tiempo para descansar...","Не ожидал я, что Хиноа и Миното обе
разом начнут резонировать. И не
отдохнуть старому доктору, а?","Zaskoczyło mnie, że Hinoa i Minoto
rezonują teraz jednocześnie. Nie ma
odpoczynku dla starego lekarza, co?",,,"Nunca imaginei que Hinoa e Minoto fossem
começar a ressoar ao mesmo tempo.
Vida de médico não é moleza...","설마 히노에와 미노토가 동시에
공명할 줄은 몰랐다냥… 나 참.
명의는 쉴 시간도 없다냥.","沒想到火芽和水藝會同時發生共鳴喵……
真受不了，難道對名醫來說
連休息都是一種奢侈了嗎喵。","没想到火芽和水芸会同时共鸣喵……
唉，就不让名医休息休息喵。",,,,,,,,"لم أتوقع أبدًا أن تبدأ كلٌّ من هينوا
ومينوتو بترديد الصدى سويًا. لا توجد
راحة للطبيب المرهق، هاه؟",,,,,,,,,,,
f3e12c8b-824b-423f-926d-af869f5968e5,296042573,,,,,,,,,,,,,,,,,,,,,,,,,,,,,,,,,,,,,,,,nid025_h7_008,"とはいえ、ワシの薬のおかげで
２人の症状も、多少はマシに！
………なってるはずニャ。…たぶんニャ。","Still, my medicine shall alleviate
their more troubling symptoms. Well,
it should do...a little. Hopefully.","Au moins, mes médicaments devraient
atténuer leurs pires symptômes. Enfin...
J'espère.","Le mie cure dovrebbero alleviare i sintomi
più preoccupanti. Beh, dovrebbe
bastare... spero.","Aber meine Medizin sollte ihre
schlimmeren Symptome lindern. Ein
wenig zumindest... Hoffentlich hilft es.","Mi medicina aliviará los síntomas más serios.
Bueno... Al menos un poquito. Espero.","Но все ж мое лекарство снимет самые
опасные симптомы. Ну, должно.
По идее...","Moje lekarstwo załagodzi bardziej
niepokojące objawy. Cóż, to
powinno wystarczyć. Mam nadzieję.",,,"Ainda assim, meu remédio deve aliviar
grande parte dos sintomas delas.
Bom, pelo menos um pouco. Espero.","그래도 내 약 덕분에 두 사람의
증상도 조금은 나아졌을 거다냥!
………아마도냥.","但話說回來，也是多虧有老夫的藥，
她們兩個的症狀才能多少獲得舒緩！
………一定是這樣喵……大概吧喵。","不过，有老夫的灵药在，
她们俩的症状也多少有好转了！
……应该是喵……大概是喵。",,,,,,,,"ومع ذلك، سيخفف دوائي أعراضهما
الأكثر سوءًا. حسنًا،
يجب أن تفعل...القليل. أتمنى.",,,,,,,,,,,
0ad030f1-8533-4119-8078-f7be282a2716,3920804673,,,,,,,,,,,,,,,,,,,,,,,,,,,,,,,,,,,,,,,,nid025_h7_009,"ワシも引き続き治療方法を探してはみるが、
イブシマキヒコとナルハタタヒメ、
こっちは、お前さんの仕事だニャ。","I'll do everything I can to find a cure,
but I'm afraid I'll have to leave
trouncing Ibushi and Narwa to you.","Je vais faire mon possible pour trouver
un remède, mais je compte sur toi
pour t'occuper de l'Ibushi et de la Narwa.","Farò tutto il possibile per trovare una cura,
ma temo che dovrai occuparti tu di
sconfiggere l'Ibushi e la Narwa.","Ich versuche, ein Heilmittel zu finden.
Aber den Sieg gegen Narwa und Ibushi
muss ich dir überlassen.","Haré todo lo posible por encontrar una cura,
pero Ibushi y Narwa son cosa tuya.","Я сделаю все, чтобы найти лекарство, но,
боюсь, что бой с Ибуси и Нарвой
останется тебе.","Postaram się znaleźć lekarstwo.
Obawiam się, że lepiej będzie, jak
ty spuścisz łomot Ibushiemu i Narwie.",,,"Vou fazer de tudo pra descobrir uma
cura, mas acho que vou ter que deixar a
briga com Ibushi e Narwa nas suas patas.","나도 계속해서 치료 방법을 찾아 보겠지만
이부시마키히코와 나루하타타히메는
네가 맡아줘야 한다냥.","老夫會繼續尋找治療方法的。
至於對付風神龍和雷神龍，
就是你的工作了喵。","老夫也会继续找治疗方法，
但风神龙和雷神龙那边，
就是你的任务了喵。",,,,,,,,"سأفعل كل ما بوسعي لإيجاد علاج،
ولكن أخشى أنني سأضطر إلى ترك هزيمة إيبوشي
وناروا الشنيعة <LSNR {لك} {لكِ}>.",,,,,,,,,,,
50cbdc4b-10f1-4aaa-831e-a219996e16da,1812073038,会話終了,,,,,,,,,,,,,,,,,,,,,,,,,,,,,,,,,,,,,,,nid025_h7_010,頼んだニャ！,"Don't let us down, now!","Nous avons foi en toi, alors...
Nous déçois pas !",Contiamo su di te!,Enttäusch uns jetzt nicht!,¡Así que no nos defraudes!,Не подведи же нас!,Nie zawiedź nas teraz!,,,"Não nos decepcione, hein!",잘 부탁한다냥!,拜託你了喵！,看你的了喵！,,,,,,,,لا <LSNR {تخذلنا} {تخذلينا}>، الآن!,,,,,,,,,,,
e2beb612-c019-4f06-8052-b8ee78aa4502,2569572926,,(default)世間話,,集会所進行☆7EX,,この会話フラグがOFFなら→,EV_PRO_HALL_008_05_01,,この会話フラグがONなら→,EV_PRO_HALL_008_02_01,,,,,,,,,,,,,,,,,,,,,,,,,,,,,,nid025_h7_011,"ふぁ～あ。まったく、この里の者たちは
毎日毎日よう働くニャ。皆、もうちょっと
休んだほうがいいと思うニャ。","*yawn* The folks in this village
work so hard. But in my opinion,
a little time off never hurts.","*bâille* Les gens travaillent tellement
dur dans ce village. Mais ça fait pas de
mal de se la couler douce parfois.","Yawn! La gente del villaggio lavora sodo,
ma, per quanto mi riguarda, un po'
di riposo non guasta.","*gähn* Die Dörfler geben sich so viel
Mühe. Aber eine Pause kann nie schaden.","La gente de esta aldea trabaja muchísimo.
Pero, en mi opinión, tomarse un tiempo para
descansar es vital. Uaaah... Ya tengo sueño.","*зевает* Местные жители так упорно
трудятся... Но небольшой отдых,
мне кажется, никому не повредит.","Zieeew... Mieszkańcy wioski
tak ciężko pracują. Według mnie
trochę odpoczynku nie zaszkodzi.",,,"Uaaah... O povo dessa aldeia trabalha
muito, mas eu mesmo acho que um
tempinho de folga não faz mal a ninguém.","흐아암~ 나 참. 이 마을 사람들은
매일같이 열심히 일한다냥.
다들 좀 쉬엄쉬엄해도 좋을 거 같다냥.","呼啊～真是的，這座村莊的村民們
每天都這麼認真地工作喵。
老夫覺得大家應該多休息一點比較好喵。","呼～啊。唉，这座村子的人
每一天都在辛勤工作喵。
老夫认为大家应该多休息休息喵。",,,,,,,,"*تثاؤب* يعمل الناس في
هذه القرية بجد. لكن في رأيي،
لن تضر الاستراحة لبعض الوقت أبدًا.",,,,,,,,,,,
9a4fdb90-69d4-4243-a08b-2dc1700495c4,3315095662,,,,,,,,,,,,,,,,,,,,,,,,,,,,,,,,,,,,,,,,nid025_h7_012,"<PL>、お前もだニャ。
たまにはもっとのんびりするニャ。","That goes for you too, <PL>.
Try taking things slow sometimes.","Tu devrais en prendre de la graine,
<PL>. Détends-toi un peu.","Vale anche per te, <PL>.
Prova a prendertela con più calma.","Das gilt auch für dich, <PL>!
Gönn dir hin und wieder eine Auszeit.","Eso va también por ti, <PL>.
Gestiona bien tu tiempo para echarte alguna
siesta de vez en cuando.","И тебя это касается, <PL>.
Старайся иногда сбавлять темп.","Ciebie też się to tyczy, <PL>.
Zwolnij czasem, dobra?",,,"Isso também vale pra você, <PL>.
Tente levar a vida com mais calma.","<PL>, 너도 마찬가지다냥.
가끔은 느긋하게 지내라냥.","<PL>，你也一樣喵。
偶爾也該過得悠閒一點啊喵。","<PL>，你也是喵。
偶尔多放松放松喵。",,,,,,,,"ينطبق هذا <LSNR {عليك} {عليكِ}> يا <PL>. <LSNR {حاول} {حاولي}>
أخذ الأمور برويّة في بعض الأحيان.",,,,,,,,,,,
