guid,crc?,<PageAttr>,<TalkAttr>,<VillageProgress>,<HallProgress>,<HunterRank>,<TalkTag>,<TalkTagParam>,<TalkTagComment>,<TalkTag>,<TalkTagParam>,<TalkTagComment>,<TalkTag>,<TalkTagParam>,<TalkTagComment>,<TalkTag>,<TalkTagParam>,<TalkTagComment>,<TalkTag>,<TalkTagParam>,<TalkTagComment>,<TalkTag>,<TalkTagParam>,<TalkTagComment>,<TalkTag>,<TalkTagParam>,<TalkTagComment>,<TalkTag>,<TalkTagParam>,<TalkTagComment>,<TalkTag>,<TalkTagParam>,<TalkTagComment>,<TalkAction1>,<TalkAction1Param>,<TalkAction1Comment>,<TalkAction2>,<TalkAction2Param>,<TalkAction2Param2>,<TalkAction2Comment>,<KohakuProgress>,entry name,Japanese,English,French,Italian,German,Spanish,Russian,Polish,Dutch,Portuguese,PortugueseBr,Korean,TraditionalChinese,SimplifiedChinese,Finnish,Swedish,Danish,Norwegian,Czech,Hungarian,Slovak,Arabic,Turkish,Bulgarian,Greek,Romanian,Thai,Ukrainian,Vietnamese,Indonesian,Fiction,Hindi,LatinAmericanSpanish
28e627a9-2939-4569-b1f9-1ef027758392,2646687744,,,,,,,,,,,,,,,,,,,,,,,,,,,,,,,,,,,,,,,,,nid033_ch6_015,美しい長髪だった！,"Had a beautiful, long mane of hair
once upon a time!","Eu une magnifique chevelure, fut un temps !","... aveva una lunga e splendida chioma
tempo fa!","Hatte sie vor langer Zeit einmal einen
wunderschönen, langen Haarschopf!",¡Tenía una larga y bellísima melena!,"Когда-то была изумительная грива
длинных волос!","Dawno temu miała piękne
i długie włosy!",,,"Tinha uma linda e longa cabeleira
um belo dia!",아름다운 롱헤어였다!,曾經有著一頭漂亮的長髮！,以前留了一头漂亮的长发！,,,,,,,,"كان لديها شعر طويل جميل
ذات مرة!",,,,,,,,,,,
dc5dd026-be51-49e6-9d5c-c5ba65c7662f,2171634928,,,,,,,,,,,,,,,,,,,,,,,,,,,,,,,,,,,,,,,,,nid033_ch6_016,"チッチェ姫は母親である女王陛下や
家臣たちに、受付嬢になることを
反対されていたニャ。","Her Meowjesty, the Queen, was opposed
to the purr-incess managing quests.
As were the retainers.","Sa Miaoujesté, la reine, était contre
l'idée que la princesse s'occupe des
quêtes, tout comme ses laquais.","Sua Miaostà, la regina, non voleva che
la prrrincipessa si occupasse delle missioni.
Questo valeva anche per i sudditi.","Ihre Miaujestät, die Königin, hatte etwas
dagegen, dass die Prinzessin Quests
verwaltet. Genau wie der Adel.","Su miaujestad, la reina, se oponía a que
la princesa gestionara misiones, al igual
que sus cuidadores.","Ее Мяу-личество Королева не хотела,
чтобы принцесса занималась заданиями.
Как и слуги.","Jej miau-sokość, królowa, nie chciała, aby
księżniczka zarządzała zadaniami.
Jej świta również.",,,"Sua Miaujestade, a Rainha, se opôs à
princesa virar uma recrutadora.
Os conselheiros também.","치체 공주님의 어머니인 여왕 폐하와
신하들은 접수원이 되는 걸
반대하셨다냥.","琪婕公主的母親女王陛下與其家臣們
以前都反對她去當接待員。","琪切公主的母亲，也就是女王陛下
和家臣们反对她当接待员喵。",,,,,,,,"ولكن الملكة صاحبة الجلالة رفضت
قيام الأميرة بالمهام.
كما يفعل الخدم.",,,,,,,,,,,
d7b694af-b2ae-4cd1-b791-4c8ee12980f3,2494497625,,,,,,,,,,,,,,,,,,,,,,,,,,,,,,,,,,,,,,,,,nid033_ch6_017,"でも、猛勉強をして資格をとったニャ。
ひたむきな姿勢に決意を感じ取ったのか
最後はこころよく送り出してくれたニャ。","But she studied hard and qualified fur
the paw-sition. She must have won them
over with her determination in the end.","Mais elle a étudié et a tout fait pour
être digne de ce rôle. Elle a dû les
convaincre par sa détermination.","Ma ha lavorato sodo e si è qualificata
per la posizione. Alla fine deve averli
convinti con la sua determinazione.","Aber sie lernte hart und qualifizierte
sich für die Position. Ihre Entschlossen-
heit muss sie überzeugt haben.","Pero Chichae estudió mucho y se ganó
el puesto. Se ve que al final los convenció
a base de determinación.","Но она усердно училась и получила
эту позицию. Видимо, в итоге она их
переубедила своей решимостью.","Ale ona pilnie się uczyła i otrzymała to
stanowisko. Przekonała ich swoją
determinacją.",,,"Só que ela estudou muito e foi aprovada
para a função. Deve ter convencido eles
com a determinação.","하지만 열심히 공부해서 자격을 얻었다냥.
노력하는 그 모습에서 진심을 느꼈는지
결국에는 흔쾌히 보내 주셨다냥.","但她還是拼命學習，並取得了資格喵。
或許陛下他們是從那一心一意的模樣感受到
她的決心，最後才樂意讓她去當接待員。","但她用功学习，拿到了接待员的资格喵。
可能是看到她那么下苦功，大家感受到了
她的决心，最后就高兴地送她出来了喵。",,,,,,,,"لكنها درست بجد وتأهلت
لهذا المنصب. لا بد أنها تفوقت
عليهم بعزمها في النهاية.",,,,,,,,,,,
4e2cc2d1-59c7-418d-a3df-731ef821ff4f,2741375175,,,,,,,,,,,,,,,,,,,,,,,,,,,,,,,,,,,,,,,,,nid033_ch6_018,"その後、チッチェ姫は、
長かった髪をバッサリ切って
エルガドに降り立ったのニャ。","When she was posted to Elgado, she
decided to cut off her long hair to
purr-ove her commitment to the job!","Une fois assignée à Elgado, elle a décidé
de se couper les cheveux pour prouver
son dévouement au rôle !","Quando è stata assegnata a Elgado,
ha deciso di tagliare la sua lunga chioma
per dimiaostrare il suo impegno.","Als sie in Elgado stationiert wurde, ent-
schloss sie sich, das Haar abzuschneiden,
als Beweis ihrer Entschlossenheit.","Cuando la emplazaron en Elgado,
¡decidió cortarse el pelo para demostrar
lo comprometida que estaba con su labor!","Получив назначение в Элгадо, она решила
отстричь свои длинные волосы, чтобы
подчеркнуть приверженность работе!","Gdy wysłano ją do Elgado, ścięła swe
długie włosy, aby udowodnić, że
traktuje tę pracę poważnie!",,,"Quando ela foi mandada a Elgado, decidiu
cortar as longas madeixas para prrrovar
a dedicação dela ao trabalho!","그 후, 치체 공주님은 긴 머리카락을 싹둑
잘라버리고 엘가도로 부임하셨다냥.","然後，琪婕公主一刀剪斷了
那頭美麗的長髮，到艾爾卡多赴任喵。","之后琪切公主干脆把那头长发剪掉，
奔赴埃尔迦德喵！",,,,,,,,"عندما تم إرسالها إلى إلجادو،
قررت قص شعرها الطويل لتثبت
التزامها بالمهام!",,,,,,,,,,,
2bff66c5-70d4-4fc9-9ed6-d9828cf421dd,874276363,,,,,,,,,,,,,,,,,,,,,,,,,,,,,,,,,,,,,,,,,nid033_ch6_019,"本人としては、エルガドで仕事が
しやすいように切ったんだけど…
エルガドの人々はビックリ仰天したニャ。","And when the people of Elgado saw
that, it touched them, and helped boost
morale.","Et quand les gens d'Elgado ont vu ça,
ça les a touchés, et a redonné
la motivation à tout le monde !","E quando la gente di Elgado l'ha visto,
ne è rimasta molto colpita e questo gesto
ha tirato su il morale.","Und als die Leute in Elgado das sahen,
berührte es sie und es hat geholfen,
ihre Moral zu stärken.","Y la gente de Elgado, al verlo, se conmovió,
lo que ayudó mucho a levantar los ánimos.","Это растрогало жителей Элгадо и
подняло их моральный дух.","Kiedy mieszkańcy Elgado to zobaczyli,
byli poruszeni i zwiększyło
to ich morale.",,,"E, quando o povo de Elgado viu isso,
ficaram comovidos, o que melhorou o moral.","공주님은 엘가도에서 일을 하기 쉽도록
자르신 모양이지만…엘가도 사람들은
깜짝 놀랐다냥.
","她剪斷頭髮是為了方便在艾爾卡多工作，
不過這嚇倒了艾爾卡多的人喵。","虽然对她来说只是为了在埃尔迦德工作起来
更方便，但对埃尔迦德的人们来说，这可是
惊人之举喵。",,,,,,,,"وعندما رأى سكان إلجادو ذلك،
تأثروا بها، وساعد ذلك في رفع
روحهم المعنوية.",,,,,,,,,,,
12778734-3a11-437c-9cdc-a8a8f52c3c4e,2116718104,会話終了,,,,,,,,,,,,,,,,,,,,,,,,,,,,,,,,,,,,,,,,nid033_ch6_020,"……ニャんとも驚愕の情報だったニャ。
では、２つの「すぺしゃる」な情報のうちの
１つは、これにて終了だニャ。","By my whiskers, wasn't that juicy?
Thus concludes the second half
of my most special, secret intel.","J'en ai les moustaches qui frétillent !
Et ainsi s'achève la seconde partie de
mes infos spéciales secrètes.","Per mille baffi, questo sì che era
interessante. Qui si conclude la seconda
metà del segreto speciale...","Ich weiß, jetzt bist du baff. Das war
der zweite Teil meines größten,
speziellsten Geheimnisses.","¡Por mis bigotes, menudo dato! ¿No?
Con esto concluye el segundo de los dos
secretos más ocultos de Elgado.","Клянусь хвостом, это просто чудесно.
Вот я и поведал вам вторую часть
самого необычного секрета.","Na moje wąsy, to było pikantne, co?
Zatem znasz drugą połowę mojej
najbardziej bombowej tajemnicy.",,,"Pelos meus bigodes, essa foi das boas.
E aqui termina a segunda parte da minha
informação secreta mais especial.","……정말 놀라운 정보다냥.
「스페셜」한 비밀 중 하나는
이걸로 끝이다냥.","……真是令人震驚的情報喵。
那麼，2條「SPECIAL」情報的其中之一，
就到此結束喵。","……多喵惊人的情报喵。
那么，两个“特别”情报之一就此讲完了喵。",,,,,,,,"ربّاه، ألم يكن ذلك مثيرًا؟
وهكذا نستنتج النصف الثاني من
سري الخاص الأكثر تميزًا.",,,,,,,,,,,
