guid,crc?,<PageAttr>,<TalkAttr>,<VillageProgress>,<HallProgress>,<HunterRank>,<TalkTag>,<TalkTagParam>,<TalkTagComment>,<TalkTag>,<TalkTagParam>,<TalkTagComment>,<TalkTag>,<TalkTagParam>,<TalkTagComment>,<TalkTag>,<TalkTagParam>,<TalkTagComment>,<TalkTag>,<TalkTagParam>,<TalkTagComment>,<TalkTag>,<TalkTagParam>,<TalkTagComment>,<TalkTag>,<TalkTagParam>,<TalkTagComment>,<TalkTag>,<TalkTagParam>,<TalkTagComment>,<TalkTag>,<TalkTagParam>,<TalkTagComment>,<TalkAction1>,<TalkAction1Param>,<TalkAction1Comment>,<TalkAction2>,<TalkAction2Param>,<TalkAction2Param2>,<TalkAction2Comment>,<KohakuProgress>,entry name,Japanese,English,French,Italian,German,Spanish,Russian,Polish,Dutch,Portuguese,PortugueseBr,Korean,TraditionalChinese,SimplifiedChinese,Finnish,Swedish,Danish,Norwegian,Czech,Hungarian,Slovak,Arabic,Turkish,Bulgarian,Greek,Romanian,Thai,Ukrainian,Vietnamese,Indonesian,Fiction,Hindi,LatinAmericanSpanish
de06062c-1d0e-47d4-b217-0852d31d3d54,1015627385,ページ属性,会話属性,村進行度,集会所進行度,必要ハンターランク,会話タグ1,会話タグ1パラメータ,会話タグ1コメント,会話タグ2,会話タグ2パラメータ,会話タグ2コメント,会話タグ3,会話タグ3パラメータ,会話タグ3コメント,会話タグ4,会話タグ4パラメータ,会話タグ4コメント,会話タグ5,会話タグ5パラメータ,会話タグ5コメント,会話タグ6,会話タグ6パラメータ,会話タグ6コメント,会話タグ7,会話タグ7パラメータ,会話タグ7コメント,会話タグ8,会話タグ8パラメータ,会話タグ8コメント,会話タグ9,会話タグ9パラメータ,会話タグ9コメント,会話アクション1,会話アクション1パラメータ,会話アクション1コメント,会話アクション2,会話アクション2パラメータ,会話アクション2パラメータ2,会話アクション2コメント,MR進行度,nid033_MR,<COLOR FF0000>#Rejected#</COLOR> nid033_MR,<COLOR FF0000>#Rejected#</COLOR> nid033_MR,<COLOR FF0000>#Rejected#</COLOR> nid033_MR,<COLOR FF0000>#Rejected#</COLOR> nid033_MR,<COLOR FF0000>#Rejected#</COLOR> nid033_MR,<COLOR FF0000>#Rejected#</COLOR> nid033_MR,<COLOR FF0000>#Rejected#</COLOR> nid033_MR,<COLOR FF0000>#Rejected#</COLOR> nid033_MR,<COLOR FF0000>#Rejected#</COLOR> nid033_MR,<COLOR FF0000>#Rejected#</COLOR> nid033_MR,<COLOR FF0000>#Rejected#</COLOR> nid033_MR,<COLOR FF0000>#Rejected#</COLOR> nid033_MR,<COLOR FF0000>#Rejected#</COLOR> nid033_MR,<COLOR FF0000>#Rejected#</COLOR> nid033_MR,<COLOR FF0000>#Rejected#</COLOR> nid033_MR,<COLOR FF0000>#Rejected#</COLOR> nid033_MR,<COLOR FF0000>#Rejected#</COLOR> nid033_MR,<COLOR FF0000>#Rejected#</COLOR> nid033_MR,<COLOR FF0000>#Rejected#</COLOR> nid033_MR,<COLOR FF0000>#Rejected#</COLOR> nid033_MR,<COLOR FF0000>#Rejected#</COLOR> nid033_MR,<COLOR FF0000>#Rejected#</COLOR> nid033_MR,<COLOR FF0000>#Rejected#</COLOR> nid033_MR,<COLOR FF0000>#Rejected#</COLOR> nid033_MR,<COLOR FF0000>#Rejected#</COLOR> nid033_MR,<COLOR FF0000>#Rejected#</COLOR> nid033_MR,<COLOR FF0000>#Rejected#</COLOR> nid033_MR,<COLOR FF0000>#Rejected#</COLOR> nid033_MR,<COLOR FF0000>#Rejected#</COLOR> nid033_MR,<COLOR FF0000>#Rejected#</COLOR> nid033_MR,<COLOR FF0000>#Rejected#</COLOR> nid033_MR,<COLOR FF0000>#Rejected#</COLOR> nid033_MR,<COLOR FF0000>#Rejected#</COLOR> nid033_MR
4f05cdbc-8ac6-4ec1-9f06-0ac6be9e797c,3422306555,,(default)世間話,,,,この会話フラグがONなら→,EV_PRO_MR_001_01_01,,この会話フラグがOFFなら→,EV_PRO_MR_002_01_01,,,,,,,,,,,,,,,,,,,,,,,,,,,,,,,nid033_ch1_000,"ニャンとフカシギ。
謎の情報屋、ただいま参上…だニャ。","It is I, Fukashigi the Informant,
at your service...","C'est moi, Fukashigi l'informateur !
À ton service...","Fukashigi l'informatore,
al tuo servizio...","Ich bin es, Fukashigi der Informant,
zu deinen Diensten...","Soy yo, Fukashigi el informador,
a tu servicio...","Я, Информатор Фукасиги,
к вашим услугам...","To ja, Informator Fukashigi,
do usług...",,,"Sou eu, Fukashigi, o Informante,
ao seu dispor!","의문의 정보상,
후카시기의 등장이다…냥.","奇妙奇喵妙妙妙。
神秘情報商在此登場……喵。","多喵玄又玄。
神秘情报商来也……喵。",,,,,,,,"إنه أنا المخبر فوكاشيجي،
في <LSNR {خدمتك} {خدمتكِ}>...",,,,,,,,,,,
9439e3da-ce6a-4fb8-8192-9f097885d813,3436377040,,,,,,,,,,,,,,,,,,,,,,,,,,,,,,,,,,,,,,,,,nid033_ch1_001,"フム、ではエルガドの
裏情報その１を
オヌシに伝えようではニャいか…。","Very well. I'll impawrt to you the
first dirty secret of Elgado...","Très bien, il est temps maintenant de
te révéler le premier sombre secret
d'Elgado...","Miaolto bene. Ti svelerò il prrrimo
segreto di Elgado...","Also gut. Ich verrate dir Elgados
erstes schmutziges Geheimnis...","Muy bien. Compartiré contigo el primer
turbio secreto de Elgado...","Превосходно. Я сомяубщу вам первый
грязный секрет Элгадо.","Kociastycznie. Za chwilę poznasz
pierwszą wstydliwą tajemnicę Elgado...",,,"Muito bem. Vou te contar o prrmeiro
segredinho sujo de Elgado...","흠, 그럼 엘가도의
첫 번째 비밀을
자네에게 알려 주겠다냥…","嗯，那就讓吾告訴你
艾爾卡多的第1條秘密情報吧喵……","嗯，那老夫就告诉你
埃尔迦德的内幕消息其一喵……",,,,,,,,"جيد جدًا. <LSNR {سأخبرك} {سأخبركِ}>
بالسر الدفين الأول لإلجادو...",,,,,,,,,,,
466d56bb-3389-43fe-be7c-15a5c12279ac,982935549,,,,,,,,,,,,,,,,,,,,,,,,,,,,,,,,,,,,,,,,,nid033_ch1_002,王国騎士ルーチカ殿は…。,Dame Luchika...,Dame Luchika...,Dama Luchika...,Luchika...,La señorita Luchika...,Рыцарь Лучика...,Pani Luchika...,,,A Dama Luchika...,왕국 기사 루치카 공은…,王國騎士露琪卡大人她……,王国骑士露琪卡小姐她……,,,,,,,,السيدة لوتشيكا...,,,,,,,,,,,
41f06cc1-8bea-4854-a9c9-9362cb81ba24,2009694653,,,,,,,,,,,,,,,,,,,,,,,,,,,,,,,,,,,,,,,,,nid033_ch1_003,じつは…。,Is really...,Est en fait...,... in realtà...,... ist in Wirklichkeit...,Esto te va a pillar por sorpresa...,На самом деле...,Naprawdę...,,,"É, na verdade...",사실…,其實……,其实……,,,,,,,,إنه حقًا...,,,,,,,,,,,
eac6d01b-cdaf-4aea-b8cf-7c4389e36b46,2458592578,,,,,,,,,,,,,,,,,,,,,,,,,,,,,,,,,,,,,,,,,nid033_ch1_004,すごい大食い！,An unparalleled greedy-guts!,Un véritable estomac sur pattes !,... è una mangiona!,Ein beispielloser Gierschlund!,¡Es una tragaldabas sin parangón!,Неверо-мяу-тно прожорлива!,Jest niezrównanie żarłoczna!,,,Uma comilona inigualável!,엄청난 대식가!,是個超級大胃王！,是个大胃王！,,,,,,,,جشعة للغاية!,,,,,,,,,,,
a51b4adf-63a6-4ce2-beec-8e83ab65991a,3589462982,,,,,,,,,,,,,,,,,,,,,,,,,,,,,,,,,,,,,,,,,nid033_ch1_005,"カムラの里のヒノエちゃんと
張り合えるくらいの量を食べるニャ。","She could give Kamura's own food bank,
Hinoa, a run fur her zenny.","Elle pourrait même rivaliser avec Hinoa.
Attention au stock de nourriture !","Darebbe del filo da torcere alla
mangiona di Kamura, Hinoa.","Sie könnte Kamuras eigener Mampfmaschine,
Hinoa, noch das Wasser reichen.","Tiene un estómago a la altura del de Hinoa,
la tragona oficial de Kamura.","Даже главная обжора Камуры, Хиноа,
с ней не сравнится.","Nawet bank żywności Kamury, Hinoa,
nie może z nią konkurować.",,,"Ela deixa até a devoradora de Kamura,
Hinoa, comendo poeira no rastro dela.","카무라 마을의 히노에와
어깨를 나란히 할 만큼 먹는다냥.",她的食量幾乎和神火村的火芽不相上下喵。,"她的饭量能和炎火村的火芽妹妹
争个高下了喵。",,,,,,,,"يمكنها أن تمنح بنك طعام كامورا،
هينوا، فرصة للحصول على الأموال.",,,,,,,,,,,
4917a643-753e-4329-a1c1-451c341b5b20,2119737227,,,,,,,,,,,,,,,,,,,,,,,,,,,,,,,,,,,,,,,,,nid033_ch1_006,"でも本人は大食いを隠しているみたいニャ。
外ではほかの人と同量におさめて
自室でいっぱい食べてるらしいのニャ。","But she likes to keep it under her hat.
When she's out, she settles for a normal
portion, but eats meowntains at home!","Mais elle ne le montre pas. Dehors, elle
se contente d'une simple portion... mais
chez elle, elle arrête pas de manger !","Ma le piace essere discreta. Quando è
fuori, miaongia una porzione normale,
mentre a casa ne miaongia a quintali.","Sie behält es lieber für sich. Auswärts
isst sie eine normale Portion, aber zu
Hause verputzt sie Berge, miau!","Pero no le gusta decirlo.
Cuando está en público pide raciones normales,
¡pero en su casa se pone como el quico minino!","Но она предпочитает это скрывать.
На людях она съедает обычную порцию,
но дома она наедается вдоволь!","Trzyma to w tajemnicy. Na zewnątrz
je normalnie, ale w domu
pochłania kociogóry jedzenia!",,,"Só que ela guarda esse segredo na manga.
Quando está fora, se limita a uma porção
normiau, mas, em casa, come miautanhas!","본인은 대식가인 걸 숨기는 것 같다냥.
밖에선 다른 사람들이랑 비슷한 양을 먹고
방에서 엄청나게 먹는다고 한다냥.","不過她本人似乎在隱瞞這個事實喵。
她在外面用餐時只會和其他人吃差不多的量，
等回到自己房間後才會大吃一頓的樣子喵。","但是她好像瞒着外人这一点喵。据说她
在外面会控制饭量，吃得跟别人差不多，
等回到自己房间再放开了吃喵。",,,,,,,,"لكنها تود أن تبقيه تحت إدارتها.
عندما تكون بالخارج، فإنها تتناول كمية عادية،
لكنها تأكل الكثير في المنزل!",,,,,,,,,,,
7d53464e-f740-4a62-b93f-6f880f724fef,1436936689,,,,,,,,,,,,,,,,,,,,,,,,,,,,,,,,,,,,,,,,,nid033_ch1_007,"ヒノエちゃんもルーチカ殿も
そんなにいっぱい食べるのに
どうしてスタイルを維持できているニャ…？","What I can't understand is how both
Hinoa and Luchika manage to put so
much away but keep looking so stylish.","J'arriverai jamais à comprendre comment
Hinoa et Luchika peuvent manger autant
tout en restant si élégantes.","Quello che non capisco è come facciano
Hinoa e Luchika a miaongiare così tanto
apparendo sempre raffinate.","Was ich nicht verstehe, ist, dass sowohl
Hinoa als auch Luchika so viel verputzen
und trotzdem so stylisch aussehen können.","Lo que no consigo entender es cómo Hinoa
y Luchika pueden mantener ese tipo con
todo lo que se zampan.","Что мяуня удивляет, так это то, как
Хиноа и Лучике удается так стильно
выглядеть, несмотря на их аппетит.","Nie rozumiem, jak Hinoa i Pani Luchika
mogą tyle jeść i nadal tak
szczupło wyglądać.",,,"O que eu não entendo é como tanto Hinoa
quanto Luchika conseguem comer
tanto e continuar tão estilosas.","히노에도 루치카 공도
그렇게 많이 먹는데
어떻게 몸매를 유지하는 거냥…?","火芽和露琪卡大人明明都那麼會吃，
為什麼還能維持好身材呢喵……","火芽妹妹和露琪卡小姐都这么能吃，
为什么身材还这么好喵……？",,,,,,,,"ما لا أفهمه هو كيف تمكنت كل من
هينوا والسيدة لوتشيكا من تناول الكثير
مع الحفاظ على مظهرهما الأنيق للغاية.",,,,,,,,,,,
ceaa016b-7808-40f5-93f5-978e6a5e8273,1273806407,会話終了,,,,,,,,,,,,,,,,,,,,,,,,,,,,,,,,,,,,,,,,nid033_ch1_008,"……ニャんとも驚愕の情報だったニャ。
次の情報更新は、オヌシの実力がさらに
認められて、MRが上がったあとだニャ。","By my whiskers, wasn't that juicy?
I'll update you again once your MR
has increased.","J'en ai les moustaches qui frétillent !
Bref, je t'en dirai plus quand ton RM
aura augmenté.","Per mille baffi, non era interessante?
Quando aumenterai di grado maestro,
ti dirò un altro segreto!","Jetzt bist du baff, was? Mehr Infos gibt
es, sobald sich dein Meisterrang erhöht
hat.","¿A que es una información de primera?
Tendré algo más para ti cuando haya
aumentado tu RM.","Клянусь хвостом, разве это не пикантно?
Как только у вас вырастет РМ, я сообщу
вам новую информацию.","Na moje wąsy, pikantna sprawka, co?
Przekażę ci kolejną miau-formację, gdy
podniesiesz swoją RM.",,,"Pelos meus bigodes, não foi um baque?
Vou te atualizar de novo assim que você
elevar seu RM.","……정말 놀라운 정보다냥.
그럼 다음 정보 갱신은 실력을 더욱 
인정받아 MR이 오른 뒤다냥.","……真是令人震驚的情報喵。
那麼，下一條情報會在
你的實力更受認可，MR上升之後更新喵。","……多喵惊人的情报喵。那么下一次的情报
更新，要等你实力进一步得到认可，大师
等级提升后喵。",,,,,,,,"بالله <LSNR {عليك} {عليكِ}>، أليس هذا مثيرًا؟
<LSNR {سأخبرك} {سأخبركِ}> بآخر التطورات
بمجرد زيادة رتبة القائد الخاصة <LSNR {بك} {بكِ}>.",,,,,,,,,,,
bad9c0f0-76ea-416e-b03c-80fa5a23965f,2793619920,,(default)世間話,,,,この会話フラグがONなら→,EV_PRO_MR_002_01_01,,この会話フラグがOFFなら→,EV_PRO_MR_003_01_01,,,,,,,,,,,,,,,,,,,,,,,,,,,,,,,nid033_ch2_000,"ニャンとフカシギ。
謎の情報屋、ただいま参上…だニャ。","It is I, Fukashigi the Informant,
at your service...","C'est moi, Fukashigi l'informateur !
À ton service...","Fukashigi l'informatore,
al tuo servizio...","Ich bin es, Fukashigi der Informant,
zu deinen Diensten...","Soy yo, Fukashigi el informador,
a tu servicio...","Я, Информатор Фукасиги,
к вашим услугам...","To ja, Informator Fukashigi,
do usług...",,,"Sou eu, Fukashigi, o Informante,
ao seu dispor!","의문의 정보상,
후카시기의 등장이다…냥.","奇妙奇喵妙妙妙。
神秘情報商在此登場……喵。","多喵玄又玄。
神秘情报商来也……喵。",,,,,,,,"إنه أنا المخبر فوكاشيجي،
في <LSNR {خدمتك} {خدمتكِ}>...",,,,,,,,,,,
0b594d40-6601-4286-9970-66d80c734b6c,3394130956,,,,,,,,,,,,,,,,,,,,,,,,,,,,,,,,,,,,,,,,,nid033_ch2_001,"フム、ではエルガドの
裏情報その２を
オヌシに伝えようではニャいか…。","Very well. I'll impawrt to you the
second dirty secret of Elgado...","Très bien, il est temps maintenant de
te révéler le second sombre secret
d'Elgado...","Miaolto bene. Ti svelerò il secondo
segreto di Elgado...","Also gut. Ich verrate dir Elgados
zweites schmutziges Geheimnis...","Muy bien, compartiré contigo el segundo
turbio secreto de Elgado...","Превосходно. Я сообщу вам второй
грязный секрет Элгадо.","Kociastycznie. Za chwilę poznasz drugą
wstydliwą tajemnicę Elgado...",,,"Muito bem. Vou te contar o segundo
segredinho sujo de Elgado...","흠, 그럼 엘가도의
두 번째 비밀을
자네에게 알려 주겠다냥…","嗯，那就讓吾告訴你
艾爾卡多的第2條秘密情報吧喵……","嗯，那老夫就告诉你
埃尔迦德的内幕消息其二喵……",,,,,,,,"جيد جدًا. <LSNR {سأخبرك} {سأخبركِ}>
بالسر الدفين الثاني لإلجادو...",,,,,,,,,,,
f013ef58-42ad-49c4-879a-eb5b4118b5bc,308415149,,,,,,,,,,,,,,,,,,,,,,,,,,,,,,,,,,,,,,,,,nid033_ch2_002,王国騎士フィオレーネ殿は…。,Dame Fiorayne...,Dame Fiorayne...,Dama Fiorayne...,Fiorayne...,La señorita Fiorayne...,Рыцарь Фиорайна...,Pani Fiorayne...,,,A Dama Fiorayne...,"왕국 기사, 피오레네 공은…",王國騎士菲歐莉尼大人她……,王国骑士菲奥莱娜她……,,,,,,,,السيدة فيوراين...,,,,,,,,,,,
305ffb35-0514-47ef-b019-4786d2cda851,3741514948,,,,,,,,,,,,,,,,,,,,,,,,,,,,,,,,,,,,,,,,,nid033_ch2_003,じつは…。,Is really...,Est en fait...,... in realtà...,... ist in Wirklichkeit...,Esto te va a pillar por sorpresa...,На самом деле...,Naprawdę...,,,"É, na verdade...",사실…,其實……,其实……,,,,,,,,إنه حقًا...,,,,,,,,,,,
f391794d-17fc-4d2e-843a-4b724832862a,1049823712,,,,,,,,,,,,,,,,,,,,,,,,,,,,,,,,,,,,,,,,,nid033_ch2_004,かわいいものが大好き！,Crazy fur anything cutesy!,"Une fan absolue de tout ce qui est
mignon !",... va matta per tutto ciò che è tenero!,"Verrückt nach allem, was niedlich ist!",¡Se vuelve loca por las cositas monas!,Обожает все миленькое!,Szaleje na punkcie maskotek!,,,Louca por tudo que é fofinho!,귀여운 것을 엄청 좋아한다!,很喜歡可愛的東西！,超喜欢可爱的东西！,,,,,,,,مولعة بأي شيء لطيف!,,,,,,,,,,,
ddea7a40-a975-43eb-bf13-da6d51a0a32f,950617347,,,,,,,,,,,,,,,,,,,,,,,,,,,,,,,,,,,,,,,,,nid033_ch2_005,"勇猛果敢で、提督の右腕のお姉さん。
絶対に自分では言わないけど、
かわいいものに目がないニャ。","That's right, Admiral Galleus's courageous
second-in-command. She'd never admit it,
but she's as soft as a kitten.","Oui, la commandante en second de
l'amiral Galleus... Elle l'admettra
jamais, mais elle est chacrément douce !","Proprio lei, la coraggiosa seconda in comando
dell'ammiraglio Galleus. Non lo ammetterà
mai, ma è dolce come un gattino.","Ganz genau, Galleus’ mutige Stellver-
treterin. Sie würde es nie zugeben, aber
sie ist weich wie ein junges Kätzchen!","Así es, nada menos que la lugarteniente
del almirante Galleus. No lo reconocerá,
pero es una florecilla de lo más minina.","Да, отважная правая рука Адмирала
Галлеуса. Она никогда этого не признает,
но она бывает мягкой, как котенок.","To prawda! Odważna prawa ręka
Admirała Galleusa. Nie przyzna tego,
ale jest miękka jak kocię.",,,"Isso mesmo, a corajosa vice comandante
do Almirante Galleus. Ela nunca
admitiria, mas é doce como um gatinho.","용감무쌍한 제독의 오른팔인 누님.
아무에게도 말한 적 없지만,
귀여운 것에는 사족을 못 쓴다냥.","這位大姐姐勇猛果敢，又是提督的左右手。
其實她非常喜歡可愛的東西，
不過平常絕對不會自己提到喵。","这位姑娘勇猛果敢，又是提督的心腹。
她平时肯定不会主动说出口，其实她对
可爱的东西喜欢得不得了喵。",,,,,,,,"هذا صحيح، مساعدة الأدميرال
جاليوس الشجاعة. لن تعترف بذلك أبدًا،
لكنها ناعمة مثل قطة صغيرة.",,,,,,,,,,,
578f62af-2a63-4940-b9d3-cb58d47a68f8,872141682,,,,,,,,,,,,,,,,,,,,,,,,,,,,,,,,,,,,,,,,,nid033_ch2_006,"フカシギ調べによると、
彼女の自室はいろんなモンスターや動物の
ぬいぐるみであふれているらしいニャ。","My purr-obing has revealed that her
quarters are stuffed full of soft toy
meownsters and animals.","J'ai découvert que sa chambre était
remplie de miaonstres jouets et
autres peluches.","Le mie indagini hanno dimostrato che
le sue stanze sono piene di miaostri
e animali di peluche.","Meine Sondierung hat ergeben,
dass ihr Raum voller weicher
Plüsch-Miaunster und -Tiere ist.","Mis pesquisas han sacado a la luz que
sus aposentos están llenos de monstruos
y animalitos de peluche.","Мои исследования показали, что ее
жилище полно мягких игрушечных
мяунстров и зверюшек.","Moje kociozwiady odkryły, że w pokoju
ma pełno maskotek
potworów i zwierzaków.",,,"Minha investigação revelou que o
alojamento dela está cheio de miaunstros
e animais de pelúcia.","후카시기의 조사에 따르면
그녀의 방에는 다양한 몬스터와
동물 인형이 가득하다고 한다냥.","根據妙妙調查，她的房裡似乎擺滿了
各種魔物和動物的玩偶喵。","据老夫玄又玄打听，她的房间里到处是
各种怪物和动物的玩偶喵。",,,,,,,,"كشف تحقيقي
أن مسكنها مليء بالدمى المحشوة
الناعمة للحيوانات والوحوش.",,,,,,,,,,,
1798d0d6-ffae-4cf7-9b64-7fda17d564b8,4126159377,,,,,,,,,,,,,,,,,,,,,,,,,,,,,,,,,,,,,,,,,nid033_ch2_007,"このことを知っているのは
妹のロンディーネ殿だけだニャ。
これは重大なヒミツを握ってしまったニャ。","No one but her sister Rondine knows.
It's a closely guarded secret.","Il n'y a que sa sœur Rondine qui est au
courant. C'est un secret extrêmement
bien gardé.","Non lo sa nessuno, solo sua sorella
Rondine. È un segreto ben custodito.","Keiner außer ihrer Schwester Rondine
weiß das. Es ist ein streng gehütetes
Geheimnis.","Solo lo sabe su hermana Rondine.
Es un secreto muy guardado.","Об это знает только ее сестра Рондина.
Это тщательно охраняемый секрет.","Tylko jej siostra Rondine wie o tym.
Bardzo strzeżona tajemnica.",,,"Ninguém sabe além da irmã dela, Rondine.
É um segredo muito bem guardado.","이 사실을 아는 건
동생 론디네 공뿐이다냥.
특급 기밀을 알아 버렸다냥.","知道這件事的人，
只有她的妹妹隆蒂尼大人而已喵。
吾真是掌握了一項天大的秘密喵。","这件事只有她妹妹罗德娜小姐知道喵。
这下老夫可掌握重大机密了喵。",,,,,,,,"لا أحد يعرف ذلك سوى أختها رونداين.
إنه سر يخضع لحراسة مشددة.",,,,,,,,,,,
320d7da0-4581-4674-83c9-fae9628633ed,4194136172,会話終了,,,,,,,,,,,,,,,,,,,,,,,,,,,,,,,,,,,,,,,,nid033_ch2_008,"……ニャんとも驚愕の情報だったニャ。
次の情報更新は、オヌシの実力がさらに
認められて、MRが上がったあとだニャ。","By my whiskers, wasn't that juicy?
I'll update you again once your MR
has increased.","J'en ai les moustaches qui frétillent !
Bref, je t'en dirai plus quand ton RM
aura augmenté.","Per mille baffi, non era interessante?
Quando aumenterai di grado maestro,
ti dirò un altro segreto!","Jetzt bist du baff, was? Mehr Infos gibt
es, sobald sich dein Meisterrang erhöht
hat.","¿A que es una información de primera?
Tendré algo más para ti cuando haya
aumentado tu RM.","Клянусь хвостом, разве это не пикантно?
Как только у вас вырастет РМ, я сообщу
вам новую информацию.","Na moje wąsy, pikantna sprawka, co?
Przekażę ci kolejną miau-formację, gdy
podniesiesz swoją RM.",,,"Pelos meus bigodes, não foi um baque?
Vou te atualizar de novo assim que você
elevar seu RM.","……정말 놀라운 정보다냥.
그럼 다음 정보 갱신은 실력을 더욱 
인정받아 MR이 오른 뒤다냥.","……真是令人震驚的情報喵。
那麼，下一條情報會在
你的實力更受認可，MR上升之後更新喵。","……多喵惊人的情报喵。那么下一次的情报
更新，要等你实力进一步得到认可，大师
等级提升后喵。",,,,,,,,"بالله <LSNR {عليك} {عليكِ}>، أليس هذا مثيرًا؟
سأقوم <LSNR {بإخطارك} {بإخطاركِ}> مرة أخرى
بمجرد زيادة رتبة القائد.",,,,,,,,,,,
3b9cd7cc-ee43-4a7e-ad3c-28f1294866b7,3846502024,,(default)世間話,,,,この会話フラグがONなら→,EV_PRO_MR_003_01_01,,この会話フラグがOFFなら→,EV_PRO_MR_004_01_01,,,,,,,,,,,,,,,,,,,,,,,,,,,,,,,nid033_ch3_000,"ニャンとフカシギ。
謎の情報屋、ただいま参上…だニャ。","It is I, Fukashigi the Informant,
at your service...","C'est moi, Fukashigi l'informateur !
À ton service...","Fukashigi l'informatore,
al tuo servizio...","Ich bin es, Fukashigi der Informant,
zu deinen Diensten...","Soy yo, Fukashigi el informador,
a tu servicio...","Я, Информатор Фукасиги,
к вашим услугам...","To ja, Informator Fukashigi,
do usług...",,,"Sou eu, Fukashigi, o Informante,
ao seu dispor!","의문의 정보상,
후카시기의 등장이다…냥.","奇妙奇喵妙妙妙。
神秘情報商在此登場……喵。","多喵玄又玄。
神秘情报商来也……喵。",,,,,,,,"إنه أنا المخبر فوكاشيجي،
في <LSNR {خدمتك} {خدمتكِ}>...",,,,,,,,,,,
f1da4713-aab9-4a17-bfd9-86f1377c1cad,1741230359,,,,,,,,,,,,,,,,,,,,,,,,,,,,,,,,,,,,,,,,,nid033_ch3_001,"フム、ではエルガドの
裏情報その３を
オヌシに伝えようではニャいか…。","Very well. I'll impawrt to you the
third dirty secret of Elgado...","Très bien, il est temps maintenant de
te révéler le troisième sombre secret
d'Elgado...","Miaolto bene. Ti svelerò il terzo
segreto di Elgado...","Also gut. Ich verrate dir Elgado
drittes schmutziges Geheimnis...","Muy bien, compartiré contigo el tercer
turbio secreto de Elgado...","Превосходно. Я сообщу вам третий
грязный секрет Элгадо.","Kociastycznie. Za chwilę poznasz trzecią
wstydliwą tajemnicę Elgado...",,,"Muito bem. Vou te contar o terceiro
segredinho sujo de Elgado...","흠, 그럼 엘가도의
세 번째 비밀을
자네에게 알려 주겠다냥…","嗯，那就讓吾告訴你
艾爾卡多的第3條秘密情報吧喵……","嗯，那老夫就告诉你
埃尔迦德的内幕消息其三喵……",,,,,,,,"جيد جدًا. <LSNR {سأخبرك} {سأخبركِ}>
بالسر الدفين الثالث لإلجادو...",,,,,,,,,,,
