guid,crc?,<PageAttr>,<TalkAttr>,<VillageProgress>,<HallProgress>,<HunterRank>,<TalkTag>,<TalkTagParam>,<TalkTagComment>,<TalkTag>,<TalkTagParam>,<TalkTagComment>,<TalkTag>,<TalkTagParam>,<TalkTagComment>,<TalkTag>,<TalkTagParam>,<TalkTagComment>,<TalkTag>,<TalkTagParam>,<TalkTagComment>,<TalkTag>,<TalkTagParam>,<TalkTagComment>,<TalkTag>,<TalkTagParam>,<TalkTagComment>,<TalkTag>,<TalkTagParam>,<TalkTagComment>,<TalkTag>,<TalkTagParam>,<TalkTagComment>,<TalkAction1>,<TalkAction1Param>,<TalkAction1Comment>,<TalkAction2>,<TalkAction2Param>,<TalkAction2Param2>,<TalkAction2Comment>,<KohakuProgress>,entry name,Japanese,English,French,Italian,German,Spanish,Russian,Polish,Dutch,Portuguese,PortugueseBr,Korean,TraditionalChinese,SimplifiedChinese,Finnish,Swedish,Danish,Norwegian,Czech,Hungarian,Slovak,Arabic,Turkish,Bulgarian,Greek,Romanian,Thai,Ukrainian,Vietnamese,Indonesian,Fiction,Hindi,LatinAmericanSpanish
4c12c57a-8502-44bb-9e20-89b4e3157665,3860961979,ページ属性,会話属性,村進行度,集会所進行度,必要ハンターランク,会話タグ1,会話タグ1パラメータ,会話タグ1コメント,会話タグ2,会話タグ2パラメータ,会話タグ2コメント,会話タグ3,会話タグ3パラメータ,会話タグ3コメント,会話タグ4,会話タグ4パラメータ,会話タグ4コメント,会話タグ5,会話タグ5パラメータ,会話タグ5コメント,会話タグ6,会話タグ6パラメータ,会話タグ6コメント,会話タグ7,会話タグ7パラメータ,会話タグ7コメント,会話タグ8,会話タグ8パラメータ,会話タグ8コメント,会話タグ9,会話タグ9パラメータ,会話タグ9コメント,会話アクション1,会話アクション1パラメータ,会話アクション1コメント,会話アクション2,会話アクション2パラメータ,会話アクション2パラメータ2,会話アクション2コメント,MR進行度,nid101_MR,<COLOR FF0000>#Rejected#</COLOR> nid101_MR,<COLOR FF0000>#Rejected#</COLOR> nid101_MR,<COLOR FF0000>#Rejected#</COLOR> nid101_MR,<COLOR FF0000>#Rejected#</COLOR> nid101_MR,<COLOR FF0000>#Rejected#</COLOR> nid101_MR,<COLOR FF0000>#Rejected#</COLOR> nid101_MR,<COLOR FF0000>#Rejected#</COLOR> nid101_MR,<COLOR FF0000>#Rejected#</COLOR> nid101_MR,<COLOR FF0000>#Rejected#</COLOR> nid101_MR,<COLOR FF0000>#Rejected#</COLOR> nid101_MR,<COLOR FF0000>#Rejected#</COLOR> nid101_MR,<COLOR FF0000>#Rejected#</COLOR> nid101_MR,<COLOR FF0000>#Rejected#</COLOR> nid101_MR,<COLOR FF0000>#Rejected#</COLOR> nid101_MR,<COLOR FF0000>#Rejected#</COLOR> nid101_MR,<COLOR FF0000>#Rejected#</COLOR> nid101_MR,<COLOR FF0000>#Rejected#</COLOR> nid101_MR,<COLOR FF0000>#Rejected#</COLOR> nid101_MR,<COLOR FF0000>#Rejected#</COLOR> nid101_MR,<COLOR FF0000>#Rejected#</COLOR> nid101_MR,<COLOR FF0000>#Rejected#</COLOR> nid101_MR,<COLOR FF0000>#Rejected#</COLOR> nid101_MR,<COLOR FF0000>#Rejected#</COLOR> nid101_MR,<COLOR FF0000>#Rejected#</COLOR> nid101_MR,<COLOR FF0000>#Rejected#</COLOR> nid101_MR,<COLOR FF0000>#Rejected#</COLOR> nid101_MR,<COLOR FF0000>#Rejected#</COLOR> nid101_MR,<COLOR FF0000>#Rejected#</COLOR> nid101_MR,<COLOR FF0000>#Rejected#</COLOR> nid101_MR,<COLOR FF0000>#Rejected#</COLOR> nid101_MR,<COLOR FF0000>#Rejected#</COLOR> nid101_MR,<COLOR FF0000>#Rejected#</COLOR> nid101_MR,<COLOR FF0000>#Rejected#</COLOR> nid101_MR
a4dd6da6-b5d3-4b7e-844a-7aec5d580a0d,1527926379,会話終了,会話フキダシ(赤),,集会所進行☆7EX,50,この会話フラグがOFFなら→,EV_PRO_HALL_008_05_01,,,,,,,,,,,,,,,,,,,,,,,,,,,,,,,,,,nid101_HR50_START_hukidashi,,,,,,,,,,,,,,,,,,,,,,,,,,,,,,,,,
0e8daf22-a12a-41e6-a0b7-bfd6e57a4757,3393875029,,(default)世間話,,,,この会話フラグがONなら→,EV_PRO_HALL_ADD_008_99_01,,この会話フラグがOFFなら→,EV_PRO_MR_002_01_01,,,,,,,,,,,,,,,,,,,,,,,,,,,,,,,nid101_base0_000,"お～う、<PL>。
おぬしもついに、里の外へ出るときが
来たでゲコね。","So, <PL>, the time has finally
come for you to leave the pond?","Alors ça y est, <PL>,
tu t'en vas ?","Allora, <PL>, è arrivato il
momento di lasciare il nido?","Dann ist also endlich die Zeit gekommen,
dass du den Teich verlässt,
<PL>?","Bueno, <PL>, ¿entonces por
fin te ha llegado la hora de ir a ver
mundo?","Итак, <PL>, пришло время
отправиться в открытое плавание!","<PL>! A więc nadszedł czas,
aby wyfrunąć ze swojego gniazda?",,,"Então, <PL>, finalmente
chegou a hora de você deixar a poça?","오~ <PL>.
드디어 자네도 마을 밖으로
나갈 때가 왔다개골.","哦～<PL>。
你離開村子的日子終於到來啦呱。","噢～<PL>。
你终于也要去村外闯荡了呱。",,,,,,,,"إذن يا <PL> ، هل حان الوقت
<LSNR {لتغادر} {لتغادري}> البركة؟",,,,,,,,,,,
9bb842b8-62ee-44ae-844f-eecfed1ff8c7,2158060131,,,,,,,,,,,,,,,,,,,,,,,,,,,,,,,,,,,,,,,,,nid101_base0_001,"旅立ちだゲコ。心して行くゲコよ。
なーに、里のことなら心配いらんでゲコ。","You can rest easy knowing the village
will be in good hands while you are gone.","En tout cas, ne t'inquiète pas pour
le Village, il est entre de bonnes mains.","Puoi dormire sonni tranquilli, il villaggio
sarà in buone mani mentre sarai via.","Du kannst beruhigt sein, dass sich
das Dorf in guten Händen befindet,
während du weg bist.","Tú <LSNR {tranquilo} {tranquila}>, que la aldea estará en
buenas manos durante tu ausencia.","Пока тебя не будет,
за деревней мы приглядим —
можешь не сомневаться.","Spokojna głowa! Wioska będzie w
dobrych rękach pod twoją nieobecność.",,,"Pode ficar em paz, sabendo que a aldeia
estará em boas mãos na sua ausência.","조심히 가라개골.
마을은 걱정할 필요 없다개골.","你即將要踏上旅程，一定要做好準備呱。
放心，你不用替咱們操心呱。","该启程了呱。路上多加小心呱。
放心去吧，别担心村子的事呱。",,,,,,,,"<LSNR {يمكنك} {يمكنكِ}> الآن أن <LSNR {تشعر} {تشعري}> بالراحة بمعرفة أن
القرية ستكون في أيدٍ أمينة أثناء <LSNR {رحيلك} {رحيلكِ}>.",,,,,,,,,,,
9d45007a-300c-4030-8fe0-6b862d30ae1d,777334832,,,,,,,,,,,,,,,,,,,,,,,,,,,,,,,,,,,,,,,,,nid101_base0_002,"今までおぬしがしっかり守ってくれた里、
今度はワシらががんばる番だゲコ。
ワシもまだまだ若いモンには負けんでゲコ。","You've done a great job of protecting
the village, but I won't be outdone by
a tadpole like you! Johoho!","Tu nous as bien aidés à protéger
le Village, c'est évident, mais je suis là !
Tout ira bien !","Hai fatto un ottimo lavoro nel proteggere
il villaggio, ma non mi farò superare da
<LSNR {un pivellino} {una pivellina}> come te. Ohohoh!","Du hast großartige Arbeit geleistet, das
Dorf zu beschützen, aber ich lasse mich von
einer Kaulquappe wie dir nicht schlagen!","Enhorabuena por haber protegido tan bien
la aldea, pero ¡yo no pienso ser menos
que <LSNR {un renacuajo} {una renacuaja}> como tú! ¡Jo, jo, jo!","Ты отлично <LSNR {справился} {справилась}> с защитой деревни,
но мне <LSNR {сопляк} {соплячка}> вроде тебя —
не ровня! Йо-хо-хо!","Udało ci się pięknie ochronić wioskę,
ale ja pokażę, że będę jeszcze
lepszy! Johoho!",,,"Você fez um ótimo trabalho protegendo a
aldeia, mas eu não serei superado por
<LSNR {um girino} {uma girina}> como você! Dohoho!","지금까지 자네가 잘 지켜준 마을,
이번엔 우리가 힘쓸 차례다개골.
나도 아직 젊은이 못지않다개골.","你費盡心力保護了這座村莊，
接下來就交給咱們努力呱。
老夫可不會輸給年輕人呱。","这村子一直由你守护至今，这次轮到
我们来守护呱。老夫也还宝刀未老呱。",,,,,,,,"لقد قمت بعمل رائع في حماية القرية،
لكن لن يهزمني صبي صغير
مثلك! جوهوهو!",,,,,,,,,,,
bf539a7a-8cec-4442-a206-3c8d01de67a2,1452607786,会話終了,,,,,,,,,,,,,,,,,,,,,,,,,,,,,,,,,,,,,,,,nid101_base0_003,"でも、実際おぬしが一番頼りになるからね。
いざというときはちゃんと呼ぶから
そのときは、頼んだでゲコ。","I will admit that you have been most
dependable, and so I may call on you
when the need arises.","Tu es quelqu'un de fiable en tout cas,
alors je ferai peut-être appel à toi
en cas de besoin.","Ammetto che sei molto affidabile, quindi
ti chiamerò se ce ne sarà bisogno.","Ich gebe zu, du hast dich als höchst
verlässlich erwiesen, ich rufe dich,
wenn es nötig ist.","Reconozco que se puede contar contigo,
así que lo mismo te llamo si surge la
necesidad.","Человек ты надежный, спору нет,
поэтому когда придет время,
я попрошу тебя о помощи.","Przyznaję, że można było na tobie polegać.
W razie czego cię wezwę.",,,"Admito que sempre pudemos contar com
você e, por isso, posso te convocar
quando for necessário.","물론 자네가 제일 믿음직스럽지.
위급한 상황엔 꼭 부를 테니
그때는 잘 부탁한다개골.","不過，你還是咱們最可靠的戰力。
如果遇到緊急狀況，一定會找你的。
到時再請你多幫忙呱。","不过，你依然是最可靠的呱。出什么事的话，
我们一定会通知你，到时候就靠你了呱。",,,,,,,,"سأعترف <LSNR {بأنك كنت} {بأنكِ كنتِ}> أكثر شخص أعتمد عليه،
ولذا يمكنني الاتصال <LSNR {بك} {بكِ}>
عند الحاجة.",,,,,,,,,,,
fe19ba1d-230c-4a5d-a727-2d7515d3e15f,599563346,,(default)世間話,,,,この会話フラグがONなら→,EV_PRO_MR_002_01_01,,この会話フラグがOFFなら→,EV_PRO_MR_003_01_01,,,,,,,,,,,,,,,,,,,,,,,,,,,,,,,nid101_base2_000,"おぬしが里を出てから、
ウツシがうるさくてたまらんでゲコ。","Johoho! Young Utsushi has not shut up
since your departure from the village.","Depuis ton départ du Village,
le jeune Utsushi ne parle que de toi.","Ohohoh! Il giovane Utsushi non ha chiuso
bocca da quando sei <LSNR {partito} {partita}>.","Johoho! Utsushi hat nicht aufgehört zu
reden, seit du das Dorf verlassen hast.","¡Jo, jo, jo! Desde que te fuiste de la
aldea, Utsushi no se calla ni debajo del
agua.","Йо-хо-хо! Молодой Уцуси не умолкал
ни на секунду после твоего отъезда.","Johoho! Młody Utsushi nie może
zamilknąć od czasu twego
wyjazdu z wioski.",,,"Dohoho! O jovem Utsushi não parou de
matraquear desde que você partiu.","자네가 마을을 나간 후로
우츠시가 시끄러워 죽겠다개골.","自從你離開村子後，
倪泰就囉嗦個沒完呱。",自从你离开村子，倪泰就烦得不得了呱。,,,,,,,,"جوهوهو! لم يصمت أوتسوشي الصغير
منذ <LSNR {مغادرتك} {مغادرتكِ}> للقرية.",,,,,,,,,,,
b61222e1-5201-4683-b85d-b2919a2ee1c2,1033643157,,,,,,,,,,,,,,,,,,,,,,,,,,,,,,,,,,,,,,,,,nid101_base2_001,"心配せずとも、うまくやっとるに
決まっとると伝えとるでゲコが、
どうも落ち着かんようで…。","I told him that there was no need to worry,
that everything would be fine, but my words
appear to have fallen on deaf ears...","Je lui ai dit qu'il n'y avait pas lieu
de s'inquiéter, que tout irait bien,
mais il ne m'écoute pas.","Gli ho detto che non deve preoccuparsi,
che andrà tutto bene, ma temo che non
mi abbia dato retta...","Ich habe ihm gesagt, dass alles gut werden
wird und kein Grund zur Sorge besteht.
Aber das stieß auf taube Ohren.","Ya le dije que no se preocupara, que
todo iría bien; pero le entra por un
oído y le sale por el otro.","Я говорил ему, что волноваться
нет причин и что все будет хорошо,
но ему как горохом об стену...","Mówiłem mu, że nie ma się co martwić
i wszystko będzie w porządku,
ale nie słucha mnie...",,,"Eu disse a ele que não havia motivo para
se preocupar, que tudo ia ficar bem, mas
minhas palavras caíram em ouvidos moucos.","걱정 안 해도 어련히 잘하고
있을 거라고 하는데도
불안한가 보다개골…","雖然老夫說你一定會解決一切，
要他別煩惱呱，
但他似乎就是放不下心……","老夫都跟他说了别担心，你肯定会
顺顺当当的呱，但他就是放不下心……",,,,,,,,"أخبرته أنه لا داعي للقلق،
وأن كل شيء سيكون على ما يرام، لكن يبدو أن كلماتي
وقعت على آذان صماء...",,,,,,,,,,,
0c8b5e54-0cbe-48bb-90d6-4fa68edee538,1396406169,会話終了,,,,,,,,,,,,,,,,,,,,,,,,,,,,,,,,,,,,,,,,nid101_base2_002,"…で、うまくやっとるでゲコ？
なにか、困ったことはないでゲコか？","Johoho! So, how's it going?","Ho ho ho ! Alors, comment ça va ?","Ohohoh!
Allora, come stai?","Johoho.
Nun, wie geht es dir?","¡Jo, jo, jo!
Así que, bueno, ¿qué tal va la cosa?","Йо-хо-хо,
как поживаешь?","Johoho.
Jak ci się wiedzie?",,,"Dohoho
Mas como você vai, jovem filhote?","…그래서 잘하고 있느냐개골?
뭐 곤란한 일은 없고개골?","所以說……你這陣子還順利嗎呱？
有沒有什麼煩惱呱？","……所以，你干得还顺利呱？
有没有遇到什么困难呱？",,,,,,,,جوهوهو! حسنًا، كيف تسير الأمور؟,,,,,,,,,,,
206daaf6-5882-4c0d-a20f-9c5b10ffa0a2,3024060612,,(default)世間話,,,,この会話フラグがONなら→,EV_PRO_MR_003_01_01,,この会話フラグがOFFなら→,EV_PRO_MR_004_01_01,,,,,,,,,,,,,,,,,,,,,,,,,,,,,,,nid101_base3_000,"お～う、<PL>。
おぬし、なにをこんなところで
油を売っとるでゲコ。","What are you doing wasting your time
here? Johoho!","Qu'est-ce que tu fais là, au fait ?
T'as rien de mieux à faire ?","Che ci fai qui a perdere tempo?
Ohohoh!","Was verschwendest du
hier deine Zeit? Johoho!","¿Qué haces aquí perdiendo el tiempo?
¡Jo, jo, jo!","Что ты здесь <LSNR {забыл} {забыла}>?
Йо-хо-хо!","Czemu tu marnujesz czas?
Johoho!",,,"Por que você está perdendo seu tempo
por aqui? Dohoho!","오~ <PL>.
자네, 왜 이런 데서
농땡이 피우고 있는 거냐개골.","噢～<PL>。
你怎麼在這種地方打混摸魚呱？","噢～<PL>。
你怎么在这儿偷懒呱？",,,,,,,,"لماذا <LSNR {تضيع وقتك} {تضيعي وقتكِ}>
هنا؟ جوهوهو!",,,,,,,,,,,
d9494adf-7bcf-463a-afa1-9bd7a3226bf6,2657585251,,,,,,,,,,,,,,,,,,,,,,,,,,,,,,,,,,,,,,,,,nid101_base3_001,"おぬしはその力を期待されてエルガドへ
招かれてとるでゲコよ。きちんと
その役目を果たさんとダメでゲコ。","You were summoned to Elgado with
the hopes and wishes of everyone
here. Don't let us down!","Elgado a mis beaucoup d'espoirs
en toi, alors j'espère que tu seras
à la hauteur !","Sono state le speranze e i desideri
di tutti quanti a chiamarti qui.
Non ci deludere.","Du wurdest auf den Wunsch aller nach
Elgado gerufen. Lass uns nicht hängen!","Elgado solicita tu presencia. Aquí todos
hemos depositado en ti nuestros deseos
y esperanzas. ¡No nos decepciones!","Тебя вызвали в Элгадо —
все на тебя надеются.
Не подведи нас!","Wezwano cię do Elgado z nadziejami 
i życzeniami nas wszystkich. 
Nie zawiedź nas!",,,"Convocaram você a Elgado com as
esperanças e sonhos de todo mundo!
Não nos decepcione!","엘가도는 네 실력을 믿고
불러들인 거다개골. 그 역할을
제대로 해내야 한다개골.","人家是期待你發揮所長，
所以才邀請你到艾爾卡多呱。
你得好好完成職責才行呱。","人家叫你去埃尔迦德是因为看好你的实力呱。
不拿出点成绩来可不行呱。",,,,,,,,"تم <LSNR {استدعاؤك} {استدعاؤكِ}> الى إلجادو
مع آمال وأمنيات الجميع.
لا <LSNR {تخذلنا} {تخذلينا}>!",,,,,,,,,,,
01d31753-fe79-4921-a335-b8e236b5c18d,2048216424,,,,,,,,,,,,,,,,,,,,,,,,,,,,,,,,,,,,,,,,,nid101_base3_002,"王域生物も出とるわけだし、
やることはたくさんあるはずでゲコ！","Surely you have a lot on your plate,
with the Kingdom's monsters and all...","Tu dois avoir du pain sur la planche
avec tous les monstres du Royaume...","Di sicuro hai tanto da fare, con quei
mostri del regno e tutto il resto.","Du hast sicherlich eine Menge zu tun mit
den Monstern des Königreichs und allem...","Debes de estar hasta arriba con tanto
monstruo del reino y todo eso...","Уверен, дел у тебя по горло —
охота на монстров Королевства
и все такое!","Na pewno masz dużo pracy
z potworami Królestwa!",,,"Sei que você tem muito o que fazer,
com os monstros do Reino e tudo mais!","왕역생물도 나타났으니
할 일은 태산처럼 많다개골!","如今王域生物也現身了，
你應該有很多事要忙才對呱！",王域生物也已经出现，要做的事情该很多呱！,,,,,,,,"أنا متأكد من أن <LSNR {لديك} {لديكِ}> الكثير من الخطط
المتعلقة بوحوش المملكة وكل شيء...",,,,,,,,,,,
b002e787-64c1-4cf6-8ef8-335e418216f7,1933115391,会話終了,,,,,,,,,,,,,,,,,,,,,,,,,,,,,,,,,,,,,,,,nid101_base3_003,"…いや、だからって急いで帰らんでも
いいでゲコ。たまには休息も必要ゲコ。
一緒にうさ団子でも食べるでゲコ。","But there's no urgent need to return just
yet. Sometimes rest is necessary to keep
moving forward. Come, let us feast! Johoho!","Mais tu n'es pas à la seconde près.
Il est important de se reposer, tu sais.
Viens, on va manger d'abord !","Ma non devi rimetterti subito al lavoro.
Il riposo è importante per andare avanti.
Forza, abbuffiamoci. Ohohoh!","Aber du musst nicht sofort zurückkehren.
Manchmal ist Ruhe der beste Weg vor-
wärts. Komm, lass uns essen! Johoho!","Pero no es tan urgente que te vayas ya.
A veces conviene descansar para poder
seguir adelante. Ven a comer. ¡Jo, jo, jo!","Возвращаться прямо сейчас не нужно.
Иногда чтобы продолжить путь, надо
остановиться. Давай это отметим! Йохохо!","Nie ma potrzeby od razu wracać. Czasami
odpoczynek pozwala nam iść
naprzód. Zjedzmy coś! Johoho!",,,"Não há motivo para voltar imediatamente.
Às vezes é preciso descansar para seguir
em frente. Venha, vamos comer! Dohoho!","…아니, 그렇다고 서둘러 돌아가지는
마라개골. 가끔은 휴식도 필요하다개골.
같이 토끼 경단이나 먹자개골.","……但是也不必急著回去呱。
人偶爾也得好好休息呱。
咱們一起來吃兔兔糰子吧呱。","……哎呀，倒也不必这么急着赶回去呱。
偶尔休息一下也是必要的呱。来，和老夫
一起吃几串兔团子呱。",,,,,,,,"ليست هناك حاجة للعودة على الفور.
الراحة في بعض الأحيان تكون ضرورية لمواصلة المضي قدمًا.
هيا، <LSNR {دعنا} {دعينا}> نأكل! جوهوهو!",,,,,,,,,,,
ae4cfac4-9e4f-46e8-b90e-01ae09f9c9ec,3504823625,,(default)世間話,,,,この会話フラグがONなら→,EV_PRO_MR_004_01_01,,この会話フラグがOFFなら→,EV_PRO_MR_005_01_01,,,,,,,,,,,,,,,,,,,,,,,,,,,,,,,nid101_base4_000,"メル・ゼナ…かつて、王国の災厄とも
言われとったモンスターでゲコね。
ワシも話は聞いたことがあるでゲコ。","Malzeno... The elder dragon that continues
to plague the Kingdom. I've heard tales
of its many horrors.","Le Malzeno... Ce dragon ancien
est un véritable fléau pour le Royaume.
J'ai entendu des histoires abominables.","Malzeno, il drago anziano che continua
a essere la piaga del regno. Ho saputo
delle sue malefatte.","Der Malzeno... Dieser Drachenälteste
terrorisiert weiter das Königreich. Ich
habe viel über seine Schrecken gehört!","Malzeno... Ese dragón anciano continúa
suponiendo toda una plaga para el reino.
He oído cosas muy malas sobre él.","Этот Малзено, о котором все толкуют...
Говорят, это был бич Королевства.
Ходят слухи, он натворил много бед.","Co się tyczy Malzeno... Podobno
niszczył kiedyś Królestwo. Słyszałem
okropne historie o nim.",,,"Malzeno... O dragão ancião que 
continua a assolar o Reino. Ouvi
histórias dos muitos horrores dele.","멜-제나… 옛날에 왕국의 재앙이라고도
불린 몬스터다개골.
나도 얘기는 들어 봤다개골.","爵銀龍……
那是過去被稱為王國災厄的魔物呱。
老夫也曾經聽過牠的名字呱。","爵银龙……这头怪物以前被称为
王国的灾祸呱。老夫也有所耳闻呱。",,,,,,,,"مالزينو الذي يتحدثون عنه...
قيل ذات مرة إنه وباء للمملكة.
لقد سمعت حكايات عن أهواله العديدة.",,,,,,,,,,,
9a8961ff-21c1-4903-9a45-1052064a88a3,1707107940,,,,,,,,,,,,,,,,,,,,,,,,,,,,,,,,,,,,,,,,,nid101_base4_001,"まあ、災厄だろうがなんだろうが
おぬしの力をもってすれば
なんら問題ないはずでゲコ。","Plague or no plague, the fire that burns
inside you will guide you on the path
to victory!","Mais fléau ou pas, je suis sûr
que tu trouveras un moyen de l'éliminer.","Piaga o no, il fuoco che brucia dentro
di te ti guiderà nel cammino alla vittoria!","Plage oder nicht, das in dir brennende
Feuer wird dich auf den Pfad zum Sieg
führen!","Pero, por muchas plagas que haya,
¡el fuego que arde en tu interior seguirá
indicándote el camino hacia la victoria!","Как бы там ни было, уверен,
пламя, горящее внутри, приведет
тебя к победе!","Niszczył, czy nie niszczył, na pewno
znajdziesz sposób na pokonanie go.",,,"Assolação ou não, a chama que
queima em seu interior vai guiar
você ao caminho da vitória!","그래도 재앙이든 뭐든
자네의 실력이라면
아무런 문제도 없을 거다개골.","不管是災禍還是什麼，
只要有你的身手，應該就不成問題了呱。","不过，无论是灾祸还是什么别的，
只要有你在，都不成问题呱。",,,,,,,,"سواء أكان وباء أم لا، الحماس 
المتأجج <LSNR {بداخلك سيوجّهك} {بداخلكِ سيوجّهكِ}> على 
طريق النصر!",,,,,,,,,,,
7961c72e-5e97-4cc6-8366-d5748c8cb0a7,2725826381,会話終了,,,,,,,,,,,,,,,,,,,,,,,,,,,,,,,,,,,,,,,,nid101_base4_002,"カムラの里の猛き炎の力、
思う存分、見せつけてやるといいゲコ！","Hop to it-to it and show them what
a hunter from Kamura Village can
really do!","Montre-leur de quel bois
on se chauffe à Kamura !","Fagli vedere di cos'è capace
<LSNR {un cacciatore} {una cacciatrice}> di Kamura!","Dann mal los!
Zeig ihnen, was <LSNR {ein Jäger} {eine Jägerin}> aus Kamura
wirklich kann!","¡Que aprendan de lo que es capaz <LSNR {un} {una}>
<LSNR {cazador} {cazadora}> de Kamura!","Покажи им, на что
<LSNR {способен охотник} {способна охотница}> из Камуры!","Pokaż im, co potrafią łowcy z Kamury!",,,"Vai lá! Vai lá e mostre a eles do que
<LSNR {um caçador} {uma caçadora}> da Aldeia de Kamura
é capaz!","카무라 마을의 맹렬한 불꽃의 힘을
아낌없이 보여 줘라개골!","你可是神火村的烈火，
好好發揮你的實力，熊熊燃燒吧呱！","你就让大家见识见识，炎火村的烈焰的
实力呱！",,,,,,,,"<LSNR {انطلق} {انطلقي}> إليها! 
<LSNR {وأرهم} {وأريهم}> ما يمكن أن <LSNR {يفعله صياد} {تفعله صيادة}>
من قرية كامورا!",,,,,,,,,,,
f58c8ae7-c168-442b-809f-0a3720375db5,2987110419,,(default)世間話,,,,この会話フラグがONなら→,EV_PRO_MR_005_01_01,,この会話フラグがOFFなら→,EV_PRO_MR_006_01_01,,,,,,,,,,,,,,,,,,,,,,,,,,,,,,,nid101_base5_000,"おぬしが里の外で活躍するというのは
もちろん嬉しいけど、反面、少しさびしい
気持ちもないわけではないでゲコ。","Although it brings me great joy to see you
doing so well beyond our village walls,
I admit I am a bit-bit...sad.","Je suis ravi de te voir t'épanouir ainsi
loin du Village, mais je dois avouer
que ça me rend un peu triste aussi.","Anche se sono felice di vederti prosperare
fuori dalle mura del villaggio, ammetto
di essere un po'... triste.","Auch wenn ich mit Freude sehe, wie du
außerhalb des Dorfs gedeihst, muss ich doch
zugeben, dass ich ein wenig traurig bin.","Aunque me llena de gozo verte prosperar
allende los muros de la aldea, reconozco
que no puedo evitar estar algo triste.","Хоть меня и радуют твои успехи
за пределами деревни, должен признать,
мне все равно грустно.","Chociaż cieszę się, że osiągasz sukcesy
poza Kamurą, jakoś nie mogę
pozbyć się poczucia smutku.",,,"Ainda que me alegre ver você prosperar
tanto além da aldeia, tenho que admitir
que ainda sinto uma certa tristeza.","자네가 마을 밖에서 활약하는 건
물론 기쁘지만, 조금 쓸쓸한
마음이 들기도 한다개골.","聽到你在村外大展身手，
老夫固然高興，但卻感到有些落寞呱。","你能在村子外面大显身手，老夫自然高兴，
不过还是会觉得有些失落呱。",,,,,,,,"على الرغم من أن <LSNR {رؤيتك} {رؤيتكِ}>
<LSNR {تنجح} {تنجحين}> خارج أسوار القرية أمر يسعدني،
فإنني أعترف أنني لا أستطيع الهروب من الشعور بالحزن.",,,,,,,,,,,
