guid,crc?,<PageAttr>,<TalkAttr>,<VillageProgress>,<HallProgress>,<HunterRank>,<TalkTag>,<TalkTagParam>,<TalkTagComment>,<TalkTag>,<TalkTagParam>,<TalkTagComment>,<TalkTag>,<TalkTagParam>,<TalkTagComment>,<TalkTag>,<TalkTagParam>,<TalkTagComment>,<TalkTag>,<TalkTagParam>,<TalkTagComment>,<TalkTag>,<TalkTagParam>,<TalkTagComment>,<TalkTag>,<TalkTagParam>,<TalkTagComment>,<TalkTag>,<TalkTagParam>,<TalkTagComment>,<TalkTag>,<TalkTagParam>,<TalkTagComment>,<TalkAction1>,<TalkAction1Param>,<TalkAction1Comment>,<TalkAction2>,<TalkAction2Param>,<TalkAction2Param2>,<TalkAction2Comment>,<KohakuProgress>,entry name,Japanese,English,French,Italian,German,Spanish,Russian,Polish,Dutch,Portuguese,PortugueseBr,Korean,TraditionalChinese,SimplifiedChinese,Finnish,Swedish,Danish,Norwegian,Czech,Hungarian,Slovak,Arabic,Turkish,Bulgarian,Greek,Romanian,Thai,Ukrainian,Vietnamese,Indonesian,Fiction,Hindi,LatinAmericanSpanish
d1fa0f9b-2300-4a10-8ddd-f1a1db2b8150,1133067180,,,,,,,,,,,,,,,,,,,,,,,,,,,,,,,,,,,,,,,,,nid101_base5_001,"まあ、こういうのは年寄り特有の
感傷というものでゲコ。若いモンは気にせず
外で見聞を広めてくるといいでゲコ。","Alas, this is what it's like to get old.
Go out and make your mark. Leave
the sentimentality to us elders...","Hélas, c'est ça, de vieillir. On devient
sentimental. T'inquiète pas de ça...
Va conquérir le monde !","È così quando si invecchia. Voi giovani
lasciate il segno in giro per il mondo,
a noi non resta che il sentimentalismo...","Nun, so ist es, wenn man alt wird.
Ziehe los und setze ein Zeichen.
Sentimentalität ist für uns Alte.","Ah, así somos los viejos.
Tú deja tu marca en el mundo mientras
nosotros nos ponemos sentimentales...","Вот что значит стареть. Молодые
пробивают себе дорогу в жизнь,
а старики сидят и вздыхают.","Tak wygląda starość. Młodzi idą w świat
i osiągają sukcesy. Starszym
zostaje sentymentalizm.",,,"Isso que é envelhecer. Vocês jovens
saem pelo mundo e deixam sua marca. Deixem
a sentimentalidade para nós velhos.","뭐, 이건 늙은이 특유의 청승 같은
거다개골. 젊은이는 신경 쓰지 말고
밖에서 견문을 넓히고 와라개골.","不過這也是上了年紀後才有的感慨吧呱。
年輕人就別放在心上，
好好拓展自己的視野吧呱。","嗨，人一上年纪就会有这种感伤呱。
你这种年轻人别在意，多在外面长长见识呱。",,,,,,,,"هكذا يبدو التقدم في السن.
عليكم أنتم الشباب الخروج إلى هناك وترك بصمتكم.
اتركوا العاطفة لنا نحن المسنين.",,,,,,,,,,,
647da1df-bcc3-4b04-b1fd-5e97a20984fd,584774723,会話終了,,,,,,,,,,,,,,,,,,,,,,,,,,,,,,,,,,,,,,,,nid101_base5_002,"…え？　いや、おぬしがおらんとさびしい
とかそういう意味じゃないでゲコ！
べ、別にワシ、さびしくなんかないし！","Hmm? Oh, I'm not missing you or anything
like that! Johoho! There's plenty here to
keep me occupied!","C'est pas comme si tu me manquais ou
quoi ! Le travail ne manque pas ici !","Oh? Non è che mi manchi, ho tante
cose di cui occuparmi qui. Ohohoh!","Hmm? Oh, es ist nicht so, dass ich dich
vermisse oder so! Johoho! Es gibt viel,
was mich hier auf Trab hält. ","¿Mmm? ¡Oh, no! ¡No es que te eche de menos,
ni nada de eso! ¡Jo, jo, jo!
¡Si aquí siempre estamos que no paramos!","Хм? Ты не подумай, что я по тебе скучаю!
Йо-хо-хо! Мне тут есть чем заняться!","Nie chodzi o to, że tęsknię za tobą. Mam
tu dużo zajęć. Johoho!",,,"Não é como se eu sentisse saudades suas
ou nada assim. Tem muita coisa para me
manter ocupado aqui. Dohoho!","…뭐? 아니, 자네가 없으면 외롭다는
뜻이 아니다개골!
따, 딱히 외롭지 않아!","……嗯？不，老夫才不會
在你離開之後覺得落寞呱！
老、老夫一點也沒有！","……嗯？不对，老夫并非在说你不在就会
很失落呱！老、老夫才不觉得失落！",,,,,,,,"ليس الأمر وكأنني <LSNR {أفتقدك} {أفتقدكِ}> أو أي شيء من هذا القبيل.
هناك الكثير مما يجعلني مشغولًا هنا.
جوهوهو!",,,,,,,,,,,
4be138c2-2f32-43e7-8ace-7383cda3896a,671123445,,(default)世間話,,,,この会話フラグがONなら→,EV_PRO_MR_006_01_01,,,,,,,,,,,,,,,,,,,,,,,,,,,,,,,,,,nid101_base6_000,"お～う、<PL>。
今日も元気でハンターやっとるか？","Johoho, <PL>!
How's it going?","Hé, <PL> !
Comment vas-tu ?","Ohohoh, <PL>!
Come va oggi?","Johoho, <PL>!
Wie läuft's?","¡Jo, jo, jo!
<PL>, ¿qué tal estás?","Йо-хо-хо, <PL>,
как охота сегодня?","Johoho, <PL>,
Jak idą łowy?",,,"Dohoho, <PL>!
Como vai a caçada?","오~ <PL>.
오늘도 힘차게 헌터 업무 중인가개골?","哦～<PL>。
今天也有善盡獵人的職責嗎？","噢～<PL>。
你今天也精神饱满地在狩猎吗？",,,,,,,,"جوهوهو، <PL>!
كيف كان الصيد اليوم؟",,,,,,,,,,,
a2b79411-1ff3-4a87-bc1e-87c749393325,2260684280,,,,,,,,,,,,,,,,,,,,,,,,,,,,,,,,,,,,,,,,,nid101_base6_001,"おぬしの活躍は、ギルドでも大評判でゲコ。
里の英雄どころか、王国の英雄にまで
なっちゃったでゲコな～。","Well, tadpole, you've not only become
the hero of the Village, but hero of the
Kingdom as well!","On dirait que tu es <LSNR {devenu le héros}{devenue l'héroïne}>
du Royaume aussi, à présent !","Beh, <LSNR {pivellino} {pivellina}>, a quanto pare ora non sei
solo <LSNR {l'eroe} {l'eroina}> del villaggio, ma anche <LSNR {quello} {quella}>
del regno. Ohohoh!","Nun, Kaulquappe, du bist nicht nur <LSNR {der} {die}>
<LSNR {Held} {Heldin}> des Dorfs, sondern wohl auch
des Königreichs!","Vaya, <LSNR {jovenzuelo} {jovenzuela}>, no te conformas con
ser <LSNR {nuestro héroe} {nuestra heroína}>; parece que también
quieres serlo del reino. ¡Jo, jo, jo!","Ну что ж, ты <LSNR {стал} {стала}> не только
героем деревни, но, похоже,
и всего Королевства. Йо-хо-хо!","A niech to! Nie tylko udało ci się
ochronić wioskę, ale również zdobyć
sławę w Królestwie. Johoho!",,,"Muito bem, jovem, você não só se tornou
<LSNR {o herói} {a heroína}> da Aldeia, mas do Reino também,
ao que parece. Dohoho!","자네의 활약상은 길드에서도 화제다개골.
마을의 영웅을 뛰어넘어
왕국의 영웅이 되었다개골~","你的帥氣表現，在公會也深受好評呱。
你這下不只是神火村的英雄，
而是變成王國的英雄啦呱～","你的表现在公会也是好评如潮呱。
不仅是村庄的英雄，还成了王国的英雄呱～",,,,,,,,"حسنًا <LSNR {أيها الشاب} {أيتها الشابة}>، لم <LSNR {تصبح} {تصبحي}>
<LSNR {بطل} {بطلة}> القرية فحسب، بل <LSNR {بطل} {بطلة}> المملكة
أيضًا، على ما يبدو. جوهوهو!",,,,,,,,,,,
4e59f346-f0a6-448f-928d-51e7e75fe503,874479514,,,,,,,,,,,,,,,,,,,,,,,,,,,,,,,,,,,,,,,,,nid101_base6_002,"ギルドマネージャーのワシも
鼻が高いでゲコよ。ゲコゲコ。","And as an elder of this village, I couldn't
be prouder of you.","En tant qu'ancien de ce village,
je suis très fier de toi.","In qualità di capo di questo villaggio,
sono molto orgoglioso di te.","Und als ein Ältester dieses Dorfs könnte
ich nicht stolzer auf dich sein.","Y, como anciano de esta aldea, más orgulloso
no puedo estar.","Для меня, как для Мастера Гильдии,
это особый повод для гордости.","Jako zarządca gildii jestem
z ciebie bardzo dumny.",,,"Como administrador da guilda, eu não
poderia estar mais orgulhoso.","길드 매니저인 나도
어깨가 으쓱한다개골. 개골개골.","老夫身為公會經紀人，
同樣深感驕傲呱。呱呱。","老夫这个公会经纪人，
也是骄傲得不行呱。呱呱。",,,,,,,,"بصفتي كبير هذه القرية، لا يمكنني أن أكون أكثر فخرًا
<LSNR {بك} {بكِ}>.",,,,,,,,,,,
5b19336c-a031-49c6-99e9-2294a23e3c5d,3963404595,会話終了,,,,,,,,,,,,,,,,,,,,,,,,,,,,,,,,,,,,,,,,nid101_base6_003,"これからもハンターとして
どんどんクエストをこなして
その名を広く知らしめるでゲコ！","But that doesn't mean you should start taking
it easy on your quests though. There's still
more for you to do! Now, hop to it-to it!","Mais ce n'est pas pour ça que tu vas pouvoir
te la couler douce question quêtes
à présent. Allez file ! Au travail !","Però ora non prendertela comoda
durante le missioni. C'è sempre qualcosa
di nuovo da fare! Ora vai!","Aber das bedeutet nicht, dass du bei den
Quests nachlassen solltest. Es gibt noch
mehr für dich zu tun! Also hoppel los!","Pero no vayas ahora a descuidar esas
misiones, ¿eh? ¡Aún te quedan muchos retos
por conseguir! ¡Así que, a por ellos!","Но это не значит, что выполнять задания
теперь нужно спустя рукава. Так что иди
и дальше зарабатывай себя имя!","Co nie oznacza, że możesz zaniedbywać
zadania. Bierz je i zdobądź jeszcze
więcej sławy!",,,"Só que isso não quer dizer é para você
pegar leve nas missões. Agora sai para o
mundo e conquiste ainda mais fama!","앞으로도 헌터로서
퀘스트를 척척 수행하고
그 이름을 널리 알려라개골!","今後你也要以獵人的身分解決各種任務，
讓自己聲名遠播呱！","你今后也要好好当猎人，完成各种任务，
打响自己的名号呱！",,,,,,,,"هذا لا يعني أنه يجب أن <LSNR {تبدأ} {تبدأي}> في التهاون
في <LSNR {مهامك} {مهامكِ}>. <LSNR {اخرج} {اخرجي}> إلى هناك
و<LSNR {انشر} {انشري}> <LSNR {اسمك} {اسمكِ}> أكثر!",,,,,,,,,,,
0a5738a9-9535-44e6-93d9-db44da3a3906,2824146389,,(default)世間話,,,,この会話フラグがONなら→,EV_PRO_HALL_ADD_008_99_01,,この会話フラグがOFFなら→,EV_PRO_MR_002_01_01,,,,,,,,,,,,,,,,,,,,,,,,,,,,,,,nid101_ch1_000,"<PL>が里を出て、
王国の仕事をするときが来るとは
思っていなかったでゲコよ。","I never thought I'd see the day when you
would leave the village. And now you're
off to work for the Kingdom! Johoho!","Si on m'avait dit qu'un jour tu quitterais
le village pour aller servir le Royaume !","Non avrei mai pensato di vedere il
giorno in cui avresti lasciato il villaggio.
E ora lavori persino per il regno! Ohohoh!","Ich dachte, ich würde den Tag nicht erleben,
da du das Dorf verlässt. Und jetzt gehst du,
um für das Königreich zu arbeiten. Johoho!","Se me hace difícil que abandones la aldea.
¡Pero vas a trabajar nada menos que para
el reino! ¡Jo, jo, joooo!","Не думал, что доживу до того дня,
когда ты будешь работать на Королевство.
Йо-хо-хоооо!","Nie sądziłem, że dożyję dnia, kiedy
opuścisz wioskę i zaczniesz pracę dla
Królestwa. Johohooo!",,,"Nunca achei que veria o dia quando você
partiria da aldeia para trabalhar para
o Reino. Dohoho!","<PL>, 자네가 마을을 나가
왕국 일을 하는 날이 올 줄은
몰랐다개골.","想不到<PL>
居然要離開村莊，去王國工作。
老夫從未想過會有這天呱。","<PL>，你竟然要离开村子
去王国那里做事，真没想到会有这么一天呱。",,,,,,,,"لم أعتقد أبدًا <LSNR {أنك} {أنكِ}>
<LSNR {ستغادر} {ستغادري}> القرية للعمل من أجل المملكة.
جوهوهو!",,,,,,,,,,,
464cad75-2246-4b81-83a7-190321d7771f,659880487,,,,,,,,,,,,,,,,,,,,,,,,,,,,,,,,,,,,,,,,,nid101_ch1_001,"もちろんおぬしの力はワシが一番よく
わかっとるつもりだゲコ。だからいつかは
こんなときが来るとは思っとったが…","I've always been well aware of your
potential, so it comes as no surprise.
I knew you would leave sooner or later...","J'avais conscience de ton potentiel,
alors ce n'est pas si surprenant.
Je savais que tu partirais tôt ou tard...","Conosco bene il tuo potenziale e le tue
abilità, quindi non mi sorprende. Sapevo
che prima o poi sarebbe successo.","Ich wusste immer um dein Potenzial, daher
ist das alles für mich keine Überraschung.
Ich wusste, dass du gehen würdest.","No me sorprende: siempre he tenido claro
que tenías madera y potencial.
Sabía que tarde o temprano tendrías que irte...","Я знал, что у тебя огромный потенциал
и тебе не занимать отваги, так что я не
удивлен. Я знал, что это случится...","Zawsze widziałem twój potencjał
i waleczność, więc nie jestem zaskoczony.
To musiało nastąpić...",,,"Eu sempre estive muito ciente do seu
potencial e poder, então não estou
surpreso. Sabia que ia acontecer um dia.","물론 자네의 실력은 내가 제일
잘 안다개골. 그래서 언젠간
이런 날이 올 거라고는 생각했지만…","當然，老夫最清楚你的力量了呱。
所以內心也知道這一刻遲早會到來……","你的能力，老夫最清楚不过了呱。
所以也知道这一天总会来的……",,,,,,,,"لطالما كنت على دراية جيدة <LSNR {بإمكانياتك} {بإمكانياتكِ}>
<LSNR {وبراعتك} {وبراعتكِ}>، لذلك لم يكن الأمر مفاجئًا. كنت أعلم
أن ذلك سيحدث عاجلاً أم آجلاً...",,,,,,,,,,,
a97d6bc8-03e8-4813-80fa-051c20b6842a,450537135,会話終了,,,,,,,,,,,,,,,,,,,,,,,,,,,,,,,,,,,,,,,,nid101_ch1_002,"ほんに、大きくなったでゲコ。おぬしが
ほんの豆粒ほどの大きさだった頃から
知っとる身としては、感無量でゲコ。","I've known you since you were in diapers,
and now look at you. It fills my heart
with joy to see how far you've come.","Je te connais depuis tes débuts...
Tu en as parcouru, du chemin.
Ça me remplit de bonheur.","Ti conosco da quando avevi il pannolino
e ora guardati! Mi riempie di gioia vedere
fin dove sei <LSNR {arrivato} {arrivata}>.","Ich kenne dich seit du in Windeln warst.
Und jetzt sieh dich an. Es erfüllt mein Herz
mit Freude, wie weit du gekommen bist.","Te conozco desde que estabas en pañales,
y mírate ahora. Se me alegra el corazón
al verte llegar tan lejos.","Я помню тебя, еще когда ты <LSNR {был} {была}> размером
с данго, а теперь вон ты <LSNR {какой} {какая}>. Душа
радуется, когда вижу, чего ты <LSNR {добился} {добилась}>.","Znam cię od czasu, gdy <LSNR {byłeś} {byłaś}> nie <LSNR {większy} {większa}> niż
dango. A teraz proszę bardzo. Czuję
wielką radość, widząc twój postęp.",,,"Sabia desde que você era do tamanho de
um dango, e agora olha só para você. Meu
coração se alegra ao ver seu progresso.","정말 많이 컸다개골. 자네가
콩알만 했을 시절부터 알고 지낸
나로서는 감개무량하다개골.","你真的是成長了不少呱。
從你還是個小不點的時候，
老夫就看著你長大，真是讓人感慨萬千呱。","你真的成长了呱。老夫看着你从一个小不点
长到现在，回想起来真是感慨万千呱。",,,,,,,,"لقد <LSNR {عرفتك} {عرفتكِ}> منذ أن <LSNR {كنت} {كنتِ}> بحجم
دانجو الأرانب، والآن <LSNR {انظر إلي نفسك} {انظري إلى نفسكِ}>. يمتلئ
قلبي بالفرح من رؤية <LSNR {حالك} {حالكِ}> الآن.",,,,,,,,,,,
d7aa4526-4680-4853-9bc4-0380fba9ecea,3965385257,,(default)世間話,,,,この会話フラグがONなら→,EV_PRO_MR_002_01_01,,この会話フラグがOFFなら→,EV_PRO_MR_003_01_01,,,,,,,,,,,,,,,,,,,,,,,,,,,,,,,nid101_ch2_000,"最近、ヒノエとミノトもちょいちょい
エルガドへ行くようになったでゲコ。","I hear Hinoa and Minoto have also been
spending some time in Elgado.","J'ai entendu dire que Hinoa et Minoto
passaient du temps à Elgado elles aussi.","Ho sentito che anche Hinoa e Minoto
trascorrono del tempo a Elgado.","Ich höre, dass Hinoa und Minoto
auch Zeit in Elgado verbringen.","Creo que Hinoa y Minoto también se han
estado dejando ver por Elgado.","Говорят, Хиноа и Миното
тоже сейчас в Элгадо.","Słyszałem, że Hinoa i Minoto
również spędzają czas w Elgado.",,,"Soube que Hinoa e Minoto também estão
visitando Elgado.","요즘 히노에와 미노토도 이따금
엘가도에 다녀온다개골.","最近火芽跟水藝
有時也會去艾爾卡多呱。",最近火芽和水芸也会时不时去埃尔迦德呱。,,,,,,,,"سمعت أن هينوا ومينوتو
يقضيان بعض الوقت أيضًا في إلجادو.",,,,,,,,,,,
96d8f434-c0e5-4478-94af-f0a613eebc7a,3338062629,,,,,,,,,,,,,,,,,,,,,,,,,,,,,,,,,,,,,,,,,nid101_ch2_001,"ミノトは最初ちょっと渋っとったけど
ヒノエが乗り気だったし。ヒノエを１人で
行かせるミノトではないでゲコ。","Minoto was a little reluctant at first, but
Hinoa's enthusiasm won her over. Minoto
is not one to leave Hinoa all by herself.","Minoto était un peu réticente au début,
mais Hinoa a réussi à la convaincre. Minoto
ne laisserait pas Hinoa toute seule.","Minoto era riluttante all'inizio, ma è
stata contagiata dall'entusiasmo di Hinoa.
Minoto non la lascerebbe mai da sola.","Minoto zögerte erst, aber Hinoas
Enthusiasmus überzeugte sie.
Minoto lässt Hinoa nicht allein.","Minoto al principio no estaba segura,
pero Hinoa estaba muy entusiasmada, así
que fue con ella para acompañarla.","Сначала Миното упрямилась, но
энтузиазм Хиноа взял верх.
Миното не оставит Хиноа одну.","Minoto najpierw się wahała, ale entuzjazm
Hinoi ją zaraził. Minoto nigdy
nie zostawi Hinoi samej.",,,"Minoto relutou a princípio, mas o
entusiasmo de Hinoa a convenceu. Minoto
não deixaria Hinoa ir sozinha.","미노토는 처음엔 좀 떨떠름해 보였는데
히노에가 적극적이다 보니 히노에를 혼자
보낼 미노토가 아니다개골.","水藝雖然一開始不太願意，
但是火芽倒是很有興趣，
水藝也自然不會讓火芽隻身前往呱。","水芸刚开始有些不太情愿，火芽倒是一副很想
去的样子，水芸不放心让火芽一个人去呱。",,,,,,,,"كانت مينوتو مترددة بعض الشيء في البداية، لكن
حماسة هينوا تغلبت عليها. مينوتو
ليست من تترك هينوا بمفردها.",,,,,,,,,,,
35a97cda-d665-428b-a40c-623fd8447269,2802311331,,,,,,,,,,,,,,,,,,,,,,,,,,,,,,,,,,,,,,,,,nid101_ch2_002,"まだ人見知りしとるようだけど…
まあ、きっとそのうち慣れるでゲコ。","They're still a little on the shy side, but
I'm sure some dango will draw them out
of their shell. At least, Hinoa! Johoho!","Elles restent réservées, c'est vrai.
Mais des dango les feront sortir de leur
coquille. Du moins Hinoa, c'est sûr !","Sono ancora un po' timide, ma sono
convinto che basterà qualche dango per
motivarle di più! Almeno per Hinoa! Ohohoh!","Sie sind immer noch recht schüchtern,
aber ich werde sie schon noch hervor-
locken. Zumindest Hinoa! Johoho!","Aunque son un poco tímidas, seguro que con
un cebo como los dango se irán abriendo poco
a poco. ¡Por lo menos, Hinoa! ¡Jo, jo, jo!","Они немного стеснительные,
но уверен, данго поможет это устранить.
По крайней мере, у Хиноа! Йо-хо-хо!","Nadal są nieśmiałe, ale na pewno
wszystko będzie dobrze.",,,"Elas ainda estão meio tímidas, mas sei
que ficarão bem.","아직 낯을 가리는 모양이지만…
뭐, 금방 적응할 거다개골.","雖然她還有些怕生……
不過應該很快就會克服了呱。","虽然她好像还是有些怕生……
不过一定很快就会习惯的呱。",,,,,,,,"ما زالتا خجولتين قليلاً،
لكنني متأكد من أنهما ستكونان على ما يرام.",,,,,,,,,,,
22d0bf3d-51a8-40ee-97a4-cce1ff902c00,1331318226,会話終了,,,,,,,,,,,,,,,,,,,,,,,,,,,,,,,,,,,,,,,,nid101_ch2_003,"おぬしも、あっちで見かけたら
声をかけてやってくれゲコ。
おぬしの顔を見ればきっと安心するでゲコ。","If you run into them don't forget to
say hi. I'm sure they'll be relieved to
see a friendly face.","Si tu les vois là-bas, salue-les de ma part.
Je suis sûr qu'elles seront ravies de voir
un visage familier.","Se le incontri, ricordati di salutarle.
Saranno felici di vedere un volto noto.","Wenn du sie triffst, dann grüße sie. Sie
sind bestimmt erleichtert, wenn sie ein
bekanntes Gesicht sehen.","Si las ves, recuerda saludarlas. Seguro
que agradecerán encontrarse con una cara
conocida.","Если встретишь их, не забудь передать
им привет. Уверен, они будут
очень ему рады.","Jeśli je spotkasz, pozdrów je ode mnie.
Na pewno się ucieszą, widząc znajomą
twarz.",,,"Se você esbarrar com elas, não deixe de
dizer oi por mim. Sei que gostarão de
ver um rosto conhecido.","자네도 저쪽에서 만나면
말 한마디 건네 줘라개골. 자네의
얼굴을 보면 분명 안심할 거다개골.","如果你在那邊遇見她，
記得打個招呼呱。
她在那邊見到你的話，一定能夠放下心來呱。","你要是在那边遇见水芸，就跟她打声招呼呱。
见到你，她一定会安心许多的呱。",,,,,,,,"إذا <LSNR {صادفتهما} {صادفتِهما}> فلا <LSNR {تنسَ} {تنسِ}> أن
تحييهما. أنا متأكد من أنهما ستشعران بالارتياح
لرؤية وجه ودود.",,,,,,,,,,,
a9515fc1-1b86-4e85-a610-595c750e1da0,793242657,,(default)世間話,,,,この会話フラグがONなら→,EV_PRO_MR_003_01_01,,この会話フラグがOFFなら→,EV_PRO_MR_004_01_01,,,,,,,,,,,,,,,,,,,,,,,,,,,,,,,nid101_ch3_000,"最近、アヤメが生き生きしとるでゲコ。
里へ帰ってきた頃に比べれば
別人のようでゲコね。","Since returning to the village Ayame has
been a completely different person.
So full of life!","Depuis son retour au Village, Ayame
a totalement changé.
Elle est si pleine de vie à présent !","Da quando è tornata al villaggio, Ayame
è una persona diversa, piena di vita.","Seit der Rückkehr ins Dorf ist Ayame eine
völlig andere Person. So voller Leben!","Desde que volvió a la aldea, Ayame está
totalmente cambiada. ¡Vive la vida al
máximo!","Вернувшись в деревню, Аямэ
словно преобразилась.
Энергия из нее так и брызжет!","Po powrocie do wioski Ayame całkiem
się zmieniła. Teraz jest pełna życia!",,,"Desde que ela voltou à aldeia, Ayame
está completamente mudada.
Tão cheia de vida!","요즘 아야메는 생기가 넘친다개골.
마을로 돌아왔을 무렵과 비교하면
다른 사람 같다개골.","最近鳶尾很有精神呱。
比起剛回到村子時，
簡直就像換了個人呱。","最近菖蒲可是活力四射呱，和刚回村里的时候
比起来，简直像是换了个人呱。",,,,,,,,"منذ عودتها إلى القرية كانت ""أيامي""
شخصية مختلفة تمامًا.
مليئة بالحياة!",,,,,,,,,,,
161f4e8f-0440-4b13-9f46-2bf64ee5bc64,2202920536,,,,,,,,,,,,,,,,,,,,,,,,,,,,,,,,,,,,,,,,,nid101_ch3_001,"おぬしの活躍が
ずいぶん励みになってるようでゲコ。","It seems like tales of your heroism may
be having a positive effect on her.","Il semblerait que ton héroïsme
ait un effet positif sur elle.","Sembra che i racconti delle tue imprese
eroiche abbiano avuto un effetto positivo
su di lei.","Es scheint, als hätten die Geschichten
über deine Heldentaten einen
positiven Einfluss auf sie.","Se ve que las historias de tus hazañas
son una buena influencia para ella.","Похоже, на нее положительно влияют
рассказы о твоих геройских подвигах.","Wydaje się, że twoje bohaterskie
wyczyny miały na nią dobry wpływ.",,,"Parece que as histórias do seu heroísmo
tiveram um efeito positivo nela.","자네의 활약이
큰 힘이 되는 모양이다개골.",看來是你的表現激勵了她呱。,看来你的表现大大激励她呱。,,,,,,,,"يبدو أن حكايات <LSNR {بطولتك} {بطولتكِ}> لها
تأثير إيجابي عليها.",,,,,,,,,,,
