guid,crc?,<PageAttr>,<TalkAttr>,<VillageProgress>,<HallProgress>,<HunterRank>,<TalkTag>,<TalkTagParam>,<TalkTagComment>,<TalkTag>,<TalkTagParam>,<TalkTagComment>,<TalkTag>,<TalkTagParam>,<TalkTagComment>,<TalkTag>,<TalkTagParam>,<TalkTagComment>,<TalkTag>,<TalkTagParam>,<TalkTagComment>,<TalkTag>,<TalkTagParam>,<TalkTagComment>,<TalkTag>,<TalkTagParam>,<TalkTagComment>,<TalkTag>,<TalkTagParam>,<TalkTagComment>,<TalkTag>,<TalkTagParam>,<TalkTagComment>,<TalkAction1>,<TalkAction1Param>,<TalkAction1Comment>,<TalkAction2>,<TalkAction2Param>,<TalkAction2Param2>,<TalkAction2Comment>,entry name,Japanese,English,French,Italian,German,Spanish,Russian,Polish,Dutch,Portuguese,PortugueseBr,Korean,TraditionalChinese,SimplifiedChinese,Finnish,Swedish,Danish,Norwegian,Czech,Hungarian,Slovak,Arabic,Turkish,Bulgarian,Greek,Romanian,Thai,Ukrainian,Vietnamese,Indonesian,Fiction,Hindi,LatinAmericanSpanish
d1496e61-539e-4538-b9ea-5e41ce4dcf7c,2736767982,,,,,,,,,,,,,,,,,,,,,,,,,,,,,,,,,,,,,,,,nid306_v0_011,"<CAM:0>ちなみに、この広場ではオトモたちが
日々特訓を頑張っているのニャ！","<CAM:0>Anyway, every day, the Buddies
here work their tails off to get
better and stronger!","<CAM:0>Bref, ici, les Pilpoils s'entraînent à
s'en décrocher les coussinets pour
devenir plus forts !","<CAM:0>Comunque, qui i compagni si spaccano la coda
tutti i giorni per miaogliorarsi e diventare
più forti.","<CAM:0>Wie auch immer, die Buddys hier arbeiten sich
jedenfalls die Schnurrhaare krumm, um besser
und stärker zu werden!","<CAM:0>En cualquier caso, ¡los camaradas de aquí se
dejan la piel cada día para ser mejores y más
fuertes!","<CAM:0>Здесь спутники тренируются каждый день,
чтобы стать сильнее и лучше!","<CAM:0>W każdym razie, to tutaj kompani harują
codziennie w pocie pyszczka,
by być silniejszymi!",,,"<CAM:0>Enfim, todos os dias, os Amigos daqui
ralam muito pra ficar melhores
e mais fortes!","<CAM:0>참고로 이 광장에서는 동반자들이
매일 훈련을 하고 있다냥!","<CAM:0>順帶一提，這個廣場裡的隨從們，
每天都拼命地在進行特訓喔喵！","<CAM:0>顺便一说，随从们每天
都在这座广场上卖力特训喵！",,,,,,,,"<CAM:0>على أي حال، يعمل الأصدقاء يوميًا 
هنا بكل جد للتحسن
وتقوية أنفسهم!",,,,,,,,,,,
ace0efbb-64f6-4754-9046-2b91a70da4b5,296001935,会話終了,,,,,,,,,,,,,,,,,,,,,,,,,,,,,,,,,,,,,,,nid306_v0_012,"ボクからの紹介はこんなところかニャ。
詳しいことが知りたかったら、
直接みんなに話を聞いてみるといいニャ。","That's about all I've got for ya.
If you wanna know more, you'll
have to talk to everyone yourself!","Voilà, je crois qu'on a fait le tour !
Si tu veux en savoir plus, il va falloir
que tu ailles parler aux autres !","Questo è tutto. Se vuoi altre informazioni,
dovrai parlare con ognuno di perrrsona.","So viel von meiner Seite. Wenn du mehr
erfahren möchtest, musst du selbst mit
den anderen reden!","Eso es todo. Si quieres saber más,
tendrás que hablar con todos tú <LSNR {mismo} {misma}>.","В принципе, это все, что я могу сказать.
Если хочешь узнать больше, поговори
со всеми <LSNR {сам} {сама}>!","To już chyba wszystko. Jeśli chcesz
wiedzieć więcej, musisz pogadać
ze wszystkimi <LSNR {sam} {sama}>.",,,"Isso é tudo o que eu tinha pra dizer.
Se quiser saber mais, você vai precisar
conversar com todo mundo!","내가 소개할 곳은 이 정도다냥.
더 자세히 알고 싶다면
직접 가서 얘기를 들어 보면 된다냥.","我就介紹到這裡吧喵。
如果你想知道得更詳細一點，
可以直接去問問看他們喵。","我要做的介绍差不多就这些喵。
你想了解详细情况的话，
可以直接问大家喵。",,,,,,,,"ذلك كل ما جمعته <LSNR {لك} {لكِ}>. إذا <LSNR {أردت} {أردتِ}>
معرفة المزيد، <LSNR {عليك} {عليكِ}>
التحدث إلى الجميع <LSNR {بنفسك} {بنفسكِ}>!",,,,,,,,,,,
cdeb9c37-2e41-4cc0-bc1f-7a3bd2dd8c1e,2569626918,,(default)世間話,村進行☆3,,,このクエストが未クリアなら→,QN000402,,このクエストがクリア済みなら→,QN000304,,,,,,,,,,,,,,,,,,,,,,,,,,,,,,nid306_v3_000,"マガイマガドが出たとき
イオリくんも一緒だったって聞いたニャ。","I heard Iori was with you when
Magnameowlo attacked.","Il paraît que Iori était avec toi quand
le Magnamalo a attaqué.","Ho sentito dire che Iori era con te quando il
Magnamiaolo ha attaccato.","Hab gehört, Iori war bei dir, als Magnamiaulo
angegriffen hat.","He oído que Iori estaba contigo cuando
Magnamiaulo atacó.","Я слышал, Иори был с тобой,
когда напал Магнамало.","Słyszałem, że Iori był z tobą
podczas ataku Magna-miau-lo.",,,"Soube que Iori estava com você quando
Magnamiaulo atacou.","마가이마가도가 나타났을 때
이오리가 함께 있었다고 들었다냥.","聽說怨虎龍出現時，
小庵剛好也在那裡喵。","我听说怨虎龙出现的时候，
刀脊也在喵。",,,,,,,,"سمعت أن إيوري كان <LSNR {معك} {معكِ}> عندما
هجم ماجنامالو.",,,,,,,,,,,
55a50f3f-b6f9-46cb-9776-e9d7d833aeba,25239078,,,,,,,,,,,,,,,,,,,,,,,,,,,,,,,,,,,,,,,,nid306_v3_001,"大丈夫だったかニャ…
イオリくん、帰ってきてから
ずっと難しい顔をしてるニャよ。","I don't know what it is but ever since
he got back, he's had this pained look
on his face. I wonder how he's doing...","Je sais pas ce qu'il a, mais depuis son
retour, il n'a vraiment pas l'air bien.
Je me demande ce qui lui arrive...","Non so come mai, ma da quando è tornato
sembra sofferente. Spero che stia bene...","Ich weiß nicht, was es ist, aber seit seiner
Rückkehr hat er diesen gequälten Gesichts-
ausdruck. Ich frag mich, wie es ihm geht...","No sé a qué se deberá, pero lleva con una
expresión de dolor en la cara desde que
volvió. Espero que esté bien...","Интересно, как у него дела.
С тех пор, как он вернулся,
он какой-то потерянный.","Od czasu, kiedy wrócił, ma taki
zbolały wyraz twarzy. Zastanawiam się,
jak się mrrr-iewa...",,,"Não sei o que é, mas desde que voltou,
ele tava meio pra baixo.
Como será que ele está?","괜찮았던 걸까냥…
이오리, 돌아오고 나서
계속 표정이 안 좋았다냥…","他還好嗎喵……
自從他回來之後，
就一直露出苦惱的表情呢喵。","不知道他还好喵……
刀脊他自从回来之后，
就一直愁眉苦脸的喵。",,,,,,,,"لا أعرف حقيقة الأمر ولكن منذ عودته،
لم تفارق هذه النظرة المحملة بالألم
وجهه. أتساءل كيف حاله...",,,,,,,,,,,
fda9c541-3570-48ea-9b13-21f41a6864e9,2361426760,会話終了,,,,,,,,,,,,,,,,,,,,,,,,,,,,,,,,,,,,,,,nid306_v3_002,"ケガしたわけじゃ、ないのニャね？
ならいいんだけどニャ……？","It doesn't look like he was hurt
though, so he'll be fine...right?","Mais il n'a pas l'air blessé,
alors ça devrait aller, j'imagine.","Non mi sembrava ferito... Starà bene, vero?","Verletzt wurde er aber offenbar nicht.
Also wird doch alles wieder gut... oder?","La verdad es que no veo que esté herido por
ninguna parte. Así que debería de estar bien,
¿no te parece?","Но, вроде бы, его не ранили, так что
все будет хорошо... верно?","Chyba nie odniósł żadnych ran, więc...
wszystko będzie w porządku, prawda?",,,"Não parece que ele foi ferido,
então ele vai ficar bem... né?","어디 다친 건 아니지냥?
그렇다면 괜찮지만……","他應該不是哪裡受了傷吧？
希望他沒事才好喵……","不是受伤了喵？
那就好喵……",,,,,,,,"لا تبدو عليه علامات
جروح رغم ذلك، لذا سيكون على ما يرام، صحيح؟",,,,,,,,,,,
1f0486bc-5c92-4ef9-a85b-14de1178f3ad,127133852,,(default)世間話,村進行☆5,,,,,,,,,,,,,,,,,,,,,,,,,,,,,,,,,,,,,nid306_v5_000,"<PL>さん、
マガイマガドを倒したニャね～！","<PL>!
I heard you beat Magnameowlo!","<PL> ! Il paraît que
tu as battu le Magnamalo !","Ehi, <PL>, ho saputo che
hai sconfitto il Magnamiaolo!","Miau, <PL>!
Du hast Magnamiaulo also besiegt!","¡He oído que has derrotado a Magnamiaulo,
<PL>!","<PL>, я слышал, ты
<LSNR {победил} {победила}> Магнамало!","<PL>, słyszałem, że
<LSNR {pokonałeś} {pokonałaś}> Magna-miau-lo!",,,"<PL>!
Soube que derrotou Magnamiaulo!","<PL> 씨.
마가이마가도를 쓰러뜨렸구냥~!","<PL>，
你打倒怨虎龍了吧喵～！","<PL>，
你打倒怨虎龙了喵～！",,,,,,,,"سمعت <LSNR {أنك هزمت} {أنكِ هزمتِ}> ماجنامالو!
يا <PL>!",,,,,,,,,,,
7e914e80-2151-4eb7-b53b-dd98f23d068d,3700938474,,,,,,,,,,,,,,,,,,,,,,,,,,,,,,,,,,,,,,,,nid306_v5_001,"ボク、ゴコク様が描いた
マガイマガドの絵を見せてもらったけど、
……うう、思い出しただけで震えるニャ。","Meowster Hojo showed me a drawing of it
once. That's one scary-lookin' meownster!
I hope it never comes near me!","Hojo m'a montré un dessin de lui. Il n'a
vraiment pas l'air commode ! Chapristi !
J'espère ne jamais le rencontrer !","Il capo Hojo mi ha miaostrato un disegno. È 
proprio un miaostro spaventoso! Non vorrei
mai trovarmelo davanti!","Miauster Hojo hat mir mal eine Zeichnung
von ihm gezeigt. So ein gruseliges Miaunster!
Ich hoffe, er kommt nie in meine Nähe!","El maestro Hojo me enseñó un dibujo sobre ese
miaunstruo. ¡Y no veas qué miedo que da!
¡Espero no tenerlo cerca nunca!","Мяустер Ходзё как-то показал мне его
портрет. Ужас какой! Надеюсь
никогда его не встретить.","Miaustrz Hojo pokazał mi go kiedyś na
rysunku. Przerażające miaustrum!
Nie chciałbym zobaczyć go z bliska!",,,"Miaustre Hojo me mostrou um desenho dele
uma vez. Era um miaunstro assustador!
Espero que nunca chegue perto de mim!","전에 고코쿠 님이 그린
마가이마가도 그림을 본 적이 있는데
……으으, 떠올리는 것만으로도 무섭다냥.","風登大人給我看過他所畫的怨虎龍，
嗚嗚……不過光是回想，
就讓我全身發抖了喵。","岁丰稔大人
给我看过他画的怨虎龙……
呜呜，真是光想起来就打寒颤喵。",,,,,,,,"لقد عرض لي السيد هوجو رسمة لذلك في
إحدى المرات. إنه وحش مخيف المظهر!
أتمنى ألا يقترب مني مطلقًا!",,,,,,,,,,,
d487b7d8-fc9a-40c7-9152-fcbedf2a5e5e,3890148029,会話終了,,,,,,,,,,,,,,,,,,,,,,,,,,,,,,,,,,,,,,,nid306_v5_002,"あんな恐ろしい見た目のモンスターを、
よく狩猟できたニャね。
<PL>さんはすごいのニャ。","Anymew, taking down such a fur-ocious
beast is quite a feat! Three cheers fur you,
<PL>!","Bref, ça n'a pas dû être facile de
terrasser un monstre aussi affreux !
Chat-peau bas, <PL> !","Sconfiggere una bestia così miaolvagia è
una vera impresa. Urrà per te,
<PL>!","Wie auch immer, es ist eine tolle Leistung,
so eine bösartige Bestie zu erledigen! Ein
dreifaches Hoch auf dich, <PL>!","Acabar con una bestia de aspecto tan feroz no
es poca cosa. ¡Ole tú, <PL>!","Одолеть такое жуткое чудовище —
настоящий подвиг. Троекратное
""ура"" тебе, <PL>!","U-miau-cestwienie tak straszliwej
bestii to niezły wyczyn. Miau-leży
ci się medal, <PL>!",,,"Enfim, abater um ser tão feroz
é um feito e tanto. Três vivas pra você,
<PL>!","그런 무서운 몬스터를
잘도 사냥했다냥.
<PL> 씨는 대단하다냥.","<PL>竟然有辦法成功狩獵
外表這麼可怕的魔物喵。
實在太厲害了喵。","那怪物看起来那么吓人，
难为你狩猎它了喵。
<PL>真强喵。",,,,,,,,"على كل حال، من النادر القضاء على
وحش كاسر مثل هذا! لنشرب احتفالًا بما
<LSNR {حققته} {حققتِه}> يا <PL>!",,,,,,,,,,,
77c8d99f-6516-4a81-81b0-5e535fe203c6,1585923559,,(default)世間話,,集会所進行☆6,,この会話フラグがOFFなら→,EV_PRO_HALL_007_01_01,,このクエストがクリア済みなら→,QN010603,,,,,,,,,,,,,,,,,,,,,,,,,,,,,,nid306_h6_000,"<PL>さーん！
ついにイブシマキヒコ、倒したニャね！","Meow-wie, <PL>!
You defeated that fur-ightening
meownster, Ibushi!","Chat-peau, <PL> ! Tu as
vaincu l'affreux Ibushi !","Miao, <PL>! Hai sconfitto quel
miaostro pauroso, l'Ibushi!","Miau, <PL>! Du hast das
schnurrchtbare Miaunster Ibushi besiegt!","¡Hola, <PL>! ¡Has derrotado a
ese miaunstruo tan aterrador, Ibushi!","Привет, <PL>!
Ты <LSNR {победил} {победила}> этого жуткого
мяунстра Ибуси!","Sie-miau, <PL>!
<LSNR {Pokonałeś} {Pokonałaś}> to
miaustrum, Ibushiego!",,,"Miau-uau, <PL>!
Você derrotou aquele miaunstro
assustador, Ibushi!","<PL> 씨!
마침내 이부시마키히코를 쓰러뜨렸다냥!","<PL>～！
你終於打倒風神龍了喵！","<PL>！
你终于打倒风神龙了喵！",,,,,,,,"يا إلهي يا <PL>!
لقد <LSNR {هزمت} {هزمتِ}> ذلك الوحش المخيف
إيبوشي!",,,,,,,,,,,
e9f0ff73-9ca4-4315-b28f-46ee240c67eb,2172915698,,,,,,,,,,,,,,,,,,,,,,,,,,,,,,,,,,,,,,,,nid306_h6_001,"すごいニャ～！
さすが、<PL>さんだニャ！","You never cease to impurr-ess, do you?",Tu m'épates de plus en plus !,"Non smetti miaoi di stupirmi, eh!",Du verblüffst mich immer wieder.,"Jamás dejas de impurrresionar, ¿eh?","Не перестаешь удивлять, смотрю?",Jesteś po prostu <LSNR {miau-samowity} {miau-samowita}>.,,,"Você nunca para de impressionar, né?","대단하다냥~!
역시 <PL> 씨다냥!","太厲害了喵～
真不愧是<PL>喵！","好强喵～！
不愧是<PL>喵！",,,,,,,,ألن <LSNR {تتوقف} {تتوقفي}> عن إبهارنا؟,,,,,,,,,,,
a7cdc3c9-06f5-4f1a-9c4a-15d98abacf25,3110351715,会話終了,,,,,,,,,,,,,,,,,,,,,,,,,,,,,,,,,,,,,,,nid306_h6_002,"百竜夜行はまだ続くって
コガラシさんも言ってたけど
それもきっともう一息なのニャ！","Kogarashi says the Rampage is still
nippin' at our tails, but we must be
getting close to stopping it meow!","D'après Kogarashi, la Calamité nous
pend toujours au nez, mais nous allons
bientôt en finir, c'est sûr !","Kogarashi dice che la furia è ancora
una bella gatta da pelare, ma prrresto
la fermeremo.","Kogarashi sagt, die Randale ist uns immer
noch auf den Pfoten, aber langsam ist wohl
ein Ende in Sicht!","Kogarashi dice que el Frenesí sigue su curso,
¡pero debe de faltar poco para que lo
detengamos!","Когараси говорит, Буйство до сих пор
не прекратилось, но мы уже
вот-вот его остановим!","Kogarashi mówi, że wciąż mamy Furię na
ogonie, ale chyba jesteśmy już
coraz bliżej jej zakończenia!",,,"Kogarashi diz que o Frenesi ainda tá
nas nossas caudas, mas devemos estar
perto de pôr um fim nele agora!","백룡야행은 계속될 거라고
코가라시 씨가 말씀하셨지만
그것도 얼마 안 남았다냥!","雖然秋風頭領
也說百龍夜行還沒結束，
但我想肯定只差一步了喵！","冬风也说
百龙夜行还会继续，
可是一定就差那么一口气了喵！",,,,,,,,"يقول كوجاراشي إن الغضب العارم
مازال يهددنا، لكننا علينا
أن نضع حدًا لذلك الآن!",,,,,,,,,,,
264ee1f9-4ad0-404c-98ae-f7cec8b70638,501271369,,(default)世間話,,集会所進行☆7以上,,この会話フラグがOFFなら→,EV_PRO_HALL_008_02_01,,このクエストがクリア済みなら→,QN010702,,,,,,,,,,,,,,,,,,,,,,,,,,,,,,nid306_h7_000,"やっぱり<PL>さんは
すごいニャ～！","Meow-wie, <PL>!
You sure sent that meownster packing!","Chat-peau, <PL> ! Tu n'en as
fait qu'une bouchée de ce miaonstre !","Miao, <PL>! Hai fatto fuggire
quel miaostro con la coda tra le gambe!","Miau, <PL>! Du hast dem
Miaunster eine hübsche Abfuhr erteilt!","¡Aquí estás, <PL>!
¡Has dado para el pelo a ese miaunstruo!","Привет, <PL>!
Как ты <LSNR {задал} {задала}> этому монстру!","Sie-miau, <PL>! <LSNR {Spuściłeś} {Spuściłaś}>
temu miaustrum niezłe bęcki!",,,"Miau-uau, <PL>!
Você mandou aquele miaunstro pra casa!","역시 <PL> 씨는
대단하다냥~!",我就知道<PL>果然很厲害喵～！,"<PL>
果然好强喵～！",,,,,,,,"يا إلهي يا <PL>!
لقد <LSNR {قضيت} {قضيتِ}> على ذلك الوحش بكل تأكيد!",,,,,,,,,,,
8bd0f9e5-5c7b-45f6-aca1-b77705960598,691599968,,,,,,,,,,,,,,,,,,,,,,,,,,,,,,,,,,,,,,,,nid306_h7_001,"イブシマキヒコだけじゃなくて
ナルハタタヒメまで
倒してしまうなんてニャ～！","fur-st you put the beatdown on Ibushi,
and then its girlfur-iend, Narwa!
You cold, hunter.","D'abord tu envoies valdinguer l'Ibushi, et
maintenant tu te débarrasses de sa
copine, la Narwa... Quelle violence !","Prima hai dato una bella lezione all'Ibushi e
poi è toccata a sua ""miaoglie"", quella Narwa!
Sei prrroprio <LSNR {tosto} {tosta}>, <LSNR {cacciatore} {cacciatrice}>.","Zuerst machst du Ibushi platt, und dann auch
noch seine Freundin Narwa. Du bist eiskalt,
<LSNR {Jäger} {Jägerin}>.","Primero machacas a Ibushi, ¡y ahora vas y le
haces lo mismo a su novia, Narwa!
¡Eres demasiado, <LSNR {cazador} {cazadora}>!","Сперва ты <LSNR {врезал} {врезала}> Ибуси,
а теперь и подружке его, Нарве!
Да ты зверь просто.","Najpierw <LSNR {pogoniłeś} {pogoniłaś}> kota Ibushiemu, a
teraz jego miau-kochanej, Narwie!
Ostro sobie poczynasz.",,,"Primeiro, você derrota Ibushi,
aí a namorada dela, Narwa!
Você é <LSNR {frio, caçador}{fria, caçadora}>.","이부시마키히코에다가
나루하타타히메까지
쓰러뜨리는 거다냥~!","除了風神龍之外，
你竟然連雷神龍都打倒了喵～！","没想到不止风神龙，
连雷神龙
都给你打倒了喵～！",,,,,,,,"<LSNR {عليك} {عليكِ}> أولًا هزيمة إيبوشي
ثم صديقته، ناروا!
<LSNR {أيها الصياد المغوار} {أيتها الصيادة المغوارة}>.",,,,,,,,,,,
339d4c0e-0b97-46f7-a05d-ebd8444e42e6,2689695435,,,,,,,,,,,,,,,,,,,,,,,,,,,,,,,,,,,,,,,,nid306_h7_002,"２体ともまだ生きてるって話だったけど、
今、コガラシさんたちが
調査してるから、だいじょうぶニャ。","And hopefur-ly that beatdown will keep
'em from showing their ugly meownster
faces here again!","En espérant que la raclée que tu leur as
mise les fera réfléchir à deux fois
avant de remontrer leur sale tête !","Speriamo che gli sia passata la voglia di
far vedere i loro brutti musi miaostruosi
da queste parti!","Die Tracht Prügel war ihnen hoffentlich eine
Lehre und wir müssen ihre hässlichen
Miaunstervisagen hier nicht mehr ertragen!","Con suerte, ¡esa paliza los convence de que
no deben acercar esos feos hocicos de
miaunstruo por aquí nunca más!","Будем надеяться, что теперь они
сюда свои мяунстровые рыла не сунут!","Oby odebrało im to miau-chotę do
pokazywania swych wrednych
miau-strualnych pysków w tej okolicy!",,,"E espero que aquela surra mantenha
aquelas caras feias de miaunstro
longe daqui!","두 마리 다 살아있다고 들었지만
지금 코가라시 씨와 다른 사람들이
조사하고 있으니 괜찮을 거다냥.","雖然聽說那2頭龍都還活著，
不過秋風頭領他們已經著手進行調查了，
所以暫時可以放心了喵。","听说那两条龙都还活着，
但是冬风它们正在调查，
所以没问题的喵。",,,,,,,,"ومن المرجو أن تحول هزيمة
تلك الوحوش دون إظهار وجوههم القبيحة
هنا مجددًا!",,,,,,,,,,,
e41edc2c-9f90-4760-9a73-9aeeb745c30e,1805070262,会話終了,,,,,,,,,,,,,,,,,,,,,,,,,,,,,,,,,,,,,,,nid306_h7_003,"見つかったら、また<PL>さんが
ズバッと倒してくれるニャね！
ボクたちは安心して過ごせるニャ。","And if they ever do, Kogarashi will
find 'em and you'll give 'em another
beatdown, right <PL>!?","Et s'ils le font quand même, Kogarashi
les retrouvera et il leur mettra la tête
au carré. T'inquiète, <PL> !","Ma se dovessero tornare, Kogarashi li troverà
e tu gli darai un'altra bella lezione!
Giusto, <PL>?!","Und falls doch, wird Kogarashi sie finden,
und du vermaust sie dann noch mal ordentlich.
Stimmt doch, <PL>?","Y si lo hacen, Kogarashi los encontrará y tú
les pegarás otra paliza, ¡¿verdad que sí,
<PL>?!","А если сунут, Когараси их найдет
и ты им снова от души врежешь,
верно, <PL>?","A jeśli nie, to Kogarashi znowu ich
wytropi, a ty jeszcze raz przetrzepiesz
im skórę, tak, <PL>!?",,,"E se voltarem, Kogarashi os encontrará
e você dará outra surra neles,
né, <PL>?!","발견하면 <PL> 씨가
다시 한번 쓰러뜨려 줄 거다냥!
우린 안심하고 지낼 수 있다냥.","<PL>，等找到牠們的時候，
你一樣會馬上打倒牠們的吧喵！
那我們就能放心地繼續生活了喵。","找到之后，<PL>会
再次麻利地打倒它们的喵！
这样我们可以安心过日子了喵。",,,,,,,,"وفي حال ظهورها مجددًا، سيجدهم كوجاراشي
<LSNR {وستقوم} {وستقومين}> بهزيمتها مجددًا،
أليس كذلك يا <PL>؟!",,,,,,,,,,,
74d9accf-3d61-44f3-9ecf-1ff2676565da,955783494,,(default)世間話,,集会所進行☆7EX,,この会話フラグがOFFなら→,EV_PRO_HALL_008_05_01,,この会話フラグがONなら→,EV_PRO_HALL_008_02_01,,,,,,,,,,,,,,,,,,,,,,,,,,,,,,nid306_h7_004,"<PL>さん！
<PL>さんだニャ！","Meow-wie, <PL>!
You're a real village hero meow!","Chat-peau, <PL> ! Ça y est,
t'es la star du village maintenant !","Miao, <PL>!
Sei <LSNR {un} {una}> <LSNR {vero} {vera}> <LSNR {eroe} {eroina}> per il villaggio.","Miau, <PL>!
Du bist jetzt <LSNR {ein echter Dorfheld} {eine echte Dorfheldin}>!","Hola, <PL>. ¡Te has hecho
<LSNR {todo un héroe} {toda una heroína}> en la aldea!","Привет, <PL>!
Ты теперь <LSNR {настоящий герой} {настоящая героиня}> деревни!","Sie-miau, <PL>! Jesteś
teraz <LSNR {prawdziwym bohaterem} {prawdziwą bohaterką}> wioski!",,,"Miau-ui, <PL>!
Você é <LSNR {o herói}{a heroína}> da aldeia agora!","<PL> 씨!
<PL> 씨다냥!","<PL>！
是<PL>喵！","<PL>！
<PL>来了喵！",,,,,,,,"يا إلهي، يا <PL>!
<LSNR {إنك بطل القرية الحقيقي} {إنكِ بطلة القرية الحقيقية}> الآن!",,,,,,,,,,,
457db710-755f-4e59-b04d-9e2c09b9ead7,2662557910,,,,,,,,,,,,,,,,,,,,,,,,,,,,,,,,,,,,,,,,nid306_h7_005,"いや～、<PL>さんは
すっかり里の英雄だからニャ。
今のうちに色紙でも書いてもらおうかニャ。","Oh, wait! I gotta get you to sign something.",Il faut que je te fasse signer un truc.,"Oh, un miaomento! Voglio il tuo autografo!","Oh, Maument! Du musst etwas unterschreiben.","Oh, ¡espera! Tengo que darte algo para que me
lo firmes.","Подожди, я попрошу
тебя кое-что подписать.","Czekaj, mam tu coś. Chciałbym,
żebyś to <LSNR {podpisał} {podpisała}>.",,,"Ah, espera! Preciso pegar um autógrafo.","역시 <PL> 씨는
이 마을의 영웅이다냥.
지금이라도 사인을 받아 둘까냥?","哎呀～<PL>已經
徹底成為村莊裡的英雄了喵。
我也趁現在請你簽個名好了喵。","哎呀～<PL>
已经完全成为全村的英雄了喵。
要不我趁现在拿张纸请你留念好了喵。",,,,,,,,يا إلهي <LSNR {فلتنتظر} {فلتنتظري}>! أحتاج <LSNR {منك} {منكِ}> إلى التوقيع على شيء ما.,,,,,,,,,,,
12f1557b-2a84-4ddf-b333-ce0668dc3caa,3268674807,会話終了,,,,,,,,,,,,,,,,,,,,,,,,,,,,,,,,,,,,,,,nid306_h7_006,"名前と、座右の銘と…
あ、手形とかもどうかニャ。
将来、すごい価値がでそうだニャ！","Here! Add your name, your motto...
Oh, and a pawprint! I bet it'd be
worth a fur-tune one day!","Vas-y, écris ton nom, ta devise... Oh,
et une empreinte aussi ! Chapristi !
Je vais être riche avec tout ça !","Ecco! Aggiungi il tuo nome, il tuo motto... E
anche la tua impronta. Varrà una forrrtuna.","Da! Mit deinem Namen, deinem Motto... Oh, und
einem Pfotenabdruck! Ich wette, das ist eines
Tages ein Vermögen wert!","¡Toma! Ponle tu nombre, tu lema...
Oh, ¡y tu huella! ¡Seguro que algún día
valdrá un miauntón de dinero!","Здесь! И еще свое имя, девиз... да, и
отпечаток лапы! В будущем это
будет стоить кучу денег!","O, tu. Potrzebne mi twoje imię i motto.
Aha, i odcisk łapki! To będzie kiedyś
warte więcej niż tona sardynek!",,,"Aqui! Coloca o seu nome, seu lema...
Ah, e uma impressão digital! Vai valer
uma fortuna um dia!","이름이랑 좌우명이랑…
아, 손도장도 괜찮을 거 같다냥.
나중에 엄청난 가치가 생길 거다냥!","要請你幫我寫上名字、座右銘……
對了，還有手印也要喵。
感覺以後肯定會增值喵！","要签名，还有座右铭……
啊，手印也请来一份喵。
将来会成为稀世珍宝的喵！",,,,,,,,"هنا! <LSNR {أضف} {أضيفي}> الاسم ووسيلة الركوب...
يا إلهي والبصمة أيضًا! أراهن أن ذلك
سيساوي ثروة يومًا ما!",,,,,,,,,,,
