guid,crc?,<PageAttr>,<TalkAttr>,<VillageProgress>,<HallProgress>,<HunterRank>,<TalkTag>,<TalkTagParam>,<TalkTagComment>,<TalkTag>,<TalkTagParam>,<TalkTagComment>,<TalkTag>,<TalkTagParam>,<TalkTagComment>,<TalkTag>,<TalkTagParam>,<TalkTagComment>,<TalkTag>,<TalkTagParam>,<TalkTagComment>,<TalkTag>,<TalkTagParam>,<TalkTagComment>,<TalkTag>,<TalkTagParam>,<TalkTagComment>,<TalkTag>,<TalkTagParam>,<TalkTagComment>,<TalkTag>,<TalkTagParam>,<TalkTagComment>,<TalkAction1>,<TalkAction1Param>,<TalkAction1Comment>,<TalkAction2>,<TalkAction2Param>,<TalkAction2Param2>,<TalkAction2Comment>,entry name,Japanese,English,French,Italian,German,Spanish,Russian,Polish,Dutch,Portuguese,PortugueseBr,Korean,TraditionalChinese,SimplifiedChinese,Finnish,Swedish,Danish,Norwegian,Czech,Hungarian,Slovak,Arabic,Turkish,Bulgarian,Greek,Romanian,Thai,Ukrainian,Vietnamese,Indonesian,Fiction,Hindi,LatinAmericanSpanish
0ef472b3-565f-4d70-b001-461a18fbc9d5,2668617281,,(default)世間話,,集会所進行☆7EX,,この会話フラグがONなら→,EV_PRO_HALL_008_05_01,,このクエストが未クリアなら→,QN010706,,,,,,,,,,,,,,,,,,,,,,,,,,,,,,nid306_h8_000,"２体の古龍が見つかったニャ。
広場にいるオトモたちも、
少し緊張している様子だニャ。","We saw the two elder dragons
here from the Buddy Plaza. It's
got everyone's fur standing on end.","On a aperçu les deux dragons anciens
depuis la Place Pilpoil. Ça nous a tous
hérissé le poil !","Abbiamo visto quei due draghi anziani dalla
Piazza compagni. Hanno fatto rizzare il pelo
a tutti quanti.","Wir haben die beiden Drachenältesten hier von
der Buddy-Plaza aus gesehen. Bei dem Anblick
stand allen das Fell zu Berge!","Vimos a los dos dragones ancianos desde la
plaza Camarada. Todo el mundo está nervioso.","Мы увидели этих двух древних драконов
с Площади спутников. То-то у всех
шерсть дыбом встала!","Z Placu Kompanów
widzieliśmy dwa Starsze Smoki.
Wszystkim aż futro się zjeżyło.",,,"Vimos os dois dragões anciões daqui da
Praça dos Amigos. Todo mundo ficou de
pelo arrepiado.","두 고룡을 찾아냈다냥.
광장에 있는 동반자들도
조금 긴장한 것 같다냥.","已經找到那2頭古龍了喵。
廣場裡的隨從們看起來似乎都有點緊張喵。","找到两头古龙了喵。
广场上的那些随从
看起来也有些紧张了喵。",,,,,,,,"لقد رأينا التنينين القويين
هنا في ساحة الأصدقاء. وأدخل ذلك المنظر
الرعب في قلوب الجميع.",,,,,,,,,,,
83909e9b-32ff-4cd8-b78d-d5990e809939,1113601599,,,,,,,,,,,,,,,,,,,,,,,,,,,,,,,,,,,,,,,,nid306_h8_001,"でも<PL>さんが
倒しに行ってくれるのなら、
大船に乗ったつもりで待ってるニャ。","But if you're on the case, <PL>,
we shouldn't have anything to worry
about.","Mais si tu t'en occupes, <PL>,
il n'y a pas de souci à se faire.","Ma se te ne stai occupando tu, non abbiamo
niente di cui preoccuparci.","Aber wenn du an dem Fall dran bist, gibt es
ja nichts zu befürchten, <PL>.","Pero si eres tú quien se encarga del asunto,
<PL>, no hay de qué preocuparse.","Но раз этим занимаешься
ты, <PL>, нам бояться
нечего.","Ale jeśli ty się tym zajmujesz,
<PL>, to nie mamy
się czym martwić.",,,"Mas com você no caso, <PL>,
não temos nada com o que nos
preocupar.","그래도 <PL> 씨가
고룡들을 쓰러뜨리러 가 준다면
편한 마음으로 기다리고 있겠다냥.","不過既然是<PL>
要去打倒牠們的話，
我就能放一百二十個心等你回來喵。","可是，<PL>
要去打倒它们的话，
我就放下这颗心，好好等着了喵。",,,,,,,,"إذا <LSNR {كنت} {كنتِ}> في خضم هذه المعركة
يا <PL>،فليس هناك
ما نقلق حياله.",,,,,,,,,,,
d8c84b63-8b38-4672-b12a-55cd803a388a,2010679353,会話終了,,,,,,,,,,,,,,,,,,,,,,,,,,,,,,,,,,,,,,,nid306_h8_002,"<PL>さんはムテキなんだニャ。
相手が２体だろうが２００体だろうが、
楽勝で帰ってくるニャ！","I mean, it's you, after all! Two serpents?
Why stop there? I bet you could take
a whole army of 'em, no pur-roblem!","Après tout, t'es loin d'être n'importe
qui ! Deux serpents ? Pff ! Même une
armée t'arriverait pas à la cheville !","Insomma, tu sei speciale! Due drrraghi?
Ti fanno un baffo! Scommetto che potresti
abbatterne un intero esercito!","Immerhin reden wir von dir! Zwei Schlangen?
Pipikatz! Ich wette, du könntest auch eine
Armee von denen schlagen, rubbeldiekatz!","De hecho, creo que dos dragones son poca cosa
para ti, ¡si dudo que ni un ejército pudiese
contigo!","Ведь это же ты, как-никак! Два змея?
Чего скромничать! Держу пари, ты
целую армию змеев можешь положить.","Co to dla ciebie! Dwa węże?
Pestka! Założę się, że <LSNR {pokonałbyś} {pokonałabyś}>
całą mrrr-armię takich!",,,"Digo, é você, afinal! Duas serpentes?
Por que parar aí? Aposto que você encara
um exército delas, sem problemas!","<PL> 씨는 무적이다냥.
상대가 둘이든, 200마리든
쉽게 쓰러뜨리고 올 거다냥!","因為<PL>是所向無敵的喵。
不管對手是2頭還是200頭，
你一定都能輕鬆獲勝，並平安歸來的喵！","<PL>无敌喵。
不管对手有两头还是两百头，
都会轻松搞定，平安回来的喵！",,,,,,,,"أعني، إن الفضل <LSNR {لك} {لكِ}> في نهاية المطاف! أفعيان؟
لماذا توقفتا هنا؟ أراهن أن <LSNR {بمقدورك} {بمقدوركِ}>
القضاء على جيش بأكمله منهما، بكل تأكيد!",,,,,,,,,,,
cdc475d1-02ab-42be-962e-070ea7672044,4267763542,,(default)世間話,,集会所進行☆7EX,,この会話フラグがOFFなら→,NID_306_EPILOGUE,,このクエストがクリア済みなら→,QN010706,,,,,,,,,,,,,,,,,,,,,,,会話フラグを「ON」→,NID_306_EPILOGUE,,,,,,nid306_h8_003,"<PL>さん、おかえりニャ。
やっぱり相手が古龍２体だろうが、
楽勝だったニャ。","Welcome back, <PL>.
You made beatin' those two elder dragons
look easy!","<PL> ! Quel plaisir de te
revoir ! Combattre ces deux dragons semble
avoir été une promenade de santé pour toi !","Rieccoti, <PL>. Hai sconfitto
quei due draghi anziani come se fosse una
cosa da niente!","Willkommen zurück, <PL>. Bei
dir sah der Kampf gegen die beiden Drachen-
ältesten aus wie ein Kinderspiel!","Hola de nuevo, <PL>.
¡Has hecho que esos dos dragones ancianos
parezcan lagartijas viejas!","С возвращением, <PL>.
Знатно ты <LSNR {задал} {задала}> этим
древним драконам!","Witaj ponownie, <PL>.
Przy tobie te dwa Starsze Smoki
wyglądały jak polne myszki!",,,"<LSNR {Bem-vindo} {Bem-vinda}> de volta, <PL>.
Você fez parecer fácil bater naqueles
dois dragões anciões!","<PL> 씨, 어서 와라냥.
상대가 고룡 둘이었는데도
쉽게 쓰러뜨렸다냥.","<PL>，歡迎回來喵。
即使對上那2頭古龍，
你還是輕鬆獲勝了呢喵。","<PL>，欢迎回来喵。
果然就算对上两头古龙，
也不在话下喵。",,,,,,,,"عود حميد يا <PL>.
<LSNR {أنت تجعل} {أنتِ تجعلين}> من ضرب هذين التنينين القويين
أمرًا سهلًا!",,,,,,,,,,,
57dd8b53-3c47-4a2c-b336-bb9e5fac08ff,4188564379,,,,,,,,,,,,,,,,,,,,,,,,,,,,,,,,,,,,,,,,nid306_h8_004,"<PL>さんが討伐成功したと
連絡が入ったとき、
もちろんみんな喜んだけど…","We were relieved when we heard
that you successfully took those
terrors down, but...","Nous avons été soulagés d'apprendre
que tu avais vaincu ces deux terreurs,
mais...","Eravamo tutti così felici quando abbiamo
saputo del tuo trionfo, ma...","Wir waren erleichtert, als wir von deinem
Sieg über diese Scheusale gehört haben,
aber...","Fue un alivio enterarnos de que habías
acabado con esas amenazas, pero...","У нас гора с плеч упала, когда мы
узнали, что ты <LSNR {победил} {победила}>, но...","Ulżyło nam, kiedy usłyszeliśmy,
że udało ci się pokonać te
poczwary, ale...",,,"Ficamos aliviados quando soubemos que
você eliminou aqueles terrores com
sucesso, mas...","<PL> 씨가 토벌에
성공했다는 연락을 들었을 때
모두가 기뻐했지만…","收到<PL>
討伐成功的消息後，
大家當然都感到很開心……","收到<PL>
讨伐成功的消息时，
大家当然很开心了……",,,,,,,,"لقد شعرنا بالراحة عندما سمعنا
<LSNR {أنك قضيت} {أنكِ قضيتِ}> على
الأخطار، ولكن...",,,,,,,,,,,
f59ac188-26b9-4755-9d6e-626bd8424d76,887014280,会話終了,,,,,,,,,,,,,,,,,,,,,,,,,,,,,,,,,,,,,,,nid306_h8_005,"<PL>さんが無事だと連絡が来て
さらにワーッと盛り上がったニャ。みんな、
<PL>さんが大好きなんだニャ。","Everyone REALLY cheered once we
heard that you managed to get back
safe and sound!","On ne s'est vraiment réjoui que
quand on a appris que tu étais
de retour en un seul morceau !","Ma abbiamo tirato un sospiro di sollievo solo
quando abbiamo saputo che eri
<LSNR {torrrnato sano e salvo} {torrrnata sana e salva}>!","RICHTIG gejubelt haben wir alle erst, als wir
wussten, dass du es wohlbehalten zurück-
schafft hast!","Lo mejor no fue eso, ¡sino saber que habías
vuelto <LSNR {sano y salvo} {sana y salva}>!","Больше всего все обрадовались, когда
услышали, что ты
<LSNR {вернулся целым и невредимым} {вернулась целой и невредимой}>!","Prawdziwe wiwaty zaczęły się,
gdy się okazało, że
<LSNR {wróciłeś cały i zdrowy} {wróciłaś cała i zdrowa}>!",,,"Todos aplaudiram MUITO quando ouvimos
dizer que você tinha voltado
<LSNR {são e salvo!} {sã e salva!}>","<PL> 씨가 무사하다는
연락을 들었을 때는 더 많이 기뻐했다냥.
다들 <PL> 씨를 좋아한다냥.","不過在得知<PL>平安無事後，
所有人反而歡呼得更大聲呢喵。
大家真的都非常喜歡<PL>喔喵。","可是收到<PL>平安的消息时，
大家就更激动了喵。
大家都很爱<PL>喵。",,,,,,,,"لقد طار الجميع من الفرحة بمجرد سماعنا
<LSNR {أنك قد تمكنت} {أنكِ قد تمكنتِ}> من العودة
بكامل الصحة والعافية!",,,,,,,,,,,
22fa123a-18aa-451a-9b17-18850b8c32b4,3832413764,,(default)世間話,,集会所進行☆7EX,,このクエストがクリア済みなら→,QN010706,,,,,,,,,,,,,,,,,,,,,,,,,,,,,,,,,nid306_h8_006,"<PL>さん、
オトモ広場へようこそだニャ！","Hey, <PL>!
Greetings and sal-mew-tations!","Hé, <PL> !
Bienvenue et chalutations !","Ehi, <PL>!
Miao, ben <LSNR {trrrovato} {trrrovata}>!","Hallo, <PL>!
Grüße und miaun miaun!","Hola, <PL>.
¿Cómo te va todo?","Приветствую, <PL>!
Добро пожаловать!","Hej, <PL>!
Witam, moje miau-szanowanie!",,,"Ei, <PL>!
Saudações!","<PL> 씨!
동반자 광장에 온 걸 환영한다냥!","<PL>，
歡迎來到隨從廣場喵！","<PL>，
欢迎来到随从广场喵！",,,,,,,,"مرحبا يا <PL>!
تهانيا وتحياتنا!",,,,,,,,,,,
af6568e8-821d-40ba-8b4c-411b6a27a0a2,3700756991,,,,,,,,,,,,,,,,,,,,,,,,,,,,,,,,,,,,,,,,nid306_h8_007,"<PL>さんがここへ来ると
広場のオトモたちも嬉しそうニャ。","Whenever you show up, all the Buddies
get super excited!","Dès que tu apparais,
les Pilpoils sont super excités !","Quando arrivi tu, tutti i compagni
rizzano le orecchie!","Wann immer du auftauchst, sind alle
Buddys total aus dem Häuschen!","Siempre que te pasas por aquí, todos se
animan un montón.","Каждый раз, когда ты нас навещаешь,
Спутники так радуются!","Kompani zawsze bardzo się cieszą
na twój widok!",,,"Sempre que você aparece, os Amigos ficam
todos superanimados!","<PL> 씨가 여기 오면
광장에 있는 동반자들도 좋아한다냥.","見到你過來後，
廣場的隨從們看起來都很高興喵。","<PL>来这里之后，
广场上的随从们好像也很开心喵。",,,,,,,,"عندما <LSNR {تظهر} {تظهرين}>، يشعر الجميع
بالحماس الشديد!",,,,,,,,,,,
c147da2a-756b-4806-bf5e-ea5948176971,1425632706,会話終了,,,,,,,,,,,,,,,,,,,,,,,,,,,,,,,,,,,,,,,nid306_h8_008,"もちろんボクも嬉しいのニャ！
これからも、ときどきお話してほしいニャ。","And I'm glad you swung by too!
Hey, don't furget to say hi every
meow and then.","C'est gentil de passer me voir !
Reviens à l'occasion.","Sono felice di vederti. Non dimenticarti di
passare a dirci miao ogni tanto.","Und ich freue mich auch, dass du vorbei-
schaust! Hey, vergiss nicht, ab und zu mal
Hallo zu maunzen.","Y que conste que yo también me incluyo.
Así que ya sabes, pásate de vez en cuando a
saludar, ¿vale?","Да и я рад тебяу видеть!
Ты уж не забывай, захаживай.","Ja też się cieszę, że <LSNR {wpadłeś} {wpadłaś}>!
Konieczne przychodź 
jak miau-częściej.",,,"E fico feliz de você ter aparecido! Ei,
não esquece de dar um oi de vez
em quando.","물론 나도 좋다냥!
앞으로도 종종 말을 걸어 달라냥.","當然，我也覺得非常開心喵！
希望你以後偶爾能來找我聊天喵。","我当然也很高兴喵！
希望你以后也时不时来陪我说说话喵。",,,,,,,,"ويسعدني <LSNR {مرورك} {مروركِ}> علىّ!
ولا <LSNR {تنسَ} {تنسي}> إلقاء التحية
بين الحين والآخر.",,,,,,,,,,,
23c92308-6c11-4de4-be93-020b7bce715b,3012748827,,(default)世間話,,,,,,,,,,,,,,,,,,,,,,,,,,,,,,,,,,,,,,nid306_s1_000,"新しくオトモを雇用したい場合は
イオリくんに話しかけるニャ。","Talk to Iori if you want
to recruit new Buddies.","Va voir Iori si tu veux recruter
de nouveaux Pilpoils.","Se vuoi ingaggiare nuovi compagni, vai a
parlare con Iori.","Wenn du neue Buddys anheuern möchtest,
sprich mit Iori.","Habla con Iori si quieres reclutar nuevos
camaradas.","Если хочешь нанять новых спутников,
поговори с Иори.","Jeśli chcesz zwerbować nowych
kompanów, porozmawiaj z Iorim.",,,"Fale com Iori se quiser
recrutar novos Amigos.","새로운 동반자를 고용하고 싶을 때는
이오리에게 말을 걸면 된다냥.","如果你想雇用新的隨從，
可以去找小庵交談喵。","想雇用新随从的话，
就去找刀脊喵。",,,,,,,,"<LSNR {تحدثْ} {تحدثي}> إلى إيوري إذا <LSNR {رغبت} {رغبتِ}>
في تجنيد أصدقاء جدد.",,,,,,,,,,,
2eb263f3-6fa5-4bac-81e4-8860fcf7efb1,3727465724,会話終了,,,,,,,,,,,,,,,,,,,,,,,,,,,,,,,,,,,,,,,nid306_s1_001,"こんなオトモがほしいな～とか、
オトモの名前をこうしたいな～とかも
一度イオリくんに相談してみるといいニャ。","Also if you want a certain kind
of Buddy, or want to change
their name.","Aussi, si tu veux un Pilpoil en particulier,
ou si t'aimerais en renommer un.","Rivolgiti a lui anche se cerchi un tipo
specifico di compagno o se vuoi rinominarli.","Bei ihm bist du auch an der richtigen Adres-
se, wenn du auf einen bestimmten Buddy aus
bist oder einen Namen ändern willst.","También hazlo si quieres un cierto tipo de
camarada o si quieres cambiar el nombre
a algunos de ellos.","А еще если вдруг захочешь нанять
определенного спутника или
сменить спутнику имя.","Albo gdybyś <LSNR {potrzebował} {potrzebowała}> konkretnego
kompana lub <LSNR {chciałbyś} {chciałabyś}> zmienić
któremuś imię.",,,"Até para buscar um tipo específico
de Amigo, ou para mudar algum nome.","어떤 동반자가 필요한지~
동반자의 이름은 어떻게 할지~
고민될 때는 이오리에게 말하면 된다냥.","或是你想要某種類型的隨從，
還是想變更隨從的名字時，
也都可以去找小庵商量看看喵。","比如想要这～样的随从啊，
或者想把随从的名字改成这～样啊，
都可以找刀脊商量商量喵。",,,,,,,,"وكذلك إذا <LSNR {أردت} {أردتِ}> نوعًا محددًا من
الأصدقاء، أو تغيير
أسماء أي منهم.",,,,,,,,,,,
7f4634ab-45f7-47f5-a43b-db83bd0d42bf,136307898,,(default)世間話,,,,,,,,,,,,,,,,,,,,,,,,,,,,,,,,,,,,,,nid306_s1_002,"オトモ隠密隊を取り仕切っているのは
我らがアイルーの頭領でもある
コガラシさんニャ。","Kogarashi is top-Felyne when it
comes to managing the Meowcenaries!","Pour les Miaourcenaires,
c'est Kogarashi qu'il faut aller voir.","Kogarashi è il miaogliore nella gestione dei
cacciatori di miaostri.","Kogarashi ist der beste Felyne, wenn es
um die Miaunster-Jäger geht.","Kogarashi es el Felyne perfecto cuando se
trata de gestionar a los miaurcenarios.","Мяуемниками Когараси
командует лучше всех!","Kogarashi jest kociastyczny, jeśli
chodzi o zarządzanie miaujemnikami.",,,"Kogarashi é imbatível quando se trata
de gerenciar os Miaucenários!","동반자 그림자 부대를 관리하는 건
우리 아이루의 수장인
코가라시 씨다냥.","負責掌管隨從隱密隊的，
是我們艾路的領導──秋風頭領喵。","全权管理随从隐秘队的
是我们艾露猫的首领
——冬风喵。",,,,,,,,"يعد كوجاراشي رئيس الفيلاين حيث يعمل على إدارة
القطط المرتزقة!",,,,,,,,,,,
140b4162-15be-45f0-aacd-2e3379182cf8,2631606439,,,,,,,,,,,,,,,,,,,,,,,,,,,,,,,,,,,,,,,,nid306_s1_003,"オトモ隠密隊は、<PL>さんが
クエストに出ている間に
別の場所に素材を集めに行くのニャ。","Meowcenaries can be dispatched to
gather materials while you're meow-t
on a quest.","Les Miaourcenaires peuvent
aller chercher des objets pour toi
pendant que tu fais une quête.","I miaorcenari possono essere inviati
a raccogliere materiali mentre tu
sei in miaossione.","Miaunster-Jäger können entsendet werden,
um Material zu besorgen, wenn du gerade
mit einer Quest beschäftigt bist.","Puedes enviar a los miaurcenarios a buscar
materiales mientras tú estás <LSNR {ocupado} {ocupada}> con una
misión.","Мяуемников можно
отправлять на сбор материалов,
пока ты на задании.","Miaujemników możesz wysłać
po miau-teriały, podczas gdy ty będziesz
<LSNR {zajęty} {zajęta}> wykonywaniem zadania.",,,"Miaucenários podem ser enviados para
coletar materiais enquanto você está
em uma missão.","동반자 그림자 부대는 <PL> 씨가
퀘스트를 하는 동안
다른 곳으로 소재를 모으러 간다냥.","隨從隱密隊會在<PL>
進行任務的期間，
到其他地方去收集素材喵。","<PL>去执行任务的时候，
随从隐秘队会去其他地方
收集素材喵。",,,,,,,,"يمكن القطط المرتزقة
لتجميع المستلزمات
خلال <LSNR {قيامك} {قيامكِ}> بالمهمة.",,,,,,,,,,,
d2133e58-1d33-4f2d-a72a-616dea5fce52,2961583211,会話終了,,,,,,,,,,,,,,,,,,,,,,,,,,,,,,,,,,,,,,,nid306_s1_004,"<PL>さんの役に立つために
隊のみんなも頑張ってるから、
ぜひどんどん活用してほしいニャ！","All of the Buddies are eager to
help meow-t, so don't hesitate to
call on them when you need to!","Les Pilpoils sont ultra motivés pour
t'aider, alors n'hésite pas à faire
appel à eux !","Tutti i compagni sono prrronti
a dare una zampa, quindi chiamali
se hai bisogno di aiuto.","Alle Buddys wollen helfen, also zögere nicht,
von ihnen Gebrauch zu machen, wenn du
Hilfe miauchst!","Todos los camaradas están ansiosos por
ayudar, ¡así que no dudes en llamarlos cuando
te haga falta!","Все Спутники готовы тебе помочь, так
что если будет нужно, обращайся!","Wszyscy kompani są chętni do
pomocy, więc ś-miau-o możesz
wzywać ich w razie potrzeby!",,,"Todos os Amigos estão ansioso pra
ajudar, então não deixe de chamá-los
quando precisar!","<PL> 씨를 위해서
부대원들도 열심히 노력하고 있으니
적극적으로 활용해라냥!","為了能夠幫上<PL>的忙，
隊上每個成員都很努力，
請你一定要多加善用喵！","队里的大伙会努力
为<PL>效劳的，
请一定要善加利用喵！",,,,,,,,"يملأ الحماس جميع الأصدقاء
لتقديم المساعدة، لذا لا <LSNR {تتردد} {تتردي}> في
استدعائهم عند الحاجة!",,,,,,,,,,,
de427c3e-8626-41dc-a8a8-ac798babb08e,880779056,,(default)世間話,,,,,,,,,,,,,,,,,,,,,,,,,,,,,,,,,,,,,,nid306_s1_005,"ロンディーネさんは、
里の外から来た交易商人さんだニャ。",Rondine is a trader from a distant land.,Rondine vient d'une contrée lointaine.,Rondine è una mercante venuta da lontano.,"Rondine ist eine Händlerin aus
einem fernen Land.",Rondine es una mercader de un lugar remoto.,Рондина — торговка из дальних земель.,"Rondine jest handlarką, pochodzi
z dalekich stron.",,,"Rondine é um mercador
de uma terra distante.","론디네 씨는
마을 밖에서 온 교역상인이다냥.","隆蒂尼小姐是
來自村外的交易商人喵。","罗德娜
是村外来的交易商喵。",,,,,,,,تعد رونداين تاجرة من أرض بعيدة.,,,,,,,,,,,
095fbc12-0519-4b7c-b7e2-9457e5ed019b,2879709215,,,,,,,,,,,,,,,,,,,,,,,,,,,,,,,,,,,,,,,,nid306_s1_006,"カナリーノさんとチーニョさんも
そうだニャ。
みんな変わった名前だニャ。難しいニャ。","Kotori and Chino too.
Their names are...a little hard
to purr-onounce, no?","Kotori et Chino aussi... D'ailleurs, tu
trouves pas qu'ils ont des noms
difficiles à prononcer ?","Anche Kotori e Chino. I loro nomi sono... un
po' difficili da prrronunciare, non trovi?","Kotori und Chino auch. Ihre Namen sind...
etwas schwer miauszusprechen, oder?","Kotori y Chino también. Sus nombres son un
poco raros, ¿no crees?","Котори и Тино тоже.
Имена у них... трудновато
произносить, да?","Podobnie Kotori i Chino. Ale
imiona, co? Trudne do wy-miau-wienia.",,,"Kotori e Chino também.
Seus nomes são... um pouco
difíceis de pronunciar, não?","카나리노 씨와 치노 씨도
마찬가지다냥.
다들 이름이 특이하다냥. 어렵다냥.","卡那利諾和奇紐也一樣喵。
大家的名字都好特別喵，好難唸喵。","切伊诺和卡娜莉诺也是喵。
她们的名字都好怪喵，好难记喵。",,,,,,,,"كوتوري وتشينو أيضًا.
إن أسماءهم...صعبة بعض الشيء
في النطق، أليس كذلك؟",,,,,,,,,,,
d9b7ca79-0ffb-46ad-a458-0956216b94db,4261176753,,,,,,,,,,,,,,,,,,,,,,,,,,,,,,,,,,,,,,,,nid306_s1_007,"交易に興味があるなら
話しかけてみるといいニャ。","If you want to barter, go talk to them.","Bref. Si tu aimes marchander,
c'est eux qu'il faut aller voir.","Se vuoi fare uno scambio, rivolgiti a loro.","Wenn du handeln willst, sprich sie an.","Si quieres hacer negocios, habla con ellas.","Если тебе нужны товары, обращайся к ним.","Jeśli potrzebujesz wymiany
handlowej, idź właśnie do nich.",,,"Se quer negociar, vá falar com eles.","교역에 흥미가 있다면
얘기를 나눠보는 게 어떻냥?","要是你有興趣進行交易的話，
可以找他們交談喵。","你对交易有兴趣的话，
可以找她聊聊喵。",,,,,,,,إذا <LSNR {أردت} {أردتِ}> المقايضة، <LSNR {فلتذهب} {فلتذهبي}> للتحدث معهم.,,,,,,,,,,,
eed61532-4e5a-4e7d-9159-a5761926b6f7,3776989583,会話終了,,,,,,,,,,,,,,,,,,,,,,,,,,,,,,,,,,,,,,,nid306_s1_008,"なんだかちょっと変わった人だけど、
悪い人じゃないニャよ。","They might be a little purr-culiar, but
they're real cool Felynes, I purr-omise!","Ils sont un peu spéciaux, c'est vrai,
mais ils sont réglo ! Promis !","Potrebbero sembrare un po' strane, ma sono
Felyne miaolto simpatiche. Non
graffiano, prrromesso!","Sie mögen etwas sonderbar sein, sind aber
richtig feine Felynen. Ehrenmaunz!","Pueden parecer un poquito peculiares,
pero son buena gente, te lo purrrometo.","Пусть они и немного странные,
но доверять им можно, честно!","Może są nieco dziwne, ale miau-pewniam
cię, że to naprawdę porządne feliny!",,,"Eles podem ser peculiares, mas
são Felynos bem legais, prometo!","어딘가 조금 특이하지만
나쁜 사람은 아니다냥.","他們雖然有點特別，
但是並不是壞人喔喵。","我总觉得她有点怪，
但并不是坏人喵。",,,,,,,,"قد تبدو عليها علامات الغرابة بعض الشيء،
إلا إنها قطط فيلاين رائعة،<LSNR {أعدك} {أعدكِ}> بذلك!",,,,,,,,,,,
