guid,crc?,<PageAttr>,<TalkAttr>,<VillageProgress>,<HallProgress>,<HunterRank>,<TalkTag>,<TalkTagParam>,<TalkTagComment>,<TalkTag>,<TalkTagParam>,<TalkTagComment>,<TalkTag>,<TalkTagParam>,<TalkTagComment>,<TalkTag>,<TalkTagParam>,<TalkTagComment>,<TalkTag>,<TalkTagParam>,<TalkTagComment>,<TalkTag>,<TalkTagParam>,<TalkTagComment>,<TalkTag>,<TalkTagParam>,<TalkTagComment>,<TalkTag>,<TalkTagParam>,<TalkTagComment>,<TalkTag>,<TalkTagParam>,<TalkTagComment>,<TalkAction1>,<TalkAction1Param>,<TalkAction1Comment>,<TalkAction2>,<TalkAction2Param>,<TalkAction2Param2>,<TalkAction2Comment>,<KohakuProgress>,entry name,Japanese,English,French,Italian,German,Spanish,Russian,Polish,Dutch,Portuguese,PortugueseBr,Korean,TraditionalChinese,SimplifiedChinese,Finnish,Swedish,Danish,Norwegian,Czech,Hungarian,Slovak,Arabic,Turkish,Bulgarian,Greek,Romanian,Thai,Ukrainian,Vietnamese,Indonesian,Fiction,Hindi,LatinAmericanSpanish
33f8fd35-5bed-4072-bd96-b91f931f0792,2715460235,,初対面会話,,,,この会話フラグがONなら→,EV_PRO_MR_001_01_01,,この会話フラグがOFFなら→,NID_615_FIRST,,,,,,,,,,,,,,,,,,,,,,,,,,,,,,,nid615_base1_000,"こんにちは。
初めまして、お待ちしておりました。
私、王国騎士のルーチカと申します。","I've been waiting for you. I am Luchika,
knight of the Royal Order, at your service.","Je t'attendais. Je suis Luchika, Chevalier de
l'Ordre Royal, à ton service.","Ti aspettavo. Io sono Luchika, cavaliera
dell'Ordine reale, al tuo servizio.","Ich habe dich erwartet. Ich bin Luchika,
Ritterin des Königlichen Ordens,
stets zu Diensten.","Te he estado esperando.
Soy Luchika, caballero de la Orden Real,
a tu servicio.","Я ждала тебя. Я Лучика, рыцарь
Королевского Ордена, к твоим
услугам.","Czekałam na ciebie. Jestem Luchika,
rycerka Królewskiego Orderu, do usług.",,,"Eu estava esperando você. Sou Luchika,
Cavaleira da Ordem Real, ao seu dispor.","안녕하세요. 처음 뵙겠습니다.
기다리고 있었습니다.
저는 왕국 기사 루치카라고 합니다.","您好。
初次見面，我已恭候多時。
我是王國騎士──露琪卡。","您好，初次见面，恭候已久。
我是王国骑士露琪卡。",,,,,,,,"لقد كنت في <LSNR {انتظارك} {انتظاركِ}>. أنا لوتشيكا،
فارسة الأمر الملكي، في خدمتك.",,,,,,,,,,,
376008b6-7896-4cb2-b84b-fcc040b4a755,1379975905,,,,,,,,,,,,,,,,,,,,,,,,,,,,,,,,,,,,,,,,,nid615_base1_001,"<PL>様のことは
すでにお伺いしております。
カムラの里の「猛き炎」様、ですね。","You are the ""Fierce Flame of Kamura,""
are you not? Tales of your deeds have
reached far.","Tu es la ""Flamme furieuse de Kamura"",
pas vrai ? Tes exploits forcent l'admiration.","Tu sei la ""Fiamma audace di Kamura"", vero?
Le tue imprese ti precedono.","Du bist die Grimmige Flamme von Kamura,
nicht wahr? Von deinen Taten erzählt
man sich landauf, landab.","Eres la ""Feroz Llama de Kamura"", ¿cierto?
Tus hazañas se conocen en los lugares
más lejanos.","Ты и есть ""Яростное Пламя Камуры"",
не так ли? Сказания о твоих заслугах
дошли до самых дальних земель.","Jesteś Nieulękły Płomień Kamury, tak? Aż
tu zawitały wieści o twoich czynach.",,,"Você é a ""Fúria Flamejante de Kamura""?
Histórias dos seus feitos chegaram longe.","<PL> 님에 대해선
익히 들어 알고 있습니다.
카무라 마을의 「맹렬한 불꽃」 님이시죠?","我已聽聞<PL>的種種事蹟。
您就是神火村的「烈火」沒錯吧？","<PL>，久仰大名。
您就是炎火村的“烈焰”吧。",,,,,,,,"<LSNR {أنت} {أنتِ}> ""شعلة كامورا الشرسة،""
أليس كذلك؟ لقد ذاع صيت
<LSNR {أعمالك} {أعمالكِ}> الشجاعة في كل مكان.",,,,,,,,,,,
0fddc33d-564b-4bbe-8954-d551cc81017b,2189529487,会話終了,,,,,,,,,,,,,,,,,,,,,,,,,,,,,,,,,,,,,,,,nid615_base1_002,"私も、王国騎士として狩猟に
従事しております。ご縁があった際には
よろしくお願いいたします。","Like you, I am a hunter. I look forward
to seeing your skill in battle someday.","Je suis chasseuse, comme toi.
J'ai hâte de voir tes prouesses au combat.","Anch'io sono una cacciatrice. Non vedo
l'ora di constatare le tue abilità
in battaglia, un giorno.","Ich bin eine Jägerin, wie du. Ich freue
mich schon, dein Kampfgeschick zu sehen.","Yo soy cazadora, igual que tú.
Tengo ganas de ver cómo te manejas
en los combates un día de estos.","Я охотница, как и ты. Надеюсь вскоре
увидеть твое боевое мастерство в
действии.","Podobnie jak ty jestem łowczynią. Chętnie
zobaczę, jak walczysz.",,,"Como você, sou uma caçadora. Quero muito
ver sua habilidade em combate, um dia.","저도 왕국 기사로서 사냥에
나서고 있습니다. 연이 닿는다면
부디 잘 부탁드립니다.","我身為王國騎士，也會前往狩獵。
如果有緣同行，屆時還請多多關照。","身为王国骑士，我平时也会去狩猎。
以后有机会，还要请您多关照。",,,,,,,,"أنا صياد <LSNR {مثلك} {مثلكِ}>. وأتطلع
إلى رؤية <LSNR {مهارتك} {مهارتكِ}> في المعركة يومًا ما.",,,,,,,,,,,
41f902ea-fbec-4983-923d-9410555aaa1b,289843249,,(default)世間話,,,,この会話フラグがONなら→,EV_PRO_MR_001_01_01,,この会話フラグがOFFなら→,EV_PRO_MR_001_01_02,,,,,,,,,,,,,,,,,,,,,,,,,,,,,,,nid615_base1_003,"エルガドは観測拠点ですが
騎士の活動に必要な施設は
一通りそろっております。","Elgado is but an observation base, but
it has outfitted with all the necessary
facilities for our duties.","Elgado n'est qu'un avant-poste, mais
on y trouve toutes les installations
nécessaires à nos missions.","Elgado è solo una base di osservazione,
ma è dotata di tutte le strutture
necessarie ai nostri scopi.","Elgado ist nur eine Beobachtungsbasis,
aber es gibt hier alle für unsere Pflichten
nötigen Einrichtungen.","Elgado es una mera base de observación,
pero cuenta con todas las instalaciones
necesarias para cumplir nuestro deber.","Элгадо — это лишь база для наблюдений,
но здесь есть все необходимое для
работы.","Elgado to baza obserwacyjna, ale ma
wszystko, co potrzebne do
pełnienia obowiązków.",,,"Elgado é só uma base de observação, mas
está equipada com todas as instalações
necessárias para nossos deveres.","엘가도는 관측 거점이지만
기사의 활동에 필요한 시설은
어느 정도 갖추어져 있습니다.","艾爾卡多雖然是個觀測據點，
但是此處也有騎士活動時所需的
各項設備，且一應俱全。","埃尔迦德虽然是观测据点，但骑士活动
所需的设施基本齐全。",,,,,,,,"إن إلجادو ما هي إلا قاعدة مراقبة، لكن
تم تجهيزها بجميع المرافق اللازمة
لأداء المهام.",,,,,,,,,,,
a3e65a62-120d-457b-ba0b-ce85abe050d9,1400215022,,,,,,,,,,,,,,,,,,,,,,,,,,,,,,,,,,,,,,,,,nid615_base1_004,"各施設のみなさまも、その道のプロばかり。
これも提督の手腕ですね。","We are blessed with many professionals
and artisans. We can thank Admiral
Galleus for assembling them all here.","Nous avons plein d'artisans et de pros,
et nous pouvons remercier l'amiral
Galleus de les avoir fait venir ici.","Siamo fortunati ad avere molti
professionisti e artigiani. Ed è tutto
merito dell'ammiraglio Galleus.","Wir haben das Glück, viele Fachkräfte
und Handwerker zu haben. Das haben
wir Galleus zu verdanken.","Muchos profesionales y artesanos nos honran
con su presencia. Dale las gracias por ello
al almirante Galleus.","Адмирал Галлеус собрал здесь множество
профессионалов и ремесленников, за что
мы все ему очень благодарны.","Mamy tak wiele wspaniałych ekspertów
i artystów. Możemy dziękować Admirałowi
Galleusowi za ich zebranie.",,,"Fomos abençoados com muitos artesãos e
profissionais. É graças ao Almirante
Galleus que reunimos todos eles aqui.","각 시설에 계신 분들도 해당 분야의 프로.
이 또한 제독님의 수완이라고 할 수 있죠.","不僅如此，各項設備的負責人也都是專家。
這都得多虧提督高明的手腕。","各个设施的人员也都是各个业内的行家，
这也是提督的本事。",,,,,,,,"نحن محظوظون بوجود العديد من المهنيين
والحرفيين. يمكننا أن نشكر الأدميرال
جاليوس على جمعهم هنا.",,,,,,,,,,,
e97b733a-0cbe-41e5-ae3a-69ac9f1ef775,764861168,会話終了,,,,,,,,,,,,,,,,,,,,,,,,,,,,,,,,,,,,,,,,nid615_base1_005,"<PL>様も、ご用があれば
ぜひエルガドの施設をご利用ください。","If you find yourself in need of answers,
I shall lend you my ear.","Si tu te poses des questions,
j'essaierai d'apporter des réponses.","Se hai bisogno di risposte, sarò lieta
di darti una mano.","Wenn du nach Antworten suchst,
habe ich ein offenes Ohr.","Si tienes alguna pregunta que necesite
respuesta, seré toda oídos.","Если у тебя будут вопросы, можешь
обращаться ко мне.","Jeśli będziesz potrzebować
odpowiedzi, chętnie pomogę.",,,"Se você precisar de respostas, eu
estarei à sua disposição.","<PL> 님도 필요하시다면
엘가도의 시설을 이용해 주세요.","<PL>，您如果有任何需求，
還請儘管使用艾爾卡多的設備。","<PL>，您要是有需要，
一定要去一去埃尔迦德的设施啊。",,,,,,,,"إذا <LSNR {وجدت} {وجدتِ}> <LSNR {أنك} {أنكِ}> بحاجة إلى إجابات،
<LSNR {فسأسمعك} {فسأسمعكِ}> بانتباه.",,,,,,,,,,,
61e6bdb5-e509-4a9d-a8d8-219b15ff86f6,3154326576,,(default)世間話,,,,この会話フラグがONなら→,EV_PRO_MR_001_01_02,,このクエストが未クリアなら→,QN335101,,,,,,,,,,,,,,,,,,,,,,,,,,,,,,,nid615_base1_006,"エルガドでは、ハンターのことを
「騎士」と申します。
王国を守る騎士、ということですね。","Here in Elgado, hunters are also referred
to as ""knights."" Those sworn to protect
the Kingdom.","Ici à Elgado, les <LSNR {chasseurs} {chasseuses}> sont
aussi des chevaliers qui ont prêté
serment de protéger le Royaume.","Qui a Elgado, i cacciatori vengono
definiti cavalieri. Sono coloro che
hanno giurato di proteggere il regno.","Hier in Elgado werden Jäger auch als
Ritter bezeichnet. Diese haben
geschworen, das Königreich zu schützen.","En Elgado, a los cazadores nos llaman
caballeros, pues hemos jurado proteger
el reino.","В Элгадо охотников также называют
""рыцарями"". Они приносят клятву
защищать Королевство.","Tu, w Elgado, łowcy są również nazywani
„rycerzami”. Chronią oni
Królestwo.",,,"Aqui, em Elgado, os caçadores também são
chamados de ""cavaleiros"". Aqueles que
juraram defender o Reino.","엘가도에서는 헌터를
「기사」라고 불러요.
왕국을 지키는 기사라는 뜻이죠.","在艾爾卡多，獵人一職被稱為「騎士」。
因為擔任此職者，
便如同保衛王國的騎士。","在埃尔迦德，猎人被叫做“骑士”，
也就是保卫王国的骑士。",,,,,,,,"هنا في إلجادو، يُشار إلى الصيادين أيضًا
باسم ""الفرسان"". أولئك الذين أقسموا على حماية
المملكة.",,,,,,,,,,,
6cad74b0-e08f-49ad-99e7-5d023dd5e96e,3928184692,,,,,,,,,,,,,,,,,,,,,,,,,,,,,,,,,,,,,,,,,nid615_base1_007,"責任感とやりがいを感じる
非常にいい名前だと思っています。","A suitable name, one that gives a sense
of responsibility and fulfillment to those
who'll carry it.","Un nom qui convient bien au sentiment
de devoir de ceux qui le portent.","Un nome appropriato che dà un senso
di responsabilità e rispetto a chi lo porta.","Ein passender Name, der das
Verantwortungsgefühl und die Erfüllung
deren widerspiegeln, die ihn tragen.","Es un nombre apropiado que da sentido de
responsabilidad y cumplimiento a quienes
lo llevamos.","Подходящее имя, наделяющее несущих
его чувством ответственности и
выполнения долга.","Jest to odpowiednia nazwa i daje
poczucie odpowiedzialności
oraz obowiązku.",,,"Um nome adequado, que oferece um senso
de responsabilidade e realização àqueles
que o portam.","책임감과 보람을 느낄 수 있는
정말 좋은 이름이라고 생각해요.","個人認為這個名字非常好，
能夠使人感受到責任與挑戰。","我觉得这个名字很好，能激发人的
责任和干劲。",,,,,,,,"إنه اسم مناسب يعطي إحساسًا
بالمسؤولية والوفاء لكل من
يحمله.",,,,,,,,,,,
e3ff4660-8e67-48de-bb7b-45c1cb1d9d68,1105496156,会話終了,,,,,,,,,,,,,,,,,,,,,,,,,,,,,,,,,,,,,,,,nid615_base1_008,"私とジェイは、個人ではなく王国に
所属するため「王国騎士」になります。
王国を守るために日々励んでいるのです。","We are knights of the Royal Order because
we fight to protect the Kingdom, not only
for our own selfish ends.","Nous, Chevaliers de l'Ordre Royal,
combattons pour le Royaume et
non à des fins personnelles.","Noi siamo ""Cavalieri dell'Ordine reale""
perché combattiamo per proteggere il
regno, non solo per i nostri fini egoisti.","Wir sind Ritter des Königlichen Ordens,
weil wir für den Schutz des Königreichs
kämpfen, nicht für unsere eigenen Ziele.","Somos caballeros de la Orden Real porque
luchamos por proteger el reino, en lugar de
hacerlo en beneficio propio.","Мы зовемся ""рыцарями Королевского Орде-
на"" потому, что сражаемся ради защиты
Королевства, а не для собственных целей.","Jesteśmy „Rycerzami Królewskiego
Orderu”, bo chronimy Królestwo.
Nie walczymy tylko dla własnych celów.",,,"Somos os ""Cavaleiros da Ordem Real"",
porque lutamos para proteger o Reino,
não só pelos nossos fins egoístas.","저와 제이는 개인이 아닌 왕국
소속이기에 「왕국 기사」라고 합니다.
항상 왕국을 지키기 위해 힘쓰고 있죠.","我與傑伊並非隸屬於特定人士，
而是隸屬於王國，所以稱「王國騎士」。
為了保衛王國，我們每天都精益求精。","我和杰伊隶属于王国，并非单独行动，所以是
“王国骑士”。我们每天都在努力保卫王国。",,,,,,,,"نحن ""فرسان الأمر الملكي""
لأننا نكافح لحماية المملكة،
وليس فقط من أجل غاياتنا الأنانية.",,,,,,,,,,,
1ee85ca0-67ce-49ae-b0c3-01d20a7040fc,3336938785,,(default)世間話,,,,このクエストがクリア済みなら→,QN335101,,この会話フラグがOFFなら→,EV_PRO_MR_001_02_01,,,,,,,,,,,,,,,,,,,,,,,,,,,,,,,nid615_base1_009,"エルガドに闘技場はありませんが、
優秀な方々に助言をいただいたり
特訓をつけていただいています。","Elgado lacks any kind of arena, but
we make up for it with advice and
training from real professionals.","Il n'y a pas d'arène à Elgado mais
on compense avec un entraînement
dispensé par de vrais pros.","A Elgado non abbiamo arene, ma rimediamo
con i consigli e l'addestramento da parte di
veri professionisti.","Elgado hat keine Arena, aber der Rat
von echten Profis und das Training
mit ihnen macht das wett.","En Elgado no hay ninguna arena y, para
compensarlo, ofrecemos asesoramiento
y formación impartida por profesionales.","В Элгадо нет арены, зато у нас есть
настоящие профессионалы, готовые дать
совет или помочь в тренировке.","W Elgado nie ma areny, ale za to można
tu się poradzić i wyszkolić u prawdziwych
profesjonalistów.",,,"Elgado não conta com nenhuma arena, mas
compensamos a falta com conselhos e
treinamento por profissionais.","엘가도에는 격투장이 없지만,
우수한 분들이 계시기에 조언을
듣거나 특훈을 받고 있습니다.","雖然艾爾卡多並無設置鬥技場，
但此處人才濟濟，我們時常能獲得建議，
並與人進行特訓。","埃尔迦德虽然没有斗技场，但精英云集，所以
我会去请教他们，还会让他们特训我。",,,,,,,,"تفتقر إلجادو إلى وجود ساحات التدريب، لكننا
نعوض ذلك بالحصول على المشورة والتدريب
من محترفين حقيقيين.",,,,,,,,,,,
1819134f-8fa8-40c4-b851-c9baa100881c,3719843177,会話終了,,,,,,,,,,,,,,,,,,,,,,,,,,,,,,,,,,,,,,,,nid615_base1_010,"提督にアルロー教官、フィオレーネ様。
それに、<PL>様も。
何か気づいた際には、ぜひご指摘ください。","The Admiral, Master Arlow, Dame Fiorayne,
and you of course. It would be an honor to
hear any feedback you may have.","L'amiral, Maître Arlow, Dame Fiorayne,
et toi bien sûr. Ça serait un honneur
d'avoir ton avis.","L'Ammiraglio, il maestro Arlow, Dama
Fiorayne e te, ovviamente. Sarebbe un
onore avere il tuo parere.","Der Admiral, Arlow, Fiorayne
und natürlich du. Es wäre eine Ehre,
Tipps von dir zu erhalten.","El almirante, el maestro Arlow, Fiorayne
y, por supuesto, tú. Será un honor
escuchar lo que tengas que decir.","Адмирал, Мастер Арлоу, рыцарь Фиорайна
и, конечно же, ты. Для меня будет честью
услышать любой твой совет.","Admirał, Mistrz Arlow, Pani Fiorayne
i ty. Chętnie usłyszę twoje opinie.",,,"O Almirante, Mestre Arlow, Dama Fiorayne
e você, é claro. Seria uma honra ouvir
qualquer conselho que você tiver.","제독님과 알로 교관님, 피오레네 님.
그리고 <PL> 님까지.
뭔가 발견하시면 꼭 알려 주세요.","提督、亞爾羅教官、菲歐莉尼大人和您
都是我們能夠學習的對象。
如果有任何建議，還請不吝指教。","提督、阿尔洛教官、菲奥莱娜，还有您都是。
要是您觉得我哪里做得不好，请务必指出。",,,,,,,,"الأدميرال، وسيد أرلو، والسيدة فيوراين، <LSNR {وأنت} {وأنتِ}> بالطبع.
إنه لشرف كبير أن نسمع أي
ملاحظات قد تكون لديكم.",,,,,,,,,,,
df9d5070-91ab-4375-9abc-c84074c06d02,2396020064,,(default)世間話,,,,この会話フラグがONなら→,EV_PRO_MR_001_02_01,,この会話フラグがOFFなら→,EV_PRO_MR_001_99_01,,,,,,,,,,,,,,,,,,,,,,,,,,,,,,,nid615_base1_011,"我々のエルガドでの最終目的は
メル・ゼナの討伐です。同時に王域生物の
拡大を食い止めることです。","Our ultimate goal here is to defeat
Malzeno. We must also halt the
advance of the Kingdom monsters.","Notre but ultime, c'est terrasser le Malzeno.
On doit aussi contenir l'avancée des
monstres du Royaume.","Il nostro obiettivo principale è sconfiggere
il Malzeno. In più, dobbiamo fermare
l'avanzata dei mostri nel regno.","Unser ultimatives Ziel ist der Sieg über den
Malzeno. Und wir müssen dem Vormarsch
der Königreich-Monster Einhalt gebieten.","Nuestra meta final es acabar con Malzeno.
También hemos de detener el avance
de los monstruos del reino.","Наша основная цель — победить Малзено.
Но мы также должны остановить
распространение монстров Королевства.","Naszym głównym celem jest pokonanie
Malzeno. Musimy też powstrzymać napór
potworów Królestwa.",,,"Nossa meta final aqui é derrotar o
Malzeno. Também temos que deter o avanço
dos monstros do Reino.","저희의 최종 목표는 엘가도에서
멜-제나를 토벌하는 것과 동시에
왕역생물의 확대를 막는 것입니다.","艾爾卡多的最終目標為討伐爵銀龍，
以及阻止王域生物繼續擴大活動範圍。","我们在埃尔迦德的最终目标是讨伐爵银龙。
同时，还需要阻止王域生物扩张领地。",,,,,,,,"إن هدفنا النهائي هنا هو هزيمة
مالزينو. يجب علينا أيضًا أن نوقف
تقدم وحوش المملكة.",,,,,,,,,,,
8c46fe68-be3f-464d-b5e7-9a7ffd16053f,1982587021,,,,,,,,,,,,,,,,,,,,,,,,,,,,,,,,,,,,,,,,,nid615_base1_012,"クエストを遂行することも大事ですが
同じくらい、原因の調査も必要です。
日々の勉強は欠かせません。","Questing is an important aspect in our
daily lives, yet dare I say investigating
can be just as important.","Les quêtes sont importantes au quotidien,
et les recherches tout autant.","Le missioni sono un aspetto importante
della nostra vita, eppure oserei dire che
le ricerche sono altrettanto fondamentali.","Quests sind ein wichtiger Aspekt
unseres Alltags, aber ich würde sagen,
Untersuchungen sind genauso wichtig.","Las misiones son muy importantes en nuestra
vida cotidiana, y me atrevería a decir que
investigar también lo es.","Выполнение заданий является важным
аспектом нашей повседневной жизни, но
расследования могут быть не менее важны.","Zadania to ważny aspekt naszego życia, ale
badania są tak samo ważne.",,,"Cumprir missões é um aspecto importante
da nossa rotina diária, mas, ouso dizer
que a investigação pode ser tão vital.","퀘스트를 수행하는 것도 중요하지만,
원인을 조사하는 것도 필요해요.
매일같이 공부하는 건 필수죠.","進行任務固然重要，
但是調查事件的原因也有其必要。
我們每天都得努力磨練自己。","执行任务固然重要，但调查事情的原因也
一样懈怠不得。每天都必须努力学习。",,,,,,,,"يعد تنفيذ المهام جانبًا مهمًا في
حياتنا اليومية، ولكن أجرؤ على القول إن التحقيق
يمكن أن يكون بنفس الأهمية.",,,,,,,,,,,
1ac86f0e-9163-4087-96cf-b8e4d2a0a2f4,4204561134,会話終了,,,,,,,,,,,,,,,,,,,,,,,,,,,,,,,,,,,,,,,,nid615_base1_013,"ジェイは…どちらかというと体を使う方が
得意なようです。…もう少し勉学にも
興味をもってほしいですね。","I had hoped Jae would take his studies
more seriously... At this rate, he'll be
all brawn and no brains.","J'aurais cru que Jae serait plus
appliqué... Il se repose trop sur
ses facultés.","Avrei voluto che Jae prendesse i suoi
studi più seriamente... Di questo passo,
sarà tutto muscoli e niente cervello.","Ich hatte gehofft, Jae würde sein Studium
ernster nehmen. Wenn das so weitergeht,
hat er bald nur Muskeln ohne Hirn.","Esperaba que Jae se tomase más en serio
sus estudios... A este paso, acabará siendo
todo músculos sin tener cerebro.","Я надеялась, что Джей более серьезно
отнесется к своему обучению... Так он
превратится в безмозглого силача.","Miałam nadzieję, że Jae będzie pilniej
się uczyć... Na razie wygląda na to, że
będzie tylko silny.",,,"Eu tinha torcido para que Jae levasse
o estudo mais a sério... Desse jeito,
ele vai acabar só músculo sem cérebro.","제이는… 굳이 말하자면 몸 쓰는 게
특기인 것 같아요… 어느 정도는 공부에도
흥미를 가져 줬으면 좋겠네요.","至於傑伊……
他似乎在體能方面較為拿手……
我希望他能更用心學習一點。","杰伊他……好像更擅长干力气活。
……真希望他能在学习上也多花点心思。",,,,,,,,"كنت آمل أن يأخذ جاي دراسته على
محمل الجد... ولكن بهذا المعدل، سيكون
قويًا، ولكنه لن يكون ذكيًا.",,,,,,,,,,,
79504252-935a-44aa-949c-ec8829e973a8,1641291884,,(default)世間話,,,,この会話フラグがONなら→,EV_PRO_MR_001_99_01,,この会話フラグがOFFなら→,EV_PRO_MR_002_01_01,,,,,,,,,,,,,,,,,,,,,,,,,,,,,,,nid615_base1_014,"フィオレーネ様がムチャをなさるのは
いつものことです。ですが、提督が
お怒りになるのは珍しいですね。","It isn't like Fiorayne to be reckless.
It isn't like Admiral Galleus to be
short-tempered, either.","C'est pas le genre de Fiorayne
d'être imprudente, ni de l'Amiral
Galleus d'être coléreux.","Fiorayne non è mai stata così incosciente
e l'ammiraglio Galleus non è mai stato
così irascibile.","Waghalsigkeit sieht Fiorayne gar
nicht ähnlich. Auch Galleus ist
eigentlich nicht unbeherrscht.","No es propio de Fiorayne ser insensata,
como tampoco lo es del almirante Galleus
tener tan mal genio.","Такое безрассудство не свойственно
Фиорайне. Да и Адмирал Галлеус
обычно не такой вспыльчивый.","To niepodobne do Fiorayne, aby być
lekkomyślną. Admirał Galleus
też nie jest nerwowy.",,,"Não é típico da Fiorayne ser imprudente.
Também não é típico do Almirante Galleus
ficar furioso.","피오레네 님께서 무리하시는 건
항상 있는 일이에요. 하지만 제독님이
화를 내시는 건 흔치 않은 일이네요.","菲歐莉尼大人經常做出冒險之事。
但提督這次居然大動肝火，
實在相當罕見。","菲奥莱娜乱来是常有的事了，但提督生气倒是
十分少见。",,,,,,,,"ليس من عادة فيوراين أن تكون متهورة.
وليس من عادة الأدميرال جاليوس
أن يكون سريع الغضب أيضًا.",,,,,,,,,,,
