guid,crc?,entry name,Japanese,English,French,Italian,German,Spanish,Russian,Polish,Dutch,Portuguese,PortugueseBr,Korean,TraditionalChinese,SimplifiedChinese,Finnish,Swedish,Danish,Norwegian,Czech,Hungarian,Slovak,Arabic,Turkish,Bulgarian,Greek,Romanian,Thai,Ukrainian,Vietnamese,Indonesian,Fiction,Hindi,LatinAmericanSpanish
6cd302b1-917c-4a2e-8b94-f4563ca02264,712984453,OtDogArmor_Chest_056_Explain,"徳のある佇まいの胴用装備。
火のご利益が熱を防ぐと言われ
暑さがニガテなガルクに大人気。","Elegant armor said to be
blessed by fire. Cold-loving
Canynes love its breezy fit.","Une armure chic bénie par le
feu. Les Canynes amateurs de
froid en raffolent.","Elegante armatura benedetta
col fuoco. Ventilata, ideale
per Canyne calorosi.","Dieser Panzer soll wohl vom
Feuer gesegnet sein. Canynen
mögen die luftige Passform.","Elegante armadura bendecida
por el fuego. Los Canyne
propensos al frío la adoran.","Элегантная броня. Говорят,
она благословлена огнем. Ее
прохладу любят Собакки.","Stylowy pancerz sprawdzony
w walce. Zimnolubne kynosy
docenią go za przewiewność.",,,"Armadura elegante abençoada
pelo fogo. Canynos do frio
adoram seu frescor.","덕망이 느껴지는 몸통 방어구.
불의 힘이 열을 막아줘 더위를
잘 타는 가루크에게 인기.","散發出德行之風的身體裝備。
據說受到火的庇佑，能夠抗熱，
很受怕熱的加爾克歡迎。","看起来德高望重的身体装备。
据说火之加护能阻挡热量，
相当受怕热的牙猎犬欢迎。",,,,,,,,"درع أنيقة يُقال إنها بُوركت
بالنار. تحب كائنات الكناين
المحبة للبرد نسيمها المناسب.",,,,,,,,,,,
4422d163-8cd9-4c00-9da6-5bcc1c47adcf,737936978,OtDogArmor_Chest_057_Explain,"山霊の神通力を微かに宿す。
胴用装備。魔を退け、妖から
身を守ると言われている。","Blessed armor of the alpine
spirits. Said to exorcise
evil and ward off disaster.","Les esprits alpins ont béni
cette armure censée écarter
le mal et protéger du chaos.","Armatura degli spiriti
delle montagne. Scaccia
il male e allontana i guai.","Von Berggeistern gesegneter
Panzer. Vertreibt wohl das
Böse und hält Unheil fern.","Bendecida por espíritus
alpinos. Exorciza el mal y
guarda de calamidades.","Благословенная броня горных
духов. Говорят, изгоняет зло
и несчастья.","Strój naznaczony tchnieniem
górskich duchów. Podobno
odstrasza zło i katastrofy.",,,"Armadura abençoada pelos
espíritos alpinos. Exorciza
o mal e o desastre.","산신님의 신통력을 조금 담은
몸통 방어구. 마를 쫓아내고
요괴로부터 지켜준다고 한다.","蘊藏著微量山靈神通力的
身體裝備。相傳能夠除魔，
保護使用者不受妖物傷害。","寄宿着山神些许神通力的
身体装备。据说能降妖除魔，
从妖怪手中保护自己。",,,,,,,,"درع مباركة لأرواح
جبال الألب. يُقال إنها تطرد
الشر وتمنع الكوارث.",,,,,,,,,,,
b1c004c2-2477-422f-9a5b-111ce3989160,1226813103,OtDogArmor_Chest_058_Explain,"毒妖鳥の素材から造られた
胴用装備。緑色の外套に身を
包んだ姿は、まさに森の狩人。","Pukei-Pukei chest armor.
Its green shroud is perfect
for woodland hunting.","Une cape en Pukei-Pukei.
Sa couleur verte permet de
se camoufler dans la nature.","Protezione Pukei-Pukei. Il
colore verde la rende adatta
alla caccia nei boschi.","Pukei-Pukei-Brustpanzer.
Der grüne Kragen eignet sich
gut für die Jagd im Wald.","Coraza de Pukei-Pukei. Su
mortaja verde es perfecta
para cazar en los bosques.","Плащ из Поки-Поки.
Зеленый покров подходит
для охоты в лесу.","Napierśnik z Pukei-Pukei
w odcieniu zieleni idealnym
do polowań w kniejach.",,,"Peitoral de Pukei-Pukei.
Sua cor verde é perfeita
para caçadas na selva.","독요조의 소재로 만들어진
몸통 방어구. 녹색 외투를
두른 모습은 숲의 사냥꾼이다.","以毒妖鳥素材製成的身體裝備。
將綠色外套穿在身上的樣子，
簡直就像是森林裡的獵人。","毒妖鸟素材制成的身体装备。
绿色外套包裹身体的模样，
仿佛森林里的猎人一般。",,,,,,,,"درع صدر بوكي-بوكي.
ويُعد غطاؤها الأخضر مثاليًا
للصيد في الغابات.",,,,,,,,,,,
46455f66-abc1-4ef9-b372-3ea623f6619e,3284640465,OtDogArmor_Chest_059_Explain,"鉄壁の守りを追求した胴用装備。
全身を包む頑強な装甲は、
大岩の如く衝撃をはじき返す。","No-frills protection.
This all-encasing armor
can deflect boulders.","Une armure sans superflu qui
recouvre tout le corps et
peut endurer une avalanche.","Protezione senza fronzoli.
Una copertura totale che
devia anche i macigni.","Schlichter Schutz.
Diese Vollpanzerung kann
Felsbrocken abwehren.","Protección sin florituras.
Esta completa armadura
desviaría hasta peñascos.","Простая защита.
Эта обширная броня может
отражать удары камней.","Ochrona bez kompromisów.
Obszerny i mocny pancerz, od
którego odbijają się głazy.",,,"Proteção despreocupada.
Esta armadura que tudo cobre
rebate rochedos.","철벽 같은 방어를 추구한
몸통 방어구. 전신을 감싼
장갑은 큰 충격도 튕겨낸다.","追求固若金湯防禦的身體裝備。
包覆全身的堅固裝甲有如巨岩，
能將衝擊給反彈回去。","追求铁壁守护的身体装备。
覆盖全身的坚固装甲
如同巨岩般弹开冲击。",,,,,,,,"حماية أساسية.
يمكن لهذه الدرع المكسوة
بالكامل أن تُزيح الصخور.",,,,,,,,,,,
aeb94e53-9268-42bf-be9a-228efa41dd93,3204202149,OtDogArmor_Chest_060_Explain,"陸の女王の気品が宿った鮮緑の
胴用装備。猛火ですらも
はねのける、高い性能を誇る。","Viridescent plate dripping
with queenly grace. Repels
even the fiercest of flames.","Des plaques impériales aux
reflets de jade capables de
résister aux flammes.","Piastra verdastra di regale
eleganza. In grado di
respingere qualunque fiamma.","Grüne Platte mit königlicher
Eleganz. Wehrt sogar die
wildesten Flammen ab.","Armadura glauca de gracia
majestuosa. Repele las
llamas más fieras.","Зеленоватый доспех. Источает
благородство. Защищает
от сильнейшего пламени.","Zielonkawe cudo emanujące
królewskim urokiem. Odporne
na najsilniejsze płomienie.",,,"Placas brilhantes que gozam
de graça real. Repele
até as mais fortes chamas.","육지의 여왕의 기품이 깃든
몸통 방어구. 맹화를 튕겨내는
높은 성능을 자랑한다.","寄宿著陸之女王氣質的鮮綠色
身體裝備。擁有傲人的高性能，
連烈火都能避開。","拥有陆地女王气度的绿色
身体装备。甚至能抵挡烈火，
拥有高性能。",,,,,,,,"لوح أخضر تنتشر منه
نعمة ملكية. يصد
حتى أعنف النيران.",,,,,,,,,,,
1e7112eb-6c83-4796-81de-51d8da02b8d2,1172230050,OtDogArmor_Chest_061_Explain,"泥魚竜の素材を用いた胴用装備。
素材に付着した泥もそのまま
活用し、より強度を高めている。","Jyuratodus plate still
tangibly muddy, but that
just makes it stronger.","Un plastron en Jyuratodus
encore un peu boueux, ce
qui le rend plus solide.","Piastra Jyuratodus. È
ancora infangata, ma
per questo più resistente.","Jyuratodus-Panzer, dessen
fühlbare Schlammschicht ihm
zusätzlich Stärke verleiht.","Placas de Jyuratodus todavía
muy enfangadas, pero eso las
hace aún más resistentes.","Доспех из Юратода. Очень
грязный, но от этого
он лишь прочнее.","Płyta z Jyuratodusa jest
wyczuwalnie błotnista, a co
za tym idzie – mocniejsza.",,,"Placa de Jyuratodus ainda
enlameada, mas isso só
a deixa mais forte.","이어룡의 소재로 만든 몸통
방어구. 소재에 묻은 진흙도
활용해 강도를 높였다.","以泥魚龍素材製成的身體裝備。
連附著在素材上的泥土也加以
活用，使強度更加提升。","用泥鱼龙素材制成的身体装备。
直接活用附着于素材上的泥，
进一步提升了硬度。",,,,,,,,"لا يزال لوح جيوراتودوس
موحلًا بصورة ملحوظة،
لكن هذا يجعله أقوى.",,,,,,,,,,,
84998ec0-045b-47d8-a3cf-4401435d8c8d,1827745906,OtDogArmor_Chest_062_Explain,"冥界への使者が纏う黒衣。対峙
した者は知る。命尽きても逃れ
られぬ苦しみがあることを。","Dark garb worn by agents of
the underworld, who speak of
enduring pain after death...","Une tenue ténébreuse portée
par les êtres ayant enduré
l'agonie après la mort...","L'oscura veste degli agenti
degli inferi, che sussurrano
di morte e sofferenza...","Gewand der Unterweltagenten,
die vom endlosen Schmerz des
Jenseits berichten.","Atuendo oscuro llevado por
agentes del inframundo, que
sufren aun tras la muerte.","Темное одеяние, что носят
посланники загробного мира,
твердящие о вечных муках.","Mroczne odzienie wysłanników
zaświatów. Dla tych, którzy
zaznali bólu po śmierci...",,,"Traje negro usado por
agentes do submundo, que
aguentam a dor do pós-morte.","명계의 사자가 입는 검은 옷.
맞선 자만이 알 수 있다.
죽더라도 고통이 계속될 것을.","前往冥界的使者身穿的黑衣。
對峙者將親身體會，世上有種
痛苦是如何拼命也無法逃脫的。","冥界使者穿的黑衣。
对峙之人将知晓，世上存在着
耗尽生命也无法逃离的痛苦。",,,,,,,,"زي ظلامي يرتديه عملاء
العالم السفلي الذين يتحدثون
عن تحمل الألم بعد الموت...",,,,,,,,,,,
88e83e74-c540-4eed-8e01-efdbcde7cafa,1943961169,OtDogArmor_Chest_063_Explain,"南瓜の葉を主材料とし造られた
胴用装備。関節や鞍の部分は
硬い南瓜で補強されている。","It's mostly pumpkin leaves,
but the seat and fastenings
are made of pumpkin PEEL!","À part la selle et la boucle
en écorce, le reste est
en feuilles de citrouille.","È fatto di foglie di zucca,
ma almeno il seggio e
le fibbie sono di buccia!","Hauptsächlich Kürbisblätter,
die mit Kürbisschalen
zusammengehalten werden.","Casi todo hojas de calabaza,
¡salvo las coderas y parte
trasera de piel de calabaza!","В основном — листья тыквы,
но сиденье и застежки —
из тыквенной КОЖУРЫ!","Wykonany z liści dyni,
a siedzenie i mocowania
– z dyniowej skórki!",,,"De folha de abóbora,
mas o assento e cintos
são de casca de abóbora.","호박 잎을 재료로 사용한
몸통 방어구. 관절과 안장은
단단한 호박으로 보강했다.","以南瓜葉為主要材料製成的
身體裝備。關節與鞍的部分
使用了堅硬的南瓜進行加強。","以南瓜叶为主要材料制成的
身体装备。关节与鞍的部分
使用坚硬的南瓜进行了强化。",,,,,,,,"يكون غالبًا عبارة عن أوراق
يقطين لكن المقعدة والأربطة
مصنوعة من قشر اليقطين!",,,,,,,,,,,
6c396707-65e3-469a-bd0a-12a65e5d6b56,3424116765,OtDogArmor_Chest_064_Explain,"風巻が神のおながなり。
東よりうちいでし神風は、
うつし世の終を運びゆく。","Ibushi's tail. Once said
to stir the East winds and
sweep the sun from the sky.","La queue de l'Ibushi. Jadis,
elle soulevait les vents de
l'Est et chassait le soleil.","Coda di Ibushi. Si dice
svegliò i venti dell'Est e
spazzò il sole dal cielo.","Ibushi-Schweif, der wohl den
Ostwind tosen lässt und die
Sonne vom Himmel fegt.","Cola de Ibushi. Se dice que
antaño sacudía los vientos
orientales y movía el sol.","Хвост Ибуси. Говорят, раньше
поднимал восточные ветры и
сметал с неба солнце.","Ogon Ibushiego. Mówią, że
wzniecał wschodnie wiatry i
strącał słońce z firmamentu.",,,"Cauda de Ibushi. Dizem que
guiava os ventos do Leste
e varria o sol dos céus.","돌풍의 신의 꼬리일지니.
동쪽에서 불어온 신의 바람은
현세의 끝으로 인도하노라.","龍捲乃神之長尾。
遙望東方神風起，
拂來今世之終焉。","风卷乃神明之御服。
东方之神风，
变易现世之终焉。",,,,,,,,"ذيل إيبوشي. قيل ذات مرة
إنه يثير رياح الشرق
ويزيل الشمس من السماء.",,,,,,,,,,,
6a47b318-fb8e-43ab-b346-6f0d6d20df42,3290567140,OtDogArmor_Chest_065_Explain,"雷狼竜の威光まばゆい胴用装備。
紫電を纏い猟場を駆ける姿は
まさしく無双。比類なき狩人。","Chest armor exuding the
intimidating, thunderous
strength of Zinogre.","Une armure dont émane la
puissance intimidante et
foudroyante du Zinogre.","Questo pettorale trasuda
la minacciosa e devastante
forza di uno Zinogre.","Brustpanzer mit der sowohl
einschüchternden als auch
tosenden Stärke des Zinogre.","Armadura pectoral con
la fuerza atronadora e
intimidante del Zinogre.","Нагрудник, источающий
грозную, сокрушительную
силу Зиногра.","Napierśnik pulsujący wręcz
przerażającą, wściekłą
mocą Zinogra.",,,"Peitoral exalando a
intimidadora e poderosa
força de Zinogre.","뇌랑룡의 위광으로 빛나는
몸통 방어구. 번개를 두르고
전장을 누비는 무쌍의 사냥꾼.","散發著雷狼龍耀眼威嚴之光的
身體裝備。紫電纏身穿梭獵場的
樣子，簡直是舉世無雙的獵人。","散发雷狼龙威光的身体装备。
身缠紫电驰骋于猎场的姿态，
正可谓天下无双的猎人。",,,,,,,,"درع صدر تنبعث منها
قوة زينغر المخيفة
والمدوية.",,,,,,,,,,,
78537610-4f33-40c7-a0ea-957e7444a45e,1241889204,OtDogArmor_Chest_066_Explain,"神秘的な美しさを放つ、胴用
装備。心奪われた者は、光の
届かぬ深海へと招かれる。","Armor with its own urban
legend: ""Its glitter doth
lure men to watery graves.""","D'après la légende, l'éclat
de cette armure attire ses
victimes dans les abysses.","Dice una leggenda su questa
armatura: ""Il suo scintillio
conduce a sepolcri d'acqua"".","Rüstung mit eigenem urbanen
Mythos: ""Sein Glanz lockt
Männer in wässrige Gräber.""","Según una leyenda, su fulgor
arrastra a los hombres a
tumbas sumergidas.","Броня, достойная собственной
легенды. Ее блеск манит
бедняг в смертельную пучину.","Jak mówi legenda miejska:
„Błysk, który wabi
ludzi do wodnego grobu”.",,,"Armadura com lenda urbana:
""seu brilho atrai os
homens para as profundezas.""","신비한 아름다움을 발하는
몸통 방어구. 마음을 빼앗기면
끝없는 심해로 끌려간다.","散發神秘美感的身體裝備。
為其著迷者，將會被帶往
暗不見底的深海。","拥有神秘美感的身体装备。
受其迷惑之人，将被邀至
阳光无法抵达的深海。",,,,,,,,"درع تتمتع بأسطورتها الحضرية:
""يعمل بريقها على جذب
الرجال إلى القبور المائية"".",,,,,,,,,,,
226f9da6-c927-4c2c-a30e-f46dbec55da0,3227798056,OtDogArmor_Chest_067_Explain,"氷牙竜素材で造った胴用装備。
強靭かつ軽量にして堂々たる
拵えは白騎士の名にふさわしい。","Thin, light, and resembles
a knight—totally unlike
the Barioth it came from.","Mince, légère et à l'allure
chevaleresque. En bref, rien
à voir avec le Barioth.","Sottile, leggera, ricorda un
cavaliere... Ma non tanto
il Barioth da cui proviene.","Dünn, leicht und ritterlich.
Hat mit dem Barioth-Ursprung
kaum noch etwas zu tun.","Delgada, ligera y con forma
de caballero; para nada como
el Barioth del cual procede.","Тонкий, легкий, благородного
вида — не то что Бариот,
из которого сделан.","Cienka, lekka, z rycerskim
sznytem. Kto by pomyślał, że
wykonano ją z Bariotha?",,,"Fina, leve e lembra
um cavaleiro - diferente
do Barioth de onde saiu.","단단한 빙아룡의 소재로 만든
몸통 방어구. 경량화되어
당당한 그 자태는 백기사답다.","以冰牙龍素材製成的身體裝備。
兼具強韌與輕量化的威風外表，
與其白騎士之名十分相襯。","用冰牙龙素材制成的身体装备。
强韧且轻量，威风凛凛的姿态
不负白骑士之名。",,,,,,,,"رفيعة وخفيفة وتشبه
الفارس—وتختلف تمامًا عن
الباريوث الذي جاءت منه.",,,,,,,,,,,
0236b264-16a3-485a-90c1-26c050a9cb1f,1777213766,OtDogArmor_Chest_068_Explain,"飛雷竜の繊細な素材で造られた
胴用装備。風のように軽捷で、
雷のように苛烈な攻めが可能。","The Kadachi material helps
a swift Palamute sprint
and strike like lightning.","La finition en Kadachi aide
le Chumsky à bondir aussi
vite que l'éclair.","Il materiale Kadachi aiuta
il Canyne a scattare e
colpire come una saetta.","Dank des Kadachi-Materials
können flinke Palamutes
blitzschnell zuschlagen.","El material de Kadachi ayuda
al ágil Canyne a correr y
golpear como el rayo.","Части Кадачи помогают
Паламуту быстро бежать
и разить, как молния.","W tej zbroi z Kadachi chyży
kumpies spadnie na wroga
jak piorun z przestworzy.",,,"O material de Kadachi ajuda
um ágil Amicão a correr
e atacar como um trovão.","비뢰룡의 섬세한 소재로 만든
몸통 방어구. 바람처럼 빠르고
번개처럼 격렬하게 공격한다.","以飛雷龍的纖細素材製成的
身體裝備。攻擊的時候能夠
如風一般輕快，如雷一樣猛烈。","使用飞雷龙的纤细素材制成的
身体装备。如风般迅捷，
能够发动雷电般的猛烈攻击。",,,,,,,,"تساعد مواد كاداتشي
في ركض بالاموت بسرعة
والضرب مثل البرق.",,,,,,,,,,,
c61b53f4-268f-4494-8d5b-b35dc05f08b8,2508064873,OtDogArmor_Chest_069_Explain,"獰猛なる蛮顎竜の胴用装備。
血を浴びるほどに熱を帯び、
駆けた軌跡は陽炎となる。","This torso piece heats up
when splattered in blood,
trailing red steam about it.","Quand elle est souillée de
sang, cette armure chauffe,
libérant une vapeur rouge.","Un pettorale che si riscalda
quando schizzato di sangue,
fino a emanare vapori rossi.","Im blutbespritzten Zustand
erwärmt sich der Panzer und
verströmt roten Dampf.","Esta pieza se calienta al
contacto con la sangre y
emana un vapor carmesí.","Этот доспех нагревается
от брызг крови и испускает
красный пар.","Ten napierśnik rozgrzewa się
zbryzgany krwią, parując
wokół czerwonymi smugami.",,,"Esta peça aquece quando
respingada de sangue,
exalando vapor vermelho.","사나운 만악룡의 몸통 방어구.
피가 묻을수록 열이 나며
달린 흔적은 아지랑이가 된다.","獰猛蠻顎龍的身體裝備。
身上沾染的血越多，體溫越高。
奔馳的軌跡將化為蒸騰熱氣。","蛮颚龙狞猛的身体装备。
带有浴血般的热量，
奔跑时轨迹会化为热浪。",,,,,,,,"ترتفع درجة حرارة قطعة الجذع
هذه عند تناثر الدم عليها،
مخلّفة بخارًا أحمر حولها.",,,,,,,,,,,
f1d2a663-0f94-4810-868b-ab2a188a86b0,3132936235,OtDogArmor_Chest_070_Explain,"迅竜の素材で造った胴用装備。
光より鋭く闇を切り裂き、
闇へと堕とす刺客となれ。","Nargacuga chest armor. May
you cleave your foes swifter
than light, into the dark.","Une cotte en Nargacuga. Dans
l'ombre, tranchez vos proies
plus vite que la lumière.","Pettorale Nargacuga.
Possa tu colpire più veloce
di un fulmine nel buio.","Nargacuga-Brustpanzer.
Mögest du Feinde schneller
als das Licht ausschalten.","Armadura pectoral de
Nargacuga. Sé fugaz como
la luz. Trae la oscuridad.","Нагрудник из Наргакуги. Да
будете вы рассекать врагов
быстрее, чем свет тьму.","Napierśnik z Nargacuga. Ślij
wrogów w odmęty mroku
z szybkością błyskawicy.",,,"Peitoral de Nargacuga. Mande
inimigos para a escuridão
mais rápido que a luz.","신룡의 소재로 만든
몸통 방어구. 빛보다 날카롭게
어둠을 베는 자객이 되리라.","以迅龍素材製成的身體裝備。
化身為墮入黑暗的刺客，
比光線更銳利地劈開黑暗吧。","迅龙素材制成的身体装备。
比光更为锋利，斩断黑暗，
化为堕入黑暗的刺客。",,,,,,,,"درع الصدر الخاصة بنارجاكوجا.
قد تشق خصومك أسرع
من مرور الضوء في الظلام.",,,,,,,,,,,
4f168098-97d1-44fd-a53a-e1e819c3cefd,2596182317,OtDogArmor_Chest_071_Explain,"空の王者の誇りが宿った、
深紅の胴用装備。爆炎をも
退ける、高い性能を誇る。","Imbued with the pride of the
ruler of the skies, capable
of parrying even explosions.","Bénie par le seigneur des
cieux, cette armure protège
même des explosions.","Intrisa dell'orgoglio del
sovrano dei cieli, può
parare anche un'esplosione.","Erfüllt mit dem Stolz des
Himmelsherrschers, wehrt
er selbst Explosionen ab.","Imbuida del orgullo del
señor de los cielos y capaz
de bloquear explosiones.","Наполнен гордостью
властелина небес, способен
отражать даже взрывы.","Przesycona dumą władcy
przestworzy. Może wytrzymać
nawet siłę eksplozji.",,,"Imbuída com o orgulho do
senhor dos céus, capaz
até de refletir explosões.","하늘의 왕자의 긍지가 깃든
몸통 방어구. 폭염도 물리치는
높은 성능을 자랑한다.","寄宿著天空王者的驕傲，
深紅色的身體裝備。擁有傲人的
高性能，連爆炎都能消除。","寄宿着天空王者荣耀的
深红色身体装备。
拥有能击退爆炎的高性能。",,,,,,,,"مشبعة بكبرياء حاكم السماوات،
وقادرة على تفادي
حتى المتفجرات.",,,,,,,,,,,
d00265df-0233-4a5b-8dad-e8533162f6da,720987406,OtDogArmor_Chest_072_Explain,"高潔な佇まいの胴用装備。
非常に難解な装備手順で、
着る側も着せる側も大変。","A dignified chest piece
extremely tricky to put on
for both wearer and armorer.","Une armure raffinée, mais un
calvaire à enfiler pour le
porteur et l'armurier.","Un solenne pettorale, ostico
da indossare anche con
l'ausilio di uno scudiero.","Ein würdevolles Stück, das
Träger und Ausrüster beim
Anlegen vor Probleme stellt.","Soberbia armadura pectoral,
difícil de poner incluso
con ayuda.","Прославленный доспех.
Непрост в изготовлении
и в надевании.","Dostojny napierśnik. Bardzo
trudny w obsłudze i dla
wojownika, i dla płatnerza.",,,"Peitoral digno, extremamente
complicado de vestir pro
usuário e pra quem o veste.","고결함이 느껴지는
몸통 방어구. 입기 어려운
구조라서 입히는 쪽도 힘들다.","擁有高潔氛圍的身體裝備。
裝備時的步驟非常難以理解，
無論自己穿或幫忙穿都很費時。","看起来很高贵的身体装备。
穿着顺序非常复杂，
穿的人和帮忙的人都会很辛苦。",,,,,,,,"قطعة صدر مفخمة يكون
ارتداؤها أمرًا معقدًا للغاية
لمرتديها ولصانع الدروع.",,,,,,,,,,,
4fe74210-a139-4877-8e40-ae4e2998ea95,1702300095,OtDogArmor_Chest_073_Explain,"底知れぬ妖しさ漂う胴用装備。
心に潜む静かな闇の危うさと
儚さ、気高さを感じる逸品。","THE Palamute torso armor to
display how in touch you are
with your inner darkness.","L'armure parfaite pour que
le Chumsky puisse exprimer
son côté ténébreux.","La corazza giusta per
un Canyne in sintonia
con il proprio lato oscuro.","Palamute-Oberkörperpanzer,
der deine Verbindung zur
inneren Finsternis anzeigt.","Armadura pectoral para
Canyne que muestra tu
lado oscuro.","Нагрудник Паламута. Идеален,
чтобы показать, как близки
вы с тьмой, что внутри.","Napierśnik kumpsa dla tych,
którzy nie boją się ciemnych
zakamarków własnej duszy.",,,"Armadura de torso de Amicão
que exibe toda sua escuridão
interior.","끝없는 요기가 감도는
몸통 방어구. 어둠의 위험,
허무, 기품이 느껴지는 명품.","散發出深不見底妖異氣息的
身體裝備。能感受到潛藏在內心
靜謐黑暗的危險、虛幻與高尚。","身体装备，散发着深不可测的
妖艳感。潜藏于心的寂静之暗，
危险且虚幻，高贵的逸品。",,,,,,,,"درع جذع بالاموت،
وتُظهر ملامستك لها
مدى ظلامك الداخلي.",,,,,,,,,,,
142adef9-19e5-4653-bc02-ca46077da417,3124228761,OtDogArmor_Chest_074_Explain,,,,,,,,,,,,,,,,,,,,,,,,,,,,,,,,,
