guid,crc?,entry name,Japanese,English,French,Italian,German,Spanish,Russian,Polish,Dutch,Portuguese,PortugueseBr,Korean,TraditionalChinese,SimplifiedChinese,Finnish,Swedish,Danish,Norwegian,Czech,Hungarian,Slovak,Arabic,Turkish,Bulgarian,Greek,Romanian,Thai,Ukrainian,Vietnamese,Indonesian,Fiction,Hindi,LatinAmericanSpanish
e83bb8dd-5c6f-4f1e-b0fa-332c67767d98,1640744630,OtDogArmor_Chest_037_Explain,"泥翁竜素材で造った胴用装備。
特殊駆動を持つ漆黒の装甲は
滑らかに加速し狩場を駆ける。","Jet black Almudron armor,
specially crafted to allow
for uninhibited movement.","Armure noire en Almudron,
conçue pour permettre une
grande liberté de mouvement.","Armatura Almudron nera
creata per consentire
totale libertà di movimento.","Schwarzer Almudron-Panzer,
der speziell für Bewegungs-
freiheit entwickelt wurde.","Armadura de Almudron negra
cual azabache. Permite
moverse de forma fluida.","Черная броня из Алмудрона,
созданная так, чтобы не
стеснять движений.","Czarny jak noc pancerz
z Almudrona. Skrojony tak,
by nie krępował ruchów.",,,"Armadura de Almudron preta,
feita especialmente para
não atrapalhar o movimento.","이옹룡의 소재로 만든
몸통 방어구. 칠흑의 장갑으로
미끌어지듯 사냥터를 누빈다.","以泥翁龍素材製成的身體裝備。
漆黑的盔甲具備特殊驅動裝置，
能夠順暢地加速前往獵場。","用泥翁龙素材制成的身体装备。
具备特殊驱动的漆黑装甲
能够平滑加速，驰骋猎场。",,,,,,,,"درع ألمودرون شديدة السواد،
مصنوعة خصوصًا للسماح
بالحركة دون قيود.",,,,,,,,,,,
cf5cd37b-c875-404d-b3d6-3bf2e0c2fc77,2969657064,OtDogArmor_Chest_038_Explain,"各地を渡り歩く、謎に満ちた
行商人の衣。鞍の模様は、
行商人の家紋になっている。","Garb of a mysterious trader
who travels the world. Its
saddle bears his clan crest.","La tenue d'un mystérieux
marchand itinérant. Sa selle
porte le blason de son clan.","La veste di un misterioso
mercante girovago. Reca
lo stemma del suo clan.","Gewand eines durch die Welt
reisenden Händlers. Auf dem
Sattel ist sein Klanwappen.","Atavíos de un misterioso
mercader ambulante. La silla
tiene el emblema de su clan.","Одеяние таинственного
торговца, что странствует
по миру. С гербом его клана.","Szata tajemniczego kupca,
który podróżuje po świecie.
Z herbem klanu na siodle.",,,"Traje de misterioso mercador
que viaja pelo mundo. A sela
tem o brasão de seu clã.","각지를 돌아다니는 정체불명의
행상인 옷. 안장의 문양은
행상인의 집안 문양이다.","走遍世界各地，全身充滿謎團的
旅行商人之衣。鞍上面的圖案
是旅行商人的家徽。","奔走各地的神秘游商穿的衣服。
鞍上的图案，
是游商的家纹。",,,,,,,,"زي تاجر غامض
يرتحل حول العالم. يحمل
سرجه شعار عشيرته.",,,,,,,,,,,
f88cda3e-fc19-406c-8644-17c32b5e186b,3538193881,OtDogArmor_Chest_039_Explain,,,,,,,,,,,,,,,,,,,,,,,,,,,,,,,,,
a91e2feb-90d4-4e12-b511-5d436c953e7e,2056729131,OtDogArmor_Chest_040_Explain,"里で長年使われるガルクの鞍。
簡素ながら、ガルクにも乗り手
にも優しい造りになっている。","A common Kamura saddle.
Simple and accommodating
for both rider and Canyne.","Une selle de Kamura basique.
Simple et pratique pour
le Canyne et son cavalier.","Comune sella di Kamura.
Semplice e comoda
per cavaliere e Canyne.","Gewöhnlicher Kamura-Sattel.
Schlicht und bequem sowohl
für Reiter als auch Canynen.","Silla común de Kamura.
Sencilla y confortable para
el jinete y el Canyne.","Обычное седло Камуры.
Простое и удобное как для
ездока, так и для Cобакка.","Zwykłe siodło z Kamury.
Prosty fason i wygoda
dla jeźdźca i dla kynosa.",,,"Sela de Kamura comum.
Simples e confortável pro
usuário e pro Canyno.","마을에서 오랫동안 사용한
가루크 안장. 간소하면서도
타는 사람이 편하게 만들었다.","村莊內長年使用的加爾克鞍。
外觀雖然樸素，但在使用上
對加爾克和騎乘者都很舒適。","炎火村长年使用的鞍。
构造朴素，但对牙猎犬
和骑乘者来说都非常舒适。",,,,,,,,"سرج كامورا المشهور.
بسيط وملائم لكل
من الفارس والكناين.",,,,,,,,,,,
ee69fac3-1641-40ee-b0c1-745efda92d86,2568994031,OtDogArmor_Chest_041_Explain,"モンスターの骨を基に造られた
胴用装備。随所に飾られた
無数の骨は勇猛なる戦士の証。","Tough-looking torso armor.
The adorning bones are the
mark of a fearless warrior.","Une armure robuste.
Les os décoratifs reflètent
la férocité de son porteur.","Corazza da veri duri.
Le ossa che la decorano
danno un'aria impavida.","Robuster Oberkörperpanzer.
Die Knochen sind das Zeichen
eines furchtlosen Kriegers.","Recia armadura pectoral. El
ornamento de huesos señala
a un guerrero sin miedo.","Прочный с виду доспех.
Украшения из костей —
знак храброго воина.","Solidny napierśnik.
Ozdoby z kości są oznaką
nieustraszonego wojownika.",,,"Armadura de torço forte.
Os ossos decorativos denotam
um guerreiro destemido.","몬스터의 뼈로 만들어진
몸통 방어구. 여기저기 장식한
무수한 뼈는 전사의 증거.","以魔物骨頭為基底製成的
身體裝備。上頭布滿了無數的
骨頭裝飾，為勇猛戰士的證明。","以怪物骨头为基础制成的
身体装备。铠甲上装饰着的
无数骨头是勇猛战士的证明。",,,,,,,,"درع جذع قوية المظهر.
وتُعد عظام التزيين
علامة للمحارب المقدام.",,,,,,,,,,,
1dea2278-76a8-4eb4-adf7-bd7096d9f2f4,2151149103,OtDogArmor_Chest_042_Explain,"良質な鉱石を用いて造られた
胴用装備。実用性を重視する
ため、一切の無駄を省いた設計。","Chest armor made of quality
ore, with an emphasis
on practicality above all.","Une cotte faite de minerai
de qualité, conçue pour être
pratique avant tout.","Creata da un minerale
di qualità, apprezzabile
per la sua praticità.","Brustpanzer aus hochwertigem
Erz, der in erster Linie
praktisch ist.","Armadura pectoral de mineral
de calidad, práctica por
encima de todo.","Доспех из хорошей руды,
сделан с упором на
практичность.","Napierśnik z wysokiej
jakości rudy. Praktyczność
przede wszystkim.",,,"Peitoral feito com minério
bom, com ênfase na
praticidade acima de tudo.","양질의 광석으로 만들어진
몸통 방어구. 실용성을 중시해
군더더기 없는 설계가 특징.","使用品質優良的礦石製成的
身體裝備。由於著重實用性，
因此省去了一切多餘的設計。","使用上好矿石制成的身体装备。
设计上重视实用性，
舍弃了一切不必要的部分。",,,,,,,,"درع صدر مصنوعة من معدن خام
عالي الجودة، مع التركيز على
ميزته العملية فوق كل شيء.",,,,,,,,,,,
67ab4422-f3aa-42e2-8897-18ac99512454,1268807449,OtDogArmor_Chest_043_Explain,"鎌鼬竜の素材で造られた胴用
装備。狩場を軽やかに駆ける
姿はさながら一陣の風の如く。","Izuchi torso armor. Carries
the wearer through fields
like a gust of wind.","Une armure Izuchi.
Le top du top pour
passer en coup de vent.","Corazza Izuchi che
accompagna in battaglia
come un soffio di vento.","Izuchi-Oberkörperpanzer.
Trägt den Träger schnell wie
der Wind durch das Gelände.","Armadura pectoral de Izuchi.
Hace volar al portador por
el campo de batalla.","Доспех из Идзути.
Несёт владельца, словно
порыв ветра.","Napierśnik z Izuchiego.
Można w nim mknąć jak
na skrzydłach wiatru.",,,"Armadura de torso de Izuchi.
Veste o usuário como
um sopro de vento.","겸유룡의 소재로 만들어진
몸통 방어구. 사냥터를 누비는
그 모습은 바람과도 같다.","以鐮鼬龍王素材打造的
身體裝備。能夠宛如風一般
輕快地穿梭於獵場之中。","镰鼬龙素材制成的身体装备。
在猎场中轻盈奔跑的模样，
宛如一阵风。",,,,,,,,"درع الجذع لإيزوتشي. تحمل
مرتديها عبر الميادين
مثل هبة رياح.",,,,,,,,,,,
70c6c160-614c-46c7-9e69-af0b1b7705d4,4051077278,OtDogArmor_Chest_044_Explain,"青熊の素材で作った胴用装備。
様々な地形での狩りを想定し、
動きやすさを重視した設計。","Arzuros-derived chest armor
with good range of motion
and fit for all terrains.","Une cotte à base d'Arzuros,
offrant une grande liberté
de mouvement et polyvalente.","Questo pettorale Arzuros
garantisce libertà di
movimento su ogni terreno.","Dieser Arzuros-Panzer bietet
viel Bewegungsfreiheit und
hält jedem Gelände stand.","Armadura pectoral de Arzuros
con gran movilidad y apta
para cualquier terreno.","Доспех из Арзуроса,
не стесняющий движений.
Достаточно универсален.","Napierśnik z Arzurosa
dający dużą swobodę ruchów.
Dobry na każdy teren.",,,"Peitoral derivado de Arzuros
com boa mobilidade
e para todos os terrenos.","청웅 소재를 쓴 몸통 방어구.
온갖 지형에서 사냥할 수 있게
활동성을 중시한 설계가 특징.","以青熊素材製成的身體裝備。
事先設想於各種地形上的狩獵，
為著重活動方便性的設計。","用青熊兽素材制成的身体装备。
设想到在各种地形中的狩猎，
拥有重视活动便利性的设计。",,,,,,,,"درع صدر مشتقة من أرزوروس
ومزودة بنطاق مناسب للحركة
وملائمة لجميع التضاريس.",,,,,,,,,,,
e84902f1-2442-4235-8047-ffacaddc4857,2767136677,OtDogArmor_Chest_045_Explain,"廉潔の精神を宿した胴用装備。
非行を嗅ぎ取る嗅覚は、
秩序を乱す者を逃さない。","Armor made for the noble
Canyne that'll sniff out
injustice and bite it away.","Une armure pour les Canynes
raffinés pour détecter et
déchiqueter les injustices.","Armatura per Canyne che
fiutano l'ingiustizia
e la estirpano a morsi.","Rüstung für edle Canynen,
die Ungerechtigkeit wittern
und wegbeißen werden.","Armadura para nobles Canyne
que rastrean y combaten toda
injusticia.","Доспех для благородных
Собакков, не терпящих
несправедливости.","Pancerz dla szlachetnego
kynosa, który wywęszy
każdą niesprawiedliwość.",,,"Armadura feita para nobres
Canynos que farejam
injustiça e a mordem.","청렴한 정신이 깃든
몸통 방어구. 악행을 감지하는
후각으로 질서를 지킨다.","蘊藏著廉潔精神的身體裝備。
其嗅覺能夠發現不法行為，
絕不放過擾亂秩序的人。","寄宿着廉洁精神的身体装备。
能闻出恶行的嗅觉，
不会放过扰乱秩序之人。",,,,,,,,"درع مصنوعة للكناين النبيل
الذي يكشف الظلم
ويقضي عليه.",,,,,,,,,,,
8736a7ec-0a8f-4963-9636-99b24af6397e,2493789994,OtDogArmor_Chest_046_Explain,"オシャレな模様が施された、
胴用装備。全身を覆う毛皮は、
寒冷地での活動に向いている。","Looks cool, feels warm. Its
layered fur makes it suited
to cold climate activities.","Cette fourrure est parfaite
pour tenir chaud, mais elle
fait froid dans le dos.","Bello e caldo, con i suoi
strati di pelliccia è ideale
per i climi più freddi.","Sieht cool aus, hält warm.
Dank der Fellschichten gut
für kaltes Klima geeignet.","Muy calentita. Sus capas
de piel son idóneas para
actividades en climas fríos.","Эффектно выглядит, хорошо
согревает. Удобна в
холодном климате.","Wygląda równie dobrze, jak
grzeje. Warstwowe futro
chroni w mroźnych warunkach.",,,"Parece legal, é quentinha.
Suas camadas de pele
são ideias para o frio.","화려한 무늬의 몸통 방어구.
온몸을 감싸는 모피 덕분에
추운 곳에서 활동하기 좋다.","帶有時髦圖案的身體裝備。
覆蓋在全身上下的毛皮，
適合於寒冷地區活動時使用。","拥有时髦花纹的身体装备。
全身覆盖有毛皮，
适合在寒冷地区活动。",,,,,,,,"تبدو رائعة، ومُدفئة. يجعلها
فروها متعدد الطبقات مناسبة
لأنشطة المناخ البارد.",,,,,,,,,,,
c1d4a15f-351a-41d9-9d71-02323853a8ac,1210868938,OtDogArmor_Chest_047_Explain,"傘鳥の素材を使った、頑丈かつ
美しい胴用装備。勲功を立てた
オトモのみ、作成を許される。","Tough as it is ornate, this
Aknosom mail is only for
Palamutes that've earned it.","Aussi robuste qu'élégante,
cette cotte en Aknosom est
pour les meilleurs Chumskys.","Bella e resistente, questa
cotta Aknosom è per il
Canyne che sa guadagnarsela.","Genauso hart wie kunstvoll,
ist dieser Aknosom-Panzer
nur für würdige Palamutes.","Tan dura como ornamentada,
esta cota de Aknosom es solo
para buenos chicos.","Прочная и красивая кольчуга
из Акносома. Только для тех
Паламутов, кто ее заслужил.","Równie wytrzymała, co
ozdobna zbroja z Aknosoma.
Dla zasłużonego kumpsa.",,,"Dura e decorada, esta
armadura de Aknosom é só
pra Amicães que a merecem.","산조의 소재로 된 튼튼하고
아름다운 몸통 방어구. 공적을
쌓은 동반자만 만들 수 있다.","使用傘鳥素材，既堅固又美觀的
身體裝備。只有立下功勞的
隨從才有資格製作這項裝備。","使用伞鸟素材制成的
结实美丽的身体装备。
仅允许立下功勋的随从制作。",,,,,,,,"تخصص زرد أكنوسوم هذه،
المميزة بصلابتها كزخرفتها،
لكلاب البالاموت التي ربحتها.",,,,,,,,,,,
6fc17c02-39ac-4f55-beeb-920a487338b1,2131684398,OtDogArmor_Chest_048_Explain,"掻鳥の素材で造った胴用装備。
素材特有のしなやかさが、
ガルクの俊敏な動きを助ける。","Kulu chest armor known for
its pliability and support
of your Palamute's agility.","Une protection en Kulu dont
la souplesse va de pair avec
l'agilité d'un Chumsky.","Pettorale Kulu. La sua
rinomata flessibilità esalta
l'agilità di ogni Canyne.","Kulu-Brustpanzer mit enormer
Biegsamkeit. Fördert die
Beweglichkeit des Palamutes.","Armadura pectoral de Kulu
cuya flexibilidad apoyará la
agilidad de tu Canyne.","Нагрудная броня из Кулу.
Очень гибкая, не мешает
ловкости вашего Паламута.","Napierśnik z Kulu słynący z
elastyczności. Doskonały dla
gibkiego i zwinnego kumpsa.",,,"Peitoral de Kulu conhecido
por ser flexível e apoiar a
agilidade de seu Amicão.","소조의 소재로 만든
몸통 방어구. 부드러운 소재가
민첩한 움직임을 돕는다.","以搔鳥素材製成的身體裝備。
素材本身特有的柔軟度，
能使加爾克動作更加靈活。","搔鸟素材制成的身体装备。
素材特有的柔韧性使得
牙猎犬的动作更为敏捷。",,,,,,,,"درع صدر كولو معروفة
بمرونتها وزيادتها لخفة حركة
بالاموت لديك.",,,,,,,,,,,
75a83631-c6e2-4481-a2c0-ae732f0c9480,134882476,OtDogArmor_Chest_049_Explain,"河童蛙の素材で作った胴用装備。
全身が装甲に覆われてはいるが、
ぬめりがあるので動きやすい。","Protects the wearer with
undeniably slimy but tough
non-restrictive platings.","Protège le porteur grâce à
des plaques gluantes mais
offrant une bonne mobilité.","Protegge chi la indossa con
robuste placche, tanto
melmose quanto comode.","Schützt den Träger mit zwar
schleimigen, aber robusten
nicht-restriktiven Platten.","Protege al portador con
placas flexibles, viscosas
pero duras.","Защищает носителя склизкими,
но крепкими пластинами.","Wykonana z oślizgłych, ale
wytrzymałych płytek.
Zostawia swobodę ruchów.",,,"Protege o usuário com
placas pegajosas, porém
nada restritivas.","하동와의 소재로 만든
몸통 방어구. 중장갑이지만
점액이 있어 움직이기 편하다.","以河童蛙素材製成的身體裝備。
雖然全身都被裝甲包覆，
但其實相當滑溜，易於活動。","河童蛙素材制成的身体装备。
虽然全身都覆盖着装甲，
但很滑润，便于行动。",,,,,,,,"تحمي مرتديها بطلاء
رقيق مميز إلا إنه قوي وغير
مقيد.",,,,,,,,,,,
1bd9c0fe-ced5-487a-b042-096ff668cb49,2056767618,OtDogArmor_Chest_050_Explain,"勇敢な荒野の守護者に似合う
胴用装備。強者にも奮然として
立ち向かう意志を秘めている。","Chest armor of the brave
guardians of the badlands;
almost as cool as they are.","L'armure des valeureux
gardiens des terres arides,
presque aussi cool qu'eux.","Pettorale dei coraggiosi
guardiani del deserto,
mitico quasi quanto loro.","Brustpanzer der tapferen
Ödland-Wächter und fast
genauso cool wie sie.","Armadura pectoral de los
bravos guardianes de los
yermos, tan guay como ellos.","Нагрудная броня храбрых
стражей пустошей. Почти
такая же крутая, как и они.","Napierśnik dla dzielnych
strażników pustkowi.
Pełen fasonu jak oni sami.",,,"Peitoral dos corajosos
guardiões das terras más;
quase tão legal quanto eles.","용감한 황야의 수호자에게
어울리는 몸통 방어구. 강적과
맞설 수 있는 의지가 담겼다.","適合勇敢的荒野守護者穿戴的
身體裝備。蘊藏著縱使面對強者
也將奮然挺身對抗的意志。","适合勇敢的荒野守护者的
身体装备。隐藏着
勇敢直面强者的意志。",,,,,,,,"درع صدر حراس الأراضي الوعرة
الشجعان؛ وهي رائعة
بقدر روعتهم.",,,,,,,,,,,
15f890df-3820-46bb-b9b0-111121394c31,3093122352,OtDogArmor_Chest_051_Explain,"ブヨブヨした質感の、不気味な
胴用装備。全身を覆うその姿は、
まさに獲物を探す白い影…。","Soft and floppy white armor
with a weird texture. Its
wearer looks like a ghost.","Une armure blanche souple et
douce à la texture bizarre
et au look fantomatique.","Flessibile armatura bianca
dalla strana consistenza.
Dà l'aspetto di un fantasma.","Weicher, weißer Panzer mit
merkwürdiger Textur. Träger
sehen aus wie Geister.","Armadura blanca, suave y
flexible, de extraña textura
y aspecto fantasmal.","Мягкая и гибкая белая броня
со странной текстурой.
Носитель похож на призрака.","Biała, opadająca zbroja
o przedziwnej fakturze.
Nadaje wygląd zjawy.",,,"Armadura suave e mole
com uma textura estranha.
Usuário parece um fantasma.","물컹물컹한 질감이 기묘한
몸통 방어구. 착용한 모습은
사냥감을 찾는 하얀 그림자…","質感富有彈性且令人害怕的
身體裝備。包覆全身的樣子，
像是在尋找獵物的白色影子……","有着充满弹性的质感，诡异的
身体装备。覆盖全身的模样，
正可谓搜寻猎物的白影……",,,,,,,,"درع بيضاء لينة ومرنة
بنسيج سحري. يبدو
مرتديها وكأنه شبح.",,,,,,,,,,,
3fe7e5e7-2c62-4b40-a536-fc479c0d6b2d,2015185522,OtDogArmor_Chest_052_Explain,"身の丈ほどの巨大なキノコで
作った胴用装備。相手が胞子を
吸い込むと、幻覚に襲われる。","Magnificent mushroom mail.
May cause hallucinations
due to its abundant spores.","Une cotte en champignons.
Attention à ses spores qui
causent des hallucinations.","Splendida cotta di funghi.
Le abbondanti spore
provocano allucinazioni.","Prachtvolle Pilzpanzerung.
Kann aufgrund der Sporen
Halluzinationen hervorrufen.","Espléndida cota de setas.
Sus esporas pueden causar
alucinaciones.","Чудесная грибная кольчуга.
Множественные споры
могут вызывать галлюцинации.","Wspaniała zbroja z grzybów.
Liczne zarodniki
mogą powodować halucynacje.",,,"Arm. de Cogumelos magnífica.
Pode causar alucinações
devido aos esporos.","거대한 버섯으로 만든
몸통 방어구. 상대가 포자를
들이마시면 환각에 빠진다.","以與人一樣高的巨大香菇
製成的身體裝備。對手一旦
吸入孢子，便會產生幻覺。","使用和人一样高的巨大蘑菇
制成的身体装备。
对手吸入孢子后，会产生幻觉。",,,,,,,,"زرد الفِطر الرائعة.
قد تسبب الهلوسة
بسبب كثرة جراثيمها.",,,,,,,,,,,
639acccb-d405-47f5-949e-e6737dbd8a2c,2846359667,OtDogArmor_Chest_053_Explain,"白き翼を持つ神秘の胴用装備。
清らかで穢れのないその姿は
あたかも天よりの使者の如く。","Ethereal torso armor adorned
with white wings for a
particularly heavenly look.","Une armure éthérée
aux ailes blanches lui
donnant un aspect angélique.","Corazza eterea decorata con
ali bianche che donano
un aspetto celestiale.","Ätherischer Panzer, verziert
mit weißen Flügeln für eine
besonders himmlische Optik.","Armadura pectoral etérea,
adornada con alas blancas
de aspecto celestial.","Воздушный доспех, украшенный
белыми крыльями, что
придают ангельский вид.","Zwiewny napierśnik z białymi
skrzydłami. Sprawia
niebiańskie wrażenie.",,,"Armadura de torso etérea
decorada com asas brancas
para um visual angelical.","하얀 날개를 가진 신비한
몸통 방어구. 티끌 하나 없는
자태는 하늘의 사자와도 같다.","擁有白色翅膀的神秘身體裝備。
其純潔無穢的外觀，
宛如來自天界的使者。","拥有洁白双翼的神秘身体装备。
那纯洁无暇的姿态，
宛如天上来的使者。",,,,,,,,"درع جذع أثيرية مزينة
بأجنحة بيضاء لتبدو
بمظهر سماوي خاص.",,,,,,,,,,,
dd54353e-b951-43ff-9b34-e5afd81c2695,1974223131,OtDogArmor_Chest_054_Explain,"軽い着心地の胴用装備。水獣の
素材に特別な加工を施すことに
より、高い耐水性を得た。","A light Ludroth torso guard
specially treated to be
supremely water resistant.","Une armure légère à base
de Ludroth conçue pour
résister totalement à l'eau.","Leggera corazza Ludroth
trattata per la massima
resistenza all'acqua.","Ludroth-Oberkörperschutz,
der leicht ist und optimalen
Schutz vor Wasser bietet.","Ligera armadura pectoral
de Ludroth tratada para
que resista el agua.","Легкий нагрудник из Лудрота,
обработанный так, чтобы
быть устойчивым к воде.","Lekki napierśnik z Ludrotha
o doskonałych parametrach
wodoodporności.",,,"Proteção de torso leve de
Ludroth tratada para ser
muito resistente a água.","착용감이 좋은 몸통 방어구.
수괴수의 소재를 특수 가공해
높은 내수성을 얻었다.","穿著起來相當輕盈的身體裝備。
使用了經特殊加工的水獸素材，
因此具有非常高的耐水性。","穿起来很轻的身体装备。
通过对水兽素材进行特殊加工，
获得了很高的耐水性。",,,,,,,,"واقي جذع لودروث خفيف
تمت معالجته بصورة خاصة
ليكون مقاومًا للماء تمامًا.",,,,,,,,,,,
83e62c84-fd49-443a-ba05-5b0ad42627df,1912065923,OtDogArmor_Chest_055_Explain,"究極の硬度を目指して作られた
胴用装備。長年愛用しても、
キズひとつつかない代物。","These things are so hard,
they can stay scratch-free
even after years of use.","Armure si résistante
qu'elle peut rester des
années sans égratignure.","Questi affari sono così duri
che non avranno un solo
graffio anche dopo anni.","Ist dank seiner Härte selbst
nach jahrelangem Einsatz
noch ohne Kratzer.","Tan duras que aguantan sin
un rasguño tras años de uso.","Эти доспехи так тверды, что
на них не остается царапин
даже спустя годы ношения.","Tak twarda, że
wytrzymuje lata użytkowania
bez jednej rysy.",,,"Estas coisas são tão duras
que ficam sem arranhões
mesmo com anos de uso.","궁극의 경도를 목표로 만든
몸통 방어구. 오래 사용해도
흠집 하나 남지 않는다.","追求終極硬度製成的身體裝備。
即使經過長年的使用，
也見不到任何的裂痕。","以究极硬度为目标制成的
身体装备。即便常年使用，
也依然毫发无损。",,,,,,,,"تُعد هذه الأشياء صلبة جدًا،
ويمكن أن تظل بلا خدوش حتى
بعد سنوات من الاستخدام.",,,,,,,,,,,
