guid,crc?,entry name,Japanese,English,French,Italian,German,Spanish,Russian,Polish,Dutch,Portuguese,PortugueseBr,Korean,TraditionalChinese,SimplifiedChinese,Finnish,Swedish,Danish,Norwegian,Czech,Hungarian,Slovak,Arabic,Turkish,Bulgarian,Greek,Romanian,Thai,Ukrainian,Vietnamese,Indonesian,Fiction,Hindi,LatinAmericanSpanish
4f56567e-8b88-4f93-a152-71b2e8fe5a01,2141316009,StartMenu_System_001_01_Inv_MR,"アイテムスライダーでの常備品の表示/非表示を
切り替えます。",Toggle display for the fixed items on the Item Bar.,"Permet d'afficher/masquer les éléments
fixes de la Barre d'objets.","Cambia la visualizzazione degli strumenti base
sulla barra oggetti.",Anzeige für feste Objekte in Objektleiste ändern.,"Cambia la visualización de los elementos fijos de la
barra de objetos.","Включить/выключить отображение закрепленных
предметов на панели предметов.",Przełącz wyświetlanie stał. przedm. na pasku przedm.,,,Alterna exibição dos itens fixos na Barra de Itens.,"아이템 슬라이더의 상비품 표시/비표시를 
변경합니다.",設定是否顯示道具快捷鍵的常備品。,切换显示/不显示道具快捷栏中的常备品。,,,,,,,,تبديل عرض العناصر الثابتة على شريط العناصر.,,,,,,,,,,,
