guid,crc?,entry name,Japanese,English,French,Italian,German,Spanish,Russian,Polish,Dutch,Portuguese,PortugueseBr,Korean,TraditionalChinese,SimplifiedChinese,Finnish,Swedish,Danish,Norwegian,Czech,Hungarian,Slovak,Arabic,Turkish,Bulgarian,Greek,Romanian,Thai,Ukrainian,Vietnamese,Indonesian,Fiction,Hindi,LatinAmericanSpanish
2feb1004-4b1a-4bec-9581-21a0cbecd86c,1104202530,Trial_LobbyMenuMsg_Back,戻る,Back,Retour,Indietro,Zurück,Atrás,Назад,Wstecz,,,Voltar,돌아가기,返回,返回,,,,,,,,عودة,,,,,,,,,,,
2f4ff9bb-0d8f-45f4-afd9-e792458a5c26,4184098870,Trial_LobbyMenuMsg_Titleboard,ネットワークプレイ,Online Play,Jeu en ligne,Gioco online,Online-Spiel,Modo online,Сетевая игра,Gra online,,,Partida On-line,네트워크 플레이,線上遊玩,线上游戏,,,,,,,,اللعب عبر الإنترنت,,,,,,,,,,,
1b9dea9b-c479-40ef-9d00-7893a8d02855,2978405158,Trial_LobbyMenuMsg_Sessionboard_Fourths,/4,/4,/4,/4,/4,/4,/4,/4,,,/4,/4,/4,/4,,,,,,,,/4,,,,,,,,,,,
ea7a2488-3e7d-40a3-85ef-8ad749987252,370592404,Trial_LobbyMenuMsg_Back_SysMSG,前の画面へ戻ります,Return to the previous screen.,Retourner à l'écran précédent,Torna alla schermata precedente.,Zurück zum vorherigen Bildschirm.,Vuelve a la pantalla anterior.,Вернуться на предыдущий экран.,Wróć do poprzedniego ekranu.,,,Voltar para tela anterior.,이전 화면으로 돌아갑니다,返回上一個畫面,返回之前的画面,,,,,,,,العودة إلى الشاشة السابقة.,,,,,,,,,,,
4ff5bd36-2337-4479-a901-c9e3568c9ef9,3257840281,Trial_LobbyMenuMsg_Targets_SysMSG,討伐ターゲットを指定します。,Set a target to slay.,Choisir une cible à tuer.,Scegli un obiettivo da uccidere.,Lege ein Ziel zum Erlegen fest.,Elige un objetivo que abatir.,Выбрать цель для убийства.,Ustaw cel do zabicia.,,,Defina um alvo para matar.,토벌 타겟을 지정합니다.,指定討伐目標。,指定讨伐目标。,,,,,,,,حدد هدفًا لقتله.,,,,,,,,,,,
