guid,crc?,entry name,Japanese,English,French,Italian,German,Spanish,Russian,Polish,Dutch,Portuguese,PortugueseBr,Korean,TraditionalChinese,SimplifiedChinese,Finnish,Swedish,Danish,Norwegian,Czech,Hungarian,Slovak,Arabic,Turkish,Bulgarian,Greek,Romanian,Thai,Ukrainian,Vietnamese,Indonesian,Fiction,Hindi,LatinAmericanSpanish
114908dc-e262-4478-995a-ded64420c100,990877133,Trial_CheckPlayCount_RemainCntInfo,"MONSTER HUNTER RISE DEMO版
残りクエスト出発回数に関するご注意

当DEMO版では、あと<COL RED>{0}</COL>クエストお楽しみいただけます。

またインターネットプレイはDEMO版の公開期間終了後は
行えませんので、その際はローカルプレイをお楽しみください。","Monster Hunter Rise - Demo
You can only take on a limited number of quests in this demo.
Number remaining: <COL RED>{0}</COL>

Online Play will be disabled after the trial period for this
demo, at which point you will have to use Local Play.","Monster Hunter Rise - Demo
Vous ne pouvez transporter qu'un nombre limité d'objets
dans cette démo.
Nombre restant : <COL RED>{0}</COL>

Le jeu en ligne sera désactivé après la période d'essai de cette démo,
vous limitant alors au mode multijoueur local.","Monster Hunter Rise - Demo
In questa demo puoi affrontare solo un numero limitato
di missioni.
Missioni rimanenti: <COL RED>{0}</COL>

Il gioco online verrà disabilitato al termine del periodo di
prova della demo, dopodiché dovrai usare il gioco in locale.","Monster Hunter Rise – Demo
In dieser Demoversion kannst du nur eine begrenzte Anzahl
von Quests annehmen.
Verbleibende Anzahl: <COL RED>{0}</COL>

Nach Ablauf des Probezeitraums wird das Online-Spiel
deaktiviert. Du kannst danach nur das Lokale Spiel nutzen.","Monster Hunter Rise - Demo
Puedes aceptar misiones un determinado número de veces
durante esta demo.
Quedan <COL RED>{0}</COL>

El modo online se deshabilitará tras el periodo de prueba
de esta demo. Después podrás seguir usando el juego local.","Monster Hunter Rise - Demo
В этой демоверсии вам доступно лишь ограниченное
количество заданий.
Осталось заданий: <COL RED>{0}</COL>

По истечении пробного периода демоверсии сетевая игра
будет недоступна, останется доступ лишь к локальной игре.","Monster Hunter Rise – Demo
W wersji demonstracyjnej możesz wykonać ograniczoną
liczbę zadań. Pozostała liczba: <COL RED>{0}</COL>.

Funkcja gry online zostanie zablokowana po upłynięciu okresu
próbnego wersji demonstracyjnej. Będziesz wtedy musiał
korzystać z opcji gry lokalnej.",,,"Monster Hunter Rise - Demo
O número de missões nesta demonstração é limitado.
Quantidade restante: <COL RED>{0}</COL>

A Partida Online será desativada após o período de teste
para esta demonstração, depois disso, você terá que usar
a Partida Local.","MONSTER HUNTER RISE DEMO판
남은 퀘스트 출발 횟수에 대한 주의 사항

이 DEMO판으로는 <COL RED>{0}</COL> 퀘스트를 플레이할 수 있습니다.

또한, 온라인 플레이는 DEMO판 공개 기간 종료 후,
이용할 수 없으니 그 후에는 로컬 플레이를 즐겨 주십시오.","MONSTER HUNTER RISE DEMO版
剩餘任務次數提示

在本DEMO版中，您尚可體驗<COL RED>{0}</COL>次任務。

此外，在DEMO版開放期間結束後，將無法進行線上遊玩。
屆時請改以本地遊玩的方式繼續享受多人遊戲的樂趣。","MONSTER HUNTER RISE DEMO版
剩余任务出发次数相关的提醒

本DEMO版还能游玩<COL RED>{0}</COL>次任务。

此外，在DEMO版的公开期限结束后
将无法进行线上游戏，届时还请享受本地游戏。",,,,,,,,,,,,,,,,,,,
433ab29d-d01c-4635-82b0-4bd1664c15bc,3133217214,Trial_CheckPlayCount_NothingCnt,"MONSTER HUNTER RISE DEMO版
残りクエスト出発回数に関するご注意

当DEMO版の残りクエスト出発回数が<COL RED>0</COL>になりました。
当DEMO版をお楽しみいただき、ありがとうございました。","Monster Hunter Rise - Demo
You can only take on a limited number of quests in this demo.

The remaining number has reached <COL RED>0</COL>.
Thank you for playing!","Monster Hunter Rise - Demo
Vous ne pouvez transporter qu'un nombre limité d'objets
dans cette démo.

La limite d'objets <COL RED>0</COL> a été atteinte.
Merci d'avoir joué !","Monster Hunter Rise - Demo
In questa demo puoi affrontare solo
un numero limitato di missioni.

Missioni rimanenti: <COL RED>0</COL>
Grazie per aver giocato!","Monster Hunter Rise – Demo
In dieser Demoversion kannst du nur eine begrenzte Anzahl
von Quests annehmen.
Verbleibende Anzahl: <COL RED>0</COL>
Danke fürs Spielen!","Monster Hunter Rise - Demo
Puedes aceptar misiones un determinado número de veces
durante esta demo.

El número de misiones que puedes aceptar ha llegado a <COL RED>0</COL>.
¡Gracias por jugar!","Monster Hunter Rise - Demo
В этой демоверсии вам доступно лишь ограниченное
количество заданий.

Осталось заданий: <COL RED>0</COL>.
Спасибо за игру!","Monster Hunter Rise – Demo
W wersji demonstracyjnej możesz wykonać ograniczoną
liczbę zadań.

Licznik pozostałych zadań osiągnął <COL RED>0</COL>.
Dziękujemy za grę!",,,"Monster Hunter Rise - Demo
Você só pode cumprir um número limitado de missões
nesta demonstração.

A quantidade restante chegou a <COL RED>0</COL>.
Obrigado por jogar!","MONSTER HUNTER RISE DEMO판
남은 퀘스트 출발 횟수에 대한 주의 사항

이 DEMO판의 남은 퀘스트 출발 횟수가 <COL RED>0</COL>이 되었습니다.
DEMO판을 플레이해 주셔서 감사합니다.","MONSTER HUNTER RISE DEMO版
剩餘任務次數提示

本DEMO版的剩餘任務次數已經為<COL RED>0</COL>。
感謝您體驗本DEMO版遊戲。","MONSTER HUNTER RISE DEMO版
剩余任务出发次数相关的提醒

本DEMO版的剩余任务出发次数已为<COL RED>0</COL>。
非常感谢您游玩本DEMO版。",,,,,,,,,,,,,,,,,,,
